id,body,author,created_utc,score,subreddit,parent_id,is_submitter,distinguished
otdynue,"Nice! Looks good for the most part. Couple of things: random.randint(1, 101)is gonna be inclusive of 101, so there's a bug where the number might be 101, would change that to 100.Second: I would recommend lowering the difficulty input, so the user can type Hard or HARD and it will work. You should also add some input validation. They might type an invalid hard/easy string, or not put an integer for the guess, or put an integer above 100 or below 1.mode = input(""Choose difficulty ('hard' or 'easy'): "").lower().strip()Third: the code is a bit verbose and inelegant in general. This is more art than science, but here's how I'd write it: import random target = random.randint(1, 100) lives = 5 if input(""Difficulty ('hard' or 'easy'): "").lower().strip() == ""hard"" else 10 print(f""Game started with {lives} lives."") while lives > 0: try: guess = int(input(""\nGuess (1-100): "")) except ValueError: print(""Invalid number."") continue if guess == target: print(f"":party_popper: You won! The number was {target}."") break lives -= 1 print(""Too high!"" if guess > target else ""Too low!"") print(f""Lives left: {lives}"" if lives > 0 else f""\n:skull: Game Over! It was {target}."")",Whatever801,2026-06-23 19:38:50,2,learnprogramming,t3_1udbo7d,False,
otat3ih,Game logic's solid but naming's lazy and there's a ton of copy pasta. Flip the life decrement into the guess checks to cut those duplicated blocks.,Even-Lawfulness-7984,2026-06-23 10:35:47,1,learnprogramming,t3_1udbo7d,False,
otapg1v,"Oh hello again, I will review with your advice By the way,What is a go-to project?",Ryuzaki___L,2026-06-23 10:07:59,1,learnprogramming,t1_otaozdu,True,
otahqwi,"ohk but, i thought in the randint the range dont include 101? by the way thx for advice",Ryuzaki___L,2026-06-23 09:04:05,2,learnprogramming,t1_otah8kq,True,
otb96x4,Ohk,Ryuzaki___L,2026-06-23 12:20:31,2,learnprogramming,t1_otb5dhk,True,
otbfpzu,ohki will review the idea,Ryuzaki___L,2026-06-23 12:56:23,1,learnprogramming,t1_otbf7j9,True,
otawcuo,Try https://tldp.org/guides.html,marrsd,2026-06-23 10:59:11,3,learnprogramming,t3_1ud8bkd,False,
ot9w3bn,"Look at FreeCodeCamp, they have all sorts of courses.Other than that, find stuff to do with linux.. set up a media server, mail server, dns server, web server, run home automation, make it your internet router> i'm thinking maybe i'll check out an Arch distro someday if i think i can learn enough about how linux OS's work. There's really nothing special about arch. It has a slightly more complex setup than Mint or whatever, but if you can follow a page of instructions, you can install arch. It's not some sort of level-up.. use whatever distro you want.",grantrules,2026-06-23 06:01:37,2,learnprogramming,t3_1ud8bkd,False,
otbe2ie,[KillerCoda](https://killercoda.com/linux101) free cloud VMs and courses for practice,MedIngeniare,2026-06-23 12:47:40,1,learnprogramming,t3_1ud8bkd,False,
ot8ccyo,_What's the best way to improve_ --> _coding - coding - coding and coding_Irrelevant what! But don't follow 'guides'! Do your own stuff - Even it matters ONLY FOR YOU!,_l33ter_,2026-06-23 00:14:14,0,learnprogramming,t3_1ud0cd6,False,
ot8jvyx,"Yes, I know, but I can't think of what I could do. For example, could there be a guide or exercises to help you improve your programming?",Few-Replacement-6351,2026-06-23 00:55:55,1,learnprogramming,t1_ot8ccyo,True,
otl7oha,">Yes, I know, but I can't think of what I could do. Think harder.Self-sufficiency is the most important trait of a successful programmer.",Dazzling_Music_2411,2026-06-24 19:47:37,1,learnprogramming,t1_ot8jvyx,False,
ot8lfkn,"_but I can't think of what I could do._ --> Look what I've done daily, and auto. itYou want to _improve_ your programming! --> If you follow a guide, you won't improveIf you cant think of what you could do. So tell me for what you even programm?",_l33ter_,2026-06-23 01:04:31,-1,learnprogramming,t1_ot8jvyx,False,
ot4v23z,money,Hungry_Ghostt,2026-06-22 14:34:42,1,learnprogramming,t3_1ucm6cb,False,
ot4v7yy,What are your goals and what is your background?,database_systems,2026-06-22 14:35:27,1,learnprogramming,t3_1ucm6cb,False,
ot56h99,Native with AI is better imo,_janc_,2026-06-22 15:27:06,1,learnprogramming,t3_1ucm6cb,False,
ot4vxoz,"Both pay well, but MERN will get you hired faster right now.",SufficientTrouble213,2026-06-22 14:38:47,1,learnprogramming,t1_ot4v23z,False,
ot5vb58,"I am a CS student, and I am clearly confused with these when I look for the future. MERN seems too saturated. That's why, I wanted to have an opinion of the real people here.",Impressive-Can-7003,2026-06-22 17:19:32,1,learnprogramming,t1_ot4v7yy,True,
ot5vd2d,So should I pursue native?,Impressive-Can-7003,2026-06-22 17:19:45,1,learnprogramming,t1_ot56h99,True,
ot8qrfe,Try all for some work first,_janc_,2026-06-23 01:33:37,1,learnprogramming,t1_ot5vd2d,False,
ot3ew4y,"Funnily enough - this is a question you can ask AI and get a pretty solid answer of what programs/tech stack to use, if you describe your use cases. Don't use AI to do the work, but have it point you in the right direction so you can do the research and implement it yourself.",dandandan2,2026-06-22 09:09:11,3,learnprogramming,t3_1ucfe48,False,
ot4pqu3,Just use Access.,BranchLatter4294,2026-06-22 14:09:55,1,learnprogramming,t3_1ucfe48,False,
ot74i8b,"Try looking into CSV files. You can read them easily with C# and in Excel you can export to CSV. From there, the coding part is mostly searching in a list.",mondaysleeper,2026-06-22 20:33:41,1,learnprogramming,t3_1ucfe48,False,
otojnfh,All modern OSes come with a contact management / address book app. Use that. Import your existing data from excel.,DrHydeous,2026-06-25 07:10:03,1,learnprogramming,t3_1ucfe48,False,
ot67rfc,"i am not fond of ai, and i dont like the use of ai in code as i dont believe its teaching anything by coding for the user but yeah i really should start researching how to do that on my own though thanks for pointing this out though i hope i will find something quickly",Grey_jo3,2026-06-22 18:11:31,1,learnprogramming,t1_ot3ew4y,True,
ot052nf,If your placement cell or professors expect C++ then maybe learn enough C++ to stay comfortable. Otherwise I'd rather become really good in one language than mediocre in three.,Beneficial_Winter927,2026-06-21 20:18:20,4,learnprogramming,t3_1uc003l,False,
ot04tz3,Because JS js garbage collected there are some ideas that don't really sink in unless you're using a manual memory management language.But do whatever is good for your goals.,DrShocker,2026-06-21 20:17:09,0,learnprogramming,t3_1uc003l,False,
ot05zyh,"good in one language than mediocre in three.M thinking the same, guess I should js start learning js without caring about clg for now",Icy_Criticism7822,2026-06-21 20:22:55,1,learnprogramming,t1_ot052nf,True,
ot0i487,"I used neetcode to help me with DSA I would definitely recommend. I work in C# so I did about 350 leetcode problems in that language but I agree, stick to one language and typically the patterns are similar in others and making the change from language to language is more or less intuitive, they each just have their own nuances",jargonpop,2026-06-21 21:22:55,1,learnprogramming,t1_ot052nf,False,
ot050x4,What would you've done in my place?,Icy_Criticism7822,2026-06-21 20:18:07,2,learnprogramming,t1_ot04tz3,True,
ot0ci8l,"Don't knock being mediocre in three languages. There's not a lot of careers where you never have to switch, and learning to be flexible early on is nothing to sneeze at.JS has so many DS built-in - and not implemented in JS, but in the underlying language that the JS interpreter is built in. So writing DS in it is not particularly practical, even before you get to the automatic garbage collection. Whereas in C++ you're implementing things the same way it's done in the standard library..",zeekar,2026-06-21 20:54:48,1,learnprogramming,t1_ot05zyh,False,
ot05iaz,"Well, I have a different background than you so it won't help you.I learned Java in high school, learned Matlab and a bit of cpp for mechanical engineeringstarted a CS minor which was in Java againEventually took a data structures course in C++but I'm a very math and detail inclined person, so I can't generalize it to everyone.",DrShocker,2026-06-21 20:20:30,1,learnprogramming,t1_ot050x4,False,
ot05r4l,"Alright, thanks for you time.",Icy_Criticism7822,2026-06-21 20:21:43,1,learnprogramming,t1_ot05iaz,True,
ossejbc,"Dude (madame?), my first two programming languages went to a garbage been.You need to learn a programming language. It will be easier to learn another one. And if you want to enter web programming, you will need to handle a couple of them. E.g. HTML/JS/CSS/PHP/SQL.",VibrantGypsyDildo,2026-06-20 16:30:02,1,learnprogramming,t3_1uay61s,False,
osvqmp4,"Don't worry about it, just eenie meanie minie moe a popular framework. The underlying concepts are what's important. Once you learn one you can switch to another no problemo",Whatever801,2026-06-21 03:39:40,1,learnprogramming,t3_1uay61s,False,
oswqjey,"Sometimes, you will find that the languages and toolsets used in a particular area are taken from a small pool of the available options. There are lots of reasons for that, one factor is availability of skilled resources who know a particular technology.Let's say you learned electronics and your capstone project was an electric room heater. Well, if you lived in Iceland, that is probably a good choice. But if you lived in Singapore, that might not have been the best choice as it won't be in such high demand - even if it were the best room heater ever.My point is that there is nothing wrong with python but maybe it isn't the first choice in your area because the other technologies you mentioned are the best supported/represented - in your area.",gm310509,2026-06-21 08:27:31,1,learnprogramming,t3_1uay61s,False,
osry66d,I agree with this.,AromaticBuilder7030,2026-06-20 15:08:45,1,learnprogramming,t1_osrtper,False,
ossj7o2,"Haha, okay, I'm looking forward to the day I get to throw my first.",sssss23232323,2026-06-20 16:53:09,1,learnprogramming,t1_ossejbc,True,
osrcu5y,https://github.com/features/codespaces,Quillox,2026-06-20 13:14:38,2,learnprogramming,t3_1uaw3s6,False,
osqpksz,"the spiral you're describing is so common when you actually care about something, the stakes feel real so every gap feels catastrophic what helped me was treating concepts like a web not a checklist. you don't need to fully own the Repository Pattern before moving forward, you'll hit it again from a different angle and it'll click deeper each time. trust the repetition. also no interviewer expects you to recite patterns cold, they want to see how you think through problems so chasing ""perfect recall"" is kind of the wrong target anyway",Parking-Elk-231,2026-06-20 10:35:26,3,learnprogramming,t3_1uat6yx,False,
osv415u,"You will not use most of the theory that you are learning in actual real world development. Most companies and firms that develop software have their own methods and standards that don’t utilize the more academic subjects you are trying to learn. You will often have superiors, and colleagues, who know none of these things and have never even heard of them, who will be able to write production worthy code using their own methods, and you will also likewise see mediocre developers and co-workers who somehow get away with not being up to standards, whose work you have to fix or update.",v_e_x,2026-06-21 01:11:13,2,learnprogramming,t3_1uat6yx,False,
osqr5g6,Thank you very much,AccomplishedJudge460,2026-06-20 10:48:10,3,learnprogramming,t1_osqpksz,True,
otpv1b9,"icmp needs a raw socket (SOCK_RAW, IPPROTO_ICMP), which means root or CAP_NET_RAW, and you send with sendto() passing the target's sockaddr_in, not send() since there's no connected peer. if sendto returns -1 with 'operation not permitted' that's the root/cap thing. and double-check your icmp checksum, if it's wrong the packet just gets dropped silently and it looks like the send failed.",donk8r,2026-06-25 12:51:16,1,learnprogramming,t3_1uf8oa4,False,
otq9clo,"Ok ok, did i set it up correctly then with the SOCK_RAW thing?",lolluzzo,2026-06-25 13:59:28,1,learnprogramming,t1_otpv1b9,True,
otqhzg0,"can't see your code but the two that matter: socket(AF_INET, SOCK_RAW, IPPROTO_ICMP), and running it as root (or setcap cap_net_raw on the binary). if socket() returns -1, print errno right there, it'll tell you instantly if it's a perms thing. paste the socket line if it's still not sending.",donk8r,2026-06-25 14:37:44,1,learnprogramming,t1_otq9clo,False,
otqqgwv,And how do i handle the messaging of an ICMP packet? With sendto i mean,lolluzzo,2026-06-25 15:14:40,1,learnprogramming,t1_otqhzg0,True,
otquj6i,"sendto(fd, packet, packet_len, 0, (struct sockaddr*)&dest, sizeof(dest)) is the call. dest is a struct sockaddr_in with sin_family = AF_INET and sin_addr set to the target ip, no port (icmp ignores it). you don't connect() on a raw socket, you just pass dest on every sendto. it returns bytes sent or -1 (check errno), and make sure the icmp checksum is filled in over the whole packet first or it gets dropped silently.",donk8r,2026-06-25 15:32:01,2,learnprogramming,t1_otqqgwv,False,
otdytwp,"If you can get a job, get a job.It makes sense to study full time if it'll get you a degree from an accredited university, but sounds like you actually have that.If you've been AIing most of the degree you'll probably not have any meaningful programming skills, so getting experience working with organizations and making connections is going to be more important than continuing to (not) develop your programming skills anyways.",PoMoAnachro,2026-06-23 19:39:33,2,learnprogramming,t3_1udqog6,False,
otejl1d,">I AI’d most of the degreeSave all of the resources, recorded lectures, etc. while you still have an access to your study system. Your current degree is pretty void. A wasted time, I would say. Personally, I would fail your degree if I would be your Master thesis supervisor. But what's done, is done. Now, you can start learning all of the stuff again, from zero, when you have the materials that I suggested to back up.Leetcode is irrelevant. That you can pass beginner or medium level leetcode exercises means only that much that when the company uses a leetcode exercise in its interview, you are familiar with it. But leetcode is just one form of many ways how a company can test your knowledge and skills. And, in the real life, at work, you won't be using your leetcode. Can you build actual projects that solve some real life problem, with your leetcode? No.As you used AI in most of your studies and also in your project then I will be questioning the quality of said project, the quality of the business/technical analysis you are doing as an analyst, the quality of the management of a product, etc. I hope the users of your project are not using any sensitive information nor doing any monetary transactions. Because most likely your project is void of good coding practices, void of cybersecurity practices.Let's say, you are not permitted to use the AI. For whichever reasons: geopolitics (Deepseek being from China, ChatGPT being from the US, etc.), client prohibiting it to protect his product from competitors, highly classified projects, etc. Can you function without an AI, then?As you said that you can study full time then if I would be you, I would get myself up to standards. Because the degree you are getting right now (IF getting), it is void. So, now it is time to fill that void with actual knowledge and skills that will stick to your brain not originate from your LLM tools.Because look at it so: you'll get hired as a software developer. You'll suck because you do not have the knowledge and skills a software developer should have. You get hired as a business analyst or as an IT analyst. Your analysis will be shallow. You'll miss out important details purely because such knowledge does not exist in your head. You will not consider even checking one or another thing. And, then you will pass such low quality analysis to developers. They will develop a thing that the client will be unhappy with.You won't have time to learn these small bits while this knowledge and skills are already expected from you from day one. You'll be given a real task you have to complete. Can you right now guarantee the quality and security of the end result for your task? What if your client suffers a damage because of the bugs you AI'd into the code? Will you compensate the damage? What if the end users have their data hacked and leaked out?If money is an issue then pick an unrelated job (not related to your degree studies) and work part time while filling the void that remains from your degree studies. Turn to your specialty-related jobs only when you have the knowledge and skills that you should acquire from your degree studies WITHOUT the use of AI.",mandzeete,2026-06-23 21:10:35,2,learnprogramming,t3_1udqog6,False,
otdwc66,Get a job and learning in your own time.,NumberInfinite2068,2026-06-23 19:28:35,1,learnprogramming,t3_1udqog6,False,
otmvpqw,"I have no idea how you study or how disciplined you are in self-study, so that question cannot be answered by us.",kschang,2026-06-25 00:37:37,1,learnprogramming,t3_1udqog6,False,
oteim1x,Starting with how to write complete sentences would probably help you.,icemage_999,2026-06-23 21:06:21,9,learnprogramming,t3_1udn6i3,False,
oteh132,"Don't wait to get served and spoon fed. Do your own, individual research, become proactive.There are more than enough posts discussing the same topic. There are our **FAQ** with plenty learning resources.You will need to invest considerably more effort than just venting here.",desrtfx,2026-06-23 20:59:27,3,learnprogramming,t3_1udn6i3,False,
otd0pbq,"It's totally normal to feel this way! Everyone struggles with JS at the beginning. You don't need to memorize code—nobody does. Just focus on building small, silly projects, even if they don't look perfect. The 'creative block' goes away once you build more things. Keep going!",Massive_Camp8976,2026-06-23 17:14:29,2,learnprogramming,t3_1udn6i3,False,
oteg0hb,"**This is a low effort question.** If you need extra help you should have asked your instructors. You didn't search this subreddit nor did you take the initiative to search google for resources. This is childish post. You feeling stupid or not creative has nothing do with this subreddit. You need talk to a person, you have issues.",rustyseapants,2026-06-23 20:55:04,2,learnprogramming,t3_1udn6i3,False,
otd2w5i,"Build a renderer from scratch without help (except mdn), wrap your head around it, no need for it to be perfect, then optimise, build on it, till you can build websites with it… will teach you a lot…",ExtraTNT,2026-06-23 17:23:43,1,learnprogramming,t3_1udn6i3,False,
otd2zq9,"I learned front end by looking at popular websites, Netflix, YouTube, Twitch, and trying to recreate the UI as precisely as I could. When you get stuck, google your way out of it. You’ll eventually not need to search things up as much.",Zendental,2026-06-23 17:24:08,1,learnprogramming,t3_1udn6i3,False,
otdihov,"Forgetting code constantly at the start is completely normal, not a sign you're ""stupid"". JS syntax sticks the more you type it yourself instead of copying.Slow down, build tiny things instead of trying to match the pace of the class; understanding one small thing fully beats half-remembering ten things.",bywaldemar,2026-06-23 18:29:06,1,learnprogramming,t3_1udn6i3,False,
otdjkbf,"What kind of assignments are you doing? ""Javascript"" could mean anything from simple in-browser scripts to something like node.js where all the server-side code is also written in JS.",setq-default,2026-06-23 18:33:43,1,learnprogramming,t3_1udn6i3,False,
otd0l42,Learn,Lumethys,2026-06-23 17:13:59,1,learnprogramming,t3_1udn6i3,False,
oteyxal,"""You have issues"" is such a demeaning assumption for someone asking their peers for help in a subreddit dedicated to learning programming. Sometimes you can't get the push or the words of motivation you need just from googling.",Hazeeverest,2026-06-23 22:18:48,1,learnprogramming,t1_oteg0hb,False,
ot9xtnb,"from what i heard the process is bit slow but they do get back to you eventually, just make sure all your documents are uploaded properly before submitting or it creates headache later",SableBicycle,2026-06-23 06:15:23,1,learnprogramming,t3_1ud8wn0,False,
othb02r,"applied after my boards, process was easy and i managed to get some scholarship benefits too",Anxious-Buyer1127,2026-06-24 06:49:08,1,learnprogramming,t3_1ud8wn0,False,
otpp2nd,"submitted my de tails, finished the doc thing and got my dashboard within a few days",AcademicPack7503,2026-06-25 12:19:17,1,learnprogramming,t3_1ud8wn0,False,
otvzyu6,"compared to few other colleges i looked, admsn process here is more organised and less hectic :persevering_face: btw anyone from BCA?",Public_Seat_3660,2026-06-26 07:45:02,1,learnprogramming,t3_1ud8wn0,False,
otwngsp,"my admission experience with the college was good, applied on a sunday night, uploaded my documents and got updates pretty regularly",Long-Wamp,2026-06-26 10:51:06,1,learnprogramming,t3_1ud8wn0,False,
ot9j3dm,"C style arrays are core language feature. You can't learn pointers without learning arrays, and vice versa. You could say they are not even arrays, which is kinda critical to understand about C and C++.",Cultural_Gur_7441,2026-06-23 04:25:19,3,learnprogramming,t3_1ud6piu,False,
ot9xtt2,"Great now you know that std::array is a thin wrapper around a primitive array, time to explore why that wrapper takes 1337 lines of code",Kadabrium,2026-06-23 06:15:25,3,learnprogramming,t3_1ud6piu,False,
otencgn,"I've been programming C++ for... ~37 years now.> Vector obviously are the bestDa' fuck they are... Vectors have growth semantics. Do you need growth semantics? Probably not all the time - they're not inherently desirable, only sometimes necessary. Do you like your data always being heap allocated? You wanna pay for that indirection, that cache prefetch, that branch prediction? Does your hardware support prefetch?In contrast an array in C++ is a distinct type recognized by the type system - they ARE NOT pointers to their first element, and offer they you properties and guarantees well above and beyond the what the machine code the compiler generates offers you. Arrays are not vectors because they don't have growth semantics - and that fixed size is an easy way to get optimizations like vectorization (SIMD instructions). C-style arrays can be opaque.But you have to understand what a programming language is to appreciate the nuance and reap the benefits. Dynamic vectors fill a niche. Nothing more.> WHAT is then need of c style arrays here, should i learn it or just skim it. [...] Yeah ik std::arrays are structs who are just T arr[N] but how will this help me in dsa,etc.I don't know how to satisfy you. From a PURE DSA standpoint, these are literally the same thing. From a C++ standpoint, they are not, and you're missing the forest for the trees, the big picture in terms of the C++ programming langauge. But then again, I'd say if you're only interested in DSA, then WTF do you care about C++ so specifically? DSA applies to all of computer programming, and is language agnostic.You're asking a C++ specific question but want a DSA generic answer. You see the problem? If you want to talk C++, well then alright. If you only care about DSA, there is no difference between fixed and dynamic arrays.",mredding,2026-06-23 21:27:21,3,learnprogramming,t3_1ud6piu,False,
ot9uxye,At worst it'll take an afternoon and at best it'll take less time than reading comments on Reddit. Stop trying to take too many shortcuts at once.,biskitpagla,2026-06-23 05:52:35,2,learnprogramming,t3_1ud6piu,False,
otbxfwz,Bro I'm just a first year student just trying to get a job :face_holding_back_tears::victory_hand:,Primary_Smoke4643,2026-06-23 14:22:49,1,learnprogramming,t1_ot9xtt2,True,
otobwpk,What do you mean by c-style arrays can be opaque? std::array is implemented via a c-style array.,FloweyTheFlower420,2026-06-25 06:07:46,2,learnprogramming,t1_otencgn,False,
oto7u3r,Except for the tone a perfect reply! These nuances you speak about to me are both the strength and the curse of C++.But you are also right to ask OP if his focus is on DSA or C++.,Ormek_II,2026-06-25 05:36:09,1,learnprogramming,t1_otencgn,False,
oto70yr,So you need to be curious. Get a job as a waiter.,Ormek_II,2026-06-25 05:29:55,0,learnprogramming,t1_otbxfwz,False,
otpti12,"I mean `type[]` is itself a distinct and incomplete type according to the C++ type system. There is no `std::array` equivalent. You see use of it in some places like `std::make_unique(42);`. ""Opaque"" isn't the right word, that means something else.",mredding,2026-06-25 12:43:15,2,learnprogramming,t1_otobwpk,False,
otutd9d,"Like std::array is derived from c style arrays but with some changes to benefit the code speed and also has some changes to fit cpp. Whereas c style arrays were the starting point for arrays and has many flaws in its design. For a person whose main goal is to perform good in leetcode while coding in cpp , is stdd::array and vectors enough.",Primary_Smoke4643,2026-06-26 02:50:01,1,learnprogramming,t1_otobwpk,True,
ot3ijaj,"The O'Reilly edition is the one you want, just make sure whatever seller you're buying from is listing that specific publisher or you'll end up with one of those garbage print-on-demand knockoffs. In Delhi, Connaught Place has a few solid tech bookstores worth checking in person so you can flip through it before buying",FoldCritical8376,2026-06-22 09:40:19,2,learnprogramming,t3_1ucfx2k,False,
