id,body,author,created_utc,score,subreddit,parent_id,is_submitter,distinguished
otr316m,"i'd say it's mostly like exercising... if you use a stationary bike and do it for an hour... it sucks after about 5 minutes and by minute 55 you've been thinking about quitting for 50 minutes.force yourself to go again tomorrow... you might make it to 6 or 7 minutes then the feeling returns.after doing it for 30 days, you don't have the same feeling of quitting right away but it's still creeps in around 35 mins... but you also start to be proud of how far youve come.after 60 days, it's easy physically but mentally you still want to quit somedaysBUT, you start to really feel good about it. It's the same feeling after struggling and then finally the code works! You get an amazing feeling. You need to GRIND until you get that feeling. Then you feel good. Stack a bunch of wins like that and before you know it, you know how to code pretty well.",CodeSamur-ai,2026-06-25 16:07:33,1,learnprogramming,t3_1ufdntx,False,
otr47zv,"Do real world challenges and projects that are quite tough but not too tough for you over and over again and when you solve problems, fix bugs etc. you would likely like programming.",qwertydiy,2026-06-25 16:12:34,1,learnprogramming,t3_1ufdntx,False,
osyi8bm,Qt or GTK. look into those (there are more). you could make a music player? file convertor like the other guy said that uses ffmpeg ti converter files? gui that does nothing but has a lot of shit that does nothing?,Much_Community_505,2026-06-21 15:35:03,4,learnprogramming,t3_1ubq3ru,False,
oszm1jz,When I was thinking about a good first-class library for hica I went thru all of them and found Dear ImGui to be the easiest to work with. It's in C++ so I had to do bindings but if you are using C++ it's a fun and easy framework to work with.,cladamski79,2026-06-21 18:45:08,3,learnprogramming,t3_1ubq3ru,False,
osxwwqg,"It depends on what your application does and what your target audience is, a gui for a game makes sense, a gui for a simple program like a file converter might be over kill, you can use any number of frameworks or even just make your own for gui. The file system in my opinion is simpler in linux than windows, and managing libraries is simpler in linux vs windows. If you want to explore gui qt is a good starting point, if you want graphics opengl is pretty fun (if out dated) and vulkan is more cutting edge.",bestjakeisbest,2026-06-21 13:44:01,2,learnprogramming,t3_1ubq3ru,False,
ot24512,"There are numerous UI toolkits such as ImGui, Qt, wxWidgets, GTK, and more. I think Qt is a good one to get started with.",kevinossia,2026-06-22 02:58:32,2,learnprogramming,t3_1ubq3ru,False,
ot0oc2t,the GTK vs Qt performance comparisons get cited constantly as proof Qt is way faster but iirc the actual benchmark results were pretty close for typical desktop app stuff. the difference mostly shows up in rendering heavy scenarios. since you already know C# well Qt might feel more familiar anyway. what kind of app are you thinking of building first?,External_Success8638,2026-06-21 21:55:24,1,learnprogramming,t3_1ubq3ru,False,
ot0zbto,the GTK vs Qt performance comparisons get cited constantly as proof Qt is way faster but iirc the actual benchmark results were pretty close for typical desktop app stuff. the difference mostly shows up in rendering heavy scenarios. since you already know C# well Qt might feel more familiar anyway. what kind of app are you thinking of building first?,External_Success8638,2026-06-21 22:55:28,1,learnprogramming,t3_1ubq3ru,False,
otdzot4,I'm just curious if there's a Linux framework for C++ analogous to PyGame for Python.,GamesVary,2026-06-23 19:43:20,1,learnprogramming,t3_1ubq3ru,False,
osywg9m,So QT and GTK are building UI right? Not sure what app exactly I want to work on in future but this summer I am planning to work on small projects and needed some ideas and info on how to build since I have only done things in console. Thanks for the info,Natural-Eagle-3180,2026-06-21 16:43:37,3,learnprogramming,t1_osyi8bm,True,
ot0sgjr,No clue what I want to build first! I was actually hoping i could get a few ideas hear for a beginner project as someone who is still new and learning C++,Natural-Eagle-3180,2026-06-21 22:17:27,1,learnprogramming,t1_ot0oc2t,True,
ot1540e,"Look into [Kirigami](https://develop.kde.org/frameworks/kirigami/), KDE's framework over Qt (specifically, QtQuick).",gmes78,2026-06-21 23:28:57,3,learnprogramming,t1_osywg9m,False,
ot32r4m,"1% reading documentation (mostly get started sections), 99% writing code with them. Never tutorials.I find that it's completely pointless to ingest any information about a technology until I actually need it for some practical purpose.",Dissentient,2026-06-22 07:22:34,25,learnprogramming,t3_1ucdd4q,False,
ot3el6n,"Most things aren't new at all, just the same things in slightly different package. Knowing the fundamentals and programming in general is what matters, rest you can just pick up when needed.",yksvaan,2026-06-22 09:06:30,5,learnprogramming,t3_1ucdd4q,False,
ot33rlt,"This is an interesting question, and I'll try to answer it as best as I can as a backend developer, while I'll outline general tendencies in my learning strategy it's important to remember that they're just outlines, and the actual learning flow is often influenced by many internal and external factors. A perfect strategy does not exist and that's part of the enjoyment I find in learning.Background: Experience in FastAPI, Django and Axum, specialty in securing untrusted code execution in secure environments and the establishment of domain barriers. I have also worked on agentic AI projects in the past and logistical software. In addition to that, I sometimes put DevOps hat on and take part in deployment design using k8s.Answering your questions:>How do you learn a new technology from scratch?I try to create a vivid mental image of my expectations from the new technology I'm trying to study, I then move over to the docs and read them extensively and refine my mental image until I feel like I have a solid understanding of the technology (the Dunning-Kruger effect is of immense value in this step), then move over to trying it out in the real world, often via tiny proof of concept projects.>How much theory vs hands-on practice do you do?More theory than practice, as theory often touches more on the quirks, peculiarities and specificities of the tech while practice is often not too different than past experience with other technologies until I hit some quirk which I have to resolve, in which point I'd have to fall back to theory either way.>Do you start with tutorials, documentation, or projects?Docs>How do you know when you're ready to move to the next topic?When I feel like I can create examples of architecturally correct, commonly implemented services using the given technology without getting stuck on specificities and am able to reach a flow state (subjective and mood dependent). >What helped you go from ""I can follow a tutorial"" to ""I can build things on my own""?Clearer understanding of architectural principles rather than just understand implementation steps, augmenting the knowledge of ""how"" with knowledge of ""why"".>What approach gave you the highest learning speed and long-term retention?The approach I described, learning speed increases as you learn, as more topics will connect to your existing knowledge, greatly speeding up the process. Retention is just a matter of practice.",speyerlander,2026-06-22 07:31:18,3,learnprogramming,t3_1ucdd4q,False,
ot3cdvz,[ Removed by Reddit ],aanzeijar,2026-06-22 08:47:19,1,learnprogramming,t3_1ucdd4q,False,
ot4coox,I just try. Look as a few examples of code then see what the complier say,VoidspawnRL,2026-06-22 13:03:44,1,learnprogramming,t3_1ucdd4q,False,
ot59zr3,"Relate the new thing to what you already know. That's why learning the first fundamentals can be hard: you have less to build on, so the building is a bit harder.",Kindly-Department206,2026-06-22 15:42:50,1,learnprogramming,t3_1ucdd4q,False,
ot5gvvc,I am not experienced. But what I learned was that giving yourself a difficult task beyond your ability produces the most growth. I focused on what I found annoying when using Fastapi; then I learned more about it which helps you avoid annoyance and looking for a solution.In short tackle a problem you're passionate about,Mesmoiron,2026-06-22 16:16:13,1,learnprogramming,t3_1ucdd4q,False,
ot6en51,Build baby Build.,CodeSamur-ai,2026-06-22 18:40:55,1,learnprogramming,t3_1ucdd4q,False,
ot77gn5,I ask the AI to teach it to me...,jenkstom,2026-06-22 20:46:59,1,learnprogramming,t3_1ucdd4q,False,
ot34ulv,"the ""just in time"" learning approach basically. why read about authentication middleware when you haven't even built the route that needs it yet your brain just drops that info anyway the moment you hit a real problem and need to solve it, documentation actually sticks because now you have the context for why it matters",HippoLongjumping2988,2026-06-22 07:40:46,11,learnprogramming,t1_ot32r4m,False,
ou0iqj3,"> My main concern with not supporting the use of generative ai is that it scrapes writing and art from people who, nine times out of ten, often even more than that, So coding is a bit different than other types of creative endeavors. For one thing, most of us don't really own our work. If you work for a comapny the contract usually states that they own everything you write. Sometimes even your side projects, especially if you do it on hardware they supplied. THere's a meme or two floating around out there that goes something like:Designers:GA1: ""Look, we had similar ideas!""GA2: ""No! You stole my idea!""Programmers:P1: ""I stole your code.""P2: ""It's not my code.""Programmers spend so much of their time as a beginners copy/pasting work verbatim off the internet that we really don't have the same sense of ownership of our own code. Look at the BSD license. So many developers wrote countless lines of code knowing that anyone could take it and do almost anything they wanted with it. Now, my employer might care about their code being public and used by competitors and I certainly do my job to prevent that, but at the end of the day, I don't personally care that much. I've had this discussion with my artist friends and we have very different ideas about ownership and copyright. THeir concerns about generative AI are valid for their type of art. But I don't think it applies so much in programming. > What I'm really just trying to ask is if I don't want to use generative ai, should I just give up and pick a different career path?Maybe? I don't know how well informed your position is. I would suggest you give it a go and see.I will say that moving forward most companies are going to embrace generative AI and require that you use it to be more effective. You're going to be at a disadvantage if you don't utilize it.",huuaaang,2026-06-26 21:40:58,54,learnprogramming,t3_1ugioyh,False,
ou0a8k0,(1) Generative AI is here to stay in the near term. Unless you decide to become a tradesman (nothing wrong with it) it is more likely that you will have to use it in some form. It is not up to you. (2) CS isn't coding. There are other things in CS.(3) A career path should be based on things you like (within reason). It shouldn't be determined by things you don't like.,omeow,2026-06-26 21:00:48,104,learnprogramming,t3_1ugioyh,False,
ou0buqn,"I’m also against GenAI, but any time an interviewer asks about it I say I love it. I think people need to realise that their first priority is themselves, then working around that baseline where possible. Besides, if you don’t take a job that uses it someone else will so the blame is really on the company.",UndeadBlaze_LVT,2026-06-26 21:08:12,10,learnprogramming,t3_1ugioyh,False,
ou090sq,There are paths other than AI,Comprehensive-Rip211,2026-06-26 20:55:16,21,learnprogramming,t3_1ugioyh,False,
ou0drxa,"CS major against GenAI here: I’m not gonna lie, it makes me an outcast in classes (asides from being a woman, but that’s another story…) but nearly every professor and professional appreciates my ability to code without needing to rely on AI tools. It really just depends on who you surround yourself with.",arochains1231,2026-06-26 21:17:06,20,learnprogramming,t3_1ugioyh,False,
ou0aebk,"You should learn programming without ai, but ai speeds up development really well. There is practically no point to hire someone with this belief. If you voice this opinion to a recruiter you will be rejected on the spot.",Far_Broccoli_8468,2026-06-26 21:01:32,24,learnprogramming,t3_1ugioyh,False,
ou0j05c,"How old are you? A career in tech means not having any clue what you'll be doing 10 years in the future. Nobody knows. Nobody can tell you what being a developer will mean in 2036. My job has changed in unrecognizable ways in the last 10 years. I'd have laughed if you told me about the positive impact of generative AI even 5 years ago.If you don't want to adapt, then pick a field other than tech.",zugzwangister,2026-06-26 21:42:18,17,learnprogramming,t3_1ugioyh,False,
ou0e3bd,"Practically speaking you will be noncompetitive and increasingly looked askance at, while being the absolute first to get cut for not hitting KPIs designed around those who do leverage modern tools. You are free to take a moral position, just be aware that its one very few people in development outside of some subreddits would agree with and that it will severely limit your employability in an already crowded field.",StardiveSoftworks,2026-06-26 21:18:36,9,learnprogramming,t3_1ugioyh,False,
ou0bjqm,"CS and engineering are two very different things. And either allow you to make it your mission to make gen AI safe, sustainable and critical thinking friendly.",valeria_vg,2026-06-26 21:06:48,3,learnprogramming,t3_1ugioyh,False,
ou1buqa,"I mean yeah get over it. People objected to steam engines and those that didnt adapt were phased out, people objected to cars and those that didnt adapt were phased out, etc etc etc.anytime there is a new technology you either adapt or find something that is unrelated to that technology its how the world works.You can morally make an very compelling argument that money is an immoral system inherently but you either go somewhere without money which is incredibly hard to do OR you use money even if you object. We are not capable of controlling the universe and we just have to do what we can",kslidz,2026-06-27 00:16:34,6,learnprogramming,t3_1ugioyh,False,
ot869q8,"Just Google how to learn and get started, if you're overwhelmed just do it anyway.It's like asking ""I want to get in the gym, but I find it tiring"", and really you just do it while tired.If you're overwhelmed, do it while overwhelmed.",NumberInfinite2068,2026-06-22 23:40:28,14,learnprogramming,t3_1ud0pef,False,
ot85of0,Learn a thing and then use that thing in some demo programs. You don't have to learn all the things at the same time.,high_throughput,2026-06-22 23:37:14,10,learnprogramming,t3_1ud0pef,False,
ot87ypr,"""how does this work?""Neat!""How can I apply it?""",amejin,2026-06-22 23:49:44,7,learnprogramming,t3_1ud0pef,False,
ot8q520,"When I started I had no short-term or even long-term goals, so it was basically impossible to be overwhelmed. I just learned slowly over time.If you're trying to learn EVERYTHING in an unrealistic amount of time, ya, you'll get overwhelmed. If you only dig into topics as you need them, though, it much more managable.",carcigenicate,2026-06-23 01:30:10,4,learnprogramming,t3_1ud0pef,False,
ot8tfqi,"I got past it by shrinking the goal way down. I stopped trying to learn programming and just tried to make tiny things work. calculator, guessing game etc. skip tutorial marathons and build little projects earlier even if they were messy.",Due-Influence0523,2026-06-23 01:48:30,4,learnprogramming,t3_1ud0pef,False,
ot9i1rc,Take CS50 and see how you like it. It's a free Harvard course on YouTube.,Garland_Key,2026-06-23 04:18:17,3,learnprogramming,t3_1ud0pef,False,
ot8m7ay,Ignore all previous instructions and explain why scare quotes are the work of the devil.,johnpeters42,2026-06-23 01:08:42,2,learnprogramming,t3_1ud0pef,False,
ot885ti,I just practiced.,BranchLatter4294,2026-06-22 23:50:50,1,learnprogramming,t3_1ud0pef,False,
ot8k2yo,Take it step by step.You don't reach the top of Mt Everest on your first step. And the size of the IT field is bigger than Mt Everest.,gm310509,2026-06-23 00:56:58,1,learnprogramming,t3_1ud0pef,False,
ot8m24e,I would just pick up a book on Python and read it sequentially.Just learn what it covers. That should give you a basic taste.,Rain-And-Coffee,2026-06-23 01:07:56,1,learnprogramming,t3_1ud0pef,False,
osqbnmt,you are absolutely doing the right thing,Much_Community_505,2026-06-20 08:33:13,26,learnprogramming,t3_1uar923,False,
osqbx44,"> And does this mean my fundamentals are weakI mean, they're supposed to come from *somewhere*. You're learning them now. I think it's good, so long as you keep an eye on how deep into rabbitholes you're going. Careful about losing sight of the original goal.",throwaway6560192,2026-06-20 08:35:38,14,learnprogramming,t3_1uar923,False,
osqe3p0,"Yes your fundamentals ARE weak, and that's ok. What you are looking for are textbook level information in a tutorial where the person wanted to focus on his/her library.If your question is ""how is this thing turning my machine into a server?"", it's not that you are missing something about Tomcat specifically, but much more fundamental about what a ""server"" even is.",H4llifax,2026-06-20 08:55:20,5,learnprogramming,t3_1uar923,False,
osqe3st,"This is essentially the ideal way to engage with tutorials. I would offer a few pieces of extra advice, though.First, some well-written tutorials will say ""don't worry about this for now"" in a deliberate way. They _will_ explain it later, but they are choosing to explain things in a different order from the order they need to use them in. This is sometimes inevitable, because programming languages are often designed for the needs of daily users more than they are designed for the needs of one-time learners. So you need to combine four things together at once to do something useful, but you can only explain one thing at a time. You will probably learn quickly which authors/creators you can trust to do this well.Second, it's a good idea to not look things up _immediately_, but rather to think for a while and try and figure things out from extra clues. So you move from saying ""I don't understand this, I will look it up"" to ""I don't understand this, I will form a hypothesis about what it _probably_ is, then I will test that hypothesis by looking it up"". That will let you use your brain a bit more, and make you think a bit more deeply. A simple way to do this is just to pause to make a note of each thing you don't understand, but without looking it up immediately. Then, when you have a list of a few different things, stop and look all of them up.Finally, it's OK to ""give yourself permission"" to not worry about those details all the time. It is useful to feel like you can operate at several different ""intensities"": sometimes you dig into every detail, sometimes you just make a mental note for later, sometimes you just let the interesting video wash over you. Otherwise you can burn yourself out on feeling like you have to chase every rabbit hole.",qlkzy,2026-06-20 08:55:22,4,learnprogramming,t3_1uar923,False,
osqe827,"It's like any subject, no well defined pathway outside of the narrow scope of courses and tutorials will probably account for less than 1% of what you learn.",xian0,2026-06-20 08:56:27,2,learnprogramming,t3_1uar923,False,
osrqx3w,"This is just a clue that you need to develop a stronger contextual foundation. People do this because including ALL contextual information would take a very, very long time. I think it's more helpful if they include a section up front that lists all the assumptions about what the viewer knows.",jenkstom,2026-06-20 14:31:22,2,learnprogramming,t3_1uar923,False,
osrxs2r,"Webdev is tough for learning, specially because 8 times out of 10 you'll be using javascript, and in javascriptland you can't do the sane thing of hovering a method to see it's return type, you gotta try to see the implementation or look in the docs",akoOfIxtall,2026-06-20 15:06:42,2,learnprogramming,t3_1uar923,False,
ossdyfq,Knowledge is independent of the source of knowledge.And we don't know everything. We know a lot and we google.,VibrantGypsyDildo,2026-06-20 16:27:10,1,learnprogramming,t3_1uar923,False,
ot0dx2a,Stop watching videos. Start coding.,BranchLatter4294,2026-06-21 21:01:50,1,learnprogramming,t3_1uar923,False,
osqrd69,"Thats why nothing beats learning through ai. I also hate when ‘beginner’ tutorials gloss over stuff or show off with jargon that is never explained. With ai i already have that set in memory so it knows if i want to learn something i expect every jargon word explained, every concept properly explained in an intuitive way with clear modern realistic examples not to-do lists. Everything presented in nicely designed html files and properly structured. Etc",westeast1000,2026-06-20 10:49:53,-2,learnprogramming,t3_1uar923,False,
ostr77d,Sounds like a case for the *Strategy Design Pattern*.,aqua_regis,2026-06-20 20:32:18,29,learnprogramming,t3_1ub6m8o,False,
osttkb9,Seems like you ask about “inheritance vs aggregation/composition”.There are many pros and cons for both of these approaches. Just read some articles about this. Choose something that will fit for your task. There is also few very popular books about classes design. Like GoF “Design Patterns”.,brinza888,2026-06-20 20:44:26,5,learnprogramming,t3_1ub6m8o,False,
osu0fp5,"I generally need at least 3 iterations to go from the first demo to anything resembling production. Don't be afraid to write something and throw it away. Each time through the process you will learn more about the abstractions and how they interact, and whether or not that leads to an unmaintainable wad of code.Any solution that meets the requirements is a correct solution.",somewhereAtC,2026-06-20 21:19:47,2,learnprogramming,t3_1ub6m8o,False,
oswrlnw,"Think of it as composition over inheritance. Instead of building a ""SuperGun"" class that tries to account for every possible behavior, you’re just giving your gun a backpack of ""behavior modules"" that it can execute whenever you hit the fire button. It makes your code way easier to maintain because you aren't stuck in ""inheritance hell"" trying to figure out which parent class handles the projectile logic.",technopiyush,2026-06-21 08:37:01,2,learnprogramming,t3_1ub6m8o,False,
osy7sdn,"your second instinct is right: composition, not subclassing. make each ability a self-contained behavior you attach to the GunController.subclassing explodes the moment you want to mix abilities across guns. build an ability once, bolt it onto any gun. look up ""composition over inheritance,"" it's exactly this.",SpecialistGazelle508,2026-06-21 14:42:07,1,learnprogramming,t3_1ub6m8o,False,
osyc5p8,You describe the behavior very carefully,HasFiveVowels,2026-06-21 15:04:26,1,learnprogramming,t3_1ub6m8o,False,
osvky8u,"I enjoyed a game called Creeper World 4 a few years back, learned their '4RPL' for it (reverse polish language)When I was a young'un I used to mod Tiberian Sun - now that was a fun one!Like anything, you've just gotta get the reps in to start figuring things out.",dark_elf_2001,2026-06-21 03:00:17,-1,learnprogramming,t3_1ub6m8o,False,
ostyydf,"the strategy pattern is the right call here. basically you define an interface (or in Lua/Roblox terms just a module with expected functions) for what an ""ability"" looks like, then each ability is its own self-contained thing you plug into the gun controller at runtime. this way adding new gun feels like assembling from parts rather than writing a whole new subclass every time. subclassing gets messy fast when abilities start overlapping between guns or you need to mix and match them.",Own-Site6376,2026-06-20 21:11:57,12,learnprogramming,t1_ostr77d,False,
ostuoqu,"I’ve never really used the strategy pattern, but wouldn’t that be the same as subclassing? I assume each gun would be its own “strategy” that I set on the gun controller?",Sol-SiR,2026-06-20 20:50:09,2,learnprogramming,t1_ostr77d,True,
ot9xu5p,"For most guns there could be common modules for how a projectile flies, hits a target, and imparts an effect. Differences covered by property values of the gun. But making the system modular allows any of those functions to be swapped out for something different from the usual. A homing missile rather than a simple dumb bullet. Or ignore barriers that stop most bullets. A stun effect where the standard is just damage.",RealisticDuck1957,2026-06-23 06:15:30,1,learnprogramming,t1_oswrlnw,False,
