id,body,author,created_utc,score,subreddit,parent_id,is_submitter,distinguished
ooha4z4,"[I wrote about this a while ago](https://www.ramijames.com/thoughts/reading-documentation-effectively).Basically, it's a skill that you need to learn and to exercise. Skim, then focus. Read page by page. It doesn't really matter. Find your own way. Just read the docs.",farfaraway,2026-05-29 00:40:50,2,learnprogramming,t3_1tqiwym,False,
oos2pdw,A language becomes good when it fulfills its philosophy,Flame77ofc,2026-05-30 15:45:48,37,learnprogramming,t3_1ts37zr,False,
oos2cci,>There are only two kinds of languages: the ones people complain about and the ones nobody uses,MojitoBurrito-AE,2026-05-30 15:43:59,96,learnprogramming,t3_1ts37zr,False,
oos1s1u,Whether you like it or not.,EntrepreneurHuge5008,2026-05-30 15:41:12,17,learnprogramming,t3_1ts37zr,False,
oos1zog,If the programming language fulfills a purpose then its a good one,PaperCube_,2026-05-30 15:42:16,8,learnprogramming,t3_1ts37zr,False,
oosqxo4,"I tend to judge languages by their footguns. For example, I like to trashtalk JS because of its notorious type coercions. But, _every_ language has footguns. C is basically infinite footguns in a trench coat, but that hasn't stopped it from being used for most of the most robust, safety-critical software ever written.Languages generally aren't ""good"" or ""bad."" They have different trade-offs that affect what applications they're best used for. More visibly to redditors, they have different developer experiences that inform wildly strong opinions that usually aren't very deep. For example, Python gets a ton of hate due to its use of whitespace in syntax, but you'll see a lot fewer complaints about its _actual_ limitations since those don't usually affect the experience of _writing_ Python nearly as much. People who wrote Python in a community college CS102 class ten years ago will bend your ear about how bad Python is because of that one thing, without even knowing what Python's _actual_ drawbacks are (it's slow, the GIL preventing multithreading from doing parallel processing, some warts on the type system...) or its strengths (flexibility, introspection, metaprogramming, being easy to learn).And most of us aren't innocent. Like I said, I like to trashtalk JS, but I don't actually work with it very often and couldn't tell you what it's real strengths and weaknesses are besides freely coercing types. It's not the only language to do that, but it's the one I talk about: just like [the top comment said](https://old.reddit.com/r/learnprogramming/comments/1ts37zr/what_makes_a_programming_language_a_good/oos2cci/).",Delta-9-,2026-05-30 17:41:39,7,learnprogramming,t3_1ts37zr,False,
oosjgf8,"Lots of meme answers sadly. In the spirit of the sub:When designing a programming languages you have to make a few choices, and there's no right or wrong here, all of these have their use:Do you want your language to have static typing or dynamic typing? In static typing a variable can only ever be of one type and that type must be known at declaration time. In dynamic typing it can change types. C, C++, Java, Rust, Go all have static typing, while Perl, Python and Javascript have dynamic typing.Do you want your language to be strongly or weakly typed? In strongly typed languages you control transitions between types. Assigning from one type to another usually results in an error, while weakly typed languages will try to make it fit for you. Java, and Ruby are pretty strict, while C, C++ and Javascript are weakly typed.Do you want your language to be compiled, interpreted or something in between? If you compile ahead of time, you can spend more time optimising the resulting assembly instructions. If you compile to a bytecode or virtual machine target you get some of the benefits but stay portable. If you interpret your language it will run everywhere the interpreter runs but will be slower and eat more memory. C, C++, Rust are fully ahead of time compiled, Java, Go, Perl, Typescript use some intermediate formats and Javascript is fully interpreted - but the v8 engine has a just-in-time compiler to compile hot paths into assembly on the fly.How do you want your language to manage memory? If the user has full control over memory, you can use your language as a systems programming language and make operating systems or embedded with it - at the cost of being more complicated to use and more prone to memory errors. If you add some form of automatic memory management, the user doesn't have to worry about it, but you usually have to give up strong guarantees about execution time and memory requirements. Only C, C++, Zig and (to a lesser degree) Rust have manual memory management, while every other modern language has some form of automatic memory management.What paradigms do you want to support? This used to be a controversial thing, with low level languages being procedural and high level languages being object oriented or functional, but nowadays most languages are multiparadigm and support everything in some form. Notable exception is the venerable old C (strictly procedural), Go and Zig (no OOP out of spite). There are other niche paradigms, but that's a bit much for this question.Do you want your language to support threads or asynchronous code? If yes, which primitives do you provide? async blocks, promises, futures, channels, pipes, mutexes, semaphores....Do you default to mutable state or immutable state? The trend here has been towards immutability because it's easier to reason about, while old languages default to mutable state.Do you support exceptions for error handling? Or some sort or short circuit Result type like Rust? If not, what is your preferred error handling model? Or do you simply encourage people to copy/paste `if err != nil` everywhere like Go does?Do you support some form of abstraction? classes? structs? interfaces? modules? records? traits? generics? generators? templates? higher order operators? Overloading? Operator-overloading? type-coercion-overloading? Inheritance? Multiple Inheritance? Duck-typing? Delegation?Do you support nullable types? If you do, do you support some kind of non-nullability check? If not, do you support some other form of optional values? Do you support general annotations for people to build tools like that outside of the language definition?Do you support access control? public? private? protected? final? friend?How ""safe"" do you want your language to be? Should runtime operations always be overflow and bounds checked (safer, but costs time). Should overflows automatically promote to a larger type? (requires dynamic typing).Do you want to support metaprogramming? runtime reflection? introspection? code generation? macros? monkey-patching? dynamic dispatch? aspects? Or even a full meta object protocol?How comprehensive do you want your standard library to be? full Unicode string support? collections for all the standard DSA things? time api? json/xml/yaml/ini/protobuf adapters? file api? network api? ip/tcp/udp/ipv6/dhcp/http/ftp/ldap libraries? foreign function interface to interoperate with libraries in other languages? An interface for sql databases? A crypto api? A regular expressions library? A GUI library?Do you want to support annotations? These are informal snippets on the code that external programs can read and do stuff with it. It has proven to be an extremely powerful thing to create better tooling for a language, but you also give up control.Do you want to support ""new"" hardware? Most languages operate on an idealised machine that is stuck in the 1960s. Support for modern hardware is still rare and extremely hard to use in practice.Do you support non-POSIX machines? This sounds weird since Windows PCs are _not_ POSIX compliant, but the vast majority of machinery out there runs on some sort of Linux or BSD kernel, and if you target embedded devices you never have to put up with all the crap that Microsoft comes up with. Go for example has a file api that is infamously ignorant of anything that is not a POSIX file system.On the other hand, how far do you want to support esoteric hardware and ecosystems? IBM mainframes to this day do not operate on ASCII but rather on EBCDIC. Gaming consoles, embedded devices, specialised hardware etc sometimes drastically differ from the usual conventions of how a system works.And of course finally: what should your syntax look like? (Don't worry, this one is the one why people won't like your language).---I personally think a language is a good language if it has a niche and serves it well, and also is _consistent_ within its own values in this niche. Most languages that are popular today have a niche at least.There are some where I think that they are not really consistent within their niche, but take that with a grain of salt. As another already quoted: there are only two kinds of languages, the ones people complain about and the ones nobody uses.- I think PHP is an irredeemable mess. It started out as C, Perl and shell script under a blanket, and while they did try to get away from that, it was too deeply engrained in its design.- I think Go is the modern PHP. The designers basically ignored 20 years of language design theory to cook up their own C replacement, which then was promptly abused for something it wasn't even designed for. Since then they fight tooth and nail against adapting the language to its new niche.- I think Java was mostly an academic reaction to the perceived failings of C++ and overshot in every direction. C# is better at what Java tries to be.- I think there a good language buried in C++ that is waiting to get out. Many languages have claimed to be that language, but none are quite there.- I think Kotlin is a very good core language that is completely ruined by how easy it is to create DSLs in it.",aanzeijar,2026-05-30 17:06:33,21,learnprogramming,t3_1ts37zr,False,
oos4n9l,"There is no good programming language, every single one is bad in its own way and has drawbacks. How good the experience is would be determined by 1) how well you can read the code, 2) how well you can write the code, and 3) how much support the language has in the dev community",smartuno,2026-05-30 15:55:18,7,learnprogramming,t3_1ts37zr,False,
oos1xtd,It is all subjective,hugazow,2026-05-30 15:42:00,4,learnprogramming,t3_1ts37zr,False,
oosbchp,"Honestly I think a “good” programming language is mostly one that makes the right tradeoffs for its purpose, not one that tries to win every category.For me the big differentiators are: readability, tooling/ecosystem, performance, developer experience, how easy it is to debug, and whether it gets out of your way or constantly fights you.Python feels great for learning/AI because it’s readable and fast to build with. C/C++ give you more control and performance but can be painful. Java/C# trade some flexibility for structure. JavaScript… somehow runs everywhere and survives purely out of spite :loudly_crying_face:A bad language to me isn’t necessarily slow or old, it’s one where simple things feel unnecessarily hard, errors are cryptic, tooling sucks, or the language fights the problem you’re trying to solve. The “best” language is usually context-dependent.",MR_LAW11,2026-05-30 16:28:10,2,learnprogramming,t3_1ts37zr,False,
ootbbag,"I have seven years of professional experience and I honestly don't know. I'm kinda agnostic when it comes to programming languages, I just work with whatever the stack of the company in question is, and I have never really preferred one over another, while the devs around me have always been super opinionated",JonasErSoed,2026-05-30 19:18:52,2,learnprogramming,t3_1ts37zr,False,
ooday82,"20+ years in WebDev…. It’s about solving problems. Business problems are CONSTANTLY evolving, therefore learn to fix their problems.— 20 years ago, it was browser incompatibility, so we wrote separate code for Internet Explorer— 10 years ago, HTML5 replaced Flash, so we rewrote code to keep dynamic animation going— 5 years ago, accessibility and privacy become KEY, so we adapt to solve those issues.— Now it’s all about AI and the increase of bots…. Figure it out.Be a problem solver, and you’ll always find work. Good luck.",crashomon,2026-05-28 13:29:45,132,learnprogramming,t3_1tq39p5,False,
ood9eng,"Learning JS is useful but most websites are put together with layers of frameworks these days, with or without AI. Get the fundamentals down but try and branch out a bit. Still lots of work available in tech but churning out basic front end websites by hand hasn’t been much of a thing for a while now.",desutiem,2026-05-28 13:22:15,19,learnprogramming,t3_1tq39p5,False,
ood8zgf,"That's because you learn a skill; not problem solving by critical thinking. It comes before temporary skills as it helps you, understand to be relevant In any situation and you will adapt automatically.",Mesmoiron,2026-05-28 13:20:11,14,learnprogramming,t3_1tq39p5,False,
oodiy2p,Web dev changes fast but learning how to solve problems and build stuff matters way more than memorizing today is framework of the month.,melissaleidygarcia,2026-05-28 14:07:08,7,learnprogramming,t3_1tq39p5,False,
oodn8sc,"This is nothing new and have been something tonnes of web dev have been worrying about for 20yrs. Fundamentals should be the same and transferable. There's far more to web dev than just your regular CSS, JS and HTML. For example, some of the things that got me to land roles after web dev:* Understanding users and their bullcrap.* Understanding how the internet works- basics of networking (e.g. TCP, HTTP/S, DNS).* Some of understanding of database and how to interact with it.* Understanding what APIs are, how to test it and write your own.* Understanding software architecture basics (esp microservices).* Knowing how to collaborate and communicate with a wide range of people.There's also no reason as to why you shouldn't be capable of picking up new skills throughout your degree aside from web dev. For example, learning basic cloud skills or other modules you would find on OSSU or any CS courses.",LifeNavigator,2026-05-28 14:26:52,6,learnprogramming,t3_1tq39p5,False,
ooeah89,"Nowadays companies are looking for AI that can substitute Humans, so it will be harder going forward being a ""code monkey"". But trust me, less than 5 years from today and they will be looking for Senior devs that can fix all the AI Slop they've been pushing to production code during these years!",LastJoker96,2026-05-28 16:09:04,3,learnprogramming,t3_1tq39p5,False,
ooeq8o8,"It's not useless I went to university here in London for my masters in digital media design and when I use AI I know what to look for, what to expect, and how to fix issues when they arise. People say learning code is pointless but it can make you stand out if know the basics of code and utilizes AI to help make you faster",chaoticbastian,2026-05-28 17:17:31,2,learnprogramming,t3_1tq39p5,False,
oogjpfh,"the stuff that goes stale is specific syntax and framework APIs. what you're actually building is debugging pattern recognition and the ability to read unfamiliar code, and I haven't found those expire.",quietcodelife,2026-05-28 22:15:11,2,learnprogramming,t3_1tq39p5,False,
oondek4,"If it makes you feel any better, people have been saying ""web dev is dead"" for well over a decade :grinning_face_with_sweat:The tools keep changing, but companies still need people who can understand requirements, build things, debug issues, and maintain systems. I'd be more worried if you were only memorising frameworks. If you're building projects and learning how software actually works, those skills tend to survive technology shifts much better.",Dry-Hamster-5358,2026-05-29 21:25:51,2,learnprogramming,t3_1tq39p5,False,
oodnh6x,"Take some communication classes. Seriously. Learn to work with diverse teams across engineering, product, sales, marketing, customers. Learn how to find out about problems and then solve them.",delicioustreeblood,2026-05-28 14:27:55,1,learnprogramming,t3_1tq39p5,False,
ooz6vx9,"Learning the syntax of a language is a different skill than problem decomposition and critical thinking. Learning the language does not necessarily mean you will be able to do the latter.For your projects, you must break things down into a list of the simplest things you can do. You need to do it a bit excessively at first.",ErrorDontPanic,2026-05-31 17:25:49,25,learnprogramming,t3_1tt1bkx,False,
ooz9w1s,"You don’t have to start over. What you’re hitting is the normal gap between “I recognize the concepts” and “I can assemble them into a program.” That gap feels awful, but it’s where programming actually starts to become real.A good next step is to make projects smaller than you think they should be. Instead of “build a todo app,” do: 1) store one todo in a list, 2) print all todos, 3) add a menu, 4) handle invalid input, 5) save to a file. After each tiny step, run it. If you get stuck, write comments in plain English for the next 3 lines you wish existed, then translate one line at a time into Python.Also, don’t judge the hours as wasted. Variables/loops/functions are like vocabulary; now you’re learning how to write sentences with them.",AutomaticBill114,2026-05-31 17:39:42,15,learnprogramming,t3_1tt1bkx,False,
oozrlr7,"> all the hoursIf you still count in *hours*, you haven't basically started to learn. Learning programming takes *months* and becoming somewhat proficient takes *years*.You may have learnt the vocabulary and grammar, but can't write a novel yet. That's basically what stage you are at.You need to *practice*. You need to do small and simple projects and gradually increase size, scope, and complexity. You need to grow with your projects and your projects need to grow with you.And no, you don't have to start over from the beginning.Did you start over from learning to write ""A"" when you couldn't write your first homework essay?You are giving up way too quickly. You need to build up a certain frustration tolerance towards failure and a different attitude towards it as failing is not negative, it is **learning**. You learn how to not do something. This is important. You absolutely need to struggle when learning. If you don't struggle, you don't internalize. You also need to build up a certain stubbornness to not give up on the faintest molehill of an obstacle.",aqua_regis,2026-05-31 19:02:18,4,learnprogramming,t3_1tt1bkx,False,
ooz8umv,Can you give an example of an exercise that stumped you?,grantrules,2026-05-31 17:34:55,3,learnprogramming,t3_1tt1bkx,False,
ooz7dmd,"I remember when I was first getting comfortable with my best language. Why don’t you give some of these exercises a try:https://www.codingame.com/multiplayer/clashofcodeIt’s a multiplayer coding game where you try to solve the problem with variables/loops etc. You even get to see how others solved the problem.When I started I couldn’t solve a single one all weekend, but after a week I was able to solve one every couple of tries. I also encourage no use of AI when trying to do these and I think this will get you more comfortable with your Python skills.",Ok-Advantage-308,2026-05-31 17:28:06,2,learnprogramming,t3_1tt1bkx,False,
ooztuoa,"You do not need to start over. You are just hitting the gap between knowing syntax and decomposing a problem.When a project feels too big, write it in English first:1. what input do I need?2. where will I store it?3. what is the smallest output I can print?4. what is one rule/condition?5. what function would make this less messy?Example for a tiny expense tracker:- ask for item name and amount- store one expense in a dict- append it to a list- print total- add a menu- save/load from a fileDo not build the full project in your head. Build the dumbest working version, then add one feature. This is how real software is made too.Also, when you get stuck, your next move should not be ""watch another Python course."" It should be: reduce the problem until you can make one line work, then expand again.",Mysterious_Anxiety86,2026-05-31 19:13:04,2,learnprogramming,t3_1tt1bkx,False,
ooz79a5,Simply practice more.,Own_Loquat_7602,2026-05-31 17:27:33,1,learnprogramming,t3_1tt1bkx,False,
ooz940y,"I'm not sure what side of the fence I'm on if you can learn to think like an engineer or not, but that's where you're lacking it seems. You need to think about the entire project, then break it up into logical chunks then piece it all together.",__init__m8,2026-05-31 17:36:06,1,learnprogramming,t3_1tt1bkx,False,
oozhg55,"I got better at it when I started taking stuff apart into smaller tasks. And then go step by step. Once the first part works I'll move on to the second part and so on. and boom, the task is done.",DoctorWhatTheFruck,2026-05-31 18:14:24,1,learnprogramming,t3_1tt1bkx,False,
oozok9v,What's the most difficult exercise you've solved?,Humble_Warthog9711,2026-05-31 18:47:56,1,learnprogramming,t3_1tt1bkx,False,
ool38dr,"General advice is to favor composition over inheritance.So avoid abstract classes (generally).If you find yourself wanting several of your concrete implementations to have the same behavior for an operation, you can extract that operation to its own class and provide an object of that class as an implementation.This leads to more testable code and avoids the abstract class hierarchy mess of trying to figure out which tier of the abstract class hierarchy specifies the default your concrete class is using.",AsparagusBig3989,2026-05-29 15:16:15,17,learnprogramming,t3_1tr4ovj,False,
ool1dxj,"I have almost never used abstract classes. I haven’t made an exact count, but I would guess that interfaces outnumber abstract classes 70 to 1 in my code.",lurgi,2026-05-29 15:08:09,15,learnprogramming,t3_1tr4ovj,False,
ool3ybo,"An interface is like a contract. I need you to pass in a class that that implements the DrawableAnimal interface, and I'll add it to the list of things to be drawn every time the window refreshes.An abstract class is like a base class with common functionality between two classes. Let's say two of my drawables are TRex and Stego. They both inherit from an abstract base class Dino which has a lot of the common code to draw a dino.Dino isn't an interface because in this program at least, there's no need to know that something is a Dino or not, you just have a list of animals. Dino is more of an implementation detail. It's common code that two classes from inherit from.",dmazzoni,2026-05-29 15:19:25,9,learnprogramming,t3_1tr4ovj,False,
ool2vn0,"I guess whenever you want a method that is commonly executed on the sub classes, since one of the differences is that an abstract class can have a method not be abstract.",Danque62,2026-05-29 15:14:41,4,learnprogramming,t3_1tr4ovj,False,
