id,body,author,created_utc,score,subreddit,parent_id,is_submitter,distinguished
onxexs3,Run away from anyone that does vibe coding. AI assisted coding is where the future is.,obelix_dogmatix,2026-05-26 06:51:13,2,cscareerquestions,t3_1tn9x77,False,
ontrs93,"80k LOC + “manager changes direction every new keyword” sounds less like vibecoding and more like no product discipline :loudly_crying_face:AI isn’t really the issue there. No plan, no boundaries, constant pushes, and two devs cleaning chaos after.This shouldn’t be the normal. Fast building is fine. Rebuilding the whole thing every week because hype changed is not.",More_Ferret5914,2026-05-25 17:58:38,2,cscareerquestions,t3_1tn9x77,False,
on9qwmk,Wow. Thanks for sharing your details.,rickosborn,2026-05-22 16:13:34,16,cscareerquestions,t3_1tkndzf,False,
on9t4dq,how much was the offer,cwolker,2026-05-22 16:23:51,7,cscareerquestions,t3_1tkndzf,False,
on9tdz8,Did you get a pay bump?,throwaway09234023322,2026-05-22 16:25:06,3,cscareerquestions,t3_1tkndzf,False,
on9s271,"Good on you! Keep training and keep working at it. I'm working today on Building Claude AI agents using C#. I have 27 years of development experience, so I figure if I can add agentic development to my resume, that can only help. Remember, Reddit is not reality. There are certainly perspectives you can glean, but it is not total reality.",Melodic_Crow_3409,2026-05-22 16:18:57,4,cscareerquestions,t3_1tkndzf,False,
ona96v2,Thanks for some positivity!,Adventurous-Move-191,2026-05-22 17:39:02,1,cscareerquestions,t3_1tkndzf,False,
oncwgc4,"Congrats! Just curious what tech stack you had going into it, and what does the new job use?",spiritualquestions,2026-05-23 02:09:36,1,cscareerquestions,t3_1tkndzf,False,
ongnkd0,Congrats - did you apply to fully remote roles?,Annual_Negotiation44,2026-05-23 17:30:01,1,cscareerquestions,t3_1tkndzf,False,
onaidu6,"appreciate the data point. 250 applications in a month landing 2 interviews and one offer at 3.5 yoe self-taught, that's actually a solid hit rate for the current market.the government consulting angle is underrated. those orgs are slower to adopt ai tooling, have steady budgets, and often have less competition than pure product companies. good entry point.",UgurcanSoruc,2026-05-22 18:21:30,-1,cscareerquestions,t3_1tkndzf,False,
oo7rp4g,"think carefully, i quit and now more than a year later i never got back inplenty of ppl are having the same experienceu might leave and be unable to get a new job",Known-Ice5903,2026-05-27 17:51:21,44,cscareerquestions,t3_1tpclv3,False,
oo7om6e,"At the end of the day, you should prioritize your mental health. I had to leave a very cushy job for the exact same reasons and I don't regret it one bit. I'm not necessarily better off money wise but at least I was much happier after I left.",gg_bye,2026-05-27 17:38:26,38,cscareerquestions,t3_1tpclv3,False,
oo7rp85,"i took a 1.5 year break after 6.5 years of exp in dec 24 it was monumental for my mental healthnow I am looking for a job again, market is shit but I don't mind. It'll take longer than usual but it should be fineI'll say, take a 3 month sabbatical if your job allows it and rejoin them. if you want a longer break, you will have to quit.",inthiseeconomy,2026-05-27 17:51:22,16,cscareerquestions,t3_1tpclv3,False,
oo7ykge,You need to dive deeper as to why you’re burned out. Lack of agency? High number of hours? Not meaningful work? Lack of interaction/downtime? Etc,vamos_davai,2026-05-27 18:20:29,11,cscareerquestions,t3_1tpclv3,False,
oo8ajro,"Heads up, when you leave agile, daily standups, on call, estimations, managers and all the corpo crap, it is VERY difficult to go back.",valkon_gr,2026-05-27 19:12:43,17,cscareerquestions,t3_1tpclv3,False,
oo8dvb6,"Listen, don’t make easy choices. Easy choose gives you a relief and then puts you much lower than you were previously. I left my toxic job, I felt relief and since then it has been a nightmare. I do wish someone gave me this advice - don’t give up!!!! There are ways to feel better mentally, take a blanket and have a seat on a green grass and just enjoy summer etc. Easy choices don’t pay back.",JuiceChance,2026-05-27 19:27:14,6,cscareerquestions,t3_1tpclv3,False,
oo9cnko,"Honestly I’m going to be a massive prick and say I find this attitude really irksome. It’s one thing to hate a job where the manager/coworkers suck or the work his endless and exhausting or you feel bullied/underappreciated but I honestly struggle with people who claim to have good jobs, good home lives and yet are still miserable…especially considering what the economy is like and what the financial realities for most people are.But that’s not to say you’re entirely wrong, but for me the introduction of AI has meant I’ve never enjoyed work more, because I can ultimately put as little of my mental real estate towards it. In all honesty, software engineering is a knowledge field, there’s lots of information to retain and absorb and learn but it’s not truly a place where one gets to experience the kind of challenge that makes you truly value life for what it is. I honestly think that can’t really come from any typical 9to5 jobs outside of maybe something like medicine or working for som non profit/charity.I’m big into martial arts and I’m a bit of a drama enthusiast and I find those avenues, whilst nowhere near as secure, are perhaps somewhat better for truly discovering oneself or forcing you out of a comfort zone which imbues a true sense of accomplishment. When people in the corporate/white collar world complain about feeling deeply unfulfilled I often also find those same people have rarely, if ever, challenged themselves from beyond their domain. So maybe signing up to a boxing class or learning an instrument or volunteering at a food bank or taking some acting lessons will help you in perhaps learning a little more about yourself…because in all honesty your life doesn’t sound like a particularly arduous one.",Inertia_Sleeps,2026-05-27 22:07:41,4,cscareerquestions,t3_1tpclv3,False,
oo7p6fn,"Do you have the money to just like do that? I had a total existential crisis too several years back, went off and did Peace Corps, came back and restarted my career just fine but tbh there's no family wealth and I probably would've been better off just cruising and getting a paycheck.",Street-Gur-1343,2026-05-27 17:40:48,2,cscareerquestions,t3_1tpclv3,False,
oo8llam,Do not quit unless you feel you’re wealthy,koolkween,2026-05-27 20:01:28,2,cscareerquestions,t3_1tpclv3,False,
oo8n6s4,I feel you on this. It doesn’t help that the interview process is its own grind so you have to study for that on top of normal work.,StephIsJesus,2026-05-27 20:08:38,2,cscareerquestions,t3_1tpclv3,False,
onxd2ew,There is a reason Google tenure was under 2 years even in the golden days. I think a lot of us eventually feel stifled early in our careers and leave for smaller shops. It's a tale as old as time. After my 4 years at Google I picked a MUCH smaller company to kind of get exactly what you're talking about: the ability to touch more parts and really just have technical progression. It's something worth at least considering imo.,ImSoRude,2026-05-26 06:35:11,88,cscareerquestions,t3_1tny74l,False,
onxbvn9,"If it makes you feel better, I feel like there are so few SWE jobs that actually have you work on something that feels meaningful",TheDinoDynamite,2026-05-26 06:25:01,63,cscareerquestions,t3_1tny74l,False,
onxx1a8,"It’s ok to want meaning in labor. And it’s okay to walk away if that will bring you closer to it. Not everyone can split their being and their job into separate categories. Everyone told me that I should be grateful, that I should compartmentalize my job from everything else. It was catastrophic and devastating for my health.It doesn’t really sound like your issue will be fixed at startups, at least from my reading. Hoping the best for you.",Mean_Conference6910,2026-05-26 09:31:30,11,cscareerquestions,t3_1tny74l,False,
ony51wp,When you're younger you want to do something impactful. I get it I was in your shoes a over a decade ago. I did Google and left for failed startup and bounced around and do consulting now. I have a family now so my priorities changed. I no longer have the desire to go into the office. I would rather be remote so I can spend more time with family and friends. The job now is just for stability until I can retire.,dontmissth,2026-05-26 10:36:34,10,cscareerquestions,t3_1tny74l,False,
onxg0tf,Just get a job where you actually want to do it. Unless ur in it for the moneyTf u expect from a company where their biggest issue to solve is how to make ads prominent on as many platforms possible,QuitTypical3210,2026-05-26 07:00:18,33,cscareerquestions,t3_1tny74l,False,
onzc1wc,"Was L5 senior IC at Google, here's my take on it:1. At Google to do interesting work you have to seek out opportunities yourself. At L4 it is unlikely that you have any say in project allocation and/or resourcing. There are many ways to go about this: climb the corporate ladder (promotions) into position of influence or make proposals yourself on what you think is interesting & impactful.2. Treat job as a job will make you less frustrated at work. If I'm understanding correctly you're feeling underutilized which is very common at big tech like Google. It is what you make it out to be, advocate for yourself and seek out opportunities, play office politics to get what you want, or if you're really unhappy, switch teams or jobs.3. If you're single, L4 money is plenty enough. If you're raising a family, then you want at least L5 money. 4. I encourage you to try out a different team at Google to decide whether or not it's for you, your experience is completely team dependent. Figure out a way to market yourself so you can be considered by hiring managers.5. You either find a role that is related to your passion or figure out how to identify impactful work that aligns with business priorities where you are at and pitch it to leadership.",qpalzmg,2026-05-26 14:41:20,8,cscareerquestions,t3_1tny74l,False,
onyimqh,"There's some valuable insights you can learn from google, like business methodology, requirements tracing, meeting cadence etc, but big corporations like that are very much an ""everyone has a very specific hat they wear"" type of environment. It's not until you get into the small to smaller mid-size companies that you feel more like a _developer_ who wears multiple hats. At my last job we had a database person, a frontend person, a backend person, a devops person and so on. It could be great if everyone did their job, but the moment one person wasn't, they were a blocker everyone else depended on. Our database guy was that for me. I had to basically show him exactly what to execute against the database instead of using plain language (that was still very detailed.) He also didn't know what normalization was, which was alarming. Another database person told my coworker she didn't know what SQL was. That's the other thing about big companies, sometimes some really bad people cheat and slip through the cracks, or they know someone who knows someone but just absolutely should not be there.",DoingItForEli,2026-05-26 12:09:05,2,cscareerquestions,t3_1tny74l,False,
onxe52j,Bot?? I already saw a post like that this week.,reivblaze,2026-05-26 06:44:25,7,cscareerquestions,t3_1tny74l,False,
onuat42,"Since you were able to land both your previous job and this one without a CS degree, it sounds like you probably already have a solid portfolio, a resume that explains your skills well, and some recruiter connections. I really wouldn’t quit before having another offer, and I wouldn’t even mention that you’re thinking about leaving. In the meantime, maybe send your resume to other recruitment firms in your field like this [developer ](https://www.reddit.com/r/RemoteJobseekers/comments/1fdpeg2/how_i_landed_)did. You might end up finding something much healthier than where you are now.",All_The_Memes,2026-05-25 19:30:49,16,cscareerquestions,t3_1tmqjdi,False,
onox7y8,Depends on who you are. But from the sounds of it I’d just quiet quit and look for another job. You have to be proactive in not burning yourself out everyday so that you have the ability to apply for jobs when you get home. This place sounds horrible.,21_12user,2026-05-24 23:28:35,10,cscareerquestions,t3_1tmqjdi,False,
onp0b5q,"My advice doesn't work during this time (I'll include you in my prayers), but just in case you ever find yourself with income to spare.1) Invest and save ALL your money, don't spend any money anymore, ever again. Build a big dragon hoard. Money can protect your mental health, like a magical ward of sorts.Money can buy you mental health, it can buy you dignity, and confidence. Just knowing that you have savings that can last longer than the time it takes you to find the next job will make you feel safe (and loved, by your money, not management).",abandoned_idol,2026-05-24 23:46:50,19,cscareerquestions,t3_1tmqjdi,False,
onov9v7,"That sounds genuinely brutal, and those red flags are real, not in your head.",farfaraway,2026-05-24 23:17:06,24,cscareerquestions,t3_1tmqjdi,False,
onpcc9e,Tbh this sounds less like “imposter syndrome” and more like a genuinely toxic company burning people out fast.,Majestic_Menu_1125,2026-05-25 00:58:51,3,cscareerquestions,t3_1tmqjdi,False,
onpux34,A couple of situations that have always helped me:- Try to get more time outside in the wilderness. Not just one day. Not just one weekend. But consistent time outdoors. It will help you cope with the stress.- Cut your burn rate. Try to save as much cash as possible. Live out of your car if you have to. Live up in the woods with a hammock. I did it when I was a kid. Get your burn down to zero so you can bank as much cash as possible so you have more freedom.- Take care of your health. Eat right. Hit the gym. Lift. ... That's the only wya to deal with this type of situation.,brainhack3r,2026-05-25 02:51:25,3,cscareerquestions,t3_1tmqjdi,False,
ont5a7z,"The stock options thing is a red flag I'd take seriously. That's not a miscommunication, that's just lying. And ""chronic stress as a core operating principle"" is leadership telling you exactly who they are upfront.Start quietly building your skills and your external reputation now, while you have income. Don't wait until you're desperate again. The 6 month job hunt you described is brutal, but tbh it's easier to land something when you're already employed.",alexxtoth,2026-05-25 16:12:41,3,cscareerquestions,t3_1tmqjdi,False,
onrh4ag,"I've been in a similar spot before, and honestly the thing that helped most was realizing that ""having a job"" and ""having a sustainable job"" are different things. A company that normalizes public shaming, constant urgency, and bait-and-switch hiring practices isn't teaching resilience, it's burning through people.If I were you, I'd treat this as a temporary landing spot, not a destination. Keep collecting the paycheck, do good work, update your resume with everything you're learning, and keep interviewing. The fact that you're stressed all the time despite a 40% pay bump is a pretty strong signal that the problem isn't you.",curious_4207,2026-05-25 10:37:18,2,cscareerquestions,t3_1tmqjdi,False,
onp3c8f,"No question you’re in a toxic environment. You should be applying to other jobs with just as much urgency as you did before. But in the meantime, try cognitive reframing. Sure, you could lose your job any day without warning. But every paycheck is a win over your previous situation where you were unemployed and looking. This job might be just the stopgap you need in order to get something more sustainable long term",BEvey_Boo,2026-05-25 00:05:07,5,cscareerquestions,t3_1tmqjdi,False,
onopsb0,I don't have a CS degree either and went from five good years in tech to grocery. Could be a lot worse. I'd love to be in tech again but I cant stomach mass applying to hundreds of job postings and having to work primarily with AI. Was a lot better 5-6 years ago pre-Covid. Walked into the grocery store and was basically hired on the spot. I'll get into tech again after the AI hype dies down.,dontdoxme33,2026-05-24 22:45:00,8,cscareerquestions,t3_1tmqjdi,False,
onvp85s,"Had no luck mass applying to everything. I focused on a niche, studied embedded software / firmware for 6 months (during last semester of school) and doing projects, then fixed my resume and only targeted embedded jobs.I got 2 interviews from 150 apps, and then 1 really good offer at fortune 200 company.You need to work hard and have a bit of luck",Friendly_Rock_2276,2026-05-25 23:59:29,69,cscareerquestions,t3_1tnq0qn,False,
onvoudy,"graduated last spring, got my first SWE job through a plain online app at a mid sized non-tech company. i sent a lot of apps, but I focused on ones that said new grad or 1-2 years and I tailored the top of my resume to mirror the posting, then made each project bullet show impact with numbers and the same tech they were asking for. process was OA, a panel with a couple easy-medium coding questions, and a project walkthrough where I explained tradeoffs and what I’d do differently. aiming at less flashy industries and smaller markets helped, and I kept momentum by doing small paid gigs and campus IT work while applying so I had fresh experience to talk about.",dippatel21,2026-05-25 23:57:13,24,cscareerquestions,t3_1tnq0qn,False,
onvxscz,Took a shit coding job at an local business for 15 an hour then moved on to a larger local business for 70k a year,Titoswap,2026-05-26 00:49:24,13,cscareerquestions,t3_1tnq0qn,False,
onw6rrq,"Got lucky with about 80-90 cold applications. Low GPA, no name school, no internships. Had 4 interviews and ended up with a full time SWE offer at a F500 defense company. My advice is if you’re sociable and likable that will take you further than you can imagine. And secondly work your resume around passing ATS screening without going TOO deep into larpville. A lot of government/government contracting work has no leetcode style interviews at all while still starting at 70-100k (i live in HCOL area) if your interview game sucks so targeting those could be good",krustyt,2026-05-26 01:41:41,7,cscareerquestions,t3_1tnq0qn,False,
onw381t,small company shitty pay,21_12user,2026-05-26 01:20:44,4,cscareerquestions,t3_1tnq0qn,False,
onw2oso,"local small company, help desk, really shitty pay",rhaizee,2026-05-26 01:17:34,3,cscareerquestions,t3_1tnq0qn,False,
onwcc5q,"I graduated 2025 just landed my first position after 5 rounds i start june 22nd finishing the background check as we speak. I didnt have any internships so i promise you a lot of the fear mongering that youre cooked is from people who either stopped trying, want others to feel how they feel or are just pessimists (wont lie the market is hard). I started applying jan 2026 due to family concerns but i had two main capstone projects that the hr team and interviewers all asked me to walk them through. They asked a lot of deeper questions on tradeoffs so make sure youre well versed. Even if you just made a choice cause you wanted to try something do research and understand the tradeoffs for that and other possible choices. I still have a couple companies in the interview process but a big thing i noticed was after i kept iterating over my resume till i got to my final resume i saw way better results. I was interviewing every week since the middle of feb till now. I dont actually edit my resume for each role i feel like the gains are minimal at best and might worsen if you dont keep track of changes. Also i applied to only backend or data engineer and general swe not full stack or front end cause… i dont show any of those skills on my resume so its pointless… Uhm I think thats it but it was a grueling 5 months for me getting finals and being picked over for someone with more experience but i understood thats the market. I started leetcoding feb and got decent at it… not insane… but good enough that OA was a good most of the times. Communication matters a lot. But i guess success story is that I went from minimum wage to 6 figures and i can finally retire my mom. I hope some of it was helpful cause i was on this sub messaging people all the time and they helped me a lot to get where i am so i felt like i should pass it along. Good luck bro keep going i promise i had a 2.7 gpa no projects till 2025 december when i finished them and i made it in this market (failed amazon, failed nutanix, failed plenty of others but dont let it discourage you keep going). Sorry if this wasnt coherent im quite sleep deprived atm. Oh applied online to all of them try to apply within the first 4 hours no referrals for anything cold apply.",charliewitda9,2026-05-26 02:13:57,3,cscareerquestions,t3_1tnq0qn,False,
onvy4wv,Connections,SunsGettinRealLow,2026-05-26 00:51:22,2,cscareerquestions,t3_1tnq0qn,False,
onwk7bf,"I graduated with a BS in Elec/Comp Engineering in late March 2025 and eventually landed a SWE FAANG role in early July 2025. Only previous ""experience"" was some TA work for a couple senior level classes, I didnt network, I didnt hackathon, I didnt have recommendations (do not do this lol, really shot myself in the foot for job searching by not doing these in college). Not sure how much mass applying contributed to my ""success"" but nonetheless it led to more interview practice which was extremely valuable. Finding what to be prepared for online for an interview is fairly easy but going through the process multiple times and getting used to the pressure and polishing your responses leads to becoming a better interviewee. I likely sent out a few hundred apps, got roughly a dozen phone screens, and like 3 interviews which went into later rounds, and a single offer.",THOUGHT_PETROL,2026-05-26 03:01:04,2,cscareerquestions,t3_1tnq0qn,False,
onwbe7n,"Spamming posts on linkedin reached out by recruiters, interview, offer",Darkislife1,2026-05-26 02:08:25,1,cscareerquestions,t3_1tnq0qn,False,
oniu5ys,Never,nulnoil,2026-05-24 00:46:45,89,cscareerquestions,t3_1tlx5yf,False,
oniv4cb,"I'm a generalist and have been for 30+ years. But when I've talked to people who are specialists, the story is typically pretty similar: Their first job, or a really early job, just ended up being what they kept doing. A friend of mine from when I was in high school got into his specialty by doing an early contract with me. I did a couple more jobs in that domain but then moved on to other domains and he kept doubling down. 30+ years later he's still doing the same thing and I've bounced between a dozen domains. He's really, really good at what he does now, and it's a niche market without a lot of competition, so he does well for himself. But I'm happier doing different things. Edit: Fix swipeo. :grinning_face_with_sweat:",TimMensch,2026-05-24 00:52:44,39,cscareerquestions,t3_1tlx5yf,False,
oniuke5,"30+ years in and I still haven't though it's basically ""anything except frontend"" at this point. Too fiddly.",TheTeamDad,2026-05-24 00:49:14,51,cscareerquestions,t3_1tlx5yf,False,
onix1yx,"My last co-op put me into (internal, applied) Solution Architecture, stayed far too long, became a generalist after surviving attrition long enough to become a department of one. Then that job died and it took a year to get another.16 YOE as an SA, ain't nobody going to touch me for a coding job, so survival depends on keeping up as a generalist enough to design and delegate work and to be the centre of diagnosis when stuff inevitably collapses.I guess if anything my ""specialty"" is talking about things I barely understand and calibrating just the right mix of bitchiness and good-nature to control power dynamics in multi-party meetings.",CurtisLinithicum,2026-05-24 01:04:53,13,cscareerquestions,t3_1tlx5yf,False,
onj41rv,"4 years ago.My speciality became ""adaptility to the market"" and ""fundamentals"".You pick tooling based on job and market opportunity, you learn fundamentals so you have skills that always carry over.The honest answer is never.Adaptability is what sustains you long term. Not picking one particular thing.",GeologistVisual3097,2026-05-24 01:49:39,9,cscareerquestions,t3_1tlx5yf,False,
oniudqu,"It was kind of decided for me. My internship happened to be in a niche. After graduating, I joined a different company in a generalist role. One week into the job, another manager saw I had experience in and called me saying congratulations I'm joining his team, and that he'll talk to my manager to get me transferred over. Since then I haven't left the niche and it's pretty much my home now.",Oneok-Field,2026-05-24 00:48:06,19,cscareerquestions,t3_1tlx5yf,False,
onizpva,"Manny times, it's a ""I fell into it"" situation.I was a generalist for the first 5 years of experience (2 companies). When I moved to my 3rd company, they were small and had some glaring holes that needed filled as we grew. I was raised with a ""see a need, fill it"" mentality.No source control, no ci/cd pipeline, nobody that had ever integrated with a 3rd party api, no cloud infra, etc... I had experience in some of that and a ""can do attitude"". I quickly became the owner of DevOps, Infrastructure, Release Management, and Integrations. They all kind of jive together so it makes sense. The next 5 years I really leaned into those skills in my niche and have reached a very successful level.",Vigillance_,2026-05-24 01:21:57,8,cscareerquestions,t3_1tlx5yf,False,
