id,body,author,created_utc,score,subreddit,parent_id,is_submitter,distinguished
o627c1o,"Nice, I cannot wait to buy it and not read it again.",GrandOldFarty,2026-02-18 14:46:05,805,dataengineering,t3_1r83xku,False,
o6256o0,I purchased the 1st one years ago. i think i will buy this and read it finally. thank you,Effective_Degree2225,2026-02-18 14:35:11,56,dataengineering,t3_1r83xku,False,
o647gt9,"What’s is new in this version, compared to first edition?",Mclovine_aus,2026-02-18 20:13:37,21,dataengineering,t3_1r83xku,False,
o62guhc,Would you say the previous version is quite out of date?,samvander,2026-02-18 15:31:27,14,dataengineering,t3_1r83xku,False,
o62af2h,Genuinely asking: what is so special about this book?,hau5keeping,2026-02-18 15:01:07,39,dataengineering,t3_1r83xku,False,
o62km06,"Thanks. Just a note to myself; it’s not about the book, but what you do after reading it.",Grinding_Hard,2026-02-18 15:48:41,7,dataengineering,t3_1r83xku,False,
o6302up,A modern classic. I do miss the days when everyone had books at their desk and I could make snap judgments about them by their taste.,sisyphus,2026-02-18 16:58:37,5,dataengineering,t3_1r83xku,False,
o666nt6,"FFS, why does O'Reilly put pictures of animals on its book covers?!! :confused_face:",BurgundyTile,2026-02-19 02:21:41,3,dataengineering,t3_1r83xku,False,
o62bucm,Please put NSFW tags on books making people cry.,One-Neighborhood-843,2026-02-18 15:07:59,4,dataengineering,t3_1r83xku,False,
o65mc8n,"Don’t buy the book from Amazon Chinese publishers copy and reprint the book and sell it alongside the originals (in the same listing). I ordered a few and some came with yellow pages, others with thin pages like a bible, others with awful printing mistakes. O’reilly used to only sell through Amazon and I tried to contact them and let them know and their customer service was only interested in closing my ticket. Glad to see they at least have one other vendor now.",icehot54321,2026-02-19 00:24:28,4,dataengineering,t3_1r83xku,False,
o5um6li,"All this is happening because the management needs to adapt to new technologies. My company was running in On Prem until 1.5 years back and I was specifically hired to setup AWS + Databricks. Because the management decided its cloud era. Same tables , same dimensions, but within Databricks. Only positive thing is I get paid to do this.",Secure_Firefighter66,2026-02-17 11:42:10,283,dataengineering,t3_1r73l52,False,
o5unagf,"I sort of like a bit of lake and a bit of warehouse. A common loading pattern we have been using is:- for streaming: source --> Kafka --> snowflake (snowpipe streaming to tables)- for batches: source --> AWS s3 (~lake) --> snowflake (external tables)- in both cases once in Snowflake: raw staged tables (bronze) --> structured, type-cast, deidentified views (silver) --> Kimball/star/mart views with metadata (gold)I've been liking this system so far. The key difference with streaming and batch in the above cases are that the batch method keeps the raw/bronze data in s3 via external tables, so I guess that's a ""lake"", while the streaming method loads the CDC events into a table resting in the snowflake data warehouse. We use dagster to orchestrate and dbt to run the jobs. The technologies are good - the challenges are behavioural in nature.There's probably a more consistent way to do the above, but it does work. I guess the lake/s3 component just exists because it is simple and cheap to read from some provided s3 dump than to add a ""copy into"" step. We would probably would have done the same for streaming, but snowpipe streaming is a good enough solution at the moment so we can skip a redundant intermediate load to s3.",PossibilityRegular21,2026-02-17 11:50:58,76,dataengineering,t3_1r73l52,False,
o5umrbw,"I think datalakes exist because data-driven stuff got popular, people started accumulating more data since like 5 years ago when it was all the rage, and then suddenly huge decentralized companies figured that their data infrastructure is hot garbage.Datalake and databricks, although costly with money/time/resources, allows to handle that hot garbage in some way — easily pump in money into a solution that works within a few clicks, giving people a few tools to pull and process everything in one place.I always try to choose a proper DB like clickhouse, snowflake, whatever, whenever I can. Model the infrastructure (make it modular and scalable), create some processes, and give power to the people within some defined boundaries. It’s more work, but I feel it’s easier — after inital cost I can go do streaming, swap out tools, optimize DB tables, create alert systems and stuff.Plus the experience managing your own files, metadata, debugging fucking notebooks is atrocious. But maybe that’s just me. I like sitting in my black terminal with a box cursor….",Splun_,2026-02-17 11:46:48,25,dataengineering,t3_1r73l52,False,
o5unb3k,"Data lake yes, Lakehouse noMy last 2 projects use a data lake as staging and structured store as warehouse and it works great. Tools and teams can share data onto S3 in their native format and this gets used for many things:\- Our own operational dashboards with basically 0 extra costs, no other teams needed\- Some local transformations we run for our own processes\- Sharing a subset of data with other teams\- Staging for the data warehouse (with an SQL abstraction layer)Now if you try to make your silver layer purely file based... yeah I wouldn't do it if I just have financial and sales data...",dadadawe,2026-02-17 11:51:06,24,dataengineering,t3_1r73l52,False,
o5upteq,"Because it really is a database, just leveraging cheap cloud storage.",siliconandsteel,2026-02-17 12:09:54,10,dataengineering,t3_1r73l52,False,
o5v58wl,"Computing is pop culture. Pop culture holds a disdain for history. Pop culture is all about identity and feeling like you’re participating. It has nothing to do with cooperation, the past or the future—it’s living in the present. I think the same is true of most people who write code for money. They have no idea where [their culture came from].—Alan Kay, in interview with Dr Dobb’s Journal (2012) , DDIAMy leadership sells datalake with the idea that data scientists can do exploratory analysis on the raw unstructured data. It’s been over a year and I have yet to see any exploratory analysis or insights happen.",nus07,2026-02-17 13:47:01,10,dataengineering,t3_1r73l52,False,
o5v0k8u,"It's the continuation of the concept of democratization of data, only on steroids. For years it's been all the rage to position data lakes as some sort of magic data library where ""data managers"" float around and browse every byte of the corporate data mass, somehow promoting and furthering those data, preferably delegating the quality and cleaning it up with the insanely over-engineered and dubious conceptual process of data stewardship, and then somehow with no-code UI design a pipeline to make perfect and automatically published and semantically described data sets that anyone can consume at every whim of middle management and executives.Anyone in this business clearly understood from the beginning that this in 99% of organizations and use cases is a utopian pipe dream. The result are what we see right now.",billionarguments,2026-02-17 13:20:15,6,dataengineering,t3_1r73l52,False,
o5uz7rc,Disagree on the cost part. Depends on usage and data amounts but s3 and Athena in AWS is lot cheaper for us than spinning up redshift. And we can't use other products than what aws has to offer. Data amounts are so big that postgres can't handle adhoc aggregates fast enough anymore. Talking about multiple billions of rows tables.But yeah. Setting things up and keeping it running in AWS is painful.,MaverickGuardian,2026-02-17 13:12:20,6,dataengineering,t3_1r73l52,False,
o5up645,"It's because so many people have a tool first mentality. Our staff data engineer is an aws fan boy and I've never seen such a badly implemented, convoluted and overengineered mess. As the analytics engineer I've unfortunately had very little say in all off this. And the fun part: he's the only person that seems to know how any of this works. If this guy leaves, we're fucked. I mean for management I suppose, I'm going to laugh my ass off if that happens :p",snackeloni,2026-02-17 12:05:08,10,dataengineering,t3_1r73l52,False,
o5umqlw,I don’t see any reason why I would want to go back to a database after adopting Delta?,No-Satisfaction1395,2026-02-17 11:46:38,8,dataengineering,t3_1r73l52,False,
o62b7sa,"{""code"":""BadRequest"",""message"":null,""target"":""pipeline//runid/XXXX"",""details"":null,""error"":null}Thank you ADF",SupaWillis,2026-02-18 15:04:59,114,dataengineering,t3_1r83gjr,False,
o62wyc2,"Never, ever touch a technology that is not designed for the people using it. Worst mistake of my life.",RipProfessional3375,2026-02-18 16:44:34,44,dataengineering,t3_1r83gjr,False,
o64arpe,I really love and hate ADF man.,xean333,2026-02-18 20:29:20,19,dataengineering,t3_1r83gjr,False,
o6531zn,"I truly and passionately abhor ADF. Not a single actual user or even tech minded person could have contributed to such an app's requirements. For anyone saying, ""oh but it works"", well, so does a horse-drawn carriage even today.",sparkplay,2026-02-18 22:40:51,18,dataengineering,t3_1r83gjr,False,
o64cjmf,"Oh yeah, and rolling back commits on Azure DevOps because it throws some weird ass stuff during publishing.",Astherol,2026-02-18 20:37:53,9,dataengineering,t3_1r83gjr,False,
o62g3nn,Have you seen SSIS UI. That is even worse,Outrageous_Let5743,2026-02-18 15:27:59,21,dataengineering,t3_1r83gjr,False,
o6611kn,"not DE, but i have the same hatred for all their online services.Power Automate, PowerApps, Fabric.",Mightygamer96,2026-02-19 01:48:58,3,dataengineering,t3_1r83gjr,False,
o63u7p2,My table is now full of rows with nothing but NULL values. Job failed successfully :thumbs_up:.,mertertrern,2026-02-18 19:12:18,22,dataengineering,t1_o62b7sa,False,
o650tfp,"Oh no, no this again",igna_na,2026-02-18 22:29:54,8,dataengineering,t1_o62b7sa,False,
o65d6mv,Error code equivalent of :thumbs_up:,dentinn,2026-02-18 23:34:01,6,dataengineering,t1_o62b7sa,False,
o6ji1cp,"You can find a list of community-submitted learning resources here: https://dataengineering.wiki/Learning+Resources*I am a bot, and this action was performed automatically. Please [contact the moderators of this subreddit](/message/compose/?to=/r/dataengineering) if you have any questions or concerns.*",AutoModerator,2026-02-21 03:10:21,1,dataengineering,t3_1rag36f,False,moderator
o6jj6w0,What are your thoughts on explicitly stating they can use AI but they must show you their screen when doing so? I can tell a lot about someone’s experience and depth of knowledge by the way they use AI and their prompts.,lysogenic,2026-02-21 03:17:58,136,dataengineering,t3_1rag36f,False,
o6jlqgp,"I guess we are loosing our thinking ability/analytical skills by using too much AI, in the long run we would become dumb.",eeshann72,2026-02-21 03:35:09,53,dataengineering,t3_1rag36f,False,
o6jn3kw,> Because used Al to help create the damn questions and fine tune the answers. Of course didreverse uno,ab624,2026-02-21 03:44:18,14,dataengineering,t3_1rag36f,False,
o6jzrhz,Did it occur to you that candidates also might use AI to practice or have mock interview. Maybe what you asked was asked to the candidate by the AI too during practice and maybe they remembered the wording or the answers.,Symphonic_nerve,2026-02-21 05:16:30,13,dataengineering,t3_1rag36f,False,
o6jne81,"So did you consider them ""cheating"" by using AI to answer the questions you used AI to generate? I had a similar thought about a candidate that was clearly using AI to answer questions. My initial thought was to pass, but the more I thought about it the more I realized that it was old thinking and pretty hypocritical to judge someone for using AI when we as a team use it all the time and I used it to cross reference their resume to the JD and produce the questions they were answering. Ultimately I set up another call to just chat. Told them that I use AI regularly and asked what they used. I asked them about using it to help answer questions. I told them I'd like to talk about some things and just wanted their answer in their own words. It became clear that they knew what they were talking about but there was a confidence issue. I have the same thing in interviews, I often freeze in my thoughts when I should be able to easily answer. I don't know what the right thing to do is, but as of now the use of AI is so ingrained in business life how can I dismiss its use completely. I think these are conversations we need to have with recruiters and recruits.",SRMPDX,2026-02-21 03:46:17,36,dataengineering,t3_1rag36f,False,
o6jolt1,"This is pretty tricky. In general, if someone is just copy pasting Claude responses to you - well you could just do that for yourself and seems red flag.At the same time - I think you realized it as well - we really need to start just setting AI expectations for interviews. Stating exactly what is and isn't allowed, and working AI into the grading process as necessary.My job has gone full tilt into AI development recently so it's going to be more and more of a thing.",danielfrances,2026-02-21 03:54:30,10,dataengineering,t3_1rag36f,False,
o6jx7sg,"It’s something that I think about sometimes, I’m currently looking for work and I’m competing with candidates who might be using AI. Now if I don’t use it, I’m at a massive disadvantage and at serious risk for not being considered. If I do and get caught, I risk my competency being questioned - most likely by people who are using AI to do their jobs!So what do I do? I’m gonna roll the dice and use it.",ipohtwine,2026-02-21 04:56:58,11,dataengineering,t3_1rag36f,False,
o6k4jvu,"Yeah, asking questions in interviews isn’t really a good way to gauge a candidate’s fit anymore since everyone just uses AI. I prefer throwing all of the potential candidates into a pit of lions and seeing who survives as a first pass to see how they perform under real world pressure. I suspect most companies will be moving to this hiring model in the future.",ypressays,2026-02-21 05:55:26,6,dataengineering,t3_1rag36f,False,
o6jx82h,"""HR uses AI, I used AI, the job uses AI. Everyone else loved this person. But my gut says fuck this candidate for using AI, so I torpedoed it.""100% this person has never been challenged in therapy and it shows, and they will be back in a decade in another sub asking why their children won't talk to them anymore.Candidate dodged a bullet.",codykonior,2026-02-21 04:57:01,29,dataengineering,t3_1rag36f,False,
o6rfma8,contract cto is already a yellow/red flagbeing ignored entirely is a red flag.cto trying to make sweeping architectural changes within weeks of joining without understanding the context is a red flag.i think you can see already that there isn't much hope in this situation which is why you're gonna update your resume. I wouldn't waste my time too much trying to make their life any easier if they've already been ignoring you this much so far - they're just gonna ignore whatever output you give them. why waste your energy that could be spent on literally anything else?,ThroughTheWire,2026-02-22 12:32:34,235,dataengineering,t3_1rbk3ov,False,
o6rffvm,"If the CTO intends and succeeds to migrate to Google it'll take a long time and you'll have a job at least for that duration of time. Use that time to start looking for work. The CTO has come into this job thinking you are the problem. Not much you can do about this, I'm sorry it's happening. Usually, when migrations to new stacks occur, they focus on hiring experts in that stack, which is why he's writing you off early.",financialthrowaw2020,2026-02-22 12:31:09,138,dataengineering,t3_1rbk3ov,False,
o6remoj,"Reading your post at face value, it’s pretty common for C-level executives to show up on the back of whatever he’s heard interviewing (data issues, we need to leverage data more, it’s hard to get a data picture bla bla) and get frustrated in an unfamiliar situation. Second system syndrome is incredibly common at all levels.You can try to document everything, and particularly provide metrics around how things are running to make a case that it’s actually in hand. I would assume there’s a deeper issue with data access that you aren’t fully informed about, so you might not even know what you’re arguing against.Ultimately these decisions are completely out of your hands, a C-level executive that’s recently hired has absolute authority to start changing things entirely by opinion. It’s going to take several quarters for wrong decisions impact to be felt to the point of them being blamed for them.If your new CTO doesn’t buy what you’re selling, and you’re not willing to go along for the ride with an open heart, absolutely look for the quickest exit.I say all this as the C-level executive. It’s also very possible the new CTO is seeing/know something you don’t, and what you’re reacting to is the first step in a long term plan that they themselves can’t clearly articulate because they are new.If you do stay on, you should try to build a new relationship and pull in the same direction for the next year before passing judgement. Good luck!",kitsunde,2026-02-22 12:24:37,47,dataengineering,t3_1rbk3ov,False,
o6rcl48,We had this with a contract CTO who could talk the talk but.... Anyway it took a good 18mths for the CEO to get rid. If you have other contacts in C suite keep those active and open.,reditcyclist,2026-02-22 12:07:48,83,dataengineering,t3_1rbk3ov,False,
o6rfhc0,"Ride it out. Contract C suite don't last long. He's just playing the game spreading butter on the toast until his time is up. Nod, smile, and you'll outlast, and likely absolutely nothing will change.",codykonior,2026-02-22 12:31:28,21,dataengineering,t3_1rbk3ov,False,
o6sfhax,I feel like every time a new CTO comes in they have to change things for the sake of changing things in order to justify their own position.,reviverevival,2026-02-22 15:55:55,25,dataengineering,t3_1rbk3ov,False,
o6s97t6,"I have seen this before. My advice - if the CTO won't talk to you, you are cooked. I am sorry to say it, but he is already planning to get rid of you, otherwise your input would be valued. Don't assume that a long tenure of good work, or good relationships elsewhere in the company, will save you - if your reporting line is against you, it's over (unless you can move laterally within the org, but you would likely have to substantially change roles to get out from under the CTO.) Your performance reviews are about to get worse as well, due to downward pressure to push you out. They do not have to be fair, and defiance is pointless - if the CTO wants it, a ""case"" will be built for removing you, even if it takes months or years.The safest bet is to update your resume and reach out to contacts you trust. Presumably you have those, from former coworkers happy with what you accomplished. It is far easier to change your environment than to change the nature of a CTO who is not interested in engaging with you on goals, tech, costs, etc. on their merits. I am sorry you are dealing with this, but you should not pass up outside opportunities while holding onto ""hope"" that something gets better there.",Hulainn,2026-02-22 15:27:04,16,dataengineering,t3_1rbk3ov,False,
o6sbd68,"In BI your most important job security is making business friends in high places who either directly benefit from the value of your work or see you as an ally pushing the company in the right direction.One thing you didn't mention is how the business perceived all of this ELT framework and Power BI model. Does everyone in the company use it every day? How long does it take to make a change? Are they knocking down your door asking for more?If all you have is a tech stack and your own interpretation of the value you provide, you are going to be easily waylaid by either a smooth talking chav or someone who actually can potentially 10x a company.Tale as old as time.",kthejoker,2026-02-22 15:37:22,13,dataengineering,t3_1rbk3ov,False,
o6shm45,"The fact that they hired a contract CTO kind of tells you all you need to know. He’s going to try and make big bold moves so he either gets a good recommendation for his next contract role and maybe a bonus or he’s making a big bet so that he can become full time cto. You’re in his way with your common sense objections based on experience and fact. And there’s nothing you can really do about it. Leadership is taking a big swing on this guy and they need him to succeed as much as the guy himself wants to “succeed” and they want to move fast. That contract is a constraint that ensures he’ll put his head down ignore the things that usually slow teams down (like rationality) and do something “bold”Don’t waste your energy. Document everything,earn what you can (GCP on your resume is a good thing) and get prepared to leave.",TodosLosPomegranates,2026-02-22 16:04:49,12,dataengineering,t3_1rbk3ov,False,
o6t21da,"In my experience a contract CTO's mission is to hire as many people from their company as possible, until they are fully embedded and hard to remove.I'd start looking for a job.",RBeck,2026-02-22 17:37:28,8,dataengineering,t3_1rbk3ov,False,
o630y9j,"Are you interested in transitioning into Data Engineering? Read our community guide: https://dataengineering.wiki/FAQ/How+can+I+transition+into+Data+Engineering*I am a bot, and this action was performed automatically. Please [contact the moderators of this subreddit](/message/compose/?to=/r/dataengineering) if you have any questions or concerns.*",AutoModerator,2026-02-18 17:02:33,1,dataengineering,t3_1r88m8b,False,moderator
o632lz1,"Not every company has people doing actual data engineering - there are a lot of unclear boundaries and oftentimes folks end up doing 3 jobs in one: data engineer, analytics engineer, and analyst (some roles specifically state building dashboards for end users)",SuperTangelo1898,2026-02-18 17:10:09,251,dataengineering,t3_1r88m8b,False,
o635a5y,"In short, nobody walks into a house and praises the plumbing, which is an easier field than most trades but requires more knowledge than your average handyman, and some people *need* that praise and glory.I see it as an important role that software engineers don't want to do, and that basic analysts aren't technical enough to do (or that it's too time-intensive to do whole-ass, rather than half-assing two roles).You're invisible to the higher ups, but your immediate leadership knows you're essential, so your job is secure but thankless. I don't care about my org or what they sell, so that's fine by me as long as the money comes into my account so I can enjoy life....but others need a gold star and kudos and ""feeling like they make a difference"".",MakeoutPoint,2026-02-18 17:22:10,153,dataengineering,t3_1r88m8b,False,
o636rau,"I enjoy data engineering. I switched into it from database administration 6 years ago because I felt (pretty rightly, in retrospect) that database's would become automated quickly, and data engineering would be the more robust job market. Keep in mind that reddit is largely an area for complaints, arguments, and regrets. You simply are not going to encounter a lot of people here that post ""Data Engineering is A-OK!""",Orzhov_Syndicalist,2026-02-18 17:28:53,42,dataengineering,t3_1r88m8b,False,
o6322vx,Confirmation bias maybe. A lot of people who got into it and found that it's one of the least glamorous roles. It's a weird niche without a lot of understanding from other people what all it can entail. So you've got a weird bucket of weird expectations that has attracted a lot of weird people. And here we are.,Evilcanary,2026-02-18 17:07:44,80,dataengineering,t3_1r88m8b,False,
o636zbt,"Well it is the most needed role is my opinion.The key is that the role often is placed in a company with small amounts of data, with the ambition to use the most expensive marketed product, where your creditcard is the limit. Or you end in a company on a budget where you have large amounts of data. Here you learn to be good, while the first is where you learn to be a consultant :face_with_tears_of_joy:But my experience, the business starts by hiring data science / “ML” experts and then they find out they need data. At this moment the salary of the experts is ticking, so when the data engineer comes in, he/she is already behind schedule. Therefore you will never be successful.I think a lot of newcomers experience this. While the data science people will always be against you, because it is easy to blame the data engineer.",PeitersSloppyBallz,2026-02-18 17:29:53,21,dataengineering,t3_1r88m8b,False,
o631upr,"I'm not entirely sure if that's the sentiment. I've been watching the sub on and off and have seen more posts about people swapping roles to data engineering. Honestly regardless, you're gonna find people that burn out from data engineering or any role in general.",stuckplayingLoL,2026-02-18 17:06:41,15,dataengineering,t3_1r88m8b,False,
o632s02,A lot of people get into DE by accident and the end goal for them is to ultimately be on the model building side,andrew2018022,2026-02-18 17:10:53,28,dataengineering,t3_1r88m8b,False,
o636mxq,"I feel like as a DE you are kinda stuck as a middle man, which is frustrating. There is a lot out of your control and trying to organize all these sources and destinations can be painful.",Phantazein,2026-02-18 17:28:19,13,dataengineering,t3_1r88m8b,False,
