id,body,author,created_utc,score,subreddit,parent_id,is_submitter,distinguished
o6fs587,"1. Sounds like it worked *just fine* and you learned a ton. I mean, to quote you,>it was genuinely one of the best learning experiences I've had2. Your project may have been ambitious. But that's part of the learning, too.Also, you say:>If someone had told me upfront that constant breakage is the mechanism and not a sign I'm doing it wrong I would have panicked so much less in week one.That's just development. That's what development *is*. It's not ""oh, I know exactly what to do and it's going to work the first time"". It's figuring out all of those little things. Eventually you really realize this, and learn to start with the smallest possible end-to-end increment you can, and build from there. That's Gall's Law - a complex system that works inevitably is an evolution of a simple system that worked.",robhanz,2026-02-20 15:37:55,83,learnprogramming,t3_1r9xyd0,False,
o6q751k,"lol the scraping journey is so relatable. my first real project was almost identical - price tracker for sneaker sites. same exact arc: requests + bs4 works great, then you get blocked, then you're down the rabbit hole of rotating headers, proxies, handling inconsistent html across page types...the blocking part killed me too. spent a full day convinced my parser was broken before realizing the site was just serving captcha pages. got some residential proxies sorted out (been using Proxyon, works well enough) and that fixed the blocking, but then three new problems showed up immediately lol.honestly though you nailed it - the breakage is the mechanism. wish someone told me that earlier too.",scrapingtryhard,2026-02-22 05:42:25,58,learnprogramming,t3_1r9xyd0,False,
o6fp9en,"Confused what you’re asking for. Sounds like you are saying that tutorials don’t teach you enough, and that you learned a lot in two weeks by choosing a project and building it, _especially_ learning when it breaks or you hit the edge of your knowledge.You even hit on “constant breakage is the mechanism”…confused what you thought building software was if not constantly fixing broken things, pushing at the edges and building your knowledge up brick by hard earned brick?“A project that teaches you something” - are you clear about what it is you want to learn?If I want to learn about network security but I choose to remake Trello, my learning goals probably won’t be met.TL;DR - yes, build something is great advice. The breakage is the point, as you said. Choose a project that reasonably aligns with your learning goals.",skol_io,2026-02-20 15:24:12,47,learnprogramming,t3_1r9xyd0,False,
o6frrj4,"You don't really explain why ""just build things"" is bad advice. It seems like you learned a lot by just building things.",zeocrash,2026-02-20 15:36:09,24,learnprogramming,t3_1r9xyd0,False,
o6fp249,"the irony is you just proved ""just build projects"" right while complaining it didn't work. the breakage \*is\* the lesson. you learned more debugging apartment scrapers than you would've from 50 tutorials that pretend code works perfectly. the real bad advice is thinking projects should feel smooth.",kubrador,2026-02-20 15:23:15,44,learnprogramming,t3_1r9xyd0,False,
o6fpkaj,I'm like 80% sure this is an LLM and not a real person.,throwaway6560192,2026-02-20 15:25:39,65,learnprogramming,t3_1r9xyd0,False,
o6go0vl,"What you describe is exactly like the job you are planning to do.For maximum realism, have a friend give you the requirements and then change them twice a week while you're trying to code.",ismokedwithyourmom,2026-02-20 18:04:39,10,learnprogramming,t3_1r9xyd0,False,
o6fw2uu,Sounds like you learned quite a lot.,PseudocodeRed,2026-02-20 15:56:23,9,learnprogramming,t3_1r9xyd0,False,
o6wnxom,I've been on a couple teams where I was literally one of the only people to touch a debuggerLike they'll just sit there for 3 hours adding more console.log() everywhere so they can sift though 30 pages of text instead of just attaching the debugger to the container already running in dev and walking a couple steps up the call stack.,aleques-itj,2026-02-23 05:48:55,422,learnprogramming,t3_1rc912a,False,
o6wnc30,"For new people I’d say problem solving and figuring it out. It’s important to be comfortable even when you are in unfamiliar territory.For juniors who have a little more skill, I’d say understanding the problem and googling well. By googling well I mean not just the first result, but I’m talking search results deep to the point where there’s someone that dealt with the same issue 13 years ago in some stack overflow post. Yes, I know AI can help as well but I would confirm what the AI says before following it.",Ok-Advantage-308,2026-02-23 05:44:03,116,learnprogramming,t3_1rc912a,False,
o6wrp9a,times are a bit different now but I was slightly surprised how many people in the field doesn't read official documentations. I know there might be language barrier but at least try to the browser translate tool. Reading medium guides seems to be more preferred (pre-AI days) over official docs,chhuang,2026-02-23 06:20:43,30,learnprogramming,t3_1rc912a,False,
o6wn1co,"Implementing secure code, like you wouldn't believe",2hands10fingers,2026-02-23 05:41:37,83,learnprogramming,t3_1rc912a,False,
o6wovy8,"Basic architecture. As in planning your structure before you start coding. You can get away without it in small apps or scripts, but in larger ones you can't, doing it up front prevents falling into the pit of technical debt too far too quickly",7YM3N,2026-02-23 05:56:48,17,learnprogramming,t3_1rc912a,False,
o6wqtmx,"Research and problem solving skills.People seem to think that if they learn what a for loop is and where to use brackets, then they know everything there is to know about coding.However there's a lot of research involved too, as well as problem solving skills.You want to make a chrome extension? Well first you need to understand how they work and how you will deploy your code. Then you need to work out what steps you need to take to solve your problem.After that, actually writing the code is the easy bit.",Middle--Earth,2026-02-23 06:13:10,31,learnprogramming,t3_1rc912a,False,
o6wraea,Debugging & breaking problems into small steps. That’s what turns a beginner into a professional.,Useful_Potential4648,2026-02-23 06:17:10,11,learnprogramming,t3_1rc912a,False,
o6wu5ij,"""Just do it"" mindset. Many people are either afraid of being wrong, wanting to produce the perfect solution from the get-go or just plain too lazy/passive to fill in details by themselves.Like when being told that the new feature will need this data from that system, even when told to ""use this API"", many would blankly stare and ask how to do that. Sir, refer to the standardised API docs then work up from there - there is literally no difference between me or you looking at the auth section.",lonelymoon57,2026-02-23 06:42:18,11,learnprogramming,t3_1rc912a,False,
o6wpyot,"Git beyond the basics. Everyone knows git add/commit/push but so many people panic when they need to rebase, resolve merge conflicts, or cherry-pick commits. Had a group project last semester where two teammates literally just avoided Git entirely and sent me files on Discord lmao.",Popular_Noise_5189,2026-02-23 06:05:47,7,learnprogramming,t3_1rc912a,False,
o616qqg,"Absolutely! People focus way too much on making ""useful"" or ""productive"" apps.Video games are in no way a productive use of time, but they're fun as hell. Programming (as a hobby) should be the same way. Make fun shit. It doesn't matter whether it's useful to anyone as long as you enjoyed making it.",Cybyss,2026-02-18 10:56:58,109,learnprogramming,t3_1r7zpsv,False,
o61xlps,Guy at work once showed me his lottery number generator project. I will never forget the look of humble pride on his face as he clicked the generator button again for one more spin.Write what you like.,grayston,2026-02-18 13:55:45,28,learnprogramming,t3_1r7zpsv,False,
o618x9g,As a wise man once said..._Do or do not... there is no try_,rupertavery64,2026-02-18 11:15:26,33,learnprogramming,t3_1r7zpsv,False,
o6163gz,"you finally broke the tutorial prison, congrats. turns out the secret to learning was just... learning instead of watching other people do it.",kubrador,2026-02-18 10:51:33,32,learnprogramming,t3_1r7zpsv,False,
o61d7on,"Generally, when I get in the mood to do some coding, if I’m looking for inspiration for a project I look to the computer games I play. I play a lot of RPGs and sims etc. so there’s always some handy little tool I can make. For example a world of Warcraft character database app. Forms to enter my character names, levels, race, class, gold balance, long term goals to work towards, for example tracking outstanding pets to collect in a zone. There’s always something to add, like an item level tracker, inventory of BOE weapons and gear in the bank etc. Before you know it you’re learning about and using all kinds of variables, making functions and classes, learning about frameworks, accessing databases, making it web accessible etc.",Wolfeehx,2026-02-18 11:49:24,7,learnprogramming,t3_1r7zpsv,False,
o61a8xy,There's no such thing as a useless project as long as you are learning and practicing.,kongwahenergy,2026-02-18 11:26:14,5,learnprogramming,t3_1r7zpsv,False,
o645eea,"Programming single-handedly curbed all of my impulsive ""let's start a project only to leave it unfinished (*thanks*, ADHD)"" spending. The only annoying part is the realization that you still know nothing even after spending *n* hours/days/weeks/months/years of your time :zany_face:.",Atlamillias,2026-02-18 20:03:53,3,learnprogramming,t3_1r7zpsv,False,
o62r8j2,my first app was useless also. It was a calculator that figured out the amount of ingredients needed to make a specific amount of iced tea :face_with_tears_of_joy: :face_with_tears_of_joy: :face_with_tears_of_joy: It def worked well and I still use it to this day.,op4,2026-02-18 16:18:42,3,learnprogramming,t3_1r7zpsv,False,
o637pkx,Half of programming is realizing the useless thing is actually how you level up.,Different_Pain5781,2026-02-18 17:33:13,2,learnprogramming,t3_1r7zpsv,False,
o641q4n,"I think that's awesome and most of the calculator apps out there are badly in need of an upgrade from Texas Instrument days, which they all strangely seem to still emulate.I wrote my own CRM in and now it's fully customized to a sales workflow, has dynamic scripts that populate for each client with name and info from the lead source. I can easily add or modify these scripts using a regular text file and put the fields I want in with {{ label }} tags and it will replace them with customer record data. I can just add a template file to a directory and it'll use it. That builds the texts I can bulk or individually send out. As I work, it dynamically keeps track of my availability across the day and updates the scripts for me on the fly as my schedule fills up.Although it has some required fields in the single SQLite table it uses, like first name, last name, phone, status, but other than that, it can import any csv file with at least those field names into it and it'll just slurp up whatever and show the fields from the csv in the GUI. It also has a customized note taking page where I can put the customer's data into a UI and it'll save is as a json document in a directory and attach the name of that file to the client record. That document is also a json document, so I can modify it without coding anything and those fields in the notes are not on the client record directly and they don't need to be. I could of course add them later to any data structure I want if I want to.Also, now I can parse PDF files for data, match them to a record and update the database and attach the now renamed pdf file to that client and open it in a window from the gui. I can also create a new record if one doesn't exist, or just fail and spit out a not found. Whatever I need it to do at the time.That pdf view window dynamically changes to the corresponding file if I change customers in the gui by selecting, hitting the next or previous client or page buttons, and doesn't break if it's not there, it just happily displays there's no pdf file found for that one.It also has color themes, a dark, light, slate, blue and pink themes. These are CSS files and if you want to add one you just drop it in by the name light.css, dark.css into a config directory and it'll pick it up and let you select that from the menu and save it so it always uses that theme until you change it again, with all the other config options that you set as well. They all stay active until changed across runs.It can build lists I can use for bulk texts or anything else I can dream up for it. I can just code that in.As I built it and made changes, I just kept adding the ability to customize it from the way it used to work, to the new capability. So, it basically just gets more and more powerful over time. Everything it could ever do, it can still do perfectly fine.It's awesome and it's 100% mine, 100% free, and 100% not on the cloud, it doesn't even use a web browser either, although it easily could, but I like that it doesn't for now.Would it pass corporate IT coding standards. NOPE! I wrote them so I know, NOPE! and I like it that way.Is it easy to use - Yep.Is it user friendly - Nope.Is it well documented - other than the code is clearly written - NOPE. lolThat's (Hell\^Nope)Did I vide code it? Kinda. I've got plenty of experience writing software. Big software. No direct experience writing anything quite like this before. It's got the simplest data model I've ever used in any DB lol. There's a lot of room for more things it could do here in the future if I get around to needing it. For now, I just don't.I started with free AI because I didn't know a some of the available API's and I wanted to try them out. I went through a few of these before I found one I liked and wanted to work with. AI got me off the ground with them,I got amazingly far down the line of a prototype and before I knew it, I had something basically working. As I kept adding more capability however, it quickly ran out of context area and now gets lost and makes so may errors and just poor coding choices I rarely use it anymore. The cool thing is I don't really need it now. I learned the API I landed on and I'm comfortable taking it from here. I also got a very good idea of what AI can and can't do these days as well.Replace coders and people with technical skills? Maybe some junior slog roles. It can be used to write slog job automation that would have otherwise been way out of scope and not cost effective.What are you going to replace them with? Don't even tell me business analysts. Don't even think about telling me corporate executives or nepo babies. They don't know their ass from a hole in the ground and AI isn't going to help for that. They can't bully a robot caddie into ignoring that extra swing and a miss. I wonder how they make it through the day without dying.",JudgeB4UR,2026-02-18 19:46:58,2,learnprogramming,t3_1r7zpsv,False,
o69pm7f,"I’ve been trying to get better at “tooling” stuff (git, shell, editors) and it’s always the part I procrastinate. For the 2026 run, what’s the expected baseline and time per week? Also, do you recommend watching in order or picking modules as needed?",AtlasCourier_8,2026-02-19 16:57:57,31,learnprogramming,t3_1r93yk6,False,
o69wwxq,"Saw the old version yesterday and was just about to start today. This is great, thank you so much!",Gildishxchambino,2026-02-19 17:32:59,7,learnprogramming,t3_1r93yk6,False,
o69wwno,Neat. thank you.,dialsoapbox,2026-02-19 17:32:57,3,learnprogramming,t3_1r93yk6,False,
o6ch5ly,I have had this on my bookmarks and on my browser Tab since 2020 !Stoked that this new 2026 course is just released !May this year be the time i finally learn and complete this mit missing semesterWish me luckSuper awesomeThank you all for teaching and uploading :folded_hands:,kaboomzxc,2026-02-20 01:29:40,3,learnprogramming,t3_1r93yk6,False,
o6d5863,"When I was learning, the thing that accelerated my progress the most was building projects slightly above my skill level. Not impossibly hard, but enough to force me to look things up and problem-solve.",PushPlus9069,2026-02-20 04:00:51,3,learnprogramming,t3_1r93yk6,False,
o6dlkps,"Big ups to this series. It really fills in the gaps that a LOT of CS curriculum seems to sweep under a rug or avoid entirely. As someone who jumped into tech at 40 with very little formal education in CS, I was so confused when college professors at my local university couldn't explain these concepts well, yet were trying to teach smart pointers. I'm now a 2nd year sysadmin in IT & this series has been great for me. Thanks!",dylsey,2026-02-20 06:05:24,3,learnprogramming,t3_1r93yk6,False,
o6ao8t1,"Amazing, thank you!",hypercosm_dot_net,2026-02-19 19:42:21,2,learnprogramming,t3_1r93yk6,False,
o6eedyw,"the original missing semester is legitimately one of the best free resources for practical programming skills. shell scripting, vim, git internals - stuff you use every day that almost nobody teaches formally.",Hot_Western_4495,2026-02-20 10:31:26,2,learnprogramming,t3_1r93yk6,False,
o6ar86c,"Nice work, this should be mandatory for any program that makes serious use of computers.At this point I've only had a few minutes to look the material over, but have some suggestions for you.1. In many segments you focus on one solutions such as git. However you should make a point to highlight a number of similar systems. The idea is to make students aware that there are many options. Covering the common solution is find after highlighting that students have lots of options. I actually like that GIT and VIM coverage as good introductions.2. I'm still of the opinion that everyone needs to learn VIM, as a command line tool, to some extent. It is the VIM is everywhere base reality. However in the modern world using the command line environment with a GUI editor of choice might lead to more productive students. I'm not even sure students grasp that command line control can be mixed with GUI apps. This may be personal thing but I find GUI based editors far more productive. So in the same regards a paragraph that list out a few alternative command line an and GUI editors to inform students makes sense.3. A port for compiled languages or an additional segment within this package, would be useful for programs that don't use Python. A focus on C++ would be advisable as the use of GCC is similar for many languages. The idea is not to teach the language, but to teach how programs are built with compilers. Like I said only a very brief view of this site, but guys it looks like it covers much of which sidelines students at the start. In fact this sort of stuff should be covered in a high school prep course.",spinwizard69,2026-02-19 19:56:37,3,learnprogramming,t3_1r93yk6,False,
o6rykl8,"Get ready to be disappointed in the behavior of your creation. Be ready to wipe out the whole project in a deluge because that is easier than fixing the codebase; we call this a ""rewrite"".",Justin_Passing_7465,2026-02-22 14:32:26,135,learnprogramming,t3_1rbn3v4,False,
o6s1cnf,Congratulations it’s a great feeling and a big first accomplishment in programming!,rainyjazzdays,2026-02-22 14:47:15,30,learnprogramming,t3_1rbn3v4,False,
o6ss7rm,"Yep, I know the feeling, 3 years ago now. Frontend php, backend java and MySQL as dB. Now I write CRUD stuff all the time for my job, but still the one first project really stuck with me",alexppetrov,2026-02-22 16:52:04,21,learnprogramming,t3_1rbn3v4,False,
o6skiu4,Crud gives you a different high when your start. A confidence that you can build something legit. All the best.,sagarp96,2026-02-22 16:17:24,12,learnprogramming,t3_1rbn3v4,False,
o6rx9a2,congrats!,RubbishArtist,2026-02-22 14:25:09,6,learnprogramming,t3_1rbn3v4,False,
o6t6uiq,Congrats! Remember this moment when dunning-kruger hits you like a truck a few years from now.,Antosino,2026-02-22 17:59:39,6,learnprogramming,t3_1rbn3v4,False,
o6s05c7,Awesome. Go get a beer bro,yyellowbanana,2026-02-22 14:40:54,7,learnprogramming,t3_1rbn3v4,False,
o6t29th,The feeling never goes away for me,CzarSisyphus,2026-02-22 17:38:37,3,learnprogramming,t3_1rbn3v4,False,
o6tre2g,Millions of people have also tried and given up,Routine-Soup-4100,2026-02-22 19:35:32,4,learnprogramming,t3_1rbn3v4,False,
o6tzwup,"That feeling is real and you should ride it, but make sure you actually deploy it somewhere people can access it. Most first CRUD apps work great locally and then immediately break in production when you hit edge cases nobody planned for.",Bartfeels24,2026-02-22 20:18:17,5,learnprogramming,t3_1rbn3v4,False,
o6yz7jt,It’s all fun and games until that temporary code is pushed into production for a decade because there wasn’t enough time,AHardCockToSuck,2026-02-23 16:06:43,212,learnprogramming,t3_1rckydz,False,
o6yy0f9,Pick a task. Make it work. Refactor before submitting to final version.,normantas,2026-02-23 16:01:07,60,learnprogramming,t3_1rckydz,False,
o6yz7js,"Like writing text, you have a ""shitty first draft"".",Suspicious_Tax8577,2026-02-23 16:06:43,23,learnprogramming,t3_1rckydz,False,
o6z0959,"""premature optimization is the root of all bug""Luckily when I was a Jr I had some great sr devs to learn from. For me, my goal was to just get something working so we could all look at it and then do a code review. I think it's important when someone is learning to see what they are thinking for a solution and working from there versus doing it someone elses way first and things like clean code are someone elses way. Unless you naturally write clean code, you need to write shitty code and learn from it.And sometimes shitty code is good enough; sometimes shitty code now is better than perfect code tomorrow.",Soft-Marionberry-853,2026-02-23 16:11:35,14,learnprogramming,t3_1rckydz,False,
o6za3fu,"Neither 8 or 80. You cant optimize ""after you're done"", there wont be anyone paying your time to do that if it already works.You need to clean it as you go, and your starting state is increasingly better with experience; not a single giant god-file of procedural code.That then takes you to the next trap. Once you've finalized one use-case, you want to refactor it, because now you can do it ""better"". That's a trap, you'll need to learn to accept ""good enough"" somewhere along the way and take your lessons to the next project instead of getting stuck in this loop.With that in mind, I actually think this is bad advice. I prefer devs who think a little before coding. Knowing your context boundaries can already help you structure your implementation greatly; starting with something like hexagonal is not slow anymore, it's fast and you can use scaffolders for it; openapi generators if you're using good structure will also accelerate API exposure AND consumption; so you arent over-engineering it if it took you 1 hour to setup and saved you 50 hours of refactors or bug-hunting as you implement, while simultaneously making it easier to change.You write code once and read it 100 times. Optimize for readability from the get-go, and continuously improve as you go.17YOE here.",Laenar,2026-02-23 16:57:08,22,learnprogramming,t3_1rckydz,False,
o6zfdca,"30 yr senior dev here. I will go a step further: never even try to commit to any sort of architecture. Solve the problem at hand, not a possible problem in the future. Stay open to any architecture change. No code is holy: everyrhing can be changed. But, and this is the hard part that needs experience, always look.at the big picture, make sure all components work together in a way that makes sense and all dependencies keep working.Yes, there will be design patterns and such, but much more powerful are generic principles and practices. Like keeping data as local as possible, separating state from presentation etc",nightwood,2026-02-23 17:21:58,6,learnprogramming,t3_1rckydz,False,
o6ywceh,why does 4 out of the 10 things you've ever written on Reddit start with 8 YOE Senior Dev here?,scandii,2026-02-23 15:53:22,16,learnprogramming,t3_1rckydz,False,
o6zlzn3,Make it workMake it goodMake it fast,BARDLER,2026-02-23 17:52:54,5,learnprogramming,t3_1rckydz,False,
o6zxwpj,I wish I learned this way earlier thank you,Tatrakrad,2026-02-23 18:47:10,3,learnprogramming,t3_1rckydz,False,
o70h70x,"Sure, but the problem is you're conflating ""messy first draft"" with ""no thought given to structure,"" and those aren't the same thing. I've seen juniors write completely unmaintainable spaghetti because someone told them iteration beats planning, then spend weeks untangling it when requirements actually changed.",Bartfeels24,2026-02-23 20:17:06,3,learnprogramming,t3_1rckydz,False,
o6qjkqn,Github,papershruums,2026-02-22 07:34:08,508,learnprogramming,t3_1rbfkme,False,
o6qmqlk,Seems weird that the prof would want you to store your work on the lab computer. We had scripts (cron jobs) that cleaned lab computers to prevent code (and data) from filling up the hard drive. You would have to be a privileged user just to have any hope that your stuff would be there for very long.,GeneralPITA,2026-02-22 08:04:08,126,learnprogramming,t3_1rbfkme,False,
o6ql7u0,Anywhere. You can store on a flash drive. You could store on github. Also onedrive or googledrive.,AwesomeRealDood,2026-02-22 07:49:46,53,learnprogramming,t3_1rbfkme,False,
o6qnj3i,"If I ever end up teaching software development, source control will the first thing I teach.",Robodobdob,2026-02-22 08:11:34,18,learnprogramming,t3_1rbfkme,False,
