id,body,author,created_utc,score,subreddit,parent_id,is_submitter,distinguished
orbtbou,"If you're self-learning IMO it makes more sense to do project-based learning because you'll be more likely to stick with it and internalize it in a practical way.Pick something relevant for the career you're aiming for. Some topics which might be interesting depending on what you want to build are linear algebra to draw vectors, graphics, physics(I first properly put this to use to simulate/visualize radiowaves interacting with surfaces), boolean algebra(can be used to simplify lengthy conditions) and combinatorics(can be useful to calculate odds of certain outcomes)",Plenty_Line2696,2026-06-12 23:58:56,2,learnprogramming,t3_1u4aui4,False,
orc1ryg,Discrete Mathematics as others have mentioned; it is the foundation of how computers work.,pat_trick,2026-06-13 00:49:18,2,learnprogramming,t3_1u4aui4,False,
orco9nj,If you plan on touching 3D rendering in any sort of way get really really familiar with linear algebra. I took it in college and I still don't know why calculus was a prerequisite. Its an incredibly useful field of mathematics and it is so much easier than everything that came before it.,MrMagoo22,2026-06-13 03:05:59,2,learnprogramming,t3_1u4aui4,False,
orcu419,Maybe look here — https://teachyourselfcs.com/#math,Byteman2021,2026-06-13 03:45:31,2,learnprogramming,t3_1u4aui4,False,
oqvg6bn,Watching a tutorial is basically just programming by proxy. You feel like you understand the concept until you stare at a blank VS Code window and realize you don't actually know how to start.,QuietApprehensive591,2026-06-10 17:13:20,27,learnprogramming,t3_1u23t57,False,
oqwifgp,"Devils advocate here: If you don't know what you don't know, ""passive"" learning is very helpful to figure out why you might use a tool or even what is possible. A lot of the Udemy courses I watched when I was starting didn't do much to actually teach me about what I was watching, but they did introduce me to what I _could_ build, what tools were available, things to avoid (e.g. goto vs loops). A LOT of the stuff I built, even after that was hot, flaming garbage. You can waste a lot of time coming up with an inefficient solution to something already solved. For example, one of the things I built was a tool to manage SSH connections. I just didn't know ~/.ssh/config was a thing. That isn't to say that active learning time on that project was wasted. I learned what not to do, but you can absolutely go too far in both extremes of never starting anything and jumping in without seeing what other people have done, what tools are avialable, etc.",corny_horse,2026-06-10 20:01:35,13,learnprogramming,t3_1u23t57,False,
oquizrk,agreed,LivingContact6564,2026-06-10 14:48:08,3,learnprogramming,t3_1u23t57,False,
oqv3vvg,"this happened to me with async/await. watched like 6 tutorials, felt solid on it, then tried to actually fetch data in my own project and completely blanked. did you find any specific types of projects that helped it finally click?",National_Big_5168,2026-06-10 16:19:59,3,learnprogramming,t3_1u23t57,False,
oqvr2a6,"100% with you. the thing that made it click for me was building stuff i actually wanted to use — you debug way harder when its your own problem, and it sticks because you keep coming back to the code. tutorials never gave me that.",uberneenja,2026-06-10 17:59:56,3,learnprogramming,t3_1u23t57,False,
oquj3hz,"No such thing as a passive learning. To learn something is to form neural connections in your brain and for the only way to do so is practice and repetition. By reading/watching stuff you only temporarily make yourself aware. Your brain have a garbage collector too, anything you put in disappears in a matter of days unless it's used enough times.",Towel_Affectionate,2026-06-10 14:48:36,2,learnprogramming,t3_1u23t57,False,
oqwonen,Start with pseudo code,TheAnimatrix105,2026-06-10 20:29:49,2,learnprogramming,t3_1u23t57,False,
or0pp3z,"While I passively learn I try to replicate what is being represented. This way I can modify slightly, use previous passive topics and ideas to be used and reinforced. That's what I do.",python_gramps,2026-06-11 12:02:20,2,learnprogramming,t3_1u23t57,False,
oqz6hcz,"Yes that's true; but at the same time you realise how dependent you are on complexity abstraction. Frameworks produce a lot of code you don't understand. Every code base has so much noise in it.Building things the words alone abstract things because you have to understand how your own ideas fit together. That's architecture with consequences. Even something as 'modular' is too abstract until you seeing it play out by real choices.Interestingly, the industry around passive is much bigger than the one around doing. I learned more by interacting with developers than all the videos and tryouts I have been doing. I even might become an accidental programmer.",Mesmoiron,2026-06-11 04:46:36,1,learnprogramming,t3_1u23t57,False,
or1x2wr,"Passive learning does have value. You need active and passive learning. You need active learning for building, and passive learning to understand concepts. For example, active learning alone can't help you grasp how C# works under the hood.",Codechella5903,2026-06-11 15:36:27,1,learnprogramming,t3_1u23t57,False,
or7zn6o,"If I were starting again, I would become an absolute project-building cryptid. The moment I learned a new concept, I'd immediately use it to build something unnecessary, confusing, and strangely ambitious. Learn arrays? Build a sandwich inventory tracker. Learn APIs? Build a dashboard that tracks how often my neighbor's porch light is on. Learn Flutter? Build seventeen apps, including at least one that should never have been an app(this ideas on me pal, go nuts!).People get trapped in tutorial purgatory collecting technologies like enchanted gemstones. Meanwhile, the fastest progress comes from repeatedly smashing your face into real projects until error messages start feeling like old friends. Build things. Then build more things. Then build something so far beyond your current skill level that your IDE begins emitting psychic distress signals.For DSA, do a little consistently instead of trying to consume the entire algorithmic canon in a weekend. For consistency, make your goal ""ship something"" rather than ""study perfectly."" Tiny progress compounds.Big mistakes I would avoid- endlessly planning, endlessly watching tutorials, switching tech stacks every time a YouTuber discovers a new framework, and waiting until you ""feel ready"" to build something. You never feel ready. The code demons simply drag you into production whether you're prepared or not.Build as many new things as possible. Become a factory of weird little applications. Leave a trail of abandoned prototypes across the internet like breadcrumbs. Let recruiters discover your GitHub and wonder whether they're hiring a developer or investigating a cryptozoological event.That's just me though. I learn well by doing when it comes to anything STEM related and during lectures and video tutorials I basically just keep the seat warm as words flow in and out of my head(my brain is the smoothest there is, the info slides right off).",JohnBrownsErection,2026-06-12 13:01:50,62,learnprogramming,t3_1u3uh0n,False,
or9987l,"If I were starting again, My advice is to connect programming with something you actually enjoy.Fun and personal interest are powerful sources of consistency. If you can keep creating output, even small things, you’ll naturally improve over time.So instead of studying programming only as an abstract skill, try to tie it to your hobbies. In my case, I like horse racing, so I build small tools related to horse racing data and predictions. That gives me a reason to keep learning.Also, keep some kind of non-programming hobby, even a simple analog one. Cooking is a great example. You create something, it gets consumed, and then it disappears. That process can even help you think about things like data flow, lifecycle, cleanup, and database design.Run once a week and think. Cook something and make someone happy. If there’s no one to cook for, share the recipe.The key is to keep producing output connected to your real life. That makes learning much easier to sustain.",Hot_Phrase4054,2026-06-12 16:26:38,15,learnprogramming,t3_1u3uh0n,False,
or88k8p,"I'd spend way less time chasing the ""perfect"" course and way more time building tiny projects from day one. Most of my learning came from getting stuck, googling stuff, and figuring out why things broke. The fundamentals matter, but they stick a lot better when you're using them to build something you actually care about.",Mell-Silver-20,2026-06-12 13:46:26,5,learnprogramming,t3_1u3uh0n,False,
or9ulv4,"Assuming zero knowledge, I'd learn the absolute barebone basics of a language and basic concepts and jump into building actual projects ASAP. I got caught up in silly console apps and tutorials for way too long. Build something real, and you will naturally find out what you need to learn next. Also be prepared with early stuff being an absolute mess. It's fine. You'll learn.If you ar very specifically doing this to pursue a career, look at what tech stack is hiring in your area the most, and learn that. If you're doing it as a hobby, learn whatever seems the best for you, whether that's just preference or good tooling for your project.",Noah__Webster,2026-06-12 18:02:17,5,learnprogramming,t3_1u3uh0n,False,
or9l9ub,"100 days of code by Angela Yu, and creating a shit ton of projects.I've been programming for 3 years now, and that one course taught me more than I ever paid for. Without it I would've never gotten interested in programming, forever grateful",KitchenCommercial396,2026-06-12 17:20:42,4,learnprogramming,t3_1u3uh0n,False,
orbrwiy,"If I were starting again (going into senior year of college), I'd have learned how to plan and test more effectively. Data flow diagrams have been a life saver for me to figure out what exactly I want to make before I start working. They cut down a lot on me spending time idly scrolling up and down code and they also help me to document my code too. Okay, what you were posting about aside, the other thing I'd do would be to spend more time in non-CS classes and around non-CS people. I have learned so much from working with, taking classes on, and befriending people in different disciplines, ESPECIALLY the humanities, than I have from taking CS classes. Might it make me less employable in the future? I guess -- I won't learn some skills in a university setting. However, it's given me a lot of sort of soft skills and other good things. Specifically: 1) its helped me find outlets and hobbies I wouldn't have otherwise 2) its helped me to better understand other people and the world around me 3) its exposed me to problems and things that I might be able to fix/help with that I wouldn't have known or been aware of otherwise 3.5) they also has force me to consider what impacts my work can or might have on the world and made me consider perspectives of people I didn't grow up around (ex: handling language, characters, and localization in games/software -- some languages might have non-Latin characters; if you only allow Latin/English characters to be inputted into a field, then what do people who speak those languages/whose names come from them do to fill in that field?) 4) its really helped my social skills, somewhat to be outside of the sphere of influence at times of the stereotypical major of socially awkward boys (or you know -- other descriptors of cs majors which I have found to be somewhat true) 5) it helps you learn how to talk about and explain cs concepts to non-cs-people, because you sometimes try and explain what you're doing. If you did it badly, your non-technical friends will look at you like you just told them that einstein's theory of general relativity was incorrect, and that your theory of something inane and non sensible (idk let's call it duck theory) is accurate. If you do it right, then you will see understanding dawn on their faces. (There is a caveat to this of everyone will expect you to do technical things for them even when you can't but eh you win some and you lose some)This doesn't mean I recommend forsaking all cs classes and only doing the bare minimum, I'm just recommending giving humanities classes a shot, even if you hate writing papers. In part, I believe my experience with the humanities teaching me more is because my college's cs program (which is really good and I love my professors, to be clear) and probably my college as a whole (despite being a liberal arts college) is experiencing a big push (from students and probably others) to focus solely on applicability and job skills. Meanwhile, my humanities courses have been able spend much more time on theory and their respective fields' histories. That's not to say theory is the only way to learn information about a field, but I find that very often in CS, there are times I've found myself reinventing the wheel for things that have already been solved and that I just never learned how to find or search for, because so much of my cs courses silo their content away into just raw ""applicable programming knowledge,"" and don't discuss it in the context of anything else. Meanwhile, most of the humanities courses I have taken explicitly try and cover the breadth of fields the knowledge is used in, and domains of research/academia they cover. These are then things I can fold back into my work in those classes, or even in my cs courses. More importantly, if I want to explore them further outside of class, I then know what direction to go in.And (mostly applying to the paragraph about giving humanities courses a shot but generally applicable to any class -- take this advice) if you need help, talk to your professor, go to their office hours, go to your college's writing center. If they're anything like mine, they'll (your college's writing center at minimum, if not the professors, but don't assume) will want to/be explicitly designed so they can help you do things like plan your papers or to help with research (not do research for you but help you plan out how to do and what to do). Honestly, in general as well, get to know your professors if possible (or at least those you like). Check in with them throughout college. It makes them easier to work with/learn from, it helps them understand you more, and it means you can sometimes get leeway when necessary. Plus, it's very good to get their perspectives about things, and you know, they're people. They might also have connections to people in the industries you want to work in. Of course, I want to go into game development as either a writer or a programmer, and I'm double majoring in English and computer science, so my perspective is also biased, due to how collaborative and interdisciplinary game development can be and also because of the English major. As a result a lot of things I've discussed are most helpful for my endeavors, and possibly less necessary in other fields (though I'd still recommend them, I just can't say for sure that they're as helpful the same way). I hope this does not completely ignore your question and offers a helpful perspective. I apologize for how long winded it is, and how long I spent talking about something that I could easily see how you might not see as an answer to your question.",sociallyanxiousnerd1,2026-06-12 23:50:37,3,learnprogramming,t3_1u3uh0n,False,
ore791n,"Read documentations instead of lectures. Start with a simple, medium and a complex level project in sequence. Some leetcode does help to understand patterns but that’s it.",bhargavamakwana,2026-06-13 10:41:56,3,learnprogramming,t3_1u3uh0n,False,
or93zhi,"First i would take a look on fields and market jobs and pick one career that suits my purposes, then pick one project and apply what i learn from roadmap tools",abdelkaderbkh,2026-06-12 16:03:32,2,learnprogramming,t3_1u3uh0n,False,
orrbced,"Stop trying to cover everything at once. Pick one thing, go deep, ship something. That's it.For DSA specifically, do Neetcode 150 in order. Don't grind randomly. Watch his video, code it yourself without looking, then move on. Thirty minutes a day beats a four-hour session once a week. Metana handles structured pacing well if you want someone keeping you accountable on that front.The Flutter plus Spring Boot combo is actually solid for landing a job. Build one real project that connects both. A full CRUD app, nothing fancy. Recruiters care way more about that than your LeetCode score, at least early on.",No_Leg6886,2026-06-15 09:49:32,2,learnprogramming,t3_1u3uh0n,False,
or847iw,Carpentry or welding,Fit-Ad9820,2026-06-12 13:25:21,2,learnprogramming,t3_1u3uh0n,False,
orlg4fi,"You just... do. Identify the tools/languages that you use regularly that you're weak on and skim the docs, picking out sections you think might be relevant to what you're currently using it for or will be in the near future. You build up knowledge over time and you discover little things that your tools/languages do for you that end up being quite useful.E.g. A coworker was once quite amazed when I sent him a git patch file and an ""apply"" command for lots of changes he was about to make manually to test something that I had already made locally (that would later be checked in but weren't for the time being). He never knew git could parse and apply the output of the diff command like: git diff > some.gitpatch git apply some.gitpatchI found that ages ago by simply looking at the available commands in the git ref docs.I personally can't see how listening to an audio version of a technical document would help you, but it might only cost you half an hour to test it out.",HashDefTrueFalse,2026-06-14 13:22:24,20,learnprogramming,t3_1u5k5w4,False,
orlr1l7,"Listening to documentation sounds like a nightmare ngl.You just open up a page and read it. I got the habit by getting a handful of physical reference books of the language/software I'm using and just flicking trough them for a 10-15 minutes a day. At first it's kinda aimless, then when you're reviewing code/using the software and you start identifying things you've read and get a sense of them in practice. Then eventually you get a larger sense of stuff, start looking for things targeted to what you're needing and suddenly you're reading documentation for hours.",_LordCat,2026-06-14 14:19:51,12,learnprogramming,t3_1u5k5w4,False,
ormbp53,I think a good way to develop this habit is reading man pages.,rias_dx,2026-06-14 15:59:20,5,learnprogramming,t3_1u5k5w4,False,
orll6nc,"I believe knowing where to look and how to search through documeation and find what you need is more important than just reading through it randomly page by page. If there is an architecture document for a project I'm working on, I'll read through it very carefully to understand how everything should work. If I'm working with a new framework or language, I'll read the overview to get the basic idea, but I won't go through and read each function definition, but I know where to look when I want to do something, find the function documentation, and read through it to understand how to accomplish whatever task I want to do.",Zesher_,2026-06-14 13:49:53,3,learnprogramming,t3_1u5k5w4,False,
ormwwxi,You don't read it like a book.,throwaway6560192,2026-06-14 17:39:07,3,learnprogramming,t3_1u5k5w4,False,
orla7f8,"I read docs for around 4 hours a day as a backend developer, coding occupies a substantially smaller portion of your work time the further you progress in your career.",speyerlander,2026-06-14 12:47:57,6,learnprogramming,t3_1u5k5w4,False,
orldze2,Regex search is your friend…,ExtraTNT,2026-06-14 13:10:15,2,learnprogramming,t3_1u5k5w4,False,
orm19n1,"As a tester, reading docs has probably saved me more time than writing code. I rarely sit down and ""study documentation."" Usually it's problem → docs → experiment → repeat. After a few years you suddenly become the person saying, ""Wait, Git can do that?"" :grinning_face_with_smiling_eyes:Written by a human. Bugs included free of charge.",SouroDas,2026-06-14 15:09:39,2,learnprogramming,t3_1u5k5w4,False,
ornkfug,"It's not like a book you read cover to cover. Focus on something small, like hello world. Usually you have a particular problem or use case, so limit your scope to that, don't try to cram everything into your brain at once.",monkChuck105,2026-06-14 19:29:23,2,learnprogramming,t3_1u5k5w4,False,
ornthxn,"You won't be listening the documentation because you can't hear the syntax. You can't hear the diagrams. You can't hear the JSON structure of API requests. etc. Okay, fine, probably there is something for blind people because theoretically syntax and such can be put into words for a blind person to understand it. But it would be weird for a seeing person. Which means, you won't be listening the documentation.Also, a documentation is not a book that you are reading. Some documentation can have thousands of ""pages"" (links, articles, whatever). Some documentation can have outdated parts that contradict with everything else. Some documentation can be unfinished and in works or abandoned. It is not a book.You are looking up information relevant to your cause. That is where you are reading documentation. May it be business use cases. May it be an information related to integration with external service providers. May it be instructions to deploy/run/test something. It all depends on what you are currently trying to do.",mandzeete,2026-06-14 20:14:26,2,learnprogramming,t3_1u5k5w4,False,
oqtnkgz,"I was a kid. We got an Apple ][. It came with BASIC. So I learned to code. I've obviously moved on to other languages. C/C++ on my own. Pascal and COBOL in school. VB, C#, JavaScript, Java, Python on my own. A few other languages along the way.",BranchLatter4294,2026-06-10 12:12:38,11,learnprogramming,t3_1u20999,False,
oqw7rgz,"I bought a book on Python and also did the 100 Days of Python Boot Camp by Angela Yu. Got about half way through it and started coding on my own. I still find I have to go back to the basics and remember proper syntax on things.I had a few ideas and processes at work that I felt could be improved upon but didn't really know how to approach it so I just decided to do it myself. So far so good, the applications I've made are used in various departments. They aren't anything special or spectacular, but they are handy little apps that display data in an easy to read page that you can quickly reference and I keep them updated.",Kwith,2026-06-10 19:13:33,5,learnprogramming,t3_1u20999,False,
oqtnlmn,University and then more specific courses + my owns projects. Now Im trying to solve leetcode problems and improve my english to get a job,champinion,2026-06-10 12:12:49,3,learnprogramming,t3_1u20999,False,
oqtqj4h,"I followed tutorials in BASIC, Visual Basic, C and Assembly - lots of them. I moved on to other languages and to teach-yourself books. I created any number of small demo apps - timers, small static websites, database front-ends and so on. I went on to more advanced tutorials, e.g. writing games with SDL. I don't think you are ever too advanced to learn new languages and libraries by following quite basic tutorials.My general skills only really took off after I had to write more advanced projects for university and especially for work. It can be hard to leap forward unless you have the time and the support of other people. However, it is also important to realise that, for learning, a personal project that fails to reach the goal that you originally set is not a failure overall. It's OK to get to a point where you suddenly realise you screwed it up and then design doesn't work - you learned that it doesn't work.Learning to programme is a process of trial, error and reinforcement of what does and doesn't work. You cannot learn about a language or a library and then be instantly great at writing software with them. No book, tutorial or university course makes you a master programmer.",RealWalkingbeard,2026-06-10 12:29:17,3,learnprogramming,t3_1u20999,False,
oqtrjba,"In the early 80s, I got an 8 bit computer, an MSX. It included a BASIC interpreter, and with the help of the manual I learnt some coding. Then at uni I learnt C (remember Borland C?). Since the programs were compiled, I  was in awe how much faster the programs run.Then I became a LAMP (Linux, Apache, MySQL, PHP) admin in the 90s, on minimum wage. Back then, Linux was for weirdos. ""Real"" admins used Windows NT. I got tired of my minimum wage job, and became a truck driver :person_shrugging:",OwnLunch2133,2026-06-10 12:34:53,2,learnprogramming,t3_1u20999,False,
oqtno88,"I learned it when i was 8, started with basic and then c, c++ and Java. I learned by running games, typed control+break and typed list to see the code, it was easy to make changes and presses run to execute the game and see the changes that I made. Later on my parents gave me books with codelistings and I typed them into my computer and ran the little programs and games.",RobertDeveloper,2026-06-10 12:13:14,1,learnprogramming,t3_1u20999,False,
oqtob3y,"Was always interested in it, decided to take a course in it, ended up being super fun. From then i made some projects and went on to study computer science.Generally in my opinion the most important thing to be able to learn programming is to have fun in what you are making. Think of something you think would be cool to make, and then just try, eventually you’ll have it figured out, made the thing you wanted to make and learned a bunch. All while enjoying the process.",gigagone,2026-06-10 12:16:50,1,learnprogramming,t3_1u20999,False,
