id,body,author,created_utc,score,subreddit,parent_id,is_submitter,distinguished
og6a1ab,"yo. what the fuck.insane risk over reward.worse case scenario is both companies find out, and you get black listed from ever working with them again, and you now have 0 internships in on your resume from them and limited experience.",No-Cranberry-1363,2026-04-14 17:52:48,1,dataengineering,t3_1sl94gk,False,
og9hpfr,the hubris of youth. do not attempt over employment as an intern.,kizoa,2026-04-15 03:39:52,1,dataengineering,t3_1sl94gk,False,
ogh0300,Just take 1 internship and really do well (better to get a return offer this way). It’s way easier to get good at one thing than spread yourself too thin learning many things at the same time.,LilParkButt,2026-04-16 06:04:40,1,dataengineering,t3_1sl94gk,False,
og857hw,…but a bunch of other people do it.i appreciate your take and it’s probably the correct one. Any advice regarding not accepting one and asking for fall/ future internship?,GwHeezE,2026-04-14 23:05:18,1,dataengineering,t1_og6a1ab,True,
ogc9ycv,"i don't see your point... My limited intern experience has proved that internships are not as bad as a loaded semester. I know you don't know me, but I will no life to the max to make sure I am employable in this market. Thus, I see this as a good opportunity with risk of course, but what doesn't have risk associated with it",GwHeezE,2026-04-15 15:07:40,1,dataengineering,t1_og9hpfr,True,
ofxnxwu,"Your post looks like it's related to Data Engineering in India. You might find posting in [r/dataengineersindia](https://www.reddit.com/r/dataengineersindia/) more helpful to your situation.*I am a bot, and this action was performed automatically. Please [contact the moderators of this subreddit](/message/compose/?to=/r/dataengineering) if you have any questions or concerns.*",AutoModerator,2026-04-13 13:25:15,1,dataengineering,t3_1skarlg,False,moderator
ofxqwwt,"For this X amount you should choose to go with X, it totally doesn't make sense to go with X for many x reasons.",vish_a,2026-04-13 13:40:32,6,dataengineering,t3_1skarlg,False,
ofxsxr1,That doesn't seem like that much more to be in office 5x a week.,itsthekumar,2026-04-13 13:50:44,4,dataengineering,t3_1skarlg,False,
ofy9c0j,"I think it matters if you like your current coworkers or not. If you're having a hard time choosing between flexibility and salary, then think about if you could see yourself working with new people. You don't know if your new boss will be good to you, so if your current boss values and respects you, it's probably not worth the change. Or if your current coworkers are rude and cutthroat, it would be worth the risk to get some new coworkers who might be kinder.",no-one-73,2026-04-13 15:06:03,2,dataengineering,t3_1skarlg,False,
ofzumay,"Stick to Tiger, I heard they will provide better hikes as well.",Aggravating_Force228,2026-04-13 19:19:58,1,dataengineering,t3_1skarlg,False,
ofzyb68,This year they did not give good hikes,Rhythm_04,2026-04-13 19:36:43,1,dataengineering,t1_ofzumay,True,
og3q3s0,"Dm you, plz check",Aggravating_Force228,2026-04-14 09:55:56,1,dataengineering,t1_ofzyb68,False,
ogzhkep,"You can find a list of community-submitted learning resources here: https://dataengineering.wiki/Learning+Resources*I am a bot, and this action was performed automatically. Please [contact the moderators of this subreddit](/message/compose/?to=/r/dataengineering) if you have any questions or concerns.*",AutoModerator,2026-04-18 23:37:56,1,dataengineering,t3_1spczw3,False,moderator
ogzleu9,"If you're already a senior DE, then focus on architect related work and courses. If you want to get certs, then go for architect certs which will provide more value as the next steps.",69odysseus,2026-04-19 00:00:29,1,dataengineering,t3_1spczw3,False,
ogzlyby,"Thanks, I had the AWS solutions architect (which recently expired) but I don't feel like it taught me anything meaningful. Perhaps others are better.",insomniafordays,2026-04-19 00:03:45,1,dataengineering,t1_ogzleu9,True,
ogzuvvy,"Sometimes certs don't provide much value as we expect from them. For beginners, they're a checkmark for HR entry gate but for experienced folks, not so much. I have seen people spending around $3k a year on just certs or renewing them.",69odysseus,2026-04-19 00:57:30,1,dataengineering,t1_ogzlyby,False,
oh05w9f,That's insane!,insomniafordays,2026-04-19 02:04:51,1,dataengineering,t1_ogzuvvy,True,
ogb1rls,Bruh asking cursor while presenting a course is something that i wouldn't even fathom doing. I guess standards are low nowadays.,XxDarkSasuke69xX,2026-04-15 11:14:20,284,learnprogramming,t3_1sm2hx7,False,
ogbjajb,the text based curriculum is still solid tbh. the video content def went downhill when they started relying on AI generation,alphadester,2026-04-15 12:59:32,71,learnprogramming,t3_1sm2hx7,False,
ogb70m7,"Never was any good same as codecademy and many others, watching videos wont get you anywhere, you need to read and write",Nok1a_,2026-04-15 11:48:46,67,learnprogramming,t3_1sm2hx7,False,
ogaygpj,"FreeCodeCamp used to hit during Covid times, I learnt so much. However, I agree the courses don't have the same value anymore",SemanticThreader,2026-04-15 10:51:05,24,learnprogramming,t3_1sm2hx7,False,
ogayi45,I heard that line from a uni professor. Guess this shit is an industry standard now,PonosDegustator,2026-04-15 10:51:22,10,learnprogramming,t3_1sm2hx7,False,
ogbgpr8,"Sounds like you’re referring to their video content, which are videos created by many different sources and aren’t really as curated and scrutinized as their main website curriculum. This is expected.Their main full-stack curriculum at freeCodeCamp.org is a masterpiece.",Snugglupagus,2026-04-15 12:45:37,34,learnprogramming,t3_1sm2hx7,False,
ogc5gag,"Yeah, feels like a shift from teaching fundamentals to showcasing tools. Watching someone prompt their way through problems isn’t the same as understanding why things work. It’s useful in small doses, but not great as a primary learning method.",patternrelay,2026-04-15 14:47:37,5,learnprogramming,t3_1sm2hx7,False,
ogelat7,"I actually like freecodecamp overall, but it's basically the TEDx of learning to code. Some of the video authors might be really good programmers but that doesn't necessarily make them good teachers.",SourCreamSplatter,2026-04-15 21:19:11,5,learnprogramming,t3_1sm2hx7,False,
oge4hra,We are not a serious industry,LowFruit25,2026-04-15 20:03:45,3,learnprogramming,t3_1sm2hx7,False,
ogkyt2o,"Hello there~I'm Naomi, the community manager over at freeCodeCamp~I am very sorry to hear that you were not satisfied with this video course. We do our best to provide the most effective coursework we can to position you for success as a developer.AI-augmented workflows are becoming increasingly common in our industry, so it would be a disservice to you all if we did not share information about that.However, I have very much heard your feedback on the quality of this course. If you would like to share the link to the course with me, I will gladly pass the feedback on to our video team~(edit to introduce myself properly~)",naomi-lgbt,2026-04-16 19:42:54,3,learnprogramming,t3_1sm2hx7,False,
ofspv8d,you can start with this repo: [https://github.com/ashishps1/awesome-system-design-resources](https://github.com/ashishps1/awesome-system-design-resources) . It is up to date and starts with basics. Then can try out the skills learned at [rubduck](https://rubduck.ai),Jazzlike-Age-4867,2026-04-12 18:26:31,56,learnprogramming,t3_1sjlhrl,False,
ofskvy1,Start here: [https://www.youtube.com/watch?v=m8Icp\_Cid5o](https://www.youtube.com/watch?v=m8Icp_Cid5o) (System Design for Beginners Course)ps: your age has nothing to do with it.,0x14f,2026-04-12 18:03:20,20,learnprogramming,t3_1sjlhrl,False,
ofsmj11,"except for the very young (pre natal through toddlerville), age isn't very relevant for pedagogical approaches.Anyway...There are myriad tutorials and primers available to you -- many which are free. Search, learn, and have fun!P.S. The youngest typically learn the fastest, especially with languages.",DinTaiFung,2026-04-12 18:10:55,24,learnprogramming,t3_1sjlhrl,False,
ofsluj5,"System design is a bit broad, it depends on how much foundational knowledge you already have. There are a lot of factors to consider depending on the project. Ie. Scalability, performance, security, efficiency, etc.I’d say if you already followed a CS related course, you shouldve already known the basics of it. The rest comes with practice and review. Just dive into projects.Basically, if you know the programming fundamentals then I suggest putting what you learned to practice and if not then there are lots of great and free courses out there that can help you start",CannibalPride,2026-04-12 18:07:47,7,learnprogramming,t3_1sjlhrl,False,
ofw86oc,There's also the age old Designing Data Intensive Applications book that gives you a large overview on scaling and building robust systems,codewiser,2026-04-13 06:57:16,4,learnprogramming,t3_1sjlhrl,False,
ofsxy96,Hello interview is pretty amazing. Good quality content.,koffeeluv,2026-04-12 19:04:24,4,learnprogramming,t3_1sjlhrl,False,
ofsyt4r,"im curious, why does your age even matter?",QuarryTen,2026-04-12 19:08:29,4,learnprogramming,t3_1sjlhrl,False,
ofu8ibu,The same as 18 year olds and 50 year olds,binarycow,2026-04-12 23:00:11,4,learnprogramming,t3_1sjlhrl,False,
ofslarh,I wanna know the same thing :smiling_face_with_tear: . A friend told me to read Clean Architecture by uncle Bob but i havent started yet. Idk if that book is still relevant today,manoh1234,2026-04-12 18:05:15,3,learnprogramming,t3_1sjlhrl,False,
ofsz3tw,"* **NobleProg Nepal:** Offers high-level courses on Microservice Patterns, Domain-Driven Design (DDD), and Software Design & Architecture. These are ideal for developers looking to move into senior roles.* **The Knowledge Academy:** Provides Software Design and Architecture training, including live, instructor-led sessions covering software development lifecycles and architectural patterns.",Aglet_Green,2026-04-12 19:09:53,3,learnprogramming,t3_1sjlhrl,False,
ogo1yl4,It pushes the code to remote repo and deletes everything on the pc. I think he meant that the guy has moved to a “final” resting place and this world for him no longer exists something like that,mrgoodytwosho365,2026-04-17 06:51:43,216,learnprogramming,t3_1snt4xs,False,
ogo38yc,"git is a tool programmers use to ""save"" their work. pushing is how they ""publish"" or ""submit"" their work. origin is a common name for where the work originated. ""final"" would be the descriptor of the last thing he worked on. putting it all together, he completed his final act and returned to where he came from (went to heaven, became one with the universe, etc)rm removes a file or a directory. in this case, it is the entire file system. in other words, everything on the computer is deleted. interpret that as his mind, body, or something else is gone",dumpin-on-time,2026-04-17 07:02:39,72,learnprogramming,t3_1snt4xs,False,
ogo5ngx,"It is a good send off.Your last send of purpose to the cosmos/heavens/gods/valhalla. And then you’re done with the local copy.Definitely nerdy, poetic, beautiful.",These-Math1384,2026-04-17 07:23:36,55,learnprogramming,t3_1snt4xs,False,
ogos42l,"This hits close to home, I lost a friend too. It's like he was saying ""I've sent my final push, my work here is done."" Beautifully poetic, even in command lines.",Training-Attempt-209,2026-04-17 10:39:38,20,learnprogramming,t3_1snt4xs,False,
ogo1t6r,"I would translate it to ""going back to where he came from"". ""git push origin final"" is ""push the 'final' branch back to the 'origin' repo"" and ""rm -rf /"" is removing the entire local filesystem.",Immediate_Form7831,2026-04-17 06:50:28,23,learnprogramming,t3_1snt4xs,False,
ogo3wen,"This is an interesting way to approach git and spirituality.Made me think of different ways to represent death.Final death, nothing after. Would just be rm -rf / I guessPushing to git means there is something to push somewhere.Reincarnation could be a new branch or fork.Things like that.Anyway, I find it beautiful.",HolyPommeDeTerre,2026-04-17 07:08:14,5,learnprogramming,t3_1snt4xs,False,
ogo4xai,"The program `git` is a way of copying source code around and tracking changes to it by multiple programmers; those changes can be individually kept or reverted.If you are a programmer beginning work on an existing project, the first thing you do is get a copy of that project onto your computer by _cloning_ it from the place it lives online (called a _repository_ and identified by a URL). The local copy remembers the repository where it came from as its `origin`. Then you create a _branch_ to hold your changes, which you can name whatever you want; in this case, since the changes were going to be the last ones, the author called it `final`. Once you've made your changes you then copy your branch back to the original repository with `git push`, the first command in your snippet. ""Send a copy of the `final` branch to the `origin` repository.""Having thus saved your work in the cloud, if you're all done, you can safely delete the local copy. The `rm -rf /` goes above and beyond by deleting every file on the computer, essentially turning it into a lifeless husk.",zeekar,2026-04-17 07:17:12,4,learnprogramming,t3_1snt4xs,False,
ogo8i8a,It is a good send off.,NoKaleidoscope3408,2026-04-17 07:49:24,3,learnprogramming,t3_1snt4xs,False,
ogpwylp,A bit of dark humour if you ask me. Plenty of others have given a far more eloquent explanation superior to anything I'd say.,Kwith,2026-04-17 14:28:27,3,learnprogramming,t3_1snt4xs,False,
ogo3bha,"git is how we keep track of code. \`push origin final\` means send your code updates to everyone else and call them ""final."" \`rm -rf /\` deletes all of the files on a linux system (technically not but close enough).I read this as a metaphore for sending his soul somewhere (wherever he came from) and deleting his body.",skoorrevir,2026-04-17 07:03:15,2,learnprogramming,t3_1snt4xs,False,
ogjj9hx,"No. I’d rather spend time with my wife and child, like most people get to do in other careers.",PianoConcertoNo2,2026-04-16 15:52:28,196,learnprogramming,t3_1sn6y5o,False,
ogjw9q6,"I personally don’t. I have close friends who are also devs and do, but for me personally, I’ve found that no good comes from it. I really enjoy my job, but programming outside of work makes me less happy at work and at home, even if I feel like I’ve caught the bug to build something - it always circles back to mental exhaustion. I much prefer spending time doing totally different activities that keep me balanced like running, rock climbing, cooking, etc… on a more opinionated note, I think it’s just good to have variety in life in general. Programming is just one way to spend time, not THE way to spend time.",SaxSalute,2026-04-16 16:50:28,19,learnprogramming,t3_1sn6y5o,False,
ogjezgl,Yes after work I still spend a lot of time doing my game dev hobby,mlugo02,2026-04-16 15:33:46,30,learnprogramming,t3_1sn6y5o,False,
ogjfnd3,I have been working as a dev in some capacity for nearly 20 years and I have always had side projects. To me they are separate things. I can be sitting at work working on an application and can't wait till I get to go home and work on my side project. It's one of the things that has kept me interested in this field. I know most of my coworkers are just 9-5 devs and I think that's okay too.,Christavito,2026-04-16 15:36:45,67,learnprogramming,t3_1sn6y5o,False,
ogkno6a,"All of my personal projects are in the real world. Home improvements and things like woodworking, electronics, or learning about random stuff.My curiosity and interests wander. Development used to be one of those curiosities and it led to a good career. Right now, it mostly just pays the bills while I do other things that interest me more. If the world didn’t reward a single focused career progression, I would probably be on my 4th career by now.",maowai,2026-04-16 18:51:48,12,learnprogramming,t3_1sn6y5o,False,
ogjgfs3,"I have side projects, but they're hobbies that I want to turn into income.",EtherealSai,2026-04-16 15:40:12,9,learnprogramming,t3_1sn6y5o,False,
ogjpg1m,"I think it's important to actually be interested in the project you are working on so it's not just working after work. Working extra hours for free after a long day is difficult, but putting time into your hobby is totally a different story.",Significant-Syrup400,2026-04-16 16:20:06,4,learnprogramming,t3_1sn6y5o,False,
ogjhj7m,"I never started any serious side projects to continue tbh, so no i don't code after work",Asleep-Party-1870,2026-04-16 15:44:55,2,learnprogramming,t3_1sn6y5o,False,
ogjl3ll,"Yes, programming is what I like to do and unfortunately the stuff I write for work just isn't that complex or interesting.Besides on days where I'm mostly in meetings or helping junior programmers it is nice to program at home.",pixel293,2026-04-16 16:00:35,2,learnprogramming,t3_1sn6y5o,False,
ogjlwyz,"Yes but not in a grindy way, I just work on projects that are useful for myself or would be fun to try. My ""largest"" one right now is maintaining a search engine type system I made for a very niche community. I don't whip myself for not working on side projects if I don't have the energy to though, nothing forced. Usually the projects I work on at home are completely different than the kind of stack/platforms I use at work so I don't burn myself out entirely and have some variety.To clarify though I am not married with no kids so this will probably change as my circumstances change, but for now I'm having fun and using my free time to my advantage. But again, I do it because I want to and I like learning new things, not because I feel compelled to maintain side projects because I ""have"" to.",bigsauce456,2026-04-16 16:04:15,2,learnprogramming,t3_1sn6y5o,False,
ofzigx7,"Reading AI code is kinda different experience than human senior code tbh. AI usually writes very clean and predictable patterns but it lacks the ""why"" behind certain decisions that you get from experienced developers Senior devs will leave comments about edge cases they discovered, weird workarounds for specific bugs, or architectural decisions that came from years of maintaining similar systems. AI just follows best practices without that context of real world pain points I'd say do both - AI code is good for learning clean syntax and common patterns, but reading actual senior code in open source projects will teach you more about problem solving and dealing with legacy systems",Neat_Fisherman9331,2026-04-13 18:25:19,56,learnprogramming,t3_1skj7bs,False,
ofzigbt,"In my experience, AI currently writes intern level code.You can definitely learn things from interns, especially when it comes to basic syntax and usage of unfamiliar APIs and such, but I would not want to study an intern's architecture and approach as a gold standard.",high_throughput,2026-04-13 18:25:15,53,learnprogramming,t3_1skj7bs,False,
ofzmlhb,"What would the point be? You want to read code from good programmers. You've pointed out where you can read code written by good programmers as part of real, battle-tested projects. Is there any point generating even more code, which may be of dubious quality, when you can just read some reputable codebases? I'm not aware of any well-established, well-reputed projects that have been LLM-generated that are known for having good code, but there are many such open source projects.IME LLMs generate very average code. Most of the time it compiles. Some of the time it does what you want. Almost never is it the best way to do whatever you wanted. You can usually improve it, and you are often required to. Architecture what? In a vacuum you might consider small pieces good enough but collecting too much of it together would make for a pretty terrible codebase to subsequently read through. I wouldn't point beginners to anything like that to learn how programming should be done.",HashDefTrueFalse,2026-04-13 18:43:58,12,learnprogramming,t3_1skj7bs,False,
ofzpb1h,"Don’t just read senior developers’ code and expect to learn automatically. Try to understand the logic—what problem they are solving, how they are solving it, and why they chose that approach. If you don’t agree with it, try to think of a better solution yourself.",hyper4saken,2026-04-13 18:55:57,6,learnprogramming,t3_1skj7bs,False,
ofzkn9g,"We learn by reading existing code, yes.But not just by reading projects - this will not work as a learning method.We learn by reading code in context of our task - we know what we have to do so we try to find a way how to attach it to existing structure.Or extended existing code to include our new feature.Or we need to change how something works so we analyse it's code and introduce changes.Just reading open source projects will not give that to you.",ShoulderPast2433,2026-04-13 18:35:10,3,learnprogramming,t3_1skj7bs,False,
ofziiw1,Can you learn something? sure probably. Is that something worth learning? Probably not.Why read slop in an effort to learn instead of any of the countless well regarded and well written projects out there?,Digital-Chupacabra,2026-04-13 18:25:34,3,learnprogramming,t3_1skj7bs,False,
og04o4z,"> is it same for the code written by AI?No, absolutely not. A *senior* knows what they are doing and can reason with understanding about everything they wrote.AI is just a statistical model that chooses the ""best fit"" according basically to probabilities. It has zero understanding of programming at all.Also, just reading others' code will enable you to write it, as reading and understanding books will enable you to write a meaningful, fully developed, comprehensive novel. It won't.It can *improve* your skills by giving you new ""tools"" and ""tricks"", but that's about it.**You** first and foremost need to write code in order to improve, just like an author needs to write a boatton of bad books before they can eventually write a good one.",desrtfx,2026-04-13 20:06:07,3,learnprogramming,t3_1skj7bs,False,
og08iu5,"I wouldn’t try and learn via code with AI. I do find that AI is good at summarizing problem definitions and techniques that would be helpful. If my question is “How does Java implement abstraction?” Or “Based on my problem definition, what data types or algorithms would you recommend and why?”, my answers tend to be very detailed and well summarized. As a search engine, AI can be nice. It’s also good at showing examples of other implementations, or give pseudo-code. Pretty much everything you find on stack overflow.When coding without a reference point, I find it’s *okay* at differentiating mediocre ideas from great ideas. There are scenarios where it can’t detect a bad idea at all, but I find that it’s different from model to model. I’ve tried using AI to solve problems that I’m 50% confident on, and it created solutions that I felt 50% confident on. It’s nice to prototype a bad idea and get it out of the way. So as generating “Counter-examples” I’m pretty happy with it. AI is really good at explaining what a codebase is *actually* doing. I use this during code reviews when there aren’t enough comments to give me an idea of what someone is thinking. Usually, the summary is really good. If there is a section of code that’s confusing, I would definitely recommend asking AI to help you understand it. Sometimes, AI can even generate edge cases for you to test against.My final note: AI companies are capitalist companies. Sometimes, I’ve seen models refuse to complete a request as expected so that I’d give them another message saying the exact same thing. It’s good to remember to think for yourself. Especially when/if you pay for AI models, it will save you money.",TheNewJoesus,2026-04-13 20:23:12,1,learnprogramming,t3_1skj7bs,False,
og0elt7,"What I like to do is after I’ve written my code, I ask AI what I can improve. It’s not always right but it gives good advices",Teheiura,2026-04-13 20:50:59,1,learnprogramming,t3_1skj7bs,False,
og0fu1f,"Let rephrase that to reading well written code helps you learn. You can't assume that a senior, open source project or an AI is constructing good code.In the case of open source it can be all over the place as far as code quality goes. Think about it open source is just somebody that has solved a problem an released the code to the world. That somebody could be a professional programmer, possibly generating good code. The you have the doctor, farmer, or artist that hammered together something to solve a specific problem that they had. The code these people produce can be all over the place as far as quality goes.So yeah read a lot but take everything with a grain of salt and be cautious around old code. Languages like Swift, C++ and Python have changed over time, what might have been good code a decade ago, today would be seen as terrible practice. This is especially true with languages life C++ that have evolved over time. Young languages like Swift had major changes in their short careers so even new languages suffer. Then you have languages like Python that had minor changes to clean up the language and got complaints all out of proportion to the impact. The reason I picked these three is that the age of a language does matter and old code might not be a proper example anymore.So yeah read but try to focus on reading modern code that is well written. More importantly write your own code. Write lots of code actually often with the only reason being to explore an aspect of a language or SDK.",spinwizard69,2026-04-13 20:56:37,1,learnprogramming,t3_1skj7bs,False,
