id,body,author,created_utc,score,subreddit,parent_id,is_submitter,distinguished
oofk87p,"I appreciate your perspective. I remember reading the WyCash explanation in the introduction, but didn't know the man literally wrote JUnit. Let alone with Gamma.I've been a hobby programmer since the days of Commodore and QBasic, but I think something about these examples wasn't really clicking. I'll look at the completed source again and revisit it. Will check out that other book too.Thanks!",TseehnMarhn,2026-05-28 19:29:13,2,learnprogramming,t1_oob3nj6,True,
oofkm7b,"Before this book, I did read though the Art of Unit Testing by Osherove",TseehnMarhn,2026-05-28 19:30:58,1,learnprogramming,t1_ooapav7,True,
oohcrsy,"Additional context: the ""Gang of Four"" patterns book, by Gamma et al? That entire pattern movement was launched by Ward and Kent: [Using Pattern Languages for Object-Oriented Programs](https://c2.com/doc/oopsla87.html).'course, it could still be true that the TDDbE demonstration projects are convoluted, etc. The text is the text, it doesn't magically become better just because the author is a Name.",vocumsineratio,2026-05-29 00:55:49,2,learnprogramming,t1_oofk87p,False,
oooky0f,"Design Patterns was one of the first programming texts I bought way back when. I just looked though the preface and sure enough, special thanks to Kent Beck. Strange that I often hear about Fowler or Martin, but not the ""grandfathers"" of all those ideas. In any case, while I agree just because someone influential wrote a book doesn't automatically make it good, I'm also inclined to believe he's working on a level above my own. I probably have some learning to do.",TseehnMarhn,2026-05-30 01:26:57,1,learnprogramming,t1_oohcrsy,True,
oo8xnau,HTML you can learn in an afternoon. Master CSS? Probably never lol,jbaker88,2026-05-27 20:55:44,28,learnprogramming,t3_1tpi45d,False,
oo8w97g,26 years +,peterlinddk,2026-05-27 20:49:28,6,learnprogramming,t3_1tpi45d,False,
oo9i8nu,[You need to Master how to use Google](https://www.google.com/search?q=how+long+does+it+take+to+learn+and+master+html%26css%3F&client=ms-android-tmus-us-rvc3&sourceid=chrome-mobile&ie=UTF-8#lfId=ChxjMe),rustyseapants,2026-05-27 22:36:37,6,learnprogramming,t3_1tpi45d,False,
oo8z2gb,"HTML is pretty straightforward and you should be able to get the basics in a few hours of learning and practice. There are ways to really get deeper (mostly if you care about accessibility through ARIA or if you want to do some very specific stuff), but you can accomplish most things with a basic understanding. CSS is quite a tougher cookie. Again, learning the basics should take a few hours, but each project will bring its own specifications which will require some deeper knowledge. Most books that cover the subject will bundle them together because they are very often used together, along with JavaScript (which is a good language to pick up if you want to learn Web Design).",quietjaypee,2026-05-27 21:02:12,4,learnprogramming,t3_1tpi45d,False,
oo95idr,Html - 1 dayCss - 10 years,cankennykencan,2026-05-27 21:32:37,3,learnprogramming,t3_1tpi45d,False,
ooarjoo,"Define ""master"". Plus, what are you trying to achieve/do? Learn web dev?",NationsAnarchy,2026-05-28 02:48:09,3,learnprogramming,t3_1tpi45d,False,
oo8wjj7,1 month.,Flame77ofc,2026-05-27 20:50:46,2,learnprogramming,t3_1tpi45d,False,
oo8ypxi,"Depends on the individual.  Tell us a few things about yourself,  your tech education and your facility for recognizing patterns. Otherwise it's like asking how long is a piece of string.",Dazzling_Music_2411,2026-05-27 21:00:36,1,learnprogramming,t3_1tpi45d,False,
oo8zjv0,"if you meant by mastering knowing all syntax,tags and keywords even historical/deprecated ones then for me 3 months is more than enough but to actually Master them a lifetime maybe not enough because they're part of a bigger development cycle which is frontend which the latter is only a part of fullstack which is a part of system architecture and product management which is part of software engineering",Software-fullstack,2026-05-27 21:04:26,1,learnprogramming,t3_1tpi45d,False,
oo9i8pj,"A few months to learn (2-4), but you won't ""master"" it until years later without professional experience. You don't need to though. That being said, HTML+CSS doesn't give you much, you want to add at least JavaScript to it in today's world, unless you're insanely talented UX designer and even that's a very bare baseline.",Any-Look-8817,2026-05-27 22:36:37,1,learnprogramming,t3_1tpi45d,False,
oo8jwxi,"If your goal is game dev and home automation is just a path, go with c++.Will take you longer for the automation but faster for your game dev!",Illustrious-Deer1126,2026-05-27 19:53:59,3,learnprogramming,t3_1tpf4nr,False,
oo89uha,"new coders like to ask ""what language should I learn?"" and old coders like to reply ""it doesn't actually make much difference"". Decide on a feature set, let the feature set guide you to a tool stack and then let the tool stack tell you what language to learn based on what languages the tool stack is written in and/or supports for scripting purposes. Between the two you presented it's more likely to be python than C++, but it might be either or both or a third thing we didn't think about.",reverendsteveii,2026-05-27 19:09:38,7,learnprogramming,t3_1tpf4nr,False,
oo8gz3c,"If you want results, use Python. Also, don't start from scratch: Other people have done the heavy lifting already: [https://www.home-assistant.io/integrations/python\_script/](https://www.home-assistant.io/integrations/python_script/)Start there.",Beregolas,2026-05-27 19:41:01,2,learnprogramming,t3_1tpf4nr,False,
oo8fnj2,"For Raspberry Pi home automation, I’d start with Python. The ecosystem is friendlier for beginners, hardware libraries are easy to use, and most tutorials for GPIO, sensors, Home Assistant integrations, MQTT, etc. will assume Python.C++ is still worth learning for game development, but you don’t need to force it into every project. Python will let you get lights/sensors/buttons working quickly, which is motivating. Later, if you hit performance or low-level constraints, you can bring C++ back in for those specific parts.",AutomaticBill114,2026-05-27 19:35:10,2,learnprogramming,t3_1tpf4nr,False,
oodfk0b,"You don't really want to power home automation with RasPis, you want to do it with ESP32s.C is more than sufficient, and quite simple since for the vast majority of home automation cases you won't need to do any dynamic memory allocations",TapWaterDev,2026-05-28 13:51:26,1,learnprogramming,t3_1tpf4nr,False,
oo8kw4n,Go or python,smaudd,2026-05-27 19:58:22,1,learnprogramming,t3_1tpf4nr,False,
oo98xq1,"Python, it comes with libraries that make controlling the I/O really easy. You'll need this to interface with the real world to do automation.",PipingSnail,2026-05-27 21:49:18,1,learnprogramming,t3_1tpf4nr,False,
oo89ny6,Python would be easier than C++ for sure. Not sure if there are other better ones - other people might know,nog642,2026-05-27 19:08:49,0,learnprogramming,t3_1tpf4nr,False,
oo8a52h,C# nano framework,Proxiconn,2026-05-27 19:10:55,-1,learnprogramming,t3_1tpf4nr,False,
oo8b9d4,"For basic automation, you'll probably want bash or python",cgoldberg,2026-05-27 19:15:50,-1,learnprogramming,t3_1tpf4nr,False,
op498h3,"Go for it. That's how we learned in the 1980s, we just made stuff and learned along the way.",NumberInfinite2068,2026-06-01 12:42:43,7,learnprogramming,t3_1ttqzal,False,
op49gc3,"Once you have a solid foundation, projects are the way to go.Yet, you have to balance the scope and complexity of your projects with your skills. Ideally, you tackle projects just a bit above your current skills. Then, as your skills grow, you take the next complex and larger one, and so on.Programming is an acquired and trained skill, like more or less any craftsmanship. You don't start to build intricate Victorian Furniture from zero skills. You work your way up to it through more and more complex and intricate projects.",aqua_regis,2026-06-01 12:43:56,6,learnprogramming,t3_1ttqzal,False,
op4a5qd,"Nah, that's a great way to learn. Software engineering is always changing, learning how to figure out new things on your own is one of the best skills to develop. My first projects 20 years ago were simple websites and programs to help construct Warhammer 40k armies to play with friends. They were crap and the code I learned would be useless today, but the ability to learn how to figure things out by experimenting was invaluable.",Zesher_,2026-06-01 12:47:50,2,learnprogramming,t3_1ttqzal,False,
op4b4un,"if it works then congrats you did it, efficiency will come with time",PaperCube_,2026-06-01 12:53:11,1,learnprogramming,t3_1ttqzal,False,
op4c9s1,"This is a great way to improve. Doing personal projects that are just on the edge or slightly beyond your ability will help you improve greatly. Having to research and look things up when you don't know how to do one particular thing is how you learn. The trap many people get into is, ""let me follow a tutorial about how to build an online shop website. I'll do everything the tutorial does. Cool, now I've built an online shop website.""The better thing to do is, ""I'm going to build an online shop website. I know what a basic HTML page looks like. I'll start with that. I know how to process text, so I'll build in text processing to recognize URLs and queries. I don't know how to make a ""good looking"" button though, how should I do that? I'll look that up. Oh and I'm not sure how to create a shopping cart. I know how to build an array or linkedlist or vector, maybe I could start with that? I'll look up how others have done it....""Tutorials are good for when you want to learn some small thing that you can apply to a given problem. In any case, definitely go for it. You'll learn a ton and have way more fun because you're building something for you.",Paxtian,2026-06-01 12:59:21,1,learnprogramming,t3_1ttqzal,False,
op4crjj,"practice, search, make errors and fix by yourself is the best way to learn.",Spare_Dependent6893,2026-06-01 13:01:59,1,learnprogramming,t3_1ttqzal,False,
op4dfsv,You can’t write programs without knowing the syntax (you can likely skip some of the obscure bits).,lurgi,2026-06-01 13:05:36,1,learnprogramming,t3_1ttqzal,False,
op5ai2l,"Yes, but not too big/difficult that it overwhelms you. Start with small projects and work your way up in size and difficulty.That you mention ""syntax"" is a clear sign that you're just in the beginning of your learning. Programming is so much more than just syntax.",HappyFruitTree,2026-06-01 15:44:04,1,learnprogramming,t3_1ttqzal,False,
op2c3vd,"When the E2E test fails, the unit tests tell you where.",Jonny0Than,2026-06-01 03:46:34,9,learnprogramming,t3_1ttg4nn,False,
op2e043,"Yes; absolutely, as a generalization. The unit test tests that piece of the puzzle, whereas the E2E tests the implementation OF that code. They may break independently of one another and losing one make future changes made to that unit much more convoluted to debug.That said, are sort() and filter() custom functions that you have written, or are they built-in functions of the language or framework that you are using? If they're built-in and from a known, common language or framework, it's likely extra work that is just taking up time, both in execution and from your other work.",Guideon72,2026-06-01 03:59:55,3,learnprogramming,t3_1ttg4nn,False,
op29x7c,Are you OK with always running an e2e test whenever you want to confirm the functionality in question? Are you likely to do that as often as you run unit tests?It’s your project — you decide what’s right for your needs.,iOSCaleb,2026-06-01 03:31:13,3,learnprogramming,t3_1ttg4nn,False,
op3jg57,"Usually yes unit tests are still worth it, e2e and unit test coverage often overlap each other, its easier to pinpoint with unit tests about what exactly failed compared to e2e tests. However in this case, if the helper filter and sort functions are just small wrapper function around a builtin language/framework feature, its probably not gonna be any useful adding a unit test for that, as its unlikely to ever fail",NotA-eye,2026-06-01 09:45:52,1,learnprogramming,t3_1ttg4nn,False,
op3q383,"theyre testing diffrent things, thats the key. the E2E test tells you the whole thing doesnt blow up together, but unit tests tell you why it blew up when it does. when your login breaks at 2am youre not going to want to bisect a 40-step E2E trace to find out someone broke password hashing. both layers earn their keep.",oliver_extracts,2026-06-01 10:38:55,1,learnprogramming,t3_1ttg4nn,False,
ooxn4l9,"beIt sounds like you have multiple issues happening at the same time, which is making troubleshooting really confusing.Based on what you described:1. If console.log() runs but you don't see any output, check whether Code Runner is sending output to the Output tab instead of the Terminal. Also try running your JS file directly in the terminal with:node yourfile.js2. If you're getting ""node is not recognized as an internal or external command"", then Node.js is either not installed correctly or not added to your PATH. Open a new terminal and run:node -vnpm -v3. The ""document is not defined"" error happens when you run browser JavaScript with Node.js. document only exists inside a web page, not in a Node environment.4. If HTML/CSS changes aren't showing, verify:Your CSS file is linked correctly.You're editing the same files that Live Server is serving.Try a hard refresh (Ctrl + F5).Check the browser DevTools Console for errors.5. If your JavaScript isn't appearing in the browser console, make sure your HTML includes:and check the browser Console for any 404 errors.Can you post:Your folder structureindex.htmlstyle.cssscript.js",Flame77ofc,2026-05-31 12:45:51,1,learnprogramming,t3_1tsua0a,False,
ooxt5q9,"im so annoyedi just want to practice syntax that I'm learning but its not peacefully letting me maybe vscode is not for a beginner beginnerwait I'm trying to process what you wroteedit-1) i did node filename.js it showed what i console.logged in terminal2) i did npm -v and node -v as u said . it showed its version number.CTRL + F5 trick worked but after a second , vscode sends a popup message saying"" cannot connect to target localhost:9222 couldnhotnfind anybdevuggsgle targets""with 2 options 1) open launch.json 2) cancel.ctrl + f5 also worked for js file.i have to do ctrl +f5 everytime if i wanna see output in vscode's console after i make any changes in js file.if i dont ctrl f5 then it does not show the changed code's output but npOKIE now JS code also shows up on browser page 's console tooand folder structure???edit 2- omg thank u so much :loudly_crying_face: u r a lifesaver .this finally works except that localhost:9222 popup keeps coming up but everything else is working now",Famous_Wolf162,2026-05-31 13:21:06,1,learnprogramming,t1_ooxn4l9,True,
oox6uul,"To all following commenters: please, do not bring up the old circlejerk jokes/memes about recursion (""Understanding recursion..."", ""This is recursion..."", etc.). We've all heard them n+2 too many times.*I am a bot, and this action was performed automatically. Please [contact the moderators of this subreddit](/message/compose/?to=/r/learnprogramming) if you have any questions or concerns.*",AutoModerator,2026-05-31 10:52:35,1,learnprogramming,t3_1tss1ww,False,moderator
oox8u82,I mean the only way to know that you can use it is to use it. Try writing a minimal application or script that implements whatever you're trying to learn,7YM3N,2026-05-31 11:07:59,1,learnprogramming,t3_1tss1ww,False,
ooy4eqn,"It’s actually using concepts in real projects that makes a concept click. Practice, cause suddenly you understand how it works and why it’s used. And avoid AI during the process.",DutyCompetitive1328,2026-05-31 14:21:43,1,learnprogramming,t3_1tss1ww,False,
ooykcwy,"Using [Python Tutor ](https://pythontutor.com/index.html) really helped me with certain areas of Python, like recursion, OOP and list handling. It also makes it much easier to figure out why your could throws errors, because you can sort of see every step along the way.",iMagZz,2026-05-31 15:40:01,1,learnprogramming,t3_1tss1ww,False,
ooyrg5g,"It took me several weeks to really understand recursion. This was in LISP (Lots of Irritating Little Parentheses), thank goodness. I later took this knowledge into more traditional languages such as C and Java.Object oriented programming (OOP) took me only a couple of weeks to understand the syntax in Smalltalk, but it wasn't until I really started working professionally in Java that I understood \*why\* OOP was useful.Now, when I come across a new concept, I can usually deal with it in two weeks (part time -- I'm retired and have lots of things to do) or less. Some things are more complex, like in rust's lifetime model. Most things are easy to learn, now. I was a professional for decades, mostly in Java, though there were C and C++ at times. The first program I was paid for, was a Latin tutorial (Latin Skills Program) which was a set of five programs written Tutor (a spaghetti code language) to be translated into Apple II BASIC.Now, I'm 68 years old, and have seen many things in my career. I may not know a new language, but I can learn it quickly. New concepts cause more learning, but I've coded long enough that I've been there, done that, for almost all concepts.",JGhostThing,2026-05-31 16:13:23,1,learnprogramming,t3_1tss1ww,False,
oox8fwi,"Honesty, it's 2026 - just get AI to do it, not as much incentive to learn new things deeply anymore.",tiempo90,2026-05-31 11:04:57,-4,learnprogramming,t3_1tss1ww,False,
ooyiir5,"Sleep/breaks are crucial. Your brain needs time to digest what you've fed it, usually when you're not doing anything that requires concentrated thinking. That's why the a-ha moments come in the shower, mowing the lawn, etc.",Astronaut6735,2026-05-31 15:31:12,1,learnprogramming,t1_oox93p2,False,
ooyz7kz,"pretty much this, repeated exposure and tolerance for being lost seems to be the key",ParadiZe,2026-05-31 16:49:49,1,learnprogramming,t1_oox93p2,False,
ooyt8r1,This is not the real question. It is which framework do someone follow to understand a new programming concept. Such that now you are 100% sure you know this and can solve problems related to it. Recursion and OOP were examples.,zainulabdin100,2026-05-31 16:21:52,0,learnprogramming,t1_ooykcwy,True,
oormvj4,Math. Math doesn't teach you anything about computers or electronics or code but having the structure and mindset of at least intro to intermediate undergrad math profoundly puts you onto the right direction in my opinion at least.,ivan_x3000,2026-05-30 14:26:42,3,learnprogramming,t3_1ts0xoo,False,
oorjscr,i'm in your same situation and i want to get my hands on things practically just get into it pick something you like and do a project in it you'll learn step by step what you'll actually need,Same-Mushroom-2057,2026-05-30 14:10:51,2,learnprogramming,t3_1ts0xoo,False,
oorrv37,"Grab an Arduino kit since you like hardware, it bridges the gap between those CS50 concepts and actually making physical things move.",throwaway_anchorv2,2026-05-30 14:51:55,1,learnprogramming,t3_1ts0xoo,False,
ooub0bj,"Learn OS concepts, it will give you understanding of all the toolings OS provides for apps to do great things.",RealMadHouse,2026-05-30 22:27:06,1,learnprogramming,t3_1ts0xoo,False,
ooqc9d2,"the stopping at 5500 is almost certainly a memory issue — you're loading 100k+ records with full relations (`include: a, b, c`) all at once into memory, which will cause the process to run out of heap space and silently stop.fix it by processing in batches instead of fetching everything at once:const batchSize = 500;let skip = 0;while (true) { const batch = await this.unprocessedTable.findMany({where: { isProcessed: false },include: { a: true, b: true, c: true },orderBy: { d: 'desc' },take: batchSize,skip: skip, }); if (batch.length === 0) break; for (const record of batch) {// your existing logic here } skip += batchSize;}",haiderakt,2026-05-30 09:17:26,1,learnprogramming,t3_1tru9ib,False,
ooqtcya,"The main issue here is loading everything at once. with 100k+ rows means you’re pulling a huge dataset into memory before doing any work, so the job will eventually hit memory/timeout limits and die somewhere in the middle.I’d switch this to chunked processing: + cursor pagination, process 200-500 rows per batch, mark each row as processed in the same transaction, then loop until no rows remain. That gives you resumability and keeps the scheduler from becoming a single giant failure domain. Also, is a one-shot startup task, not really a scheduler. If this needs to run continuously, I’d use or an external worker/queue and make the task idempotent so retries are safe.",cidy0983,2026-05-30 11:35:49,1,learnprogramming,t3_1tru9ib,False,
oor09f9,"depends entirely on whether you need tasks to survive a restart. if sending an email fires into APScheduler in-process and your dyno crashes mid-send, it's gone. that's the actual split: in-process scheduler (APScheduler) is fine for low-stakes stuff like nightly cleanup where missing one run doesnt matter, but anything you care about completing needs a real queue with persistence, which points you toward celery+redis or rq. for your specific list, hourly reports and email sends warrant a queue, daily cleanup probably doesnt. plain cron is also underrated if your tasks are just scripts and you have a single server you control.",oliver_extracts,2026-05-30 12:20:47,1,learnprogramming,t3_1tru9ib,False,
oox2po8,"one thing to add: `const now = new Date()` at the top means every grace period comparison is against the time the cron started, not when each record actually gets processed. for a long-running batch over 100k rows that difference accumulates, and records that became eligible midway through the run will get skipped until the next scheduled execution.",quietcodelife,2026-05-31 10:18:16,1,learnprogramming,t3_1tru9ib,False,
ooqf4xi,"Another problem is when I added take or skip the loop never runs. Dont know whats causing. Weird thing is the last log ""Cron Executed"" runs but never the loop before it.",kneegrow7,2026-05-30 09:43:17,1,learnprogramming,t1_ooqc9d2,True,
oorjjmq,Makes sense it silently stopped at 5k+. I already implemented what you guys suggests and it works fine. I am still monitoring the behavior though. But this is a new learning for me. Thanks!,kneegrow7,2026-05-30 14:09:36,1,learnprogramming,t1_ooqtcya,True,
ooqgao3,"when you add `take/skip`, the `where: { isProcessed: false }` filter combined with `orderBy` and pagination means by the time the second batch runs, the offset is wrong because previously processed records are now excluded from the count, so Prisma skips past records that haven't been processed yet.fix it by using cursor-based pagination instead: \`\`\`let cursor = undefined;while (true) {const batch = await this.unprocessedTable.findMany({where: { isProcessed: false },include: { a: true, b: true, c: true },orderBy: { recordId: 'asc' },take: 500,...(cursor && { cursor: { recordId: cursor }, skip: 1 }),});if (batch.length === 0) break;for (const record of batch) {// your existing logic}cursor = batch\[batch.length - 1\].recordId;} \`\`\`",haiderakt,2026-05-30 09:53:23,1,learnprogramming,t1_ooqf4xi,False,
ooqiz8h,"Thank you, it worked! The cursor did its job. I learned something new today.",kneegrow7,2026-05-30 10:16:08,1,learnprogramming,t1_ooqgao3,True,
ook86vr,"FreeCodeCamp and The Odin Project are both great resources. If they already manage databases, I'd honestly start with SQL and let them get comfortable building and querying things first. After that, HTML/CSS → JavaScript → React is a pretty natural progression.One thing I've noticed is that people learn much faster when they're solving real problems. Even small internal tools can teach more than hours of tutorials because there's an actual reason to build them.",BeginningOne8195,2026-05-29 12:50:59,3,learnprogramming,t3_1tr0qym,False,
ook8rqb,Thank you!I agree. Building is the way….thats how I did it. Learning how to program changes how you think about problems. I think it’s going to benefit them in other ways too.,babaqewsawwwce,2026-05-29 12:53:57,2,learnprogramming,t1_ook86vr,True,
ooepdms,Vercel + Supabase is solid combo for this,Different_Jicama_290,2026-05-28 17:13:44,2,learnprogramming,t3_1tq9ojw,False,
ooet61c,"You basically got it. Supabase, Vercel, Firebase... whatever you choose would be ok. Even renting a virtual machine and deploying everything via Docker would be very simple (even secure). Few security things to always have in mind before deploying. - only backend can talk to the database- do not store database credentials in code in any form, read it from a secure vault or inject it as ENV variable at runtime - use JWT to authenticate between frontend and backend- store backend authentication credentials in a secure vault just like the DB ones (or any other credential for that matter)",gajo357,2026-05-28 17:29:58,2,learnprogramming,t3_1tq9ojw,False,
