id,body,author,created_utc,score,subreddit,parent_id,is_submitter,distinguished
ooeaour,"Depends on the place, any sort of startup is fast and loose with it, I was at a place where some of our primary technical people would brag about not writing a single line of code.Results are mixed and inconsistent. Things get made fast, but they get made poorly, in a non intuitive way that is harder to build off of. Massive features that accrued 10s of thousands of token spend alone are scrapped and restarted because the underlying system was too fragile.Way more 'lgtm' for multi thousand line commits as long as the cursor bot also agreed.I have a friend who only codes by hand (and coincidentally is the best developer I have ever met) who worked at Vimeo before it was bought and everyone was laid off. He saw the new blood wandering into an incredibly complex legacy code base and immediately ask why they couldn't just tear it all down and host it on some nextjs typescript backend. Decades of carefully constructed code that someone just points claude at and says ""add this feature"".Anyways, he's not going back to software and is looking into becoming an electrician.So that's about where the industry is at.",Hawful,2026-05-28 16:10:01,11,cscareerquestions,t3_1tq7s9h,False,
ooea0e4,"It really depends. I use AI for quick one time scripts or prototyping some functionality before I implement the actual feature/tool/application. What I found is that I usually spend more time debugging AI code than me just writing the code myself. As for generating boiler plate code, I already use deterministic generators to create structs for APIs which is much better than the slot machine that is AI. \*\*edit\*\* Forgot to mention, I have found AI extremely useful for AWS lambda functions due to how small lambda functions are.",Altruistic_Raise6322,2026-05-28 16:07:02,8,cscareerquestions,t3_1tq7s9h,False,
ooecu0i,"It’s a lot of that “Pablo Escobar Thinking” meme. AI can be good at writing code if you are careful about what exactly it is writing. Otherwise, if the ticket is “human codeable” by my estimation, I use the AI as a “super search” to augment my coding. I rarely run into tasks I think are a “perfect size” for AI.If it is too small, the chance is too high that the AI fucks it up and I have to spend more time fixing it than if I just coded it at all.If it is too big, the AI will not be able to get it all in one session, and you have to figure out how to chunk it up appropriately.",Terrariant,2026-05-28 16:19:20,6,cscareerquestions,t3_1tq7s9h,False,
ooee3gp,The job of a SWE used to be endless hours of head scratching google search and stack overflow if that helps.,Legote,2026-05-28 16:24:51,3,cscareerquestions,t3_1tq7s9h,False,
oof6vq9,It’s the same as always. Developing software. Using your brain. That’s it.Unless you work in copypaste basic CRUD factory. Then it’s copypaste or waiting for AI to get stuff done.Choose wisely.,symbiatch,2026-05-28 18:29:40,3,cscareerquestions,t3_1tq7s9h,False,
ooeanle,"It really depends on the codebase and the standards for quality and how much test coverage exists. Overall its like you have a (cracked) jr developer you can ask to analyze code and check things and then reviewing their changes and suggesting better alternatives and holes left. Its a collaborative process where a magic machine can read a lot of code really fast but can also make errors or produce poor solutions without guidance. If you work somewhere that they do not care about the errors (or have great test coverage) or poor solutions dont matter, then its probably pretty different.",freqCake,2026-05-28 16:09:51,2,cscareerquestions,t3_1tq7s9h,False,
onuat42,"Since you were able to land both your previous job and this one without a CS degree, it sounds like you probably already have a solid portfolio, a resume that explains your skills well, and some recruiter connections. I really wouldn’t quit before having another offer, and I wouldn’t even mention that you’re thinking about leaving. In the meantime, maybe send your resume to other recruitment firms in your field like this [developer ](https://www.reddit.com/r/RemoteJobseekers/comments/1fdpeg2/how_i_landed_)did. You might end up finding something much healthier than where you are now.",All_The_Memes,2026-05-25 19:30:49,16,cscareerquestions,t3_1tmqjdi,False,
onox7y8,Depends on who you are. But from the sounds of it I’d just quiet quit and look for another job. You have to be proactive in not burning yourself out everyday so that you have the ability to apply for jobs when you get home. This place sounds horrible.,21_12user,2026-05-24 23:28:35,9,cscareerquestions,t3_1tmqjdi,False,
onp0b5q,"My advice doesn't work during this time (I'll include you in my prayers), but just in case you ever find yourself with income to spare.1) Invest and save ALL your money, don't spend any money anymore, ever again. Build a big dragon hoard. Money can protect your mental health, like a magical ward of sorts.Money can buy you mental health, it can buy you dignity, and confidence. Just knowing that you have savings that can last longer than the time it takes you to find the next job will make you feel safe (and loved, by your money, not management).",abandoned_idol,2026-05-24 23:46:50,19,cscareerquestions,t3_1tmqjdi,False,
onov9v7,"That sounds genuinely brutal, and those red flags are real, not in your head.",farfaraway,2026-05-24 23:17:06,24,cscareerquestions,t3_1tmqjdi,False,
onpcc9e,Tbh this sounds less like “imposter syndrome” and more like a genuinely toxic company burning people out fast.,Majestic_Menu_1125,2026-05-25 00:58:51,3,cscareerquestions,t3_1tmqjdi,False,
onpux34,A couple of situations that have always helped me:- Try to get more time outside in the wilderness. Not just one day. Not just one weekend. But consistent time outdoors. It will help you cope with the stress.- Cut your burn rate. Try to save as much cash as possible. Live out of your car if you have to. Live up in the woods with a hammock. I did it when I was a kid. Get your burn down to zero so you can bank as much cash as possible so you have more freedom.- Take care of your health. Eat right. Hit the gym. Lift. ... That's the only wya to deal with this type of situation.,brainhack3r,2026-05-25 02:51:25,3,cscareerquestions,t3_1tmqjdi,False,
ont5a7z,"The stock options thing is a red flag I'd take seriously. That's not a miscommunication, that's just lying. And ""chronic stress as a core operating principle"" is leadership telling you exactly who they are upfront.Start quietly building your skills and your external reputation now, while you have income. Don't wait until you're desperate again. The 6 month job hunt you described is brutal, but tbh it's easier to land something when you're already employed.",alexxtoth,2026-05-25 16:12:41,3,cscareerquestions,t3_1tmqjdi,False,
onrh4ag,"I've been in a similar spot before, and honestly the thing that helped most was realizing that ""having a job"" and ""having a sustainable job"" are different things. A company that normalizes public shaming, constant urgency, and bait-and-switch hiring practices isn't teaching resilience, it's burning through people.If I were you, I'd treat this as a temporary landing spot, not a destination. Keep collecting the paycheck, do good work, update your resume with everything you're learning, and keep interviewing. The fact that you're stressed all the time despite a 40% pay bump is a pretty strong signal that the problem isn't you.",curious_4207,2026-05-25 10:37:18,2,cscareerquestions,t3_1tmqjdi,False,
onp3c8f,"No question you’re in a toxic environment. You should be applying to other jobs with just as much urgency as you did before. But in the meantime, try cognitive reframing. Sure, you could lose your job any day without warning. But every paycheck is a win over your previous situation where you were unemployed and looking. This job might be just the stopgap you need in order to get something more sustainable long term",BEvey_Boo,2026-05-25 00:05:07,4,cscareerquestions,t3_1tmqjdi,False,
onopsb0,I don't have a CS degree either and went from five good years in tech to grocery. Could be a lot worse. I'd love to be in tech again but I cant stomach mass applying to hundreds of job postings and having to work primarily with AI. Was a lot better 5-6 years ago pre-Covid. Walked into the grocery store and was basically hired on the spot. I'll get into tech again after the AI hype dies down.,dontdoxme33,2026-05-24 22:45:00,9,cscareerquestions,t3_1tmqjdi,False,
ooarheo,"Think of their incentives. Also understand that basically by definition, everyone around you is trying to maximize their comp and their longevity at the company. They are not necessarily doing what they actually believe is best.",SergeantPoopyWeiner,2026-05-28 02:47:47,67,cscareerquestions,t3_1tpqnt6,False,
oob6adz,"The difficulties of middle management are well understood: You either spend your efforts paying attention upwards or downwards. The more efforts you spend upwards, the better off your compensation will be, and chances of promotion, barring massive catastrophe. Therefore, paying attention to issues in your chunk of the organization is just trained out of you by the time you hit the 4th, 5th level of management or so. The consequences of rocking the boat are just too high, which would include calling out other execs of similar level. The rare good exec that still knows what is going on needs very thick skin and to very rarely say what they think.Note this isn't new for tech companies: The whole thing was described in the 70s and 80s thinking of all kinds of other large companies. Dilbert was talking of bungee bosses that tried to change everything and left before seeing the consequences in 1996. It's a nature of the corporate structures, and big tech is finally big enough for this. You will find it too in second and third tier places, which will create ""Directors of Digital Transformation"" or other similar BS, who just know how to sound convincing to other execs, but immediately melt when questioned. But if you do question, you will be seen as not a team player, so don't try. Honest communication left the building years ago.",hibikir_40k,2026-05-28 04:22:43,31,cscareerquestions,t3_1tpqnt6,False,
oobdpem,"silicon valley upper managers or PMs? because those 2 are different, PMs aren't ""upper managers"", they're literally in an entirely different org and have different reporting ladder chain, I don't report to PMs I report to EMs",NewChameleon,2026-05-28 05:15:46,39,cscareerquestions,t3_1tpqnt6,False,
oobhoxp,You usually have to be from the same village as the VP and then you're in.,metamucil_buttchug69,2026-05-28 05:46:16,13,cscareerquestions,t3_1tpqnt6,False,
oof36e1,"You have 6 YOE and don't know the difference between an ""upper manager"" and a PM?",gsxdsm,2026-05-28 18:13:19,6,cscareerquestions,t3_1tpqnt6,False,
oobb7y7,With the blood of the people they stepped on in order to get there.,355_over_113,2026-05-28 04:57:28,5,cscareerquestions,t3_1tpqnt6,False,
oob30oz,"they have years of experience building things that higher ups like, to talking in ways that higher ups like to hear. what is so absolutely confusing about it?they have more experience in delivering value to those that can offer them value. it's simple, but it's a skill most people lack. otherwise you wouldn't be here complaining why you can't even understand it",OkStatement77,2026-05-28 04:00:29,4,cscareerquestions,t3_1tpqnt6,False,
ooawvc6,"They get promoted?Upper management is in charge of orgs with thousands of people, do you really think they can context switch between hundreds of disparate projects? Do you think *you* could? They will tend to operate based on signals and intuition more so than trying to make sense of the millions of LOC the peons are writing.",lhorie,2026-05-28 03:20:35,5,cscareerquestions,t3_1tpqnt6,False,
oogi34s,"imo it's kind of a self-own to describe where you work mockingly as attracting ""top"" ""talent"". I don't think you're getting the fact that you are included in this.",Altruistic-Cattle761,2026-05-28 22:06:56,1,cscareerquestions,t3_1tpqnt6,False,
oocmcpd,"Your heavy anti-AI stance will come back to bite you, this is unrelated to the thread but you gotta kill that sentiment.",TopNo6605,2026-05-28 11:12:32,0,cscareerquestions,t3_1tpqnt6,False,
onvp85s,"Had no luck mass applying to everything. I focused on a niche, studied embedded software / firmware for 6 months (during last semester of school) and doing projects, then fixed my resume and only targeted embedded jobs.I got 2 interviews from 150 apps, and then 1 really good offer at fortune 200 company.You need to work hard and have a bit of luck",Friendly_Rock_2276,2026-05-25 23:59:29,73,cscareerquestions,t3_1tnq0qn,False,
onvoudy,"graduated last spring, got my first SWE job through a plain online app at a mid sized non-tech company. i sent a lot of apps, but I focused on ones that said new grad or 1-2 years and I tailored the top of my resume to mirror the posting, then made each project bullet show impact with numbers and the same tech they were asking for. process was OA, a panel with a couple easy-medium coding questions, and a project walkthrough where I explained tradeoffs and what I’d do differently. aiming at less flashy industries and smaller markets helped, and I kept momentum by doing small paid gigs and campus IT work while applying so I had fresh experience to talk about.",dippatel21,2026-05-25 23:57:13,25,cscareerquestions,t3_1tnq0qn,False,
onvxscz,Took a shit coding job at an local business for 15 an hour then moved on to a larger local business for 70k a year,Titoswap,2026-05-26 00:49:24,13,cscareerquestions,t3_1tnq0qn,False,
onw6rrq,"Got lucky with about 80-90 cold applications. Low GPA, no name school, no internships. Had 4 interviews and ended up with a full time SWE offer at a F500 defense company. My advice is if you’re sociable and likable that will take you further than you can imagine. And secondly work your resume around passing ATS screening without going TOO deep into larpville. A lot of government/government contracting work has no leetcode style interviews at all while still starting at 70-100k (i live in HCOL area) if your interview game sucks so targeting those could be good",krustyt,2026-05-26 01:41:41,8,cscareerquestions,t3_1tnq0qn,False,
onw381t,small company shitty pay,21_12user,2026-05-26 01:20:44,5,cscareerquestions,t3_1tnq0qn,False,
onwcc5q,"I graduated 2025 just landed my first position after 5 rounds i start june 22nd finishing the background check as we speak. I didnt have any internships so i promise you a lot of the fear mongering that youre cooked is from people who either stopped trying, want others to feel how they feel or are just pessimists (wont lie the market is hard). I started applying jan 2026 due to family concerns but i had two main capstone projects that the hr team and interviewers all asked me to walk them through. They asked a lot of deeper questions on tradeoffs so make sure youre well versed. Even if you just made a choice cause you wanted to try something do research and understand the tradeoffs for that and other possible choices. I still have a couple companies in the interview process but a big thing i noticed was after i kept iterating over my resume till i got to my final resume i saw way better results. I was interviewing every week since the middle of feb till now. I dont actually edit my resume for each role i feel like the gains are minimal at best and might worsen if you dont keep track of changes. Also i applied to only backend or data engineer and general swe not full stack or front end cause… i dont show any of those skills on my resume so its pointless… Uhm I think thats it but it was a grueling 5 months for me getting finals and being picked over for someone with more experience but i understood thats the market. I started leetcoding feb and got decent at it… not insane… but good enough that OA was a good most of the times. Communication matters a lot. But i guess success story is that I went from minimum wage to 6 figures and i can finally retire my mom. I hope some of it was helpful cause i was on this sub messaging people all the time and they helped me a lot to get where i am so i felt like i should pass it along. Good luck bro keep going i promise i had a 2.7 gpa no projects till 2025 december when i finished them and i made it in this market (failed amazon, failed nutanix, failed plenty of others but dont let it discourage you keep going). Sorry if this wasnt coherent im quite sleep deprived atm. Oh applied online to all of them try to apply within the first 4 hours no referrals for anything cold apply.",charliewitda9,2026-05-26 02:13:57,4,cscareerquestions,t3_1tnq0qn,False,
onw2oso,"local small company, help desk, really shitty pay",rhaizee,2026-05-26 01:17:34,5,cscareerquestions,t3_1tnq0qn,False,
onvy4wv,Connections,SunsGettinRealLow,2026-05-26 00:51:22,3,cscareerquestions,t3_1tnq0qn,False,
onwk7bf,"I graduated with a BS in Elec/Comp Engineering in late March 2025 and eventually landed a SWE FAANG role in early July 2025. Only previous ""experience"" was some TA work for a couple senior level classes, I didnt network, I didnt hackathon, I didnt have recommendations (do not do this lol, really shot myself in the foot for job searching by not doing these in college). Not sure how much mass applying contributed to my ""success"" but nonetheless it led to more interview practice which was extremely valuable. Finding what to be prepared for online for an interview is fairly easy but going through the process multiple times and getting used to the pressure and polishing your responses leads to becoming a better interviewee. I likely sent out a few hundred apps, got roughly a dozen phone screens, and like 3 interviews which went into later rounds, and a single offer.",THOUGHT_PETROL,2026-05-26 03:01:04,3,cscareerquestions,t3_1tnq0qn,False,
onwbe7n,"Spamming posts on linkedin reached out by recruiters, interview, offer",Darkislife1,2026-05-26 02:08:25,2,cscareerquestions,t3_1tnq0qn,False,
ooqxfn7,"Wherever they want and more than a million dollars. The Mountain View median is $2M with more affordable neighborhoods starting at $1.3M. Median home price in San Francisco is $1.7M.While median income is only $250K at large public tech companies, that's because they're staffed disproportionately by non-engineers and developers with less experience. Engineers buying houses are usually farther into both their careers where $500K is reasonable total compensation and personal lives where they're half of a two-income couple. Lots of people have millions of dollars in appreciated employer stock which can be used for a down payment if not outright purchase.Many opt for condominiums and town homes which are less expensive. For housing I could easily cover with startup base salary I bought a mobile home on rented land. Other people rent apartments.The SF Bay Area is like New York City where most people can't have a detached house. That trade off is worthwhile because of the amenities accompanying the location - New York is a great city, and the SF Bay Area has the best choice of tech jobs anywhere in the world.",drew_eckhardt2,2026-05-30 12:02:57,98,cscareerquestions,t3_1trxvah,False,
oor31rn,They rent apartments with multiple roommates,YMBTPTOTLWRT,2026-05-30 12:37:55,46,cscareerquestions,t3_1trxvah,False,
oorcqrk,"Unless they are dink and staff eng, and working in ai or faang, most people are not buying houses. Condos maybe but probably not sfh. It takes an absurd amount of windfall or wealth to actually buy in the desirable areas of the bay. Most of my coworkers make 300-500k a year and they all rent except for senior management.",perestroika12,2026-05-30 13:33:08,31,cscareerquestions,t3_1trxvah,False,
oors50a,I bought my house in 2010 for 600k. Even as I have been able to buy new houses because of big jumps in my total comp I never have because mine is paid off and I don't really have any need to move as it's big enough for my family and it's in a good school district and area.I have just done an addition and other heavy remodeling since it's much cheaper to do that then move and pay higher interest rates and taxes because of prop 13.,CCB0x45,2026-05-30 14:53:17,15,cscareerquestions,t3_1trxvah,False,
oosr89i,"I think you first need to reverse-calculate, what's your goal of buying houses anyway? is it just to have a place of your own? are you single? married? do you have kids? what exactly do you prioritize? someone demanding ""I MUST buy in Cupertino because they have good local school district"" is very different than ""meh, I'll buy a condo in I don't care where"" the answer to both of your question could vary wildly depending on your answer to that",NewChameleon,2026-05-30 17:43:05,3,cscareerquestions,t3_1trxvah,False,
oosnjb7,Just go on zillow and add 400-600k on top of asking price for houses in your desired area,lhorie,2026-05-30 17:25:57,3,cscareerquestions,t3_1trxvah,False,
oostsnf,There aren't a lot of places in coastal CA with SFH under a million,d_wilson123,2026-05-30 17:55:17,2,cscareerquestions,t3_1trxvah,False,
ootvf6k,"It's doable as some others in this thread have pointed out. But it really depends on where in the bay, how lucky you got with RSUs and pay. My wife and I recently closed on a SFH in SF, really desirable location (for us). Combined income is roughly 800k. We were able to afford a 3.6m at 5% interest only because our RSUs had appreciated so much over our careers allowing us to put 50% down. That's said, we got REALLY lucky, most normal techies in SF are buying condos, and a large portion of techies in SF are only a single income techie. My wife and I are lucky that we're both in tech so our buying power is essentially double, but job security is a whole other topic when you're both in the same industry.",specialized_potato,2026-05-30 21:01:42,2,cscareerquestions,t3_1trxvah,False,
oos62lo,Bought 2 bed townhome in 2019. Total price was $892000.Did a down payment of 20%,throwaway0845reddit,2026-05-30 16:02:16,2,cscareerquestions,t3_1trxvah,False,
oosxh3j,"There are absolutely homes under $1 million in the bay area that are single-family. But they’re not on the peninsula.About San Jose Oakland, San Francisco proper and lots and lots and lots of east and North Bay have them",nofishies,2026-05-30 18:12:47,1,cscareerquestions,t3_1trxvah,False,
oo246i5,Keep the job but keep applying elsewhere,SunsGettinRealLow,2026-05-26 22:14:41,118,cscareerquestions,t3_1tom138,False,
oo25t2z,"If this is your first job and you have under 1 year of experience, 80k is not a slap to the face. You can definitely make way more if you leave. In fact I encourage it after you have \~18 months of experience.I would say go after a new job while you're young. It paid off for me to ignore stability early in my career and to value stability as I got older.",BUTTHOLE_MONSTER,2026-05-26 22:23:13,33,cscareerquestions,t3_1tom138,False,
oo24od5,"I would say stability is better , having to jump positions and move companies is never an easy thing (talking from experience) , i would say after you have gathered enough ""Fuck you money"" i would say you can then start looking into jumping into another job search.",Daemontatox,2026-05-26 22:17:18,41,cscareerquestions,t3_1tom138,False,
oo2axbi,"No such thing as job stability tbh. I’ve worked at a job like this once where it was small and had no layoffs, not even during Covid. I left for a bigger salary and the company got bought out a few years later & let go of so many people. It’s sad but the job stability our parents had isn’t as common now",Andrewshwap,2026-05-26 22:50:37,10,cscareerquestions,t3_1tom138,False,
oo258xp,"That's about right for junior. The senior is indeed getting a little less in exchange for stability, but I'd settle for $120k if the position matched my career goals. The highest I've made is in the $160k range (non FAANG) but I left out of frustration. (Read: high paying jobs often pay well for a reason.) On the east coast, I don't know anyone who gets paid in the upper $100k range without working for FAANG, at staff level, or in an expensive part of NYC.The ugly truth is that the best thing you can do for yourself is keep your burn rate reasonably low. Work on your student loans, I know that sucks but it's a huge relief to have off your shoulders.You'll get through it, your first few years zip by faster than you think.",greensodacan,2026-05-26 22:20:18,16,cscareerquestions,t3_1tom138,False,
oo2k8aa,"Jumping around early in your career is the best way to increase your compensation. Raises are slow unless you are getting competing offers. It's better to jump around when you're young and don't have responsibility and can slum it up. When you're older you have responsibility to take care to do you need stability. It's better to max out your comp early then switch to stability when you actually need it. Stability is great but being able to take risks is an asset you lose over time. Of course, don't jump around until you have an offer in hand.",Fidodo,2026-05-26 23:40:15,5,cscareerquestions,t3_1tom138,False,
oo2clht,Stay for a year or two 80k isn't bad to start off. You can start applying to intermediate roles in 2 years and try to get 120+ easily,throwaway123hi321,2026-05-26 22:59:25,3,cscareerquestions,t3_1tom138,False,
oo29g7g,ABCAlways be closing. Apply to what’s out there. See if anything sticks. If you get a better offer then assess.,code-seeker,2026-05-26 22:42:44,3,cscareerquestions,t3_1tom138,False,
