id,body,author,created_utc,score,subreddit,parent_id,is_submitter,distinguished
ofxgu7u,"No, I stayed with my previous company for 5 years only to get offshored to Colombia, got a job as lead for a team of contractors from my original country, my company started the replacement of those contractors by Indians so looks like I'll be out of a job once the replacement is complete",droi86,2026-04-13 12:47:20,6,cscareerquestions,t3_1sk8if8,False,
ofxncje,It's been a few years since I've seen a company really pride itself on employee comfort. Which is to say: companies just really don't actually value us and our skillsets as a whole anymore.Welcome to late stage capitalism :man_shrugging:,besthelloworld,2026-04-13 13:22:11,3,cscareerquestions,t3_1sk8if8,False,
ofxu688,"I'm in insurance and feel pretty good right now, but do think that my department is overstaffed given the amount of work business gives us and will slowly shrink over the next few years. So hopefully they make it easy for us to transition to other teams. But hard to not feel a bit secure when you've been promoted recently, no major layoffs, got a bonus that was 70% over initial goal.",ghdana,2026-04-13 13:56:45,3,cscareerquestions,t3_1sk8if8,False,
ofxwkdb,"Yeah, at a big corpo (finance, insurance) that's stable.",Baconpoopotato,2026-04-13 14:08:15,2,cscareerquestions,t3_1sk8if8,False,
ofxysdu,"No. If you're feeling secure in your role, there's a good chance you're kidding yourself.",RespectablePapaya,2026-04-13 14:18:41,2,cscareerquestions,t3_1sk8if8,False,
ogn65zk,"put that down to get the interview, and depending on the fit ask for more money later if you dominate the interview and they love you.",myDevReddit,2026-04-17 02:53:23,121,cscareerquestions,t3_1snok7c,False,
ogn6f0y,"Make them give you an offer. Don't say a number, unless you choose to go with like 200; very close to the top.",f_djt_and_the_usa,2026-04-17 02:54:57,85,cscareerquestions,t3_1snok7c,False,
ogn6wsc,Why are you so anxious/low confidence? Go there and kill it. Ask for the upper range and adjust if need be,Legal-Trust5837,2026-04-17 02:58:09,37,cscareerquestions,t3_1snok7c,False,
ogn6m3n,"Depends on your area and cost of living really.In NYC, I'd say it's middle of the pack. Fair range, but you'll see people who make less with more YOE (banking) and some people who make more with less YOE (Meta, Amazon, Microsoft).I think the most important thing for $165k is if you feel appropriately valued and if it's a significant increase from your previous line of work.",drugsbowed,2026-04-17 02:56:13,9,cscareerquestions,t3_1snok7c,False,
ognc6xy,"Always shoot high, if anything it creates the effect of high desirability. They’ll be willing to negotiate if they want to hire you.",nerdly90,2026-04-17 03:32:53,2,cscareerquestions,t3_1snok7c,False,
ogndna0,"In Houston working at an oil and gas mega corp, I make $155k base, 8% 401k match and got a $30k bonus for last year's performance. I'm a lead dev, 7.5 years experience. When I was a Sr (got promoted near end of last year), I was paid about $138k base and got a $20k bonus that year. Depending on 401k match, stock, bonuses, and location, your number seems fairly reasonable.",BeastyBaiter,2026-04-17 03:42:46,2,cscareerquestions,t3_1snok7c,False,
ognekcc,"Take what you'll be happy with. If it's a significant increase already and you think at all that you'll lose the job because you're asking for too much then go with it. It'll suck more to lose it and feel guilty that you lost a huge bump for a 5-10% difference. You likely can squeeze out more, but you can also push for that in a year during raise conversations. At that point if they're not matching what you think you are worth then you can start looking for jobs and be able to always ask for the high end.",blazinghawklight,2026-04-17 03:49:01,2,cscareerquestions,t3_1snok7c,False,
ogno9oe,Okay if you want 165k you need to ask for 180k and give them reasons why you’re worth the 180k. They’ll come back to you and offer you xxx and at that point you ask for 170k and they’ll come back at 165kThis has always worked for me and at most I’ve only really do one round of negotiations for jobs I’ve liked.,Shinne,2026-04-17 04:59:44,2,cscareerquestions,t3_1snok7c,False,
ognowxd,Find the median pay for that company and ask for slightly above that,scavenger5,2026-04-17 05:04:43,2,cscareerquestions,t3_1snok7c,False,
ogntj5d,"$165k is totally reasonable for that range, especially with 7 yoe and a masters. anchor higher if anything, you can always come down. first offer is almost never their best.",Miamiconnectionexo,2026-04-17 05:41:29,2,cscareerquestions,t3_1snok7c,False,
og64dza,The market is fucked. It's OK to take a job in another field to pay rent. Keep your skills sharp in your free time.,PatchyWhiskers,2026-04-14 17:28:18,55,cscareerquestions,t3_1slf1ot,False,
og65zri,I’m burnt out too but thankfully still have my (modestly paying) job. Just hanging on for dear life tbh.,ZolaThaGod,2026-04-14 17:35:19,58,cscareerquestions,t3_1slf1ot,False,
og6vm24,Equity only? Thats a scam,x2manypips,2026-04-14 19:29:10,47,cscareerquestions,t3_1slf1ot,False,
og63uj6,"The market is completely fucked right now. If you haven’t already, consider in-person roles, expand the geographical search radius if you can (might have to relocate) and don’t be opposed to a pay cut. It’s rough out there.",Old-Possession-4614,2026-04-14 17:25:58,21,cscareerquestions,t3_1slf1ot,False,
og76a6f,"I've been in the industry for over 15 years and have seen a few cycles. What you're experiencing now is rough - genuinely rough. But don't lose sight of the fact that 20 years of experience is a massive asset, not a liability. Companies that are still hiring are looking for people who can navigate ambiguity. Sometimes the best move is to take a short break, reset, and come back with a fresh perspective. The market always turns - it just takes time. Hang in there.",pattern_seeker_2080,2026-04-14 20:15:48,16,cscareerquestions,t3_1slf1ot,False,
og73av0,"If you're not getting bites, it suggests an resume issue. Maybe link it here?",lhorie,2026-04-14 20:02:48,6,cscareerquestions,t3_1slf1ot,False,
og6exq0,"From what I’ve seen, the market really is rough right now, especially for experienced devs who should not be struggling this hard.One thing I’d change is volume. 500+ applications usually means the search got too broad. A tighter list of companies, direct outreach to hiring managers, and leaning harder on past coworkers tends to work better than another hundred cold apps.And after this long, burnout starts bleeding into the process whether you want it to or not. Taking a short reset is sometimes more productive than grinding even harder.You’re not crazy. This market has been wearing people down.",KnightofWhatever,2026-04-14 18:14:38,8,cscareerquestions,t3_1slf1ot,False,
og7pmm5,So you worked at a company for 2 years with no pay???,Illustrious-Film4018,2026-04-14 21:44:02,3,cscareerquestions,t3_1slf1ot,False,
og7ar74,It's all about key words. Everything goes through AI now so you have to hit the right words. I completely re did my resume. I gave AI my old one and then just started rambling about what I did at each job. Then I let AI pick the key words. I'm a little worried it's overselling me but AI did the translation and has a better grasp of the new terms than I do. I come from the data side and the best example is data pipelines. It sounds new but if you've loaded fact and dimensions you've technically built pipelines. I suspect the people not getting any interest from recruiters need to update the terms and skills somehow. Edit: I should add that I'm going back to the office 4 days and I suspect it was a big factor in getting this position vs the national remote jobs I couldn't even get past the recruiter due to hard requirements,SoggyGrayDuck,2026-04-14 20:35:28,6,cscareerquestions,t3_1slf1ot,False,
og7yzdb,"I’m going to get downvoted to hell for this…But 20 years in the industry means you’re a senior. Seniors are in very high demand right now. If even the dozens of coworkers you’ve had during your 20 year career won’t hook you up, I think the problem is not the market…",lambdawaves,2026-04-14 22:31:51,4,cscareerquestions,t3_1slf1ot,False,
ofntxvt,"Just say you wanted a different challenge. Mention you liked your coworkers and the work was good, but you wanted a change of pace",Big_Action2476,2026-04-11 23:56:00,128,cscareerquestions,t3_1siyshj,False,
ofoctdx,"I honestly don't think any company really gives a shit why you don't work at your previous company anymore. We are in the age of shameless Big tech layoffs. Everyone's getting laid off, every few years. Come up with something simple and leave it at that. No one has ever asked me twice or even shrugged at what I said",buttflapper444,2026-04-12 01:49:32,56,cscareerquestions,t3_1siyshj,False,
ofo6l1j,Or sometimes the manager just want slavesWhat stresses me is references. I didn't really interact with other coworkers I was doing stuff alone and mostly talked to my manager,Toys272,2026-04-12 01:11:34,16,cscareerquestions,t3_1siyshj,False,
ofny2cr,"my ChatGPT answer to your ChatGPT: This is a very common situation, and the key is: you want to be honest, calm, and forward-looking without oversharing or sounding defensive.Future employers are mainly trying to assess three things:Were you actually at fault (performance, behavior, layoffs)?Are you self-aware about it?Will it happen again?So your answer should remove emotion, remove blame, and focus on learning + trajectory.:small_blue_diamond: If you were fired for performanceKeep it simple and own it without self-destruction:“I didn’t meet the performance expectations in that role, and we decided to part ways. I’ve reflected on what went wrong, and I’ve since focused on improving in those areas, especially around ___.”Then pivot:“I’m now looking for a role where I can apply those lessons in a stronger environment.”What NOT to do:Don’t say “it was a toxic manager”Don’t say “they didn’t understand my work”Don’t over-explain:small_blue_diamond: If it was partly situational (“life happened”)You can acknowledge context, but don’t lean on it too hard:“There were some external circumstances at the time that affected my performance, and I wasn’t able to meet expectations consistently. I take responsibility for that outcome.”Then immediately shift to growth:“Since then, I’ve made changes in how I work and manage priorities, and I’m much more stable and structured now.”:small_blue_diamond: If you were laid off (best case scenario)Be direct:“The company went through a restructuring and my role was eliminated.”Then optionally:“I used the time to focus on ___ and prepare for my next role.”:small_blue_diamond: The golden formula (works in most cases)1. One sentence of truth (no drama)2. One sentence of ownership (even partial)3. One sentence of learning / improvement4. One sentence redirecting to new job:small_blue_diamond: What interviewers actually want to feelNot:“Perfect employee with perfect history”But:“This person is stable now”“This person won’t repeat past mistakes”“This person is self-aware and low-risk”",NewChameleon,2026-04-12 00:20:18,-50,cscareerquestions,t3_1siyshj,False,
ofo81g3,"This doesn't work quite as well if you've been unemployed for six months. You can also just tell them you got laid off. Quiet layoffs happen constantly under the guise of ""performance""",gringo_escobar,2026-04-12 01:20:16,65,cscareerquestions,t1_ofntxvt,False,
ofpinox,"This.The point of those questions is not to get the answer on why and if you got fired, but to hear how you speak of your former employers.",casastorta,2026-04-12 06:48:25,12,cscareerquestions,t1_ofoctdx,False,
ofs0mmt,How does one do software dev without really interacting with other coworkers lol,serg06,2026-04-12 16:31:39,3,cscareerquestions,t1_ofo6l1j,False,
ofpsvn8,"Sorry, you do not meet the minimum sitewide comment karma requirement of **10** to post a comment. This is comment karma exclusively, not post or overall karma nor karma on this subreddit alone. Please try again after you have acquired more karma. Please look at the [rules page](https://old.reddit.com/r/cscareerquestions/w/posting_rules) for more information.*I am a bot, and this action was performed automatically. Please [contact the moderators of this subreddit](/message/compose/?to=/r/cscareerquestions) if you have any questions or concerns.*",AutoModerator,2026-04-12 08:14:58,1,cscareerquestions,t1_ofpsvl3,False,moderator
ofo0fd0,"Please don’t listen to this guy and say you didn’t meet performance expectations, you will not be taken seriously",rtropic,2026-04-12 00:34:32,31,cscareerquestions,t1_ofny2cr,False,
oggswfr,"Checking out other resumes: for project inspiration, to check the competition that’ll make you feel dumb, and learn where to strengthen your skill set. Narrow your focus to one thing like DevOps and build around that one thing! I did not build these, they are common tools that can help: As far as projects check out roadmap.sh it’s what I use. And for System Design & DSA in small spurts codenexus app. Then keeping that resume, LinkedIn, and website polished",WTFIZGINGON,2026-04-16 05:07:24,7,cscareerquestions,t3_1smtu46,False,
oggtm3k,"The trap you are in is common and it has a specific solution. You are treating ""stay technical"" as a side project that requires hours of free time you do not have. It does not have to be that. The actual skill you are losing is not technical knowledge. It is technical VERBAL fluency. You can know how a system works and still struggle to explain it under interview pressure. Those are different skills and they are trained differently. What works in the time you actually have: Daily micro habit, 10 to 15 minutes. Read ONE technical article or architecture breakdown per day (High Scalability, ByteByteGo, InfoQ) and summarize it out loud to yourself in one minute. You are training the muscle of talking about systems clearly. After 3 months you will notice your vocabulary and framing has changed even without building anything new. Weekly structured thing, 60 to 90 minutes. Pick ONE topic (e.g. ""database indexing"" or ""load balancing"") and do one of three things: (1) explain it to a rubber duck on video and watch the video back, (2) write a short LinkedIn post about it, (3) have a technical friend ask you questions and answer them live. This is the closest approximation to interview practice without needing an actual interview. Interview prep, 2 to 4 hours per week when actively searching. Not leetcode grinding. Mock interviews with specific focus on explaining, not solving. Pramp and [Interviewing.io](http://Interviewing.io) give you real practice with other candidates or engineers. A single mock interview per week is worth 10 hours of solo leetcode for the specific problem you described (fumbling the verbal part). Project work is honestly optional for your stage. You do not need a flashy portfolio to get interviews. You need the stories you already have from your day job to land cleanly in conversation. Spend the time sharpening how you tell those stories, not building new side projects. The hidden truth of tech interviews at senior new grad level: the technical depth is usually fine. The delivery is what tanks most candidates. You can fix delivery with 1 to 2 hours a week if you aim it at the right target.",Substantial_Baker_80,2026-04-16 05:12:50,81,cscareerquestions,t3_1smtu46,False,
oghqjos,What roles are you applying for? I am a former recruiter and a FE developer now. I am happy to schedule a free mock interview with you if you want. But I am a FE so not sure if I can help much if you are applying for a backend specific roles. Otherwise -> chat gpt is your friend. There is an option to call chatgpt and ask for a mock interview. That will allow you to practice speaking about tech concepts.,Charming_Part_3713,2026-04-16 09:58:58,4,cscareerquestions,t3_1smtu46,False,
ogjbbly,> Just wondering how others do it? day job is *not* in tech? That's what makes it hard. I try and limit my 'industry catchup' time when i have onclock downtime. Waiting on builds/pipelines/etc when I don't have the mental capacity to start/monitor *another* agent on a new task.,w0m,2026-04-16 15:17:32,2,cscareerquestions,t3_1smtu46,False,
ogl2mlv,"Me and all my friends who job hop around higher paying tech companies are not interview prepping as a full time job. They'll do it 1 or 2 hours a day, a couple days a week over a month or two. If they're really dedicated, you can start soft quitting your job at work - you'd be surprised at how slowly people catch on when you take your foot off the gas and reduce your workload by ~20%A better question is, what exactly are you so lacking in that you need so much time to prepare for in an interview?",PlasticPresentation1,2026-04-16 20:00:14,2,cscareerquestions,t3_1smtu46,False,
ogkd267,"Interview a lot, even when you don’t need to be, and it will become a lot more clear how you can solve this problem.",GrayLiterature,2026-04-16 18:03:48,1,cscareerquestions,t3_1smtu46,False,
oglfn8z,"honestly just keep a small side project alive the whole time, even if you only touch it once a week. that way when an interview drops you have something fresh to talk through and the technical muscle memory comes back way faster.",Miamiconnectionexo,2026-04-16 20:59:59,1,cscareerquestions,t3_1smtu46,False,
oggtg7n,"ah well, I most meant literally timewise.Like, I need to go shopping this evening. That's an hour. Then I need to cook dinner. That's an hour. I also need to do washing, fold washing, make some appointments for other things. I usually meal prep so I am not cooking every night, but there is always a lot to keep on top of, and as mentioned I have non-negotiable responsibilities such as ""dependants"", (not quite, but close enough).I also don't earn enough to outsource chores/repairs to a service, I have to sort everything myself, like repairs around the house for example.",Complex-Beginning-68,2026-04-16 05:11:36,5,cscareerquestions,t1_oggswfr,True,
ogguaom,"This is genuinely so very helpful, and perfectly describes the issue I have, which I think must have stem from never discussing tech shit. I could tell you in 10,000 different words how to disassemble parts of a car, can't for the life of me easily describe how my code works or something, lol.",Complex-Beginning-68,2026-04-16 05:18:08,12,cscareerquestions,t1_oggtm3k,True,
ogiqr1f,"FYI, This is an ad :face_vomiting:",EntropyRX,2026-04-16 13:43:15,38,cscareerquestions,t1_oggtm3k,False,
ofr5juh,Is there time? Does someone above me want a RCA?,PotentiallyAPickle,2026-04-12 14:03:55,60,cscareerquestions,t3_1sjfcga,False,
ofr7v49,"The better engineers know where to draw the line. Always RCA doesn't make sense in a practical world. Repeated issues or anything that is capable of corrupted state, yeah it makes sense to do so. An internal tool that gets used a few times a day or a customer facing service in maintaining mode serving non critical data? It's whatever as long as it's fixed.",Late-Introduction707,2026-04-12 14:15:50,20,cscareerquestions,t3_1sjfcga,False,
ofr6g3x,It depends where you work and the engineering culture. At my current job -- literally never. If anyone puts up a PR without showing a convincing understanding of the issue they get called out immediately.,shinglee,2026-04-12 14:08:34,48,cscareerquestions,t3_1sjfcga,False,
ofr667r,"Always RCA, learn something to prevent it happen again and amortize the cost in the long run",lrascao,2026-04-12 14:07:07,27,cscareerquestions,t3_1sjfcga,False,
ofrrv9y,"""It works now"" is never valid. You can't guarantee that it will work for customers that way. Maybe it will keep randomly failing for some. You always need to know why it works.",Comprehensive-Pin667,2026-04-12 15:51:00,7,cscareerquestions,t3_1sjfcga,False,
ofr7ube,"I work in realtime-critical embedded signal processing/protocols software, we do RCA for problems above certain criticality/impacts. There are always new learnings from RCA e.g. miscommunication between developers and domain experts, lacking test coverage etc. The reason is, robustness is important in such domain.",badboi86ij99,2026-04-12 14:15:43,4,cscareerquestions,t3_1sjfcga,False,
ofr9nq0,My tech stack is such a clusterfuck of rotating door dev work along with changing systems interfacing with the main product I work with to the point even asking questions risks it not working anymore. I’d love to understand and/or fix it but at this point it’s just about keeping it breathing long enough to pass off to the next guy.,Empty-Employment-889,2026-04-12 14:24:40,3,cscareerquestions,t3_1sjfcga,False,
ofrg22b,Give yourself a set amount of time. If you go over the time then it was too complex for the company to care and move on to the next thing. As an engineer you have the obligation to spend your company's resources ethically.,TurtleSandwich0,2026-04-12 14:55:39,3,cscareerquestions,t3_1sjfcga,False,
ofry6ti,"It depends on the impact. Recently we had an event that caused our main site to go down for over an hour. Estimated losses where 20-30k in that time and that was only the direct financial and didn't include things like lost customer satisfaction. You bet we did a full RCA for thatMore recently we also had a bug that caused some customers to be unable to complete orders. Sounds bad, but incomplete others end up in a queue for later processing, so the impact is that they're simply getting delayed. Doing an RCA for that was considered not worth it",Loves_Poetry,2026-04-12 16:20:16,3,cscareerquestions,t3_1sjfcga,False,
ofsowbq,"“It works now” is the bar to resolve an incident, it can be as braindead as reverting to a previous known-to-work commit.RCA is part of postmortem process, after production is back to healthy. It doesn’t mean you have to *fix* the root cause right away (e.g. maybe it’s due to some assumption that is deeply embedded in the architecture that would take months to fix properly), but at least understanding it will allow you reason about potential ways to work around the core issue and how effective those workarounds may be and how pragmatically they can be prioritized.",lhorie,2026-04-12 18:21:58,3,cscareerquestions,t3_1sjfcga,False,
oglrcld,"43% of 2026 being unemployed/underemployed is actually normal. Now if class 2024/2025 also has those numbers, that's a problem.Basically, even in good times it could take 6 months to get a job and most new grads wouldn't have managed to secure a job before graduating. It's bad times now so I wouldn't be surprised if takes 6-12 months to get a job.Edit: > Entry-level roles are being rewritten to require 2-3 years. This has been going on since I was a new grad (or looking at new grad positions while in school) nearly a decade ago bruh",Gold-Flatworm-4313,2026-04-16 21:58:45,90,cscareerquestions,t3_1snhmje,False,
oglvpk7,AI slop like this should be banned from this sub honestly.,Useful_Perception620,2026-04-16 22:21:49,93,cscareerquestions,t3_1snhmje,False,
ogmupmi,ChatGPT post with fake advice.  OP sells a shitty mock interview ai and posts slop that says you need to do mock interviews... what a coincidence.,qqqqqx,2026-04-17 01:44:31,11,cscareerquestions,t3_1snhmje,False,
oglygeq,Class of 2026? As in the one that hasn't graduated yet?,Comsicwastaken,2026-04-16 22:36:50,14,cscareerquestions,t3_1snhmje,False,
oglt30z,"The honest truth is unless you have a good network that can help you out, its literally all luck. You just gotta keep spinning the wheel until something lands",astroboy030,2026-04-16 22:07:49,12,cscareerquestions,t3_1snhmje,False,
ogm1p4s,"honestly the best moves right now seem to be targeting smaller companies and startups that actually need someone to wear multiple hats, and doing contract or freelance work to build that ""2-3 years experience"" they want. big tech pipelines are basically frozen for new grads but mid-size companies still hire if you can solve a real problem for them.",Miamiconnectionexo,2026-04-16 22:54:44,3,cscareerquestions,t3_1snhmje,False,
oglqq8q,"co-sign on this. what’s working for folks around me: build one project that mirrors the JD and ship it end to end, then put it at the top with 2-3 bullets on impact like “cut build time 35 percent by caching deps, added tests for X edge case, handled N users/data.” spend most of your energy on a tight list of 15-20 companies and try to get warm intros through alumni, former internship managers, or friends of friends, then send a short note tying your project to the role’s outcomes. be open to short contracts or QA/support engineer roles inside product teams, i’ve seen a few convert in a quarter when headcount opened up. also, do mock screens with a friend before the real ones and say your answers out loud, even 2-3 reps makes you sound way more composed.",dippatel21,2026-04-16 21:55:33,4,cscareerquestions,t3_1snhmje,False,
ogltuhz,I’ve been unemployed since 2024. I’m just over it and depressed now. Prolly gonna give up soon.,CollegeStudentLol1,2026-04-16 22:11:47,3,cscareerquestions,t3_1snhmje,False,
oglva6a,When I started in the field almost every job required 3 yoe and wouldn’t call you back until you had atleast 2,Known-Tourist-6102,2026-04-16 22:19:30,2,cscareerquestions,t3_1snhmje,False,
ogm28nj,"It’s not even May yet. Spring graduates, just walked down the aisle or will in May. 43% underemployed sounds superb considering those have full time offers before even graduating.",allknowinguser,2026-04-16 22:57:44,2,cscareerquestions,t3_1snhmje,False,
