id,body,author,created_utc,score,subreddit,parent_id,is_submitter,distinguished
o6cgtam,"The textbook,* Abelson, Sussman, Sussman, *Structure and Interpretation of Computer Programs* \[SICP\] * PDF from course website: [SICP\_6001](https://web.mit.edu/6.001/6.037/sicp.pdf) * The [MIT\_Press](https://mitpress.mit.edu/9780262543231/structure-and-interpretation-of-computer-programs/) webpage for itwill probably give a foundation to computer science as good as almost any book, especially the first three chapters.The main competition would be Donald Knuth's *The Art of Computer Programming* \[TAOCP\], which is five volumes rather than SICP's five chapters.",UnderstandingPursuit,2026-02-20 01:27:33,2,learnprogramming,t3_1r9bdmo,False,
o6bo730,Working Effectively with Legacy Code - Michael Feathers,comment_finder_bot,2026-02-19 22:40:26,1,learnprogramming,t3_1r9bdmo,False,
o6fcfn4,Post saved,TheBlegh,2026-02-20 14:19:59,1,learnprogramming,t3_1r9bdmo,False,
o6fpoir,"""CODE: The Hidden Language of Computer Hardware and Software"" by Charles Petzold is a great choice for understanding computer logic from the ground up without focusing on a specific language. It explains how hardware and software interact through historical examples like Morse code and electrical circuits. ""The Signal and the Noise"" by Nate Silver is also useful for learning the fundamentals of data and statistics in a broader context. Both books provide a solid big-picture foundation before you start writing actual code. Here's more if you're curious: [https://tripleten.com/blog/posts/7-inspiring-books-for-beginners-in-tech](https://tripleten.com/blog/posts/7-inspiring-books-for-beginners-in-tech)",TripleTen-Team,2026-02-20 15:26:12,1,learnprogramming,t3_1r9bdmo,False,
o6dxxuq,"I can double recommend the ""The Pragmatic Programmer"" book -> Helped me early on in my career",Medical_Bridge4968,2026-02-20 07:57:03,1,learnprogramming,t1_o6ba37q,False,
o6934qx,"It’s the muddiest title in the tech industry. many many people are business or data analysts with a scientist title. some are top tier quantitative researchers. + everything in between. some make 60k, some make 500k in big tech or millions at a hedge fund. hard to answer the question since the work is so varied within title.",CountyExotic,2026-02-19 15:08:23,4,learnprogramming,t3_1r91fcj,False,
o6b26vn,"My day as a junior: i dont really know if this can be considered data science, but here i go:I open the email, i open teams, i check tasks, i check excels, i import to R, i do some plotting, some descriptive stats, i do some modeling(other software included too) .Once i finish, i get the results into powerpoint presentations, or reports, and we do some iterations between me and my colleagues and manager to see errors, try to improve the analysis and such, and once is good we communicate the results with the department/s that asked us for help.But my salary isnt as high as people beleive, just because a few make a lot of money doesnt mean everyone does, plus you need to consider where they live, cost of life there, and such",SprinklesFresh5693,2026-02-19 20:50:33,1,learnprogramming,t3_1r91fcj,False,
o6ejsa4,IT'S A TRAP!,Anti-Sidewalker-666,2026-02-20 11:18:17,1,learnprogramming,t3_1r91fcj,False,
o6hv29b,"reading research papers, analyzing complex datasets and implementing algorithms .. at least in the medical sectorand a alot of meetings with senior data scientists who are sometimes almost as confused as you but then you work together to clear up assumptions and take the right pathto be honest i think working in tech, within the medical field is the most interesting and most fulfilling",Illustrious_Park7068,2026-02-20 21:29:30,1,learnprogramming,t3_1r91fcj,False,
o6req5f,"A lot of people are surprised that most data science work is closer to data cleaning, stakeholder alignment, and decision framing than pure modeling.The job is less about clever algorithms and more about asking the right question and making the output usable. That’s the part many courses don’t emphasize enough.",Willing-Astronaut-51,2026-02-22 12:25:23,1,learnprogramming,t3_1r91fcj,False,
o697r4d,"You're 7+ years late, and your impression of the field is like a meme from 2018. The vast majority of ""data scientists""  are just data analysts with extremely routine work.  It's a very poorly defined job title that has been redefined so many times that now you have data analyst, data scientist, data engineer...it's a joke, people with slightly different skills are just desperate to differentiate themselves because they learned an extra programming language or framework.There has been a ton of industry momentum away from generic ""data scientists"". Turns out that very few companies actually need to hire random bachelors degree holders or lower that learned a bit of Python and SQL that have no specific industry expertise i.e. the overwhelming majority of people looking into the field.  The few people who do this work are highly specialized and highly educated and would never be caught dead taking a udemy course.The technical barrier was perceived to be a lot lower than it is for swe so it got absolutely flooded in the last five years even more than SWE has. Add universities everywhere opening data science bachelors degrees, bootcamps, certs, self learners to the mix and the uncertainty of AI on top of the movement away from hiring generic ""data scientists"" and the field is a total mess.  All this hype for an industry that doesn't even exist in its former state anymore.Many grifters that shilled DS have moved onto AI.",Humble_Warthog9711,2026-02-19 15:31:48,0,learnprogramming,t3_1r91fcj,False,
o6iq5b0,This sounds like my dream job lol,96ataraxia,2026-02-21 00:18:02,2,learnprogramming,t1_o6b26vn,False,
o6av2hk,"I would not agree.Data science is the highest encompassing area these day, as they sometimes ask you to have a bit of SWE background and understand deployment of models.I do agree that 80% of the work is data cleaning, imputation, visualization, presentation to stakeholders, but the 20% is where it shines.You are basically putting in knowledge of a hundred year old statistical knowledge with a sprinkle of calculus and a large portion of linear algebra, optimization if you are OG and not a lib kiddie like me who uses gridsearchcv or optunaJavascript, C and C++ maybe make the world go round, but Data scientists decide how fast it should spin.They are the decision makers best resources. And as we know companies basically rule the world.Many are glorified BI, but those that are not, oh man you would not believe the knowledge and experience they have.Unfortunately a data scientist does not make ste stock go up like engineers, so they and ml teams are sadly the first ones to go.Just look at R libraries or scikit learn. You'll see equations up the wazoo.",SemperPistos,2026-02-19 20:15:34,2,learnprogramming,t1_o697r4d,False,
o699k3w,Came here to say the same. The Data Science hype is so 2019 ...,emicurb,2026-02-19 15:40:44,1,learnprogramming,t1_o697r4d,False,
o69sjdr,"So real. I know MULTIPLE people with business degrees that worked in management, then learned some python and SQL, and are now ""data scientists"" at their companies. Different companies, mind you lol.",unbackstorie,2026-02-19 17:11:56,1,learnprogramming,t1_o697r4d,False,
o6uhcpr,"Perhaps try to build something that solves some real life problem.Do you have interests or hobbies? Make something related to these. Are you doing something manually? Try to automate it. Is something taking too long? Look into optimizing it and/or speeding it up.Your goal should not be building useless things you see in tutorials but your goal should be improving your own life and the life of people around you. Why are you learning to program? To copy stuff from tutorials? Is ""tutorial websites"" the actual goal? Okay, you built the website. What next? Will it sit in your Github and collect dust? Re-define your goal.",mandzeete,2026-02-22 21:46:20,9,learnprogramming,t3_1rbyhq4,False,
o6ugaty,"If you're looking for little problems to solve, I always recommend [Simple programming problems](https://adriann.github.io/programming_problems.html)!If you're looking to build actual *things*, why not brainstorm with AI?",abrahamguo,2026-02-22 21:41:07,4,learnprogramming,t3_1rbyhq4,False,
o6uv0qz,"I built a weather app pulling from a free API my first week and it forced me to actually learn fetch, state management, and basic design instead of getting lost in tutorial hell. Start stupidly small like that instead of waiting for the perfect idea.",Bartfeels24,2026-02-22 22:58:37,2,learnprogramming,t3_1rbyhq4,False,
o6uwmb5,"I looked on TikTok for inspiration lol I saw multiple ""make these projects for your portfolio"" posts and it gave me my own ideas. One was a sunscreen reminder by using an API to pull the UV Index for that day and it made me think about how my daughter checks the UV every single day because she wants to tan, so instead of a sunscreen reminder I built something that would help her. Think about any hobbies/interest you (or even friends or family) have and how you could automate it or build something related to them.",Frosty_Principle_343,2026-02-22 23:07:27,2,learnprogramming,t3_1rbyhq4,False,
o6vlo3w,build a web scraper that collates ideas from replies to reddit posts asking for project ideas.,ffrkAnonymous,2026-02-23 01:32:09,2,learnprogramming,t3_1rbyhq4,False,
o6w1xjy,The best way to come up with your own ideas is to look around you and try to identify something that can benefit from automation.Having experience (by following guided tutorials) helps to open your mind to possibilities.Here are ~~two~~ three examples of projects that I did of my own volition:* https://www.instructables.com/Motion-Activated-Automatic-LED-Stair-Lighting-With/* https://www.instructables.com/Household-Environmental-Monitor-IoT-Solution/* https://www.instructables.com/Event-Countdown-Clock-Covid-Clock-V20/,gm310509,2026-02-23 03:11:17,2,learnprogramming,t3_1rbyhq4,False,
o6wyh10,Are you interested in making games? There's tons of game jams on itch where you can practice making small projects in short timeframes,aezart,2026-02-23 07:21:15,1,learnprogramming,t3_1rbyhq4,False,
o6uhptj,"I’m specifically staying away from walkthrough tutorials to combat this. Thank you, I have some sort of clue. If I make progress I’ll update you if you’re into that",Irw04,2026-02-22 21:48:11,4,learnprogramming,t1_o6uhcpr,True,
o71a8tb,It's surprising to find how many people simply lack access to their own creative faculty.,Interesting_Dog_761,2026-02-23 22:39:49,1,learnprogramming,t1_o6w1xjy,False,
o6uijea,Sure.,mandzeete,2026-02-22 21:52:23,5,learnprogramming,t1_o6uhptj,False,
o6pmr0b,"[Codeberg](https://codeberg.org/) is another somewhat popular alternative Unlike GitHub, GitLab and most of their competitors, it's a non-profit organization.(And although I wholeheartedly agree with your principles, please bear in mind that Microsoft can harvest your code regardless of whether you upload it to GitHub. Every major AI company scrapes every bit of publicly available data that it can find on the web.)",teraflop,2026-02-22 03:12:52,8,learnprogramming,t3_1rbaj7a,False,
o6r06np,Gitea?,VivaPitagoras,2026-02-22 10:13:09,2,learnprogramming,t3_1rbaj7a,False,
o6plnv2,gitlab?,pandorazboxx,2026-02-22 03:05:27,1,learnprogramming,t3_1rbaj7a,False,
o6qihah,Bitbucket,deltageek,2026-02-22 07:23:45,1,learnprogramming,t3_1rbaj7a,False,
o6ra86r,"I've used GitLab for personal projects and it's been pretty solid and you can share your code with others without them needing an account. And it's kinda similar to GitHub but not owned by Microsoft. I mean, it's not perfect, but it works for small projects like what you're describing.",Any-Main-3866,2026-02-22 11:47:44,1,learnprogramming,t3_1rbaj7a,False,
o6plqdx,"Similar convo, albeit a few years old [**https://www.reddit.com/r/git/comments/zyr7iu/what\_is\_a\_good\_alternative\_to\_github\_that\_will/**](https://www.reddit.com/r/git/comments/zyr7iu/what_is_a_good_alternative_to_github_that_will/)",babydemon90,2026-02-22 03:05:55,0,learnprogramming,t3_1rbaj7a,False,
o6r5i60,being somewhere other than github is a serious impediment to you.  this is a bad idea,StoneCypher,2026-02-22 11:03:37,-4,learnprogramming,t3_1rbaj7a,False,
o6q2c2s,"Thanks. I'll look into Codeberg. Your caveat is noted, and I thought about that after I posted. I still would rather not directly hand it to them",pfp-disciple,2026-02-22 05:03:45,1,learnprogramming,t1_o6pmr0b,True,
o6q1kzo,I thought I read that gitlab moved from providing free hosting? I'll look and see. Thanks,pfp-disciple,2026-02-22 04:58:03,1,learnprogramming,t1_o6plnv2,True,
o6rtg2r,How so? I've been programming professionally for over 30 years and nobody I know has been impacted by whether they use it.,pfp-disciple,2026-02-22 14:03:23,2,learnprogramming,t1_o6r5i60,True,
o6ip4pq,"To all following commenters: please, do not bring up the old circlejerk jokes/memes about recursion (""Understanding recursion..."", ""This is recursion..."", etc.). We've all heard them n+2 too many times.*I am a bot, and this action was performed automatically. Please [contact the moderators of this subreddit](/message/compose/?to=/r/learnprogramming) if you have any questions or concerns.*",AutoModerator,2026-02-21 00:12:13,1,learnprogramming,t3_1rac6si,False,moderator
o6iq0bi,real talk just scrape some housing data from zillow api then predict prices with different models. covers like 80% of your list and super relevant for econ,Different-Duck4997,2026-02-21 00:17:15,2,learnprogramming,t3_1rac6si,False,
o6iv4li,Git is the same concept as if you were coding something or making a project and you made a copy of it before you started working on something new that might mess it up.So when you mess it up. You just use the copy you made on your desktop if you had copied the folder or something beforehand. Git is the professional way of doing this,Zuldwyn,2026-02-21 00:46:43,1,learnprogramming,t3_1rac6si,False,
o6iv67y,try pandas for data cleaning and scikit-learn for ml models,Virtual-Breath-4934,2026-02-21 00:46:59,1,learnprogramming,t3_1rac6si,False,
o6kj87y,"Are you trying to learn whole of CS ? “Patience, young grasshopper” kung fu the series",Tintoverde,2026-02-21 08:10:55,1,learnprogramming,t3_1rac6si,False,
o6ne739,"If you're getting into exploring APIs, these guys at [Basketry](https://basketry.io/) are starting a project where they're trying to streamline the API creation process. It's all super new and IDK if it's anything you would need but it seems promising!",thwinks,2026-02-21 19:23:25,1,learnprogramming,t3_1rac6si,False,
o6oiz3c,"Try looking at open source too and start contributing could be something like docs, small bugs, typos etc. They do count.I recently launched my own open source thing and open to contributions myself so that could also work",Beneficial_Pie_7169,2026-02-21 23:01:42,1,learnprogramming,t3_1rac6si,False,
o6kppv8,"Thanks, I think something like this'll work",Lemonpie_jedi,2026-02-21 09:15:15,1,learnprogramming,t1_o6iq0bi,True,
o6kpshm,Ahh thank you,Lemonpie_jedi,2026-02-21 09:15:58,1,learnprogramming,t1_o6iv4li,True,
o6kpv4g,"Thank you, I'll check those out",Lemonpie_jedi,2026-02-21 09:16:42,1,learnprogramming,t1_o6iv67y,True,
o6irnqv,"After printing, then immediately break out of the loop using `break`.",abrahamguo,2026-02-21 00:26:40,1,learnprogramming,t3_1rabbz3,False,
o6itpb1,thank you it worked,TheEyebal,2026-02-21 00:38:26,1,learnprogramming,t1_o6irnqv,True,
o6gubmx,"just do it in swift. Don't dwell on language choice too much, what you need to practice is the general problem-solving cycle and being able to jump into the fray. You already have an apple watch, you're interested in this project idea, so just give it a go. Keep the project narrowly defined, focus on a slim MVP, try to timebox it and get to a working prototype as quickly as you can.",SoSpongyAndBruised,2026-02-20 18:32:39,3,learnprogramming,t3_1ra2ox3,False,
o6gz0k2,"honestly, building a smartwatch from scratch just to avoid swift is an insane detour lol. i'm building a telemetry data attachment for an rc plane right now and hardware/sensors are a whole different beast. you'll spend weeks just trying to get a bluetooth module to stay connected instead of actually writing your app.swift is definitely not a waste of time. hiring managers care way more that you can take an idea, learn whatever stack is required, and actually ship a finished product. just build the apple watch app. a working, polished ios app on your portfolio looks 10x better than a half-finished hardware project you abandoned because of a soldering issue.",Sweatyfingerzz,2026-02-20 18:53:56,2,learnprogramming,t3_1ra2ox3,False,
o6igujt,"There are tons of diy smart watch things out there, often based on ESP32 which you can program with Arduino",grantrules,2026-02-20 23:24:13,1,learnprogramming,t3_1ra2ox3,False,
o6ifkhr,"Hmm, yeah like I answered below, that the logic and problem solving is the same in every language, so might as well do in swift! I have a lot of other project ideas I can do, if I want to chicken out",EyeVirtual6644,2026-02-20 23:16:53,1,learnprogramming,t1_o6gubmx,True,
o6if6ye,"Bahah, cause I’ve done electronics projects before and liked it a lot, I actually thought I just might go there. But I guess the logic and problem solving is the same in any language, so might just go for it and do it in swift. Thanks!",EyeVirtual6644,2026-02-20 23:14:46,2,learnprogramming,t1_o6gz0k2,True,
o6b2p4o,For like game dev in unity etc. or other like app development?,Ok-Original-3475,2026-02-19 20:53:04,1,learnprogramming,t3_1r9b0ho,False,
o6bikap,maybe you should just start building things or look for open source projects on github that you can contribute to instead?,adambahm,2026-02-19 22:10:49,1,learnprogramming,t3_1r9b0ho,False,
o6emhlk,roadmap.sh,NationsAnarchy,2026-02-20 11:40:10,1,learnprogramming,t3_1r9b0ho,False,
o6b35tr,"app, cloud and ai/ml",cliixy,2026-02-19 20:55:21,1,learnprogramming,t1_o6b2p4o,True,
o61yld6,It needs tests and a delivery mechanism,Interesting_Dog_761,2026-02-18 14:00:57,2,learnprogramming,t3_1r83mxw,False,
o66ipwt,So uh how can I run it? Is there an exe for this if ever I don't want to compile the game myself?,Danque62,2026-02-19 03:33:13,1,learnprogramming,t3_1r83mxw,False,
o67bxw9,"Hi, it runs especially on Linux, there are some functions that I used in it that are not compatible with Windows, also the the Windows terminal doesn't support special character (mandatory for the pawn). I'm sorry but I'm still learning to make portable applications.",Distinct-Cancel1995,2026-02-19 07:09:09,1,learnprogramming,t1_o66ipwt,True,
o68jsu5,"So I have to run it via WSL. Got it.I guess my suggestion for now is to give instructions on how to either build or run your app. And in general, format your README markdown file, like adding headings and such.",Danque62,2026-02-19 13:22:30,1,learnprogramming,t1_o67bxw9,False,
o5x7iz9,Depends on language and OS and if you want cross platform or not.,fuddlesworth,2026-02-17 19:51:31,13,learnprogramming,t3_1r7gkll,False,
o5x7kq1,"Generally speaking, most GUI frameworks will make it so the easiest, default thing to do is to make an app that follows the look-and-feel conventions of your operating system's GUI toolkit. Some even aspire to be cross-platform (although frequently the result you get from such a system looks more out-of-place than if you used the OS's supported toolkit directly).The Linux ecosystem is a little bit of an outlier here, since you get to answer the question ""What does it look like if I use the built-in API"" with the question ""... the what?"" But Linux windowing toolkits will also provide defaults that make it easiest to make apps written with them look similar.",fixermark,2026-02-17 19:51:44,8,learnprogramming,t3_1r7gkll,False,
o5x8b2t,"That's because these apps use the OS's UI frameworkFor windows - **Win32 API**, WinForms **WPF**, **etc****For linux - Gtk / Qt****Idk about macos****So when you use these frameworks / libraries when writing apps, and say create a button, the os creates a standard button and uses the system's theme to style it.****That's the reason apps built with cross platform frameworks like electron, flutter, etc look different. This is because they render the components using custom styles**",Nice-Essay-9620,2026-02-17 19:55:09,3,learnprogramming,t3_1r7gkll,False,
o5xh6b7,"Depends on how you make it, but say if you use the stuff Microsoft supplies to make a Windows app, by default, it all looks like other apps you see, but there are lots of options to change how it looks.",Pale_Height_1251,2026-02-17 20:37:27,1,learnprogramming,t3_1r7gkll,False,
o5xjz2c,"Exactly.You can make “your own” like JavaFX for java programs or tkinter for python, and thus make gui in a ton of operating systemsBut windows, mac and linux have their own as well. Using swiftUI for mac, it defaults to mac fonts, etc. you can call operating systems functions, like save a file or open photo library. Buttons will use native design, like a button can have a glass effect modifier to make it .. glass-like. But you dont have to.",SourceScope,2026-02-17 20:50:46,1,learnprogramming,t3_1r7gkll,False,
o5xssum,"> do I call some OS API that predefines UI components and how they look like Yes.The API may not be part of the OS itself (like Qt or GTK on GNU+Linux), and there may be an abstraction layer between your components and the native UI components (like React Native or Java AWT), and the developer still has guidelines to follow to ensure the program looks and behaves canonically, but you're essentially right.",high_throughput,2026-02-17 21:32:11,1,learnprogramming,t3_1r7gkll,False,
o5y3c0t,"In some systems, it's the OS API (Windows COM/DCOM), in others it is a ""toolkit"" which is the old name for ""drawing support library""Gtk is an example of a toolkit, Qt is another. Swing is popular for Java, AWT, etc.The toolkits contain ""widgets"" which are the components that implement buttons, etc.The X11 system sometimes called their toolkits ""widgets"", back when you were writing more of the plumbing. There's the Athena Widget Set, TK (from Tcl/Tk, repackaged to be used by other languages) etc.Some of the more advanced solutions (Qt, Swing, etc.) support ""look and feel"" which is an attempt to make one portable library look like the native widgets for different environments. So Swing can look something like Windows, OSX, or Gtk.So it's not really all ""it always looks the same. Often it doesn't, when one technology contains a different set of widgets, or a different toolkit. With some careful inspection, you might now start to see the differences.",edwbuck,2026-02-17 22:22:27,1,learnprogramming,t3_1r7gkll,False,
o5xmu0e,You as the programmer determines how your app will look like. It's your work to make it look the way you want it to. Or maybe you are lazy and you just go with whatever library components look like by default.,r2k-in-the-vortex,2026-02-17 21:04:23,-5,learnprogramming,t3_1r7gkll,False,
o5xj96z,"MacOS uses SwiftUI in these modern timesThough other options are available I mean, swift is used and there are cross platform alternatives to swiftUI that work on mac, linux and windows.",SourceScope,2026-02-17 20:47:22,3,learnprogramming,t1_o5x8b2t,False,
o5xoh7w,"SwiftUI nowadays, UIKit before that.",pak9rabid,2026-02-17 21:12:12,2,learnprogramming,t1_o5x8b2t,False,
o5v3cb8,"Well, yes it is better - but you don't need to do it immediately, you can wait till it becomes necessary, for instance when you begin to add new abilities, or want to store them in savegames or something.Usually a process like this one is fine, especially when learning:1. First, hardcode values directly where they are used.2. Then move them into variables3. Then combine those variables in classes - the same classes that handles objects in the game4. Then move then out of those classes and into separate data-classes, separated from the behaviour5. Then make it possible to read and write the data-classes to files - enabling savegames6. Then go further on with your online multiplayer-game, and transmit the data-classes across the network, or whatever :)The idea is that you don't build anything more complicated than you need at the moment - always remember the YAGNI principle when deciding to make advanced solutions - and that you only take small steps, always making sure that everything still works as intended, even when moved around in the code.",peterlinddk,2026-02-17 13:36:24,5,learnprogramming,t3_1r75rje,False,
o5vp1mu,"It's completely up to you. There's nothing inherently wrong with a 100k line configuration class.But if separating them makes more logical sense to you, then go ahead.Look at your development flow, not what you think is correct. If you find yourself creating these files in excel, just write an excel parser. What gives you least resistance moving forward?You'll find all of this will be very easy to refractor when you need to.",bikeram,2026-02-17 15:30:28,2,learnprogramming,t3_1r75rje,False,
o5v3s3r,"I think you’re asking whether your game app should have a textual configuration file. If it were my project I’d decide this by asking “is the code easier for my future self to read, maintain, and update, with or without the configuration file?”",Aggressive_Ad_5454,2026-02-17 13:38:52,1,learnprogramming,t3_1r75rje,False,
o64su3k,Every individual bit of data should be in its own file. I have spoken.,Next_Highlight_4153,2026-02-18 21:53:02,1,learnprogramming,t3_1r75rje,False,
o71qetc,Python,no_regerts_bob,2026-02-24 00:09:09,6,learnprogramming,t3_1rcyor0,False,
