id,body,author,created_utc,score,subreddit,parent_id,is_submitter,distinguished
ont3t3y,Something you are interested in. Something you would like to use yourself. Then you’ll show passion at the interview.,Kenny-G-,2026-05-25 16:05:40,1,learnprogramming,t3_1tnddv6,False,
ont4ncf,"I would build a basic CRUD web api using FastAPI. I say this specifically because many companies are hiring AI Engineers and some of them are not interested in learning to build out APIs and are more wanting to develop prompts and rules, etc. So they get paired with a python developers.I worked on a client earlier this year where I had to rewrite 3 months worth of code because both the AI Engineers didn't mention they don't really build out APIs and things got so bad, humans couldn't read or understand the majority of the code.I would also build a chatbot with rules, which I think is in pretty high demand right now. Just one that handles the basics of conversation, but also uses LLMs to make sure system and user prompts are safe, etc. Basically you dont want a bot telling you to harm yourself is the idea.Hope this helps!",idreaminecmascipt,2026-05-25 16:09:41,1,learnprogramming,t3_1tnddv6,False,
ont56ej,"This depends entirely on what you are into, meaning your interests or studies.Something I am looking at creating at some point myself is basically a mini version of Wolfram Alpha. The reason being that very often at my university we aren't allowed access to the internet for exams, but we are allowed to use our computer however we want otherwise (Wordmat, Maple, GeoGebra, Python etc.), and for physics Python has a bunch of tools, but it is annoying to work with without having something premade with a lot of abilities/functions.I would also like to build a program that can calculate and visualize Taylor expansions, and then have a slider to chose how many expansions to incorporate, and another thing to type in the *a*\-value.Another thing I would like to make is a program which can simulate and animate different classical mechanics problems, such as the three-body-problem or the double pendulum, as well as visualize the energies.",iMagZz,2026-05-25 16:12:11,1,learnprogramming,t3_1tnddv6,False,
ont6puh,you should work on the project which looks real like Price hikes on Car how this effected the sales like this something which is happening and you have analysed things over that.,Any-Cardiologist1641,2026-05-25 16:19:25,1,learnprogramming,t3_1tnddv6,False,
ont9umg,"those physics simulation ideas are really solid, especially the double pendulum thing since it shows you can handle complex math and visualization together i'd probably go with something that actually solves a problem you have - like that offline wolfram alpha idea is pretty clever for exam situations. makes for good talking point in interviews too when you can explain the real use case behind it",Better_Sea8446,2026-05-25 16:34:21,2,learnprogramming,t1_ont56ej,False,
ontnapf,I was mostly doing game dev in pygame,TheEyebal,2026-05-25 17:37:43,2,learnprogramming,t1_ont56ej,True,
ontfep9,Yes I agree. It was also just to give OP a few ideas that I thought about in relation to my own area and interests.,iMagZz,2026-05-25 17:00:41,2,learnprogramming,t1_ont9umg,False,
onqatiq,I’m in third year of CS degree and maybe tops 50 leet code problems. But a lot of projects and open source contributions. I would say you’re in a good stage. Keep going with leet code but start focusing on some projects. Maybe some open source contributions but that’s kinda hard.,Worldly_Analysis_664,2026-05-25 04:40:40,3,learnprogramming,t3_1tme0fa,False,
onnkqbw,"I can't comment specifically on your field (I'm an embedded C and Rust developer), but the general advice I can offer is: * Write projects that use the algorithms you've learnt* Have evidence you can use in interviews (when you used an algorithm, the problems it solved)* Don't compare your progress to other people's progress too much: * There's always someone with a head start on you * There's always someone who hasn't started yet * Keep comparisons healthy (don't only compare yourself to the top 1%) * Imposter syndrome is normal* Research the technologies and languages that jobs in your field require, then learn and use them.* Make practice deliberate (i.e. I'm doing this project to learn `X` and `Y`)* Have fun and don't burn yourself out.I defer to someone else to give field-specific advice, but for the next 6-12 months I'd say keep learning, and have at least one larger project you can reference.",RossMorgan363,2026-05-24 19:10:23,1,learnprogramming,t3_1tme0fa,False,
onoce7m,"You're definitely not behind - second year and 125 leetcode problems is actually solid progress. I'd say focus more in building actual projects rather than just grinding algorithms. Pick one area (web dev or ML) and go deep for few months instead of jumping around. For AIML student, maybe start with some ML projects since that's your major? You can always pick up web development later when you need it for deploying models. The key thing is having something real to show - employers care more about what you built than how many coding problems you solved. Don't get too caught up with LinkedIn posts, people tend to oversell their achievements there anyway.",HastyMainframe,2026-05-24 21:30:27,2,learnprogramming,t1_onnkqbw,False,
onjyfg1,"Sure, I think stuff like NATS and Kafka both support multiple consumers.",DrShocker,2026-05-24 05:29:55,2,learnprogramming,t3_1tm2z0f,False,
onkfrbq,Yes. Having more than one message type isn't a given. There are many multi-consumer (and multi-producer) message queues that only deal with one type of message. If you're writing it then you can make it work however you like.,HashDefTrueFalse,2026-05-24 08:00:26,1,learnprogramming,t3_1tm2z0f,False,
onkqnln,Coming from the world of SaaS it really depends on the queue implementation. Some queues have consumer groups where a message is visible to the group and consumed by one consumer(so having multiple groups would result in multiple consumptions) Kafka works like that. Other solutions like SQS do not have this concept and require fan out through multiple queues usually via something intermediary like SNS.I imagine lower level implementations work similarly.,dyslechtchitect,2026-05-24 09:40:22,1,learnprogramming,t3_1tm2z0f,False,
onmod9z,Many html servers support multiple processes to better deal with requests.You do have to be careful taking things off the queue. It's best to have separate input and output queues.Have fun!,JGhostThing,2026-05-24 16:37:14,1,learnprogramming,t3_1tm2z0f,False,
onmpvn4,"Yes. This is a very common thing. Consult the manual of whatever you use to figure out how they behave with multiple writers and multiple readers.You need to make sure that the access to the queue are atomic, that is to say that they can't be interrupted.",esaule,2026-05-24 16:44:21,1,learnprogramming,t3_1tm2z0f,False,
onnbmvj,Look up pthreads and mutex locking,igotshadowbaned,2026-05-24 18:25:34,1,learnprogramming,t3_1tm2z0f,False,
onjytcf,yeah works fine in practice,Evening-Living842,2026-05-24 05:33:10,2,learnprogramming,t1_onjyfg1,False,
onk0jg7,"I don't think I'm allowed to use tools that haven't been covered during our lesson, I'd have to use strictly System V mq. Would that still be ok? Of course, I'd make a new structure for the message",Avi250,2026-05-24 05:47:48,0,learnprogramming,t1_onjyfg1,True,
onlt3pl,"Another approach is topics-vs-queues. JMS and MQ implementations do this. If you create a ""topic"", then every consumer gets a copy of every message in that topic. If you instead create a ""queue"", then the system tries to deliver each message to only one consumer (though that can fail in edge cases because exactly-once semantics are practically impossible).",Justin_Passing_7465,2026-05-24 14:05:11,2,learnprogramming,t1_onkqnln,False,
onkh5nf,"What have you tried? If your clients are receiving on the same queue, there is your example of multiple receivers. The documentation says that...>If msgtyp is greater than 0, then the first message in the queue of type msgtyp is read,There is nothing in there to say you can't have multiple receivers asking for the same type, but it also doesn't say how the kernel decides who gets it first, so a safe assumption might be that it is an arbitary choice between processes that have called msgrcv with a common type. We could get a better answer if we [use the source, Luke](https://git.kernel.org/pub/scm/linux/kernel/git/torvalds/linux.git/tree/ipc/msg.c#l61), or [RTFM](https://tldp.org/LDP/tlk/ipc/ipc.html#:\~:text=Reading%20from%20the%20queue,up%20and%20run%20again) -- If I read that correctly, processes calling rcv get put into a _read queue_, they are going to see arriving messages first-come-first-served, and will remain in that read queue until a message of the requested _msgtyp_ is seen. That aligns with what I remember too.As for ""how"" to use them - that is completely up to you to design. You design it to fit your needs and operate within the documented constraints and behaviours. If I was reviewing work, I would be looking at things that make your application reliable and robust, and avoid leaking resources, like: How you generate and share the keys; How do you handle a client or servers going away (what happens if messages are left in the queue for it); How you handle application lifecycle properly (how do you cleanly and gracefully exit an application but not leave messages unanswered, which may involve another form of IPC); How do you handle queue lifecycle properly (how is it created and destroyed, that might require yet other forms of SysV IPC); How do you handle anticipatable errors (the queue being deleted out from under you, or you not having permission to access it, or it running out of message space, or trying to send or receive too large a message); How do you avoid deadlocks, Etc. The actual receiving and sending is probably one of the easiest parts.(You might ask is this SysV stuff relevant today. Funnily enough it was only relatively recently that I was maintaining and extending code that used SysV MQs, semops \_and\_ shmem. Even if you end up using more recent posix queues, message brokers, load balancers and more elaborate application protocols, etc, principles of robust design in distributed computing are still very relevant!)",LeeRyman,2026-05-24 08:12:59,1,learnprogramming,t1_onk0jg7,False,
ongt9k2,"Except 100 days of code which I only hear rest of the list should be solid foundation.Anyway I suggest stick to something very basic course, then dig in problems. Some of mentioned above have specific audience like webdevelopment. CS50P - solid introduction, Helsinski - adding few examples about game programming in Python, MIT 6.0001 - some part about efficiency, 6.1000L has some part of extra.When you have basic in theory - loops, variables, alghorithms go to specific niche of python. If you do data analysis - pandas for example. You don't have to pay anything. Read lectures, watch videos and you can learn for free. Python is not rocket science. A lot of resource double some parts.Even with W3school you can get basic needed for problem solving, if you look for more you can for example extend interesting you parts by freecodecamp:[https://www.freecodecamp.org/learn/python-v9/](https://www.freecodecamp.org/learn/python-v9/)For me better will be ask - what kind of problem you want to solve and look for this. Learning Python for learning itself is hard, because you don't know which part currently you need it. Some problem are more I/O bound, other better for concurency, different for web programming etc.",pepiks,2026-05-23 17:58:04,2,learnprogramming,t3_1tln10x,False,
onmjzjl,"Just pick whatever, it's a tool, a means to get something done, not your final end goal.",PuzzledAdeventurer,2026-05-24 16:16:38,1,learnprogramming,t3_1tln10x,False,
ongvtee,"Thanks for the answer! I get that most of the courses are probably fine. I was just curious to hear from people who might have done them and hear their thoughts.I want to learn with the purpose of being able to apply it to my degree, physics, which means it will mostly be computer science stuff I guess, like data analysis and simulations. However I would think learning and understanding the fundamentals of Python would help, and I enjoy following courses as that gives me a direct road to follow.Some things I would like to eventually do would be: Solving problems numerically. Being able to analyse real data from experiments, like making plots, fits, regressions, calculating uncertainties and adding those to the graphs, making animations of changing data and so on. It would also be fun to be able to simulate my own data and do fun things with that.",iMagZz,2026-05-23 18:10:53,1,learnprogramming,t1_ongt9k2,True,
onk4iao,"Look for reference: [https://becksteinlab.physics.asu.edu/learning/128/phy202-programming-for-physicists](https://becksteinlab.physics.asu.edu/learning/128/phy202-programming-for-physicists) and [https://lucydot.github.io/python\_novice/](https://lucydot.github.io/python_novice/)Look for free courses for your discipline. The basic will be the same, but at the end you will see field specific libraries and aproaches.",pepiks,2026-05-24 06:21:56,2,learnprogramming,t1_ongvtee,False,
onf1ffo,"for grades + reminders you don't even need supabase storage, just use the database. spin up a free supabase project, create a `grades` table, then `npm install @supabase/supabase-js` and use `createClient(url, anonKey)` with the keys from project settings > API. supabase storage is meant for files (images, pdfs etc) so unless you're saving attachments you'd just be hitting `.from('grades').insert(...)` and `.select(...)`. if you tell us what error you're getting when you try to connect ppl can actually help",opentabs-dev,2026-05-23 12:21:02,1,learnprogramming,t3_1tlcels,False,
onfabc6,"Supabase is actually a pretty solid choice for this kind of project. You’d usually store the grades/tasks in a hosted database, then sync user data through authentication so each device pulls the same records after login.",patternrelay,2026-05-23 13:16:12,1,learnprogramming,t3_1tlcels,False,
onfkbi0,"you can use supabase , like for beginner level they offer free services . i myself did that yesterday only. Do let me know if there is a specific issue or step when i can help you",iblish69,2026-05-23 14:12:21,1,learnprogramming,t3_1tlcels,False,
onesbn0,"Pretty new to programming tbh just want it to be my hobby, i cant connect it to supabase i dont know why",Grim_Lock7536,2026-05-23 11:15:55,1,learnprogramming,t1_ones7l5,True,
on76yk8,"ah promises can be tricky at first! i remember struggling with the event loop stuff when i was learning too there's this really good video that explains the whole microtask/macrotask thing with actual visual examples - shows you exactly how the call stack works with promises. the guy draws everything out step by step which makes it way easier to follow than just reading about it also look for videos that cover async/await alongside promises since they're basically the same thing under hood, just different syntax",Forsaken-File9993,2026-05-22 06:30:13,1,learnprogramming,t3_1tka8v0,False,
on7gvoi,Jonas has a course on udemy ( JavaScript course). His videos available on youtube also. He explains with illustrations,MostWide5304,2026-05-22 07:54:57,1,learnprogramming,t3_1tka8v0,False,
on7huj7,"Jake Archibald’s “In The Loop” is the one I’d watch for microtasks/macrotasks. Philip Roberts’ “What the heck is the event loop anyway?” is great too, but more big-picture; Jake’s talk connects it to promises better. I’d watch with DevTools open and try to predict the log order before each bit runs.",WishboneComplete3410,2026-05-22 08:03:27,1,learnprogramming,t3_1tka8v0,False,
on4bg9r,"You are reading it wrong. `K-ZA-J` is not `K`, `ZA`, and `J` but rather `K-Z` (K through Z) and `A-J` (A through J).`K-Z` (K through Z) of course being shorthand for `KLMNOPQRSTUVWXYZ`.The basic use of `tr` is `tr klm abc` to `tr`ansliterate ""k"" into ""a"", ""l"" into ""b"", and ""m"" into ""c"". So you could do this by typing out `tr klmnopqrstuvwxyzabcdefghij `abcdefghijklmnopqrstuvwxyz`, but it's less tedious to use ranges to express the same thing.",high_throughput,2026-05-21 19:57:13,9,learnprogramming,t3_1tjvqtx,False,
on4d5xe,"That’s just the syntax for `tr`. `tr` swaps letters in the first argument with the letters in the same position in the second argument.`tr “ABC” “123”`would swap As for 1s, and swap Bs for 2s, and Cs for 3s.Another way to write `ABC` is `A-C`, and another way to write `ABCDEFGHIJKLMNOPQRSTUVWXYZ` is `A-Z`. So if you want the whole alphabet but starting at L, you can write `L-ZA-K` which gets the letters from L to Z and then the letters from A to K",maxpowerAU,2026-05-21 20:05:10,5,learnprogramming,t3_1tjvqtx,False,
on4avr0,"Either the course text is bad, or you're misreading it.""K-Z"" is just shorthand for all the characters from K to Z, and similar for the rest. So the first command is equivalent to: tr ""KLMNOPQRSTUVWXYZABCDEFGHIJklmnopqrstuvwxyzabcdefghij"" ""ABCDEFGHIJKLMNOPQRSTUVWXYZabcdefghijklmnopqrstuvwxyz""",johnpeters42,2026-05-21 19:54:35,4,learnprogramming,t3_1tjvqtx,False,
on4e50q,type `man tr` into your terminal,chrisrrawr,2026-05-21 20:09:42,4,learnprogramming,t3_1tjvqtx,False,
on4y7zr,"`tr` maps characters one-to-one. `""K-ZA-J""` is just the full alphabet starting at K: K,L,M...Z,A,B...J. The lowercase `""k-za-j""` is the same thing for lowercase letters. When you change the key to 11, everything shifts by one more letter so K becomes L, J becomes K, etc. The uppercase and lowercase parts are separate ranges that both do the same rotation, just for their respective cases. Try writing out the full alphabet starting at K and mapping each letter to A-Z and it'll click.",missymyszkaco,2026-05-21 21:47:27,2,learnprogramming,t3_1tjvqtx,False,
on4eelk,Thanks! I get it now.,Herbert_Tarlek,2026-05-21 20:10:56,1,learnprogramming,t1_on4bg9r,True,
on4ehq6,Thank you!,Herbert_Tarlek,2026-05-21 20:11:20,1,learnprogramming,t1_on4d5xe,True,
on4ec9v,"Thanks for your reply. I was grouping the letters incorrectly, so I couldn’t see the meaning.",Herbert_Tarlek,2026-05-21 20:10:38,2,learnprogramming,t1_on4avr0,True,
on50iw2,Thanks!,Herbert_Tarlek,2026-05-21 21:59:22,1,learnprogramming,t1_on4y7zr,True,
oo8ve7b,"Build real life projects without any external resources like AI or tutorials. I know this sounds obvious, but if you actually use the concepts you'll memorize them much better then just copying them down.",ImprovementLoose9423,2026-05-27 20:45:37,5,learnprogramming,t3_1tphwqx,False,
oo8xnsf,"How are you learning C at the moment?What preparation have you had?  Do you already know what a CPU register is, and what is meant by its size?   Do you understand how RAM is different from CPU registers?  Can you express your ideas in pseudo-code or flow-charts?Please supply some background information on your tech education if you want meaningful input.",Dazzling_Music_2411,2026-05-27 20:55:47,2,learnprogramming,t3_1tphwqx,False,
oo9e548,"Loop: Do the same thing over and over. // Based on a predicate while(/* this is true */) { // Do work in here } // With a counter for(int i = 0; i < /* some limit */; ++i) { // Do work in here } // A do-at-least-once loop do { // Work in here } while(/* this is true */);A predicate is a function that returns true or false: bool predicate() { if(you_think_this_is_a_good_idea) { return true; } else { return false; } }So `do` and `while` loops focus on the types of repeated activities that DON'T require a counter. while(robot_hasnt_fallen_in_the_hole()) { inch_forward(); }`for` loops are good for counting: for(int i = 0; i < 10; ++i) { printf(""%d) %s\n"", i, ""some text""); }Pointers are arithmetic types, so they're basically just a number. If the syntax is getting in your way, we can reduce that: typedef int_ptr int *; int x; int_ptr ptr_x = &x;It's just a type, like `int`. The catch is there is no single pointer type. There are addresses, and addresses are just addresses - and they're inherent to the machine. But WHAT is at that address is where the pointer type needs an additional ""kind"" - what am I dereferencing to? That way, the compiler can generate instructions that reads those bytes like an integer, or a structure, or something else. The other thing pointers can do is let you go to the contents at the address they store, so they store where in memory you're going to jump to when they're dereferenced. typedef struct { int data; } some_type, *some_type_ptr; some_type_ptr ptr = (some_type_ptr)malloc(sizeof(some_type));So we've called the allocator and got heap memory SOMEWHERE in memory, enough to store the structure in it, and we cast the pointer to that type (because malloc returns a `void` pointer - a pointer without a type). Now we can dereference that pointer: ptr->data = 7;`ptr` exists as a local variable, ostensibly in a function we're doing all this in. That's on the call stack. When that function returns, `ptr` disappears, but the heap allocation persists. So don't lose track! The arrow operator is a short hand for dereferencing the pointer and accessing the member. We could have written: (*ptr).data = 42;We can use pointers in loops over arrays: some_data array[100]; for(some_data_ptr iter = array; iter != array + sizeof(some_data[100]); ++iter) { iter->data = 0; }This is why the pointer knows the type it points to. We're pointed to the first element in the array, so incrementing the pointer (I said it was an arithmetic type) doesn't go to the next address, it goes a number of addresses that gets you to the start of the next value. We don't want to split memory across two instances - that would make for a junky programming abstraction that doesn't help you much.That's counting with an index vs iterating with a pointer. There are also data graph-like data structures you can create with pointers: typedef struct tree { int data; tree *left, *right; } tree, *tree_ptr; tree_ptr root;You can start to populate this tree. Put an integer at the root - 5. The next node will be a left or right child; if the value is greater than 5, it'll go to the right. If it's less than 5, it'll go to the left. You repeat that process until you get to an unused pointer - that's where you create the next node in the tree.Searching for a value is a binary operation - the node you want is either the node you're at, down the left, down the right, or not in the tree. Every time you go down the left or right - you cut the remaining tree search space in half. This makes the search logarithmic instead of linear, as in an array.Also - arrays are not pointers, they are distinct types. You saw me use that earlier - `array` is of type `some_data[100]`. Arrays implicitly convert to pointers as a language feature of some historic reasons. You can't pass arrays as values, so they don't have value semantics: void fn(some_data array[100]);Nope, that ""decays"" to `fn(some_data *array);`. This is why you always have to pass a size. You CAN pass a whole array - but by reference: void fn(some_data (*array)[100]);The extra parens are required. This is a pointer to an array. And yes, you can iterate arrays with pointers, meaning you can have arrays of arrays - say if you wanted to make a 2D or 3D grid of data.How do you learn this stuff and figure it out? Explore, practice, read the language spec a bit, read some blogs, and participate in the community. None of us do this by ourselves. Even by using your learning materials, you're learning from someone who had to write it in the first place.",mredding,2026-05-27 22:15:16,2,learnprogramming,t3_1tphwqx,False,
oo9ilii,"C is a beautiful language and will set you up well no matter what area you chose to go into so good choice to start!I always recommend [this video](https://youtu.be/zuegQmMdy8M?si=-X5qKnTXKOreQ5AV) about pointers, it’s still great. Put aside an hour a day over 4 days to watch it and you’ll have 90% of everything you’ll ever need to know about the subject.",_TheNoobPolice_,2026-05-27 22:38:30,2,learnprogramming,t3_1tphwqx,False,
oo9vl0w,"The syntax for pointers are annoying.But the idea passing the address location of an object, and then modifying it by writing to that address instead of changing the variable directlyWhile loops repeat a section of code until a condition changes For loops repeat a section of code a specific number of times and are good for iterating through things",igotshadowbaned,2026-05-27 23:48:36,1,learnprogramming,t3_1tphwqx,False,
oo9fc9n,"Goes without saying, but basic things to start.Not the most exciting, but I've found C is really good for brute forcing a few of the mathematical paradoxes.",Ratfus,2026-05-27 22:21:25,1,learnprogramming,t1_oo8ve7b,False,
oo9h4wz,"Arrays are just bounded/locked pointers. A[1]=(asterix)(A+1)If you have function that takes a pointer, you can pass it an array (pretty sure). You also have to return a pointer from a function, regardless of its a n array or pointer; this could be bad due to scope, but that's much deeper down his journey.",Ratfus,2026-05-27 22:30:44,1,learnprogramming,t1_oo9e548,False,
oo89uha,"new coders like to ask ""what language should I learn?"" and old coders like to reply ""it doesn't actually make much difference"". Decide on a feature set, let the feature set guide you to a tool stack and then let the tool stack tell you what language to learn based on what languages the tool stack is written in and/or supports for scripting purposes. Between the two you presented it's more likely to be python than C++, but it might be either or both or a third thing we didn't think about.",reverendsteveii,2026-05-27 19:09:38,7,learnprogramming,t3_1tpf4nr,False,
