id,body,author,created_utc,score,subreddit,parent_id,is_submitter,distinguished
oyvm3cn,"Some were born writing code at 4yrs old. For the rest of us, it takes a very very long time.I just found out functions can run inside arrays and its melting my brain right now because no one ever fucking told me that.",mkprofile85,2026-07-21 14:18:33,3,learnprogramming,t3_1v2j2dk,False,
oyvssxf,"In your mind you may be doing bottom-up design.. that is thinking about every line of code and how they go into functions. If instead you try to think top-down then you can write empty functions in the code to fill in later.\`\`\`mouse\_down(button, x, y)mouse\_up(button, x, y)get\_object\_under\_pixel(x, y)move\_object(obj, new\_x, new\_y)\`\`\`Thinking about code in terms of empty functions allows you to mess around and try different things and think about variables being passed in before you get too stuck in your actual implementation. Give it a try.",Philluminati,2026-07-21 14:48:15,3,learnprogramming,t3_1v2j2dk,False,
oyvki02,"You break it down into a series of problems that you can solve. You don't even have to do it in one pass. You can break it into simpler steps, then break each of those down further, and eventually you'll have a series of simple well defined problems which when solved in sequence will give you the completed feature.",Queueue_,2026-07-21 14:11:23,2,learnprogramming,t3_1v2j2dk,False,
oyvkxyz,"> I don’t want to just rely on AI or copy-paste forever. I want to actually be able to build features myself. Your mistake: You relied on it until now, therefore never trained the skills you're lacking here.Now you have to go back to small helloworld programs and start doing things yourself, slowly getting better and being able to do more complex things.",dkopgerpgdolfg,2026-07-21 14:13:21,2,learnprogramming,t3_1v2j2dk,False,
oyu86rv,"ah the android emulator nightmare, i remember this from when i started flutter too. spent like 3 days troubleshooting before it worked first thing, this almost never about region or network speed, the emulator runs locally on your machine so internet only matters when your app needs to fetch data. the connection between vs code and emulator is all local what fixed it for me was making sure the emulator is booted fully before trying to run, like wait until you see the home screen not just the android logo. also check that flutter doctor shows everything green, especially the android sdk and licenses part. sometimes is just flutter not seeing the emulator because adb is acting up, try running adb kill-server and adb start-server in terminal then restart everything if that doesnt work check the emulator settings, make sure is using hardware acceleration and cold boot instead of quick boot. my old laptop struggled until i changed that",Evening-Living842,2026-07-21 09:21:18,2,learnprogramming,t3_1v2by89,False,
oyuogsr,"Another option is using android studio for the Flutter Dev. Two or so years back I used Android Studio for Flutter as the Android Emulator always worked great. VS Code always gave me issues. In fact, I had my app running in VS Code with my emulator running through android Studio, so I decided to just move completely over.",TeaBagzzzz,2026-07-21 11:22:49,2,learnprogramming,t3_1v2by89,False,
oyv01gh,OG.. I don't know how this idea didn't come to our minds!Thanx a lot :red_heart:,Straight-Leader-4540,2026-07-21 12:31:03,2,learnprogramming,t1_oyuogsr,True,
oyvh1ul,No stress man!This is why we use reddit :winking_face:,TeaBagzzzz,2026-07-21 13:55:25,1,learnprogramming,t1_oyv01gh,False,
oytu66n,"Sounds like very bad idea. One core idea of micro services is also that their build is independent from each other but you just sucked all into one and will force redeployment of everything for each build.Edit: your concept will actually create much more complicated CI/CD than ""normal"" micro service would have.",Made-In-Slovakia,2026-07-21 07:23:22,3,learnprogramming,t3_1v2b4a3,False,
oyu0lkk,Let me add a potential nest-js folder structure that visualizes a bit better what i had in mind: [https://pastebin.com/4WrHN83X](https://pastebin.com/4WrHN83X),john__dev,2026-07-21 08:17:11,1,learnprogramming,t3_1v2b4a3,True,
oyxsqa3,There isn’t an existing pattern for this as its not a good idea.,s0ftware-dev,2026-07-21 19:55:49,1,learnprogramming,t3_1v2b4a3,False,
oytup41,"i mean i can see why they think that but the post literally says they okay with building everything together, it's not like they didnt thought about that. maybe the word ""microservice"" is throwing people off cause what they describe is honestly more like a modular app with startup flags. still could work for smaller teams where managing 20 pipelines is bigger headache than one fat binary",FabullousMirth,2026-07-21 07:27:45,1,learnprogramming,t1_oytu66n,False,
oytvarn,I agree with the missing build independence but i would argue that you have to force-redploy each service. You can still deploy only the services that had changes.,john__dev,2026-07-21 07:32:44,1,learnprogramming,t1_oytu66n,True,
oytvn5k,">One repositoryFrom my experience I know that monorepo and single repository will became pain as number of modules will grow and you will have more people and more teams.>One build artifactThat is called monolith and it is directly against core principle of micro services.>Independent deploymentsI do not see it. It is same as with micro services but now you have to be careful about config so you do not start other modules.>Independent scalingSame as regular micro services. Zero added value here.>Much simpler local development (run all modules with one command)You can do it now with docker compose. With your solution you cannot control version of other services and have to run always what is in git branch including not released features. And also build everything instead of using existing artifacts.>Version consistency across servicesIn core this is against micro services. You want them to be independent, not dependent.",Made-In-Slovakia,2026-07-21 07:35:37,1,learnprogramming,t1_oytu66n,False,
oytwytr,"Problem is often fact how people separate micro services. With any app, CI/CD is important thing and with growing number it is even more important.I would not compromise architecture because you want save some effort on CI/CD.",Made-In-Slovakia,2026-07-21 07:46:42,1,learnprogramming,t1_oytup41,False,
oytvmn0,I can see that it is harder if not impossible to deploy changed services in a strict order that way which is not always needed to be fair.,john__dev,2026-07-21 07:35:30,1,learnprogramming,t1_oytvarn,True,
oytwbuk,">You can still deploy only the services that had changes.You will literally end in deployment hell. If you have one artifact and one version, you have to deploy everything otherwise you have no true idea what is really deployed. Imagine how big issue will be ""it works on my computer"" because they start services in different version. You may think there is no change in module between versions but are you sure? Will you put you on the line at 2am for it?",Made-In-Slovakia,2026-07-21 07:41:24,1,learnprogramming,t1_oytvarn,False,
oytwabr,"Yeah, i somehow have to agree in all your points. When you say ""Same as regular micro services. Zero added value here."", you are not wrong. Its not about adding value in the first place, its about easing the developer experience.",john__dev,2026-07-21 07:41:02,1,learnprogramming,t1_oytvn5k,True,
oyp0qik,"It's a cool language, but it is very quickly progressing and there are a lot of breaking changes being rolled out from version to version, the latest being version 0.16.0 where they added an entire new IO interface that invalidated basically all previous code that used any IO at all. It can also be very verbose at times, as with the infamous hello world.Although, given the fact that you are satisfied with Golang I would stick with it, since you can use it more efficiently because you already know it.",Confused-Armpit,2026-07-20 15:58:17,10,learnprogramming,t3_1v1p8cl,False,
oypmzjz,"Its basically a better C with easy async and parallelism through the new io interface. If you think your project will benefit from being implemented in C or C++, it can use Zig instead.",zik_rey,2026-07-20 17:33:18,6,learnprogramming,t3_1v1p8cl,False,
oypfueo,"> many apps are being written in itAre you sure about that? Very, very few people are using it for serious projects because of the reason you mentioned. The number is even smaller if you rule out vibe-coded projects. I think the language is quite promising, especially for Gophers, but I'd keep its use limited to hobby projects for now. Even then, the ecosystem just isn't there, so you'd still be facing some obstacles.",biskitpagla,2026-07-20 17:03:00,6,learnprogramming,t3_1v1p8cl,False,
oypkr68,"IMO, no not at all, it represents a significant regression in language design. Instead of reaching for known solutions it pretend issues don't exist or just squarely blames them on the user. I'm not sure what it offers that you couldn't get in a more mature and widely supported package in C",particlemanwavegirl,2026-07-20 17:23:50,3,learnprogramming,t3_1v1p8cl,False,
oytr2s7,Rust or Odin is the answer.,Puzzled-Extent7817,2026-07-21 06:58:02,1,learnprogramming,t3_1v1p8cl,False,
oz2vgm8,"Zig offers very little advantage over C besides the syntax. It offers even less over C++ and comes with significant disadvantages. If you think it looks fun than by all means learn it, but don't expect it to ever catch on as a C or C++ successor the way Rust has.",StewedAngelSkins,2026-07-22 14:05:03,1,learnprogramming,t3_1v1p8cl,False,
oyp6ijx,"that's what I was worried about, golang is quite stable and doesn't break after a version change. I've read a little about Zig and it's quite low level language which might be useful for some things that require more control i suppose",narukoshin,2026-07-20 16:23:27,1,learnprogramming,t1_oyp0qik,True,
oypl9e0,"I didn't mean that every app is being written in it, but now many AI-related or some kind of low-level tool projects are using it instead of C++ and other popular languagesI think that might experiment with the language, maybe even write the same projects as Go to compare performance n stuff[https://github.com/topics/zig](https://github.com/topics/zig)",narukoshin,2026-07-20 17:25:59,0,learnprogramming,t1_oypfueo,True,
oyp3fxe,That's a pro point.,specialpatrol,2026-07-20 16:10:10,4,learnprogramming,t1_oyozf2a,False,
oy8oh41,"been messing with a small web scraper that tracks chocolate prices across different stores, got it working finally but the site layouts change every week it feels like",PlatformWooden9991,2026-07-18 06:04:05,2,learnprogramming,t3_1uzldnn,False,
oyelw4y,"[My Video](https://youtu.be/lxlQIciYxPM?is=CYB_u-Vrb9YcB7Vu)hello everyone!Above is my first YouTube Video where I show off the Software that I’m planning on porting to my handheld diy project (‘Cyberdeck’). I want to use it specifically to help me learn computer science / programming. Have any of yall ever had experience with educational CS games? What would you change? When it becomes more finished, I’d love to share the repo and we can all play the programming games together. Second half of the video is a grandma game dev segment while we explore Stick RPG. Sincerely, Explain’d",Worth_Bodybuilder_83,2026-07-19 02:28:31,1,learnprogramming,t3_1uzldnn,False,
oyg1qzy,"Currently been working on a distributed database. Man is so interesting and difficult. The storage layer is in java, and I’m building the raft engine in go. There was a weird thing that kept happening that 2s of logs would go missing when running on my local machine so i had start deploying them. I spend alot of time writing the tooling for it, but man is it interesting. Here’s a link to the repo. https://github.com/persona-mp3/fsm.git",Motor-Frosting-5891,2026-07-19 09:08:23,1,learnprogramming,t3_1uzldnn,False,
oy8tzml,Ahh interesting. I made a shopping comparison feature but stopped at automatically scraping web data so not bot blocked but the overall idea I need is there,Ok-Somewhere7722,2026-07-18 06:48:44,1,learnprogramming,t1_oy8oh41,False,
oyenbk8,how often did the price of chocolate fluctuate for you to make a web scraper for it? Or did you just choose chocolate arbitrarily?,Worth_Bodybuilder_83,2026-07-19 02:37:32,1,learnprogramming,t1_oy8oh41,False,
oyjt8vy,"There's third party apis that scrape things like Google shopping feeds. Some of them probably have a free tier, which would make sense if you're fine only checking a few times a day max.",rupturedprolapse,2026-07-19 21:06:35,1,learnprogramming,t1_oy8oh41,False,
oy7p05a,I'd just start with gdscripthttps://school.gdquest.com/courses/learn_2d_gamedev_godot_4/learn_gdscript/learn_gdscript_app,grantrules,2026-07-18 02:00:32,2,learnprogramming,t3_1uziwcz,False,
oycvd80,"I don't know GScript. Python is the most universal currently wide used script language. When you know python you can go inside a lot of domains, but as it is universal - it is not the best for very high performance tasks / microcontrollers very efficient programming. For start the best is get fundamentals as it can be reused in other languages.",pepiks,2026-07-18 20:49:55,2,learnprogramming,t3_1uziwcz,False,
oygvgti,"I get that you're not looking to start a career in computer science or software engineering, programming is just a hobby for you. That's totally OK, but keep in mind that coding can be pretty demanding. So it makes sense to pick a language that's easier to learn and has broader use. In that regard, Python really takes the cake. It's a bit simpler to pick up, has tons of doc and a huge & vibrant community, and it's used in all kinds of fields.Godot and its scripting language GDScript is far more popular in gaming than Python's gaming engines such as Panda3D, though. So if you just want to stick to writing games, GDScript is a superior choice.",Dismal-Citron-7236,2026-07-19 12:50:14,2,learnprogramming,t3_1uziwcz,False,
oyj5y5g,After some thought I think I’m just going to put all my energy into GDScript. I already have some great physical reference media. Thanks for the input!!,LogosSpiralis,2026-07-19 19:24:22,1,learnprogramming,t1_oygvgti,True,
oy7hyfh,"for a personal project like this the complexity is manageable. you already know the database part with MySQL so that’s half the battle won i’d start with a simple web interface, maybe flask or django since you know python. the borrower tracking is just another table with a date field, nothing too crazy",Feeling_Temporary625,2026-07-18 01:18:57,2,learnprogramming,t3_1uzgh8m,False,
oy27fm5,"More repetitions, more practice. That's it.",aqua_regis,2026-07-17 09:38:24,4,learnprogramming,t3_1uyuw8g,False,
oy27uig,"on your actual question, revising c/c++, OS, networks, and DBMS daily on top of spring boot would just recreate the spread-too-thin thing that already burned you. placement interviews mostly test DSA and whatever's on your resume, so make DSA in java the one deliberate daily track and let the rest come back when a project or an interview actually needs it. the fundamentals aren't really gone either, they're just cold. you didn't forget how a process works, you lost the surface recall, and that returns fast the moment you use it. the fact you caught yourself unable to code without AI and then rebuilt tic tac toe and an expense tracker by hand means the muscle is already returning. keep shipping projects, add leetcode as the daily habit.",ItaySela,2026-07-17 09:41:43,1,learnprogramming,t3_1uyuw8g,False,
oy3e196,"I wouldn't try to revise everything at once. Keep building projects and do a little DSA consistently, the fundamentals come back way faster than you think once you start using them again.",Mell-Silver-20,2026-07-17 13:49:48,1,learnprogramming,t3_1uyuw8g,False,
oy3edn1,"The recommendation I've heard is that you should study at home 3 hours for each hour of class time. So, for a three hour university course, you should do 9+ hours on your own. Yes, this is a lot, and it approximates a 40 hour work week. Doing less than this is doing a disservice to yourself.While universities have changed a lot, the original concept of a university was that people renowned in their field would allow students to ask questions and learn from them. They weren't teachers in the traditional sense and the student was supposed to be active in his learning. Yes, in the present day, universities seem more like a continuation of high school, where the knowledge is given by lectures and textbooks. You should still think about the self learning part because even in the case of a bad teacher or bad course, you will learn more.",JGhostThing,2026-07-17 13:51:23,1,learnprogramming,t3_1uyuw8g,False,
oy558oh,"Built a whole notification system before I ever talked to a single user. Yeah, been there.",IncorrectPlayer,2026-07-17 18:20:43,1,learnprogramming,t3_1uyuw8g,False,
oy5ool0,"Nah screw the fundamentals, you absorbed enough. Besides, in the real world you will be building things, developing deliverables. To prepare for that, simply focus on projects that interest YOU. What’s an app you could design that will make your life easier? Something you could automate? Make sure to publish to GitHub or whatever site you prefer. Keep up with it, make regular commits to a couple different projects, be they open source or personal. Oh and make sure they’re hosted somewhere, try to get a user base on one of them.",darknecessitities,2026-07-17 19:45:50,1,learnprogramming,t3_1uyuw8g,False,
oy69p37,"first off, going through losing your dad and still coming back to this takes a lot, give yourself credit for that. on the fundamentals part, what worked for me when i felt like i'd forgotten everything was NOT re-grinding tutorials from zero, that just made me feel more behind. i picked one small real thing i actually wanted to build and let the gaps show up on their own, then filled them one at a time. it comes back way faster in context than cold review. you probably remember more than it feels like right now.",PlatformDifferent129,2026-07-17 21:21:28,1,learnprogramming,t3_1uyuw8g,False,
oy280q9,"I was in a similar spot after a messy second year, just felt like everything I'd supposedly learned had evaporated. What helped me was picking one small thing from an old subject (like reimplementing SJF scheduling in 20 lines of Python) and doing it right before bed. Quick hit, no pressure, and it kept those concepts from feeling like a foreign language. The project breakdown approach you mentioned is already a solid habit, maybe you can weave fundamentals into that. Need a task list for your Spring Boot app? Store it in a file on disk and suddenly you're touching file I/O and a tiny bit of OS stuff without derailing your main plan.",Junior-Bookkeeper182,2026-07-17 09:43:04,1,learnprogramming,t1_oy27fm5,False,
oxxyik1,Do you know anything about codedex? I’m almost done codedex beginner python course but I’m not sure if it’s sufficient.,None,2026-07-16 18:45:28,1,learnprogramming,t1_oxxy41k,False,
oxtkeai,"> programming some IoT devices If you can't break it down any further than that, then you are destined to fail. Honestly not trying to be mean, just trying to make you realize what you need to do to help point you in the right direction. So what exactly needs to be done?",96dpi,2026-07-16 03:48:10,16,learnprogramming,t3_1uxrg6m,False,
oxtncf3,It takes about 20 hours to 2 weeks for your brain to stop hurting,shuanDang,2026-07-16 04:07:48,9,learnprogramming,t3_1uxrg6m,False,
oxtk9ub,"C++ is over 40 years old, there are thousands upon thousands of quality resources for learning it. I’d actually be surprised if you found a bad C++ learning resource. Basically anything on the first page of a Google search should get you there.",Monster-Frisbee,2026-07-16 03:47:22,13,learnprogramming,t3_1uxrg6m,False,
oxtp5ig,>programming some IoT devices I think the real headache stems from here. Do you have any documentation from the vendor?,Fensirulfr,2026-07-16 04:20:10,3,learnprogramming,t3_1uxrg6m,False,
oxtotaw,"Well, study of any programming language can be broken down in the following subjects (all easily googable/claudable/copilotable/whateverable):* Language semantics* Data types* Built‑in operations* Operation precedence* Control flow* Functions and modularity* Memory model & variable scope* Error handling* Collections & data structures* I/O and environment interaction* Object‑oriented or functional constructs* Concurrency model* Tooling & ecosystem* Idioms & best practices* Architecture & real‑world applicationJoogle each - and read, read, read. Then practice, practice, practice. Apply to each new language you want to learn - rinse and repeat.Now, real life applications with applicable value - years of experience. Literally years and years, no shortcuts.",Distdistdist,2026-07-16 04:17:50,2,learnprogramming,t3_1uxrg6m,False,
oxtw2g3,"start with hello world, data types (strings, int, floats, booleans), lists, loops, pointers, functions, class etc...Honestly find a youtube video on the fundamentals and do small projects on what you learn* Bro Code -- C++* Tech with Tim -- C++ playlist* The Cherno -- C++ playlistOnce you get a grasp trying doing small projects on IoT devices (if possible)",TheEyebal,2026-07-16 05:10:01,2,learnprogramming,t3_1uxrg6m,False,
oxuek7j,"Why have you been tasked with this if you have never had c++ experience? Did you claim to the experience or are they just throwing it to you regardless of experience?Can you not explain to who ever has thrown this to you that you are unfamiliar with the language so would need some up skilling time to get yourself up to speed, before you can start working through this problem?",International-Owl466,2026-07-16 07:35:33,2,learnprogramming,t3_1uxrg6m,False,
oxulg32,"Do you have to use C++? C or Zig or even Javascript are good alternatives, depending on devices.If you have to use C++, realize that a lot of C++ will not be relevant for IoT devices. Try to find a book about embedded C++.But you do need to learn C++, if you are going to use it. It is probably the most complex language in existence, multi-paradigm and infused with C++ legacy on top of C legacy. So you need to figure out just what parts of C++ you need to get started, and then actively learn more as you go, and also actively avoid many things (you need to also figure out what things), which are not relevant for IoT devices.",Cultural_Gur_7441,2026-07-16 08:33:11,2,learnprogramming,t3_1uxrg6m,False,
oxtw6j1,"If you've got the time, learncpp.com will get you up to speed.",Won-Ton-Wonton,2026-07-16 05:10:52,1,learnprogramming,t3_1uxrg6m,False,
oxuio64,Why don't u first learn the language using a book like C++ primer?,defaultguy_001,2026-07-16 08:09:50,1,learnprogramming,t3_1uxrg6m,False,
oz6nt9k,It will be difficult if you don't want to invest in learning.,BranchLatter4294,2026-07-23 00:04:36,5,learnprogramming,t3_1v3xdcb,False,
oz6z2e5,"When work needs me to learn something to do something outside of my current scope, work pays me to learn it.",No_Report_4781,2026-07-23 01:05:01,2,learnprogramming,t3_1v3xdcb,False,
oz6n82m,"What is your actual role?I think you will be fine, but a lot of that depends on how your organization is managing this. LLMs are getting really good, but it's still a tool best used by a skilled hand. Using an LLM effectively for software development, in my opinion, requires a really good grasp on a lot of big picture stuff.",iamnull,2026-07-23 00:01:27,1,learnprogramming,t3_1v3xdcb,False,
oz73jeb,Yeah I’d love for that to be the case for me but literally had the trainer today say don’t waste time after work going to bar spend it learning more…,PleaseAnswerMeeeeee,2026-07-23 01:29:26,1,learnprogramming,t1_oz6z2e5,True,
oz6omyj,Junior PM/ business analyst. Gathering requirements and creating user stories which can be done in literally seconds now. They are trying to place me on the M&O team to help with fixes along side my PM/BA activitiesI have been using AI to help with my work over the past couple years so I’d like to say my prompting is good and I’m not completely unaware in that regard but yeah so far this is where I stand.,PleaseAnswerMeeeeee,2026-07-23 00:08:57,1,learnprogramming,t1_oz6n82m,True,
oz75rhk,"Ask your boss, “What is the overtime rate and how do I bill the hours I spend learning this stuff?”",mjmvideos,2026-07-23 01:41:42,2,learnprogramming,t1_oz73jeb,False,
oz74vj3,"Bro, stop wasting time and learn it.",lonelyinsan,2026-07-23 01:36:47,0,learnprogramming,t1_oz73jeb,False,
oz6q2en,M&O?Mergers and Ocuasitions?,PianoConcertoNo2,2026-07-23 00:16:34,2,learnprogramming,t1_oz6omyj,False,
oz71g09,"Well... You're in the middle of an executive gamble. If it works, you'll be fine. That said, if something goes wrong and the LLM gets stuck in something, you'll probably need to know enough to tell it that it's going in circles on the wrong part of a problem.That said, the latest models haven't given me some of the issues I've had in the past. They're getting pretty good about writing code that works, even if it is sometimes an unholy mess to try and read/modify.",iamnull,2026-07-23 01:17:55,1,learnprogramming,t1_oz6omyj,False,
oz6qj9e,Maintenance and operations - supported fixes to already deployed applications,PleaseAnswerMeeeeee,2026-07-23 00:19:03,2,learnprogramming,t1_oz6q2en,True,
