id,body,author,created_utc,score,subreddit,parent_id,is_submitter,distinguished
orrbyhb,i think kickstart is very basic i guess. do we have any other options?,Ehh-GoodEnough,2026-06-15 09:54:36,1,learnprogramming,t1_orr1d49,True,
orraw8j,i think i should try vim mode in vs code. Thanks for useful tip,Ehh-GoodEnough,2026-06-15 09:45:48,1,learnprogramming,t1_orr3yc1,True,
orrb3ky,Yes its true but that's also reduce my productivity and as a working profession i can't delete Vs code. its my option B. But still Good idea i will definitely give it a try,Ehh-GoodEnough,2026-06-15 09:47:30,1,learnprogramming,t1_orra6uu,True,
ormf05m,"If you are sure that your source string is NULL-terminated and that your target buffer is large enough to hold the source string (including the NULL), then you can technically use strcpy(). But if your string is dynamic and could be of a different length, then why not use strncpy()?",Justin_Passing_7465,2026-06-14 16:14:56,8,learnprogramming,t3_1u5p6ne,False,
ormwzbd,"Whenever possible, always use strncpy() rather than strcpy(). This is not because you could put in a bug, but because the next person to touch the code may introduce a bug based on strcpy() rather than the safer function.The problem is that you might be able to guarantee that the arguments of strcpy() are fine now, but the next time, who knows?",JGhostThing,2026-06-14 17:39:26,2,learnprogramming,t3_1u5p6ne,False,
ormevil,If you know how long the source is and how big the destination buffer is then it can be used safely.,lurgi,2026-06-14 16:14:19,1,learnprogramming,t3_1u5p6ne,False,
ormo7in,"I maintain an app done in STD C (DEC C). The original devs rarely used strcpy. Since they always knew the length of database columns and the user interface, memcpy is used. There are a few routines used that send back a null terminated string and I have seen strlen used as a start point to space fill. The database indexing with null terminations can yield unexpected results too. But then Justin\_Passing\_7465 is correct, if it's NULL term go ahead.",Oleplug,2026-06-14 16:58:35,1,learnprogramming,t3_1u5p6ne,False,
ormvqgo,"You need to know the maximum length of the source string, including terminating NUL char (so you need to know it is null terminated), and you need to know how much space destination buffer has, at least (remembering to account for the terminating NUL char). If there is any uncertainty with these, which you can't resolve satisfactorily, do not use `strcpy`.",Cultural_Gur_7441,2026-06-14 17:33:41,1,learnprogramming,t3_1u5p6ne,False,
orqnk5e,Using strncpy will only move the problems to another place but it won't solve it. Instead of writing behind a buffer it causes strings that aren't null-terminated (which can result in all kinds of chaos),Classic-Rate-5104,2026-06-15 06:23:13,1,learnprogramming,t3_1u5p6ne,False,
os29r10,"`strncpy` was designed for fixed width records. So if that's the case, once you know your code is correct, there's nothing wrong with it.What it's not good at is variable length user strings and secure strings. `strncpy` doesn't guarantee null termination if the string gets truncated (it's longer than the destination buffer), and since it works with fixed fields, under-sized strings are padded out with null terminators, which might be a waste of effort. Fixed size. FIXED. SIZE.`strlcpy` comes from BSD compliant systems that always guarantees null termination. User strings are any string where you didn't produce the string yourself and you don't know how long it is. You can't trust the user. There may be a leading length field that tells you how long it is - but THAT DOESN'T MEAN the buffer is ACTUALLY that long, it could be longer, it could be shorter, it may or may not be null terminated - you didn't produce it, you can't trust it. The ""user"" is any other 3rd party entity, not necessarily a person in an interactive session. It could be another process, a file or device, another machine from the network...",mredding,2026-06-16 21:12:39,1,learnprogramming,t3_1u5p6ne,False,
ormrzcg,basically never use strcpy unless you have complete control over both strings and can guarantee the buffer size. even then its risky because one small change in your code later could introduce buffer overflow strncpy is better but it has own quirks - it doesnt always null terminate if source is too long. strlcpy would be ideal but its not standard everywhere so you might need to implement it yourself,HorrorAgent8815,2026-06-14 17:16:23,8,learnprogramming,t1_ormf05m,False,
ormkh6d,"I’ll give you a good reason not to use strncpy: it doesn’t guarantee the resulting string is null-terminated.So it has a huge pitfall too.The preferred alternative is actually strlcpy, which is not technically part of the standard library but widely available.Another alternative is snprintf.",dmazzoni,2026-06-14 16:41:00,5,learnprogramming,t1_ormf05m,False,
ormk750,"`strncpy` has a couple of quirks that make me wonder about the sanity of the person who designed it. While all of the proposed replacements (`strcpy_s`, `strlcpy`, `strscpy`, and probably a few I've missed), they are all better than `strncpy`.",lurgi,2026-06-14 16:39:41,2,learnprogramming,t1_ormf05m,False,
orihor9,You can do a kind of mix where you have one function that takes an argument and performs all the actions. Then you create 3 small wrapper functions that you can register as each button’s onclick handler. Inside these wrappers you can just call the single action handler with the correct argument.,mjmvideos,2026-06-14 00:54:11,6,learnprogramming,t3_1u56ux5,False,
orij1kd,combining the logic and simplifying it down to 3 exits will be easier to read and also compile and execute faster if performance are your goals.,paclogic,2026-06-14 01:02:31,2,learnprogramming,t3_1u56ux5,False,
oril90y,"Why not have a 3x3 array with the outcome-code for each (row, column), and one function to display the result based on the outcome-code?",kingstern_man,2026-06-14 01:16:06,2,learnprogramming,t3_1u56ux5,False,
orkf5m2,"If you're asking, you know the answer. Yes, it works. But can it work with less code duplication?That `randnum < 2 / 3` business is messy. What if you started with `randnum` being 0, 1, or 2? Or, even better, the value you actually care about?I'd start with something like: Rock Paper Scissors const choices = [""Rock"", ""Paper"", ""Scissors""]; const randChoice = () => // your code here function playComputer(player) { const computer = randChoice(); const msg = `You picked ${player}\nComputer picked ${computer}`; if (player === computer) { alert(`${msg}\nIt's a tie!!`); } else if (player === ""Rock"" && computer === ""Scissors"") { // ... // if you got here, this must be true: computer === ""Paper"" } else if (player === ""Rock"") { // ...",WystanH,2026-06-14 08:47:17,1,learnprogramming,t3_1u56ux5,False,
oriix9z,"You're right that three separate functions feels wrong. The piece you're missing is that onclick can call any function, including one that takes a parameter. So `onclick=""play('rock')""` on all three buttons, and one function reads the argument to decide the logic.",Aggressive_Ticket214,2026-06-14 01:01:47,0,learnprogramming,t3_1u56ux5,False,
orit9q6,"Or rather onclick=""play('paper')"" for paper, and similar for the others.If you switch from RPS to some other scenario where you want to pass multiple parameters, and it starts getting unwieldy, then you can also do stuff like:function play(btnSender) { // read those attributes and do stuff }",johnpeters42,2026-06-14 02:03:46,1,learnprogramming,t1_oriix9z,False,
orkq2kz,Red flags whenever you see someone start their sentence with “you’re right”. It’s a sign the person can’t think and they used AI,zunjae,2026-06-14 10:23:04,1,learnprogramming,t1_oriix9z,False,
or7wztr,"For scientific computing, I would choose based on the ecosystem you need, not only the language qualities. C++ still has a huge advantage when you need mature numerical libraries, HPC tooling, and integration with existing scientific code.Rust is excellent if you care about safety and modern tooling, but the ecosystem can be thinner depending on the domain. Coming from Python, you might get the most practical value by learning enough C++ to understand performance/native extensions, then explore Rust for new projects where the library gap is not painful.",alexshev_pm,2026-06-12 12:47:49,6,learnprogramming,t3_1u3qcm4,False,
or78lr9,"Somewhat depends, but I would really make it Rust vs C (vs Fortran) and immediately throw out C++.Rust is absolutely the most pleasant to use out of the bunch, and whenever it's viable I'd recommend it. It's generally a pleasure to use, really fosters correctness, makes parallelization comparatively painless, has great tooling, the stdlib includes data structures and algorithms that blow other languages' out of the water in some cases, it has a great interop story with python, many good third-party libraries, ...\*BUT\* it still doesn't have the ecosystem that the more classical languages have, and when it comes to GPU programming it's still rather immature. And of course in some contexts you may need to work with people that really only use some specific language (at a national aerospace center I worked at the whole team was for example using Fortran, with only a bit of Python and C around. Introducing Rust into such a setting can be a hard sell).If you don't care about those latter points / can work around them (by implementing things that don't already exist yourself or working with bindings to existing C / Fortran / C++ code) it's great; but you likely want to have at least some knowledge about those other languages for when this isn't possible.FWIW: my worst experiences around scientific computing were all related to C++; and I've now used Rust exclusively for a number of years (working around optimization algorithms) and really wouldn't want to go back. You can actually focus on your algorithms and work rather than having to babysit the language and build system, or having to look into memory issues in decades old library-code that wasn't \*quite\* as stable as people thought.",SV-97,2026-06-12 10:10:32,6,learnprogramming,t3_1u3qcm4,False,
or76hxw,What kind of scientific computing?,_janc_,2026-06-12 09:53:40,3,learnprogramming,t3_1u3qcm4,False,
or79f97,"C++, period. It has very large community and tons of well established libraries, developed over decades, like GSL, Eigen, etc. The language is cruel to beginners and has steep learning curve. But once you learn more about it, it becomes easier and clearer.There is python if you don't care about performance.",EdwinYZW,2026-06-12 10:16:54,1,learnprogramming,t3_1u3qcm4,False,
orciqwu,"To follow up on this, are you mostly doing personal projects or job searching? it really matters bc tech stacks differ based on what folks need to impress",Awkward-Cat835,2026-06-13 02:30:58,1,learnprogramming,t3_1u3qcm4,False,
orfoq0l,"If you are not a programmer first, scientist second, then the amount of footguns provided by C++ should be taken as a hint.",Cultural_Gur_7441,2026-06-13 15:57:41,1,learnprogramming,t3_1u3qcm4,False,
or9vo6m,"If you want to learn computer science and understand the concepts from the base detail, follow a good CS program that starts with C++ and the command line. Continue on with C++ until you have implemented a couple of common data structures. A good CS program will expose you to at least 3 languages, maybe even a tiny bit of assembly. Done right this gives you robust knowledge and hopefully start you off on the right trajectory.Personally I stay away from Rust because the community reminds me of the early days of C++. Note I said community, not the language, too many people with their heads up their asses for me. As for scientific computing, I don't see Rust as being stable enough, nor does it have all the libs that float about for C++. So that leaves C++ or another. Another could be Julia or even Apples Swift. Julia of course was designed for science so that is a big plus.As for Python, everybody that even does a tiny bit of computing in their filed should learn Python. However personally you really have to consider if it is the best choice for a lot of scientific programming. The existence of numpy pretty much tells me that Python isn't suitable in many cases. That point could be a very long discussion. Again though really using Python in a positive way requires a CS background and formal training in the language.Speaking of formal training this applies to any language because a CS program, for the most part, does not dive into any language in depth. A CS program is about concepts, not language skill development. Unfortunately to learn to use C++ well takes a very long time. This is why I see lots of potential in Julia or even Swift, they are just less complex languages that lead to idiomatic code.",spinwizard69,2026-06-12 18:07:06,1,learnprogramming,t3_1u3qcm4,False,
oraxdp4,"C++, people have touched on reasons why. I’ll give a different reason. Use C++ cause it’s not rust or the rust community.",StonksGoUpOnly,2026-06-12 21:03:54,0,learnprogramming,t3_1u3qcm4,False,
or74itg,"From my very limited experience, I recommend RustIt seems much more straightforward to build modules that can be imported into Python for when you need performance. There are specific Rust crates and compilation methods that are well documented and easy to use. C++ is ubiquitous, yes, but Rust can be just as performant and it'll teach you more than C++ will IMO.",InternetSandman,2026-06-12 09:37:16,-1,learnprogramming,t3_1u3qcm4,False,
or7gz7g,"Thank you for the reply, were there any resources for learning Rust you would recommend?I feel I should page /u/EdwinYZW on this reply since the two of you are at other ends of the spectrum.",ZealousAttacker,2026-06-12 11:11:30,1,learnprogramming,t1_or78lr9,True,
or4h0qm,Sorry but is the question?,ninhaomah,2026-06-11 22:34:14,1,learnprogramming,t3_1u3dmxn,False,
or4hlzu,Stop watching tutorials and start building something small that actually requires those concepts to work. You can read about OOP all day but it won't click until you're trying to organize a messy codebase and realize you need classes to keep it from becoming a nightmare.,jessyxcandy,2026-06-11 22:37:28,1,learnprogramming,t3_1u3dmxn,False,
or68z4h,Learning C is a great way to understand programming fundamentals but try building small projects while you learn instead of waiting until you feel ready. Concepts like OOP and async usually make much more sense when you encounter a real problem that they help solve.,Due-Influence0523,2026-06-12 05:09:14,1,learnprogramming,t3_1u3dmxn,False,
orns6rq,"If you know ""basic concepts like variable, functions, condition statements"" in some language (you don't specify which one), don't waste your time trying to relearn it all in C.Continue with the language you know, and get into OOP - learn about classes and methods, mutability and accessors, inheritance and composition, and use it to build projects of the kind you like!Unless you are eager to learn memory-management and bit-patterns, addresses and byte-size of variables, don't go into C. While every programmer should learn it at some point in their career, don't use it as a blockade against learning new stuff, use it later to learn what lies below!",peterlinddk,2026-06-14 20:07:50,1,learnprogramming,t3_1u3dmxn,False,
or4lulb,you want to learn the theory behind programming right? C is actually good choice for understanding how things work under the hood since its closer to machine level maybe try reading some computer science textbooks alongside coding - they explain the why not just the how. when you understand memory management in C the oop concepts will make more sense later,Cold-Watercress-1943,2026-06-11 23:00:45,2,learnprogramming,t1_or4h0qm,False,
or4hmtj,Yes actually I am totally confused what to do?,thakur_ji803212,2026-06-11 22:37:36,1,learnprogramming,t1_or4h0qm,True,
or4i1gg,Yeah my plan is to build things with help of documentation,thakur_ji803212,2026-06-11 22:39:49,1,learnprogramming,t1_or4hlzu,True,
or4qjxo,You are replying to me or to OP ?,ninhaomah,2026-06-11 23:27:13,1,learnprogramming,t1_or4lulb,False,
or4i0ig,Pls see below poster's advice,ninhaomah,2026-06-11 22:39:40,1,learnprogramming,t1_or4hmtj,False,
or4i9c8,Sorry I accidentally check on topic flair,thakur_ji803212,2026-06-11 22:40:59,1,learnprogramming,t1_or4i0ig,True,
or131z2,"I have no experience with devices like this, but can't you just do some kind of standard Auth? Like a username+password, and then a session cookie for the actual requests?",carcigenicate,2026-06-11 13:15:39,1,learnprogramming,t3_1u2ydtm,False,
or17lpl,This really depends on your pre approval process. Without more information on how you do approval we can't really help. Are pre approved devices getting this flutter app as an intentional install? Are approved devices a specific brand and type? Your approval distinction will lead to a technical one,Kavinci,2026-06-11 13:38:22,1,learnprogramming,t3_1u2ydtm,False,
or4716t,What stops my mobile device from lying about its value?,fixermark,2026-06-11 21:42:19,1,learnprogramming,t3_1u2ydtm,False,
or1dsc6,"Yes, intentional install. They are a specific brand and type, yes.",Reasonable-Job4205,2026-06-11 14:08:09,1,learnprogramming,t1_or17lpl,True,
or541pb,"If it's a value I'm expecting, that's good enough for now. Yes, someone could figure out this value and then spoof it, but with the env this is gonna be running in, I'm not terribly worried about this",Reasonable-Job4205,2026-06-12 00:46:27,2,learnprogramming,t1_or4716t,True,
or1fi1t,"Gotcha. Look into mTLS for the concept.What you'll do is embed certs or keys in your flutter app that your backend is aware of. There are crypto libraries to make this easy for your languages. You sign all of your requests with these back and forth. The backend can have an auth middleware (not difficult with existing libraries) that validates the cert/key and decode if you are signing request bodies. Some product or machine without these would fail. You can also choose which endpoints to secure and which to not if you need a hybrid approach.Another similar topic is ""end to end encryption"".",Kavinci,2026-06-11 14:16:14,3,learnprogramming,t1_or1dsc6,False,
or0ogwa,"This is kind of futile. Any malware that has permissions to read the password from your process's memory could also get it in other ways, e.g. by intercepting the user's keystrokes.> The architecture is zero-knowledge: it uses Argon2-id for key derivation and AES-256 for encryption, saving everything into a local SQLite database.That's not what ""zero-knowledge"" means.",teraflop,2026-06-11 11:54:52,4,learnprogramming,t3_1u2v0i3,False,
or0d8bj,"You can manually call the GC to free the memory, but that doesn't guarantee the memory is immediately wiped clean https://docs.python.org/3/library/gc.htmlA bytearray is mutable, you could overwrite in the immediate sense there but somewhere up or down the line is likely still going to use the string version. You would also need to check the language implementation to make sure it is actually overwriting the memory. Also check any libraries used to understand if they are making copies too.Perhaps see if there are any existing libs which call on C/C++ code to securely handle these kinds of tasks?This thread is interesting on security: https://security.stackexchange.com/questions/74280/would-it-be-good-secure-programming-practice-to-overwrite-a-sensitive-variableThe reality is that there is only so much you can do (threat reduction). Your job is to mitigate the risk as much as is **reasonably possible**, the rest is on the OS, process isolation, and the user not doing anything dumb to compromise their system.",dingoDoobie,2026-06-11 10:39:41,2,learnprogramming,t3_1u2v0i3,False,
or0jvzb,"To do this thing right, you need to implement OS specific code to- prevent memory getting swapped to disk- prevent memory being included in crash dump- scrub the memory after usefor an allocated memory block, and also being careful that secrets don't get copied to other memory needlessly.",Cultural_Gur_7441,2026-06-11 11:25:45,1,learnprogramming,t3_1u2v0i3,False,
or0w5mk,"Anyways I am fully aware that if an OS is completely compromised by a root-level malware with keylogging capabilities, absolute security is practically impossible. However, to mitigate this specific threat, I'm thinking maybe to an integration of hardware-backed authentication mechanisms . By caching a session token securely within the OS credential store after the first successful unlock, so I can drastically reduce the number of times the user needs to physically interact with the keyboard. This minimizes the attack surface exploitable by a keylogger during routine daily use, limiting the window of vulnerability to the initial login command.",InspectorHour6976,2026-06-11 12:39:16,1,learnprogramming,t1_or0ogwa,True,
or0ty37,"Fair point, I definitely misused the term 'zero-knowledge' in my original post. What I meant is that PyVault follows a strictly local-only, client-side encryption architecture, meaning that the raw SQLite file is completely unreadable to anyone (or any process) without the proper master key.Regarding the malware with root access: you are completely right. A keylogger would be a much more efficient way to steal the credentials in a fully compromised system, and that goes beyond the current threat model I was analyzing. My main focus for this specific exercise was strictly horizontal memory isolation and narrowing the exposure window within the Python runtime.That being said, I really appreciate you bringing up the broader system compromise scenario. I'm definitely taking notes on this use case and I will research how password managers typically harden themselves against keystroke logging or raw input interception!",InspectorHour6976,2026-06-11 12:27:02,-2,learnprogramming,t1_or0ogwa,True,
or0dotc,Yeah the bytearray approach is probably your best bet even if it's not perfect. You could also look into using ctypes to zero out memory directly but that gets pretty messy and still no guarantees. I've seen some projects use mlock() to prevent pages from swapping to disk which helps with the persistence issue. The C library route is definitely worth exploring since Python's memory management wasn't really designed with security in mind. At end of day though you're right that most of security happens at OS level anyway and if someone has memory access they probably already own the system.,Own-Site6376,2026-06-11 10:43:01,2,learnprogramming,t1_or0d8bj,False,
or12iwh,"Unfortunately this is still more or less futile.If you are assuming a generic, untargeted attack such as a keylogger, then the most plausible scenario is that the keylogger was installed without the user's knowledge and will remain undetected for a while. So it doesn't matter whether the user enters their password a hundred times within that window of time, or only once; the keylogger will get it either way.If you are assuming a targeted attack by someone who knows how your tool works, then using hardware credential storage doesn't matter, because the attacker could trivially patch your code to exfiltrate the decrypted keys after they are unlocked.IMO the best option is to not give the user a false sense of security. You should truthfully tell the user that if an attacker gets local access to their machine, all the passwords should be considered compromised. This is just as true for your password manager as it is for every single other one. Password managers provide convenience, and they can *indirectly* provide security (by encouraging users to use strong passwords instead of weak ones). They can't meaningfully provide security against malware, and you shouldn't say or imply that they can.",teraflop,2026-06-11 13:12:55,1,learnprogramming,t1_or0w5mk,False,
or1qwq1,"Well, fortunately nobody in this post said that, but we thank you for the reminder! I hope I cleared up your doubts about the architecture. Thanks for your contribution and your time :grinning_face_with_smiling_eyes:",InspectorHour6976,2026-06-11 15:08:53,0,learnprogramming,t1_or12iwh,True,
or01ryu,"> I have asked this from my friends who are cs majors & programmers & they told me to actually start working instead of watching courses n stuff.Your friends are right.> Because bear in mind, that I'm still a uni student & handling 2 majors is quite demanding. Not to mention that i also work as a private English tutor, and am studying french as well. So idk if i can rly do REAL projects with like deadlines for companies n stuff.This will be your biggest issue. Coding is a craft. You get better by doing it, and doing it properly takes time. Learning a language also takes a ton of time if you want to get anywhere, and work sadly takes time as well.I would recommend you invent a time machine first to have 50h+ per day. Failing that, you will have to drop something or get comfortable with the idea that programming will stay an interest and hobby, to fill the gaps when everything else is done.",aanzeijar,2026-06-11 09:05:46,1,learnprogramming,t3_1u2rubk,False,
or1vn5m,What is your ultimate goal image processing? I took a graduate elective on image processing it was a lot of reading scholarly articles (my professor in that class has written several peer reviewed papers in the field). Image processing is a lot of theory and data structures. You might want to get started in computer algorithm and data structures.,Fast-Boysenberry-286,2026-06-11 15:30:04,1,learnprogramming,t3_1u2rubk,False,
