id,body,author,created_utc,score,subreddit,parent_id,is_submitter,distinguished
ossrk4n,"If you don't study in the domain, it's extremely hard to get there. You have to take a long path of beating expectations and people starting to trust you. Working at a company that does that but not necessarily in the role doing that will expose you to it and eventually you will find opportunities to get tasks related to it. For me it took starting my career in physics related industries and gradually angling towards more science until now doing geospatial, hyperspectral imaging, some signal processing, etc after 7 years. I'm considered research engineer.If you want to enter a business doing so, after 3 years, you will be able but only in a pigeonholed role (like everything). As you acquire seniority people tend to be more trusting of your ability.So for a deep honest opinion, it's gonna be unlikely unless you land a job at a startup in that domain where most of the time it's easier to fill many roles.",Aware-Individual-827,2026-06-20 17:34:00,9,cscareerquestions,t3_1ub1s13,False,
osupl8z,"In a good team you would express your doubt to your senior and they will have your back, either by taking part of your job, helping with it or expressing your doubt to whoever is on top of them so maybe start by talking to them.If it's really a toxic environment? Honestly do your best and that's it. Some people might suggest going full vibe coding and not even look at the code. I don't really like that (call it pride, love for the craft or just enjoying coding idk) as you'll learn nothing and it's just a waste of time for your personal growth.I guess there's the risk of being laid off but in that case hey, you get a year of full salary for being laid off as unemployment benefits (though I'm in a EU country unsure if it's like this in other part of the world)",ErZicky,2026-06-20 23:41:26,23,cscareerquestions,t3_1uba296,False,
osujys1,Sounds like a shit team. The answer is that you can’t. But a lot of managers are moronic,Expensive_Title_2670,2026-06-20 23:07:19,19,cscareerquestions,t3_1uba296,False,
osuy82h,"It is mostly a losing battle if your managers don't understand the value of maintaining a design or dealing with tech debt and just want you to go fast all the time - that is a bad situation even without AI.IMO the best option to somewhat keeps the wheels on is forcing the agent and your devs to do spec-driven-dev - instead of just telling claude to go make a bunch of changes each time you get a feature request, spend some time writing up a spec of what each application does and how it's architectured, check it into your source control as part of the same repository and branch as your application, and then for each feature start with telling Claude to update the spec to include the new feature, and review that (ideally with your team, but just you at least).Don't tell claude to start coding until you're happy with the changes to the spec, and then let claude code to that updated spec, and write tests to that updated spec.- it is slow to get started because you probably don't have an up to date design for each application, but after that first investment it shouldn't add significant overhead to each task- the process of reviewing the spec changes is good to keep you informed of what claude is actually changing each time so you aren't as out of touch anymore- if you do need to go back and check how something works, reading the spec and spot checking key logic yourself is a lot quicker than crawling through a mess of machine-generated code",alienangel2,2026-06-21 00:34:50,8,cscareerquestions,t3_1uba296,False,
osuovb6,"yeah this is the velocity trap in real time. if management is measuring only output, you won't win by privately doing all the review work after the fact. i'd make the risk visible: for each AI-heavy change, note what you verified, what you didn't, and what could break. if they still want speed over ownership, that's a company signal, not a personal failure.",OAKI-io,2026-06-20 23:37:03,19,cscareerquestions,t3_1uba296,False,
osv9zgy,"Why are they asking you how its set up? Tell them to ask Claude in my experience its very good at that type of thing, if you are going to go full in like this go full in! You can also ask it to generate docs if you really want to and simply review them I've had it generate all types of docs and it can do mermaid diagrams as well that render in markdown",makonde,2026-06-21 01:48:57,2,cscareerquestions,t3_1uba296,False,
osup8lu,"The secret sauce (or, at least what I’m doing) is I focus on implementation plans and creating an architecture plan and saving all of them to a markdown file, then have the agents implement it. That way I don’t focus on the code anymore, I only focus on the architecture. The code is no longer something I pay much attention to.I do still give it a glance to make sure it’s not doing something completely insane, and put it for review so other engineers chime in. Usually they just have their agents review it so.. yeah. I also keep all the architecture documented so any given agent knows not to stray away and do its own thing. You still have to babysit it sometimes but at least you are not trying to read every line. It’s working so far. It is one of those let Jesus take the wheel moment but whatever. If they want us to move faster then that’s the price to pay.",techno_wizard_lizard,2026-06-20 23:39:17,2,cscareerquestions,t3_1uba296,False,
osvm9q6,"clean code, data modeling, and abstractions are still useful in this era and the llm wont build them unless you spec it",ExtenMan44,2026-06-21 03:09:17,1,cscareerquestions,t3_1uba296,False,
osw5upu,I’m not trolling but use AI to read AI generated code. Also use plan docs to keep context before you start a large ish feature.,Ok_Jello_2441,2026-06-21 05:32:20,1,cscareerquestions,t3_1uba296,False,
osxa316,How are the dumbasses measuring output? If it’s PRs and LoC then it's pretty easy to game. If it's tasks then pick smaller tasks,DarthCaine,2026-06-21 11:16:37,1,cscareerquestions,t3_1uba296,False,
ot6ejnq,"What's worked for me is writing a spec or plan of what's going to change before the agent touches anything. You can also get reviewed by someone on your team instead of the ai-generated code. The agent implements it, and when someone asks ""how does this work,"" you answer from the spec you reviewed which you actually understand and can keep stored in your head a lot easier.",jameslaney,2026-06-22 18:40:30,1,cscareerquestions,t3_1uba296,False,
osscsbs,"Pittsburgh. The CMU talent pipeline feeds the robot car industry who all test their cars here because of the geography. Google, Meta, Amazon are all here too.",Mahler911,2026-06-20 16:21:28,91,cscareerquestions,t3_1uaxyg2,False,
osrwu97,"Best value is probably working remotely and living in a lower cost of living area on the west coast or Nevada. There are things more important than money, I live in NC and make around 150k. I really love my city and wouldn’t move anywhere else even if they offered me 300k (which they probably wouldn’t). 150k doesn’t go as far as it used to here but it’s still much more than the median income.",Hog_enthusiast,2026-06-20 15:01:50,114,cscareerquestions,t3_1uaxyg2,False,
osrxwqb,I moved from the DC area to Seattle. Not only is housing more comparable than you'd imagine but there's no state income tax in Washington.,capitalsfan08,2026-06-20 15:07:23,37,cscareerquestions,t3_1uaxyg2,False,
osrrvlz,"If you only care about owning a home, most major Midwest cities will fit the bill. That being said, I’m a strong proponent of finding where you want to be & just making that happen. Houses are expensive everywhere right now compared to local incomes, but you’re well paid. Just spend a few years building the necessary downpayment.",dataGuyThe8th,2026-06-20 14:36:20,46,cscareerquestions,t3_1uaxyg2,False,
oss8324,"A lot of people are going to down-vote, but the answer is: No income tax states.If you want a blue state, that means Washington. If you are a high-paid individual in any industry (including tech) *nothing* comes close to no-state-income tax. At $210K per year, the state income tax in Oregon (in Salem) is $17,900 and California (in Sacramento) is $15,424 . Pick a bigger city (SF/Portland), and you'll pay even more.In Seattle, the median 1-bedroom rent is $2,100 or $25,200 per year. That means that the income tax in Oregon/California alone pays 50-70% of your rent in Seattle.Once you hit $400K+, that same 1-bedroom is *entirely paid by what you would've paid in state income tax.*",aabajian,2026-06-20 15:58:15,65,cscareerquestions,t3_1uaxyg2,False,
ostigkb,"Austin used to be it before the housing boom.For tech hubs like SF, Seattle and NYC, Seattle usually comes up on top with income to CoL.",JoshL3253,2026-06-20 19:46:59,5,cscareerquestions,t3_1uaxyg2,False,
osrrhve,Working in Jessup MD and the TC market isn’t very far below NOVA. I commute from the Eastern Shore. Bay Bridge traffic in the summer is miserable but the delta is pretty good for saving.Imagine you could do something similar in NOVA with a somewhat manageable commute.,SuperSaiyanSandwich,2026-06-20 14:34:21,9,cscareerquestions,t3_1uaxyg2,False,
osrtxqq,"You can work in NYC but live in a lower cost area, you'll just have a 30 minute-1 hour commute. I imagine its the same with the other VHCOL cities.",Temporary-Air-3178,2026-06-20 14:46:58,7,cscareerquestions,t3_1uaxyg2,False,
osrsfyy,"Once you find a Significant Other who earns around the same or more than you (you'll also most likely make your way to \~$300k+ TC within the next 5-7 years or so), and wants to contribute and buy a home with you, you'll find that the $800k - $1.5M price won't seem too unreachable anymore.",EntrepreneurHuge5008,2026-06-20 14:39:16,11,cscareerquestions,t3_1uaxyg2,False,
ossc7lh,St. Louis - companies pay decent salaries here for SWE,SpareSmileBravo,2026-06-20 16:18:37,6,cscareerquestions,t3_1uaxyg2,False,
ota7dri,"My friend works in embedded development and it is a rather peaceful job. It pays bit less than your default web dev but it is quiet. Kids are not doing courses trying to get into C++ and STM32. Plus sometimes you get to do manual labor like probing a I2C bus with an oscilloscope. Hard to automate with ai.But I am not a huge expert, just saying this field exists and it is mostly under the radar",Putrid-Musician-5534,2026-06-23 07:34:30,70,cscareerquestions,t3_1ud9lc5,False,
otacu6r,"do you really have to learn all that in your free time? lots of people I know learn on the job and maybe use like an hour of their time dedicated to learning or something. anyways to answer your question try to get a government job, or a job in a big old company, or a bank",AdObjective5502,2026-06-23 08:21:42,19,cscareerquestions,t3_1ud9lc5,False,
otarh81,"The more experienced you get the more you realize how similar new technologies are to old ones. You eventually get to a point where there’s no real reason to keep up with trends because you know how to do pretty anything you’ll be asked to do. Once you achieve clarity the essentialness of learning continuously ends. Which for me happened within 8-10 years of working in the field.Also, most high paying jobs have a time sink attached to them and that’s partly why the compensation is high. Because the level of work involved is high enough that few are willing to tolerate it.",rkozik89,2026-06-23 10:23:37,29,cscareerquestions,t3_1ud9lc5,False,
otbyrm3,"If there's anything AI has taught me, it's that nothing is certain anymore, everything you think you know could change.So jobs with less uncertainty is really hard to say, because I'm not sure such a thing exists.If people say the trades and more people go into the trades, then that could become oversaturated and not a stable career path.",ILikeFPS,2026-06-23 14:28:55,11,cscareerquestions,t3_1ud9lc5,False,
ota653h,"Plumber, electrician. Pipes will always leak and wires will always need to be placed.",UpsetPomegranate5428,2026-06-23 07:23:51,14,cscareerquestions,t3_1ud9lc5,False,
otcecqp,Hardware companies are more stable overall. Tho right now with AI infra buildout it’s been chaotic trying to increase headcount I have so many interviews to conduct I get a headache and don’t have as much time to do my own work,isospeedrix,2026-06-23 15:38:20,2,cscareerquestions,t3_1ud9lc5,False,
otbn2o9,"IT, jobs in government. Software engineering is one of the only fields where you are expected to constantly be learning new stuff outside of work.",zombawombacomba,2026-06-23 13:33:39,-10,cscareerquestions,t3_1ud9lc5,False,
otfafum,good post. the part about taking it step by step is underrated advice.,Miamiconnectionexo,2026-06-23 23:17:17,-1,cscareerquestions,t3_1ud9lc5,False,
otchuze,Be a cop,nsxwolf,2026-06-23 15:53:39,-3,cscareerquestions,t3_1ud9lc5,False,
otaekss,"The issue, at least at my company, is the development work is 95% web and 5% embedded.",VerdantGarden,2026-06-23 08:36:40,15,cscareerquestions,t1_ota7dri,False,
otd554s,this task is somewhat possible but it's for someone tech lead + and a very good one and not a new gradjust get the fuck out or wait for them to dismiss you while you collect the paychecks,omegahustle,2026-06-23 17:33:01,19,cscareerquestions,t3_1udmm2e,False,
otczg48,"This is fine experience to have. ""I was set up to fail"" is a bit over dramatic, I think they just had unreasonable expectations. Communication is a big part of software, as you get more experienced you'll be able to flag earlier if expectations are unreasonable, or if you're blocked on meeting them, etc.Start looking for your next job if you haven't already.",Dankaati,2026-06-23 17:09:06,31,cscareerquestions,t3_1udmm2e,False,
otd1glq,"i work on ai tools and this is exactly the gap between demos and actual production work. asking a new grad to fully automate modernization of legacy code with no version control, no reviewers, and no clear acceptance criteria is not a normal probation task, it's a management fantasy. the thing to salvage is a clean writeup of what you tried, risks you found, and why human review/version control are required, then use that story while you look elsewhere.",OAKI-io,2026-06-23 17:17:42,19,cscareerquestions,t3_1udmm2e,False,
ote3ph8,"To give you some perspective, I have a team of guys, all over 5 years experience, some 20 years that Ive led on modernization projects that eventually did what this company wanted. Super legacy stuff 10+ years old.It took us 1.5 years just to get the internal libraries, internal apis, modularize the cidebase so we could pull out pieces at a time without breaking. Setting up observability and telemetry. We had another 2 years left on the road map.We moved to using ai. Not the way you think though. It uses all of our methodology, all of our internal standards, it understands the code estate better than sny one person and we applied an entire governance framework around it. That took 3 months of principal engineer workWe're finally seeing payoff and are on track to complete in 6 months.You got roped into a million dollar + project with no experience from a clueless company. Another 10 years experience you could have redirected their expectations, got them aligned, built a team and automated everything.You had no chance here. Chalk it up to oops I got played and was taken advantage of simply due to ignorance on all sides and move on. No biggie. The next guy will fail as hard. How can you pick the correct design patterns that will lead to aaair step 1.5 versions that get you to v2 without knowing which design patterns are right for the task? Let ai decide? Without full months of training it will literally just say this is good and 3 other downtream apps will blow up in your face. It doesnt really consider blast radius unless youve trained it yourself.The business will fail at this task until they find me. And I charge alot young man. Know they will understand when someone likes me talks to them and they will finally realize they are dumb. They won't admit it. Won't feel bad for what they did to you, but there will be pain.",no_onions_pls_ty,2026-06-23 20:00:58,8,cscareerquestions,t3_1udmm2e,False,
otdesnq,"Honestly, I’d say you’re in luck for this type of experience even if it’s shitty, especially when you’re a new grad. My old boss had the same impossible expectation, but I learned much out of it.Such impossible tasks can certainly help build upon your resume/portfolio. I’d say look at this on a bright side (“a short term job AKA internship” if you will) and look for the next job.",SpectreTechnocity,2026-06-23 18:13:24,4,cscareerquestions,t3_1udmm2e,False,
otd24jf,"It's not normal or right but it is not uncommon. Non-technical members of leadership may believe that a fully automated system is possible, and that a single developer can build it all.Building a fully automated app or process will always be a future target. Be sure to break out deliverables into small attainable chunks and get buy-in from your management. Then meet those targets and document it well.In the meantime, keep looking for a better job.",OrangeSalmonGuru,2026-06-23 17:20:28,4,cscareerquestions,t3_1udmm2e,False,
otdbzab,"Llms as they currently stand fucking suck. There's a reason why most of us are using enterprise level models. I would let them know that. Ask them if they're fine investing $500k+ for H100s, 200s, B100s, etc. Guarantee that they aren't. Each one of these costs like $35k+ LOL. Plus cooling and the electricity bill attached to them. There's a reason why data centers exist and why we're doing what we're doing.",CH33SYP00FSS,2026-06-23 18:01:28,3,cscareerquestions,t3_1udmm2e,False,
ote82dl,"If they have ""no work for you,"" take this as a sign to start pounding the pavement now. Do the bare minimum to keep your existing job. I went through something similar a decade ago with a small company, though obviously this was before AI.I was hired in. Management admitted they wouldn't find a product expert at what they were willing to pay and had to settle for what they could get. The lead analyst wouldn't give me any simple tasks. When I tried to be more assertive with her and to our management, I was just locked out of everything.We would deploy code changes immediately into production because they were too cheap to invest in a test environment. This went on for a few months - me being mostly frozen out, what little bit of work I did get was either very basic support or some production deployment where I'd make an error because I had no knowledge of the product. Eventually I was put on a PIP - likely to be demoted to desktop support - or fired.I just left as I knew either result would always be a dark cloud over me.Look now while you're still employed.",Serious-Conversation,2026-06-23 20:20:29,3,cscareerquestions,t3_1udmm2e,False,
ote9cw1,Did you tell the AI to make no mistakes?,Available_Road_2538,2026-06-23 20:26:06,3,cscareerquestions,t3_1udmm2e,False,
otip99o,"It's extremely unlikely that all software engineering will be replaced by AI. The demand for SWEs is actually growing.I have a pet theory that the right question isn't ""is industry X lucrative"" but rather ""how good do I need to be to make a good living in industry X?"" For example, you can make a great living in music, but you have to be really good. On the other hand, you can be an average or below average doctor and still make a great, stable living.It looks at this stage that you need to be better in 2026 and going forward at SWE that you needed to be in 2021 to have a stable career.So to answer your question: it depends how good you think you can be at it and how hard you're willing to work to get there.",The-_Captain,2026-06-24 13:01:23,151,cscareerquestions,t3_1uecrqj,False,
otiqgq5,"Dude take it from me, don’t bother hoping to get much support on this app lol it’s a whole lot of unemployed, miserable twats that will tell you you’re hopeless even if you graduate MIT with a 4.0. It’s hard to blame them given their situations, but they are simply not going to encourage you because even approaching the idea of it being a good career would make them feel like their unemployment is their own fault. The truth is simple, there is an entry level bottleneck, it likely isn’t going away, but if you do well in school and build a portfolio/practice for technical interviews (the most important part) try to land an internship (a very important part but not the end of the world) it is still 1 of the better degrees you can get. Software engineers won’t go away, they just have to learn to work with and on AI systems. If you’re passionate, do it",Jayman453,2026-06-24 13:07:40,57,cscareerquestions,t3_1uecrqj,False,
otis5u6,As far as getting a career in it? Yes. But not because of AI. Because of over-saturation and offshoring.,Sure-Relationship609,2026-06-24 13:16:13,39,cscareerquestions,t3_1uecrqj,False,
otiyech,"We can't know how things will be in 4 years, but AI is only getting better while the human brain stays the same, more and more work is eventually going to go to AI and the demand for software engineers is going to decreaseI graduated a while ago, almost none of my friends found work, I luckily found a job because my employer from my IT job back in the day, wanted me to come back as developer, otherwise I am pretty sure that I would have never found a jobIf I were you, I would be searching for something else to study",SanePcycho,2026-06-24 13:46:38,8,cscareerquestions,t3_1uecrqj,False,
otiplxt,"No. Do yourself a favour and do not return to this sub. It's full of depressed students, grads and jaded devs who are extremely pessimistic.",ProfessorMiserable76,2026-06-24 13:03:13,26,cscareerquestions,t3_1uecrqj,False,
otiqbf3,"Didn't you already ask this question weeks ago? Yes, it's a gamble just like going to school for 4 years for a degree is a gamble since you have zero job experience and won't know if you'll actually like the field or not. No one here, absolutely no one, will be able to tell you what the job market will look like by the time you graduate. I say trust your gut instinct and don't listen to random redditors with a chip on their shoulder or survivorship bias.",SignificanceShotc,2026-06-24 13:06:54,7,cscareerquestions,t3_1uecrqj,False,
otiraaz,"No but add some classes on running a/your own business, that’s my recommendation.I think there is another unwritten question here which is: is software engineering a good paying job in the future?",BountyMakesMeCough,2026-06-24 13:11:51,3,cscareerquestions,t3_1uecrqj,False,
otjq9jt,"""Ive always enjoyed coding and feel like i would excell in software engineering.""No. This is not a gamble for you. You should study something you enjoy and are interested in. Many of the skills of an undergrad degree are broadly transferrable to a range of jobs. CS is not a professional degree and does not lock you in to a specific career.",kblaney,2026-06-24 15:52:40,5,cscareerquestions,t3_1uecrqj,False,
otiu7qa,Yes. Don't do it.,IzK,2026-06-24 13:26:19,2,cscareerquestions,t3_1uecrqj,False,
otj1x9r,"Try studying or learning a mix of both EE and CS. In embedded systems engineering you work right at the boundary between hardware and software and you really need to know both. Years ago, our little then startup company hired a young CS engineer just starting out. He did software development for us. But it wasnt long before an oscilloscope was a permanent companion at his desk and he said it was his favorite debugging tool.He is now the CTO at a major underwater robotics company.",oceaneer63,2026-06-24 14:03:28,2,cscareerquestions,t3_1uecrqj,False,
osw6nm6,"I currently work at meta - there’s tons of uncertainty and poor morale. However, that was kinda true when I joined a year ago.It’s a risk. Depends on your risk tolerance.",BackendSpecialist,2026-06-21 05:38:48,162,cscareerquestions,t3_1ubhm7j,False,
oswcmwt,"As a person working at Meta, go with Bloomberg. Meta has a bad habit of laying off people who just joined the company 0-12 months ago. As a new grad, you don't want to be job searching when you have PE work.",jawohlmeinherr,2026-06-21 06:27:49,141,cscareerquestions,t3_1ubhm7j,False,
osw832m,Bloomberg,NoDryHands,2026-06-21 05:50:15,36,cscareerquestions,t3_1ubhm7j,False,
oswe2cp,"As someone at meta, go Bloomberg, it is a no brainer. Morale is terribly low rn over here.",cmztreeter,2026-06-21 06:39:34,60,cscareerquestions,t3_1ubhm7j,False,
osw6ja3,Palantir :face_vomiting::face_vomiting::face_vomiting::face_vomiting::face_vomiting::face_vomiting:,Interesting-Ad9666,2026-06-21 05:37:48,129,cscareerquestions,t3_1ubhm7j,False,
osy5730,"Bloomberg is the easiest choice ever. Stable, good name, and you can make a lot just advancing there.SWE > SRE work too, early in career at least.",Altruistic_Knee2044,2026-06-21 14:28:33,17,cscareerquestions,t3_1ubhm7j,False,
ot0wjvn,Why would ANYONE want to join palantir? They’re a company that spies on people.,RandomRedditor44,2026-06-21 22:39:50,8,cscareerquestions,t3_1ubhm7j,False,
osx3afq,Bloomberg. I've worked at meta and palantir.,traderftw,2026-06-21 10:20:53,23,cscareerquestions,t3_1ubhm7j,False,
oswpg9n,"Meta PE is more than SRE, it can be mix between traditional SWE and SRE. I wouldn’t join right now, given recent trends in the company.",CrayonsAreNutritious,2026-06-21 08:17:51,10,cscareerquestions,t3_1ubhm7j,False,
oswixrc,Not even mentioning the ethical component of considering palantir is insane lol,Creatura,2026-06-21 07:21:05,42,cscareerquestions,t3_1ubhm7j,False,
osy4ykt,We’d still be bitching about H1Bs and offshoring/nearshoring lol,Varrianda,2026-06-21 14:27:19,42,cscareerquestions,t3_1ubnsqn,False,
