id,body,author,created_utc,score,subreddit,parent_id,is_submitter,distinguished
on2z8p6,"Comment and Documentation is the most common answer, but seriously: hand written notes are really good for this. Hand writing something helps with keeping it in memory better than typing, and you can order your notes freely in 2D space. I have a whiteboard next to my PC for short term notes, and it is basically always in use, and I have a A4 college block on my desk. While programming, I go through multiple pages per day, and use my whiteboard extensively. Programming is mainly a problem of thinking through a problem. How much code you write is not a measure of productivity, and neither is how much time you spend typing. For completeness sake: There are some programmers who prefer exploring ideas by coding, and some who prefer exploring ideas on paper. I am firmly in the latter camp. Both have advantages and disadvantages, and if you want to be a good programmer, you need to be able to do both, but most people tend to favor one of those approaches.",Beregolas,2026-05-21 16:17:53,2,learnprogramming,t3_1tjowr1,False,
on31gt3,"You're not going to avoid reloading stuff into your head; you can only make it easier.I structure my git commits and often write more than one line in the commit message. Git blame will then show what I was thinking. I use Python's doctests liberally. I only commit code in a working state (all tests pass) unless I'm interrupted, and then I fix it later rather than compounding the problem. Or I throw it away and start over at the last good commit. Commits are ""atomic"", meaning they change ""one thing"" that I can easily verify in the diffs (even if ""one thing"" is scattered over multiple modules). I write down plans that I can't implement immediately, usually using an issue tracker. I add comments warning about things I can't fix immediately.Finally, I try to keep the codebase as short and simple as reasonably possible, so it's easier to understand and there's less of it to work through. Doing this part well is a lot of the art of software development. Refactor to reduce duplication and coupling. These goals appear to be at odds, as deduplication done poorly tends to introduce coupling. Depend on generic interfaces, or better, plain data, rather than implementation details. Think JSON and queues, not inheritance and ""design patterns"".",Gnaxe,2026-05-21 16:27:53,2,learnprogramming,t3_1tjowr1,False,
on32ef6,"Simply never stop coding :PI want to +1 the other commenter suggesting Kanban and I'll also add that thoughtful comments in the code itself are another way to maintain the ""why"" of something. In my experience, planning and thinking about your approach is often harder and more important than the actual code itself. So having a system to keep tabs on your overall idea is just as critical as writing it. And for me that looks like Kanban, usually. Or just scattered words on a whiteboard or paper that I can refer to later.It gets easier the longer you do it.",political_noodle,2026-05-21 16:32:07,2,learnprogramming,t3_1tjowr1,False,
on2zfko,"Notes, and comments.Start your project with a design doc of some kind, even if it is just a few drawings on a napkin.",burlingk,2026-05-21 16:18:46,1,learnprogramming,t3_1tjowr1,False,
on322fl,"I usually keep notes about it in my phone notes. Either I'll pull an all nighter just trying to implement tons of things for my project that I don't want to wait for, or I'll take way too many detailed notes about what I need to do, how they need to look, function and process, etc. Sometimes I follow them, sometimes I think about something else while I'm at work and never get to them, but they're there when I do.",IPutThoughtIntoThis,2026-05-21 16:30:36,1,learnprogramming,t3_1tjowr1,False,
on33wso,Git repo? Commit your changes and add a good commit message with what you have done,GlKar,2026-05-21 16:39:00,1,learnprogramming,t3_1tjowr1,False,
oo1n20y,"Games make great learning projects, but don't bite off more than you can chew. Do something like Pac-Man, not World of Warcraft. I recommend working through a beginner programming textbook in a relevant language before jumping in. Pick Python if you don't have a better idea.If you insist on jumping in first, start with an easier engine like Scratch instead of Godot. Even kids are doing it. Then try the beginner textbook again.",Gnaxe,2026-05-26 20:52:12,15,learnprogramming,t3_1toizxk,False,
oo1jwxl,"What you describe is a classic ""modern world"" problem.1. You started way too high. You are trying to build a house from the fifth floor up without building a solid foundation first2. Because of the above, all you can do is rely on and copy from tutorialsIn the old days, there were no tutorials. You had to learn everything with only a basic manual from the ground up. You had to learn to come up with your own solutions.Your problem is that you *started with game dev* instead of starting *learning programming*. First, a general, solid foundation, and then specializing.Because of that, you don't understand what the tutorial tells you and also because of relying on tutorials/AI, you do not learn how to solve your own problems.Take several steps back and *learn programming* from the ground up. This might not be fun. This might be tedious, but it is a necessity.Since you want to do Godot, start with *Python*, a language very close to GDScript. Do the MOOC [Python Programming 2026](https://programming-26.mooc.fi) from the University of Helsinki - start to finish. Do not skip anything. Do not use AI. Do not look up solutions. This will take time, effort, determination, and discipline, but it ensures that you get a solid foundation upon which you can build.Then, once you go back to Godot, shift from consuming tutorials to using them as inspiration. Try to do the things in the tutorials before the code is shown to you. Try to predict the code.Stop the notion to try to find tutorials for everything and anything. That's not how programming works. That's not even programming. That's just copying (even if you retype) and you will never really learn. (Just like you won't learn to write books by just copying existing ones.)",desrtfx,2026-05-26 20:37:57,23,learnprogramming,t3_1toizxk,False,
oo1yp1i,A really good habit is taking tutorial code and modifying it yourself in small ways. Break things intentionally change variables add features remove parts and predict what will happen before running it. That is where understanding actually develops,Designer-Flounder948,2026-05-26 21:47:03,10,learnprogramming,t3_1toizxk,False,
oo3efbt,"Ok, first off all, you are starting out WAY to big. I would recommend dipping your toes in lighter programming concepts, like programming in general and the thought processes required to build projects. Once you are comfortable with coding in a respect language, then transition gradually to Godot.",ImprovementLoose9423,2026-05-27 02:23:21,2,learnprogramming,t3_1toizxk,False,
oo4kiur,"I understand the thirst to bang out an awesome piece of work, but you must learn to crawl, before you walk, you have to walk before you run and you got to run before you fly.Best thing to do is take the bare bones of what you want to do, minus coop. Learn to craft the world, learn to move around, learn to place resources, then how to gather them. Each time you set out with 1 specific goal. Call your first attempt, ""The World"". Once you got a world looking like what you want. Save it as that version, then save it as a new version ""Strolling"". Code it so you can move all over the world without getting an error. Once that's done, save it and then save it again under the next goal ""Place Resources"". Just keep progressing that way, save often, save with a number system so that if you add code that causes it to blow up, you have a safe copy of what had worked before.When you got the majority of things you want to do in the game, then look at coop. That's the way I'd approach it. \*shrug\*",Popular-Woodpecker-6,2026-05-27 07:08:43,2,learnprogramming,t3_1toizxk,False,
oo6hbdd,"Honestly, almost nobody starts by “just writing scripts without looking things up.” Even experienced developers still read documentation, search things, and inspect other codebases constantly. The difference is mostly that over time they build stronger mental models of how systems behave, so new code feels more understandable instead of random.One thing that helps a lot is slowing down when using tutorials or AI. Instead of copying large chunks, try changing small things intentionally and predicting what will happen before running the code. That process gradually builds intuition.",_N-iX_,2026-05-27 14:31:54,2,learnprogramming,t3_1toizxk,False,
oo1qnuy,Learn the basics before jumping into game development. Practice. Practice. Practice.,BranchLatter4294,2026-05-26 21:08:48,1,learnprogramming,t3_1toizxk,False,
oo2edgv,Writing itBut also.. googling a lot while writing to figure out how to write what you're trying to do is a common and substantial part of the process,igotshadowbaned,2026-05-26 23:08:55,1,learnprogramming,t3_1toizxk,False,
oo2iti9,"A) programming is a lot of looking things up in the documentation or just searching for answers. Like, a lot a lot. Eventually some things get ingrained, but when it comes to doing something new that you've never done before, you'll almost certainly need to do some searching and reading. B) When you're making a game in an engine, a lot of what you're doing is manipulating values of objects provided to you by the engine (Nodes, in the case of Godot). So if you're trying to make a character move around on the screen, what you're doing is changing the value of its transform (specifically, its position). You can see the various attributes you can manipulate right in the inspector. So when you're thinking about what you want to happen, look in the inspector for the attribute that needs to be manipulated to make it happen, then translate the thing into code.",Paxtian,2026-05-26 23:32:38,1,learnprogramming,t3_1toizxk,False,
oo2pzr0,"Consider looking in to just doing procedural programming with Raylib and Odin, Odin is super easy to understand to use the compiler so it takes the headache out of having to learn C and Cmake or C and all the linking or just simply use C and use the AI to help you with the makefile setup and go through all of the Raylib tutorials and then start tinkering and making them your own. Live in procedures and then slowly branch out into using structs and arrays. I think that would be an easy pill to swallow and it will give dopamine hits cause its cool and fun.",jack_mackeral,2026-05-27 00:11:28,1,learnprogramming,t3_1toizxk,False,
onyl67b,"To all following commenters: please, do not bring up the old circlejerk jokes/memes about recursion (""Understanding recursion..."", ""This is recursion..."", etc.). We've all heard them n+2 too many times.*I am a bot, and this action was performed automatically. Please [contact the moderators of this subreddit](/message/compose/?to=/r/learnprogramming) if you have any questions or concerns.*",AutoModerator,2026-05-26 12:24:04,1,learnprogramming,t3_1to5d7z,False,moderator
onylmdp,Go? its pretty fast not too much close to python but similar and modern,Lanky_Supermarket_70,2026-05-26 12:26:40,11,learnprogramming,t3_1to5d7z,False,
onymjff,"Lua would be an easy transition (Love2d for games, which is Lua). C/C++ speed scales with your skill. If you write inefficient code, C wont fix that. If you dont know proper memory management go with Rust, Java, C#.Scala is a pretty nice hobby language with lots of built in optimization features.",Dangerous-Quality-79,2026-05-26 12:32:00,8,learnprogramming,t3_1to5d7z,False,
onymakp,"Except for the syntax Java and C# are very easy for a python proficient, and they are slower than C/C++ but still faster than python",0xC4FF3,2026-05-26 12:30:34,13,learnprogramming,t3_1to5d7z,False,
onymnx5,"Since you're using and enjoying Godot, you could try to go for C# as Godot supports that too. Might have a multiple benefit for you :grinning_face_with_smiling_eyes:",Donkey_God-D,2026-05-26 12:32:42,3,learnprogramming,t3_1to5d7z,False,
onyrhov,"Honestly, Go sounds like it would fit your interests really well. It’s fast, simple to pick up from Python, great for scripting/tools, and doesn’t bury you in boilerplate the way Java sometimes can. A lot of Python users seem to enjoy it because you can still move quickly without fighting the language.If you want something that changes how you think about programming a bit more, Rust is also worth a look. Steeper learning curve, but really rewarding once it clicks, especially for gamedev/performance-heavy stuff.",Beneficial-Panda-640,2026-05-26 12:59:20,2,learnprogramming,t3_1to5d7z,False,
onysh3p,">ive also dabbled in some custom bash scripts, although im considering switching to zsh because of the limitations i'm reaching with bash. People switch to zsh more for the interactive shell component not the scripting features. It's just another implementation of POSIX shell like bash. They share almost identical syntax, with only minor differences. I'd be surprised if scripting in zsh would solve these limitations you're talking about (could be dead wrong though). Bash is just so standard at this point. Even if zsh scripting is marginally nicer in some ways, you might hit issues that are harder to resolve since the ecosystem simply isn't as well supported/represented.It is a great interactive shell, though. Feels a little more modern without being completely dumbed down, and as long as you still have bash installed you can always run your scripts even from z-shell.Not exactly what you asked, but just wanted to blabber about it since I am also mostly a hobbyist and recently made the switch to zsh and find it slightly better interactive experience and worth the time I put into setting it up (oh-my-zsh, personalized aliases, and stuff).",yummyjackalmeat,2026-05-26 13:04:41,2,learnprogramming,t3_1to5d7z,False,
oo15pqs,For your usecase of scripting I'd think go is better than Java.For the joy of OOP because you're a Linux user id heavily recommend Java over C#. Csharp is at home on Windows but I don't prefer it.If you want to dive into something more intense I personally prefer scripting on Linux in Rust,I_Am_Astraeus,2026-05-26 19:33:23,2,learnprogramming,t3_1to5d7z,False,
oo22q2d,"Go. The syntax will feel familiar coming from Python (minimal ceremony, no semicolons needed in practice, strong standard library, built-in formatting via gofmt), but you get compiled speed and real concurrency without the mental overhead of Rust's borrow checker or C's manual memory management. It's excellent for the kind of scripting and CLI tooling you described. Compiles to a single static binary too, so deploying scripts to other machines is just copying one file. If gamedev is your main priority over tooling, C# (Godot has solid C# bindings) or Rust would be stronger picks. But as a ""second compiled language for a Python person,"" Go has the gentlest learning curve by a wide margin.",GreenNo2789,2026-05-26 22:07:04,2,learnprogramming,t3_1to5d7z,False,
oo3612e,"What you’re missing is not Python knowledge, it’s a starting ritual. For scripts, I’d begin with comments before code:1. get the folder path2. list files3. decide the new name for one file4. print old -> new without changing anything5. only then renameThat “dry run first” habit removes a lot of fear. For your renamer, don’t try to design the whole structure upfront. Write a tiny script that prints filenames, then add one function at a time: `make_new_name(file)`, `preview_changes(files)`, `apply_changes(changes)`. Structure appears as you separate those steps.",AutomaticBill114,2026-05-27 01:38:17,16,learnprogramming,t3_1toqy74,False,
oo38dvb,"Yup I think you already mentioned the main issue, breaking a task into smaller pieces. I like using a whiteboard, I’ll draw my thoughts out using labeled boxes and have arrows pointing everywhere for how it should flow. it helps get initial ideas from just concepts in my brain and pulls them into the physical world. Grab a rubber duck and talk out loud, explain to the duck the problem you need to solve and the steps you’ll take to solve it in code.",Repulsive-Money-1578,2026-05-27 01:50:50,4,learnprogramming,t3_1toqy74,False,
oo3a3mx,"I’m in the same boat as you, what is helping me is look up documentation, break down the problem as much as i can on my own, if stuck, use ai to guide me and code myself after. Code slowly, type and think about what you wrote and how it works in the context. This is the only way I’ve found for me to remember the patterns and build muscle memory. I could finish the whole project with Claude but if I don’t go through it slowly and understand each part, I won’t be able to rebuild all of it without AI. Yes I can understand what is happening after googling and all but in the end, we want to be able to write it on our own, not just understand it, correct? Hope this helps",Summertime_Happinex,2026-05-27 01:59:53,2,learnprogramming,t3_1toqy74,False,
oo3epaj,"One thing that helped me was writing the boring version first.  For your file renamer example, I’d split it into tiny steps:  1. list the files  2. decide what each new name should be  3. print a preview of old name -> new name  4. only then actually rename them",No-Aardvark-2881,2026-05-27 02:24:51,1,learnprogramming,t3_1toqy74,False,
oo3r9oh,Plan the project think about the components what coes first code that then after what shoudl come code that,ApprehensiveLand963,2026-05-27 03:37:00,1,learnprogramming,t3_1toqy74,False,
oo415z8,"Also, it may help to draw it out on paper or mspaint or whatever. People have even written vscode plugins to help with this because it can get difficult to follow on big projects.ex https://www.codediagram.io/",EquipLordBritish,2026-05-27 04:41:12,1,learnprogramming,t3_1toqy74,False,
oo4dxmc,"the freeze at a blank file is usually not a knowledge problem. it's an assembly problem: you know the pieces but not the order, and the fastest fix for that is reading one real small script someone wrote to solve one specific thing, not writing more code yourself.",quietcodelife,2026-05-27 06:16:04,1,learnprogramming,t3_1toqy74,False,
oo4ncte,"You are just struggling to come up with a plan to solve the problem.So, this is not really a programming issue, but a planning issue.And the reason you're struggling, just like programming, you need to practice this skill in order to get better.Here is how to start to get better and planning you code.Take a pen and piece of paper write out the steps you need to do to solve the problem.None of this writing should include code, just text describing what you plan to do.Now code those steps using Python code, adding in your text from the plan as a line comment.",ScholarNo5983,2026-05-27 07:32:32,1,learnprogramming,t3_1toqy74,False,
oo5vvsw,"Reading the other comments, everyone's giving you the same advice from different angles (decompose first, dry run, comments before code). All true. But the question of HOW to decompose is what nobody's answering, and that's the part that paralyzes you.Here's the trick that nobody told me explicitly but every senior dev does subconsciously: read your problem out loud and grab the verbs and the nouns.""Rename all files in a folder using a pattern.""Verbs: rename, list (implied)Nouns: file, folder, pattern, new name (implied)Verbs become functions. Nouns become variables or arguments. Your function signatures basically write themselves:list\_files(folder) -> \[files\]generate\_new\_name(file, pattern) -> strrename\_file(old, new) -> boolThat's it, your whole script is now 3 functions and you haven't written a line of code yet. The ""what functions should I build"" question stops being mysterious once you realize the answer is always hiding in how you describe the problem in plain english.Bonus: this also tells you when you're overcomplicating. If your sentence has 12 verbs, you don't need 12 functions, you probably need to rephrase the problem more tightly..",Dense-Inspection-183,2026-05-27 12:49:17,1,learnprogramming,t3_1toqy74,False,
oo67ouq,"This is honestly one of the most common transitions people hit when moving from: “Learning concepts” to “Building software.”Because tutorials/data science notebooks often give you:* clear flow* predefined structure* obvious next stepBut blank projects force you to design the structure yourself.And honestly, software design is a separate skill from syntax knowledge.One thing that helps a lot is: Stop thinking about the whole script at once.For your file renaming example, literally write the steps in plain English first: 1. get all files 2. loop through files 3. generate new filename 4. rename file 5. handle errors Then convert each line into tiny code pieces.A lot of experienced developers basically do this mentally automatically after enough repetition.Also, don’t over-engineer early projects. Beginners sometimes freeze because they think: “What’s the PERFECT structure?”Meanwhile, real software often starts as: “Make it work first.”The important thing is that you already understand: input → transformation → output.That’s honestly a huge part of programming already. The “breaking problems into smaller pieces” skill mainly improves through repeatedly building small, standalone scripts/tools.",EfficientMongoose317,2026-05-27 13:47:13,1,learnprogramming,t3_1toqy74,False,
onded2g,This is not a childish question at all. The simple code you wrote can be translated into “stuff on the screen” because you use some built in features/functions given to you by the programming language (like stdio.h). You simply call those functions and the compiler does the heavy lifting of converting those function calls into instructions telling the CPU to draw stuff on the screen,gohanshouldgetUI,2026-05-23 04:08:02,13,learnprogramming,t3_1tl5l7d,False,
ondds2l,"In short, that code you wrote gets compiled down into a ton of 0s and 1s that tell the CPU/GPU what to render for the UI and what processes to run.Coding languages are just an abstraction from binary that machines understand",chinnick967,2026-05-23 04:03:48,13,learnprogramming,t3_1tl5l7d,False,
onded06,"it's not an easy answer, as you can probably imagine. I'm not 100% sure what you mean by ""run automatically"" but an application is a process, which is a sequence of instructions in memory that is executed by the CPU. the operating system facilitates the use of the CPU for each process (scheduling). what you see on the screen is just bits; each pixel gets 3 numbers for red, green and blue. some instructions in the program that is running inside the process will decide what color each pixel should be. it's a bunch of math and heuristics and voila, windows and text and icons and everything else. a lot of that is sufficiently complicated that third-party libraries exist to make it much easier by providing abstractions for things like windows and UI elements - each application programmer is not hand-rendering pixels. and GPUs streamline it further by giving you a method of computing each pixel's value in parallel.generally good to have more specific questions to get more specific answers. if you have a fundamental interest in how computers work, bottom up, check out the nand2tetris course, it is absolutely unmatched",gordonnowak,2026-05-23 04:08:02,3,learnprogramming,t3_1tl5l7d,False,
ondnlpi,"You start to learn programming in a kind of simple classic environment, with two connections to the outside world. (Standard) input and output. Usually bytes that get interpreted as text. This works great in the command line, and for simple scripts, and even for generating web pages, but to do anything interesting, you need more connections, usually to the hardware via the operating systems. Most programming languages have libraries or APIs that kind of extend the language and let you do more stuff, like a GUI, or being installed in a way to run automatically, or open up a network connection, or make a sound.The next step would be to do some kind of tutorial, maybe for mobile development or something, maybe a “desktop apps with c#” tutorial, to give you a taste of how the next level of programming works. Or do a tutorial in whatever interests you. Nothing too complicated to start with though.",flamehorns,2026-05-23 05:20:13,2,learnprogramming,t3_1tl5l7d,False,
onefli6,"Do you have a PC?If so, just install a C compiler and start writing C code and getting it to work on the PC using a locally installed C compiler/linker.This is easy to do, and it will give you a much better understanding on how the compile/link/run cycles works for the C language.>What I don't understand is how applications run automatically and how they translate into graphical interfaces where all we ever did was interact with the code through weird compiler text interfaces only.If you ran a C program using something like Windows or Linux, the program would be run in a console/terminal window.What that console window does is take input from the user and send it to the program and capture output from the program and display it to a screen.Both of those operations can be done by a web interface, but instead of program running locally as is the case for the console, the web interface runs the executable on the server.",ScholarNo5983,2026-05-23 09:26:59,2,learnprogramming,t3_1tl5l7d,False,
