id,body,author,created_utc,score,subreddit,parent_id,is_submitter,distinguished
oyowpqk,"My friend used to work for a satellite company. He traveled to Kourou French Guiana more times than he wanted to. Rather unsafe place good thing he was 6ft 5in and muscular... Defense also, another friend ended up in unsavory places galore in the Middle East with his work on the V-22 Osprey. My favorite job though. Chief information officer on a cruise ship. Mostly IT operations and money not the best but a good deal.",debugprint,2026-07-20 15:40:53,25,cscareerquestions,t3_1v1hjf9,False,
oyogae9,"There are sysadmin jobs at McMurdo.IT support people I've known that dealt with oil rigs would fly out for a day, not live aboard.",PaddingCompression,2026-07-20 14:27:01,22,cscareerquestions,t3_1v1hjf9,False,
oyoroqu,"Most jobs like that will be IT jobs (installing equipment, repairing devices, administering systems) rather than software development.Living on site is still extremely uncommon, though.",dmazzoni,2026-07-20 15:18:41,12,cscareerquestions,t3_1v1hjf9,False,
oyob50u,"Defense contractor gigs. In my experience, depending on your role, you’ll sometimes be deployed to bases overseas to help with setting up equipment and deploying services.",kennpacchii,2026-07-20 14:02:44,39,cscareerquestions,t3_1v1hjf9,False,
oypsopc,"Did some data analysis on antennas in Iraq when it was still pretty sketchy there.An armored truck picked us up from the airport and drove us to a bunker where we spent the week. Weekends were anywhere we wanted, many flew back to Dubai (company HQ) or for me, I just caught the red eye flight to Bangkok",DangerousPurpose5661,2026-07-20 17:57:17,5,cscareerquestions,t3_1v1hjf9,False,
oypc0fd,I've got a friend who used to work in tech recruiting. He told me about a data science job he struggled to fill because it was a six month contract living and working at a mining operation in the Nevada desert,HaplessOverestimate,2026-07-20 16:46:47,3,cscareerquestions,t3_1v1hjf9,False,
oyqvyp5,"As others have stated, systems or IT is really where you want to be for this kinda thing. Basically nobody has true SWE on site like this. Something others haven't mentioned, Sales Engineer. Not so much living on site, but traveling a lot. Sometimes living in weird places to fill territories. But it's usually remote or at a company office otherwise. Niche support staff can also end up in weird places with the right employer. Especially defense.",VladimirPutin2016,2026-07-20 20:49:33,2,cscareerquestions,t3_1v1hjf9,False,
oyz18fd,"Walmart headquarters are in Arkansas, does that count?",droi86,2026-07-21 23:23:09,2,cscareerquestions,t3_1v1hjf9,False,
oynni8b,The Rust Belt,Illustrious-Pound266,2026-07-20 11:58:20,4,cscareerquestions,t3_1v1hjf9,False,
oyrhf8d,Operational Technology cyber at a chemical processing plant usually requires some in office commitment lol,henryhttps,2026-07-20 22:31:13,1,cscareerquestions,t3_1v1hjf9,False,
oyd2y7n,to increase the wealth of its shareholders,PixelPhoenixForce,2026-07-18 21:27:14,15,cscareerquestions,t3_1v07so1,False,
oydikod,This exact story was posted 4 days ago. https://old.reddit.com/r/cscareerquestions/comments/1uwdwg2/meta_used_ai_to_target_workers_with_medical/,alinroc,2026-07-18 22:42:47,4,cscareerquestions,t3_1v07so1,False,
oyjx387,"They were low performers, what's the issue?/s",Fun_Highway_8733,2026-07-19 21:22:55,1,cscareerquestions,t3_1v07so1,False,
oyery13,"I guess then, shareholding will replace full time work as a more secure source of income",ccricers,2026-07-19 03:07:35,1,cscareerquestions,t1_oyd2y7n,False,
oyfibtf,"Sorry, you do not meet the minimum sitewide comment karma requirement of **10** to post a comment. This is comment karma exclusively, not post or overall karma nor karma on this subreddit alone. Please try again after you have acquired more karma. Please look at the [rules page](https://old.reddit.com/r/cscareerquestions/w/posting_rules) for more information.*I am a bot, and this action was performed automatically. Please [contact the moderators of this subreddit](/message/compose/?to=/r/cscareerquestions) if you have any questions or concerns.*",AutoModerator,2026-07-19 06:24:10,1,cscareerquestions,t1_oyfibry,False,moderator
oxzk19h,3 years of experience before you graduate in this market.,fernfernferny,2026-07-16 23:05:08,63,cscareerquestions,t3_1uyi7r6,False,
oxzjxa9,100% the only skill that is working in 2026 is exploiting the neurotypical nepotism and in-group system (“networking”),Dry_Fly_7265,2026-07-16 23:04:33,43,cscareerquestions,t3_1uyi7r6,False,
oxzlw44,Family is personal friends with company director,AdministrativeHost15,2026-07-16 23:14:49,13,cscareerquestions,t3_1uyi7r6,False,
oy08ojc,Luck,DinnerTimeSanders,2026-07-17 01:18:37,6,cscareerquestions,t3_1uyi7r6,False,
oxzojdw,Knowing people. That’s pretty much it.,amuscularbaby,2026-07-16 23:28:34,11,cscareerquestions,t3_1uyi7r6,False,
oy5115q,"Start your own LLC, develop a SaaS business and then make a product that gets some recognition.Now do it for atleast a year and put it on your resume as a software engineering experience.For non-startup companies don’t tell them that you ran a business but that you were hired by the LLC and describe the tasks that you did.For start-ups absolutely tell them you ran your own company for a bit and had some success or that you still do run it.",PhilosophicalGoof,2026-07-17 18:02:57,5,cscareerquestions,t3_1uyi7r6,False,
oxzmumo,"solid projects, leetcode basics, git, networking. even then, nobody hiring now",my_peen_is_clean,2026-07-16 23:19:49,5,cscareerquestions,t3_1uyi7r6,False,
oxzqx1w,3million YouTube subscribers on your coding channel,Savings-Desperate,2026-07-16 23:41:06,3,cscareerquestions,t3_1uyi7r6,False,
oy1xhpy,"Typescript, Frontend framework (generally react), backend framework (node is fine, I think python/django might be a little more marketable but not a big deal, if you know node i mean you can just lie lol...), SQL, cloud microservices (api gateway, lambdas or ecs, cdn, s3, redis, x-ray, cloudwatch), CICD, testing with jest/playwright, docker. Grind hellointerview, be able to do the easy typical leetcodes.I'd say know those skills and be to talk about them live in an interview, be able to read the code for the above. Live you should be able to write basic data manipulation, pagination, and make APIs.Have a single solid professional level project with the above.",NICEMENTALHEALTHPAL,2026-07-17 08:17:40,2,cscareerquestions,t3_1uyi7r6,False,
oy50169,"Networking, as in building relationships with people to leverage your relationships so when any of your friends gets a job and there is an opening, you can have them give their boss your resume with a recommendation that you will fit well with the team.As for your skill set, degrees, and certs, it doesn't fucking matter; so do another 2000 people who are applying for the jobs you want. They use AI slop to go through an AI slop sorting machine and of those 2000, 200 will be spat out to be considered, a bunch will be interviewed, shortlisted, and then one will be hired. It's much easier to cut through all of that and get shortlisted from the beginning.I get told I am wrong by people who can't get a job and just keep getting another cert, certain that their 12 page resume will get them the next job, maybe it does.What I know is that knowing people has gotten me 6 jobs, and not like gigs, like jobs I worked for years until I moved on.Also, don't take it personally when either you don't ever hear back, or you get shortlisted, but never hired. There's nothing wrong with you, the other person knows someone inside and had their friend recommended them to their boss. The whole hiring process after that is just to be able to show on paper that they didn't do what they did do.",I_IdentifyAsAstartes,2026-07-17 17:58:46,2,cscareerquestions,t3_1uyi7r6,False,
oz1di8r,DevOps especially the guy doing release and incident response,BabytheStorm,2026-07-22 08:32:36,47,cscareerquestions,t3_1v39f8v,False,
oz2gp7u,That guy who gets in early at a start up and documents nothing and is subsequently the only person who knows how anything works.,kimbosdurag,2026-07-22 12:55:30,20,cscareerquestions,t3_1v39f8v,False,
oz19njt,"If you want stability, aim for state level government jobs. Be careful what you wish for though.",beatfungus,2026-07-22 08:00:22,53,cscareerquestions,t3_1v39f8v,False,
oz26x01,"It's probably working with deeply integrated mission critical legacy tech. Think FORTRAN programmer working on mainframe software that is at the heart of a credit agency or bank. I don't know if it is still true but at some point the demand was great enough IBM ran special summer programs just to try to get new CS students into the area as greybeards were not being replaced at a sustainable rate.The joke used to be if you went into this area you would be bound to your desk with golden chains. I don't know how true that is in 2026, and this is from an era before SV comp exploded in the mid to late 2010s, but in terms of stability it's probably still true.",Chuu,2026-07-22 12:03:40,14,cscareerquestions,t3_1v39f8v,False,
oz2hkci,"Sports is so annoyingly secure that I can’t leave it. Why do multiple rounds of extreme engineering interviews when I just get asked for a 1-2 conversational interviews only before receiving an offer?And that’s if I would get laid off which wouldn’t happen unless there was another pandemic. And on the hiring side I see the same way, like I can’t find a talented tech engineer/developer that has worked on sports products without literally trying to bribe them off their company.",StuckWithSports,2026-07-22 12:59:49,6,cscareerquestions,t3_1v39f8v,False,
oz1amwf,Mongolian basket weaver,Jeferson9,2026-07-22 08:08:35,18,cscareerquestions,t3_1v39f8v,False,
oz1cp37,"Nothing is really stable at the end of the day.Nothing is future proof.If the market craters nobody is really safe.There's a few things that'll always be needed, but even there the fat might get cut.You might be able to buy time in a super-stable sector with no real pressure and no competition.Government might be good for this.But even government might go through a renewal process every few decades. Get a crack team of consultants in, maybe the new system makes you redundant?",PyroSAJ,2026-07-22 08:25:48,7,cscareerquestions,t3_1v39f8v,False,
oz19wfs,Goose farmer,spellcasterGG,2026-07-22 08:02:26,9,cscareerquestions,t3_1v39f8v,False,
oz1ad9x,Let us know when you figure it out.,IX__TASTY__XI,2026-07-22 08:06:20,6,cscareerquestions,t3_1v39f8v,False,
oz1s728,I was reading this in all seriousness and then saw diabolical answers like goose farmer and mongolian basket weaver. Why tf are they so specific?,Recent_Land1282,2026-07-22 10:29:34,6,cscareerquestions,t3_1v39f8v,False,
oypsoxb,"You accept that even if you cant get a job related to tech that life will go on and that even if you do everything right failure is always a possibility. So just hope for the best and soldier on, it's all you can do",Sauerkrauttme,2026-07-20 17:57:18,23,cscareerquestions,t3_1v1rvls,False,
oyplyjh,You fly the airplane all the way into the ground. What else are you gonna do?,justUseAnSvm,2026-07-20 17:28:56,15,cscareerquestions,t3_1v1rvls,False,
oyq56qi,Accept that it will likely be even more hopeless in 2 years. :man_shrugging:,djslakor,2026-07-20 18:50:41,6,cscareerquestions,t3_1v1rvls,False,
oyquhyf,just junior? change careers,Useful_Calendar_6274,2026-07-20 20:42:59,3,cscareerquestions,t3_1v1rvls,False,
oypnjsu,"The economy is in a really rough shape currently. It is genuinely rough out there. So, your hopeless feeling is not totally ungrounded. Things are being shaken up in a big way by technology and the internet and AI. The need for software engineers doesn't just go away over night. If anything, the way it looks, there will be a ton of robotics + AI job opportunities rolling out over the next few years. If you love working with tech, keep at it. But stay open-minded about what jobs you could end up doing. Stay flexible as possible. My takeaway would be: if you genuinely love working in tech, stick with it. Things will get better. It is really hard to see right now, because we don't know where things are heading and what industries will be opening up yet.",j__magical,2026-07-20 17:35:41,6,cscareerquestions,t3_1v1rvls,False,
oypnye1,"The trait you hear over and over again as separating good SWEs from bad ones is their soft skills. If you want to stand apart from other new grads, now's the time to start working on your professional network and on your social skills.",victorsmonster,2026-07-20 17:37:23,6,cscareerquestions,t3_1v1rvls,False,
oypli5l,"well definitely don't expect the job market to improve significantly. we've been in this lame-ass stagnant low-hire market for a full three years, it's obviously just the new normal rather than a pendulum about to swing back.",Felix033,2026-07-20 17:27:01,3,cscareerquestions,t3_1v1rvls,False,
oypnm41,"The tech industry in general goes in cycles this is not the firstn or last time those in charge have claimed we will no longer need juniors, this is not the first nor last time an overwhelming amount of capital enters the industry and dramatically shifts the focus . Dotcom, Metaverse, NFT's, beginning of social media , Web APps, the industry constantly goes through trends. Your job is to learn the fundamentals of computer science and when you graduate be open to embracing whatever trends or new emerging technologies are popular when you are looking to be employable. I've been working in tech for a long time and the most valuable skill I can reccommend for longevity is being adaptable until you find your core area of expertise ( and that can take a long time) .The odds are stacked against you but the odds are stacked against everyone who enters tech and doesn't have immediate connections , at the end of the day can you build something people want to pay for ? If so you are likely to land a job and if not then you still have time to change majors.",theKetoBear,2026-07-20 17:35:57,2,cscareerquestions,t3_1v1rvls,False,
oysf0gs,good news: it goes away after you get a full time jobbad news: you now have a full time job,rynspiration,2026-07-21 01:31:54,1,cscareerquestions,t3_1v1rvls,False,
oy5vl7t,Skibidi is not AI generated.,lavahot,2026-07-17 20:16:52,18,cscareerquestions,t3_1uzajap,False,
oy604ek,"You can ignore whatever you want, especially if it's to keep your sanity /two-cents",lhorie,2026-07-17 20:37:14,8,cscareerquestions,t3_1uzajap,False,
oy60u26,AI writes the job applications.AI gives the job interviews.AI takes the job interviews.It's just the circle of artificial life.,The_Other_David,2026-07-17 20:40:27,8,cscareerquestions,t3_1uzajap,False,
oy868ez,I mean that seems like an easy way to filter out potential employers.,farsightxr20,2026-07-18 03:50:25,5,cscareerquestions,t3_1uzajap,False,
oy5td8u,I would never do an AI interview unless that's literally what 95%+ of what companies would do. I hope we never get to that point (i think the AI bubble will burst before that happens).,SectumSempra1981,2026-07-17 20:06:57,10,cscareerquestions,t3_1uzajap,False,
oy60pjf,"nope, not wrong, just say the magic words to them ""unfortunately, I don't think this role is a good fit and I'd like to withdraw my candidacy"" I've said that phrase so many times that I've lost count over the years",NewChameleon,2026-07-17 20:39:53,3,cscareerquestions,t3_1uzajap,False,
oy696c7,The only reason I’ve used AI to conduct interviews are to help me come up with questions because I got tossed into them without warning lol,Mike_Oxlong25,2026-07-17 21:19:01,3,cscareerquestions,t3_1uzajap,False,
oy6pb2t,Send an ai avatar in your place.,FlashyResist5,2026-07-17 22:39:00,3,cscareerquestions,t3_1uzajap,False,
oy7ei6n,yea time to switch to blue collar. nobody is doing AI interviews for that.,LibrarianOutside2376,2026-07-18 00:58:44,1,cscareerquestions,t3_1uzajap,False,
oy7fz7c,"I would do the interview, and then try and trick the AI into doing something flagrantly illegal.",fsk,2026-07-18 01:07:22,1,cscareerquestions,t3_1uzajap,False,
oywiexn,"Not great. 2.5YOE, backend, laid off recently. Worked in a big corporation as a backend engineer and before that in a no-name consultancy firm as a full-stack engineer. Getting called back, but HR and tech managers claim that I don't have enough experience. Working on selling myself better in my resume and in HR calls.Every other company either searches for 5+ YOE or a \*\*senior\*\* with 3+, which is close to or in our ballpark, but I would consider myself very far from senior. It sucks.",Jagabong,2026-07-21 16:37:30,24,cscareerquestions,t3_1v2lc36,False,
oyvzrb4,"I’ve been seeing more callbacks than I did a year ago, but the job descriptions are getting weirdly specific for that level.",NeedleworkerNext5000,2026-07-21 15:18:30,25,cscareerquestions,t3_1v2lc36,False,
oyx50po,"I'm at 5 YOE and it's been easy getting offers. I just started a new job and got it through a recruiter via LinkedIn. I'm at 150k TC, 2 days hybrid, MCOL. Full-stack .NET. SaaS company.",dats_cool,2026-07-21 18:13:08,10,cscareerquestions,t3_1v2lc36,False,
oyyt3y5,"no name startups will make it hard to get callbacks. i was at F500 media company and the market was fine, 3 interviews in \~90 apps and 2 converted to offers.",pkfireeee,2026-07-21 22:42:03,3,cscareerquestions,t3_1v2lc36,False,
oyw16ub,im not 100% sure. When i was applying last year what recruiters told me was that the market in 2025 was getting better but no way close to where it was in prior years. But one thing i will say is i feel like a year ago this sub was filled with doomposters and posts asking this same question. It felt like a daily question about it. Now i feel like ive been seeing these posts on this page less and less. So that should say something i feel like.,Broad-Cranberry-9050,2026-07-21 15:24:38,4,cscareerquestions,t3_1v2lc36,False,
oz0m7bx,The market is in a recalibration. It is mostly going to be a hold for someone with 2 jobs in 3 years. Offers are unlikely to exceed current salary.That being said always be interviewing as this sort of stuff can change and opportunities and salaries can be kind of random.,Few-Impact3986,2026-07-22 04:56:05,1,cscareerquestions,t3_1v2lc36,False,
oz1qpgc,Ass,SkellyJelly33,2026-07-22 10:18:36,1,cscareerquestions,t3_1v2lc36,False,
oz78uqz,I'm basically in the same exact boat. It sucks ass.,emteedub,2026-07-23 01:58:48,1,cscareerquestions,t3_1v2lc36,False,
oywmz2s,Doesnt having a big corp on ur resume help for interviews?,Worldly-Plant1,2026-07-21 16:56:53,11,cscareerquestions,t1_oywiexn,False,
oyyta8z,"the YOE isn't what matters nowadays, it's your perceived seniority. i was doing a lot of senior level work at my previous company and got a new job which asked for 5+ yoe (i had 2)",pkfireeee,2026-07-21 22:42:56,2,cscareerquestions,t1_oywiexn,False,
oy4h1a8,"That is a good point, I think you might not be charging enough for an hour",maxou2727,2026-07-17 16:39:28,32,cscareerquestions,t3_1uz4r73,False,
oy4iadg,"I've been doing it for like 20 years.IMO, it's worth it if you can find long-term, multi-year contracts where you bill 40/hrs per week, or several short-term contracts you can run concurrently without overcommitting yourself. It's not worth it if you have short-term contracts that leave you with a lot downtime in between gigs and/or have to constantly scramble around trying to find new projects.There can also be an hourly rate trap, where the higher your hourly rate becomes, you're making more but a client is also increasingly less inclined to keep you around long-term once an immediate, pressing need has passed.You also need to structure your LLC in such a way that you're maximizing your employee salary vs. owner corporate earnings taxes.",bliceroquququq,2026-07-17 16:44:44,21,cscareerquestions,t3_1uz4r73,False,
oy4id61,"Contract work can be very lucrative, but you have to charge enough. And it will vary by project. If it's big enough and the kind of work where you can put in large numbers of billable hours a week, you can charge less, and if it's not, you'll want to charge more. A decade ago when I would occasionally take some contract work, my range was $300-$600/hour. $110 today is very low. But it can make sense to take some low-paying work to build a reputation and build some relationships. But independent contracting means you're covering so much more. You need to compensate for differences in taxes, benefits, administration, risk, and more. Think like a business and charge like a business. Edit: fixed typos",ben-gives-advice,2026-07-17 16:45:04,11,cscareerquestions,t3_1uz4r73,False,
oy4h0bx,"If you can get away with doing a 40 hour a week job in 15, more power to you. I've personally found its more common that it takes more than 40 hours a week but that will depend upon where you work.On the other hand, just because you're billing for hours doesn't mean you actually need to work them. All depends upon the terms you've negotiated.If you thought becoming a contractor was going to be easy then you're mistaken",Alive_Sir_4708,2026-07-17 16:39:21,6,cscareerquestions,t3_1uz4r73,False,
oy4qwql,"I have been working full time for consulting departments/companies for the last six years.  I make right north of $200K full time, W2, benefits, 401K match, etc.This isn’t the highest I’ve made.  Even as a mid level consultant which I was back then, my last year at AWS ProServe I made around $235K in cash + RSUs. Senior consultants are making around $285K+ at AWS, GCP and a little less at Oracle and Microsoft.I would just rather get an anal probe with a cactus than go back to BigTech - especially with the RTO requirements. I’m not sure what they are making as FDEs at OpenAI.  But the qualifications are not you have to know how to build FMs, you need to learn how to bring that into a business.  With all of my experience, connections etc, I would never go independent.",BraveResearcher3037,2026-07-17 17:20:46,6,cscareerquestions,t3_1uz4r73,False,
oy4z2f9,"$110/hour must be way too low for USA, that's about what we are billing here in socialist europe lol",VitunSama69,2026-07-17 17:54:43,4,cscareerquestions,t3_1uz4r73,False,
oy4i4v1,"It's always a hard calculation. I generally work a little more that 40 hours a week, but still taxes, insurance, 401k match and all the other stuff adds up. I think a good ballpark is your hourly needs to be at least 50% more than your were making at your full time job to approximately break even. There are a lot of really nice things about contact work though. Lots of flexibility and lots of opportunity to do different things. In good markets a lot of opportunity to turn down uninteresting work too.",Bobgar_the_Warbarian,2026-07-17 16:44:05,3,cscareerquestions,t3_1uz4r73,False,
oy4idhz,Can you charge more? I was charging about $200/hr at 5 YoE; plenty of clients pushed back but I was still able to bill 30+ hours a week. Market is different now but I still do consulting and don’t usually get pushback on rate. Cheap clients will be looking to Europe or South America anyway; you can’t compete on price as a US-based contractor.,samelaaaa,2026-07-17 16:45:06,3,cscareerquestions,t3_1uz4r73,False,
oy4tifs,"My rule on contract work is to take my yearly salary TC target, devide it by 1840 to get my hourly rate. Then for W2 I increase it by 20% and if it is gonig 1099 it is another 20%. From there the cost only goes up as the shorter the contract the more it going to cost per hour.1840 is 46 weeks a year at 40 hours. 2 weeks of holidaies, and 4 weeks of PTO all of which I consider income of some type.the 20% for W2 is to cover benifits I dont get and for 1099 well I need to cover another 7.5% in taxes plus more headaches.",timelessblur,2026-07-17 17:31:38,3,cscareerquestions,t3_1uz4r73,False,
oy4ukj0,"I mean, compared to being unemployed, yes. Otherwise, devil's in the details of the contract.",lhorie,2026-07-17 17:36:01,3,cscareerquestions,t3_1uz4r73,False,
oy4bix8,Either they’re paying you $$$$ - even then - it’s time to start looking. Keep your head down and apply and hop ASAP,xxlibrarisingxx,2026-07-17 16:16:20,45,cscareerquestions,t3_1uz41z8,False,
oy4ek61,"Lmao, no, this is not normal. My oncall rotations have been maybe 1 week every 6, and if I got a single page outside working hours in that week, there'd better be a damn postmortem so we can fix it.> I genuinely feel like I can’t get anything meaningful done during my on-call weeks.Obviously that's fine from a professional point of view. It's fine to do zero normal work if oncall takes up your 40 hours. > I see the senior engineers online genuinely 24/7 working answering messages even when they’re on PTOShitty company culture. Don't model yourself after these people. I would casually chat with other people on the team to see how they feel about it, and if they're all like ""work hard, play hard"" then the only realistic option is a new job",high_throughput,2026-07-17 16:29:01,15,cscareerquestions,t3_1uz41z8,False,
oy5ajjy,Since on call is probably the worst shit in the SWE job being there every other week is brutal.,Glum_Worldliness4904,2026-07-17 18:43:23,4,cscareerquestions,t3_1uz41z8,False,
oy4sot6,F NO,Due_Change6730,2026-07-17 17:28:13,3,cscareerquestions,t3_1uz41z8,False,
oy4hzbo,"Everyone has said it already, but this is not normal. If you already feel like this is going to stunt your growth as an engineer, you’re probably right. Try to find something else. Every job I’ve had, I’ve been on-call \~4 times a year for a week at a time.",zswex,2026-07-17 16:43:27,2,cscareerquestions,t3_1uz41z8,False,
