id,body,author,created_utc,score,subreddit,parent_id,is_submitter,distinguished
oocem78,"The feeling you're describing is super common and most engineers including the ones who look like they have it together went through exactly this. The way out is to stop trying to learn everything and instead pick one project you actually want to build, then learn whatever you need to build it. The ""I want to learn everything"" mindset is paralyzing because the field is infinite, but ""I want to build X"" gives you a concrete path because you'll naturally need to learn frontend, backend, databases, deployment, etc as you hit walls. Pick something small to start, like a personal task manager or a simple web app that does one thing you care about, and just start building it. You'll suck at first and your code will be ugly but that's fine, your second project will be better, your fifth will be way better, and after a year of consistently building things you'll look at your old code and cringe which means you're growing. The classmates who look ahead of you got there by building stuff, not by reading more tutorials, and the only difference between you and them is six months of actually shipping projects. With AI tools like Claude and Cursor you can also move way faster now than people could even two years ago because you can ask questions and unblock yourself instantly, just make sure you're actually understanding the code being generated rather than copy pasting blindly.",Devji00,2026-05-28 10:18:13,7,learnprogramming,t3_1tpyb4u,False,
ooe2r1u,"A friend once told me “you are only as smart as people perceive you to be”. Communication is a super important skill in the industry but is often overlooked and undervalued. Technical skill is a very good thing to have, but I would not forget about the soft skills too.Network, practice interviews, and work on your presentation skills if the goal is to get a job. It’s also important to get experience working on existing code too: try to fork a repository and improve it. If you want to focus on the technical expertise portion, then I would encourage you work on a project that is outside your comfort zone but is achievable. Set some scope and boundaries for a project so you know what to do (i.e., make a requirement document and decide your MVP). The best projects (I have found) solve a problem you’re facing or make your life easier (e.g., automation or a an application for something you think would make your life easier).Good luck!",Capable_Proof_6322,2026-05-28 15:35:36,3,learnprogramming,t3_1tpyb4u,False,
ooc7ujt,"The field of software engineering is massive. You'll need to be a little more specific.Also, as you are studying software engineering, you should be focused on making sure you're learning the topics being taught.",ScholarNo5983,2026-05-28 09:24:26,2,learnprogramming,t3_1tpyb4u,False,
ooc8mqr,I''m sure you can name tons of things you could be learning.,Humble_Warthog9711,2026-05-28 09:30:57,1,learnprogramming,t3_1tpyb4u,False,
ooc93sw,pick a field you like and start learning about it. for your first project you could make a tool for yourself to help with a tedious task.,Mo7se007,2026-05-28 09:34:55,1,learnprogramming,t3_1tpyb4u,False,
oocozkk,"Most people who look “ahead” are just 6 months deeper into one thing. Pick one stack, build tiny projects, and stop comparing your chapter 1 to their chapter 10. Consistency beats trying to learn everything at once.",DevEmma1,2026-05-28 11:29:37,1,learnprogramming,t3_1tpyb4u,False,
oocz4nd,"Did you ask your teacher? Also, 6 months is too short if a time frame to learn everything.",buzzon,2026-05-28 12:29:26,1,learnprogramming,t3_1tpyb4u,False,
oon79ep,"I would start with a CRUD (**C**reate, **R**ead, **U**pdate, and **D**elete) project. Pick any subject matter that you might be interested, sports, music, budget, contact list, etc. While building this you will learn a ton of stuff that you will be using everyday as a software engineer. When you get stuck, query Claude or some other AI tool. Dont ask the AI agent to build it for you, just ask it to give suggestions/advice on how to build it. You will need to build each piece by hand to fully understand it and learn. Good luck!",Effective_Promise581,2026-05-29 20:55:44,1,learnprogramming,t3_1tpyb4u,False,
ooc8xd6,"Open Claude or Cursor and ask. It can do basics pretty well. Let it walk you through it with explanation and it can find pages with good start. Don't be afraid to use Ai even as begginer. If you can invest to premium. Most devs use Ai to some extend and it will get bigger in the future, so it's good you will get use to it now.",bally1234567,2026-05-28 09:33:26,0,learnprogramming,t3_1tpyb4u,False,
ool38dr,"General advice is to favor composition over inheritance.So avoid abstract classes (generally).If you find yourself wanting several of your concrete implementations to have the same behavior for an operation, you can extract that operation to its own class and provide an object of that class as an implementation.This leads to more testable code and avoids the abstract class hierarchy mess of trying to figure out which tier of the abstract class hierarchy specifies the default your concrete class is using.",AsparagusBig3989,2026-05-29 15:16:15,15,learnprogramming,t3_1tr4ovj,False,
ool1dxj,"I have almost never used abstract classes. I haven’t made an exact count, but I would guess that interfaces outnumber abstract classes 70 to 1 in my code.",lurgi,2026-05-29 15:08:09,13,learnprogramming,t3_1tr4ovj,False,
ool3ybo,"An interface is like a contract. I need you to pass in a class that that implements the DrawableAnimal interface, and I'll add it to the list of things to be drawn every time the window refreshes.An abstract class is like a base class with common functionality between two classes. Let's say two of my drawables are TRex and Stego. They both inherit from an abstract base class Dino which has a lot of the common code to draw a dino.Dino isn't an interface because in this program at least, there's no need to know that something is a Dino or not, you just have a list of animals. Dino is more of an implementation detail. It's common code that two classes from inherit from.",dmazzoni,2026-05-29 15:19:25,10,learnprogramming,t3_1tr4ovj,False,
ool2vn0,"I guess whenever you want a method that is commonly executed on the sub classes, since one of the differences is that an abstract class can have a method not be abstract.",Danque62,2026-05-29 15:14:41,4,learnprogramming,t3_1tr4ovj,False,
oop8wd1,"First, what u/AsparagusBig3989 said, in general new programmers tend to overuse creating their inheritance hierarchy. It's a natural mistake because OO languages depend heavily on inheritance, you literally can't program without it. But your rule of thumb should be to use composition unless you have a very good reason to use inheritance.That said:Abstract and interface are largely unrelated to each other, but though they're different things, they're both sort of at the same level, i.e. the same level as the class keyword/concept. Just don't get hung up on them being related to each other, because they mostly aren't (at least, not until Java 8, 9 and 17, when they complicated things...).**Abstract** exists because sometimes when you're designing an inheritance hierarchy (which *you* shouldn't, at least not at your current level of knowledge), there's enough common functionality between two or more classes that it makes sense to have a parent class to hold the implementation of that common functionality, *but...*...sometimes there's not enough common functionality to make a class that stands on its own and is usable on its own. But you still need to sketch those methods and instance variables in, or the rest of the common-functionality-parent-class won't make sense. What do you do?You could add stub implementations of those other methods, etc, and just have each stub method throw an exception basically saying ""you need to make a child class that implements this method for real""......which is pretty much what the abstract keyword is.So use the abstract keyword. You code the parts of the parent that you can, add in the declarations for the other parts, and add the abstract keyword to those declarations. Then the subclasses extend that class and fill in the missing (abstract) parts.You, specifically (as in you the OP), are most likely to encounter abstract classes as superclasses in existing APIs or codebases, classes that you need to extend and implement the missing methods. Or as classes that are part of some java API's hierarchy, and you need to understand the abstract superclass as part of understanding the subclass that extends it. You should almost never need to actually type the abstract keyword yourself.**Interface** is actually something you're more likely to implement, and definitely something you'll need to use, as in use existing interfaces,and classes that implement existing interfaces, all over the place, because a lot of the java libraries and APIs use interfaces. For example, the Collections API has a bunch of classes that implement the set, list and map interfaces. Almost every tutorial about the Collections API, back when they first added it to java, immediately bogged down in talking about the interfaces, something I found intensely annoying.""Interface"" was probably a bad choice of keyword, but we're stuck with it. I always thought ""role"" would have made more sense, because that's essentially what an interface is, it defines a role that some class can play.And of course, to play that role, that class needs implementations of some specific methods, which is why an interface allows you to declare the signature for those methods, and of course those signatures are, in a more general sense, the interface by which other code interacts with implementations of some interface.Generally speaking, you use an interface where you may need to have more than one class perform some role, i.e. let's say you have some sort of code that calculates shipping cost of products, let's call it Shipper. Obviously Shipper is going to need details about the products, which means the various product classes are going to need methods that Shipper can call to interrogate about necessary product details, like weight, etc.You could get lucky, and all your products and product classes are alike enough that you can have a single Product class that has those methods that Shipper needs. Or they can use a Product superclass that has those methods. But sometimes that just isn't doable, so in that case, you define a Shippable interface, and make sure each of your product classes implements the methods that Shippable needs.You, specifically (as in you the OP) are a little more likely to, at some point, need to implement an interface in one of your classes, and slightly more likely to actually define an interface. And, as I said at the beginning of this section, java uses interfaces all over the place.",StevenJOwens,2026-05-30 03:56:59,2,learnprogramming,t3_1tr4ovj,False,
ool3j1k,"Abstracts make more sense when you're building a hierachal classic inheritance style architecture, but a lot of more modern coding practices discourage heavy use of inheritance over a more combinatorial component based interface approach which doesn't really need abstracts to work.",MrMagoo22,2026-05-29 15:17:34,1,learnprogramming,t3_1tr4ovj,False,
ool4fbe,"Interfaces are purely a template. Abstract classes are interfaces that can also include implemented methods.When to use abstract class? Well, when you need the additional functionality abstract base classes provide. In other words, typically when the inheriting classes all have the exact same implementation for 1 or more methods.",backfire10z,2026-05-29 15:21:29,1,learnprogramming,t3_1tr4ovj,False,
ool95ml,"In the past interfaces did not include any implementation, just declaration. Maybe it helps to think about interfaces like that, because it makes it easier to put a certain application into one pot or the other.With abstract classes you are designing the implementation.With interfaces you are designing, well, the interface: what your objects will respond to, how client objects may address them. You look at the outside of the objects, not their inside. Writing down the interface can be considered writing a spec for your future implementation.Of course an abstract classes without implementation is also an interface description. But it is not meant for that. Therefore, Java restricts you further: e.g. you may implement multiple interfaces but inherit only a single superclass.",Ormek_II,2026-05-29 15:42:18,1,learnprogramming,t3_1tr4ovj,False,
oolp0ik,"Abstract class for related classes with same basic methods but each one has specific methods.Interfaces for unrelated classes that share the same functionalities.In practice interfaces are better than abstractions, because they're easy to add / remove. Inheritance must be right from the start or it becomes a mess.",kobaratega,2026-05-29 16:51:38,1,learnprogramming,t3_1tr4ovj,False,
oomac36,"The way it finally clicked for me was: use an interface for “what something can do” and an abstract class for “what something fundamentally is.”If multiple unrelated classes should share behavior (`fly()`, `pay()`, `serialize()`), interface. If classes share common state/logic (`name`, `id`, shared methods), abstract class makes more sense.In modern Java, interfaces are way more common than people expect because of default methods. I usually start with an interface unless I genuinely need shared fields/constructors or base implementation. Also don’t overthink it too much in small projects, refactoring later is normal.",MR_LAW11,2026-05-29 18:23:51,1,learnprogramming,t3_1tr4ovj,False,
ooeye6c,"You can do whatever helps you be productive. Memorizing functions may help you code faster, but I think it would generally be a waste of time unless you use those functions very frequently. The API documentation should always be close at hand, especially in the Internet age.",wildgurularry,2026-05-28 17:52:28,53,learnprogramming,t3_1tqavtb,False,
oof13or,"ClarificationDo you mean 'memorizing or copying what the function that does X in your library or language is' (like memorizing what the parameters are to javascript fetch)Or do you mean 'memorizing snippets of code that you want to use over and over'Because for the former, do whatever you find helpfulFor the later. Don't do it at all. The impulse to do that is mistaken for reasons I'm happy to go into.",nomoreplsthx,2026-05-28 18:04:08,3,learnprogramming,t3_1tqavtb,False,
oof1jq8,"Over time you'll remember the names of functions you use frequently. You can always look things up though. My IDE will show me public methods on a class, and I can often figure out which I need to use just by the name. I have a few notes for a few chunks of code. Things I either used frequently or were hard to find the first time I needed them. I look at these notes probably less than once a month.",Accomplished_Key5104,2026-05-28 18:06:07,4,learnprogramming,t3_1tqavtb,False,
ooeyl93,What is the context? I generally don't do any of those.,edrenfro,2026-05-28 17:53:18,3,learnprogramming,t3_1tqavtb,False,
oof10ah,Make libraries of other stuff that makes sense to you. I had a dozen functions that opened new windows with a title and heading and… just exactly what I meant when I called a window open function or an alert screen. Just don’t lose it later!,Knarfnarf,2026-05-28 18:03:43,3,learnprogramming,t3_1tqavtb,False,
ooey798,"Little bit of everything, but not a lot of writing it in notes anything like that. Most of the time you can/will use documentation, or you have enough experience where you can kinda stumble your way to a working solution. You'll also probably remember a few after doing this for awhile, but it probably won't be a ""oh shit I have to memorize xyz"" type of a thing.",illuminarias,2026-05-28 17:51:39,4,learnprogramming,t3_1tqavtb,False,
ooezo8z,"I don't write notes for things like that.You'll eventually memorize the functions that you use frequently, and for everything else, there's the documentation (which includes IDE-provided documentation). Yes, I generally have MDN or some other documentation site open as I write.",carcigenicate,2026-05-28 17:57:54,2,learnprogramming,t3_1tqavtb,False,
oof0puy,"No, not at all. You will have complete access to all imaginable resources at your job. Employers care about developer velocity, not wrote memorization. That said, if I was interviewing you and you didn't at least know the basic syntactic elements and built-in methods of whatever language you're choosing for the interview, it would be a red flag. The signal that would give me is that you don't have a lot of experience writing code. When you write a lot of code, you end up using the same constructs a lot so you tend to just know how they work.",Whatever801,2026-05-28 18:02:27,2,learnprogramming,t3_1tqavtb,False,
oof1cyz,"I've been doing this for 12 years now, and I still have to look up how to create constructors in java from time to time.",gr8Brandino,2026-05-28 18:05:17,2,learnprogramming,t3_1tqavtb,False,
oof38mv,"This entire question makes no sense. It's like asking ""do you memorise screwdrivers as a carpenter"". The skill of developing software is not how you write the code.",aanzeijar,2026-05-28 18:13:35,2,learnprogramming,t3_1tqavtb,False,
oo5xks2,"Z80 assembly for the Nintendo Gameboy has always been a neat way to dive in. You don't have an rtc, but you do have interrupts",walmartbonerpills,2026-05-27 12:57:50,8,learnprogramming,t3_1tp4ol0,False,
oo5zhax,"Embedded systems is honestly one of the coolest areas to get into if you enjoy understanding how computers work close to the hardware level.But don’t jump straight into “advanced embedded” immediately. First, build very basic programming foundations.I’d honestly go in this order:1. Learn basic programming with C, because embedded systems heavily use C/C++. Learn:* variables* loops* arrays* functions* pointers (later)* basic memory concepts1. Learn basic computer concepts. You don’t need deep theory yet, just understand:* RAM* CPU* binary* how programs run* input/output1. Buy a cheap microcontroller later, Arduino is honestly fine for beginners, despite people online acting elitist about it.Blinking an LED sounds stupid until you realise: “wait… I just controlled hardware with code.”That feeling hooks a lot of people into embedded. And honestly, being 16 is a massive advantage here. You have time to learn slowly without rushing into “industry ready” pressure immediately.Also: don’t romanticise suffering too much :loudly_crying_face: Embedded already provides enough natural pain on its own.",EfficientMongoose317,2026-05-27 13:07:30,5,learnprogramming,t3_1tp4ol0,False,
oo5y9vb,"I would take a look at a simple Arduino-set or something like that. Buy a complete kit that comes with everything: microcontroller-board, cables, power-supply, electronics to get started and most important of all: a book with some examples to build and code (and learn from).Use the language that the kit uses - whether it be C, C++, MicroPython or something else, doesn't really matter, as long as you get the complete infrastructure with editor, compiler, etc, and hardware to run the code on! The less you have to learn about configuring environments, the easier it is to get started.",peterlinddk,2026-05-27 13:01:20,1,learnprogramming,t3_1tp4ol0,False,
oo609hv,"make a parallel to serial using redstone in minecraft, then make memory, then a cpu",bomxacalaka,2026-05-27 13:11:22,1,learnprogramming,t3_1tp4ol0,False,
oo619sk,Get the hang of C before you start trying to interact with hardware,Much_Community_505,2026-05-27 13:16:18,1,learnprogramming,t3_1tp4ol0,False,
oo61w20,"Forget jumping straight in, you don't have enough background.Do a course like Nand2tetris first, it's great fun and it will teach you lots of the basics much better than any random intro course. If, at end of that, you're still keen on the sport, you'll know what you have to do, without even having to ask. Eg. get a dev board or whatever.",Dazzling_Music_2411,2026-05-27 13:19:18,1,learnprogramming,t3_1tp4ol0,False,
oo6halm,"Buy an Arduino - I've seen clones as cheap as ~$6-8, but expect to spend ~$25 for a basic, standard dev board. There are plenty of options, but for the price point, really, it doesn't matter WHAT you buy, just get one. Don't worry about the frills, this community is all about the CHEAP. The first project everyone does is gets the little on-board indicator light to blink. And you know what? For you, that's going to be huge. That's going to be worth the cheapest little model.Get involved in that community.Arduino comes with a little studio suite where you can program something that is almost like the C programming language. I think it IS the C programming language under the hood. It's meant to get someone like you up and going pretty quickly, but you'll outgrow it. By that point, you'll be looking to write ""bare-metal"" C on your device, but you'll be in a position to figure that out.The nice thing about the Arduino is that it is a very small platform. It's not a large or sophisticated CPU, you don't have a lot of storage or memory. It makes it simple to understand how the damn thing works and what you're doing on it. The fun part of working with embedded programming is that you DON'T have infinite resources, so you're forced to figure out how to do what you want to do, with what little you have. It takes A LOT of thinking and insight before you realize some clever little hack that shoehorns your ambitions into this device.But the cheapest little Arduinos will feel limiting eventually - even though they're ALL designed to be extensible with external hardware, so you'll start looking at other models and breakout boards. Again, you'll GET there...",mredding,2026-05-27 14:31:49,1,learnprogramming,t3_1tp4ol0,False,
oo6ir9m,"Depends on what kind of embedded you want to do. For MCU, it's simple, learn C, I doubt it will go away anytime soon in embedded. Maybe learn C++ if you want.If you like FPGA more, then learn system verilog/verilog first. VHDL you won't need to touch for now, but keep in mind that hardware description languages (HDL) are more difficult to learn than normal programming languages, since you are describing the hardware itself (like a 4 bit adder for example)",THEKHANH1,2026-05-27 14:38:24,1,learnprogramming,t3_1tp4ol0,False,
oo8yyhc,"I would recommend starting with anything that seems interesting from a youtube video, online tutorials, or even asking an LLM to suggest simple projects to begin with. If you are still learning loops and variables, building and running any simple program will be a good start.",SuperTop922,2026-05-27 21:01:41,1,learnprogramming,t3_1tp4ol0,False,
oo9b3hs,"start with basic programming first, like C is kinda the go-to for embedded stuff but it'll make more sense once loops and variables click, just my take",LocalEfficiency33,2026-05-27 21:59:51,1,learnprogramming,t3_1tp4ol0,False,
oo45vjh,https://scratch.mit.edu/,usercust,2026-05-27 05:14:52,36,learnprogramming,t3_1tovqh6,False,
oo48udb,c++ if you want a pointer....hurrr,Caddy666,2026-05-27 05:37:05,11,learnprogramming,t3_1tovqh6,False,
oo4jhoo,I ran into this with my brother too. Just get her started on Codecademy or Scratch and be the person she asks when she's stuck. You're probably way better at debugging questions than explaining from zero.,Initial-Process-2875,2026-05-27 07:00:20,5,learnprogramming,t3_1tovqh6,False,
