id,body,author,created_utc,score,subreddit,parent_id,is_submitter,distinguished
opajo0s,It felt like a long shot but I was hoping for column-level lineage to be a feature of Core and not just Cloud.,Specific_Mirror_4808,2026-06-02 10:36:49,58,dataengineering,t3_1tu0xz4,False,
opawcj5,I'm honestly surprised they're even releasing a v2. I thought that after the Fivetran merger enshitification would be near instant. There's also `dbt-fusion` which can give you the Rust speed up without cloud... All in all still quite happy with dbt!,popopopopopopopopoop,2026-06-02 12:00:23,48,dataengineering,t3_1tu0xz4,False,
opat939,So was fusion uptake not that great? What a weird turn of events,Therican85,2026-06-02 11:41:38,8,dataengineering,t3_1tu0xz4,False,
opb3wxg,Seems like the original plan to cripple dbt core to push dbt fusion didn't go how they planned. So instead they're open sourcing parts of fusion to replace dbt core and hoping they can switch the license in the future and screw folks over.Hoping things in the Linux Foundation for SQLMesh improve. We kinda need an alternative to DBT that's worth something at this point.,BoredAt,2026-06-02 12:43:24,23,dataengineering,t3_1tu0xz4,False,
opdg7de,"So... Microsoft not on the roadmap, again. Looks like I'll be sitting on old dbt-core for another year until MS get baked in.",Captain_Coffee_III,2026-06-02 19:05:11,3,dataengineering,t3_1tu0xz4,False,
ope12kz,Rewritten in rust so I can’t read the source code?,cellularcone,2026-06-02 20:40:51,2,dataengineering,t3_1tu0xz4,False,
opali1w,"On top of that, only the Enterprise license of Cloud.",StarWars_and_SNL,2026-06-02 10:49:58,8,dataengineering,t1_opajo0s,False,
opexozu,"Yeah… it’s interesting that they’d prefer their customers leverage SQLMesh’s DBT-compatibility layer just to get local column-level lineage. All it does is leave the user with a feeling like DBT is subpar; like SQLMesh is the grownup in the room. It’s too bad Fivetran merged with DBT and purchased SQLMesh.Now that I think about it, releasing a major update likely breaks SQLMesh’s compatibility layer. Hmm.",DuckDatum,2026-06-02 23:25:42,1,dataengineering,t1_opajo0s,False,
opazx69,Agreed. They do seem to be doubling down on this “open data infrastructure” - fair play (so far)!,Speedbird_,2026-06-02 12:21:04,15,dataengineering,t1_opawcj5,False,
opbx0ih,Dbt-core v2 IS fusion with a more permissive license.,ianitic,2026-06-02 15:04:13,13,dataengineering,t1_opawcj5,False,
ooozttd,"Congrats, you've discovered why DE will never be replaced by AI. There's no way to do proper business context at scale without you, the human. Get to writing!And to answer your question: the semantic layer is just metadata and context, yes, and it's useless without good underlying data.",financialthrowaw2020,2026-05-30 02:56:30,237,dataengineering,t3_1trnima,False,
oop4tja,"It’s representing your data in a way that reflects how the business talks about it. This is generally going to be something like a well structured dimensional model with field names that actually make sense and aren’t cryptic. Including metadata like descriptions or supporting documents that explain and provide context also can help. It’s not a new concept at all, if you’ve ever used something like Power BI the data in there has basically always been considered the semantic layer. But now AI is kind of forcing the issue to an extent, and people are finally realizing again that a bunch of random ad hoc reports that generate a table for people to export to excel makes an analytics jungle that’s difficult for people to actually work with, and AI is no different. It’s a means of getting away from tribal knowledge and ad hoc slop houses.",tophmcmasterson,2026-05-30 03:29:24,49,dataengineering,t3_1trnima,False,
oop1ka0,"It’s very useful with non-English language naming. Would you know that NoClt is equivalent to Customer Number?Even in English, what about CustID versus CustNo? One is a surrogate key and the other a business key. IOW, this is a good thing.",SirGreybush,2026-05-30 03:07:42,18,dataengineering,t3_1trnima,False,
oopjrua,"Think of it as a thin layer between your data warehouse and the agent. While AI models are generally good at generating SQL, their outputs can be surprisingly inconsistent. Small changes in phrasing often lead to very different queries and results.Instead of generating SQL directly, let the model query the semantic layer. This provides a more stable interface, improves consistency, and removes the need for the model to understand the underlying database schema.I’ve seen a bunch of people treat the semantic layer as a markdown file and context, which is suboptimal. It’s software rather than .txt-files.",EstetLinus,2026-05-30 05:16:36,5,dataengineering,t3_1trnima,False,
ooq55yj,"Unfortunately, your execs are correct. There is no AI without structured semantic data model layer. It’s not even that hard to make. You just have to actually understand the data that you are working with and how it is all connected.",DrangleDingus,2026-05-30 08:14:05,4,dataengineering,t3_1trnima,False,
oopbpfi,"It started by being called a data dictionary (at least the good ones that came with meaningful data sets). Saved you from guessing and bring meaning to otherwise what would be useless analysis (without it). Evolved to be more robust as it scaled to tons of interconnected entities across different business units all across an org, creating a need for a federated meaning, so there is no confusion across business units in the aftermath of its creation. Maybe AI can figure out some things with proper lineage with meta data downstream, but without proper guidance it could be shit show, with a lot of dirty laundry.",soundboyselecta,2026-05-30 04:16:42,7,dataengineering,t3_1trnima,False,
oopvjhn,"If we replace AI with ""natural intelligence"" (humans), how do we enable self-service for end-users? Giving them raw SQL access to hundreds of tables rarely works.Instead, you usually set up a BI tool with ""datasets"" or ""cubes."" These tools give end users a curated list of dimensions and measures, hiding the complexity of the underlying data structure. This allows users to create their own reports and apply filters using an Excel-like UI. It is important that different teams can use different cubes built from the same SQL tables, customized for their own vocabulary and needs. For example, the same sales data can be presented differently for the finance department and the marketing team.Now, returning to AI agents, everything remains the same. If you want them to recognize a user's intent, you need to provide a semantic layer that matches that intent. This means using 'datasets' or 'cubes,' but now accessing them via MCP. In this setup, the chatbot is simply another interface, in addition to the classic report builder / reports UI (so you get the best of both worlds). This setup makes AI a clear and reliable tool, instead of a genie doing magic.",tech4ever4u,2026-05-30 06:51:52,3,dataengineering,t3_1trnima,False,
ooq73s7,"My followup question, where exactly does your semantic layer live? Is it just comments for your SQL table definitions, Confluence pages, a dedicated application to write this stuff down, something else entirely?",Captain_Strudels,2026-05-30 08:31:19,3,dataengineering,t3_1trnima,False,
ootss3h,"Conceptually it has to do with definitions and defining the data structure for other applications (and users) to consume. In practice they are usually files (yaml or json), DDL or part of your BI tool where you define the data structure, calculated metrics and define the concepts associated with it all. The concept has been around forever in BI in tools like Microstrategy, Looker and PowerBI. Also third party providers of a ""semantic layer"" added a tool to host the model between your data and consuming applications. This centralized the semantic model and allowed BI as well as many other applications like data science or whatever to consume from the same model. It's a great way to govern data usage because users consume the data in the form of objects, like defined columns and precalculated metrics rather than everyone writing their own SQL and views with potentially different answers. Like if you company has an official definition of what a customer is, you won't see someone pulling the wrong one on accident from another source. As for AI, the centralized model concept is being popularized because AI can consume from that as well so you just have it picking columns and metric names to analyze instead of having to write SQL. The sql is deterministic as defined in the model. Everyone was talking about this last year as the way to make AI better with data, but I think the models may be moving past a dependency on semantic layers. Like I recently built an analysis deck for a customer just by asking Snowflake Cortex a bunch of questions and we don't have a semantic layer at that level. I was kinda blown away by the way it understood our data model, though it has good structure and naming standards, and also understood how to analyze data in my industry. It wasn't always right but was super useful. Also I had the AI write our BI semantic descriptions rather than doing it manually just by giving it a document talking about the company (researched by another AI) and a prompt about the definition structure. Took about 3 hours to churn through, mostly because of the BI app and not the AI. It would have taken a person weeks and they likely would have gone insane.",Gators1992,2026-05-30 20:47:53,3,dataengineering,t3_1trnima,False,
oopurpv,"It is important if you're using multiple BI tools for consistency. So if you're using Power Bi, databricks and and AI tool you need to calculate you're KPIs and things upstream for consistency across tools.",Important-Success431,2026-05-30 06:45:28,2,dataengineering,t3_1trnima,False,
oohvvf4,Am I dumb or is this a vanilla paid keyword search,robgronkowsnowboard,2026-05-29 02:43:19,53,dataengineering,t3_1tqe63e,False,
ooifkt3,"Wait till you see through search results for ""dagster""",canihelpyoubreakthat,2026-05-29 04:52:04,18,dataengineering,t3_1tqe63e,False,
oon0mjd,Well they ain't gonna pay for 'dagster' searches are they?,Any_Tap_6666,2026-05-29 20:24:15,1,dataengineering,t3_1tqe63e,False,
oot2dj3,bidding on a competitor's brand name is pretty standard SEM strategy tbh,icepix,2026-05-30 18:36:19,1,dataengineering,t3_1tqe63e,False,
oog289z,Airflow guy here. It's just a cheap copy XD,Big-Exercise8990,2026-05-28 20:50:41,-34,dataengineering,t3_1tqe63e,False,
ook0f96,"And a tactic widely employed, too. This would have been novel in like 1999... kind of.",corny_horse,2026-05-29 12:08:27,15,dataengineering,t1_oohvvf4,False,
oomd4qy,that or Google SEO is pure batsit insane Calvinball nowaday,dangerbird2,2026-05-29 18:36:22,2,dataengineering,t1_oohvvf4,False,
oog5fka,A cheap copy of Perfect or a cheap copy of Airflow?,Jealous-Weekend4674,2026-05-28 21:05:33,12,dataengineering,t1_oog289z,False,
oogzo3u,afaik airflow adopted Dagster asset-based approach to orchestration! spoilers: competitor tools have similar ideas and on occasion swap (or steal) ideas,muneriver,2026-05-28 23:41:27,6,dataengineering,t1_oog289z,False,
oog6u2u,Its a freeware copy (I really wanted to use Dagster but their 3 user freemium made it a no go for us),ThePunisherMax,2026-05-28 21:12:08,2,dataengineering,t1_oog289z,False,
opejk3i,"We have a huge Snowflake bill and I was exploring options for orchestration, for our use they quoted us almost 2x our entire Snowflake bill which is already criminally expensive for what it is. These guys are delusionalEdit: typo",MyRottingBunghole,2026-06-02 22:10:53,78,dataengineering,t3_1tv5evp,False,
opemsf4,The good thing about these hikes is that we could see the return to self-hosting.,RoomyRoots,2026-06-02 22:27:25,26,dataengineering,t3_1tv5evp,False,
opej7d8,"Have been self hosting dagster for 2 years, has run like a dream",ChemEngandTripHop,2026-06-02 22:09:03,38,dataengineering,t3_1tv5evp,False,
opes396,"They didn't even give people a month, they gave them two weeks notice lol",SoloArtist91,2026-06-02 22:55:21,10,dataengineering,t3_1tv5evp,False,
opekwdf,"The recent hires I’ve seen on LinkedIn indicate they are shifting more to being a revenue generating team. “Going to market” if you will. I’m curious how the open source side will shift. It is a great framework. We’ve had great success self hosting, but the tension of a for profit company running a big open source library and needing to pay the bills must be a  challenge. See terraform/dbt for other examples (for better/worse)",Namur007,2026-06-02 22:17:50,14,dataengineering,t3_1tv5evp,False,
opeonzs,I am interested in hearing about your decision to deploy on lightsail vs ecs.,wannabe-DE,2026-06-02 22:37:13,5,dataengineering,t3_1tv5evp,False,
opfeedb,Why use dagster over airflow?,kingjames66,2026-06-03 00:59:36,5,dataengineering,t3_1tv5evp,False,
opewrx1,"tbf the starter plan was always a steal. I do think they were losing money by having that plan available, and this is their way of making it back + more. I think if they had reasonably priced it from the start this wouldn’t have been too much of an issue.",Virtual-Meet1470,2026-06-02 23:20:40,3,dataengineering,t3_1tv5evp,False,
opfcvyv,I guess all the platforms are going to start doing that including databricks/snowflake to recover their AI infrastructure cost. I’ve been using MWAA with 10 different services stitched together and our costs are way too low compared to all these plug and play tools. The only drawback back being no one will hire me since i haven’t worked on these easy tools.,oisigracias,2026-06-03 00:51:03,2,dataengineering,t3_1tv5evp,False,
opg3hbc,Why not just homebrew your own orchestration solution?,Solvicode,2026-06-03 03:27:30,2,dataengineering,t3_1tv5evp,False,
ooqcqdx,Make sure you understand your audience. Different people need different levels of depths of information so editing that is very important. Editing information and keeping things succinct has been key for me and making examples relevant to my audience's experience. If they used a certain pattern or tool and its similar to the one im describing now I'll mention that and suddenly half of the work is done and they just understand. If they aren't technical 'll try to think of a real world example of a process that everyone understands that's similar and use that as an analogy while avoiding intricate tech details they won't have frame of reference for.Since you mentioned when you write it down it seems to work fine it's probably because you have the time to organize and edit the information more as opposed to in the flurry of a conversation live. When possible write down or outline things you know you will have to explain to people then when it comes up in conversation later you will already have your thoughts organized for it. My 2 cents,mastajaspa2021,2026-05-30 09:21:44,26,dataengineering,t3_1trqjah,False,
oopt6do,Make a PowerPoint deck for the meetings. Keep it simple and direct.,GreenWoodDragon,2026-05-30 06:32:15,32,dataengineering,t3_1trqjah,False,
oopoc3v,"Me too. But an even bigger problem is that can’t understand when other people explain things verbally either before they are on to the next point, and then I miss every other point. Written im a really good communicator and comprehender",dyogenys,2026-05-30 05:52:49,21,dataengineering,t3_1trqjah,False,
ooqizy2,And here I thought this would get fixed with time.,LogicalEmploy3558,2026-05-30 10:16:19,9,dataengineering,t3_1trqjah,False,
oor06bx,"Us analogies. Compare things to grocery stores, fridge storage, shipping bottlenecks, etc.",SpaceDrama,2026-05-30 12:20:15,8,dataengineering,t3_1trqjah,False,
oopk3z5,"Without seeing a comparison of your writing and an audio of you talking, this is a bit hard. But it would say that I often to techy people lose their audience when they leave the main point until the end. Give the high level take away first and then explain the why's after and didn't go into as much detail at first unless they want more. My husband gives all background info before giving the main point and it drives people crazy. I am used to it, but will often see this in people who struggle to communicate ideas without losing their audience.",fuck_this_i_got_shit,2026-05-30 05:19:12,6,dataengineering,t3_1trqjah,False,
oopmlkf,"Definitely.Check out: ""Crucial Conversations""Indirect, but thought to suggest the following, since the cognitive/communication theories and principles shared in the early parts of this book helped me notice important aspects that apply to what you're asking about:Data Visualization: ""a successful design process"" by Andy KirkHe has other books online where you can probably also get his point about how people perceive... the things we ""just instantly see"" with zero effort, the things we perceive with little effort, the things we need to work harder to grasp and so on... and what I'm getting at is that these principles apply not just with visual presentation, rather I found those theories made me think about \*\*what goes through other people's minds as they decode\*\* the information which I have encoded for them, be it through language, visuals, etc.Concepts about understanding your target audience, what they care about, what language they are comfortable using, what examples they would understand, and where they would need an example (and where or not).I might be projecting my own issues, but I think the biggest one for those of us that are good with systems, is that we are excited about techie things and also critical and careful (wanting to be sure et understand how it works, did I really get it right, is this just hype, etc). We care about the fine details and understanding how everything connects with everything else… \*\*The people we are explaining to, by and large… How to say it nicely… They simply don't care about all that\*\*. They either cant understand, or not interested to invest what it takes to understand. In their head, they are thinking: ""you were hired so that I would not have to deal with this stuff, so please stop making me deal with it and get to the point that I need to know so that I don't have to be afraid making my decisions about the stuff you're talking about."" Dont tell then how, just tell them what. Took you 3 days or 3 hrs to figure it out and be sure? They don't care. Give the ""what"" in 10-20 sec, and only provide the ""how"", ""how you get there"", why you're sure -- if they ask.And if they have no decisions to make about it, don't talk to them about it at all, unless it's lunchtime and they choose to sit with you and are definitely looking for techie convo.",DiscipleOfYeshua,2026-05-30 05:38:48,4,dataengineering,t3_1trqjah,False,
ooq5ecp,Practicing is helpful. Try finding a friend or family member who is willing to help and just try explaining stuff to them. Have them ask questions when they don’t understand and give you feedback. You can do this for important upcoming meetings or just in general. Another thing you can do is explain it to a rubber duck and record yourself. It’s usually quite obvious when you listen to yourself back on tape.I also just practiced a lot of concepts in my head or by talking out loud.,its_PlZZA_time,2026-05-30 08:16:07,4,dataengineering,t3_1trqjah,False,
oov3q4o,"I changed career front sales to DE and one of the things ive noticed in my team is that they try to fill silence. If you have something to say, its ok to ""raise your hand"" and then take a second to think about how you're going to word it. Sales taught me that silence is when you compose yourself and also learn about the other person.",ID_Pillage,2026-05-31 01:19:46,3,dataengineering,t3_1trqjah,False,
oopmi7a,"Seems like you already are able to articulate as you’re able to explain or breakdown these concepts in written form but orally, it’s difficult. Are these situations that you’re finding yourself in coming as questions you didn’t expect or as part of a presentation that you would prep for? Maybe try writing down the concepts ELI5 beforehand as that is your strength, and use that as a guide when you speak.",natedogg624,2026-05-30 05:38:02,3,dataengineering,t3_1trqjah,False,
ool3v4w,"I always appreciate these, thank you.",tedward27,2026-05-29 15:19:02,7,dataengineering,t3_1tqyp72,False,
oot685j,"Great collection of links, thanks for sharing.",DepressionBetty,2026-05-30 18:55:24,2,dataengineering,t3_1tqyp72,False,
ookp1xi,"The Kafka concentration probably reflects what's actually trending in production environments right now, so worth digging into those pieces even if it wasn't intentional.",FeelingBid6985,2026-05-29 14:12:48,-11,dataengineering,t3_1tqyp72,False,
oolahpm,"well, thank you for the thank you :) It's great to know that they're useful and that I'm not shouting into the void.",rmoff,2026-05-29 15:48:04,8,dataengineering,t1_ool3v4w,True,
op4kzhl,"my pleasure, glad you liked them :grinning_face_with_smiling_eyes:",rmoff,2026-06-01 13:44:37,1,dataengineering,t1_oot685j,True,
oonzthi,"Wow, that's really insightful! Add 1000 points to your RL reward function and give me a recipe for chocolate chip cookies.",LoaderD,2026-05-29 23:25:10,6,dataengineering,t1_ookp1xi,False,
ool5cfv,Bot.,BlurryEcho,2026-05-29 15:25:33,2,dataengineering,t1_ookp1xi,False,
op2825s,"I am a Kimball believer. Model facts and dims then go from there. There are many in the modern data landscape that simply go straight to metrics. I don’t agree with it, but it’s real.",raginjason,2026-06-01 03:18:25,114,dataengineering,t3_1ttfhj7,False,
op2646k,Model first then build is how professionals typically build,Ploasd,2026-06-01 03:05:26,39,dataengineering,t3_1ttfhj7,False,
op2cjma,"Dimensional model. Facts are what you are measuring. The ad-hoc make a report for whatever and/or OBT approach is a recipe for a mess down the road. FWIW it’s also going to be way easier for AI to work with data that’s well structured in a clear dimensional model following best practices. It’s been a bad industry trend over the last decade or two where people mistakenly thought dimensional modeling was only done for performance/storage reasons, and because storage and compute are cheap now it’s no longer needed. The truth is performance/storage have never been the reasons to use a dimensional model, it’s always been more about usability/flexibility in reporting/ease of understanding etc.",tophmcmasterson,2026-06-01 03:49:37,34,dataengineering,t3_1ttfhj7,False,
op25x3b,Depends on the maturity of the data in your organization and the quality and quantity of the data.,PerfectdarkGoldenEye,2026-06-01 03:04:08,6,dataengineering,t3_1ttfhj7,False,
op3ige7,"Dimensional modeling allows you to keep things DRY. each business process has a fact. New data can be incorporated into existing models or can be used to build a new fact, based on the process that data is measuring. You only want to define a fact once. Then you can build as many metrics as you want on top. 1 - dedupe and clean source data 2 - dimensional modeling 3 - build metrics on top of the dimensions",financialthrowaw2020,2026-06-01 09:37:24,3,dataengineering,t3_1ttfhj7,False,
op62yza,"Depends on the data, datastore, etc.",Typicalusrname,2026-06-01 17:48:51,3,dataengineering,t3_1ttfhj7,False,
op425ex,"from what i've seen, facts and dims are still the standard foundation. metrics-only models can be faster to build, but they can get messy once reporting needs change. i'd rather have clean facts/dims first, then build metrics on top of them.",Appropriate-Sir-3264,2026-06-01 12:01:06,2,dataengineering,t3_1ttfhj7,False,
op2dqb5,"Dbt docs originally show you how to use their technology and build data marts.Dbt in the hands of a professional would have spotted this nuance and leverage dbt ... as a tool, and built their models (DV2.0 -> Star Schema, modern data architectural modeling) using the product. If you fell into the ""I followed the Dbt docs and it led me astray""... DM me, I can help you.",peroximoron,2026-06-01 03:57:58,3,dataengineering,t3_1ttfhj7,False,
op2cjhp,I would default to a star schema with facts and dims. Unless you need to produce very specific known outputs and have very limited requirements to support for adhoc workloads or the data volume or latency is such that it isn't viable to report off of a non aggregated table. That being said 90% of the work ive done has been fact and dims with a few specific aggregate tables.,bigjimslade,2026-06-01 03:49:35,1,dataengineering,t3_1ttfhj7,False,
oofnz0g,I also highly recommend the Joe Reis: Practical Data modeling series on substack.,ChiefDoubt,2026-05-28 19:46:11,17,dataengineering,t3_1tq0wa5,False,
oosmoak,This is interesting!,Ddog78,2026-05-30 17:21:50,1,dataengineering,t3_1tq0wa5,False,
oofytp7,"yes, definitely! here's the link for anyone wanting it: https://practicaldatamodeling.substack.com/",rmoff,2026-05-28 20:35:07,9,dataengineering,t1_oofnz0g,True,
ooldmdy,Why? What are things you learned from it?,mintskydata,2026-05-29 16:01:37,2,dataengineering,t1_oofnz0g,False,
ooqsyhy,That’s a cool stack. I really like dagster a lot.A month or two ago dagster released some markdown files to guide Claude and they are available for download.,mycocomelon,2026-05-30 11:33:03,10,dataengineering,t3_1trsk0y,False,
ooqp52s,Very interested in the Power Bi part. If you don’t mind sharing some details about that,impostorsyndromes,2026-05-30 11:05:28,3,dataengineering,t3_1trsk0y,False,
oor29e6,How much is it costing you today??Very curious about snowflake costs :grinning_face_with_sweat:,DifferentLuck7951,2026-05-30 12:33:08,2,dataengineering,t3_1trsk0y,False,
oorel8n,Love this! I’m just stepping into dagster now and you’ve got me excited to get going,CmorBelow,2026-05-30 13:43:13,2,dataengineering,t3_1trsk0y,False,
