id,body,author,created_utc,score,subreddit,parent_id,is_submitter,distinguished
ooapav7,I would recommend unit tests by vladimir khorikov.Haven't read kent becks' but the above book is more modern and has better examples.,FlatProtrusion,2026-05-28 02:35:03,2,learnprogramming,t3_1tppopf,False,
oob8c9r,"Examples are much more difficult than they appear. You have to choose a domain the entire audience is familiar with, make it complex enough to demonstrate the principles, but not so complex that the message gets lost. It's easier to make a simple example more convoluted than to simplify a naturally complex problem.",kbielefe,2026-05-28 04:37:04,1,learnprogramming,t3_1tppopf,False,
oobros4,I had the same reaction. The Money example feels weirdly abstract until you treat it less like a real app design and more like a tiny refactoring gym.,judyflorence,2026-05-28 07:06:24,1,learnprogramming,t3_1tppopf,False,
oofk87p,"I appreciate your perspective. I remember reading the WyCash explanation in the introduction, but didn't know the man literally wrote JUnit. Let alone with Gamma.I've been a hobby programmer since the days of Commodore and QBasic, but I think something about these examples wasn't really clicking. I'll look at the completed source again and revisit it. Will check out that other book too.Thanks!",TseehnMarhn,2026-05-28 19:29:13,2,learnprogramming,t1_oob3nj6,True,
oofkm7b,"Before this book, I did read though the Art of Unit Testing by Osherove",TseehnMarhn,2026-05-28 19:30:58,1,learnprogramming,t1_ooapav7,True,
oohcrsy,"Additional context: the ""Gang of Four"" patterns book, by Gamma et al? That entire pattern movement was launched by Ward and Kent: [Using Pattern Languages for Object-Oriented Programs](https://c2.com/doc/oopsla87.html).'course, it could still be true that the TDDbE demonstration projects are convoluted, etc. The text is the text, it doesn't magically become better just because the author is a Name.",vocumsineratio,2026-05-29 00:55:49,2,learnprogramming,t1_oofk87p,False,
oooky0f,"Design Patterns was one of the first programming texts I bought way back when. I just looked though the preface and sure enough, special thanks to Kent Beck. Strange that I often hear about Fowler or Martin, but not the ""grandfathers"" of all those ideas. In any case, while I agree just because someone influential wrote a book doesn't automatically make it good, I'm also inclined to believe he's working on a level above my own. I probably have some learning to do.",TseehnMarhn,2026-05-30 01:26:57,1,learnprogramming,t1_oohcrsy,True,
oo8xnau,HTML you can learn in an afternoon. Master CSS? Probably never lol,jbaker88,2026-05-27 20:55:44,25,learnprogramming,t3_1tpi45d,False,
oo9i8nu,[You need to Master how to use Google](https://www.google.com/search?q=how+long+does+it+take+to+learn+and+master+html%26css%3F&client=ms-android-tmus-us-rvc3&sourceid=chrome-mobile&ie=UTF-8#lfId=ChxjMe),rustyseapants,2026-05-27 22:36:37,5,learnprogramming,t3_1tpi45d,False,
oo8w97g,26 years +,peterlinddk,2026-05-27 20:49:28,5,learnprogramming,t3_1tpi45d,False,
oo8z2gb,"HTML is pretty straightforward and you should be able to get the basics in a few hours of learning and practice. There are ways to really get deeper (mostly if you care about accessibility through ARIA or if you want to do some very specific stuff), but you can accomplish most things with a basic understanding. CSS is quite a tougher cookie. Again, learning the basics should take a few hours, but each project will bring its own specifications which will require some deeper knowledge. Most books that cover the subject will bundle them together because they are very often used together, along with JavaScript (which is a good language to pick up if you want to learn Web Design).",quietjaypee,2026-05-27 21:02:12,4,learnprogramming,t3_1tpi45d,False,
ooarjoo,"Define ""master"". Plus, what are you trying to achieve/do? Learn web dev?",NationsAnarchy,2026-05-28 02:48:09,3,learnprogramming,t3_1tpi45d,False,
oo8wjj7,1 month.,Flame77ofc,2026-05-27 20:50:46,2,learnprogramming,t3_1tpi45d,False,
oo95idr,Html - 1 dayCss - 10 years,cankennykencan,2026-05-27 21:32:37,2,learnprogramming,t3_1tpi45d,False,
oo8ypxi,"Depends on the individual.  Tell us a few things about yourself,  your tech education and your facility for recognizing patterns. Otherwise it's like asking how long is a piece of string.",Dazzling_Music_2411,2026-05-27 21:00:36,1,learnprogramming,t3_1tpi45d,False,
oo8zjv0,"if you meant by mastering knowing all syntax,tags and keywords even historical/deprecated ones then for me 3 months is more than enough but to actually Master them a lifetime maybe not enough because they're part of a bigger development cycle which is frontend which the latter is only a part of fullstack which is a part of system architecture and product management which is part of software engineering",Software-fullstack,2026-05-27 21:04:26,1,learnprogramming,t3_1tpi45d,False,
oo9i8pj,"A few months to learn (2-4), but you won't ""master"" it until years later without professional experience. You don't need to though. That being said, HTML+CSS doesn't give you much, you want to add at least JavaScript to it in today's world, unless you're insanely talented UX designer and even that's a very bare baseline.",Any-Look-8817,2026-05-27 22:36:37,1,learnprogramming,t3_1tpi45d,False,
oo8jwxi,"If your goal is game dev and home automation is just a path, go with c++.Will take you longer for the automation but faster for your game dev!",Illustrious-Deer1126,2026-05-27 19:53:59,3,learnprogramming,t3_1tpf4nr,False,
oo89uha,"new coders like to ask ""what language should I learn?"" and old coders like to reply ""it doesn't actually make much difference"". Decide on a feature set, let the feature set guide you to a tool stack and then let the tool stack tell you what language to learn based on what languages the tool stack is written in and/or supports for scripting purposes. Between the two you presented it's more likely to be python than C++, but it might be either or both or a third thing we didn't think about.",reverendsteveii,2026-05-27 19:09:38,7,learnprogramming,t3_1tpf4nr,False,
oo8gz3c,"If you want results, use Python. Also, don't start from scratch: Other people have done the heavy lifting already: [https://www.home-assistant.io/integrations/python\_script/](https://www.home-assistant.io/integrations/python_script/)Start there.",Beregolas,2026-05-27 19:41:01,4,learnprogramming,t3_1tpf4nr,False,
oo8fnj2,"For Raspberry Pi home automation, I’d start with Python. The ecosystem is friendlier for beginners, hardware libraries are easy to use, and most tutorials for GPIO, sensors, Home Assistant integrations, MQTT, etc. will assume Python.C++ is still worth learning for game development, but you don’t need to force it into every project. Python will let you get lights/sensors/buttons working quickly, which is motivating. Later, if you hit performance or low-level constraints, you can bring C++ back in for those specific parts.",AutomaticBill114,2026-05-27 19:35:10,2,learnprogramming,t3_1tpf4nr,False,
oodfk0b,"You don't really want to power home automation with RasPis, you want to do it with ESP32s.C is more than sufficient, and quite simple since for the vast majority of home automation cases you won't need to do any dynamic memory allocations",TapWaterDev,2026-05-28 13:51:26,1,learnprogramming,t3_1tpf4nr,False,
oo8kw4n,Go or python,smaudd,2026-05-27 19:58:22,1,learnprogramming,t3_1tpf4nr,False,
oo98xq1,"Python, it comes with libraries that make controlling the I/O really easy. You'll need this to interface with the real world to do automation.",PipingSnail,2026-05-27 21:49:18,1,learnprogramming,t3_1tpf4nr,False,
oo89ny6,Python would be easier than C++ for sure. Not sure if there are other better ones - other people might know,nog642,2026-05-27 19:08:49,0,learnprogramming,t3_1tpf4nr,False,
oo8a52h,C# nano framework,Proxiconn,2026-05-27 19:10:55,-1,learnprogramming,t3_1tpf4nr,False,
oo8b9d4,"For basic automation, you'll probably want bash or python",cgoldberg,2026-05-27 19:15:50,-1,learnprogramming,t3_1tpf4nr,False,
ont5ixu,if you already have 2 years of python experience try building projects that look like something a real company would actually use not just tutorial clones. a full stack project with authentication database api integration and deployment goes a long way. something like an expense tracker crm inventory system job tracker or ai powered document analyzer can stand out if it solves a real problem. if you like backend build a scalable api with authentication rate limiting logging and tests because recruiters love seeing clean architecture not just flashy ui.another underrated idea is automation projects because python shines there. build something that scrapes data generates reports automates repetitive tasks or processes files at scale. for example an automated resume screener smart file organizer stock/news tracker or social media analytics dashboard. bonus points if you deploy it and include a clean github repo with proper readme screenshots and documentation. honestly one polished real world project is worth more than ten half finished mini apps in a portfolio.,Playful-Sock3547,2026-05-25 16:13:50,7,learnprogramming,t3_1tnddv6,False,
ont577f,"Show authorization, connection to web service, displays it, includes error handling, input validation, type safety, etc.  Just show that it does something complex and does it safely, clearly, modularized, and clean.",mikeyj777,2026-05-25 16:12:18,3,learnprogramming,t3_1tnddv6,False,
ont4ncf,"I would build a basic CRUD web api using FastAPI. I say this specifically because many companies are hiring AI Engineers and some of them are not interested in learning to build out APIs and are more wanting to develop prompts and rules, etc. So they get paired with a python developers.I worked on a client earlier this year where I had to rewrite 3 months worth of code because both the AI Engineers didn't mention they don't really build out APIs and things got so bad, humans couldn't read or understand the majority of the code.I would also build a chatbot with rules, which I think is in pretty high demand right now. Just one that handles the basics of conversation, but also uses LLMs to make sure system and user prompts are safe, etc. Basically you dont want a bot telling you to harm yourself is the idea.Hope this helps!",idreaminecmascipt,2026-05-25 16:09:41,2,learnprogramming,t3_1tnddv6,False,
ont3t3y,Something you are interested in. Something you would like to use yourself. Then you’ll show passion at the interview.,Kenny-G-,2026-05-25 16:05:40,1,learnprogramming,t3_1tnddv6,False,
ont56ej,"This depends entirely on what you are into, meaning your interests or studies.Something I am looking at creating at some point myself is basically a mini version of Wolfram Alpha. The reason being that very often at my university we aren't allowed access to the internet for exams, but we are allowed to use our computer however we want otherwise (Wordmat, Maple, GeoGebra, Python etc.), and for physics Python has a bunch of tools, but it is annoying to work with without having something premade with a lot of abilities/functions.I would also like to build a program that can calculate and visualize Taylor expansions, and then have a slider to chose how many expansions to incorporate, and another thing to type in the *a*\-value.Another thing I would like to make is a program which can simulate and animate different classical mechanics problems, such as the three-body-problem or the double pendulum, as well as visualize the energies.",iMagZz,2026-05-25 16:12:11,1,learnprogramming,t3_1tnddv6,False,
ont6puh,you should work on the project which looks real like Price hikes on Car how this effected the sales like this something which is happening and you have analysed things over that.,Any-Cardiologist1641,2026-05-25 16:19:25,1,learnprogramming,t3_1tnddv6,False,
ont9umg,"those physics simulation ideas are really solid, especially the double pendulum thing since it shows you can handle complex math and visualization together i'd probably go with something that actually solves a problem you have - like that offline wolfram alpha idea is pretty clever for exam situations. makes for good talking point in interviews too when you can explain the real use case behind it",Better_Sea8446,2026-05-25 16:34:21,2,learnprogramming,t1_ont56ej,False,
ontnapf,I was mostly doing game dev in pygame,TheEyebal,2026-05-25 17:37:43,2,learnprogramming,t1_ont56ej,True,
ontfep9,Yes I agree. It was also just to give OP a few ideas that I thought about in relation to my own area and interests.,iMagZz,2026-05-25 17:00:41,2,learnprogramming,t1_ont9umg,False,
ontnfdh,I was thinking of doing physics and math projects,TheEyebal,2026-05-25 17:38:18,1,learnprogramming,t1_ont9umg,True,
onqatiq,I’m in third year of CS degree and maybe tops 50 leet code problems. But a lot of projects and open source contributions. I would say you’re in a good stage. Keep going with leet code but start focusing on some projects. Maybe some open source contributions but that’s kinda hard.,Worldly_Analysis_664,2026-05-25 04:40:40,3,learnprogramming,t3_1tme0fa,False,
onnkqbw,"I can't comment specifically on your field (I'm an embedded C and Rust developer), but the general advice I can offer is: * Write projects that use the algorithms you've learnt* Have evidence you can use in interviews (when you used an algorithm, the problems it solved)* Don't compare your progress to other people's progress too much: * There's always someone with a head start on you * There's always someone who hasn't started yet * Keep comparisons healthy (don't only compare yourself to the top 1%) * Imposter syndrome is normal* Research the technologies and languages that jobs in your field require, then learn and use them.* Make practice deliberate (i.e. I'm doing this project to learn `X` and `Y`)* Have fun and don't burn yourself out.I defer to someone else to give field-specific advice, but for the next 6-12 months I'd say keep learning, and have at least one larger project you can reference.",RossMorgan363,2026-05-24 19:10:23,1,learnprogramming,t3_1tme0fa,False,
onoce7m,"You're definitely not behind - second year and 125 leetcode problems is actually solid progress. I'd say focus more in building actual projects rather than just grinding algorithms. Pick one area (web dev or ML) and go deep for few months instead of jumping around. For AIML student, maybe start with some ML projects since that's your major? You can always pick up web development later when you need it for deploying models. The key thing is having something real to show - employers care more about what you built than how many coding problems you solved. Don't get too caught up with LinkedIn posts, people tend to oversell their achievements there anyway.",HastyMainframe,2026-05-24 21:30:27,2,learnprogramming,t1_onnkqbw,False,
onjyfg1,"Sure, I think stuff like NATS and Kafka both support multiple consumers.",DrShocker,2026-05-24 05:29:55,2,learnprogramming,t3_1tm2z0f,False,
onkfrbq,Yes. Having more than one message type isn't a given. There are many multi-consumer (and multi-producer) message queues that only deal with one type of message. If you're writing it then you can make it work however you like.,HashDefTrueFalse,2026-05-24 08:00:26,1,learnprogramming,t3_1tm2z0f,False,
onkqnln,Coming from the world of SaaS it really depends on the queue implementation. Some queues have consumer groups where a message is visible to the group and consumed by one consumer(so having multiple groups would result in multiple consumptions) Kafka works like that. Other solutions like SQS do not have this concept and require fan out through multiple queues usually via something intermediary like SNS.I imagine lower level implementations work similarly.,dyslechtchitect,2026-05-24 09:40:22,1,learnprogramming,t3_1tm2z0f,False,
onmod9z,Many html servers support multiple processes to better deal with requests.You do have to be careful taking things off the queue. It's best to have separate input and output queues.Have fun!,JGhostThing,2026-05-24 16:37:14,1,learnprogramming,t3_1tm2z0f,False,
onmpvn4,"Yes. This is a very common thing. Consult the manual of whatever you use to figure out how they behave with multiple writers and multiple readers.You need to make sure that the access to the queue are atomic, that is to say that they can't be interrupted.",esaule,2026-05-24 16:44:21,1,learnprogramming,t3_1tm2z0f,False,
onnbmvj,Look up pthreads and mutex locking,igotshadowbaned,2026-05-24 18:25:34,1,learnprogramming,t3_1tm2z0f,False,
onjytcf,yeah works fine in practice,Evening-Living842,2026-05-24 05:33:10,2,learnprogramming,t1_onjyfg1,False,
onk0jg7,"I don't think I'm allowed to use tools that haven't been covered during our lesson, I'd have to use strictly System V mq. Would that still be ok? Of course, I'd make a new structure for the message",Avi250,2026-05-24 05:47:48,0,learnprogramming,t1_onjyfg1,True,
onlt3pl,"Another approach is topics-vs-queues. JMS and MQ implementations do this. If you create a ""topic"", then every consumer gets a copy of every message in that topic. If you instead create a ""queue"", then the system tries to deliver each message to only one consumer (though that can fail in edge cases because exactly-once semantics are practically impossible).",Justin_Passing_7465,2026-05-24 14:05:11,2,learnprogramming,t1_onkqnln,False,
onkh5nf,"What have you tried? If your clients are receiving on the same queue, there is your example of multiple receivers. The documentation says that...>If msgtyp is greater than 0, then the first message in the queue of type msgtyp is read,There is nothing in there to say you can't have multiple receivers asking for the same type, but it also doesn't say how the kernel decides who gets it first, so a safe assumption might be that it is an arbitary choice between processes that have called msgrcv with a common type. We could get a better answer if we [use the source, Luke](https://git.kernel.org/pub/scm/linux/kernel/git/torvalds/linux.git/tree/ipc/msg.c#l61), or [RTFM](https://tldp.org/LDP/tlk/ipc/ipc.html#:\~:text=Reading%20from%20the%20queue,up%20and%20run%20again) -- If I read that correctly, processes calling rcv get put into a _read queue_, they are going to see arriving messages first-come-first-served, and will remain in that read queue until a message of the requested _msgtyp_ is seen. That aligns with what I remember too.As for ""how"" to use them - that is completely up to you to design. You design it to fit your needs and operate within the documented constraints and behaviours. If I was reviewing work, I would be looking at things that make your application reliable and robust, and avoid leaking resources, like: How you generate and share the keys; How do you handle a client or servers going away (what happens if messages are left in the queue for it); How you handle application lifecycle properly (how do you cleanly and gracefully exit an application but not leave messages unanswered, which may involve another form of IPC); How do you handle queue lifecycle properly (how is it created and destroyed, that might require yet other forms of SysV IPC); How do you handle anticipatable errors (the queue being deleted out from under you, or you not having permission to access it, or it running out of message space, or trying to send or receive too large a message); How do you avoid deadlocks, Etc. The actual receiving and sending is probably one of the easiest parts.(You might ask is this SysV stuff relevant today. Funnily enough it was only relatively recently that I was maintaining and extending code that used SysV MQs, semops \_and\_ shmem. Even if you end up using more recent posix queues, message brokers, load balancers and more elaborate application protocols, etc, principles of robust design in distributed computing are still very relevant!)",LeeRyman,2026-05-24 08:12:59,1,learnprogramming,t1_onk0jg7,False,
ooqc9d2,"the stopping at 5500 is almost certainly a memory issue — you're loading 100k+ records with full relations (`include: a, b, c`) all at once into memory, which will cause the process to run out of heap space and silently stop.fix it by processing in batches instead of fetching everything at once:const batchSize = 500;let skip = 0;while (true) { const batch = await this.unprocessedTable.findMany({where: { isProcessed: false },include: { a: true, b: true, c: true },orderBy: { d: 'desc' },take: batchSize,skip: skip, }); if (batch.length === 0) break; for (const record of batch) {// your existing logic here } skip += batchSize;}",haiderakt,2026-05-30 09:17:26,1,learnprogramming,t3_1tru9ib,False,
ooqtcya,"The main issue here is loading everything at once. with 100k+ rows means you’re pulling a huge dataset into memory before doing any work, so the job will eventually hit memory/timeout limits and die somewhere in the middle.I’d switch this to chunked processing: + cursor pagination, process 200-500 rows per batch, mark each row as processed in the same transaction, then loop until no rows remain. That gives you resumability and keeps the scheduler from becoming a single giant failure domain. Also, is a one-shot startup task, not really a scheduler. If this needs to run continuously, I’d use or an external worker/queue and make the task idempotent so retries are safe.",cidy0983,2026-05-30 11:35:49,1,learnprogramming,t3_1tru9ib,False,
oor09f9,"depends entirely on whether you need tasks to survive a restart. if sending an email fires into APScheduler in-process and your dyno crashes mid-send, it's gone. that's the actual split: in-process scheduler (APScheduler) is fine for low-stakes stuff like nightly cleanup where missing one run doesnt matter, but anything you care about completing needs a real queue with persistence, which points you toward celery+redis or rq. for your specific list, hourly reports and email sends warrant a queue, daily cleanup probably doesnt. plain cron is also underrated if your tasks are just scripts and you have a single server you control.",oliver_extracts,2026-05-30 12:20:47,1,learnprogramming,t3_1tru9ib,False,
ooqf4xi,"Another problem is when I added take or skip the loop never runs. Dont know whats causing. Weird thing is the last log ""Cron Executed"" runs but never the loop before it.",kneegrow7,2026-05-30 09:43:17,1,learnprogramming,t1_ooqc9d2,True,
oorjjmq,Makes sense it silently stopped at 5k+. I already implemented what you guys suggests and it works fine. I am still monitoring the behavior though. But this is a new learning for me. Thanks!,kneegrow7,2026-05-30 14:09:36,1,learnprogramming,t1_ooqtcya,True,
ooqgao3,"when you add `take/skip`, the `where: { isProcessed: false }` filter combined with `orderBy` and pagination means by the time the second batch runs, the offset is wrong because previously processed records are now excluded from the count, so Prisma skips past records that haven't been processed yet.fix it by using cursor-based pagination instead: \`\`\`let cursor = undefined;while (true) {const batch = await this.unprocessedTable.findMany({where: { isProcessed: false },include: { a: true, b: true, c: true },orderBy: { recordId: 'asc' },take: 500,...(cursor && { cursor: { recordId: cursor }, skip: 1 }),});if (batch.length === 0) break;for (const record of batch) {// your existing logic}cursor = batch\[batch.length - 1\].recordId;} \`\`\`",haiderakt,2026-05-30 09:53:23,1,learnprogramming,t1_ooqf4xi,False,
ooqiz8h,"Thank you, it worked! The cursor did its job. I learned something new today.",kneegrow7,2026-05-30 10:16:08,1,learnprogramming,t1_ooqgao3,True,
ook86vr,"FreeCodeCamp and The Odin Project are both great resources. If they already manage databases, I'd honestly start with SQL and let them get comfortable building and querying things first. After that, HTML/CSS → JavaScript → React is a pretty natural progression.One thing I've noticed is that people learn much faster when they're solving real problems. Even small internal tools can teach more than hours of tutorials because there's an actual reason to build them.",BeginningOne8195,2026-05-29 12:50:59,3,learnprogramming,t3_1tr0qym,False,
ook8rqb,Thank you!I agree. Building is the way….thats how I did it. Learning how to program changes how you think about problems. I think it’s going to benefit them in other ways too.,babaqewsawwwce,2026-05-29 12:53:57,2,learnprogramming,t1_ook86vr,True,
ooepdms,Vercel + Supabase is solid combo for this,Different_Jicama_290,2026-05-28 17:13:44,2,learnprogramming,t3_1tq9ojw,False,
ooet61c,"You basically got it. Supabase, Vercel, Firebase... whatever you choose would be ok. Even renting a virtual machine and deploying everything via Docker would be very simple (even secure). Few security things to always have in mind before deploying. - only backend can talk to the database- do not store database credentials in code in any form, read it from a secure vault or inject it as ENV variable at runtime - use JWT to authenticate between frontend and backend- store backend authentication credentials in a secure vault just like the DB ones (or any other credential for that matter)",gajo357,2026-05-28 17:29:58,2,learnprogramming,t3_1tq9ojw,False,
