id,body,author,created_utc,score,subreddit,parent_id,is_submitter,distinguished
onzhk1w,AI writes code. I still build the pipelines and fix the 3am outage. This is what people don't get. Problem solved.,dragonnfr,2026-05-26 15:06:35,192,dataengineering,t3_1to92g6,False,
onzh1iu,"GenAI will not be autonomously doing programmer jobs. It needs to be controlled by engineers who understand the architecture, specs, and business requirements. I see it as just another level of abstraction like going from assembly language to Java, it’s just a more efficient way to code. So I see it as a tool that elevates engineers but that can also mean that less engineers are needed to get the job done, but on the flip side of that if engineers are more powerful then we actually become more valuable and demand may remain stable as a result. A lot of times these tech revolutions go the opposite route that most people think. Like when spreadsheets were invented a ton of business analysts thought they were going to lose jobs, but it turned out they became more in demand because there is more value to the job now that they have more powerful tools.I also think data engineering is probably safer than generic software engineering because of the nuances of large data. Ask an LLM to tune a spark job and see what happens, it’s a mess because LLMs don’t actually know what they’re doing, it’s purely an algorithm for generating a token in a sequence. That said, I think we need to lean into it. Coding with GenAI is way more efficient and folks who choose not to use it may get left behind, kinda like if a business analyst refused to learn spreadsheets on computers when they were invented",jadedmonk,2026-05-26 15:04:13,154,dataengineering,t3_1to92g6,False,
onzjhk0,Data problems are hard to automate because it is based in a lot of particularidades that even the client does not know,Old_Tourist_3774,2026-05-26 15:15:24,65,dataengineering,t3_1to92g6,False,
onzo6fs,"Data engineering is really boring. You actually want to do that all day? Some companies cant afford ai so 80% of the economy. Ever asked your manager a question they actually knew the answer to? No. Job is safe. If people cant describe what they want done in enough detail that AI will do it correctly and have permission to, then you are safe. Most program managers or managers in general really just say things and pass “strategic direction” down via conversation- they are getting replaced before data engineers",hyper24x7,2026-05-26 15:36:17,9,dataengineering,t3_1to92g6,False,
onzff41,LLMs currently cannot and never will be able to reason. I'm very new to this field (coming from 10 years of experience as SE though) - so I don't have an informed opinion specifically pertaining to DE. However the more I use LLMs (they are an incredible tool when used for certain things) - the more the inherent limitations become clear to me.,conqueso,2026-05-26 14:56:44,29,dataengineering,t3_1to92g6,False,
onzjrfa,"I don’t think programmers will be redundant as people still ultimately need to know how to communicate what it is that they even need, and I think things like architectural approaches and knowing the best way to structure things etc. will continue to be needed. I think it’s kind of more that the “programmer” role becomes something more like a manager role, where you are overseeing a coding agent/agents, collaborating on design and giving input on decisions, rather than just typing out code or navigating a GUI or whatever. Like I think it’s just a fact that most business users don’t even know what options are available or what they should be asking for. It’s the thing with how you ask someone in 1900 what they want and they’d tell you faster horses. It’s going to reduce the need for bad developers/developers that were basically just code monkeys and don’t understand architecture or conceptual thinking at all.",tophmcmasterson,2026-05-26 15:16:38,7,dataengineering,t3_1to92g6,False,
oo0l1f6,"I think we will shift focus much more on architecture and orchestration and less on code. We need to know what we want built, why it's built this way, how it works together with other parts of the pipeline, how to test, how to identify what is right and wrong with code. We'll be middle managers to AI agents, but still have a role in directing the agents work. We'll also have to fix all of the pure vibe coded mess that people who don't know all of those things threw together quickly.",SRMPDX,2026-05-26 18:00:46,5,dataengineering,t3_1to92g6,False,
onzhf72,I'm more worried about people not being able think realistic and really thinking all development jobs are going to be replaced.Data engineering will stay just like any other job.,Wingedchestnut,2026-05-26 15:05:58,10,dataengineering,t3_1to92g6,False,
onzmapu,"I use AI in my work daily and frankly while it’s a boon, debugging, improving my skills and learning: It’s not gonna replace people, after all certain point it starts hallucinating, it doesn’t understand context nor the business needs. I think people should be worried about jobs being sent to India and abroad as opposed to AI taking your jobs.",Chowder1054,2026-05-26 15:27:55,10,dataengineering,t3_1to92g6,False,
onzohlm,"AI will be a force amplifier for data engineering, not a replacement in my opinion.",AdvancedAerie4111,2026-05-26 15:37:41,4,dataengineering,t3_1to92g6,False,
onrr8zd,"What we have. Airflow (mwaa) orchestrates data into and out of the warehouse. If jobs are big they get run on emr (spark), if they are small (api calls or loading a document) they are run native on an airflow worker via some @task custom Python.Airflow will then trigger our DBT jobs and tests. If there is down stream dependencies to the build we use airflow assets to trigger or signal that further work can continue. DBT is nice the moment you get above 1-2 transformations or movements on the db since it can organize the entire stack in an easy to follow, troubleshoot and validate place. That said some of our simple loads just load to a snowflake temp table, delete and insert from prod in a transaction.",KeeganDoomFire,2026-05-25 11:51:13,28,dataengineering,t3_1tn5py2,False,
onro9nc,"You have airflow doing the transformations? That is where dbt should sit, and airflow should orchestrate it. If you have airflow doing transformations and orchestration, god help you lol",xKansas,2026-05-25 11:30:43,51,dataengineering,t3_1tn5py2,False,
onrt3m4,"Dbt comes in to organize the transformations, it handles the order, the dependencies and so onYou put it into airflow:Aiflow dag: get dbt models >> execute dbt transforms >> dbt testsSo you dont have to make the dag yourself, you can either blackbox it (one task for all transforms) or let dbt write the tasks at run time (not actually at run time, but at airflow 'compile' time)So you end up with your pretty dag made by dbt dynamically",Ra-mega-bbit,2026-05-25 12:03:18,8,dataengineering,t3_1tn5py2,False,
ons5juk,"For easier maintain the pipeline, consider use dbt.",rodeslab,2026-05-25 13:16:48,4,dataengineering,t3_1tn5py2,False,
onwa444,"DBT makes sense when SQL transformations need versioning, testing, lineage, and analyst-friendly ownership, but if your current pain is mainly Airflow orchestration and cross-DAG scaling, adding DBT may increase complexity unless you clearly separate DBT for transformations and Airflow only for scheduling.",JohnResearchLab,2026-05-26 02:00:58,4,dataengineering,t3_1tn5py2,False,
onrtsr4,"DBT gives you a bunch of tools for data warehousing: testing, modelling, lineage, doc and more. I’d say it’s useful and now difficult to get hand on as long as you can find someone experienced with it to setup and guide you.DBT can solve your dependency problem. The way to do it is to use the manifest.json file to figure out the DAG edges (in “child_map”) and generate tasks on the fly.",Outside-Storage-1523,2026-05-25 12:07:46,6,dataengineering,t3_1tn5py2,False,
ons44t3,"If your current workflow does the job, then forget dbt. Unpopular opinion: I don't think refactoring a codebase, with dbt or otherwise, is worth it if there are no tangible benefits: performance, maintanability, etc.In my old role, transformations were done with Python and SQL only (most of it before my time): it worked perfectly. Sure, we could have replaced em with dbt, but why fix what ain't broken?In my new role, I am building a data platform from the ground up: I get the say on the architecture, so I use dbt.In my next role, I would most likely use SQLMesh over dbt if given the choice.",teddythepooh99,2026-05-25 13:09:02,4,dataengineering,t3_1tn5py2,False,
onrq44z,What kinda scale?Dbt will be simpler for your analaysts but you'll need someone to sort the infra. Cloud would solve most your issues there but then you're incurring cost,wallyflops,2026-05-25 11:43:39,2,dataengineering,t3_1tn5py2,False,
onrx0kd,Its worth learning. You still need to write good sql. Its easy to maintain once you get your head around it. I recommend moving one if your transformations over to dbt and test it . Verify the results are the same,reditandfirgetit,2026-05-25 12:27:40,2,dataengineering,t3_1tn5py2,False,
onsqfjy,"dbt gives you setup as code and automatic dependency management.These are the 2 main advantages. Everything else you can get similar benefits from other tools.If you sollely use SQL and stored procedures, managing dependencies is painfull I guess?",Domehardostfu,2026-05-25 15:02:23,2,dataengineering,t3_1tn5py2,False,
oo0a50q,"My suggestion is to use AI like a senior data engineer that sits on your shoulder. Asking why things are done a certain way, can you back up why we are doing x instead of y. This also helps catch them talking nonsense. Developing a reliance on LLMs will be the death of this shift like you say. I did this first hand for a short period of time, as I was under the crunch to deliver multiple things at once. I had to go back and relearn the technology properly",cakerev,2026-05-26 17:13:14,54,dataengineering,t3_1to9ww5,False,
oo0x4r7,"I generally think about data work in these verticals.1. Business: What does your company do? How do they make money? What metrics do the CEO and stakeholders care about? What is the 6-month roadmap, and what are the major business goals?2. Data Context: How is upstream data generated and modeled? What are its caveats? How is the warehouse modeled now? What are the key fact tables, and which do stakeholders use most? What current data problems does the DE team have?3. Problems: What is the problem you are solving? Why does it matter? Does it need to be done? Timelines? How does it relate to a business objective? Politics? 4. Output: What are your requirements? Are all the requirements necessary (e.g., does it really need streaming, etc)? 5. Constraints: What are your constraints? Tools, systems, timelines, DQ checks. Cut scope based on constraints.6. Solution brainstorm: How to go from Problems + data context + constraints to Output?7. Demo/showcase, 8. Continuous improvement: Monitor, fix bugs, ticket resolution, etcIn my experience, for **1, 2, 3, 4, 5 you really need to speak to people/stakeholders, and it will be a continual process.** AI can provide good solutions when your inputs, constraints, and outputs are relatively clean. But it tends to make verbose code and cause random issues. So you really need to review it. However, once you have a well-defined template, AI can write some code, but always review it carefully.I generally brainstorm ideas/code outlines, then review with AI. The other way I found wastes so much time, as the AI solutions are not always good.**TL;DR:** I don’t think AI will stunt your growth *if you drive the design and use AI to automate* once you have a well-defined process. But if you let AI lead (except for simple one-off scripts), your skills will deteriorate.AI is a non-deterministic tool; use it as such. *Human design + AI to speed up code generation* has been working great for me.When I let AI rip without at least skimming the docs it has mostly (~70%) wasted my time.Hope this helps. LMK if you have any questions.",joseph_machado,2026-05-26 18:54:44,24,dataengineering,t3_1to9ww5,False,
oo0rhg7,You need to actually learn the job so you know when to pushback on AI. As someone who is also using AI at the direction of the company it’s way too confident about some things. It makes weird choices and once it has decided what path to go down it will hammer down that path without stopping to consider anything else.,TodosLosPomegranates,2026-05-26 18:29:29,6,dataengineering,t3_1to9ww5,False,
onzwyb6,Chat with AI instead of asking it to do everything for you.,Severe_Variation_234,2026-05-26 16:15:13,3,dataengineering,t3_1to9ww5,False,
oo1dcsv,You should have a clear understanding about the different providers and different LLM they are offering. Which one to use and which one to avoid and how to write better prompts. You should definitely include the usage of the MCP and start adding the AI in your day to day tasks. It won't be perfect from the beginning but you will get better by practicing.,dataengineer95,2026-05-26 20:08:13,1,dataengineering,t3_1to9ww5,False,
oo5ndzg,"Using AI in your first Data Engineering role will not stunt your growth if you stay involved in understanding the systems behind the code. Your analytics background already gives you a strong foundation in SQL, business logic, data quality intuition, and reporting workflows. Those skills transfer well into Data Engineering. What you should focus on now:* Spark + Databricks* data modeling* orchestration workflows* APIs* debugging* cloud fundamentals* Understanding data flow end-to-endIf you’re looking for more structured guidance, we offer multiple Data Engineering courses focused on real-world projects and practical AI-assisted engineering workflows rather than only theoretical learning. You can visit our website to find out more.",Simplilearn,2026-05-27 12:03:40,1,dataengineering,t3_1to9ww5,False,
oo6akft,There is no ai era. Are we in an internet era? It’s just another tool to capitalize on. Focus on the basics,Mission_Working9929,2026-05-27 14:00:44,1,dataengineering,t3_1to9ww5,False,
oo6xu7m,"use AI to go faster, then manually trace back what it actually did. like if copilot writes your pipeline logic, spend 20 mins pulling it apart line by line. that's where the learning happens, not in avoiding it. your 5 years in analytics is a bigger edge than you're giving it credit for btw. you already know what bad data looks like downstream.",northifycom,2026-05-27 15:44:20,1,dataengineering,t3_1to9ww5,False,
oo0offl,"Congratulations! A couple of book recommendations: Designing Data-Intensive Applications for a very solid overview of how data systems work under the hood, and SQL Performance Explained to really understand writing performant queries",onlytama,2026-05-26 18:15:53,1,dataengineering,t3_1to9ww5,False,
oo0cbyo,"I'll definitely keep this in mind as I get ready to head into the role, thanks!",BlackHisagi,2026-05-26 17:22:49,4,dataengineering,t1_oo0a50q,True,
onaafw8,For tech company it is pretty common. All engineer get leetcode. Data engineer is usually lighter on leetcode but it is still easy to medium. But we get sql leetcode.,543254447,2026-05-22 17:44:51,43,dataengineering,t3_1tkq48n,False,
oncrhlp,"There’s no norm. Some do LC some don’t. Stay current and be able to do easies with no help and mediums with a few nudges. In my experience the companies that want you to do LC with the intention of grinding you down are not good places to work. If they give you LC designed to see how you work with your interviewer, they answer questions, help you through the problem etc it’s usually a good culture.",boboshoes,2026-05-23 01:39:00,9,dataengineering,t3_1tkq48n,False,
oniaoa4,Not normal.,almost-ready-2026,2026-05-23 22:46:50,4,dataengineering,t3_1tkq48n,False,
ondv8yg,"It's low effort on behalf of the company, but the idea of this first assessment is to show that, yes, you can actually code. It's a gate.So many people apply for coding positions and can't read or write a single line of code in any language.",Shadowlance23,2026-05-23 06:24:22,5,dataengineering,t3_1tkq48n,False,
onsgpm3,"we’re hiring for a data engineer at the moment, and sadly the standard of engineer coming through is very low. I understand the discipline is very broad (I have ten years experience fyi) but candidates can’t write window functions and in some cases filter pandas data frames. Are we asking too much?",Leather-Replacement7,2026-05-25 14:15:05,2,dataengineering,t3_1tkq48n,False,
onacqs0,I got a basic databricks project as a taskedit: the databricks task was for the place I currently work at. I also had a sql and python assessment for another process I went through in the past,DigoHiro,2026-05-22 17:55:22,3,dataengineering,t3_1tkq48n,False,
onb72x8,"It's a bit weird to get such weak LC problems for Staff level. For staff, you'd either want some serious LC questions or to skip that all and do more of a whiteboard technical interview. They probably just use the OA to filter out totally under-qualified people that inflate their resumes and get passed through by HR.",LoaderD,2026-05-22 20:19:41,2,dataengineering,t3_1tkq48n,False,
onjmy6l,"yes, it’s surprisingly common. many data engineering assessments still test general coding and algorithm skills (linked lists, trees, palindromes) because they want to see problem-solving, not just system knowledge. the spark/vectorized query stuff usually comes later in interviews or practical exercises.",Enough_Big4191,2026-05-24 03:58:16,1,dataengineering,t3_1tkq48n,False,
onnxl4z,"lol bro complaining, go study",slayerzerg,2026-05-24 20:14:57,1,dataengineering,t3_1tkq48n,False,
onsfsmx,"Having gone through a recent spate of interviews at large systematic and multi Strat hedge funds, yes there are usually lc/dsa rounds. I got served 2 dimensional dynamic programming at one of the biggest multi strats, told the interviewer immediately I recognise this is a dynamic programming problem but I can’t remember how to solve them and cobbled something together using recursion solving the base cases. I made it through to the next round somehow but pulled out due to accepting another offer.",Leather-Replacement7,2026-05-25 14:10:28,1,dataengineering,t3_1tkq48n,False,
oo0d04k,"Senior comes with experience and knowing how to leverage code to make business impact. Not just coding for the sake of coding.Roles are also just roles, tons of people I know who would be seniors at other companies with a mid level title and the reverse as well. You’ll naturally get the title once you are consistently driving a positive impact on the business.",adgjl12,2026-05-26 17:25:44,54,dataengineering,t3_1todgks,False,
oo0v65s,"I was previously senior SWE, now I'm DE lead.as others said, the more senior you get the more it's about soft skills. half of my work is mentoring and creating documentatiom - tech and business one - explaining how to fix the problem business is facing and how to solve it technically.i still code, but a lot less and mostly i scaffold a framework and then churn through the PRs my team starts making once they begin to add modules.specific example - we are on azure stack. we mainly use databricks. but we don't get our own nat gateway or any way to avoid the ip fanout so for closed/whitelisted apis this was a mess. the process took ages and we got around 50 adf pipelines for different apis with business logic for them burried inside adf so the work takes ages.I've built a modular framework which lets us keep the business logic in repo and uses pluggable adf proxy transport which leverages single parametrized adf pipeline. now other companies under our corporate umbrella are copying this approach and everybody's so proud of our innovative ways.you gotta sell the technical debt work though. i used the fact that now creating new api module takes a medior about a day of work. before it was a week. absolute win.now, there were other options you could go around doing this, of course.anyway, if you like coding, stay at your medior role and be happy. once you'd rather get stuck in business meetings with your reward being writing tech doc for new framework architecture or what not, push towards being a senior",Altruistic_Stage3893,2026-05-26 18:46:01,11,dataengineering,t3_1todgks,False,
oo0b88v,> trying to become senior> sick of writing docsWho’s going to tell them?,fidelcashflow8,2026-05-26 17:18:00,6,dataengineering,t3_1todgks,False,
oo1ad61,"\>  I don’t really care about this stuffYou know what makes you happy right now, and it’s not Senior tasks. Your happiness comes first.Comparing yourself to others is corrosive. Do your work that you like. Go home at a reasonable hour and have a full life.",chock-a-block,2026-05-26 19:54:38,7,dataengineering,t3_1todgks,False,
oo5f36o,"honestly this sounds less like “you’re not senior” and more like you’re discovering that senior roles often shift away from pure coding into ambiguity management, planning, communication, and system thinking. a lot of strong technical people hit this wall because nobody really explains that transition clearly. also, being in your 30s at mid-level is way more common than people admit, especially in today’s market.",Appropriate-Sir-3264,2026-05-27 11:13:36,5,dataengineering,t3_1todgks,False,
oo3mhnk,"Hey OP, what strikes me as a red flag would be “i just want to build data pipelines”, that in itself tells me you’re stuck in the mid/junior level.Now obviously every company is going to be different, but generally Senior is not about building more/bigger pipelines - it’s about knowing what to build in the first place. And that comes with.. yes planning, talking to stakeholders, figuring out the problems, honestly nowadays with AI tools the pipelines are the easy part.So the truth pill is that for Senior that is a lot of what you’ll be doing, as to how to learn.. tbh from what I’ve seen it can be cultivated to a certain extent but it requires a lot of work and really just understanding business. Best of luck.",Winter-Hold-6208,2026-05-27 03:08:23,3,dataengineering,t3_1todgks,False,
oo6u3wd,"You hit the ceiling because after a while, all the coding in the world is useless if it doesn't have business acumen to go with it.",pina_koala,2026-05-27 15:28:15,3,dataengineering,t3_1todgks,False,
oo3wq3m,sounds like the role isn’t a good fit look for positions focused on coding and pipelines rather than documentation or process-heavy work. you can still reach senior-level impact in roles that match your strengths.,Enough_Big4191,2026-05-27 04:11:08,2,dataengineering,t3_1todgks,False,
oo12ezy,"YMMV but I was a senior in under 5 years. What I would say got me there that fast? Knowledge about business, know what matters, what stakeholders need, communication then delivery.(and obviously being highly productive and technical).",bkl7flex,2026-05-26 19:18:28,3,dataengineering,t3_1todgks,False,
oo0r88h,"can you some examples , ambiguous problem you are trying to solve.",JuiceProud9655,2026-05-26 18:28:20,1,dataengineering,t3_1todgks,False,
onmdot5,"To me, that place seems like a proper enterprise data warehouse. Sone things may not make sense to you now, but believe me there is a logical reason behind all of them",mow12,2026-05-24 15:47:13,26,dataengineering,t3_1tltg11,False,
onn2pto,"I truly believe you're not understanding the concepts at all.Hub and Spoke is not a Databricks Unity Catalog, it's a network topology. Since you're executing everything in the Cloud, Hub-and-Spoke is a well-documented topology that can help on maintaining management over connection to Data Sources and accesses. With that in mind, Hub-and-Spoke has nothing to do with the Medallion Architecture, rather it is related to different environments (Dev-Test-Prod) or other environment that you need to set up.On the other hand, Unity Catalog is a metastore, is not a place where all the data from different sources is consumed. That's the Lakehouse (from Databricks perspective). If you're using Azure, the Data Lake per se is the Azure Data Lake Gen 2 that is beneath the Lakehouse layer, and Unity Catalog is only accesing metadata to describe the Delta tables that you have there.Finally, if deployed correctly, Unity Catalog has the ability to deploy lineage in a single click. Add governance metadata (as tags) in the Delta tables so you can query them and identify faster.But no, from my point of view is not over engineered. It's just you're lacking the lineage to know precisely what you're dealing with",oscarmch,2026-05-24 17:43:10,10,dataengineering,t3_1tltg11,False,
onkwn6r,"When you say not fact-to-fact, surely you know you can easily join facts on a natural key + grain by putting each fact query in it's own CTE right? I think a lot of the issues people have with star schemas is that they don't know how to query against them, but that's something that only comes with time working with them. The ""don't join fact to fact"" is simply a Kimball best practice about a singular query, no joins to a fact on another facts queries.",financialthrowaw2020,2026-05-24 10:33:16,5,dataengineering,t3_1tltg11,False,
