id,body,author,created_utc,score,subreddit,parent_id,is_submitter,distinguished
ofly8ll,"wow! At first thank you so much for taking your time to reply for this. I accept technology always evolve with time, but recently the it is rapid speed. And also yes for now data engineering is good.. I also work in Azure Databricks on data only. So i guess i should keep separate time to learn ML is the side and focus on to move with the tech of the time !!again thank you for your advice !!!",Butterscotch8484,2026-04-11 17:59:27,1,dataengineering,t1_ofl2z57,True,
ogb1rls,Bruh asking cursor while presenting a course is something that i wouldn't even fathom doing. I guess standards are low nowadays.,XxDarkSasuke69xX,2026-04-15 11:14:20,280,learnprogramming,t3_1sm2hx7,False,
ogbjajb,the text based curriculum is still solid tbh. the video content def went downhill when they started relying on AI generation,alphadester,2026-04-15 12:59:32,66,learnprogramming,t3_1sm2hx7,False,
ogb70m7,"Never was any good same as codecademy and many others, watching videos wont get you anywhere, you need to read and write",Nok1a_,2026-04-15 11:48:46,67,learnprogramming,t3_1sm2hx7,False,
ogaygpj,"FreeCodeCamp used to hit during Covid times, I learnt so much. However, I agree the courses don't have the same value anymore",SemanticThreader,2026-04-15 10:51:05,24,learnprogramming,t3_1sm2hx7,False,
ogayi45,I heard that line from a uni professor. Guess this shit is an industry standard now,PonosDegustator,2026-04-15 10:51:22,9,learnprogramming,t3_1sm2hx7,False,
ogbgpr8,"Sounds like you’re referring to their video content, which are videos created by many different sources and aren’t really as curated and scrutinized as their main website curriculum. This is expected.Their main full-stack curriculum at freeCodeCamp.org is a masterpiece.",Snugglupagus,2026-04-15 12:45:37,33,learnprogramming,t3_1sm2hx7,False,
ogc5gag,"Yeah, feels like a shift from teaching fundamentals to showcasing tools. Watching someone prompt their way through problems isn’t the same as understanding why things work. It’s useful in small doses, but not great as a primary learning method.",patternrelay,2026-04-15 14:47:37,5,learnprogramming,t3_1sm2hx7,False,
ogelat7,"I actually like freecodecamp overall, but it's basically the TEDx of learning to code. Some of the video authors might be really good programmers but that doesn't necessarily make them good teachers.",SourCreamSplatter,2026-04-15 21:19:11,6,learnprogramming,t3_1sm2hx7,False,
oge4hra,We are not a serious industry,LowFruit25,2026-04-15 20:03:45,3,learnprogramming,t3_1sm2hx7,False,
ogkyt2o,"Hello there~I'm Naomi, the community manager over at freeCodeCamp~I am very sorry to hear that you were not satisfied with this video course. We do our best to provide the most effective coursework we can to position you for success as a developer.AI-augmented workflows are becoming increasingly common in our industry, so it would be a disservice to you all if we did not share information about that.However, I have very much heard your feedback on the quality of this course. If you would like to share the link to the course with me, I will gladly pass the feedback on to our video team~(edit to introduce myself properly~)",naomi-lgbt,2026-04-16 19:42:54,3,learnprogramming,t3_1sm2hx7,False,
ofjtjn3,You don’t. I get dumber by the day but at least my dog is getting better at catching the frisbee.,spas2k,2026-04-11 11:14:09,256,learnprogramming,t3_1sid3cv,False,
ofjdd8j,"Take the extra time to pick the best features to develop, write better requirements, and develop better test suites that help you be sure that the code you're pushing is actually fixing your problems and not creating new ones.",The_Other_David,2026-04-11 08:54:28,67,learnprogramming,t3_1sid3cv,False,
ofjg8pp,"You cannot stay sharp and use AI.Similarly, when I became lead, I learnt that in order to empower others, I had to let them do things themdelves and the way they wanted (at least to some very large extends) instead of thinking like ""I know how to do it, it will be faster to do it thatn explain"".So, by becoming a better lead, I practiced less and became less sharp. When I changed job recently, I went back to an ""hardcore"" dev position and I can that I am less good than before.The key is to practice. Especially the little, annoying, things that you do everyday, not just the fun and complex things you do once in a while.",divad1196,2026-04-11 09:20:56,71,learnprogramming,t3_1sid3cv,False,
ofjm00t,"I have at least one complete no AI day at work. I try and choose the most difficult tasks to do during this day. Otherwise, I feel like 50/50 is still faster that getting the AI to do 100%",SeaThought7082,2026-04-11 10:13:00,39,learnprogramming,t3_1sid3cv,False,
ofjffbh,"I believe that there is no romanticization involved in your observation. What has really helped me is my awareness of the situation and knowing when to use or not to use the AI. There are still features or refactorings which I do from scratch because this is something that keeps me thinking and coding. Moreover, by working on one particular layer (e.g., performance layer), debugging or system designing and making it runable, we still require an ability that cannot be replaced yet by the AI.The tool works well and fast, but when nothing takes effort, we no longer exercise our instincts. Thus, the balance between the two must be achieved.",Fajan_,2026-04-11 09:13:22,11,learnprogramming,t3_1sid3cv,False,
ofjs6ks,"My suggestion would be to **always follow up.**I don't code for a job, or school, or anything of the sort; rather I code for coding's sake... (dropped out of uni during covid, currently in a dead-end job, etc, etc, sad sad, yes yes, anyway...). That said, I have found that I've been learning a lot more now *because* my code writes itself.The reason for this, I think, is the fact that when code is generated, I am able to not just skim the suggestion, but to critically analyze it. Is this the solution I would have used? What are the differences? Are there any concepts I am not familiar with? For that last one, a yes is a prompt to go do further research and learn more.It seems the difference is that I am operating without deadlines or responsibilities where my code is concerned. Perhaps, to translate this into a framework of ""the job is to ship working software"", one could either 1. find time to practice on your own, redo a problem you had, or you thought about and allow yourself to critically analyze the solutions given,2. add time to your workflow to actually look over the work and do research. You might be shipping in 2 days instead of 1, but you'd have to ask yourself and weigh that price.",Taiqi_,2026-04-11 11:03:44,9,learnprogramming,t3_1sid3cv,False,
ofj8onl,"Easy: Don't use LLMs. It's like you being a musician, maybe a violinist, asking ""how do I stay sharp when I can just replay the music on the cd player ?"" If you care about your skills, practice them. Nobody forces you to use LLMs",0x14f,2026-04-11 08:11:44,114,learnprogramming,t3_1sid3cv,False,
ofjf7jc,"You have to cut out AI usage. Yes the job is technically to ship code, but those real optimisations on a large existing codebase like you're mentioning just aren't really feasible with AI tools, because they don't have as good of a context window as a human, they don't actually do any real cognition or understanding and so on. You can ship something much faster with AI, but the quality drops very sharply.",PM_ME_UR__RECIPES,2026-04-11 09:11:20,10,learnprogramming,t3_1sid3cv,False,
ofjgnxq,"I'm studying applied CS and I love programming but I don't think that I'd love it as much if I just tell an LLM to do this. ''that doesn't work. Check what does work''. Until it works and the code is decent. I'm pretty sure that I'd feel like working a menial job after a while , the one I'm trying to get away from. However I doubt that a subfield in IT will not be like this (unless it's physically installing stuff). It's like when they invented the calculator maybe. You can feel yourself missing out on not training that arithmetic muscle as you use it. You don't get the same satisfaction. Yet to not use it wouldn't be pragmatic.So what do we do?Work part time so we can have a life where we can do fun things outside of work. Or find a different job where you can problem solve.",AskNo8702,2026-04-11 09:24:54,5,learnprogramming,t3_1sid3cv,False,
ofl33gk,Read *and understand* everything. Don’t skim; actually follow the logic and ensure it makes sense. LLMs are good at producing plausible-looking code that seems sensible at a superficial level but has weird edge cases or pointless complexity/inefficiencies if you dig into it; there’s no excuse for merging code that hasn’t had a thorough human review outside of throwaway PoCs and the like that don’t need long-term maintenance.,Blothorn,2026-04-11 15:31:49,3,learnprogramming,t3_1sid3cv,False,
ofspv8d,you can start with this repo: [https://github.com/ashishps1/awesome-system-design-resources](https://github.com/ashishps1/awesome-system-design-resources) . It is up to date and starts with basics. Then can try out the skills learned at [rubduck](https://rubduck.ai),Jazzlike-Age-4867,2026-04-12 18:26:31,50,learnprogramming,t3_1sjlhrl,False,
ofskvy1,Start here: [https://www.youtube.com/watch?v=m8Icp\_Cid5o](https://www.youtube.com/watch?v=m8Icp_Cid5o) (System Design for Beginners Course)ps: your age has nothing to do with it.,0x14f,2026-04-12 18:03:20,19,learnprogramming,t3_1sjlhrl,False,
ofsmj11,"except for the very young (pre natal through toddlerville), age isn't very relevant for pedagogical approaches.Anyway...There are myriad tutorials and primers available to you -- many which are free. Search, learn, and have fun!P.S. The youngest typically learn the fastest, especially with languages.",DinTaiFung,2026-04-12 18:10:55,25,learnprogramming,t3_1sjlhrl,False,
ofsluj5,"System design is a bit broad, it depends on how much foundational knowledge you already have. There are a lot of factors to consider depending on the project. Ie. Scalability, performance, security, efficiency, etc.I’d say if you already followed a CS related course, you shouldve already known the basics of it. The rest comes with practice and review. Just dive into projects.Basically, if you know the programming fundamentals then I suggest putting what you learned to practice and if not then there are lots of great and free courses out there that can help you start",CannibalPride,2026-04-12 18:07:47,6,learnprogramming,t3_1sjlhrl,False,
ofw86oc,There's also the age old Designing Data Intensive Applications book that gives you a large overview on scaling and building robust systems,codewiser,2026-04-13 06:57:16,5,learnprogramming,t3_1sjlhrl,False,
ofsxy96,Hello interview is pretty amazing. Good quality content.,koffeeluv,2026-04-12 19:04:24,4,learnprogramming,t3_1sjlhrl,False,
ofsyt4r,"im curious, why does your age even matter?",QuarryTen,2026-04-12 19:08:29,5,learnprogramming,t3_1sjlhrl,False,
ofu8ibu,The same as 18 year olds and 50 year olds,binarycow,2026-04-12 23:00:11,3,learnprogramming,t3_1sjlhrl,False,
ofslarh,I wanna know the same thing :smiling_face_with_tear: . A friend told me to read Clean Architecture by uncle Bob but i havent started yet. Idk if that book is still relevant today,manoh1234,2026-04-12 18:05:15,3,learnprogramming,t3_1sjlhrl,False,
ofsz3tw,"* **NobleProg Nepal:** Offers high-level courses on Microservice Patterns, Domain-Driven Design (DDD), and Software Design & Architecture. These are ideal for developers looking to move into senior roles.* **The Knowledge Academy:** Provides Software Design and Architecture training, including live, instructor-led sessions covering software development lifecycles and architectural patterns.",Aglet_Green,2026-04-12 19:09:53,3,learnprogramming,t3_1sjlhrl,False,
ogjj9hx,"No. I’d rather spend time with my wife and child, like most people get to do in other careers.",PianoConcertoNo2,2026-04-16 15:52:28,186,learnprogramming,t3_1sn6y5o,False,
ogjw9q6,"I personally don’t. I have close friends who are also devs and do, but for me personally, I’ve found that no good comes from it. I really enjoy my job, but programming outside of work makes me less happy at work and at home, even if I feel like I’ve caught the bug to build something - it always circles back to mental exhaustion. I much prefer spending time doing totally different activities that keep me balanced like running, rock climbing, cooking, etc… on a more opinionated note, I think it’s just good to have variety in life in general. Programming is just one way to spend time, not THE way to spend time.",SaxSalute,2026-04-16 16:50:28,14,learnprogramming,t3_1sn6y5o,False,
ogjezgl,Yes after work I still spend a lot of time doing my game dev hobby,mlugo02,2026-04-16 15:33:46,27,learnprogramming,t3_1sn6y5o,False,
ogjfnd3,I have been working as a dev in some capacity for nearly 20 years and I have always had side projects. To me they are separate things. I can be sitting at work working on an application and can't wait till I get to go home and work on my side project. It's one of the things that has kept me interested in this field. I know most of my coworkers are just 9-5 devs and I think that's okay too.,Christavito,2026-04-16 15:36:45,67,learnprogramming,t3_1sn6y5o,False,
ogkno6a,"All of my personal projects are in the real world. Home improvements and things like woodworking, electronics, or learning about random stuff.My curiosity and interests wander. Development used to be one of those curiosities and it led to a good career. Right now, it mostly just pays the bills while I do other things that interest me more. If the world didn’t reward a single focused career progression, I would probably be on my 4th career by now.",maowai,2026-04-16 18:51:48,11,learnprogramming,t3_1sn6y5o,False,
ogjgfs3,"I have side projects, but they're hobbies that I want to turn into income.",EtherealSai,2026-04-16 15:40:12,8,learnprogramming,t3_1sn6y5o,False,
ogjpg1m,"I think it's important to actually be interested in the project you are working on so it's not just working after work. Working extra hours for free after a long day is difficult, but putting time into your hobby is totally a different story.",Significant-Syrup400,2026-04-16 16:20:06,3,learnprogramming,t3_1sn6y5o,False,
ogjl3ll,"Yes, programming is what I like to do and unfortunately the stuff I write for work just isn't that complex or interesting.Besides on days where I'm mostly in meetings or helping junior programmers it is nice to program at home.",pixel293,2026-04-16 16:00:35,2,learnprogramming,t3_1sn6y5o,False,
ogjlwyz,"Yes but not in a grindy way, I just work on projects that are useful for myself or would be fun to try. My ""largest"" one right now is maintaining a search engine type system I made for a very niche community. I don't whip myself for not working on side projects if I don't have the energy to though, nothing forced. Usually the projects I work on at home are completely different than the kind of stack/platforms I use at work so I don't burn myself out entirely and have some variety.To clarify though I am not married with no kids so this will probably change as my circumstances change, but for now I'm having fun and using my free time to my advantage. But again, I do it because I want to and I like learning new things, not because I feel compelled to maintain side projects because I ""have"" to.",bigsauce456,2026-04-16 16:04:15,2,learnprogramming,t3_1sn6y5o,False,
ogjpsp8,"Yes.I don't feel burnt out, I enjoy working on side projects.",Kpow_636,2026-04-16 16:21:41,2,learnprogramming,t3_1sn6y5o,False,
ogo1yl4,It pushes the code to remote repo and deletes everything on the pc. I think he meant that the guy has moved to a “final” resting place and this world for him no longer exists something like that,mrgoodytwosho365,2026-04-17 06:51:43,191,learnprogramming,t3_1snt4xs,False,
ogo38yc,"git is a tool programmers use to ""save"" their work. pushing is how they ""publish"" or ""submit"" their work. origin is a common name for where the work originated. ""final"" would be the descriptor of the last thing he worked on. putting it all together, he completed his final act and returned to where he came from (went to heaven, became one with the universe, etc)rm removes a file or a directory. in this case, it is the entire file system. in other words, everything on the computer is deleted. interpret that as his mind, body, or something else is gone",dumpin-on-time,2026-04-17 07:02:39,57,learnprogramming,t3_1snt4xs,False,
ogo5ngx,"It is a good send off.Your last send of purpose to the cosmos/heavens/gods/valhalla. And then you’re done with the local copy.Definitely nerdy, poetic, beautiful.",These-Math1384,2026-04-17 07:23:36,41,learnprogramming,t3_1snt4xs,False,
ogos42l,"This hits close to home, I lost a friend too. It's like he was saying ""I've sent my final push, my work here is done."" Beautifully poetic, even in command lines.",Training-Attempt-209,2026-04-17 10:39:38,14,learnprogramming,t3_1snt4xs,False,
ogo1t6r,"I would translate it to ""going back to where he came from"". ""git push origin final"" is ""push the 'final' branch back to the 'origin' repo"" and ""rm -rf /"" is removing the entire local filesystem.",Immediate_Form7831,2026-04-17 06:50:28,22,learnprogramming,t3_1snt4xs,False,
ogo4xai,"The program `git` is a way of copying source code around and tracking changes to it by multiple programmers; those changes can be individually kept or reverted.If you are a programmer beginning work on an existing project, the first thing you do is get a copy of that project onto your computer by _cloning_ it from the place it lives online (called a _repository_ and identified by a URL). The local copy remembers the repository where it came from as its `origin`. Then you create a _branch_ to hold your changes, which you can name whatever you want; in this case, since the changes were going to be the last ones, the author called it `final`. Once you've made your changes you then copy your branch back to the original repository with `git push`, the first command in your snippet. ""Send a copy of the `final` branch to the `origin` repository.""Having thus saved your work in the cloud, if you're all done, you can safely delete the local copy. The `rm -rf /` goes above and beyond by deleting every file on the computer, essentially turning it into a lifeless husk.",zeekar,2026-04-17 07:17:12,4,learnprogramming,t3_1snt4xs,False,
ogo3wen,"This is an interesting way to approach git and spirituality.Made me think of different ways to represent death.Final death, nothing after. Would just be rm -rf / I guessPushing to git means there is something to push somewhere.Reincarnation could be a new branch or fork.Things like that.Anyway, I find it beautiful.",HolyPommeDeTerre,2026-04-17 07:08:14,3,learnprogramming,t3_1snt4xs,False,
ogpwylp,A bit of dark humour if you ask me. Plenty of others have given a far more eloquent explanation superior to anything I'd say.,Kwith,2026-04-17 14:28:27,3,learnprogramming,t3_1snt4xs,False,
ogo3bha,"git is how we keep track of code. \`push origin final\` means send your code updates to everyone else and call them ""final."" \`rm -rf /\` deletes all of the files on a linux system (technically not but close enough).I read this as a metaphore for sending his soul somewhere (wherever he came from) and deleting his body.",skoorrevir,2026-04-17 07:03:15,2,learnprogramming,t3_1snt4xs,False,
ogo8i8a,It is a good send off.,NoKaleidoscope3408,2026-04-17 07:49:24,2,learnprogramming,t3_1snt4xs,False,
ofjlk7y,Bro escaped the grind mindset respect,Different_Pain5781,2026-04-11 10:09:09,47,learnprogramming,t3_1sif0y3,False,
ofjlib9,thats how a lot of great projects start. no pressure just curiosity and consistency over time.,hippohoney,2026-04-11 10:08:41,19,learnprogramming,t3_1sif0y3,False,
ofjngz7,"That's an awesome mindset my friend. I am (was) almost same as you but a little bit different. I was 19 fresh outta college learned basic programming commands, got looped into tutorial hell, I got extremely good at copy pasting codes and kinda thought I knew everything. Then got bored and switched to CyberSecurity and Networking. worked in that field till COVID after that I completely left the computer field and tried other jobs out. After years of experiencing other jobs I've figured out that I am built for this. I do it for hobby, I don't give a crap if they hire me or not the future looks dark anyways in any field you wanna put your feet in. They wanna pressure the working class anyways. My heart blooms for computer science, i don't care that much about income. You can get rich but almost doing anything you succeed at!I never again take a look at any tutorial at all. I think what I wanna do with my program and think how to communicate with the PC itself without AI. I use AI only when I don't understand a single word. I go to libraries spend hours just trying to understand why and how the code works and how do the data structures work, if, functions, loops and made my first very basic GUI model on python. YOU HAVE TO WRITE CODE IN ORDER TO GET GOOD AT IT. STOP WATCHING YT TUTORIALSI will never EVER look at tutorial HELL LOOP ever again. Just read and write read write till you finally grasp ideas and make your brain think like a PROGRAMMER.",Both-Dragonfruit3154,2026-04-11 10:25:38,11,learnprogramming,t3_1sif0y3,False,
ofjlncv,"honestly best mindset. hobbies are way more fun once you drop the career anxiety. and yeah, finding dev jobs now sucks.",bootyhole_licker69,2026-04-11 10:09:56,11,learnprogramming,t3_1sif0y3,False,
ofkwv6k,"I'm a legal researcher/associate for a small company. My work itself doesn't require coding but I'm self learning to make my legal work easier. I learned to create basic python scripts to merger, convert, format large number of documents (because I don't have access to Adobe and my work device can't even convert pdf to docx through ""save as"" for some reason or merge without fucking up the format)",Own_Egg7122,2026-04-11 15:01:45,5,learnprogramming,t3_1sif0y3,False,
ofjn0ep,"I think that's a healthy way to get into it. When you remove the job pressure, coding becomes tools to build, automate, and experiment. Even with AI changes, being able to write small scripts, automate tasks, or play with Linux/Pi is still useful and fun! Learning it as a hobby definitly makes it more sustainable long-term than forcing it",mcidclan,2026-04-11 10:21:42,5,learnprogramming,t3_1sif0y3,False,
ofjshao,"I feel like I do a lot more coding than my friend that does it for work while I do it for fun. I’m sure I have a lot more personal projects than him. My job has almost nothing to do with coding, but I made lots of tools to make my job easier as well for my side hustles. I think getting paid for it might take the fun out of it.AI still makes lots of mistakes and it really takes a coder to be able to catch them, so I don’t see AI taking programming jobs. I see it as just a tool for programmers.",Conscious_Bank9484,2026-04-11 11:06:00,4,learnprogramming,t3_1sif0y3,False,
ofjniml,That's me. I'm learning Python just to learn it,nicodeemus7,2026-04-11 10:26:02,3,learnprogramming,t3_1sif0y3,False,
ofjzofk,"me, im learning stuff that wont get me employed (low level concepts and rust) and building projects that serve zero practical purpose other than me finding it super cool (TCP from scratch)",ParadiZe,2026-04-11 11:57:23,3,learnprogramming,t3_1sif0y3,False,
ofk55b3,100%. I think we forgot somewhere along the way that coding can just be... a hobby. Like woodworking or gardening.,Ok_Assistant_2155,2026-04-11 12:31:49,3,learnprogramming,t3_1sif0y3,False,
ofzigx7,"Reading AI code is kinda different experience than human senior code tbh. AI usually writes very clean and predictable patterns but it lacks the ""why"" behind certain decisions that you get from experienced developers Senior devs will leave comments about edge cases they discovered, weird workarounds for specific bugs, or architectural decisions that came from years of maintaining similar systems. AI just follows best practices without that context of real world pain points I'd say do both - AI code is good for learning clean syntax and common patterns, but reading actual senior code in open source projects will teach you more about problem solving and dealing with legacy systems",Neat_Fisherman9331,2026-04-13 18:25:19,53,learnprogramming,t3_1skj7bs,False,
ofzigbt,"In my experience, AI currently writes intern level code.You can definitely learn things from interns, especially when it comes to basic syntax and usage of unfamiliar APIs and such, but I would not want to study an intern's architecture and approach as a gold standard.",high_throughput,2026-04-13 18:25:15,50,learnprogramming,t3_1skj7bs,False,
