id,body,author,created_utc,score,subreddit,parent_id,is_submitter,distinguished
otmjx5o,"Congratulations, im happy 4 u and wish u more success",tek_toniq,2026-06-24 23:34:13,1,dataengineering,t3_1udra7h,False,
otopx1y,Brother Jerry rigged sharepoint shit apparently occurs in billion dollar oil companies you’ll be glad to discover:loudly_crying_face::loudly_crying_face::loudly_crying_face: I had to do the whole power automate shit the same way in a company that has databricks warehouses custom web apps whatever tf u name it. I think this industry is Jerry rigged shit,30-m-0-xo,2026-06-25 08:02:24,1,dataengineering,t3_1udra7h,False,
otxsw2d,I love this for you! I am so excited for and keep up the perseverance. It fuels hope. I am just starting my new journey and it feels all so daunting but share inspired me.,Party_Guava_1241,2026-06-26 14:30:50,1,dataengineering,t3_1udra7h,False,
oti4wm4,"Who tells you that mistakes are not really affordable in big companies? They have a lot of money to afford mistakes, like a whole lot more than smaller companies.They just can't afford mistakes at scale.",Illustrious_Web_2774,2026-06-24 11:00:01,110,dataengineering,t3_1ue9v6z,False,
otir0z4,It’s all vibe coding.,kjmerf,2026-06-24 13:10:31,77,dataengineering,t3_1ue9v6z,False,
otj0ylg,I was at meta and was laid off last month. Almost zero self written code for data engineers.,BarbaricBastard,2026-06-24 13:58:50,70,dataengineering,t3_1ue9v6z,False,
otj71ic,"I do write code when doing changes in large complex systems when AI still not good at doing right stuff. Using AI when it does help. Management supportive of AI effort, but in the end they don't care if it was manual or AI code, just that it works as expected.",mad-data,2026-06-24 14:27:17,20,dataengineering,t3_1ue9v6z,False,
otpt35j,This thread is incredibly depressing,PossibilityRegular21,2026-06-25 12:41:05,10,dataengineering,t3_1ue9v6z,False,
oti2vzc,"At my last job (not big tech but a decent sized product company) the expectation was still very much that you understand every line going to prod, AI or not. Engineers who just shipped AI output without reviewing it properly got burned pretty fast when things broke in weird ways I think the ""velocity"" push is real everywhere right now but big tech tends to have enough incident history to know that moving fast in the wrong place is expensive. so code review culture there is probably stricter than at startups, even with AI in the loop",NoticeOutside854,2026-06-24 10:45:44,7,dataengineering,t3_1ue9v6z,False,
oti2xye,"code writing is very less , but we all develop the archietecture ourselves , the flow of data , the ai just implements the logic and archietecture",SignalForge007,2026-06-24 10:46:08,9,dataengineering,t3_1ue9v6z,False,
otj7s51,"I'm writing majority of code by myself. Coding isn't a bottleneck for me, understanding a problem is (and an agent won't help you if you cannot explain exactly what the problem is/what is it you want to code). I feel like I also learn more, by trying firstly to solve a problem by myself, instead of turning to an agent instantly. However, I imagine that if I would develop same things over and over, I will be more inclined to use help of some agent. There is no learning in that",Informal-Teacher1059,2026-06-24 14:30:40,13,dataengineering,t3_1ue9v6z,False,
oti37qi,"Maybe 3% of the entire code I ship is manual. This mostly includes a certain naming convention I want to follow for naming variables, remove some of the bloat, update some comments with more context, etc.Our company tracks AI code acceptance rate so we kind of have to get the code generated by mostly AI for the metrics lol.And this is okay. As long as you spend time to understand the code AI has generated, you should be okay. The codebase is getting huge, and so are the expectations.I have a specific Claude skill for code reviews based on patterns that I look for in a review. I have shared this skill with my developers so they can fix those before it is routed for my review.",hardik1399,2026-06-24 10:48:03,5,dataengineering,t3_1ue9v6z,False,
otiaud8,Harness coding with spec. Not vibe,Eric-Uzumaki,2026-06-24 11:39:28,20,dataengineering,t3_1ue9v6z,False,
osualto,Yes.,rotzak,2026-06-20 22:13:38,61,dataengineering,t3_1uaxjf6,False,
osum1ux,"I love Linux and haven't used Windows in years. Don't swap Windows for Linux just yet, just because it doesn't seem fully necessary based on what you said.Use WSL2 until it doesn't work. Use a VM until you need more resources (or until you're familiar or love Linux).You can swap, but go to Linux Mint or Pop OS imo.But honestly, without hearing more, you probably don't need to switch.",paxmlank,2026-06-20 23:19:53,23,dataengineering,t3_1uaxjf6,False,
osu4otx,"I am a Data Engineering Manager. My home setup for messing around with DE tech is a homelab server running Ubuntu Server which i use to run docker containers of different DE tools like Postgres, Airflow, DBT etc... Then my main desktop that I use daily is Nobara.",MocDcStufffins,2026-06-20 21:42:04,18,dataengineering,t3_1uaxjf6,False,
osu1dp7,Look up WSL. Use Linux from within Windows.,FirstBabyChancellor,2026-06-20 21:24:44,56,dataengineering,t3_1uaxjf6,False,
osuatf3,I run arch but honestly any linux distro is great and will teach you more about OS than windows.,KarmaIssues,2026-06-20 22:14:49,7,dataengineering,t3_1uaxjf6,False,
osuoi84,I just use a Mac and ssh where I need to. Only shitty programs that don’t work and Microsoft vba ones but I can run an ARM VM for windows.,Rodeo9,2026-06-20 23:34:48,7,dataengineering,t3_1uaxjf6,False,
osuk1w0,"I use Pop OS; it just works. But tbh WSL should be sufficient for most tutorials. But switching to Linux will definitely help with practicing Unix commands, understanding file permissions, and understanding binaries and where they are stored, etc.You could also try GitHub CodeSpace, which provides a small Ubuntu machine.Hope this helps.",joseph_machado,2026-06-20 23:07:50,5,dataengineering,t3_1uaxjf6,False,
osw7ck7,"In my experience, for complex setups, Linux VMs work best.I wouldn't switch my personal computer for Linux unless its dual-booted with Mac/Windows, because you may find yourself needing to do other things on your computer that are incovenient on Linux (like using Office products, etc).",yeledtov21,2026-06-21 05:44:20,4,dataengineering,t3_1uaxjf6,False,
osu6910,"While WSL is a good middle ground. Do yourself justice by switching over entirely to Linux,Fedora is a good start. This will in a way force you to get comfortable with the command line. You might not use unix shell scripting in data engineering directly, but getting used to it, will build the muscle memory and intuition to working with code and you will be able to navigate remote servers easily.",wierdAnomaly,2026-06-20 21:50:25,8,dataengineering,t3_1uaxjf6,False,
oswwd68,lol no-one uses Windows in development.There's no reason messing around with WSL2 when you can learn more about your actual production environment by using Linux directly.,xmBQWugdxjaA,2026-06-21 09:20:05,8,dataengineering,t3_1uaxjf6,False,
otm87kt,"Use Declarative Automation Bundles (DABs) to define your Databricks assets as code. Once you’ve defined your jobs, clusters, dashboards, etc. as code, it becomes trivial to deploy your assets to workspaces using the CLI. And then once you’re building automated products, you can use GitHub Actions to create a true CI/CD process that automates DAB deployment to higher environments such as QA and prod.",TRBigStick,2026-06-24 22:34:30,61,dataengineering,t3_1udvgfo,False,
otm6jmq,"Look into databricks connect if you want to develop code locally, personally i prefer developing locally with code assistants, pushing to git, and then running it in the databricks UI for data frame visualization.Within databricks jobs, you can use a python or wheel task type if you would like. Unless the job requires pandas, id also leverage pyspark dataframes if possible, and sizing the compute based on whats needed for the job, start with the smallest cluster and size up if needed. Workspace deployment can be handled with Databricks Asset Bundles for ci/cd.",loganickert,2026-06-24 22:26:35,23,dataengineering,t3_1udvgfo,False,
otninw0,"DataBricks can connect to a git/bitbucket repo and the jobs can run the notebooks/py files in that repo. You can develop locally using that repo and push it back to the main branch.DB Genie is kinda cool. And if it is a notebook, DB notebook UI is so much better than the VS Code IDE.Since it is just thousands of rows, Panda is the right way to manipulate the data before converting to pyspark for database write. Manipulate such small data set using pyspark is overkill given DB auto scale the compute clusters to add to the cost.",VDtrader,2026-06-25 02:47:19,7,dataengineering,t3_1udvgfo,False,
otmsp65,I use DABs. I see a lot of people using the GitHub link method (not me personally). Just tell them what they’re doing wrong. Tell them how much money they’re wasting. Some higher up is gonna love you if you tell them you found a way to save thousands of dollars.,kenncann,2026-06-25 00:21:06,3,dataengineering,t3_1udvgfo,False,
otnexzl,"You can still do all of your dev locally. There’s a Databricks extension in VS Code and there are easy ways to sync the code to the workspace via CLI, Git, DABs. If you have to or want to edit code in the workspace you can also use Genie Code.If it’s mostly pandas processing and it’s not being parallelized then you could easily use a simpler compute model like serverless.",dwswish,2026-06-25 02:25:46,3,dataengineering,t3_1udvgfo,False,
otmpusu,"your concerns in order..\- check out genie code, it’s in browser \- check out serverless it’s more cost effective \- pandas will run on the driver only, so the cluster is a total waste, at least use pandas for spark",m1nkeh,2026-06-25 00:05:50,4,dataengineering,t3_1udvgfo,False,
otm19bg,"Assuming it is Pyspark job, we write the code in an external IDE and then test it using a feature branch. You can push the feature branch of a repo into Databricks and create a job based on it. Once done you can merge into production and create a new job based on that. Or you can go the extra mile to use Airflow to orchestrate the job instead of scheduling it in Databricks. You can also use Terraform to persist the job and its scheduling in Databricks.",Outside-Storage-1523,2026-06-24 22:01:00,1,dataengineering,t3_1udvgfo,False,
otmar10,"And besides the given answers you might want to look into the databricks sdk to replace the usage of dbutils, such that you can also run your code locally.  I guess that single node would do for most of your use cases, since Pandas does not make use of your workers and the scraping is also likely difficult to parallelize.",Pristine-Manner-3540,2026-06-24 22:47:08,1,dataengineering,t3_1udvgfo,False,
otmuujf,"Are these databricks specific things? Can't you wrong-size any non managed compute, expensively transform things, etc...It's true that genie is far behind the state of the art and databricks-connect is flawedBut most of your points are just people not knowing what they are doingEveryone that has permissions to create jobs should know how to read the spark ui, read the metric dashboard and know what it means.",Atticus_Taintwater,2026-06-25 00:32:47,1,dataengineering,t3_1udvgfo,False,
otn1zdi,"1. Development experience - use Databricks connect to develop locally in vscode. This way u can use frontier LLM to help coding. Then with this method, you will use their cluster with correct governance via UC. Use git too so that once you're satisfied with changes, cicd will be triggered which then run DAB/Terraform scripts to publish your changes. 2. Compute cost - gonna eat most of your cost, so have a separate dev vs prod cluster. Set the dev cluster lower than prod. Might as well use the lowest spec. You may also use serverless compute but pls test python dependencies and it's limitation first. My another hunch is that your superior wanted to lock in the future budgets for your team, so they just grab whatever they can now.3. Pyspark - I think it's a waste to use pyspark on thousands of rows. There's more efficient methods but that would require a lot of ""it depends"".",ppsaoda,2026-06-25 01:12:49,1,dataengineering,t3_1udvgfo,False,
otc2klu,Slow down. Make the jrs show their work. Supplement documentation.,Final-Quote-4064,2026-06-23 14:46:11,62,dataengineering,t3_1udj2rb,False,
otc4lbg,"Your job is to not over engineer and not show over engineering. Unlock their thinking when theirs is locked. The reverse also applies: if they have no clue how to proceed, teach them how to think in systems, and work with a top down rationale",Tough-Leader-6040,2026-06-23 14:55:14,25,dataengineering,t3_1udj2rb,False,
otcqgal,Mostly just creating documentation and low level design choices.I used to like fancy things a lot before but now just prefer simplicity.Also cost and space optimisation is a big part.,PR0K1NG,2026-06-23 16:30:43,23,dataengineering,t3_1udj2rb,False,
otfxozc,Empathy and guidance and giving chance to let the juniors shine.,addictzz,2026-06-24 01:23:23,6,dataengineering,t3_1udj2rb,False,
otcivh3,"One of the harder parts as you become more senior is deciding what you should do yourself vs. what you should delegate. Trying to set the others up for success while guiding them towards solutions that follow best practices, and removing roadblocks that they can’t manage themselves is a good default strategy. Also, don’t be afraid to push back and ask for rework if a solution doesn’t seem right, but be sure the reason is well justified and can be explained, not just because you like your idea better.",terencethespider,2026-06-23 15:58:03,3,dataengineering,t3_1udj2rb,False,
otc4su6,"Make your mid level and junior engineers your top priority if they need help. Sometimes you’ll be heads down trying to implement something, but it’s more important that you make sure everyone else is productive than to be productive yourself. Don’t assign yourself the most time sensitive tasks so you can drop what you’re doing and help your people get their work done.",FunContest9958,2026-06-23 14:56:10,5,dataengineering,t3_1udj2rb,False,
otct55s,Test.,Thwarting8139,2026-06-23 16:42:12,1,dataengineering,t3_1udj2rb,False,
otcwnvp,"As a senior data engineer, one thing I do that makes life easier for my team is documenting processes that I know they will struggle with. For example, if I am testing out a new integration, I outline the steps, so they can easily reference. Other than that, just being willing to help them when they need it. I get a lot of requests to review scripts or help troubleshoot why something is failing. When I can, I try to take the time to walk through it with them instead of just fixing it for them.",MerryNibblers,2026-06-23 16:57:11,1,dataengineering,t3_1udj2rb,False,
otupw7y,Ask questions and try to learn as much as possible. Find good mentors you connect well and observe how they approach problems.,Honey-Badger-12,2026-06-26 02:30:19,1,dataengineering,t3_1udj2rb,False,
otch9rq,If you need tips to be a senior you should not be a senior.,dasnoob,2026-06-23 15:51:04,-23,dataengineering,t3_1udj2rb,False,
otqh1ed,"You can find a list of community-submitted learning resources here: https://dataengineering.wiki/Learning+Resources*I am a bot, and this action was performed automatically. Please [contact the moderators of this subreddit](/message/compose/?to=/r/dataengineering) if you have any questions or concerns.*",AutoModerator,2026-06-25 14:33:35,1,dataengineering,t3_1ufbrj1,False,moderator
otqmmz9,"Stop working 10+ hour days and weekends for people who literally refer to you as 'and others'. You are burning yourself out trying to force a tangible contribution for a VP who is actively and deliberately freezing you out. Do your 40 hours, document every single roadblock they put up, communicate it to your supportive manager, and log off.",Striking-Ad2025,2026-06-25 14:58:00,97,dataengineering,t3_1ufbrj1,False,
otqjx45,Woah woah woah woah. There is an urgent rebuilding of the architecture!?? That’s a big yikes. Maybe go over to r/womenintech as they might be able to help you more over there.,nonamenomonet,2026-06-25 14:46:11,33,dataengineering,t3_1ufbrj1,False,
otqkzux,"Hi, solo female here. Im the only female engineer at my company and I deal with this daily. Unfortunately we women not only have to do our job but also prove we can do it and it truly sucks when men around us, no matter what, still deem us incapable.When I ask questions, most of my male counterparts jump to the assumption that I wasnt listening or I dont know. So, when they lead the answer with that assumption, I quickly and professionally correct them.Heres's an example (really has happened) -Me: I'm sorry can you repeat that?Them: It would be helpful if you listened instead of continued working through the meeting.Me: You assumed I was not listening when I'm simply asking bc your mic cut out. Please repeat what you said. This follows a communication technique called DEAR MAN. I highly recommend you look it up and start practicing it. It has helped me greatly. It helps you set boundaries for how you are treated. Remember, stay neutral and stick to facts. Always document so if one of these men cant handle your communication, you have the facts to back up your actions.",Rude_Pie5907,2026-06-25 14:50:55,26,dataengineering,t3_1ufbrj1,False,
otrcwxi,"Sounds like you have three key problems here. First, is lack of experience. Second is being female dealing with a team that is male-centric. Third, is the department or company is measurably immature in processes and culture.The first two are somewhat interchangeable for the blame for you not being included and having trouble getting the information you need to do the work. I'm not sure it is worth the effort to disentangle to two; regardless of what is the larger reason, you aren't receiving the information you need and appear to be actively excluded from the places where you could address that yourself.Additionally, the VP departure and not having a PM until a month ago are big red flags regardless of seniority or gender. I don't think you have the experience, seniority, or clout to work on fixing this however.In short, as described, you are in a position where it is highly likely that you will fail along with the rest of the project. It should not fall on you - juniors should not bear the brunt of failures of large projects. But, you will want to protect yourself, the team you are a part of, and your manager.If it doesn't exist, you need a workstream work plan that matches the schedule for the overall project, has the milestones you need to hit to be successful, and the required inputs need to get called out for when you need them complete and available. This needs to be done at the team level, not your individual level.Your manager needs to own this, and push it forward in their level meetings, and you have to use it to justify the asks that you make. Document what you've done to get that information, the delays and failures in it being made available, and escalate after each delay or failure.To help get the work done, don't just ask and sit back. Get to know the people from other teams that are in the meetings you are and should be invited to. The rank and file, not just the leaders. Try to find out who should be putting together what you need, and reach out to them to see if there is anything you can do to help them get it to you (document it, but like the rest, don't make a point of showing everybody you are documenting).I would say our industry is a lot like others. There are good places to be a woman and bad places (and ones in between). If you look around and the other women in the company are having the same challenges you are, start looking for a new position. There are companies where your gender is at worst neutral to getting the work done and there are some actively trying to advance women to higher levels of leadership and responsibility.",exjackly,2026-06-25 16:48:51,5,dataengineering,t3_1ufbrj1,False,
otqvp0p,"Sounds like your time is better spent elsewhere. I see this in my workplace and it sucks. Shout out to our best dev and now architect, she changed how I approach problem solving. Document, document, document. Show up when you’re invited and pitch in when it’s your area of expertise. Openly challenge when either youve been named as doing “X” and not actually involved or communicated with, use LLMs to corpo speak it. Echoing other comments, stop doing 10+ hour days and do work you want to do and can show value for when doing so, especially to your supportive team and manager.",ParanormalProse,2026-06-25 15:36:58,4,dataengineering,t3_1ufbrj1,False,
otqwyi3,"I am a woman and the VP of engineering that I worked for was very similar. When he first joined he kept calling me a Jr Engineer when I had 6 years of experience under my belt. I felt he was deliberately giving interesting projects to others. My last straw was during a meeting with another coworker where there was a misunderstanding he said something like ""Oh dear you have to be more attentive."" My jaw was on the floor and I took him to HR. Several women actually took him to HR over the years. In my current company I noticed people are leaving my female manager out of meetings because the other people find her too direct and confrontational. We all have agendas, my manager prefers to lay it all out like it is and others like ambiguity and doing things their way without structure or rules. Best thing to do is call it out and record conversation. These are the soft skills needed in engineering, most of the time we are knee deep in code and in our laptops but communicating with others is also incredibly important.",roastwildflowersea,2026-06-25 15:42:14,4,dataengineering,t3_1ufbrj1,False,
otqo8m7,Hello fellow data girly! That sucks you find yourself in this situation and my advice might sound counterintuitive but this is what has worked for me in the past. Pretend that this isn’t happening because of your gender. Meaning don’t let the anger get in the way of you getting your job done. Keep proving your worth to your team and they will continue to advocate for you and do their best to shine a spotlight on your work. Document everything! Not only their actions but everything you do for the team so that when you write your annual review it reads “I accomplished this this and this despite struggling with communication with leadership with this and that example provided”. Keep your resume updated and grow your network so you don’t have to work for these jerks forever!,is_a_butt,2026-06-25 15:04:57,10,dataengineering,t3_1ufbrj1,False,
otqtxwe,"i can't speak to the gender related issues but I (failed to) navigate a job with similar shittiness and it culminated in my sudden firing. i'd look for something else, and good luck to you either way.",zazzersmel,2026-06-25 15:29:28,6,dataengineering,t3_1ufbrj1,False,
otr1vc9,"Hi, I've been in data engineering for 5 years now and am usually both the youngest and only woman on the team. The one line in your post that stuck out to me, is that you describe yourself as passive. This is something you need to work on. Women struggle with passivity in general, but in these environments especially it's very important to stand up for yourself and be confident. You need to be direct, if you're being left out of meetings, confront those people (professionally, of course). When you answer questions, don't use unsure language. With that said, if you are very early in your career, you may just need more time to build that confidence.",MerryNibblers,2026-06-25 16:02:40,7,dataengineering,t3_1ufbrj1,False,
ot664zc,None of us have anywhere enough information regarding your specific situation to tell you what to do. Why don't you bring up your career progression as a topic in your next one-on-one meeting with your supervisor.,Eleventhousand,2026-06-22 18:04:47,38,dataengineering,t3_1ucqbuk,False,
ot6enik,"I would leave, team work really makes you learn a lot more and improve faster and wider, also if you have people with seniority higher than yours",greenestgreen,2026-06-22 18:40:58,8,dataengineering,t3_1ucqbuk,False,
ot6w5u4,"I wouldn't worry so much about YOE differences. You'd have to bring it up with your VP in 1:1s; if they are receptive, great. If they drag their feet for 2 cycles, it's better to move.",joseph_machado,2026-06-22 19:56:45,6,dataengineering,t3_1ucqbuk,False,
ot6sfn0,Discuss career progression plans as well as processes and approvals for promotions and raises in general with your manager,Yuki100Percent,2026-06-22 19:40:23,4,dataengineering,t3_1ucqbuk,False,
ot7qfce,"Quality over quantity. 6 quality years is better than 10 AFK years.But yea, I agree with most everyone else. Try to stay in a team. Try to stay in an environment where you are not the smartest person in the room. For growth purposes. Unless you are at a phase where you are 'resting and investing'.",Spunelli,2026-06-22 22:17:06,1,dataengineering,t3_1ucqbuk,False,
ot7xjgc,You leverage the experience you have gained by being the solo de in xx domain and find a new job that pays more.,CorpusculantCortex,2026-06-22 22:53:37,1,dataengineering,t3_1ucqbuk,False,
