id,body,author,created_utc,score,subreddit,parent_id,is_submitter,distinguished
og7pmm5,So you worked at a company for 2 years with no pay???,Illustrious-Film4018,2026-04-14 21:44:02,3,cscareerquestions,t3_1slf1ot,False,
og7ar74,It's all about key words. Everything goes through AI now so you have to hit the right words. I completely re did my resume. I gave AI my old one and then just started rambling about what I did at each job. Then I let AI pick the key words. I'm a little worried it's overselling me but AI did the translation and has a better grasp of the new terms than I do. I come from the data side and the best example is data pipelines. It sounds new but if you've loaded fact and dimensions you've technically built pipelines. I suspect the people not getting any interest from recruiters need to update the terms and skills somehow. Edit: I should add that I'm going back to the office 4 days and I suspect it was a big factor in getting this position vs the national remote jobs I couldn't even get past the recruiter due to hard requirements,SoggyGrayDuck,2026-04-14 20:35:28,4,cscareerquestions,t3_1slf1ot,False,
og7yzdb,"I’m going to get downvoted to hell for this…But 20 years in the industry means you’re a senior. Seniors are in very high demand right now. If even the dozens of coworkers you’ve had during your 20 year career won’t hook you up, I think the problem is not the market…",lambdawaves,2026-04-14 22:31:51,6,cscareerquestions,t3_1slf1ot,False,
ogqyv1u,they wanna hear that you let claude write the code for you and that you work on 4 issues in parallel. now do what you want with that information.,pecp4,2026-04-17 17:20:34,59,cscareerquestions,t3_1so7725,False,
ogqyah5,"""I use AI to maximize shareholder value"".Jokes aside, it's a terrible question and I definitely want to know what interviewers expect when asking this.",Best_Gynecologist,2026-04-17 17:17:58,100,cscareerquestions,t3_1so7725,False,
ogqy358,I used Claude code to vibe code some wow addons,Magnumwood107,2026-04-17 17:17:03,67,cscareerquestions,t3_1so7725,False,
ogr6lyl,"honestly the best answer i've found is just being specific about your actual workflow. like ""i use it for first drafts and rubber duck debugging, but i own the final output"" lands way better than vague stuff about ""boosting productivity."" interviewers want to hear that you're thoughtful about it, not that you use it for everything.",Miamiconnectionexo,2026-04-17 17:55:26,17,cscareerquestions,t3_1so7725,False,
ogra160,"Say ""just a second"" and type the question into ChatGPT. Then read off the answer.",00rb,2026-04-17 18:11:10,15,cscareerquestions,t3_1so7725,False,
ogqzsu0,"""I wouldn't say I use AI. More like AI uses me. I run 700 agents 24/7 and meet with them twice a week to check in""",Sulleyy,2026-04-17 17:24:50,27,cscareerquestions,t3_1so7725,False,
ogqzjtz,"My two cents is they're trying to figure out how to use it effectively themselves by asking everyone they can, cus they're about as insecure about it as you might be feeling in those interviews /shrug",lhorie,2026-04-17 17:23:42,21,cscareerquestions,t3_1so7725,False,
ogr1htr,"Kinda related, but I like to ask how they’re using AI. You’d be surprised by what different places say…",HappyZombies,2026-04-17 17:32:26,7,cscareerquestions,t3_1so7725,False,
ogre2fu,"I talk about how the time I redistribute the time I save on writing code to doing the real engineering work with thorough architecture+design and proper testing. On top of overall improving the quality of systems I make from stronger upfront investments, coding agents work best when you've refined your design, have a detailed plan for how to implement it and quality tests to verify the result.That typically lands well. Many are worried about hiring vibe coders who are lazy or unskilled. It helps to emphasize that you're working hard as ever, but are able to more optimally allocate your effort toward the highest impact aspects of the job that most require your expertise.",AlignmentProblem,2026-04-17 18:29:59,4,cscareerquestions,t3_1so7725,False,
ogr10je,"But you see, Mr. Interviewer, asking what Ai does in my day to day work prematurely narrows down the solution surface.",Ligeia_E,2026-04-17 17:30:16,3,cscareerquestions,t3_1so7725,False,
oggswfr,"Checking out other resumes: for project inspiration, to check the competition that’ll make you feel dumb, and learn where to strengthen your skill set. Narrow your focus to one thing like DevOps and build around that one thing! I did not build these, they are common tools that can help: As far as projects check out roadmap.sh it’s what I use. And for System Design & DSA in small spurts codenexus app. Then keeping that resume, LinkedIn, and website polished",WTFIZGINGON,2026-04-16 05:07:24,8,cscareerquestions,t3_1smtu46,False,
oggtm3k,"The trap you are in is common and it has a specific solution. You are treating ""stay technical"" as a side project that requires hours of free time you do not have. It does not have to be that. The actual skill you are losing is not technical knowledge. It is technical VERBAL fluency. You can know how a system works and still struggle to explain it under interview pressure. Those are different skills and they are trained differently. What works in the time you actually have: Daily micro habit, 10 to 15 minutes. Read ONE technical article or architecture breakdown per day (High Scalability, ByteByteGo, InfoQ) and summarize it out loud to yourself in one minute. You are training the muscle of talking about systems clearly. After 3 months you will notice your vocabulary and framing has changed even without building anything new. Weekly structured thing, 60 to 90 minutes. Pick ONE topic (e.g. ""database indexing"" or ""load balancing"") and do one of three things: (1) explain it to a rubber duck on video and watch the video back, (2) write a short LinkedIn post about it, (3) have a technical friend ask you questions and answer them live. This is the closest approximation to interview practice without needing an actual interview. Interview prep, 2 to 4 hours per week when actively searching. Not leetcode grinding. Mock interviews with specific focus on explaining, not solving. Pramp and [Interviewing.io](http://Interviewing.io) give you real practice with other candidates or engineers. A single mock interview per week is worth 10 hours of solo leetcode for the specific problem you described (fumbling the verbal part). Project work is honestly optional for your stage. You do not need a flashy portfolio to get interviews. You need the stories you already have from your day job to land cleanly in conversation. Spend the time sharpening how you tell those stories, not building new side projects. The hidden truth of tech interviews at senior new grad level: the technical depth is usually fine. The delivery is what tanks most candidates. You can fix delivery with 1 to 2 hours a week if you aim it at the right target.",Substantial_Baker_80,2026-04-16 05:12:50,87,cscareerquestions,t3_1smtu46,False,
oghqjos,What roles are you applying for? I am a former recruiter and a FE developer now. I am happy to schedule a free mock interview with you if you want. But I am a FE so not sure if I can help much if you are applying for a backend specific roles. Otherwise -> chat gpt is your friend. There is an option to call chatgpt and ask for a mock interview. That will allow you to practice speaking about tech concepts.,Charming_Part_3713,2026-04-16 09:58:58,5,cscareerquestions,t3_1smtu46,False,
ogjbbly,> Just wondering how others do it? day job is *not* in tech? That's what makes it hard. I try and limit my 'industry catchup' time when i have onclock downtime. Waiting on builds/pipelines/etc when I don't have the mental capacity to start/monitor *another* agent on a new task.,w0m,2026-04-16 15:17:32,2,cscareerquestions,t3_1smtu46,False,
ogl2mlv,"Me and all my friends who job hop around higher paying tech companies are not interview prepping as a full time job. They'll do it 1 or 2 hours a day, a couple days a week over a month or two. If they're really dedicated, you can start soft quitting your job at work - you'd be surprised at how slowly people catch on when you take your foot off the gas and reduce your workload by ~20%A better question is, what exactly are you so lacking in that you need so much time to prepare for in an interview?",PlasticPresentation1,2026-04-16 20:00:14,2,cscareerquestions,t3_1smtu46,False,
ogkd267,"Interview a lot, even when you don’t need to be, and it will become a lot more clear how you can solve this problem.",GrayLiterature,2026-04-16 18:03:48,1,cscareerquestions,t3_1smtu46,False,
oglfn8z,"honestly just keep a small side project alive the whole time, even if you only touch it once a week. that way when an interview drops you have something fresh to talk through and the technical muscle memory comes back way faster.",Miamiconnectionexo,2026-04-16 20:59:59,1,cscareerquestions,t3_1smtu46,False,
oggtg7n,"ah well, I most meant literally timewise.Like, I need to go shopping this evening. That's an hour. Then I need to cook dinner. That's an hour. I also need to do washing, fold washing, make some appointments for other things. I usually meal prep so I am not cooking every night, but there is always a lot to keep on top of, and as mentioned I have non-negotiable responsibilities such as ""dependants"", (not quite, but close enough).I also don't earn enough to outsource chores/repairs to a service, I have to sort everything myself, like repairs around the house for example.",Complex-Beginning-68,2026-04-16 05:11:36,5,cscareerquestions,t1_oggswfr,True,
ogguaom,"This is genuinely so very helpful, and perfectly describes the issue I have, which I think must have stem from never discussing tech shit. I could tell you in 10,000 different words how to disassemble parts of a car, can't for the life of me easily describe how my code works or something, lol.",Complex-Beginning-68,2026-04-16 05:18:08,12,cscareerquestions,t1_oggtm3k,True,
ogiqr1f,"FYI, This is an ad :face_vomiting:",EntropyRX,2026-04-16 13:43:15,39,cscareerquestions,t1_oggtm3k,False,
ogyte60,"They haven’t graduated/finished bootcamp/transitioned yet.CS as a college major/career path was not always hot. For the late 2010s and early 2020s, it became the default major for every single 18 year old that didn’t know what to do with their life but just wanted to make a lot of money. It was the number one career for adults who were burned out at their job and wanted a change/make more money.",vwin90,2026-04-18 21:22:27,207,cscareerquestions,t3_1sp9p6f,False,
ogyusux,"The number of graduating cs majors went from like 3k to 5k per year right before COVID, then up to about 10-12k now. The market needs about 4k.",CardboardJ,2026-04-18 21:29:45,56,cscareerquestions,t3_1sp9p6f,False,
ogyt9a0,Are we actually at pre-Covid levels yet? My company has more engineers now than it did 4 years ago,BeauloTSM,2026-04-18 21:21:44,34,cscareerquestions,t3_1sp9p6f,False,
ogyt5rw,"First of all that 50% figure you keep bringing up - that’s not just SWEs, that includes tons of other staff such as PMs, HR, Sales, all sorts of middle managers etc etc. Pre-Covid those people worked at other companies, possibly even in other industries entirely. Or they were young and still in school. CS became a magnet for a lot of people with $ signs in their eyes.You do realize that Meta and other Big Tech companies are not the only corporations in the world, right?",Old-Possession-4614,2026-04-18 21:21:13,63,cscareerquestions,t3_1sp9p6f,False,
ogytyps,Universities ramped up number of new CS graduates + A lot of non tech people joined tech during the boom.For decades tech companies have been growing really fast as they expand into new spaces. Now the growth is much harder with most fields saturating. After all there can only be so much ad revenue and most of these companies were reliant on it.,Advanced_Poet_7816,2026-04-18 21:25:24,16,cscareerquestions,t3_1sp9p6f,False,
ogz2x0u,"not exactly, pre-covid hiring was still competitive but the market was more balanced. covid created artificial demand because every company thought they needed to digitize everything overnight, then overcorrected with layoffs when growth slowed. the bootcamp wave just made the current situation worse by flooding an already shrinking pool.",Miamiconnectionexo,2026-04-18 22:13:52,7,cscareerquestions,t3_1sp9p6f,False,
ogyszv4,"Well more than just hiring levels changed since then, the 2 biggest changes to happen are AI and the end of ZIRP financing. Obviously AI makes code gen super cheap, prior to AI many jr's were code monkeys who really understood syntax and that was pretty much it. But the bigger reason as to why many companies have shifted resources, is that startups and businesses can no longer get interest free loans from lenders. Before they were incentivized to spend on engineering no matter the cost, now with zirp gone they have to prove revenue and profitability. The market fundamentally has shifted since then, like sure the current market might be a correction in some way. But it is a correction + AI impact + end of ZIRP.",Dill_Thickle,2026-04-18 21:20:21,15,cscareerquestions,t3_1sp9p6f,False,
ogyumia,lol when I got into CS around 2016 I would hear stories about people graduating with no internships and working at Geek Squad. When I started I made sure I focused on getting internships because I was scared of not landing a job.,Prof-,2026-04-18 21:28:50,11,cscareerquestions,t3_1sp9p6f,False,
ogyukpd,"Well first off we are already at pre COVID levels and have been for quite some time now. But to answer your question, they hiring boom made SWE seem like easy street to a high paycheck and easy day to say life. And it was for a while. So a LOT of people started getting CS degrees. There are now SIGNIFICANTLY more SWE on the market than there were before.",dllimport,2026-04-18 21:28:34,6,cscareerquestions,t3_1sp9p6f,False,
ogyvpmf,Not nearly as many folks pre-COVID wanted to become software engineers. We produce far more CS graduates than there are spots available for them.,kevinossia,2026-04-18 21:34:38,3,cscareerquestions,t3_1sp9p6f,False,
ogtwz12,"Just play along with it, keep learning and keep your earning, but start looking for another opportunity, after 8 months, just left. Build savings first, and reduce suspicion from HR. Grass always greener, but at least try to get his heart, and probably push an idea, and you are good.",BenL90,2026-04-18 02:46:44,60,cscareerquestions,t3_1solexb,False,
ogudewm,">The worst part is this manager likes to look busy to leadership or likes to play games. He'll move meetings consistently, eventually, canceling it all together. I was really surprised this kind of stuff happens at a mature large company.If only you knew how bad it really is.",Ornery-Address-2472,2026-04-18 04:42:21,15,cscareerquestions,t3_1solexb,False,
ogu2w5p,FWIW there are some people who thrive on teams like that. YMMV. It's fair to not like it but you'll need to stick it out for more than 3 weeks.,maria_la_guerta,2026-04-18 03:26:22,29,cscareerquestions,t3_1solexb,False,
ogtx3bk,"My manager reports to one of the directors of engineering who reports to the senior vp of engineering, and our standups consist of people in engineering, QA, and product. There's literally no possible way for my manager to get away with running things like that. Does your manager report to non-technical leadership?",BeauloTSM,2026-04-18 02:47:29,7,cscareerquestions,t3_1solexb,False,
ogtxe36,"With 14 engineers, there has to be some overlap. Try to have a subteam, you might make an opportunity for a project that you could lead there? 14 engs sounds like this manager would be a ""manager"" of 2-3 teams that own a vertical.",drugsbowed,2026-04-18 02:49:22,3,cscareerquestions,t3_1solexb,False,
ogugyg9,"Seems like my situation. Spaghetti code, very disorganized work, lack of documentation... But in my case, the biggest problem was a tech manager. Tech manager who has almost zero skills in OOP and design principles, doesn't know how to lead projects, and in general pretty bad coding skills. How was he promoted? Very simple, VP is also indian who tried to fire all white managers. I had to deal with that guy daily, and we would always argue because he wouldn't understand inheritance and design patterns and always would ask me to ""fix"" my code - basically converting it into Spaghetti code.I had no choice. I had to bomb our upper manager to change the team. The good thing is that he was able to change my team before he got fired by indian VP.It's crazy but that is how it is right now.",Fockewulf44,2026-04-18 05:09:18,3,cscareerquestions,t3_1solexb,False,
ogv2004,"honestly that feeling when you realize you traded a good team culture for a paycheck hits different after the honeymoon phase ends. give it a few more weeks before making any decisions, sometimes new environments just feel off at first. if it still feels wrong after 60-90 days, start quietly looking again.",Miamiconnectionexo,2026-04-18 08:10:28,2,cscareerquestions,t3_1solexb,False,
ogww7ie,"Indians at tech are all like this. This has been my experience with them. I’ve worked at FAANG, unicorn startups, no name start ups, and now at a tier2 tech company. They are ALL like this",they_paid_for_it,2026-04-18 15:37:38,2,cscareerquestions,t3_1solexb,False,
ogumjqw,"sounds like your post got cut off mid-thought, but team culture mismatch is real. sometimes a pay bump isn't worth it if the vibe is completely off. give it 3-6 months before deciding anything drastic though.",Miamiconnectionexo,2026-04-18 05:55:09,1,cscareerquestions,t3_1solexb,False,
ogv1j03,I can agree with your thoughts. I had the same situation sometime back but I could manage to move to another team. Hope all the best and try to ask for a team swap,jshalais_8637,2026-04-18 08:06:07,1,cscareerquestions,t3_1solexb,False,
ofr5juh,Is there time? Does someone above me want a RCA?,PotentiallyAPickle,2026-04-12 14:03:55,58,cscareerquestions,t3_1sjfcga,False,
ofr7v49,"The better engineers know where to draw the line. Always RCA doesn't make sense in a practical world. Repeated issues or anything that is capable of corrupted state, yeah it makes sense to do so. An internal tool that gets used a few times a day or a customer facing service in maintaining mode serving non critical data? It's whatever as long as it's fixed.",Late-Introduction707,2026-04-12 14:15:50,20,cscareerquestions,t3_1sjfcga,False,
ofr6g3x,It depends where you work and the engineering culture. At my current job -- literally never. If anyone puts up a PR without showing a convincing understanding of the issue they get called out immediately.,shinglee,2026-04-12 14:08:34,48,cscareerquestions,t3_1sjfcga,False,
ofr667r,"Always RCA, learn something to prevent it happen again and amortize the cost in the long run",lrascao,2026-04-12 14:07:07,27,cscareerquestions,t3_1sjfcga,False,
ofrrv9y,"""It works now"" is never valid. You can't guarantee that it will work for customers that way. Maybe it will keep randomly failing for some. You always need to know why it works.",Comprehensive-Pin667,2026-04-12 15:51:00,6,cscareerquestions,t3_1sjfcga,False,
ofr7ube,"I work in realtime-critical embedded signal processing/protocols software, we do RCA for problems above certain criticality/impacts. There are always new learnings from RCA e.g. miscommunication between developers and domain experts, lacking test coverage etc. The reason is, robustness is important in such domain.",badboi86ij99,2026-04-12 14:15:43,4,cscareerquestions,t3_1sjfcga,False,
ofr9nq0,My tech stack is such a clusterfuck of rotating door dev work along with changing systems interfacing with the main product I work with to the point even asking questions risks it not working anymore. I’d love to understand and/or fix it but at this point it’s just about keeping it breathing long enough to pass off to the next guy.,Empty-Employment-889,2026-04-12 14:24:40,3,cscareerquestions,t3_1sjfcga,False,
ofrg22b,Give yourself a set amount of time. If you go over the time then it was too complex for the company to care and move on to the next thing. As an engineer you have the obligation to spend your company's resources ethically.,TurtleSandwich0,2026-04-12 14:55:39,3,cscareerquestions,t3_1sjfcga,False,
ofry6ti,"It depends on the impact. Recently we had an event that caused our main site to go down for over an hour. Estimated losses where 20-30k in that time and that was only the direct financial and didn't include things like lost customer satisfaction. You bet we did a full RCA for thatMore recently we also had a bug that caused some customers to be unable to complete orders. Sounds bad, but incomplete others end up in a queue for later processing, so the impact is that they're simply getting delayed. Doing an RCA for that was considered not worth it",Loves_Poetry,2026-04-12 16:20:16,3,cscareerquestions,t3_1sjfcga,False,
ofsowbq,"“It works now” is the bar to resolve an incident, it can be as braindead as reverting to a previous known-to-work commit.RCA is part of postmortem process, after production is back to healthy. It doesn’t mean you have to *fix* the root cause right away (e.g. maybe it’s due to some assumption that is deeply embedded in the architecture that would take months to fix properly), but at least understanding it will allow you reason about potential ways to work around the core issue and how effective those workarounds may be and how pragmatically they can be prioritized.",lhorie,2026-04-12 18:21:58,3,cscareerquestions,t3_1sjfcga,False,
og9nt0p,"5+ comments on code is great. It means someone actually cares about the outcome and is helping you get better. You're a professional and not an imposter. Figure out what works for you and try a few things. Maybe break the mistakes you're still making up into categories and each time you submit a review, go through the checklist of categories to look for that bug type.",tcpWalker,2026-04-15 04:21:01,264,cscareerquestions,t3_1slvdl2,False,
og9oyie,"Code reviews are meant for people to make comments. It’s better to get that feedback than work with uncaring coworkers that just rubber stamp everything and then pikachu face when everything is on fire a year laterIf comments are about fundamental design issues, then you or your team may be missing some step earlier in your SDLC about design doc critique",lhorie,2026-04-15 04:29:17,106,cscareerquestions,t3_1slvdl2,False,
og9p0pl,"Most people don't get good feedback. It's not about your quality, you should value constructive criticism/discussion.",EnderAvni,2026-04-15 04:29:43,24,cscareerquestions,t3_1slvdl2,False,
og9xxaz,I get lowkey sus when my MRs have no comments. It's good that your coworkers (and hopefully you) care about code quality.,pukapukabubblebubble,2026-04-15 05:36:53,17,cscareerquestions,t3_1slvdl2,False,
og9o83l,You would’ve been pipped or warned by your engineering manager if this was a real problem. But I think it’s good to feel bad about this - try and see what you can do to prevent those issues from coming up in the next PR.I have a Claude code skill I make edits to periodically to review my own code with specific vectors in mind.,Namandaboss,2026-04-15 04:24:00,26,cscareerquestions,t3_1slvdl2,False,
og9vcl4,"I see 15 -> 5 is an improvement. And in many strong teams, even senior engineers get multiple comments. Real questions are: u making same mistakes ? The comments about serious issues or small stuff? Time to approval decreased ? Do other people got comments too or just u? How much code u write (the more u write the more comment u will have ..)...",hoangfbf,2026-04-15 05:16:31,7,cscareerquestions,t3_1slvdl2,False,
og9twew,You’re a professional receiving feedback on your work. Do you get the chance to review other people’s code?,misogrumpy,2026-04-15 05:05:22,6,cscareerquestions,t3_1slvdl2,False,
ogaltql,"You know what’s worse? Having no feedback at all and they just merge, and something broke and they blame you.",JackReedTheSyndie,2026-04-15 09:05:59,6,cscareerquestions,t3_1slvdl2,False,
ogab4j7,I wish people left more comments on my code.Take any non-trivial piece of code and you can find comments to add to a review if you look hard enough.,CallinCthulhu,2026-04-15 07:28:11,4,cscareerquestions,t3_1slvdl2,False,
og9x9sq,I used to be scared of getting comments. Now I actively seek it out. It means the person taking a look at it actually care and it's a learning experience. Me pushing in code with no feedback means something might break or my work environment doesn't give a shit which mean no learning opportunities.,babypho,2026-04-15 05:31:40,3,cscareerquestions,t3_1slvdl2,False,
oglcke1,"I’d like to hear stories like this, too, but I doubt many people who have transitioned out of tech still follow this sub.",bellinghanoi,2026-04-16 20:45:38,83,cscareerquestions,t3_1snfc2y,False,
oglc3ba,I have successfully went from software engineering to retail sales in my 30s,themegainferno,2026-04-16 20:43:27,72,cscareerquestions,t3_1snfc2y,False,
ogm1rnx,I went from tech to being a bum. (I lost my job 3 months ago),blipojones,2026-04-16 22:55:07,63,cscareerquestions,t3_1snfc2y,False,
oglnm4t,thinking about just kinda fucking chilling,Lonely_Ambassador202,2026-04-16 21:39:44,33,cscareerquestions,t3_1snfc2y,False,
