id,body,author,created_utc,score,subreddit,parent_id,is_submitter,distinguished
oy180va,"the comment about 8 years without feedback being the real gap is the diagnosis, so make it the fix too. you can manufacture the code review you never got. take the stack you already have real mileage in, react and rails from your second job, and start reading good production code in it, big open source apps, comparing how they structure things against how you would have. that's the closest substitute for a senior pushing back on your PRs. and don't frame this as catching up on 8 years, nobody interviews you on 8 years, they interview you on one narrow slice. going from 'did rails tickets' to 'can build one full feature end to end and explain every choice in it' is a months sized project, not years, and it quietly turns the experience you're calling basic into experience that counts.",ItaySela,2026-07-17 04:58:23,2,learnprogramming,t3_1uyku16,False,
oy2100v,Well - try to improve - put some effort into improving your skills..,QVRedit,2026-07-17 08:46:11,1,learnprogramming,t3_1uyku16,False,
oy3o0u6,"> What to do when I’m not as good or experienced as I should be?Most people are, expectations towards a job and title more often are highthened and do not match the reality.Just keep improving and don't get doubt ruin you",sylvant_ph,2026-07-17 14:35:04,1,learnprogramming,t3_1uyku16,False,
oyblxoq,"Same boat as you, I've only had one senior dev guide me but only for a few months. The only thing I can recommend is doing side projects in something you love. Like the kind that you're excited to do after work and in the middle of the night.",thaneros2,2026-07-18 17:13:07,1,learnprogramming,t3_1uyku16,False,
oy0qhhw,"Thank you so much for the reply :red_heart: I just feel so behind. So much of the “real stuff” does seem kinda basic, not really complex and most of it is Wordpress. And I see people knowing so much more than me with less years of experience. I don’t do much coding outside of work too. I will work on some personal projects. I do hope the behind feeling does fade like you say it would.",Pizzacato567,2026-07-17 03:01:58,2,learnprogramming,t1_oy0kfuw,True,
oz1ptc1,"It's definitely a good start. However, be aware that part time dev jobs are extremely rare. The industry is not setup that way.",plastikmissile,2026-07-22 10:11:59,8,learnprogramming,t3_1v3a1rr,False,
oz1epct,It is a good way to learn to walk,Flimsy-Importance313,2026-07-22 08:42:43,14,learnprogramming,t3_1v3a1rr,False,
oz1oxp4,part time backend jobs are basically nonexistent,Harrow-Beck-6274,2026-07-22 10:05:27,4,learnprogramming,t3_1v3a1rr,False,
oz1qnpj,no :loudly_crying_face: bro ur fried these will get you nowhere,Confident_Treacle974,2026-07-22 10:18:14,2,learnprogramming,t3_1v3a1rr,False,
oz1l6wr,I think whatever suits me is fine.,funny6522,2026-07-22 09:36:06,1,learnprogramming,t3_1v3a1rr,False,
oz22pa3,"to put the first stone of knowledge: YES, to land a job? I don't think so. realistically the job market is oversaturated. As a backend developer with 4 years of business experience, I am not even getting interviews. But at some point, you need to start, and the courses you mentioned are a good way to do it. then you will evolve elarning more and more from youtube and other more specialized courses",Glum_Substance4683,2026-07-22 11:38:57,1,learnprogramming,t3_1v3a1rr,False,
oz1lkkc,"You missed NoSQL, networking, API design, OS, containerization, all things about security, just to name a few. Good luck.",Dismal-Citron-7236,2026-07-22 09:39:12,-1,learnprogramming,t3_1v3a1rr,False,
oz1dpuf,Bump,Both-Pollution-50,2026-07-22 08:34:21,0,learnprogramming,t3_1v3a1rr,False,
oxte437,"I found it helpful to break what I wanted to do into small blocks, and then work on connecting them later. I don’t think I wrote anything actually useful for like a year after I got my degree lol",TheLoneTomatoe,2026-07-16 03:07:46,14,learnprogramming,t3_1uxqt4d,False,
oxtf3e1,"I think both paths are viable, there's definitely work in design, art, writing, planning, localization, lots of stuff in game development that doesn't involve writing code that could be a better fit.It sounds like your methods of learning, in a classroom setting with guided tutorials, isn't meshing with how you learn though, so I don't think I'd give up yet. The biggest lessons to learn in coding isn't the language or the syntax, its the method of thinking. Solving problems by thinking the way computers have to.A method I found that worked for me when I had that 'blank sheet panic' was to spend more time planning and scoping what I was going to code before ever opening the IDE. For example, say I was making Flappy Bird, an excellent starter project. Doesn't matter what language or format, I'd plan what I need, a bird, some pipes, a background. Bird needs to move from the left toward the right, spacebar and/or click needs to make him 'flap'. Gravity pulls him down, flapping bumps him up. Pipes need to spawn off the right edge and touching them kills the bird.Then I'd write pseudocode. Language agnostic, just work through the most basic steps first. Bird is on the screen, lets apply gravity. Bird.Velocity -= 10. With pseudocode I'm not looking at a blank sheet anymore, I'm already halfway there, I can google syntax to get the rest of the way.",ThePoorKingKarling,2026-07-16 03:13:55,7,learnprogramming,t3_1uxqt4d,False,
oxujypp,"You have mentioned that yoh tried everything including tutorials and classes (probably also videos and AI), but you didn't say that you tried any of the exercises.Most people who ask this question will say something like ""I've watched hours of YouTube but when I try to do something by myself I draw a blank"" - which is the second half of what you talked about.Again, you didn't cover this, but when yoh follow a tutorial or class etc, you need to replicate it (not copy and paste, rekey it), make mistakes, figure them out, after that explore that particular topic. For exampe, if you learned a for loop, ask how can i do it with increments other than 1? Can I make it count down rather than up? Stuff like that. To be clear, especially for videos and tutorials, you need to ""hit pause"" regularly and try out each section as you go. For classes, try to replicate what was covered in the class as soon as practible after the class. Again, make mistakes, figure them out, explore each topic.Also, the games you are talking about are pretty complicated. This is not the place to start, break it down, try doing something simpler like nought and crosses (tic-tac-toe) or a high low game, then ramp it up, try re-creating something like minesweeper and so on.",gm310509,2026-07-16 08:20:40,5,learnprogramming,t3_1uxqt4d,False,
oxtjxxi,Have you tried online courses that build an actual game beginning to end? That way you can see the bigger picture on structuring a game project to help alleviate that blank page terror and go beyond copying and pasting? Then when you want to build something for yourself you have a higher level view of what's needed and can start with an outline instead of a blank page?,asanyc,2026-07-16 03:45:11,3,learnprogramming,t3_1uxqt4d,False,
oxu0orr,When I started coding i also wanted to immediately create games. Until I read somewhere that you need a solid knowledge of the basics. So I started to learn coding (not for games). Today (15 years later) I am still coding non-game apps. But every now and then I sit down and write some lines of code for a small game. It's a hobby if you will. What I want to say: start learning and knowing the basics. Because when you want to create a game there is so much more yo habe to learn.,Naxos84,2026-07-16 05:45:19,3,learnprogramming,t3_1uxqt4d,False,
oxucb1m,Then do something you love,max_wen,2026-07-16 07:16:44,3,learnprogramming,t3_1uxqt4d,False,
oxu9eza,"so you've tried: tutorials, classes, but I don't see you mentioning trying the most important thing, actually building things.you freeze because you don't have practiceyou need practicetoo hard? find something easier and practice that.",lukkasz323,2026-07-16 06:53:44,1,learnprogramming,t3_1uxqt4d,False,
oxwobzq,"Maybe you can write down exactly where you face problems, because you mentioned is more general. In short, you need to evaluate what you can do and what you can't, then think more deeply why you cannot do this specific task. Maybe you need to take more classes, or you do take them but you are not present or attentive enough to apprehend.",ParentsWave,2026-07-16 15:36:45,1,learnprogramming,t3_1uxqt4d,False,
oxx8ced,>Am I missing something to help with learningYou need to learn problem-solving skillsactually get paper and plan out the steps needed to code your project,TheEyebal,2026-07-16 16:59:02,1,learnprogramming,t3_1uxqt4d,False,
oyxhg2b,Coding is hard. It's not for everyone. Just the facts.,Puzzled-Extent7817,2026-07-21 19:06:24,1,learnprogramming,t3_1uxqt4d,False,
oy30qu6,"You are in college, studying CS.I'd suggest staying in college, and study CS.Focus on that, and don't bother with what the rest of the world is doing - no one is going to hire someone who didn't pass their exams, because they were busy freezing in front of projects, watching tutorials and worrying about specialized topics that either aren't part of the curriculum yet, or too specialized to do much about before getting an actual job.Your college curriculum should be the ideal roadmap - make sure that you've exhausted all parts of that, before even considering doing other stuff.",peterlinddk,2026-07-17 12:45:31,11,learnprogramming,t3_1uyx1l7,False,
oy30g54,"I think you know more than you think and you think that to build something you need more than what you know.Truth is you know enough to start, and probably to finish. You don't know everything, because no one does, but your education probably gave you the tools needed to know how to learn said things.If you go online looking for tutorials on how to do thing X, you start with X and suddenly you _""absolutely need to learn A, B, C and also React Components""_... You don't. You really don't.Buy an ESP32, a breadboard, a bit of wire and some light or humidity sensors and some LEDs and go have fun with C. Take those things and make a small LED display that tells you the amount of light in a room, or the humidity in a flower pot. Then make the ESP32 communicate over the wire to your PC and writes the readings on a SQLite database for example. Then build a simple website that takes those readings and shows you graphs with a timeline! Keep adding to this website over time with new features that you come up with.The possibilities are endless my friend.You don't need tutorials that tell you step by step what to do because that rigidity kills all creativity! You just need to read some documentation and *experiment*.Write code, break things and segfault your way to success :red_heart:",xarop_pa_toss,2026-07-17 12:43:59,9,learnprogramming,t3_1uyx1l7,False,
oy306nx,"Same bro, same",Physical_Storage2875,2026-07-17 12:42:37,1,learnprogramming,t3_1uyx1l7,False,
oy34fv0,"When you start in the real world, you will be hired as a noob. You will be given easy tasks and gradually you will be exposed to more and more - just like at the university. You have 3-4 more years where you are still lower tier. Then a few years more in the middle. It’s at 7-10 years when you’re really expected to know everything - and that is only in your specialization.In this field, you’re going to be constantly learning new things and changing how you implement them. You’re learning the fundamentals now and jumping from class to class is getting you ready for the chaos.",YellowBeaverFever,2026-07-17 13:04:08,1,learnprogramming,t3_1uyx1l7,False,
oy9957m,"Try the Odin Project (www.theodinproject.com), and read the essays of Paul Graham and the blog posts by Joel Spolsky. Graham has fascinating insights to offer on a programming language called Lisp—and Spolsky has equally interesting ideas about pointers and recursion in a blog post called “The Perils of Java Schools.”",Hadley_Two,2026-07-18 08:56:38,1,learnprogramming,t3_1uyx1l7,False,
oy3t5nn,You need an internship next summer if you want a shot at a big name coming out of school,duggedanddrowsy,2026-07-17 14:57:29,0,learnprogramming,t3_1uyx1l7,False,
oy35bra,:red_heart::people_hugging:,Remarkable_War8311,2026-07-17 13:08:30,3,learnprogramming,t1_oy30qu6,True,
oymt064,Yes. Don't work yourself up for nothing. Until you have graduated. Sometimes the story you hear on campus doesn't tally with reality. It might be an old story especially for a dynamic tech ecosystem. Be patient. Concentrate on your studies,odimdavid,2026-07-20 08:04:11,1,learnprogramming,t1_oy30qu6,False,
oyc5kzh,"I'm currently pursuing btech computer Science. I will be starting my second year from august. Till now i have no skills in this field like coding and stuff but i really want to develop skills, make projects, do internships and obv get hired and its not easy ik so can you please guide me regarding this and i have more ques to ask..",convex_eye,2026-07-18 18:44:20,1,learnprogramming,t1_oy30g54,False,
oybeenm,"> I know its coz of the %d %f mistake but whyyyThe rules-lawyer answer is that using the wrong format specifier for `printf` causes ""undefined behavior"". You're not supposed to do it under any circumstances, and if you do, all bets are off. Your program can misbehave in arbitrary ways.Practically, the reason is that one of two things happens, depending on your system's [ABI](https://en.wikipedia.org/wiki/Application_binary_interface):* `printf` is expecting an integer passed in a CPU register, but you're passing a float in a different register, so it's reading random leftover garbage* `printf` is expecting a floating-point value on the stack, but you're passing an integer on the stack, so it's reinterpreting those floating-point bits as integer bits",teraflop,2026-07-18 16:38:39,47,learnprogramming,t3_1v00fri,False,
oybe0fa,"A floating point number is stored with the various bits representing a sign (+-), an exponent, and a mantissa. This is a completely different data structure from an integer. If you tell it, ""Display this binary data as though it was an integer,"" it will print something weird.",PuzzleMeDo,2026-07-18 16:36:49,8,learnprogramming,t3_1v00fri,False,
oybf445,It should be float values? `fahrenheit = (celsius * 9.0/5.0) + 32.0;`,Basic_Reporter9579,2026-07-18 16:41:54,4,learnprogramming,t3_1v00fri,False,
oybi4yv,"Because `%d` can not magically convert the next parameter to integer. It just _assumes_ it is integer. When not, Undefined Behavior! In your case, value which appears random. While educational and maybe fun, it is usually not otherwise productive to try and figure what actually happens, because it might change the next time you build the program.Either change the format specifier, or explicitly convert the float to an int.",Cultural_Gur_7441,2026-07-18 16:55:45,5,learnprogramming,t3_1v00fri,False,
oybdhl9,I don't get extactly what you mean and also you have an `\` in`fahrenheit = (celsius \* 9/5) + 32;`That is probably messing up with your program. `%d` will truncate the value towards 0 if the input it gets is a float or double in modern C.,Innominate2093,2026-07-18 16:34:24,3,learnprogramming,t3_1v00fri,False,
oyfvf6r,"I assume this line of code contained a typo: fahrenheit = (celsius \* 9/5) + 32;as I had to change it to this to get the code to compile and link: fahrenheit = (celsius * 9/5) + 32;First point. You should always run the compiler with full warning enabled, as this will help catch these kind of errors: test.c C:\temp\test.c(8,10): warning C4477: 'printf' : format string '%d' requires an argument of type 'int', but variadic argument 1 has type 'double'Now if I compile, link and run this code I don't see any random values: C:\temp>test.exe -1610612736 C:\temp>test.exe -1610612736 C:\temp>test.exe -1610612736So at least for the Microsoft C compiler generating debug level of code, the numbers are wrong, but they remain predictable.",ScholarNo5983,2026-07-19 08:14:20,2,learnprogramming,t3_1v00fri,False,
oybe68p,"`9/5` is `1`, because of integer division. You can fix that by making one (or both) of the values floating point.And in the future, please say what result you got and what result you expected. For all I know you are actually seeing a compilation error and I'm helping with the wrong thing.",lurgi,2026-07-18 16:37:34,3,learnprogramming,t3_1v00fri,False,
oybd3f6,What value did you expect to get?,bestjakeisbest,2026-07-18 16:32:35,1,learnprogramming,t3_1v00fri,False,
oyber93,why is there a '\\' before your multiplication operator? That shouldn't be anywhere here.,DTux5249,2026-07-18 16:40:15,1,learnprogramming,t3_1v00fri,False,
oyc1p4l,"> I know its coz of the %d %f mistake but whyyy`printf` doesn't know the number or types of arguments you pass after the format string; it only knows what to *expect* based on that format string. You told it to expect an `int`, so it looked for `sizeof (int)` bytes either on the stack or a specific register, and interpreted those bytes as an `int` value. If it's looking at a register, it won't be looking at the right one and will just read garbage. If it's looking on the stack, it a) won't read the right number of bytes, and b) won't interpret them correctly.",SmokeMuch7356,2026-07-18 18:25:53,1,learnprogramming,t3_1v00fri,False,
oyq2jo6,Automate something. Or make an insecure program using what you've learned and learn how to exploit the vulnerabilities. I don't do robotics so can't help there.,HashDefTrueFalse,2026-07-20 18:39:22,9,learnprogramming,t3_1v1txtd,False,
oyq7d7e,"uni is good for learning the fundamentals, but it's terrible at showing you why they're useful.if you're into robotics, hacking, or automation, just start messing with that stuff now. you'll hit things you don't know, look them up, and that's honestly how most people learn. it's a lot easier to stay motivated when you're building something you actually care about instead of another assignment.",noonereallycaresss,2026-07-20 19:00:04,7,learnprogramming,t3_1v1txtd,False,
oyq6l9b,"> I'm interested in robotics, automation, hacking, etc. (basically everything fun). ok... my advice is to do it then.",ffrkAnonymous,2026-07-20 18:56:41,5,learnprogramming,t3_1v1txtd,False,
oyq2l8o,Just pick something that you want to create and interests you and get to it! It may be slow at start but you will learn as you dig deeper into it.,AmTheHobo,2026-07-20 18:39:33,4,learnprogramming,t3_1v1txtd,False,
oyq3fmr,"Just choose a project and figure out how to make it :p you listed a bunch of good projects there. You may be interested in microcontrollers. If C feels too easy, try assembly. It will expand your mind",bird_feeder_bird,2026-07-20 18:43:08,2,learnprogramming,t3_1v1txtd,False,
oyq5dpu,"It's really about just having an idea you're interested in and doing a bit of research to find out what's required. I'm not too familiar with robotics but I think a place to start could be learning about Raspberry Pi Pico and finding a beginner project that uses motors or LEDs. I've done a few embedded projects like making a Spotify remote, making a Conway's Game of Life screen, and a few other simple things that taught me a lot about electronics and programming in an embedded environment. Tryhackme and Hackthebox are both decent places to learn what hacking actually is along with a bunch of introductory IT and networking stuff. I learned a lot of automation and linux stuff by making and managing Minecraft servers at home. So basically I'd recommend trying to get creative, picking an idea, and then looking up what you can to accomplish that idea. It doesn't even have to be useful or successful, you'll do a bit of limit testing and learn a lot about computers and programming on the way.",Slight_Cat_4423,2026-07-20 18:51:31,2,learnprogramming,t3_1v1txtd,False,
oyq6gf4,You are in the crossroads of a booming industry. Do you see your self as a entrepreneur do you want to work in space industry? 1) are you more interested by the mission or solving a problem? Or2) are interested in the act of programming Figure out which one you are then start working from that perspective,MjProblem,2026-07-20 18:56:06,2,learnprogramming,t3_1v1txtd,False,
oyqban3,"I build all kinds of stuff and end up focusing on the ideas that are more light hearted. I for one, want to build an opinionated Tamagotchi kind of thing that gives bad advice and spouts nonsense based on some relevant context. I just think that people are trying to hard to build helpers and useful robots, I would want to build something that just had attitude.",BuyFar3984,2026-07-20 19:17:23,2,learnprogramming,t3_1v1txtd,False,
oyqcz0x,"If you are bored after taking CS50p, maybe you should try for another hobby? What advice are you asking for, because no one can solve your problem of being bored.",rustyseapants,2026-07-20 19:24:46,2,learnprogramming,t3_1v1txtd,False,
oyqtueg,University rarely shows the fun parts.,Different_Pain5781,2026-07-20 20:40:07,2,learnprogramming,t3_1v1txtd,False,
oxzf4c7,"Truth tables always helped me tremendously. If I didn't understand a law, just walking through each possibility helped me mentally accept it.For example, absorption laws. Let's look at A and (A or B) = A|A|B|A and (A or B)||:-|:-|:-||True|True|True||True|False|True||False|True|False||False|False|False|So you look at that, and you see that the A column is always the same as the ""A and (A or B)"" column, and therefore the claim is true!",captainAwesomePants,2026-07-16 22:40:12,16,learnprogramming,t3_1uyhile,False,
oxzf72l,Can you share an example of a problem that you struggled to understand? And that you expected to simplify differently?Everyone's learning journey is different so there is no generic answer here. We need to know what you're struggling with.,maujood,2026-07-16 22:40:35,1,learnprogramming,t3_1uyhile,False,
oxzfkbl,"Have you thought of AND as multiplication and OR as addition, where the input values are only ones and zeros and those operators max output is 1 as well?",Recycled5000,2026-07-16 22:42:25,1,learnprogramming,t3_1uyhile,False,
oxzr6ah,[Explain to me Boolean algebra like a 5 year old](https://www.google.com/search?q=exaplian+to+me+boolan+algerba+like+a+5+year+old&rlz=1C1VDKB_enUS1161US1161&oq=exaplian+to+me+boolan+algerba+like+a+5+year+old&gs_lcrp=EgZjaHJvbWUyBggAEEUYOTIJCAEQIRgKGKABMgkIAhAhGAoYoAEyCQgDECEYChigATIJCAQQIRgKGKABMgkIBRAhGAoYoAEyBwgGECEYqwIyBwgHECEYqwIyBwgIECEYqwIyBwgJECEYjwLSAQkxNjI3MmowajeoAgiwAgHxBTIxKdfmo4-Y8QUyMSnX5qOPmA&sourceid=chrome&source=chrome.ob&ie=UTF-8),rustyseapants,2026-07-16 23:42:27,1,learnprogramming,t3_1uyhile,False,
oy9yota,"Late to the thread but it *does* work like regular algebra. You're struggling with absorption, so A+AB, but this isn't a problem when you factor out A to create A(1+B) which simplifies to A(1) = A. Your main difference is that in Boolean algebra, x + x = x instead of 2x. If you can keep that in mind, a lot of your simplifications work normally. To give a more logical example, let A = ""it is raining"" and B = ""I need an umbrella"". That means A + AB is ""it is raining"" OR ""it is raining AND I need my umbrella. Both statements require A, so B does not matter to our statement. That's part of why we can simplify it this way.",RajjSinghh,2026-07-18 12:14:15,1,learnprogramming,t3_1uyhile,False,
oxzgr8q,"I think that’s exactly my problem. My brain keeps trying to apply regular algebra, so the absorption law feels wrong even though I know it’s correct. I’ll try building truth tables for the laws that don’t make intuitive sense",Sufficient_Comment83,2026-07-16 22:48:28,2,learnprogramming,t1_oxzf4c7,True,
oxzgi1t,"Here are some problems I did and what I thought the simplification was: A + AB = 1B A(A + B) = B A + BC + B = B(A + C) AB + A = AB I know they’re wrong, but I don’t understand why they’re wrong. I think my brain is trying to treat Boolean algebra like regular algebra. I also seem to struggle the most with the absorption law. I understand De Morgan’s Law and factoring much better than absorption.",Sufficient_Comment83,2026-07-16 22:47:12,1,learnprogramming,t1_oxzf72l,True,
oxzh9i4,"I have, and I think that’s part of what’s confusing me. My brain keeps trying to treat Boolean algebra like regular algebra, and I end up simplifying things incorrectly. For example, I thought A + AB simplified differently, even though I now know it equals A. I’m struggling more with why the absorption laws work than with AND/OR themselves",Sufficient_Comment83,2026-07-16 22:51:02,0,learnprogramming,t1_oxzfkbl,True,
oxzlhfo,"Yeah, don't think of it as numbers. Will not help at all. Think of it as shorthand for an electrical circuit. A and (A or B) is a circuit where the A and B input go into an OR gate, and the result goes into an AND gate with the A input.",captainAwesomePants,2026-07-16 23:12:41,7,learnprogramming,t1_oxzgr8q,False,
oxzmxl1,"You can think of it as1*(1+0) = 11*(1+1) = 1 this is the only difficult one, until you accept 1+1=10*(0+1) = 00*(0+0)=0",0xC4FF3,2026-07-16 23:20:15,6,learnprogramming,t1_oxzgr8q,False,
