id,body,author,created_utc,score,subreddit,parent_id,is_submitter,distinguished
or0dj7e,They'll come back with a diagonal arrow from app events to the last box and tell you to do that only. All that tech stuff in the middle is just not in the budget right now.,Wing-Tsit_Chong,2026-06-11 10:41:53,406,dataengineering,t3_1u2us9d,False,
or0fumw,Hey CTO here... Where I can upload my CSV in FTP ?,charlyAtWork2,2026-06-11 10:58:22,126,dataengineering,t3_1u2us9d,False,
or0eh1h,That last box is the most accurate part of the whole diagram!,amm5061,2026-06-11 10:48:38,47,dataengineering,t3_1u2us9d,False,
or0eea2,"relax, no one is getting fire for fake reddit post",Spare-Builder-355,2026-06-11 10:48:05,117,dataengineering,t3_1u2us9d,False,
or0licv,![gif](giphy|eXyGaU1gvRGXxZgwKj),konkanchaKimJong,2026-06-11 11:36:18,10,dataengineering,t3_1u2us9d,False,
or0ltq2,Why do you need airflow here?Cant you directly load to s3 and snowflake (dbt) in parallel from spark,jiraya05,2026-06-11 11:38:20,8,dataengineering,t3_1u2us9d,False,
or0ggz5,Karen is just the name used for the persona that the consultants spent 500k putting together user stories for.,Sin-nie,2026-06-11 11:02:41,7,dataengineering,t3_1u2us9d,False,
or6f787,"""We want everything of that but MOST IMPORTANTLY, we need a button to download the Excel file!"" - I'm not making this up, I've actually been in meeting where this was the requirement.",One_Citron_4350,2026-06-12 05:58:33,6,dataengineering,t3_1u2us9d,False,
or1gwe6,"She opens the CSV, too, never imports it.",Houdinii1984,2026-06-11 14:22:47,5,dataengineering,t3_1u2us9d,False,
oqtshj8,"Use AI to learn, prompt it to explain how to do what you’re doing.",KebabAnnhilator,2026-06-10 12:40:02,295,dataengineering,t3_1u20xy5,False,
oqtsdrt,If you don't know what you're doing without the use of AI then you don't know what you're doing..,PRAY___FOR___MOJO,2026-06-10 12:39:28,151,dataengineering,t3_1u20xy5,False,
oqu104d,">I think we are at a cross road here - If I don't use claude, I will get behind or layoffed. If I continue, I am not sure what I learnYes, hundred percent. Technical people are in a lose-lose scenario at the moment depending on the expectations of management. Until this expectation changes in the industry or in management, we are expected to push out features/code faster at the same level as before. However to keep those engineering skills sharp, you sometimes need to go slower to learn, creating the dichotomy you have mentioned.Others have given great tips on how to use Claude and I would also try shifting managements expectations as this is the root cause of all this bs. Either ensure that they are happy that engineering standards drop and if more issues come through that's fine. Or they are happier that you move a bit slower and you can bake in time to keep your skills sharp. There is still so much to come out in the wash with AI in the workplace and its unfortunately going to be a couple years. I'm so tired of this already.",cakerev,2026-06-10 13:23:44,41,dataengineering,t3_1u20xy5,False,
oqu7jz6,"I use claude for everything at work. And I find I spend most of my time QAing and correcting it.If you’re not scrutinizing claude’s work and finding issues then you’re not at a level of expertise you need to be at.I literally find issues with claude’s work all the time. Consistently. Even using skill frameworks like superpower, sdd like spec kit and open spec, and just plain development loops I created myself.The balance is knowing the AI is wrong A LOT so I need to keep my domain knowledge of my business and my data engineering skills on par to keep it on course.",MonochromeDinosaur,2026-06-10 13:55:22,22,dataengineering,t3_1u20xy5,False,
oqtu6wu,"How many YoE do you have? If junior then just learn. Actively learn. Treat AI as a senior, who do things once or twice but you must learn in the process and accumulate knowledge.",robberviet,2026-06-10 12:49:10,17,dataengineering,t3_1u20xy5,False,
oqttem4,"What I do is actively learn with it. For instance was creating a POC for dbt for my senior leadership. For this I used a data model that feeds into a PBI report for executives that I made.So instead of asking Claude to spit code out and do the work for me, I asked it everything from “how to install dbt in vscode” all the way to the intricacies of dbt and I actually typed out and built the code myself. It didn’t do my work for me but acted as a guide. Only thing I had it do for me was the descriptions for dbt docs which was fine since that takes forever to write. I think people with Claude and other ai tools really need to treat it as an aide and actually do the things it tells you instead of copy paste.",Chowder1054,2026-06-10 12:45:01,29,dataengineering,t3_1u20xy5,False,
oqtszzm,"From my understanding the best way to use AI is to help *you* understand better, not for it to do everything you should be doing. For example, I'm only just getting back into data engineering, and I ask AI to help me understand things, or even to maybe point me in the direction of doing something (ie creating a pipeline), and throughout every step I ask & answer questions (from the AI). I'm hoping by making enough 'contact' with the data engineering concepts and through constant practice eventually I'll learn more. That's my 2 pence anyway!",techGrad4202,2026-06-10 12:42:50,11,dataengineering,t3_1u20xy5,False,
oqtttad,"You should be using claude code as a very booksmart and inexperienced intern. You have to fully understand what you are asking it to do and give very explicit instructions including allowed and disallowed approaches. You always check and test the work. The hardest part of a de job is the design, architecture, and engineering of the systems. Claude shouldnt be trusted to do that or you will have spaghetti that doesnt hold up over time. It can one shot something that looks close enough today, but a month from now breaks for a stupid reason.",CorpusculantCortex,2026-06-10 12:47:10,12,dataengineering,t3_1u20xy5,False,
oqtw2fk,"Hey! I've felt that way too, my friend. (Honestly, I still do sometimes lol.)Remember that, beyond the interview process, companies usually don't care that much whether you know a specific technology or not — they care about results. At the end of the day, their goal is to keep their metrics and business performance moving in the right direction.So don't worry about using Claude Code or other AI tools. Your job is to solve problems and deliver value.When you're working on personal projects, though — where you usually have more time to learn and experiment — try using AI more to ask questions, validate ideas, and review your solutions. That way, you'll build more autonomy and become less dependent on these tools over time.",No_Spend2015,2026-06-10 12:58:51,5,dataengineering,t3_1u20xy5,False,
oqu8au1,"Everyone just saying “use it to learn” - I’m sure you’re already doing that. I’m sure you’re asking it why things are breaking or what could be done better and why it works that way. This is pretty obvious.IMO, Every time you reach for AI to build things in your job, you’re choosing speed over learning. Not saying you can’t learn with AI ever, but every single time you have it do your job for you, even if you’re asking questions, you’re choosing speed (and tbh convenience) over learning.Do you ALWAYS have to choose speed over learning? Is your job really that fast paced?",Baudrillardist,2026-06-10 13:58:54,5,dataengineering,t3_1u20xy5,False,
or4cvfz,I went from ML to DE. There is A LOT of terrible ML done by MLE who don’t know ML. DE is less fun but always useful. ML is often not useful and wasted time so be prepared for that.,Trick-Interaction396,2026-06-11 22:12:01,144,dataengineering,t3_1u3byio,False,
or4gjon,This is my perspective coming from ML to DE. The solutions in DE are “all the same” because there are more or less accepted ways to do things. That is a feature. It’s like saying all the ingredients and methods for cooking are the same so why be a chef. 90% of the companies and people I worked with doing “ML” were just lying to themselves. They just want someone with a statistics degree to validate the opinions of their management team. The 10% of ML jobs that are interesting are at the frontier companies and if you have a lead on one of those then go for it.,Key-Independence5149,2026-06-11 22:31:40,91,dataengineering,t3_1u3byio,False,
or4mx3k,"I’m a part of a large team that does both so I’ve worked on both sides. Ultimately it comes down to personal taste. I can’t stand the process of fiddling with models, tuning model parameters, calculating metrics across time, ensuring model stability over time, etc. So personally, I find the challenges that DE brings a better fit.",bass_bungalow,2026-06-11 23:06:45,36,dataengineering,t3_1u3byio,False,
or4s7xj,"Think of it less as pivoting your career and more as developing another skill. Realistically, you can always come back to DE, and having the ML user perspective sets you up well, especially if you can talk to what those users need from DE from your own experience.",crossmirage,2026-06-11 23:36:46,25,dataengineering,t3_1u3byio,False,
or59p1l,"At the beginning of my data career, coming from a hard science background, both paths were opened. Of course, like anyone, I thought and still think the ML is cooler, in theory. My first job happened to be 100% DE and I liked it. In later jobs, I worked regularly with data scientists and noticed how much more unstable, unclear and wasteful their job is. I have never been interested in doing their job since then. I'd rather keep coding things that keep running for years instead of going to the trash every 3 months. DE being quite less mediatic than DS, it also a better job market niche, in my experience.",sib_n,2026-06-12 01:20:11,17,dataengineering,t3_1u3byio,False,
or5r7aq,It all depends on what the role of AI Engineer consists of. I know very talented engineers who pivoted to AI and just have to build agents for whatever nonsense the company think is flavour of the week. They’re miserable.,Walk_in_the_Shadows,2026-06-12 03:05:00,7,dataengineering,t3_1u3byio,False,
or6j67l,"ML/AI is more interesting than data plumbing, but you'll still spend 80% on data quality and debugging, 20% on actual ML. The real question is if you're bored with DE itself or just bored at your current place, sometimes switching companies solves it faster than switching careers.",rewiringwithshah,2026-06-12 06:30:50,9,dataengineering,t3_1u3byio,False,
or6nkcu,"I went the other direction. I couldn't handle working on things for months and it going nowhere, constant debates about 'yeah but did you try x, y AND z?', or being asked to look at things again because it didn't validate someone's opinion. Since most projects fail, end of year discussions are difficult when you have to show what business impact you had. This was pre-LLMs, most people I work with that do this work are now basically web developers calling LLM APIs.In DE, you need to build something that does x, you build it and it does x. So much better to do as a job.",speedisntfree,2026-06-12 07:07:29,5,dataengineering,t3_1u3byio,False,
or6b19s,"Studied a bit of ML last time, became a DE, and now doing a bit of ML.DE is more clean work. You expect ABC and it's easily validated. For ML is always subjective. Tuning endless parameter combination with mystery output and mystery acceptance level. I'd have more fun on MLOps but kot ML itself lol.",ppsaoda,2026-06-12 05:25:14,5,dataengineering,t3_1u3byio,False,
or55xr0,"I’m now at Epic as ML research, I’ve begun as a DE in a big company in Brazil. Your report is relatable, work is repetitive with the same stack and little sense of accomplishment (there’s not much excitement in delivery a table or a new ETL with few exceptions). In ML the stack is definitely more diverse, you do interact with new technologies and new things quite often since every day new stuff is released. However is not all flowers. Experimentations is a really pain in the ass. May sound cool and exciting to keep trying new things in a model and testing what works and what does not, but when actually comes to it, is a very boring job of justing trying settings and prompts and training models to get minor metrics improves, and repeat. You end up looking to a bar moving quite a lot during model training and eval sessions. Is pretty boring. I often find way more satisfactory and fun when I get to actually code something as the Service side to provide the model. Or the dataset process pipelines, o even the architecture to serve and parse data. The engineering side of ML that is not directly tied to models itself is way cooler. I do miss doing some DE and having to code more and actually come up with smart architectures.That being said, probably the ideal role is something in the middle. Something that allows you to do a bit of both and enjoy the good (and bad) parts of the both sides. However, if I had to pick, I would stick with ML engineer precisely because of the reasons you said. Even though there’s a very dull part, the cool part is really cool and is not that rare. You get to try a lot of new things.",HumorDiario,2026-06-12 00:57:48,3,dataengineering,t3_1u3byio,False,
or73an6,"Lisa is the nicest person you've ever met. Her brain contains the history of all customers, orders, deals, discounts, going back to the 70s. It also takes her a bit longer to reply to emails sometimes because she calls her grandson to ask what to do with that zippy thing again. Lisa is the database. Lisa is the company.",TJaniF,2026-06-12 09:26:39,131,dataengineering,t3_1u3ek13,False,
or6xdlx,"“Let’s see if we can’t help you improve your business process so your inputs are consistent. I’ll set up a call with your manager. Thanks.” -senior manager, analytics & data engineering (me)",Mo_Steins_Ghost,2026-06-12 08:33:56,47,dataengineering,t3_1u3ek13,False,
or8591o,"""That's always been wrong"" after you've spent a week on EDA and root cause analysis for conflicting data in production...",TheEternalTom,2026-06-12 13:30:29,22,dataengineering,t3_1u3ek13,False,
or83340,"Me: Here’s the report you asked for. We created medallion architecture in layers with an automated pipeline to clean and normalize your data feeding the report. It matches the old report you were using of a spiderweb of excel sheets, formulas, and hand-entered data. The business: Cool looks great! Now we can download this into Excel and paste it into our “other” process so we can create macros to run and have that generate other files we save in on-prem shared folders to complete the financial close. \*\*\*actual conversation had a few months ago\*\*\*",youknowwhatthisis00,2026-06-12 13:19:43,15,dataengineering,t3_1u3ek13,False,
or8ovlc,"""the numbers don't look right..."" Mother fucker listen here ...",hellnukes,2026-06-12 14:56:53,13,dataengineering,t3_1u3ek13,False,
or89irh,"CoS: Your data is off, do you know why revenue looks so high?”You: “You asked for all historical data, that includes deleted and non-approved records. I noted that in the email.”CoS: “Oh, I didn’t read that.”Your manager: “You just need to know what they are actually asking for, not just what they asked for. Don’t be defensive. By the way, we’re eliminating your role and you won’t get severance, and if you want your bonus here’s a list of new things to complete in the next 2 weeks. By the way, we’re docking your bonus for performance.”",take_care_a_ya_shooz,2026-06-12 13:50:44,11,dataengineering,t3_1u3ek13,False,
or70hjm,It's hard work. But that's what keep human safe from AI.,robberviet,2026-06-12 09:01:53,0,dataengineering,t3_1u3ek13,False,
or86n4m,"I LOVE that the NTSB called one of their main databases CAROL, literally because it was a woman named Carol that kept that data for years!",zangler,2026-06-12 13:37:24,41,dataengineering,t1_or73an6,True,
ory6rfa,"And when Lisa will retire or leave the company, the business will collapse.",Adrien0623,2026-06-16 08:51:09,1,dataengineering,t1_or73an6,False,
or7a9cy,"Me (data engineer) just this morning: ""Ah sure, let me figure out in a call with 8 people why the data shows an incorrect ""status A"" for all of the elements in the report. So I pull up our query from 3 months ago that fills the table they use, and it turns out the analyst used the column clearly named ""status B"" to fill ""status A"" in the report.",s1renetta,2026-06-12 10:23:20,25,dataengineering,t1_or6xdlx,False,
or8jisx,">Postgres still has that 8TB limit.[32TB per table,](https://www.postgresql.org/docs/current/limits.html) still much more than most companies need and you can leverage external storage.>Curious to hear if anyone is LakeBase or Neon in prod yet and their experience. Pg has had operators for almost a decade now. It's trivial to manager for most cases.",RoomyRoots,2026-06-12 14:33:17,101,dataengineering,t3_1u3vqq1,False,
or8wmeh,Analytics is still done on OLAP. They just want you to also start putting your applications that might have OLTP backends in Snowflake/Databricks as well.,Flacracker_173,2026-06-12 15:31:13,52,dataengineering,t3_1u3vqq1,False,
or8h3h0,The problem isn’t that tech. The problem is using it for everything. Your 20MB file doesn’t need a data lake. I blame dumb managers and resume driven development.,Trick-Interaction396,2026-06-12 14:22:43,125,dataengineering,t3_1u3vqq1,False,
or96rtr,"It's not one *or* the other, it's one *and* the other.OLAP and OLTP are significantly different approaches, and support different uses. The integration between the two being seamless is worth the cost of an entire team that otherwise would be developing and operating sync between these systems, with all sorts of incident scenarios that you no longer have to worry about. That's a big chunk of time and money right there. Unity Catalog itself is open source, you can deploy your own if you want, and integrate it with your own spark clusters, or access data through it from outside, for example with duckdb. The reason most companies don't do that is the cost of developers just for self-hosting a platform when they could be solving business problems using PaaS instead. Egress cost from your existing cloud provider is a much more severe form of vendor lock-in.",CrayonUpMyNose,2026-06-12 16:15:49,21,dataengineering,t3_1u3vqq1,False,
or9kiib,"Operational stuff in postgres, cdc into olap. Easy peasy",wiktor1800,2026-06-12 17:17:18,10,dataengineering,t3_1u3vqq1,False,
or8lsro,Back from what? Terrabytes table? No.Query took minutes on OLTP and seconds on OLAP? No.,robberviet,2026-06-12 14:43:20,9,dataengineering,t3_1u3vqq1,False,
or9a4fu,Everything has its usecase.Always been so.,PrestigiousAnt3766,2026-06-12 16:30:41,9,dataengineering,t3_1u3vqq1,False,
or9ki5s,The rdbms data silo exists because orgs don’t create any sort of discoverability and accessibility. Thats not a where the data is problem.,notmarc1,2026-06-12 17:17:16,5,dataengineering,t3_1u3vqq1,False,
oraa7k7,"my 2¢ on the main swing databricks is taking with lakebase is modernizing the tried & true relational db for the AI developer eraIf you look at the traditional RDBMS:1) storage tied to compute: need more disk space? Mount more. Wanna serve more queries? Scale vertically with more RAM & CPU. Cloud providers offer varying levels of abstraction here with VMs, deploying on K8s, or fully managed instances. Lakebase takes the route of a purely serverless offering where management of compute is largely abstracted away less choosing scaling thresholds (what you’re willing to pay)2) sdlc sucks: prod instance that’s locked down, restore it all onto a dev/staging box to do data work and safely test changes. Data gets stale, find out about issues later. Lakebase enables git like semantics on data so developers/agents can safely operate on a zero copy clone of the db to exercise new schema changes3) etl overhead: all the transactional data gets exported to the lake & or EDW. Separate copy of the data and ETL code to manage the movement. Lakebase has a change data feed to enable to feed downstream OLAP that protects its own operations overhead from analytical strain",nullymammoth,2026-06-12 19:13:37,5,dataengineering,t3_1u3vqq1,False,
or9qef1,"I mean OLTP is fundamentally differente from use cases of OLAPs, databricks is an OLAP at the end of the day and even with all its advancements it will never be used as a database to control financial operations per example.",Old_Tourist_3774,2026-06-12 17:43:35,5,dataengineering,t3_1u3vqq1,False,
ort98d1,"500gb is small enough you can just go test out options in an afternoon for pretty cheap. Pick your favorite managed db and see if your queries run fast enough. You can really do a lot with Postgres, dbt, and Dagster.",JaceBearelen,2026-06-15 16:14:03,55,dataengineering,t3_1u6kjdy,False,
ortnkoi,"Did you look into lakebase feature of Databricks? You can host PostgreSQL DB in Databricks, and since it's running on Databricks serverless compute, depending on the traffic it may not be so expensive. Especially when you consider manpower costs of resigning from Databricks and rebuilding your platform.",HanseltDW,2026-06-15 17:15:55,16,dataengineering,t3_1u6kjdy,False,
ortce6n,"It's not as tenured and battle tested, but MotherDuck is worth a peek. They're doing some interesting things with Dives that may fit your requirements. Not 100% sure, but I'd say it's worth a look at least.",Witty_Garlic_1591,2026-06-15 16:27:50,13,dataengineering,t3_1u6kjdy,False,
ort6qsq,Huh. I always figured you use the right tool for the right job. Anything else is just lip service to buzzwords. OLTP for oltp. Databricks for marts and DWH. No…?,BarfingOnMyFace,2026-06-15 16:02:58,35,dataengineering,t3_1u6kjdy,False,
ort5te3,You did good. Nothing wrong with your approach,Important_Ad7149,2026-06-15 15:58:53,23,dataengineering,t3_1u6kjdy,False,
ort75yd,"Why not use Lakebase inside databricks? Since it has scale to zero, it's probably much cheaper than all the alternatives and in addition if you even want to do analytics on the data again, it's simple to set up a data sync and do so.",CautiousUse8597,2026-06-15 16:04:52,5,dataengineering,t3_1u6kjdy,False,
ortb4jq,"If you’re trying to reduce costs, Spark Real-Time Mode is going to be more cost effective than any other real-time alternative like Flink. It’s cheaper than Managed Flink, and self-hosted Flink is also expensive as it commands expensive salaries.",Key-Willow-374,2026-06-15 16:22:22,5,dataengineering,t3_1u6kjdy,False,
ortl2kg,"Have you tried Lakebase within Databricks? It's OLTP database, basically Postgres, and you can connect it to any custom app you build and run, not only Databricks Apps but just any appOtherwise Duckdb might be a cheaper alternative but also check what else you're using from Databricks (like governance).",sasha_bovkun,2026-06-15 17:05:04,6,dataengineering,t3_1u6kjdy,False,
orufz75,Hey! Full disclosure I work for Databricks. We support building and hosting web apps that use your existing SQL warehouses and have a OLTP database called Lakebase that is serverless so it will auto scale and spin down when it's not in use to help you control costs.If you have any questions around cost control feel free to message me or reply and I can give you a hand.,raisinbranlovur,2026-06-15 19:16:49,5,dataengineering,t3_1u6kjdy,False,
ortcdqd,"Honestly, 1 K a month is a pretty small budget depending on what you’re doing. It is totally possible to get a working solution without paying anything to a vendor, but your management is going to also look at the time and the cost to have their people do it.I’ve worked for enterprises, I’ve been a consultant, and I’ve sold solutions - the value proposition of all the commercial products is it saves the company time and reduces risk. The unstated premise if the sales people are saying the issue is your team not knowing Databricks is you either need to bring in consultants that no data bricks or the company needs to train up their team. No two ways about it if Databricks is the solution.",Another_mikem,2026-06-15 16:27:47,9,dataengineering,t3_1u6kjdy,False,
or70i6w,"I would spend less time on tech and more on modeling. It’s the model that brings most value. And no, I don’t think dimensional modeling is enough, that’s for consumption. You need a layer between the source model and the consumption model: the business model.So read about things like Data Vault, Anchor, Focal, and Hook.",mattiasthalen,2026-06-12 09:02:02,60,dataengineering,t3_1u3phha,False,
or8127q,I would learn DuckDB/DuckLake/MotherDuck and dbt/sqlmesh over Spark. 98% of companies on Databricks don’t need it. It will just take the market some time to adjust for the reality that big data is dead.Lack of Cloud knowledge is my #1 complaint for college programs when interviewing juniors. They teach you how to hack around in Jupyter notebooks. Then you get a job in Azure/AWS/GCP and have no idea what to do. This is how you set yourself apart. It’s your golden ticket because it’s hard for everyone. No one bothers because of the friction.I would add that if you truly know that list you are doing very well already. I can’t you the number of times I have had to teach “qualified engineers” about making their code idempotent. Having that foundational level of knowledge serves as an anchor for your decision making.,Immediate-Pair-4290,2026-06-12 13:09:20,18,dataengineering,t3_1u3phha,False,
