id,body,author,created_utc,score,subreddit,parent_id,is_submitter,distinguished
oge7hne,Thanks for the suggestion :grinning_face_with_big_eyes:,mousexocean,2026-04-15 20:17:22,1,learnprogramming,t1_oge5r4g,True,
ogekvll,You're still pretty early in your journey but contests can actually help you learn faster even if you don't solve much at first. I'd say try some virtual contests on leetcode first since there's no pressure and you can take your time to understand the solutions afterward Just don't get discouraged if you can't solve anything in the beginning - even getting familiar with contest format is valuable practice,AccomplishedEase1569,2026-04-15 21:17:14,1,learnprogramming,t1_oge5r4g,False,
ogf6ttf,"Using a `Result` type here is a good choice. For things like invalid amounts, missing accounts, or insufficient funds, they're normal business outcomes - not exceptional failures - so returning a success/failure result is generally cleaner than throwing exceptions. I’d reserve exceptions for unexpected situations like file I/O failures, corrupted persistence, or programming errors. That said, the bigger thing I’d focus on isn’t whether `Result` is acceptable - because it is - but actually making the implementation correct and consistent. - here: `Result createResult = bank.createAccount(userId);` loses type safety - since `Result` is used as a raw type, Java no longer knows that `getData()` is an Account, so `getData()` is treated as `Object`. `createAccount()` should return `Result`- in `BankService`, operations like deposit/withdraw/transfer should return `Result` since they only need success/failure:```public Result createAccount(int userId)public Result deposit(...)public Result withdraw(...)public Result transfer(...)```Also:- your `transfer()` logic deposits back into the source account instead of the destination account. After withdrawing from `from`, you do `from.deposit(amount)` instead of depositing into `to` - so the money goes right back to the source account instead of the destination.Edit: few more:- there’s a menu bug in `Main.java: case 5` for transfer has no `break`, so successful transfers fall through into `case 6` and print all accounts.- in the account listing you print `User ID: "" + a.getId()` instead of `a.getUserId()`, so the displayed user ID is wrong.- you save users/accounts with `ExecutorService` then on exit return from `main` without calling `bank.close()`, and `shutdown()` doesn't wait for pending tasks to finish - so writes could be lost on program exit.- `Result` itself should actually be declared as `Result`. You're using `T` like a generic type parameter, but never declared the class as generic.Try to get in the habit of running your code through a linter, stepping through with a debugger, and writing a few unit tests for core logic. IntelliJ Inspections, SpotBugs, and SonarQube are great tools to get used to using. JUnit is extremely helpful as well. The only thing that I don't understand is that this:```public class Result { private final T data;}``` *should* have made your code fail to compile, unless you already caught that and forgot to update the repo.",gofuckadick,2026-04-15 23:11:44,1,learnprogramming,t3_1smfllp,False,
ogb2jm7,This subreddit. Read the wiki/faq.,niehle,2026-04-15 11:19:36,1,learnprogramming,t3_1sm2pcy,False,
ogb2y4g,"You’re actually in a great starting spot, everyone begins with that “I don’t know what I don’t know” feeling. The book is solid, but it’s not the easiest entry point. You’ll likely make faster progress starting with something like Python or JavaScript using interactive platforms such as freeCodeCamp or Codecademy, while building small, practical projects right away. Once you’re comfortable, then moving into C# will make a lot more sense and feel less overwhelming.Hope this helps!",No-Injury-1785,2026-04-15 11:22:17,1,learnprogramming,t3_1sm2pcy,False,
ogb96lw,"that’s actually a solid book, but to be honest jumping straight into C# + .NET can feel heavy if you’re still in the “don’t know what I don’t know” phase...what usually works better is starting with something where you can see results quickly, like small scripts or simple apps, just to build intuition. otherwise it can feel like a lot of structure before you even know what you enjoy building....also worth thinking about the *type* of thing you want to build for your life, like a simple tracker, reminders, or automation. that helps narrow the path way more than picking a language first....i’ve seen people stick with it longer when they start messy and practical, then go deeper into something like C# once they know why they need it.",Glad_Appearance_8190,2026-04-15 12:02:11,1,learnprogramming,t3_1sm2pcy,False,
ogbaec4,Read this first before you ever write a line of code https://en.wikipedia.org/wiki/Code:_The_Hidden_Language_of_Computer_Hardware_and_SoftwareKnowing code syntax without knowing how it is practically applied in computer science is like trying to memorize French so you can date a French girl.  You might be able to get by to a point but it will be surface level and you will never really truly understand it at a base level.,dromance,2026-04-15 12:09:28,1,learnprogramming,t3_1sm2pcy,False,
ogbddjv,What do you want to learn first? What do you want to create? That is a good answer to know. If you want to learn frontend/web development it is a lot different from backend programming.,Kenny-G-,2026-04-15 12:26:51,1,learnprogramming,t3_1sm2pcy,False,
ogc4hv5,"This comment combines different suggestions from [u/desrtfx](https://www.reddit.com/u/desrtfx) and [u/OctopusProgrammer](https://www.reddit.com/u/OctopusProgrammer) from separate threads mostly asking the same question as you.[u/desrtfx's comment:](https://www.reddit.com/r/learnprogramming/comments/1peodiw/my_computer_science_classes_are_too_hard_and_hard/nse2n3p/)> Course: MOOC [Python Programming 2026](https://programming-26.mooc.fi) from the University of Helsinki - free, textual, plenty practical exercises, top quality.>>Practice:>>+ small and simple: [Codingbat](https://codingbat.com/python)>+ larger and more: [Exercism](https://exercism.org)---[u/OctopusProgrammer's comment:](https://www.reddit.com/r/learnprogramming/comments/1oz1x3q/best_online_coding_course/npapakm/)>>\- [Automate the Boring Stuff with Python](https://automatetheboringstuff.com/) | a great **free** first option>>NOTE: You shouldn't have to pay a dime to get the foundations, cos there's so much great **free** material out there. The ones I've listed **below** are by people whose purpose is to make education **free** and **accessible**>>Some other great options for ""**Full-stack Web Development**"":>>\- **#1 Pick -** follow this post to the Discord server, you'll get all the clarity you need there. 4yr+ and it’s still a great place to start: [https://www.reddit.com/r/learnprogramming/comments/rlmulr/i\_ran\_a\_100\_free\_full\_stack\_web\_development/?utm\_source=share&utm\_medium=web3x&utm\_name=web3xcss&utm\_term=1&utm\_content=share\_button](https://www.reddit.com/r/learnprogramming/comments/rlmulr/i_ran_a_100_free_full_stack_web_development/?utm_source=share&utm_medium=web3x&utm_name=web3xcss&utm_term=1&utm_content=share_button)>>\- [Free Code Camp](https://www.freecodecamp.org/)>>\- [Full stack open](https://fullstackopen.com/en/) | by **University of Helsinki**>>\- [The Odin Project](https://www.theodinproject.com/)",playofWorlds24,2026-04-15 14:43:17,1,learnprogramming,t3_1sm2pcy,False,
ogft9id,"Not sure this [https://www.pixelstech.net/resource/learning/6-general](https://www.pixelstech.net/resource/learning/6-general) is okay for you or not. If u have enough time, you can follow it as it is a long journey.",Scary-Subject-1948,2026-04-16 01:18:56,1,learnprogramming,t3_1sm2pcy,False,
ogbxhem,"I did. That's why I'm asking about the book specifically, if that's also viable.",Indickthis_the_mato,2026-04-15 14:10:49,1,learnprogramming,t1_ogb2jm7,True,
ogbxsri,"Thank you, and yes. I wasn't sure about the complexities and intricacies of languages, as you'd imagined, I bet, and I wasn't really getting good results about good language starting points from what I was using to try to find out.",Indickthis_the_mato,2026-04-15 14:12:17,1,learnprogramming,t1_ogb2y4g,True,
og5bufa,"Stuff breaks = mental struggle = fix = stuff sticks.That’s how you learn. Cognitive effort is annoying, but it’s the only way you learn.",Environmental_Gap_65,2026-04-14 15:22:12,7,learnprogramming,t3_1slbqau,False,
og5noda,Use a proper text editor. In this day and age you should not run into indentation problems.,thuiop1,2026-04-14 16:14:50,3,learnprogramming,t3_1slbqau,False,
og5femo,"Lots of small experiments with fast feedback, plus Python's debugging and introspection capabilities. (You need to learn `breakpoint()`, `help()`, and `dir()`, at minimum.)I learned using the REPL, but a Jupyter Notebook might be even better. Now that I know what I'm doing, I can write fairly large amounts of Python code and have it be mostly correct (and can easily debug the rest), but when starting, you want to make very small incremental changes and test each one.",Gnaxe,2026-04-14 15:37:57,2,learnprogramming,t3_1slbqau,False,
og5dtff,"exactly this, debugging those silly mistakes is what actually teaches you the language patterns. i remember spending like 2 hours trying to figure out why my loop wasn't working just because i mixed up = and == in condition - felt stupid but never made that mistake again the indentation thing becomes muscle memory after few weeks, just keep at it",Equivalent_Pop5425,2026-04-14 15:30:54,2,learnprogramming,t1_og5bufa,False,
og7rpod,There's no truer statement about learning a skill like this or really any skill. Failure makes it stick.,cheezballs,2026-04-14 21:54:13,2,learnprogramming,t1_og5bufa,False,
og5csie,Yeah that’s a good way to put it. I think I’ve been avoiding that “struggle” part a bit too much instead of just pushing through it :grinning_face_with_sweat:,mystic_special,2026-04-14 15:26:22,1,learnprogramming,t1_og5bufa,True,
og5e13v,"Get used to it. There's a lot of struggling in programming. You'll get better, the problems just get harder.",grantrules,2026-04-14 15:31:51,1,learnprogramming,t1_og5csie,False,
ofz80h4,"You know what you need to do, right? You need to write the code yourself. It doesn't matter if you understand the code after it's been written - you are doing the equivalent of having someone else write the code for you and explain it to you and now you are wondering why you can't write the code yourself.Go back to some earlier, easier projects and do them yourself. It's okay to look stuff up (we do that all the time), but don't look up *solutions*. Look up *individual steps*. Don't know how to write a function? Look it up. Don't remember how to center something? Look it up. Don't remember how to start the thing in the first place? Look up the very first example, copy it out, and then build on that.",lurgi,2026-04-13 17:39:10,13,learnprogramming,t3_1skht5z,False,
ofzg9x4,"I think you need to change your mindset from “completing the weather app” to “learning to code”. At the moment, you should stop with the project if you’re doing it in such a way that you don’t even understand what you should be asking out of stack overflow of documentation. Then your focus’s should be pseudo code, not edge cases, not syntax.Once you have the code, implement it, test it step by step, then when you get stuck then debug by yourself using documentation. Remember, you’re looking to solve small steps not to find whole solutions for the whole weather app.",emt139,2026-04-13 18:15:32,3,learnprogramming,t3_1skht5z,False,
ofz6cps,"honestly copilot dependency is super normal right now, i’m 30 and still googling “how do i do X in js” every day, degree or not they all google and struggle for months, esp with how bad jobs are now",chocolate_asshole,2026-04-13 17:31:59,3,learnprogramming,t3_1skht5z,False,
ofzlv14,"Programming is getting to the point where AI use is expected and you as a programmer is expected to architect and manage it. If you’re hired to build a house, you hire and direct contractors, the person who hired you now doesn’t expect you to build it all yourself.Especially in an industry where outcomes and results are paramount to how you got to them. You still need to be able to evaluate these contractors tho, the outcome is dependent on your judgement.",cerebralriot,2026-04-13 18:40:40,2,learnprogramming,t3_1skht5z,False,
ofzimzl,"You should spend more time thinking rather than just writing(copy pasting) code, Try writing everything in plain English on a notepad or notebook first, then google or use AI to figure out the ""how to"" parts, slowly you will build a pattern to do critical thinking",CAPTAIN-GOD_USOPP,2026-04-13 18:26:04,1,learnprogramming,t3_1skht5z,False,
og0pk5y,Dev like legos. Which block do you have. Write code using all you know into something functional if you don't know enough use error messages to help you. Then think what could be. Nice add on. Look up that feature only. Add it now make a new project with that feature and continue for each feature you learn do more mini projects that call ok some of the previous features you've learned to reinforce it,Jumpy_Fact_1502,2026-04-13 21:42:57,1,learnprogramming,t3_1skht5z,False,
og2gdal,"""I'm losing hope and I feel like a failure."" OP this is what you need to work on. I have a suspicion that shame-cycles and feelings of failure are thematic for you. Seek therapy for this and everything you do will be clearer. On AI and programming-there is no morality here. Do what makes you productive. Using AI is how programming is done professionally now-you just can't keep up without it. The entire third world can describe what they want badly, hit ""yes"", test and repeat. Do you believe that the MBAs give a single fuck about all these nerds pearl-clutching and gatekeeping about ""real programmers"" or do they care about productivity?",shrodikan,2026-04-14 03:36:49,1,learnprogramming,t3_1skht5z,False,
og36yef,"Hey! I’m also doing the Odin Project and I’m a little further along than you. If you need help with projects, join the discord and ask in there rather than relying on AI. As other have mentioned, AI can be a really use tool in the workplace, but you’re not there. Your goal doing TOP isn’t productivity, it’s learning. If I remember correctly there are some instructions on how to use third party APIs in the previous couple of lessons and some guides on how to use asynchronous functions. Go back, study those and get those down in isolation, then come back to the weather project",acuddlywookie,2026-04-14 07:03:39,1,learnprogramming,t3_1skht5z,False,
ofzg00r,"Ive heard of the Odin project but dont know the specifics.What type of app is it? Is it a web app? Do you know what framework/language youre using?Typically you start by planning out the app, where people will use it, web or device, then plan out the features, what entities you need based on the features, what is your UI going to look like, what services are you going to use? where is the data coming from?you do all this before writing code. Its like building a house, you follow a blueprint /plans. You dont start but chucking a pile of blocks into a field. Also your point on being too old for a degree is bullshit. Im graduating from a 4 year degree this semester at 32.",EdwardElric69,2026-04-13 18:14:18,1,learnprogramming,t3_1skht5z,False,
ofzt3lj,"You’re not alone in feeling like you’re too late to learn. Everyone has been there—staring at a blank screen, not knowing what to do next.- Write down what you want to build- Break it into small features- Think about how each part will work- Start with the simplest version (don’t aim for perfect)- Build one feature at a time- Test as you go- If you get stuck, take a short break and come back- Look for help, but try to understand the solution- Keep your code simple and clearBe patient—learning takes timeJust keep going step by step. You’ll improve more than you think.If you are too much dependent on copilot turn it off or if you want to build for better muscle memory use text editor like sublime text",hyper4saken,2026-04-13 19:12:59,1,learnprogramming,t3_1skht5z,False,
ofxwvtb,"tl;dr: Honestly it sounds like you just need to find a tutorial project to stick with and create an app it tells you to make so you get an idea of the full process.> How can I learn?Start with the subreddit's FAQ in the sidebar: https://www.reddit.com/r/learnprogramming/wiki/faq> once I've written the code, what do I do with it?""It depends."" Is this on a desktop? Is this a program you just run for yourself, or on coworker's machines, or available for download by the public? (You might need an installer.) If this is a web app, you'll need to buy web hosting somewhere. If this is a mobile app, you'll need to register with the Apple/Google app stores to get it listed. If it's a video game, you'll need to look up how to register on Steam and get the game uploaded there.> Where do I execute it?For my random Python scripts, I just have a folder named ""scripts"" under my home folder, so I can run `python ~/scripts/example.py` or I run `chmod +x ~/scripts/example.py` so I can just run `~/scripts/example.py` But again, ""it depends"".> If I need to create a program, where do I get the various data files from?It depends. What is the program that you want to do? You'll need to find APIs and register to get an API key (kinda like a password) to use them, and those might be free or paid. (For example, a weather info service might let you sign up for weather updates.) Or you can find public ""data sets"" of other info.> How do I create anything other than simple functions, like an interface?""GUI framework"" is the term you want to Google. Python comes with tkinter which is nice because you don't have to install it (except on Linux) but it's a bit persnickety. PyQt and PySides are other popular ones for Python. If you're making a web app, you'll be coding in JavaScript and probably want to find a framework for that. (React is a popular one but fairly heavy. I'd just stick to basic HTML and JavaScript to start.)",AlSweigart,2026-04-13 14:09:45,3,learnprogramming,t3_1sk7trz,False,
ofx3z8m,For data analysis stuff you'll want to get familiar with Jupyter notebooks - they're perfect for biology work and let you run code in chunks while seeing results right away,WarthogGreen4115,2026-04-13 11:28:11,2,learnprogramming,t3_1sk7trz,False,
ofx4gqc,"[This](https://cs.stanford.edu/people/nick/py/python-about.html) seems like a good starting point to answer your immediate questions. Definitely enroll in a programming class at your university/school or online though, it will be good to build a foundation for it.",Cutalana,2026-04-13 11:31:31,1,learnprogramming,t3_1sk7trz,False,
ofyas78,"there's a playlist named sql DBMS crash course prolly 40-50 videos in yt, I think it will help you and alighn with your intrest",Striking_Rate_7390,2026-04-13 15:12:31,1,learnprogramming,t3_1sk7trz,False,
og26jh1,"You are on the right track, and what you are missing is not coding itself but how to use it in real workflows. A good next step is to practice in environments like Google Colab, Kaggle Notebooks, or Jupyter Notebook, where you can run code, load datasets such as CSV or biological data, and immediately see outputs like tables and graphs.",msn018,2026-04-14 02:35:03,1,learnprogramming,t3_1sk7trz,False,
og2jgqm,"youre actually at the normal next stage. syntax is one thing, using code in the real world is the real skill.most coding is just:get dataclean itanalyze itshow resultsfor biology id focus on:python + pandas for csv/excel filesjupyter notebooks to run code step by stepsql for datasetsgraphs with matplotlibwhere do you get data? kaggle, public biology datasets, gov data, lab exports, or your own csv files.dont worry about interfaces yet. beginners waste time trying to build apps before solving real problems.if i were you id start with one project: download a biology dataset, analyze it, make charts, explain what you found. thats how you really learn.also learnzy.io. helped me understand some technical stuff faster before going deep.",Narrow_Detective9864,2026-04-14 03:57:48,1,learnprogramming,t3_1sk7trz,False,
og31khz,"This is a really good question you’re basically asking how programming connects to the real world.Simple breakdown:* You run Python either **locally (on your computer)** or in tools like **Jupyter Notebook / Google Colab*** Data usually comes from **files (CSV/Excel), APIs, or public datasets (like Kaggle)*** To build something beyond scripts, try **Streamlit** or **simple web apps**Honestly, you’re already past the hardest part. Now just focus on small projects like: “load dataset → analyze → visualize → maybe build a small app",PalpitationOk839,2026-04-14 06:17:28,1,learnprogramming,t3_1sk7trz,False,
ofx5htk,"Thankss!! I took a look, it seems a bit advanced for my current knowledge, maybe reading the documentation will help me get my bearings. Anyway, it seems like a really good thing to explore.",Tenc5123,2026-04-13 11:38:28,1,learnprogramming,t1_ofx3z8m,True,
ofsk3yw,"c++ pays well but it’s kinda niche now, usually stuff like game dev, finance trading systems, high perf backend, embedded, robotics, etc. focus on data structures, algorithms, concurrency, memory. leetcode helps. internships matter more than random courses tbh. hard part is getting that first role, everything wants 3+ years, job market is pain right now",bootyhole_licker69,2026-04-12 17:59:46,1,learnprogramming,t3_1sjldti,False,
ofteks9,"C and C++ are used in more specialised areas, not general app developmentcommon paths are embedded systems, robotics, game engines, high performance systems, finance, and operating systems workSince you’re good at math, areas like finance or performance heavy systems could suit you well, but these fields usually expect deeper knowledge, not just syntax things like memory, concurrency, and system designIf you’re unsure, you can combine C++ with something more practical for jobs and explore deeper fields alongside",Dry-Hamster-5358,2026-04-12 20:24:03,1,learnprogramming,t3_1sjldti,False,
ofx6aoj,useless. AI will eat you at breakfast.,quantr88,2026-04-13 11:43:50,1,learnprogramming,t3_1sjldti,False,
ofslbq4,but how to find an internship because I'm ACC/fin student :loudly_crying_face:,Either_Cockroach6353,2026-04-12 18:05:22,0,learnprogramming,t1_ofsk3yw,True,
ofx7vr0,Maybe at dinner,Amirhassan5303,2026-04-13 11:54:03,1,learnprogramming,t1_ofx6aoj,False,
oflov7z,"I don't see any obvious problem, but I'm currently on mobile and can't run it. I will take  a look when I have an opportunityDoes anything become visible when you mouse over a button, changing the state to Active?  Maybe try adjusting the colors to just black and white while you make adjustments.As an aside, instead of retyping out the font tuple separately for each button, just make a font object and pass it to the parameter for each. It will make adjustments simpler as you can just change it in one place for all buttons.```button_font = tkinter.font.Font(family=""Times New Roman"", size=12, style=""bold"")```",Outside_Complaint755,2026-04-11 17:15:54,2,learnprogramming,t3_1siofat,False,
oflyl87,Could you post a link to the tutorial?,Middle--Earth,2026-04-11 18:01:05,1,learnprogramming,t3_1siofat,False,
ofls4xz,Even when i click or when the mouse is over a button nothing become visible. I tried to adjust the colors into fg='white' and bg='green'.,Relevant_Milk4413,2026-04-11 17:31:12,1,learnprogramming,t1_oflov7z,True,
ofmmbmo,https://youtu.be/HrWJzzfU9Z0?is=mNFZUqFj4iiCHJJVIt's in (indian)english,Relevant_Milk4413,2026-04-11 19:59:45,1,learnprogramming,t1_oflyl87,True,
ofni4f5,"Ok, I got this figured out. The ultimate underlying problem is with your `width=23,height=16,padx=2,pady=6,` parameters.For a button with a text label, width and height are not in pixels, but instead width = characters wide, and height = rows of text. As a result, your buttons are being created much taller than needed (16 rows tall), going below the limits of the ButtonsFrame, and the text is hidden down there.A couple of ways to fix this:1) Remove the width, height, padx and pady parameters from your buttons.2a) You can add width back in if you want to set a different width for each button, but remember it is character based, not pixel.2b) Alternatively, set the column weight for each column to 1, and then set the parameter `sticky=""EW""` for each call to `.grid()`. This will cause all the buttons to auto-size and fill the frame.Example:``` btnExit = Button( Buttonsframe, text=""Exit"", bg=""green"", fg=""white"", font=(""times new roman"", 12, ""bold""), width=10, height=1, ) btnExit.grid(row=0, column=5, sticky=""EW"") # Add this sticky parameter to each grid call to force auto-sizing. # Now we must set a weight for each column for auto-sizing to work # By getting grid_size from Buttonsframe, this will automatically update if you add or remove buttons. for column in range(Buttonsframe.grid_size()[0]): Buttonsframe.columnconfigure(column, weight=1)```2c) Instead of using grid with sticky and setting column weights, you could use pack and tell it to expand:```btnPresciption.pack(side=""left"", fill=""both"", expand=True)```Note that you can't mix grid and pack in the same frame, so you have to change all buttons to use pack or all have to use grid.",Outside_Complaint755,2026-04-11 22:48:57,2,learnprogramming,t1_ofls4xz,False,
