id,body,author,created_utc,score,subreddit,parent_id,is_submitter,distinguished
ooea0e4,"It really depends. I use AI for quick one time scripts or prototyping some functionality before I implement the actual feature/tool/application. What I found is that I usually spend more time debugging AI code than me just writing the code myself. As for generating boiler plate code, I already use deterministic generators to create structs for APIs which is much better than the slot machine that is AI. \*\*edit\*\* Forgot to mention, I have found AI extremely useful for AWS lambda functions due to how small lambda functions are.",Altruistic_Raise6322,2026-05-28 16:07:02,8,cscareerquestions,t3_1tq7s9h,False,
ooecu0i,"It’s a lot of that “Pablo Escobar Thinking” meme. AI can be good at writing code if you are careful about what exactly it is writing. Otherwise, if the ticket is “human codeable” by my estimation, I use the AI as a “super search” to augment my coding. I rarely run into tasks I think are a “perfect size” for AI.If it is too small, the chance is too high that the AI fucks it up and I have to spend more time fixing it than if I just coded it at all.If it is too big, the AI will not be able to get it all in one session, and you have to figure out how to chunk it up appropriately.",Terrariant,2026-05-28 16:19:20,5,cscareerquestions,t3_1tq7s9h,False,
ooee3gp,The job of a SWE used to be endless hours of head scratching google search and stack overflow if that helps.,Legote,2026-05-28 16:24:51,3,cscareerquestions,t3_1tq7s9h,False,
oof6vq9,It’s the same as always. Developing software. Using your brain. That’s it.Unless you work in copypaste basic CRUD factory. Then it’s copypaste or waiting for AI to get stuff done.Choose wisely.,symbiatch,2026-05-28 18:29:40,3,cscareerquestions,t3_1tq7s9h,False,
ooeanle,"It really depends on the codebase and the standards for quality and how much test coverage exists. Overall its like you have a (cracked) jr developer you can ask to analyze code and check things and then reviewing their changes and suggesting better alternatives and holes left. Its a collaborative process where a magic machine can read a lot of code really fast but can also make errors or produce poor solutions without guidance. If you work somewhere that they do not care about the errors (or have great test coverage) or poor solutions dont matter, then its probably pretty different.",freqCake,2026-05-28 16:09:51,2,cscareerquestions,t3_1tq7s9h,False,
op9a37g,"I have the exact same feeling. It was such a rush to first discover how powerful the modern agents are. But after a few weeks of using it, it's so boring.",zoned_off,2026-06-02 04:24:25,89,cscareerquestions,t3_1tug259,False,
op9a8gm,Each morning create a list of things you want to accomplish. When things are done check them off. When the list is done you’re done for the day. You’ll have an endless amount of things to do but limit what you will do. When you’re done then stop. Do something else. Read a book for fun. Go on a walk. Do less. But track everything to show your accomplishments.,AI_is_the_rake,2026-06-02 04:25:28,69,cscareerquestions,t3_1tug259,False,
op9cgl2,"Same here. It’s gone from something I do for enjoyment and luckily get paid for it to “just a job” like all my finance friends describe it. In my free time I used to even enjoy learning new languages, design patterns, or services but now I just have no motivation. Thinking I will go into semi retirement soon. Take a pay cut and just do chill part time job. I have no interest in seeing where this train goes",fingerling-broccoli,2026-06-02 04:41:41,14,cscareerquestions,t3_1tug259,False,
op9qcwu,this is an ad btw,AaronAardvarkTK,2026-06-02 06:30:59,30,cscareerquestions,t3_1tug259,False,
opa7452,"What I'm doing it's just deciding to do something myself, to keep the feeling of actually being the one doing stuff.I can't return, for now at least, to majority of manual coding because management is breathing down my neck.But I enjoy coding too much to let it go, so I just say ""okay this is my method/ class/ logic"" and I write it and debut it ""old way"", preferably something that isn't boiler plate.Also restructuring AI code can be kinda satisfying, yesterday Claude wrote a 100 line long method with also hard coded server passwords in it.Dividing it in smaller methods and moving stuff in appropriate properties files was surprisingly nice. Made me feel there is still a place for me.Idk maybe I'm just coping",ErZicky,2026-06-02 08:54:20,4,cscareerquestions,t3_1tug259,False,
opa7dlz,Dial it back. Take some time off too if you can.,PureCamel,2026-06-02 08:56:38,3,cscareerquestions,t3_1tug259,False,
op9btdx,"The nature of software development has changed. Less creative freedom and autonomy as an employee. Prompt cog code review job. That said, now the sky is the limit for one or two person start ups, or to buy a business and automate it. You can still get dopamine, just no longer from hand coding and coffee walks",SteviaMcqueen,2026-06-02 04:36:57,7,cscareerquestions,t3_1tug259,False,
op9hxjo,"It's like desktop support all over again! I do miss helpdesk, I like people. I'm work from home now... sad panda.",bananaHammockMonkey,2026-06-02 05:23:14,2,cscareerquestions,t3_1tug259,False,
op9pdi1,"You are now a code conductor. But like you, my code velocity has grown exponentially",TrojanGrad,2026-06-02 06:22:54,2,cscareerquestions,t3_1tug259,False,
opb4drs,"I'm actually seeing a therapist that specializes in work psychology to help deal with this. Until I (or I guess, we) come up with a solution or better ways to cope, I'm essentially taking it easy. I make sure all the tasks assigned to me are still done but prioritizing my mental health first.",Krikkits,2026-06-02 12:45:55,2,cscareerquestions,t3_1tug259,False,
opdxffs,"As a senior developer it does feel like my time is saved. Mostly because I already pretty much know the code I would write ahead of time. So I'm able to watch the agent writing code in real time and say ""Yup that's what I'd do too."" or ""Nope that's way outta line better write a new prompt to guide it better."" By the time the review comes out I don't think the review takes much longer than it ever did before because the agent is still only working on small chunked out user stories. But also because I've already guided it well when the agent was running. So I can explain any questions the reviewer has.",ObeseBumblebee,2026-06-02 20:24:05,84,cscareerquestions,t3_1tv2w1p,False,
opej6rn,"A while ago I attempted a side project using Codex.However, I wanted to ensure that I understood every line of code written and every design decision made.And I found that it wasn't as enjoyable as I thought it would be. Because whilst the code was generated faster, at the end of the day I wasn't the one writing it and I couldn't say that I really ""understood"" the code any more than a reviewer understands somebody else's code.I would describe the sensation as clinging onto the back of a Formula 1 car wizzing down a racecourse - I felt like I was constantly at the limits of my grasp, trying to catch up with what AI was doing. On the other hand, writing the code myself would perhaps be more like a marathan runner - you're not moving as fast, but at least it is *you* who are moving; *you* are the one doing the legwork.So based on that experience, I came to the conclusion that working with agents necessarily trades understanding for speed.(Some people will say that this isn't anything new, that this is just another iteration of moving up a level of abstraction, like Assembly -> C. However, the difference is that the ""correctness"" of code largely wasn't affected by such transitions. The analogy with LLMs would be that a spec is ""compiled"" to code, in the same way that C compiles to machine language. But this spec -> code ""compilation"" process cannot be compared to that of C -> machine language, which is essentially deterministic. At work I run into problems due to ambiguous statements in the spec all the time - in fact, it's probably the number one issue I encounter when reviewing.)",TwoPhotons,2026-06-02 22:08:57,4,cscareerquestions,t3_1tv2w1p,False,
opdzlyy,"Coding agents are pretty good at writing code as long as you give it enough information and guide it, sometimes with a strong hand. If your prompt consists of 'make me a Netflix enterprise system, dont make mistakes' then yea you are kinda screwing yourself over on many different levels. Whereas if you take the time, as you should be even during your line of work pre-llm, and scope out the requirements, break it down to sizeable workable chunks then it does become a pretty good productivity booster while still retaining the core understanding of the codebase. Almost no one expects you to remember code lines by heart etc... but almost all good senior engineers/architects know just enough of the flow to understand what the overall nature of the functions are. You don't remember every helper functions there are, just know that they exist due to x business requirement and some funnel into a more important parent function you care the most about. Same concept. Also this whole reviewing code argument only holds water when you have sloppy devs that try to PR out a 1k LOC. But that is a completely different issue on its own. A more disciplined developer will already be mindful of breaking things down into manageable chunks which have many values including easier PR (and thus easier code to understand), prevent exponential token burn/waste, minimize context rot/hallucination etc...",cssegfault,2026-06-02 20:34:05,10,cscareerquestions,t3_1tv2w1p,False,
ope57ji,I am getting tagged in so many more PRs to review. I spend half my day reviewing code.Now that we have Claude code - the frontend engineers are creating pull requests in the server code. The PRs are hard to review because often the code itself looks fine - but the rationale behind the changes is totally wrong. Changes are being introduced that don’t match our overall design or seem like “one offs”It can be time consuming trying to figure out what problem they were encountering and suggesting a better approach. It’s also a lot of context switching being bombarded with so many PRs from different parts of the codebase,peepeekisses,2026-06-02 20:59:59,2,cscareerquestions,t3_1tv2w1p,False,
opdz19z,"Yes, I really do believe that full autonomous agents can't replace humans because you can't remove humans from the loop without loosing accountability.Who wants to pay for a product without accountability ? Accountability is everything in business So, humans need to be part of the loop, either reviewing code or writing it. Since it's pretty obvious that agent write code better, then we need to review it.But, to review agentic code, you really need to ""own"" the solution. You need to know how things worked before, and what agentic code changes. That requires time. More code agents write, you need more to review it. But here's the caveat, not only you have to review the code syntax, you need to review business logic. Which is hard when you didn't wrote that code. So, to sum up, I don't think LLMs speed up Software delivery lifecycle, it just shifts the focus from writing code to everything else.This, in theory, should result in client having better solution, not faster one.",uniform-convergence,2026-06-02 20:31:25,2,cscareerquestions,t3_1tv2w1p,False,
opeu6k4,"for me it depends a lot on how im driving it. if im prompting in small chunks and watching it work, i basically end up with code i would have written anyway — just typed by claude. but if i hand off a whole feature and come back later, yeah im reviewing in the dark and missing stuff.i build small indie apps where i own every line tho, so its easy to keep the whole thing in my head. reviewing someone elses agent-written PR in a 500k loc codebase is a totally different problem",uberneenja,2026-06-02 23:06:37,1,cscareerquestions,t3_1tv2w1p,False,
opezavb,You need to understand it all. Having chunks and stories is crucial for this. Once you figure out your workflow it becomes rewarding,bluegrassclimber,2026-06-02 23:34:35,1,cscareerquestions,t3_1tv2w1p,False,
opfrdb6,"I think something AI has done is forced teams to take a really hard look people need to take at their existing practices. If you already had bad code review processes (rubber stamping, self reviews), bad testing (low coverage, low quality tests, tests that don't reflect true cases, manual tests), bad software delivery practices (long deploy times, frequent roll backs, difficult roll backs, large downtime during a change) or bad developer culture (teams are 100% utilized every sprint, on calls are stressful, high blame retros), then AI has cranked up all of your faults to 11. Managers who have rushed in to the AI space without making sure their team already functioned, especially while demanding improved ""efficiency"" by implementing asinine metrics, have created giant unmaintainable messes. No one understands the code, but even if they did, the code is changing anyway and people are leaving the team.Teams need to be ready to make investments that improve their coding practice way before they will see any benefit to any significant use of AI. Otherwise, AI use's efficiency gain caps out at ""increased typing speed"".",kblaney,2026-06-03 02:13:41,1,cscareerquestions,t3_1tv2w1p,False,
opg3luf,"I think it depends on the kind of project.Frontend is mostly trivial and very easy to review and test. It made me fly even with basically no frontend experience.Complex systems have been a huge headache. It gaslights you so bad and with so much security about stuff it totally misunderstands. It doesn't matter how much context you give it, they are just not made to be creative, agents are repetition machines, and if you're doing something truly new it will mislead you a lot and make you waste lots of time with contradictory ideas. The productivity probably evens out or gets actually worse than if you spent time to do it right from the beginning.",NoSupermarket6218,2026-06-03 03:28:18,1,cscareerquestions,t3_1tv2w1p,False,
opg7l9f,"i think understanding the code is important but honestly if it does work, is there a problem? i definitely would argue against this but imagine software that purely verifies outcome. if a system works and passes tests, does it matter if it’s readable to a human? the ai would eventually figure it out to meet an expected outcome",Qphex,2026-06-03 03:54:42,1,cscareerquestions,t3_1tv2w1p,False,
op6wp8w,I wouldn’t focus at all on that last part. Whoever got the job probably also knows the tech.,JackfruitNarrow840,2026-06-01 20:20:30,45,cscareerquestions,t3_1tu4d95,False,
op76w92,Don't view the rejection as a reflection of your actual abilities and more about the impression you left. One is easier to improve on than the other.,2itb0x,2026-06-01 21:07:14,39,cscareerquestions,t3_1tu4d95,False,
op8tx7m,You have skills it’s just too many resumes to sift through. You’re probably getting auto-rejected most of the time either due to resume or some filter to pare down the amounts.,MonochromeDinosaur,2026-06-02 02:36:53,11,cscareerquestions,t3_1tu4d95,False,
op8tyir,"I just don't worry about it. In fact I always assume I'm not getting the job while going though the interview process. So I'm just going through the process being me and whatever happens happens. So far I'm always correct in that I didn't get an offer, lol.",diablo1128,2026-06-02 02:37:07,8,cscareerquestions,t3_1tu4d95,False,
opa20qi,"Yeah I have that a lot as I suck at interviewing and tbh, the bar has changed a lot in 5 years. Just don't let it affect you too much, and focus on what you can learn from the interview and what you can do better.",topspin_righty,2026-06-02 08:09:45,2,cscareerquestions,t3_1tu4d95,False,
opaycke,"5 years of experience doesn't automatically translate to passing structured interview loops, those are basically their own skill set. Grind the patterns, mock interviews, system design until it feels mechanical. A lot of people with solid real-world chops tank screens just because they haven't practiced communicating tradeoffs under pressure.",Opening_Bed_4108,2026-06-02 12:12:08,2,cscareerquestions,t3_1tu4d95,False,
op9g416,are you getting interviews? get some feedback. lots of people know the tech that is required for the job.,Tight_Abalone221,2026-06-02 05:09:06,1,cscareerquestions,t3_1tu4d95,False,
op9lfxb,Hmm,Rude_Context_4844,2026-06-02 05:50:58,1,cscareerquestions,t3_1tu4d95,False,
opecvhi,When has it ever been just writing code?,QuitTypical3210,2026-06-02 21:37:05,18,cscareerquestions,t3_1tv4b7n,False,
opea324,"My exact thoughts after 1.5 years in the industry so far! Yes, there are days where it’s balls to the walls coding, but there’s so much more to Software Engineering than just writing code.",LeeKom,2026-06-02 21:23:22,17,cscareerquestions,t3_1tv4b7n,False,
opef8x1,"My Software Engineering college class nearly 30 years ago taught me this. We spent 80% of the course interviewing stakeholder to refine requirements, creating spec, architecting, and only the last 20% of the course was actually coding the project.",boner79,2026-06-02 21:48:51,5,cscareerquestions,t3_1tv4b7n,False,
opeafyc,"Being quick with the keyboard is still a great skill to have tbh. Even if you aren’t writing code, basically everything else you have to do can be sped up if you type fast. It also stops your brain from getting bored with typing since you won’t have to focus on it as much.The best part is that you can probably teach yourself to type properly in not even a month. All I did was 5-10 mins of practice a day and my typing improved by like 50x in a matter of weeks",TheDinoDynamite,2026-06-02 21:25:07,13,cscareerquestions,t3_1tv4b7n,False,
opefxqd,"the SDLC is indeed quite complex, and there's a reason SREs are in high demand in this AI-driven development world.wait until you realize that you're only building software to support some business initiative and that taking egregious shortcuts on all sorts of shit is preferred/the right way to do your job.",MoreHuman_ThanHuman,2026-06-02 21:52:19,3,cscareerquestions,t3_1tv4b7n,False,
opefuip,Depends on the company. My current role is 99% coding.,l34ch_r,2026-06-02 21:51:52,2,cscareerquestions,t3_1tv4b7n,False,
opeppgz,"The only time it’s ever been about just code is at the very junior levels.The more senior you get the less coding you do, and you move more into design , process and then stakeholder management.The best people you’ll work with are those which understand that there is bigger picture but have spent there time in the trenches doing the coding - and have (I hate to say it) some level of social skills.",kartoffeln44752,2026-06-02 22:42:44,2,cscareerquestions,t3_1tv4b7n,False,
opeas74,Wait till you find out what teachers do for a living,noBoobsSchoolAcct,2026-06-02 21:26:46,1,cscareerquestions,t3_1tv4b7n,False,
opecslq,"Learning fast, you are.",nikospkrk,2026-06-02 21:36:40,1,cscareerquestions,t3_1tv4b7n,False,
opeh7sf,"Coding is just one aspect of the job. Research is also a big part, I spend a lot of my time doing research based work as part of the job.",BeMindfulness,2026-06-02 21:58:46,1,cscareerquestions,t3_1tv4b7n,False,
op1p916,"Hello Op Se with 6+ years exp here. Here is my advice 1) Put personal feelings and work aside. You can be passionate about what u do but uds that work is ultimately a business separate ur feelings when doing the job2) Start applying, put aside time to study dsa/sys design and behaviour. I suggest getting hello interview. And this is something you should constantly doing whether you happy or not. Always network 3) personally left my first job in similar shoe as you after a year no regrets.",AffectionateEstate84,2026-06-01 01:18:41,13,cscareerquestions,t3_1tt5gb1,False,
op05t47,"Literally no one gives a shit about personal projects. I have never, not once, looked at a candidate's personal github. This is a meme people tell to recent graduates, but no one actually cares if you have experience because everyone gets you're not gonna be building some shitty personal project if you were working full time.Same for referrals, just ask a coworker to refer you, it doesn't have to come from your CEO.",skyper_mark,2026-05-31 20:11:37,35,cscareerquestions,t3_1tt5gb1,False,
op12y1l,"Edit: this turned into a small rant. Skip to the lasts paragraphs for my advice OPI don't think the majority of devs really enjoy to code 100% through Claude.But the upper suits don't care so they push you to do it.For some developers turning to full AI and accepting it was easier.For others like you and me it's Harder, for me because I like coding, it was something enjoyable in between meetings, presentations and whatnot. The moment where I could put to use all the skill I've learned in my life and translate my idea into code. And now is, not so slowly, going away.There are skills to be learned into using Claude and similar agents. It just feel...idk, soulless? Like I don't get the satisfaction of solving problems anymore. The feeling of banging my head against a problem and conquering it at the end. I'm sure we are gonna find a satisfaction in this profession again eventually, it's just hard transitioning to a new identity as developers and it'll take time.Anyway As for you, I would start looking to chance company if you feel like that environment isn't for you anymore. Don't expect to be a quick thing. It could easily take a year or more, as sometimes you could struggle to find jobs to apply for days or selection processes can last a month or two.If you like it don't stop coding by hand, it's still knowledge worth keeping alive.Things will get better eventually I hope.",ErZicky,2026-05-31 23:04:24,5,cscareerquestions,t3_1tt5gb1,False,
op09vsv,"You're unlikely to get another job with your YOE unless you have a really good internal referral, like someone you used to work with who can vouch for you to a hiring manager, especially a job that pays more than you make now. It could technically be a bit easier for you as startup experience is generally valued more, but it's still likely not gonna help without a referral.More importantly, if everyone at your company is using Claude to do 100% of their work, why exactly are YOU still being singled out as the lowest performer? Are you saying you can't even reach the minimal bar your coworkers have set?",Winston_Wolfgang,2026-05-31 20:31:37,17,cscareerquestions,t3_1tt5gb1,False,
op2d8vt,"It's ironic all the gatekeepers preach ""don't get into this job for money, you won't succeed without passion"" yet all the passionate people now hate their jobs due to AI and want to quit their job / quit the industry...",JordanUK4,2026-06-01 03:54:31,6,cscareerquestions,t3_1tt5gb1,False,
op1e5qt,">he clearly values speed over anything else.Welcome to the software industry :face_with_diagonal_mouth:. Most leaders are addicted to speed. Unfortunately, the market often still rewards fast-and-shitty over slow-but-good.You're right to be concerned about burning a bridge. It's worth completing your contract especially since you're presumably young.Consider moving to a sector like healthcare or finance where certain regulations end up forcing things to sometimes go slower than faster.",Squidalopod,2026-06-01 00:10:31,4,cscareerquestions,t3_1tt5gb1,False,
op0modi,"Growth is your own responsibility, don’t expect others to be handholding you.Most of my skillset growth came from stuff I did on the side, be it doing projects, hacking on stuff I found interesting or downright reading SDK source code to get a better understanding on DS&A low level stuff",lhorie,2026-05-31 21:35:28,4,cscareerquestions,t3_1tt5gb1,False,
op199td,Wait until you see a truly miserable workplace,clara_tang,2026-05-31 23:41:22,2,cscareerquestions,t3_1tt5gb1,False,
op19u3h,I was told by a senior developer in industry to learn Claude to get an entry level software job. I'm quitting. This is nonsense.,Desperate_Cook_7338,2026-05-31 23:44:44,4,cscareerquestions,t3_1tt5gb1,False,
op2bfvz,"Almost every software job has turned into an AI prompting job. In 40 years, I can see people telling their grandchildren stories about how they used to write software by actually typing it out, and got paid good 6 figures for doing it, and nobody believes them.",fsk,2026-06-01 03:41:50,2,cscareerquestions,t3_1tt5gb1,False,
oovwrfi,HR knows shit,Fuzzy-Armadillo-8610,2026-05-31 04:23:37,53,cscareerquestions,t3_1tsl0rf,False,
oow29je,I work on things that I don’t know how to do. That’s how you learn and grow.,kevinossia,2026-05-31 05:05:14,21,cscareerquestions,t3_1tsl0rf,False,
oovxpb1,"It's not bullshit, we learn a lot of things during our work compared to other jobs. Tasks are usually not repititive and you discover something newBugs wouldn't be there if you knew them alreadyAlso you can learn a lot from design meetings, helping others etcI still look on my code when I deliver with AI. AI doesn't change my learning",Mast3rCylinder,2026-05-31 04:30:30,86,cscareerquestions,t3_1tsl0rf,False,
