id,body,author,created_utc,score,subreddit,parent_id,is_submitter,distinguished
oz66z5i,:surprise-pikachu:,scout1520,2026-07-22 22:36:46,108,dataengineering,t3_1v3u40k,False,
oz6aght,My company is working with Palantir currently on what sounds like a similar project. It was expected to take 2 years to complete though. We're 6-7 months in currently. I don't think I should stick around long enough to see how it ends up.,SeaYouLaterAllig8tor,2026-07-22 22:54:23,67,dataengineering,t3_1v3u40k,False,
oz6i8dn,"Two years ago, our CTO proposed Palantir and brought them in for a 2 day workshop/onsite. The unanimous consensus was “wtf they do they offer over what we have? also their products are a jumbled mess” (we already have a nice databricks setup). Thankfully, we didn’t go with Palantir and for unrelated reasons said CTO got fired a few weeks later anyway.",jambonetoeufs,2026-07-22 23:34:57,37,dataengineering,t3_1v3u40k,False,
oz69iuv,What sort of data engineering project takes a team 15 months to surface an MVP?,mac-0,2026-07-22 22:49:41,67,dataengineering,t3_1v3u40k,False,
oz6am1e,"Our company is going through the same shit. Same clueless, thoughtless leadership. Same shameless, grifting charlatans selling the same shitty snake oil.",EarthGoddessDude,2026-07-22 22:55:09,19,dataengineering,t3_1v3u40k,False,
oz6emxn,That sounds exactly like my company’s experience with it. Thankfully we did not renew the contract because it was unbelievably expensive and hated by everyone who had to use it.,JaceBearelen,2026-07-22 23:16:06,16,dataengineering,t3_1v3u40k,False,
oz6myh6,Bold of you to assume they made hard coded dates and not the LLM,minormisgnomer,2026-07-23 00:00:03,17,dataengineering,t3_1v3u40k,False,
oz6nogg,"There is a saying in my country that is more or less like this"" every day a sucker and a scammer meet and they always close a deal""",Old_Tourist_3774,2026-07-23 00:03:54,9,dataengineering,t3_1v3u40k,False,
oz6i1io,"DE requires quite a bit of both business and technical background which makes huge difference in data pipeline, otherwise it's a nightmare area to work.",69odysseus,2026-07-22 23:33:57,7,dataengineering,t3_1v3u40k,False,
oz6ogg9,Yeah this is very accurate. I used to work for a consulting company and had a couple projects doing palantir migrations. Whenever clients asked about foundry I would try to steer them away. Massive vendor lock and a ridiculous price tag in for a platform that can be cloned with a with a few AWS services and a decent cloud engine. I would steer clear. They also have some very sus business tactics.,Chuck-Marlow,2026-07-23 00:08:00,5,dataengineering,t3_1v3u40k,False,
oy4hyqf,"the problem I see nowadays is that strong AI models enabled people too much. I am all in for new technologies, but if before it was already hard to deal with arrogant & clueless C-level people, now it is 10x worse. I have seen some directors that never wrote a single line of code in their lives writing articles on ""how to develop a product from scratch"" and this is just.... mind blowing",Able_Kaleidoscope_89,2026-07-17 16:43:22,88,dataengineering,t3_1uz38js,False,
oy4ffjn,Have you had the pleasure of attending a day-long “planning” meeting before?,terencethespider,2026-07-17 16:32:40,17,dataengineering,t3_1uz38js,False,
oy4slv6,No it is pure comedy. Slides will have em dashes everywhere.,speedisntfree,2026-07-17 17:27:52,11,dataengineering,t3_1uz38js,False,
oy5xb2e,DE sucks because it’s too close to the business but at the same time it’s one of the specialties that will persist for years to come for this very reason :loudly_crying_face::loudly_crying_face::loudly_crying_face:,Technical_Program_35,2026-07-17 20:24:29,12,dataengineering,t3_1uz38js,False,
oy4phlz,I'd turn off mic and cam and just do my own stuffs. Free time for me!,Outside-Storage-1523,2026-07-17 17:14:51,7,dataengineering,t3_1uz38js,False,
oy66bhc,I used to be like this until I looked up at the clock one day and realized it didn't matter what they were talking about and that I was getting paid $2/min no matter what. I had more than one person look at me and wonder why I had a smile on my face over some of the most mundane things.My rate has gone up since then and the smile is still there.,marketlurker,2026-07-17 21:05:33,9,dataengineering,t3_1uz38js,False,
oy49ft6,I feel you.,Peppper,2026-07-17 16:07:29,6,dataengineering,t3_1uz38js,False,
oy5bwt9,Today I almost got a panic attack. I got a meeting with couple of staleholders and they were basically explaining me my job. They knew everything in theory and they say with claude I can do everything now in couple of hours.,Joe_Fart,2026-07-17 18:49:17,3,dataengineering,t3_1uz38js,False,
oy799ez,The amount of bullshit that we will hear will make us quit :melting_face:,0xPianist,2026-07-18 00:28:22,2,dataengineering,t3_1uz38js,False,
oy99m3l,So many incompetent idiots empowered by ai,jdzndj,2026-07-18 09:00:40,2,dataengineering,t3_1uz38js,False,
oyqrbs3,"CONTROL TABLES!!for the love of data, please use control tables instead of relying on passing orchestrator system dates into your DAGs. Daily load that skips a heartbeat at trigger? Too bad, you just missed a batch. Need to keep track of a query's last run date? Control table. Need to log row counts? Control table! Need to fetch obscure meaningless Exception as e? Control tables! Even at the cost of a few extra database transactions :-)",UAFlawlessmonkey,2026-07-20 20:28:49,78,dataengineering,t3_1v1oj0m,False,
oyplb2y,"Nice write up. Based on my experience as a data modeler since 2022, I see many DE's writing some fancy Python codes and history long CTE's, using wrong joins and dynamic conversions and aggregations which turn into heavy computational cost and heavy I/O operations. Many DE's fail, even at senior level on the data modeling skillset. One of the biggest cost is when developers/engineers do date and string conversions in the code, over the time it starts accumulating and then everyone complains that our pipelines are costing a lot. When they go in detail, only to realize how the code was written has been adding up to that cost.Everything should start with the right data model grain, including proper naming conventions, assigning right data type, such that no dynamic conversions have to be done later in the development stage. I have seen a long fact table with more than 100 metric data elements, for which a DE had to write multiple CTE's causing delay in ETL and performance bottle necks which should be avoided at all costs.",69odysseus,2026-07-20 17:26:11,35,dataengineering,t3_1v1oj0m,False,
oytqdxo,"i find that pattern 2 is super helpful when u have to handle schema drift. its wierd how many people skip that step untill things break in production, so thanks for sharing ur thoughts on it.",gkorland,2026-07-21 06:52:28,2,dataengineering,t3_1v1oj0m,False,
oz20thg,"I was expecting static transformers, external state as markup language, metric calculation through context managers, preconditions and postconditions checking, job queueing with stacks, error logging, metadata built along side the result of the pipeline.I always feels like design patterns for data pipelines exists, but somehow not many litterature is available on it.",dreamyangel,2026-07-22 11:27:15,1,dataengineering,t3_1v1oj0m,False,
oz2ol3p,"ood list. The one I would add as a fourth, since control tables and data modeling are already covered in here, is validating the schema at the ingestion boundary before you load anything. A lot of production breakage is not actually bad logic, it is an upstream source quietly adding, renaming, or retyping a column, and the pipeline happily loading it so the problem only shows up three tables downstream. A cheap version is to snapshot the expected columns and types, then fail fast or quarantine the batch and alert when the incoming shape does not match, instead of letting a silent change flow through. Pair that with the control table idea someone already mentioned and you can answer both what ran and whether what ran was even shaped correctly. The earlier you catch a contract break, the cheaper it is to fix.",carval,2026-07-22 13:33:33,1,dataengineering,t3_1v1oj0m,False,
oz1qsov,What do you mean with control tables?,Fermabowl,2026-07-22 10:19:16,2,dataengineering,t1_oyqrbs3,False,
oyqhccq,Do you have a favorite resource for learning data modeling?,Worldly_Mirror_1555,2026-07-20 19:44:12,2,dataengineering,t1_oyplb2y,False,
oys0dwr,"Different person, but it's hard to beat the Kimball Data Warehousing Toolkit.",corny_horse,2026-07-21 00:11:18,7,dataengineering,t1_oyqhccq,False,
oys1v1o,Thank you. I appreciate it.,Worldly_Mirror_1555,2026-07-21 00:19:14,1,dataengineering,t1_oys0dwr,False,
oymhwet,"Consultancy in a nutshell. They get you, a junior, to do a certificate and suddenly you’re the data architect. It’s why I’m actively planning to leave my role.",hannorx,2026-07-20 06:30:30,159,dataengineering,t3_1v1cf7d,False,
oymn3pc,"First of all, my condolences on joining a consultancy. Second, you can play this right, since you have the mission parameters already, you can use AI to help you come up with a solid strategy before you tackle the problem, to minimise the fact that you don't have prior experience in this sort of thing. Whatever you do, don't let AI do all the thinking but let it guide you through.",Candid-Cup4159,2026-07-20 07:14:03,45,dataengineering,t3_1v1cf7d,False,
oymgf2f,Moving away from databricks to fabric to get more AI exposure is wild,Alternative_Draw5945,2026-07-20 06:18:08,82,dataengineering,t3_1v1cf7d,False,
oymuvkj,"With many years of consultancy work under my belt: this is the standard practice. I’ve seen many times people selling and signing a project and then going around asking “has anyone done x in y domain?”.You won’t get flamed by the clients because engagement or project managers will shield the face of your company. But be prepared to be asked to finish this “little simple fast thing” by tomorrow 10am call by the person who struggles with excel. But I promise you, this work will allow you to pick up a lot of human/management skills",Hopeful-Jello7052,2026-07-20 08:20:24,25,dataengineering,t3_1v1cf7d,False,
oymnn2t,> days ago I was told I'll help as the sole DE on a Fabric IQ projectWelcome to consulting.,spinozasrobot,2026-07-20 07:18:31,14,dataengineering,t3_1v1cf7d,False,
oymkgox,"Deep-end onboarding, welcome to consultancy :rolling_on_the_floor_laughing:",Large_Hedgehog2416,2026-07-20 06:52:01,9,dataengineering,t3_1v1cf7d,False,
oypqrnv,"My only advice after 25 years working and 8 years consulting and watching who succeeded and who didn'tConsulting is like being thrown into the middle of a big ocean. You know the shore is somewhere to the east, so during the day you get a little help on which way to go, but a lot of swimming is at night with no clear direction at all.The only way to get anywhere is to orient in some direction that makes sense, swim hard, and then reorient.That's it, there's no more to it.Just keep swimming, don't stop.Don't worry who might be watching, don't worry about your form, just head in the general direction of where you're going and swim hard. Don't worry if you're not a natural swimmer, or certain waters are rougher than others. Don't be afraid to change directions, or take some detours. It's just a big ocean, you can't go Swim.People notice who is swimming and who isn't.They know your situation; they're the ones who threw you in the ocean.And if the work to be done was simple, the client wouldn't need a consultant to do it. They're just as overwhelmed in the ocean as you are.That ""uneasy feeling"" is you thinking there's got to be a better way than just swimming. Thinking about staying still, waiting for a strong breeze, a guiding star or a rescue plane.That's how you drown. Fear is the mind killer, etc etc.If you swim, you'll find fascinating things, unlock new areas, find strengths.you didn't know you had, new friends.Not everyone is an ocean swimmer in life. That's okay. There are jobs where swimming is not required.But consulting is for swimmers",kthejoker,2026-07-20 17:49:15,8,dataengineering,t3_1v1cf7d,False,
oymyr8h,This is the general work model of a consultancy. Do your certifications and get up to date on Fabric quickly. You can get good on Fabric within 2 weeks. They can only do what the clients demand(A lot of the clients are usually very demanding). Also consultancies in general have a lot of churn.,Critical_Bluejay_919,2026-07-20 08:53:44,7,dataengineering,t3_1v1cf7d,False,
oyo0jk7,"Very normal for consulting companies to do that. I worked for a technology and management consulting firm for over 10 years. But here why it is not a problem1. You have solid background in DE. Your clients often don’t or in bigger companies you work with very specialist people.2. Every company is doing different things with the same technology. It is normal to get up to speed on the specific setup3. We have LLMs now that can do the coding and configuration part. You just need to drive it4. Your expertise on best practices is what your clients often want. They will believe you more than the in-house people, use that",Hofi2010,2026-07-20 13:10:38,5,dataengineering,t3_1v1cf7d,False,
oyp8q8i,Make it work.,PrestigiousAnt3766,2026-07-20 16:32:52,2,dataengineering,t3_1v1cf7d,False,
oy3zvo9,"Here is my two cents as a data modeler and someone who works with DE's all the time: 1) Cloud is very easy skill to learn, handful of YT videos on Azure and Cloud will get you going. Don't focus on it much, can even list it on resume without worrying much. 2) Even in the age of freaking AI propaganda, entire DE is still and heavily done using 95% SQL, even at FAANG companies. Python is used for migration related DE project and stuff but SQL still is the big elephant in the data space. If you know SQL really well, then you're in good position. Pretty much every company out there will test you on SQL first, then Python and data modeling. As the role level goes up, they get into architecture, solutioning skill set. They want to see what's a candidate analytical strategy for trade-offs related questions. 3) Make sure to get very, very solid at Data Modeling, Distributed compute and storage (Databricks, Snowflake). It's critical to have these skills in DE space in today's landscape compared to say 7-8 years ago. 4) I am also hearing lately on vector and graph databases, but since I have done worked on those, can't speak on that area of work. TDLR: SQL, Data Modeling, Distributed compute and storage, Cloud.",69odysseus,2026-07-17 15:26:41,117,dataengineering,t3_1uz2nw7,False,
oy3zj8a,"I'm from France, maybe it’s different where you live, but here nobody cares about a certification on a technology you don’t have ptactical experience with on a previous job (certified GCP Professionnal Cloud Architect here with only on-premise experience : nobody cares)",stiod_,2026-07-17 15:25:12,14,dataengineering,t3_1uz2nw7,False,
oy4jpak,"certifications are useful to get you past HR. I myself took some in order to stand out in the crowd of people wanting to land a DE job. my recommendation would be:1. some professional cloud certification: do not waste your time with the basic ones because honestly, no one cares. if you have, lets say, a AWS DE associate, it does look more impressive. when I am hiring and I see people with hard-to-pass certifications, I look at it with better eyes (although real world experience does beat it)2. databricks/snowflake certs are also interesting IMO, although I'd go more for a databricks spark certification since it indirectly shows you know not only spark but SQLThat all being said, certs alone wont take you very far, but IMO they work as the carrot hanging under the stick that forces you to learn things you'd usually not care. I have seen countless people with certs failing in basic design questions tho. even nowadays with crazy AI models, the design part is hard and requires some imagination from the engineer. Understanding how different components connect, trade-offs of different decisions, when to use X instead of Y, etc is what really sets you apart.",Able_Kaleidoscope_89,2026-07-17 16:50:35,7,dataengineering,t3_1uz2nw7,False,
oy3zhax,I'd go with something like databricks certs,Lamyya,2026-07-17 15:24:58,5,dataengineering,t3_1uz2nw7,False,
oygr0ni,Joining +++,Fresh-Influence-7934,2026-07-19 12:23:19,2,dataengineering,t3_1uz2nw7,False,
oyldypb,Real projects where you had to debug failures usually teach you a lot more than another certification ever will,Ill_Freedom_6666,2026-07-20 01:49:23,2,dataengineering,t3_1uz2nw7,False,
oy48izn,"Breadth stuff. Personally, governance is becoming the bread and butter. CDMP is a good path. Cloud providers offer certs that cover theory. Db t and databricks are good ideas. Snowflake felt like the cloud and databases mixed. They dont hit on cost control like they should.",asevans48,2026-07-17 16:03:34,1,dataengineering,t3_1uz2nw7,False,
oy59muy,I do not think certificates are usually a that useful in my opinion but I can see why it might be useful for you. I will always prefer someone why has build something used by real people over someone who has just sample projects with a certificate. If you do get a certificate I would possibly recommend making some projects in your spare time to put on GitHub you can show also.,Aggressive_Sherbet64,2026-07-17 18:39:30,1,dataengineering,t3_1uz2nw7,False,
oy6ca86,"Honestly… having the certification alone isn’t worth anything without practical application. I’m saying this as a consultant who has peers whose internal profile look STELLAR, meanwhile they spend 5 weeks doing one basic thing (if even) in a platform they are “advanced” in and have some associate or professional level cert.",punkypudding,2026-07-17 21:33:47,1,dataengineering,t3_1uz2nw7,False,
oybgorl,"In today’s world, a clinical researcher who can leverage AI effectively is more likely to land real world impact than a DE. I’m not too sure the DE role will exist in 10 years but get, what do I know?",renaissanceman1914,2026-07-18 16:49:08,1,dataengineering,t3_1uz2nw7,False,
oxyxbb3,"Are you interested in transitioning into Data Engineering? Read our community guide: https://dataengineering.wiki/FAQ/How+can+I+transition+into+Data+Engineering*I am a bot, and this action was performed automatically. Please [contact the moderators of this subreddit](/message/compose/?to=/r/dataengineering) if you have any questions or concerns.*",AutoModerator,2026-07-16 21:15:31,1,dataengineering,t3_1uyfkf1,False,moderator
oxyyrtv,"When the times are bad the only way to switch is internally if there is an opening.When the times are good, you can not only job hop, but you can job hop shift, if it is really good, you can job hop shift for much more.In current times I cannot even get another BI job if I worked in Power BI and the job is in Tableau",Interesting-Monk9712,2026-07-16 21:22:10,40,dataengineering,t3_1uyfkf1,False,
oxz4puo,What sort of data roles have you been applying to? Junior positions? I literally just coached my younger sister to move into data engineering from BI. Her new role is still somewhat bi focused but at least she’s using snowflake now.Do you feel like your cv is letting you down or are you not progressing through interviews?,Leather-Replacement7,2026-07-16 21:49:25,7,dataengineering,t3_1uyfkf1,False,
oxzhn9c,"data engineer is a bit of an ambiguous title right now. It can mean something closer to analytics engineer. It can be building the data pipeline, even though most of the infrastructure is handled by other teams (my company does this, and I think many others will). It can also be more of a software engineer, data - where you maintain kafka clusters, key data infrastructure, etc. It will depend heavily on the size of the company. You will have an easier time transitioning into analytics engineer or a more traditional data warehousing type role than software engineer - data. If you want to go down that path, you basically have to get your data warehousing fundamentals into a good spot.",harrytrumanprimate,2026-07-16 22:52:56,10,dataengineering,t3_1uyfkf1,False,
oy24qzc,Just call yourself an analytics engineer. Its not that its different from bi development. In all companies ive been in (plenty) this overlaps or is the same.Dont undersell your experience.,PrestigiousAnt3766,2026-07-17 09:16:35,3,dataengineering,t3_1uyfkf1,False,
oxyy6by,"Data engineering is applied software engineering. Usually, the route from BI to DE is often too weak unless you seriously compensate for it some other way. From software dev to Data is a better fit.",rapotor,2026-07-16 21:19:27,15,dataengineering,t3_1uyfkf1,False,
oxz18e4,"Same, friend. I heard from a lady on YouTube that says it’s a bad time to do a career pivot because companies are extra adverse to risk right now and also because so many people are looking for work. Just keep building skills and taking on more complex backend projects as much as you can and never stop applying.",Almostasleeprightnow,2026-07-16 21:33:21,2,dataengineering,t3_1uyfkf1,False,
oxz6wm3,"If you’re already in BI, shadow some of your DEs and get insight from them. You can also develop pipelines locally. Everything from Kafka to docker to spark, airflow, etc.. can all be done locally and then you can ingest into a local duckdb or postgresql database.",MikeLV7,2026-07-16 21:59:41,2,dataengineering,t3_1uyfkf1,False,
oy13pii,"I am just curious why do you think data engineering is somehow superior to data analytics or BI? Personally I love BI and datawarehousing, I made my career due to my skills in SSAS Multidimensional modeling and MDX and I know that it is not hot anymore like how it used to be, but I am willing to learn Power BI and DAX and work on that part of the stack, rather than pipelines which is find very messy.I am just curious what is the main motivation why you think data engineering is somehow better, is it because it is more difficult more salary?",Complete-Regret-4300,2026-07-17 04:27:53,2,dataengineering,t3_1uyfkf1,False,
oxyxb96,"You can find a list of community-submitted learning resources here: https://dataengineering.wiki/Learning+Resources*I am a bot, and this action was performed automatically. Please [contact the moderators of this subreddit](/message/compose/?to=/r/dataengineering) if you have any questions or concerns.*",AutoModerator,2026-07-16 21:15:31,1,dataengineering,t3_1uyfkf1,False,moderator
oya8m0o,Geospatial is all fun and so until you need to do some nasty algorithms. I worked as a geospatial data engineer for 2 years. The things that kept me at night was figuring out the best possible algorithm to join daily 100 milion floating car data to the neireghst roads. Total numbers of roadsegments are around 50 million. Spatial joins are just very inefficient at very large scale and you really need to precalculate stuff in advanced.,Outrageous_Let5743,2026-07-18 13:12:57,28,dataengineering,t3_1uzsr0n,False,
oyei6od,"Please, for the love of GIS, never ever even think about translating planar distance to meters by multiplying it by 111 km/degree. The problem is not that one line is straight-line Euclidean and another is geodesic - these are actually very close at small distances like the example given. For these two points Cartesian line's length differs from geodesic by about 150 meters only. But `ST_Distance` computes 'distance' in degrees, which can correspond to anything from as close to zero meters as you want to 111km.",mad-data,2026-07-19 02:05:17,3,dataengineering,t3_1uzsr0n,False,
oyg51pk,I'm pretty sure geography(4326) and anything supported SRID other than geometry(any) can be persisted in delta tables (but not iceburg tables if I recall correctly).,kevintxu,2026-07-19 09:37:00,2,dataengineering,t3_1uzsr0n,False,
oyaxph1,"Thanks for the posts. I'm working with static points, and in the future I'll refer back to these articles.",happypofa,2026-07-18 15:20:23,1,dataengineering,t3_1uzsr0n,False,
oyqf23w,"As a data modeler, GIS is one area I never worked but that's something I'd love to do data modeling in that domain and see how different can it be different than my past domains I worked in.",69odysseus,2026-07-20 19:34:04,1,dataengineering,t3_1uzsr0n,False,
oyaioqv,Oh thanks for sharing! So how you eventually solved it?,ivan_kurchenko,2026-07-18 14:06:25,1,dataengineering,t1_oya8m0o,True,
oyc6s3w,"It was a pain before warehouses added support for spatial. But now that does not seem like a huge join, and database with spatial join support should handle it easy. Like BigQuery, recent Presto versions, Spark with Apache Sedona.",mad-data,2026-07-18 18:50:00,1,dataengineering,t1_oya8m0o,False,
oyg5nts,"This was my thought exactly, I have had a play with this in Databricks somewhat recently and I am sure that native GEOGRAPHY data types could be persisted. I thought GEOMETRY could be too but may be mistaken.",ainzy99,2026-07-19 09:42:20,1,dataengineering,t1_oyg51pk,False,
