id,body,author,created_utc,score,subreddit,parent_id,is_submitter,distinguished
og3jq06,"Yeah, completely. My first dev role felt less like “I got hired” and more like “cool, now they’ll discover I’m an idiot by Thursday.” What helped was realizing confidence usually comes after repetition, not before it. You do enough tickets, break enough things, ask enough slightly embarrassing questions, and eventually your brain stops treating every task like a survival event. The other big shift was separating not knowing yet from not being capable. Those are not the same thing, even though your brain loves merging them for drama.",vudebeya,2026-04-14 08:59:24,1,learnprogramming,t3_1sl2gfl,False,
ogzfrib,Been coding for few years now and self-teaching can be really frustrating when you're not sure if you're doing things right way. I actually started same way trying to learn on my own but found that having someone review my code made huge difference in understanding proper patterns and avoiding bad habits. For groups in Philly you might want check out meetup apps - there's usually local developer meetups where people share knowledge and work on projects together. Also many libraries have coding groups or workshops that are free to join. When I was starting I joined online discord servers for web development and people there were super helpful with questions and code reviews. The fact that you already work with websites gives you good advantage because you can immediately apply what you learn to real problems at work. That practical experience is worth a lot more than just doing tutorial projects.,ManufacturerSad2610,2026-04-18 23:27:34,2,learnprogramming,t3_1spchnm,False,
ogzhc4r,"Software engineer here, before finding for a course or tutor, I'd seriously try a different path first: pick a concrete project you actually care about, and start building it.Two years of tutorials without much progress usually means one thing, tutorials teach syntax without context. You learn a for-loop in chapter 3 and forget it by chapter 7, because you never had a real reason to use it.**The shortcut is to find something YOU want to exist**. A tracker for your sneaker collection. A simple site for your favorite cheesesteak spots in Philly. A dashboard for your gym sessions. Anything tied to a real interest of yours.Then force yourself to build it. You'll hit real problems, ""how do I store data?"", ""why doesn't this button work?"", ""how do I make it look decent on mobile?"", and every answer you find sticks, because it solved a problem you actually cared about.Courses and tutors become useful after you know what you don't know. Right now, you're probably stuck in the ""don't know what I don't know"" zone hehe.",elvnjs,2026-04-18 23:36:36,2,learnprogramming,t3_1spchnm,False,
ogx9u1a,"University + self/independent learning: A degree will make it less likely to be auto-rejected, but skills built/sharpened outside the classroom are what will get you the offers.* University teaches you the fundamentals. The ""practical"" components of this are also with the end goal of solidifying these fundamentals, not to make you job-ready.* The ""job-ready"" skills are learned outside the classroom, not for credit. You'll have to spend a lot of time building projects, learning technologies that might have never even been mentioned during class, but are essential in the workplace.* Interview prep will require a LOT of overtime as well. Sharpening your skills takes time that you'll have to make outside of the classroom.",EntrepreneurHuge5008,2026-04-18 16:45:24,6,learnprogramming,t3_1sp2fk1,False,
ogxsfm3,"A degree is used as a proxy for a certain level of competence. Better if it's in the area, but just completing a 4 year degree in any subject indicates a person can commit and follow through over a multi year period.Certificates are almost meaningless.Self study (and that can include online structured programs) is how you're going to keep up to date and learn new items.",zugzwangister,2026-04-18 18:15:12,2,learnprogramming,t3_1sp2fk1,False,
ogxnoch,"I work with Udacity. One thing we hear often is that learners value project based structure because it helps them finish and build portfolio pieces, not just consume content.",Weak-Personality-231,2026-04-18 17:52:02,1,learnprogramming,t3_1sp2fk1,False,
ogx9dsy,"I’ve been doing self study. It’s what I prefer because I hate the idea of being forced to learn things I don’t want to learn (college) and refuse to pay to do so. What matters in the end is that you’re able to articulate everything you’re doing and that you have something to show for your efforts. For interviews, yes, some places filter you out if you don’t have a college degree. I don’t think that’s questioned.",Typical_Hypocrite,2026-04-18 16:43:10,1,learnprogramming,t3_1sp2fk1,False,
ogx9tgn,"for me it was structured online stuff + a ton of my own projects. uni would have been way too slow and expensive, and pure youtube meant i kept restarting over and over. the projects + some light networking got me interviews, but even then finding a job was painful in this market",bootyhole_licker69,2026-04-18 16:45:19,1,learnprogramming,t3_1sp2fk1,False,
ogx9axm,"**UNIVERSITY FIRST THING!,** credentials are more important than everat the very least try to obtain a 2-year post-graduate academic diploma in CS, then follow it by master degree to complete 4 years of formal CS educationand during the education process, learn through courses and online programsand check back on this comment when the downvote gang shows up, because apparently to them someone trying to do a real formal accredited career switching is totally bad and shouldn't even be allowed into CS field than bootcampers",SteveLorde,2026-04-18 16:42:47,-1,learnprogramming,t3_1sp2fk1,False,
ogxhrr5,"Affiliated with Udacity, so take with context but many learners compare platforms based on accountability, mentor support and practical projects more than certificates alone.",GradeFar8744,2026-04-18 17:23:43,0,learnprogramming,t3_1sp2fk1,False,
ogxg3c7,"took me forever to realize this when i was trying to switch from design work. spent way too much time thinking university would just hand me job skills but really it's more like foundation building. the portfolio projects i did in my spare time ended up mattering way more than anything from assignments, especially since most class stuff feels pretty disconnected from what companies actually need.",SlightTip6811,2026-04-18 17:15:47,2,learnprogramming,t1_ogx9u1a,False,
ogxtdrm,Totally fair if self-study works better for some people. Different formats fit different learning styles.,ParkingControl35,2026-04-18 18:19:54,1,learnprogramming,t1_ogxnoch,False,
ogxttry,"Portfolio pieces are useless beyond learning. I do a lot of interviews for a faang and had worked at multiple. At no point did we ever consider a portfolio piece. The primary reason is there is no way to ensure that the person was the actual author and delving deep enough to ask questions isn’t with our time when you have 10,000 applications per open position. Maybe for smaller or specialized work, but as a generalist, nope.",Impossible_Box3898,2026-04-18 18:22:07,1,learnprogramming,t1_ogxnoch,False,
ogn9pia,"The stack isn’t too big; it’s the scope that’s getting you. This already sounds like multiple features bundled into one project.You might benefit from defining a simple v1 = done (create parts, attach vendor, save to DB), then treat everything else as future upgrades.Finishing a smaller version is usually more valuable than restarting something new.What would your “minimum finished version” of this look like?",Alone-Location6027,2026-04-17 03:16:12,2,learnprogramming,t3_1snorow,False,
ogngnri,"I look a look at the frontend file that you linked. I didn't see any references to React Hook Form, but here are a few things that I noticed:* Don't make two API calls, especially in sequence — that's slow. Combine the two API calls into one, or make them in parallel.* You don't need to use the callback form of state setters (the `prev =>` part).* Use a loop to make your two select menus.I'm happy to advise on the backend schema, but I don't know what each and every one of the tables are — you'd need to tell us.>Parts are one of the pages that I've got working as intended. But there are so many other things that I want to add that it feels like I am never going to finish this project. Would it be better to make something easier and smaller with a higher chance of completing vs continuing with this project and maybe not completing it fully?It's totally up to you — both are valuable strategies to learn.",abrahamguo,2026-04-17 04:03:30,2,learnprogramming,t3_1snorow,False,
ogspfwc,"This doesn’t feel too big tech wise, it just feels like you’re trying to build the whole product at once.I’d honestly zoom way in and define what done means for you right now. Like just creating a part, attaching a vendor, saving it, and seeing it in a list. That’s already a real thing.Everything else can wait.I’ve had projects where I kept adding features and it never felt finished, just heavier and more chaotic",dmkraus,2026-04-17 22:25:07,1,learnprogramming,t3_1snorow,False,
ogp1498,Likely to create a BOM. I'll keep plugging away at this since there's a few features that need to be implemented before a user can create a BOM.,GullibleIdiots,2026-04-17 11:41:22,1,learnprogramming,t1_ogn9pia,True,
ogp0xcm,"Sounds good, I will take a look into your improvement. I realized I forgot to add a link to my form. It's in a component called CreatePartForm in my components folder (in sheets).For my backend, I have four main entities: parts, vendors, purchase orders, and boms. I also have relationships such as PartVendor which attaches a supplier/vendor to a part (using ids). PartSubpart which creates a parent child relationship between two parts. If you were to query all PartSubpart relationships for one part id, you would be able to get its assembly parts.Components is what I called the table that describes one line on a BOM. This line typically has a status, quantity, vendor, and sometimes a purchase order. If someone were to query all components for a BOM id, they'd get the complete picture of that BOM.Let me know if that makes sense and if my schema design makes sense.",GullibleIdiots,2026-04-17 11:40:10,1,learnprogramming,t1_ogngnri,True,
ogl23k9,"Please, ask for programming partners/buddies in /r/programmingbuddies which is the appropriate subredditYour post has been removed*I am a bot, and this action was performed automatically. Please [contact the moderators of this subreddit](/message/compose/?to=/r/learnprogramming) if you have any questions or concerns.*",AutoModerator,2026-04-16 19:57:50,1,learnprogramming,t1_ogl23ht,False,moderator
ogifnma,It probably feels fake because it is. Don't try to solve a problem you can't define. I question your premise. Talking about a project like this in interviews isn't that important. Nobody really wants to hear about something you're doing for fun without any real users. Your experience creating this doesn't apply to the real world. Find an open source project using the technologies you want to learn. Understand how it works. Find and fix real bugs. Suggest and implement useful features.,zugzwangister,2026-04-16 12:46:20,4,learnprogramming,t3_1sn25p8,False,
ogiewsa,"your gig idea is fine, no one cares about real data, just seed it and maybe add a csv upload so users can import shifts/pay. focus on stuff like auth, role based access, stats, charts, pagination, caching, tests. recruiters like seeing clear problems solved and tradeoffs. main thing is being able to walk through the schema and why you did things. sadly half of them only skim it anyway, which fits with how crap finding a job is now",chocolate_asshole,2026-04-16 12:42:16,2,learnprogramming,t3_1sn25p8,False,
ogigj2i,"I think the gig worker tracker is fine, keep it. Manual entry being the primary flow is a smart reframe. As far as actual value add, you'll want to focus on the analytics layer. Calculating effective hourly rate (accounting for fuel, etc. ), breaking down which time windows were most profitable, dead mileage alerts, etc. That's where your back end logic will live. That's also what you can walk someone through in an interview.Spring Boot will allow you to show off some proper layered architecture, service/repository separation. You can do scheduled jobs easily for things like weekly earnings summaries. There are some really nice postgres window functions you can utilize for time series analytics if you want to dig deep on the data side of things.Definitely do not seed fake data. Build a CSV import so you can populate with realistic data and demo properly.",dmitri_ac,2026-04-16 12:51:03,2,learnprogramming,t3_1sn25p8,False,
ogiotl8,"the gig tracker is solid but a job application tracker might hit harder in interviews since every recruiter can relate to it - state machine for statuses, timeline analytics, you can literally demo it to your interviewer in real time",token-tensor,2026-04-16 13:33:38,1,learnprogramming,t3_1sn25p8,False,
oglfj32,"Your idea is actually good. The problem is not the idea but the dataYou don’t need real world data to make it valuable Just simulate realistic data and focus on the system design and logicFor example, build it as a decision system input rides, earnings, time, then output insights like best hours, inefficiencies, profit trends. What recruiters care about is how you model data, how you design APIs, and how you handle edge cases. Another strong angle is adding features like authentication, role based access, analytics dashboards, and clean backend architectureDon’t drop the idea, just shift focus from “real data” to “strong system”. Tools like Cursor, Copilot, or Runable can help speed up boilerplate, but the real value is in your design decisions",Any-Bus-8060,2026-04-16 20:59:25,1,learnprogramming,t3_1sn25p8,False,
ogifi8z,"man this is actually solid direction you're thinking in. the gig worker analytics thing has legs - don't drop it because you can't get real data instead of trying to simulate actual uber/doordash data, build it as platform for freelancers to track their own metrics across different gigs. like someone doing uber eats + grubhub + instacart can manually log their shifts and see which platform pays better in their area, what times are most profitable etc this way manual input makes sense because it's the intended user flow, not a workaround. you get to build interesting analytics on backend, maybe some data visualization, user auth, all that good stuff for interview story you can talk about data aggregation challenges, how you handled time zone calculations, maybe threw in some basic machine learning for trend predictions. way more impressive than another social media clone bonus points if you actually use it yourself for few weeks and can show real insights during demo",Ok_Sentence7514,2026-04-16 12:45:31,1,learnprogramming,t3_1sn25p8,False,
ogi7mjm,"classic idea is fine, recruiters care more about polish, testing, docs, deployment",bootyhole_licker69,2026-04-16 12:00:03,3,learnprogramming,t3_1sn1dum,False,
ogi8y1u,"Recruiters won't really see the difference, the main benefit of more creative ones is it makes for a more interesting interview topic, but that can only be the case if you can talk about each to the same level.",Impossible-Brush2227,2026-04-16 12:08:04,2,learnprogramming,t3_1sn1dum,False,
ogjsl2e,"Define "" top notch"".You can ask yourself, what are you doing different for your app compared to what's already out there.",dialsoapbox,2026-04-16 16:34:10,2,learnprogramming,t3_1sn1dum,False,
ogo64yt,"By top notch I mean, trying to use enterprise archeticture, clean, scalable code, applying the right design patterns, etc ..",The-amazing-man,2026-04-17 07:27:59,0,learnprogramming,t1_ogjsl2e,True,
ogie762,Cracking the Coding Interview is a classic. You'd do no wrong in using it for interviews.,yellowmonkeyzx93,2026-04-16 12:38:17,1,learnprogramming,t3_1smymyv,False,
ogieltp,"No, what I meant was using it without any intention of going to interviews.",iamanomynous,2026-04-16 12:40:35,0,learnprogramming,t1_ogie762,True,
ogir1bb,It's practical knowledge from a veteran programmer. I'm sure there's things there that can be put to use for era of programmers.,yellowmonkeyzx93,2026-04-16 13:44:41,1,learnprogramming,t1_ogieltp,False,
oggwema,"You can try channels like Programming with Mosh or freeCodeCamp, they explain concepts in simple, clear English. Also, beginner-friendly podcasts like CodeNewbie are great for improving both listening and programming basics at the same time.",Timely-Transition785,2026-04-16 05:34:54,2,learnprogramming,t3_1smpgn0,False,
oggiakp,"You say 'programming', but you really need to provide more information. Are you asking about web development, app development, game development, systems programming, hardware programming, machine learning, automation, infrastructure, data engineering, *or* maybe a specific language - HTML, JavaScript, PHP, CSS, SQL, Ruby, Java, Kotlin, Python, Go, C, C++, C#... you get my point? I understand that your English isn't great, but this is a *really* broad question and nobody has any idea what you're actually interested in.Edit: for Python, try channels like [Corey Schafer](https://youtube.com/@coreyms/videos), [Programming with Mosh](https://youtube.com/@programmingwithmosh/videos) (Python specific video [here](https://m.youtube.com/watch?v=K5KVEU3aaeQ)), and [Real Python](https://m.youtube.com/@realpython/videos)",gofuckadick,2026-04-16 03:52:55,1,learnprogramming,t3_1smpgn0,False,
ogm8psc,"It reminds me of myself as a teen, I learned programming and english around the same time.Computers are great tool to learn.You'll be doing fine as long as you are active, producing, and not just consuming.I used to love making small games in my débuts.Even vacabulary quizz.Just make something you're excited about.Or proud to show to someone else.I love traversy media on youtube, but really, pick any vidéo that appeals to you, because there are so many.The most important is what you do with it.",yoricm,2026-04-16 23:34:18,1,learnprogramming,t3_1smpgn0,False,
ogi8pz9,"""I'm currently studying the basics such as fundamentals, problem solving and opp and haven't chosen a specific field yet",NourAlaa28,2026-04-16 12:06:43,1,learnprogramming,t1_oggiakp,True,
ogictim,"Alright, so you're just looking for beginner friendly fundamental videos. For general programming basics, channels like Corey Schafer, Programming with Mosh, and freeCodeCamp are good.- Corey Schafer: https://www.youtube.com/@coreyms- Programming with Mosh: https://www.youtube.com/@programmingwithmosh- freeCodeCamp: https://www.youtube.com/@freecodecampFor problem solving and programming logic, I’d also recommend CS50 because it explains how to think like a programmer, not just syntax. - CS50: https://www.youtube.com/@cs50I'd recommend starting with Lecture 0 - Scratch and working up through Arrays/Strings/Algorithms - https://www.youtube.com/watch?v=UuIEbpQms8oEdit: this is so weird. I couldn't put the links in embedded markdown format because they would break - at least for me. Could just be a mobile issue, but I reformatted anyway.",gofuckadick,2026-04-16 12:30:32,2,learnprogramming,t1_ogi8pz9,False,
ogiefob,Thanks a lot I really appreciate your helpCan I ask what field you're in?,NourAlaa28,2026-04-16 12:39:36,1,learnprogramming,t1_ogictim,True,
oge5r4g,You can do leetcode contests for free if you want.  You can do virtual contests for free too where you do previous contests and see how well you did relative to the people who competed in that contest.,ShardsOfSalt,2026-04-15 20:09:27,2,learnprogramming,t3_1smha7d,False,
oggyuxn,You can start but manage your expectations. With only loops and functions you will likely solve the first problem only. That is fine. The goal of early contests is not winning. It is learning how contests work and seeing what you need to learn next.,Ok_Assistant_2155,2026-04-16 05:54:48,1,learnprogramming,t3_1smha7d,False,
oglvjqq,"Yes, but go in with the right expectationsContests are not for learning basics, they’re for improving speed and problem solving under pressureSince you’ve just finished fundamentals, you can start, but don’t rely only on contestsDo this instead learn concepts + solve problems normally Then, occasionally, join contests to test yourselfas a beginner don’t worry about rank Focus on solving even 1 or 2 questions and understanding them fully afterplatforms like Codeforces (div 3), LeetCode contests, or CodeChef starters are good starting pointsContests can be frustrating at first, that’s normal They’re more like training than measurementSo yes, start, but use them as a supplement, not your main learning method",EfficientMongoose317,2026-04-16 22:20:56,1,learnprogramming,t3_1smha7d,False,
oge7hne,Thanks for the suggestion :grinning_face_with_big_eyes:,mousexocean,2026-04-15 20:17:22,1,learnprogramming,t1_oge5r4g,True,
ogekvll,You're still pretty early in your journey but contests can actually help you learn faster even if you don't solve much at first. I'd say try some virtual contests on leetcode first since there's no pressure and you can take your time to understand the solutions afterward Just don't get discouraged if you can't solve anything in the beginning - even getting familiar with contest format is valuable practice,AccomplishedEase1569,2026-04-15 21:17:14,1,learnprogramming,t1_oge5r4g,False,
ogf6ttf,"Using a `Result` type here is a good choice. For things like invalid amounts, missing accounts, or insufficient funds, they're normal business outcomes - not exceptional failures - so returning a success/failure result is generally cleaner than throwing exceptions. I’d reserve exceptions for unexpected situations like file I/O failures, corrupted persistence, or programming errors. That said, the bigger thing I’d focus on isn’t whether `Result` is acceptable - because it is - but actually making the implementation correct and consistent. - here: `Result createResult = bank.createAccount(userId);` loses type safety - since `Result` is used as a raw type, Java no longer knows that `getData()` is an Account, so `getData()` is treated as `Object`. `createAccount()` should return `Result`- in `BankService`, operations like deposit/withdraw/transfer should return `Result` since they only need success/failure:```public Result createAccount(int userId)public Result deposit(...)public Result withdraw(...)public Result transfer(...)```Also:- your `transfer()` logic deposits back into the source account instead of the destination account. After withdrawing from `from`, you do `from.deposit(amount)` instead of depositing into `to` - so the money goes right back to the source account instead of the destination.Edit: few more:- there’s a menu bug in `Main.java: case 5` for transfer has no `break`, so successful transfers fall through into `case 6` and print all accounts.- in the account listing you print `User ID: "" + a.getId()` instead of `a.getUserId()`, so the displayed user ID is wrong.- you save users/accounts with `ExecutorService` then on exit return from `main` without calling `bank.close()`, and `shutdown()` doesn't wait for pending tasks to finish - so writes could be lost on program exit.- `Result` itself should actually be declared as `Result`. You're using `T` like a generic type parameter, but never declared the class as generic.Try to get in the habit of running your code through a linter, stepping through with a debugger, and writing a few unit tests for core logic. IntelliJ Inspections, SpotBugs, and SonarQube are great tools to get used to using. JUnit is extremely helpful as well. The only thing that I don't understand is that this:```public class Result { private final T data;}``` *should* have made your code fail to compile, unless you already caught that and forgot to update the repo.",gofuckadick,2026-04-15 23:11:44,1,learnprogramming,t3_1smfllp,False,
ogb2jm7,This subreddit. Read the wiki/faq.,niehle,2026-04-15 11:19:36,1,learnprogramming,t3_1sm2pcy,False,
ogb2y4g,"You’re actually in a great starting spot, everyone begins with that “I don’t know what I don’t know” feeling. The book is solid, but it’s not the easiest entry point. You’ll likely make faster progress starting with something like Python or JavaScript using interactive platforms such as freeCodeCamp or Codecademy, while building small, practical projects right away. Once you’re comfortable, then moving into C# will make a lot more sense and feel less overwhelming.Hope this helps!",No-Injury-1785,2026-04-15 11:22:17,1,learnprogramming,t3_1sm2pcy,False,
ogb96lw,"that’s actually a solid book, but to be honest jumping straight into C# + .NET can feel heavy if you’re still in the “don’t know what I don’t know” phase...what usually works better is starting with something where you can see results quickly, like small scripts or simple apps, just to build intuition. otherwise it can feel like a lot of structure before you even know what you enjoy building....also worth thinking about the *type* of thing you want to build for your life, like a simple tracker, reminders, or automation. that helps narrow the path way more than picking a language first....i’ve seen people stick with it longer when they start messy and practical, then go deeper into something like C# once they know why they need it.",Glad_Appearance_8190,2026-04-15 12:02:11,1,learnprogramming,t3_1sm2pcy,False,
