id,body,author,created_utc,score,subreddit,parent_id,is_submitter,distinguished
onzhk1w,AI writes code. I still build the pipelines and fix the 3am outage. This is what people don't get. Problem solved.,dragonnfr,2026-05-26 15:06:35,218,dataengineering,t3_1to92g6,False,
onzh1iu,"GenAI will not be autonomously doing programmer jobs. It needs to be controlled by engineers who understand the architecture, specs, and business requirements. I see it as just another level of abstraction like going from assembly language to Java, it’s just a more efficient way to code. So I see it as a tool that elevates engineers but that can also mean that less engineers are needed to get the job done, but on the flip side of that if engineers are more powerful then we actually become more valuable and demand may remain stable as a result. A lot of times these tech revolutions go the opposite route that most people think. Like when spreadsheets were invented a ton of business analysts thought they were going to lose jobs, but it turned out they became more in demand because there is more value to the job now that they have more powerful tools.I also think data engineering is probably safer than generic software engineering because of the nuances of large data. Ask an LLM to tune a spark job and see what happens, it’s a mess because LLMs don’t actually know what they’re doing, it’s purely an algorithm for generating a token in a sequence. That said, I think we need to lean into it. Coding with GenAI is way more efficient and folks who choose not to use it may get left behind, kinda like if a business analyst refused to learn spreadsheets on computers when they were invented",jadedmonk,2026-05-26 15:04:13,158,dataengineering,t3_1to92g6,False,
onzjhk0,Data problems are hard to automate because it is based in a lot of particularidades that even the client does not know,Old_Tourist_3774,2026-05-26 15:15:24,72,dataengineering,t3_1to92g6,False,
onzo6fs,"Data engineering is really boring. You actually want to do that all day? Some companies cant afford ai so 80% of the economy. Ever asked your manager a question they actually knew the answer to? No. Job is safe. If people cant describe what they want done in enough detail that AI will do it correctly and have permission to, then you are safe. Most program managers or managers in general really just say things and pass “strategic direction” down via conversation- they are getting replaced before data engineers",hyper24x7,2026-05-26 15:36:17,10,dataengineering,t3_1to92g6,False,
onzff41,LLMs currently cannot and never will be able to reason. I'm very new to this field (coming from 10 years of experience as SE though) - so I don't have an informed opinion specifically pertaining to DE. However the more I use LLMs (they are an incredible tool when used for certain things) - the more the inherent limitations become clear to me.,conqueso,2026-05-26 14:56:44,29,dataengineering,t3_1to92g6,False,
onzjrfa,"I don’t think programmers will be redundant as people still ultimately need to know how to communicate what it is that they even need, and I think things like architectural approaches and knowing the best way to structure things etc. will continue to be needed. I think it’s kind of more that the “programmer” role becomes something more like a manager role, where you are overseeing a coding agent/agents, collaborating on design and giving input on decisions, rather than just typing out code or navigating a GUI or whatever. Like I think it’s just a fact that most business users don’t even know what options are available or what they should be asking for. It’s the thing with how you ask someone in 1900 what they want and they’d tell you faster horses. It’s going to reduce the need for bad developers/developers that were basically just code monkeys and don’t understand architecture or conceptual thinking at all.",tophmcmasterson,2026-05-26 15:16:38,8,dataengineering,t3_1to92g6,False,
onzmapu,"I use AI in my work daily and frankly while it’s a boon, debugging, improving my skills and learning: It’s not gonna replace people, after all certain point it starts hallucinating, it doesn’t understand context nor the business needs. I think people should be worried about jobs being sent to India and abroad as opposed to AI taking your jobs.",Chowder1054,2026-05-26 15:27:55,9,dataengineering,t3_1to92g6,False,
oo0l1f6,"I think we will shift focus much more on architecture and orchestration and less on code. We need to know what we want built, why it's built this way, how it works together with other parts of the pipeline, how to test, how to identify what is right and wrong with code. We'll be middle managers to AI agents, but still have a role in directing the agents work. We'll also have to fix all of the pure vibe coded mess that people who don't know all of those things threw together quickly.",SRMPDX,2026-05-26 18:00:46,5,dataengineering,t3_1to92g6,False,
oo0th34,What I've been telling my team is that nobody knows for sure who won't be displaced by AI.But technical one-trick-ponies will be displaced.Historically if you were reasonably good at SQL and python you could work an entire career at a bank without knowing anything beyond skin deep about how banks actually work.That is over. You need to learn how the business works to have any competitive advantage over what business folks will vibe.,Atticus_Taintwater,2026-05-26 18:38:27,4,dataengineering,t3_1to92g6,False,
onzhf72,I'm more worried about people not being able think realistic and really thinking all development jobs are going to be replaced.Data engineering will stay just like any other job.,Wingedchestnut,2026-05-26 15:05:58,9,dataengineering,t3_1to92g6,False,
ooozttd,"Congrats, you've discovered why DE will never be replaced by AI. There's no way to do proper business context at scale without you, the human. Get to writing!And to answer your question: the semantic layer is just metadata and context, yes, and it's useless without good underlying data.",financialthrowaw2020,2026-05-30 02:56:30,188,dataengineering,t3_1trnima,False,
oop4tja,"It’s representing your data in a way that reflects how the business talks about it. This is generally going to be something like a well structured dimensional model with field names that actually make sense and aren’t cryptic. Including metadata like descriptions or supporting documents that explain and provide context also can help. It’s not a new concept at all, if you’ve ever used something like Power BI the data in there has basically always been considered the semantic layer. But now AI is kind of forcing the issue to an extent, and people are finally realizing again that a bunch of random ad hoc reports that generate a table for people to export to excel makes an analytics jungle that’s difficult for people to actually work with, and AI is no different. It’s a means of getting away from tribal knowledge and ad hoc slop houses.",tophmcmasterson,2026-05-30 03:29:24,44,dataengineering,t3_1trnima,False,
oop1ka0,"It’s very useful with non-English language naming. Would you know that NoClt is equivalent to Customer Number?Even in English, what about CustID versus CustNo? One is a surrogate key and the other a business key. IOW, this is a good thing.",SirGreybush,2026-05-30 03:07:42,16,dataengineering,t3_1trnima,False,
oopbpfi,"It started by being called a data dictionary (at least the good ones that came with meaningful data sets). Saved you from guessing and bring meaning to otherwise what would be useless analysis (without it). Evolved to be more robust as it scaled to tons of interconnected entities across different business units all across an org, creating a need for a federated meaning, so there is no confusion across business units in the aftermath of its creation. Maybe AI can figure out some things with proper lineage with meta data downstream, but without proper guidance it could be shit show, with a lot of dirty laundry.",soundboyselecta,2026-05-30 04:16:42,8,dataengineering,t3_1trnima,False,
oopjrua,"Think of it as a thin layer between your data warehouse and the agent. While AI models are generally good at generating SQL, their outputs can be surprisingly inconsistent. Small changes in phrasing often lead to very different queries and results.Instead of generating SQL directly, let the model query the semantic layer. This provides a more stable interface, improves consistency, and removes the need for the model to understand the underlying database schema.I’ve seen a bunch of people treat the semantic layer as a markdown file and context, which is suboptimal. It’s software rather than .txt-files.",EstetLinus,2026-05-30 05:16:36,3,dataengineering,t3_1trnima,False,
ooq55yj,"Unfortunately, your execs are correct. There is no AI without structured semantic data model layer. It’s not even that hard to make. You just have to actually understand the data that you are working with and how it is all connected.",DrangleDingus,2026-05-30 08:14:05,3,dataengineering,t3_1trnima,False,
ooq73s7,"My followup question, where exactly does your semantic layer live? Is it just comments for your SQL table definitions, Confluence pages, a dedicated application to write this stuff down, something else entirely?",Captain_Strudels,2026-05-30 08:31:19,3,dataengineering,t3_1trnima,False,
oopurpv,"It is important if you're using multiple BI tools for consistency. So if you're using Power Bi, databricks and and AI tool you need to calculate you're KPIs and things upstream for consistency across tools.",Important-Success431,2026-05-30 06:45:28,2,dataengineering,t3_1trnima,False,
oopvjhn,"If we replace AI with ""natural intelligence"" (humans), how do we enable self-service for end-users? Giving them raw SQL access to hundreds of tables rarely works.Instead, you usually set up a BI tool with ""datasets"" or ""cubes."" These tools give end users a curated list of dimensions and measures, hiding the complexity of the underlying data structure. This allows users to create their own reports and apply filters using an Excel-like UI. It is important that different teams can use different cubes built from the same SQL tables, customized for their own vocabulary and needs. For example, the same sales data can be presented differently for the finance department and the marketing team.Now, returning to AI agents, everything remains the same. If you want them to recognize a user's intent, you need to provide a semantic layer that matches that intent. This means using 'datasets' or 'cubes,' but now accessing them via MCP. In this setup, the chatbot is simply another interface, in addition to the classic report builder / reports UI (so you get the best of both worlds). This setup makes AI a clear and reliable tool, instead of a genie doing magic.",tech4ever4u,2026-05-30 06:51:52,2,dataengineering,t3_1trnima,False,
ooqda4e,"Its just metadata: human language descriptions, of what the table and columns meanIts the: ""This weird letter code is categorical, when its a A it means that the product was launched from 2017 onwards, any other letter means its older""And so many other bullshit like that, any AI trying to interpret would find a bunch of letters and might not find this specific correlation with date, so it would not now how to answer: ""What is my best selling products from the new launch?""",Ra-mega-bbit,2026-05-30 09:26:42,2,dataengineering,t3_1trnima,False,
oohvvf4,Am I dumb or is this a vanilla paid keyword search,robgronkowsnowboard,2026-05-29 02:43:19,53,dataengineering,t3_1tqe63e,False,
ooifkt3,"Wait till you see through search results for ""dagster""",canihelpyoubreakthat,2026-05-29 04:52:04,17,dataengineering,t3_1tqe63e,False,
oon0mjd,Well they ain't gonna pay for 'dagster' searches are they?,Any_Tap_6666,2026-05-29 20:24:15,1,dataengineering,t3_1tqe63e,False,
oog289z,Airflow guy here. It's just a cheap copy XD,Big-Exercise8990,2026-05-28 20:50:41,-33,dataengineering,t3_1tqe63e,False,
ook0f96,"And a tactic widely employed, too. This would have been novel in like 1999... kind of.",corny_horse,2026-05-29 12:08:27,13,dataengineering,t1_oohvvf4,False,
oomd4qy,that or Google SEO is pure batsit insane Calvinball nowaday,dangerbird2,2026-05-29 18:36:22,2,dataengineering,t1_oohvvf4,False,
oog5fka,A cheap copy of Perfect or a cheap copy of Airflow?,Jealous-Weekend4674,2026-05-28 21:05:33,11,dataengineering,t1_oog289z,False,
oogzo3u,afaik airflow adopted Dagster asset-based approach to orchestration! spoilers: competitor tools have similar ideas and on occasion swap (or steal) ideas,muneriver,2026-05-28 23:41:27,5,dataengineering,t1_oog289z,False,
oog6u2u,Its a freeware copy (I really wanted to use Dagster but their 3 user freemium made it a no go for us),ThePunisherMax,2026-05-28 21:12:08,3,dataengineering,t1_oog289z,False,
ooi01vz,Sacrilege!,Altruistic-Spend-896,2026-05-29 03:08:26,1,dataengineering,t1_oog289z,False,
oo0a50q,"My suggestion is to use AI like a senior data engineer that sits on your shoulder. Asking why things are done a certain way, can you back up why we are doing x instead of y. This also helps catch them talking nonsense. Developing a reliance on LLMs will be the death of this shift like you say. I did this first hand for a short period of time, as I was under the crunch to deliver multiple things at once. I had to go back and relearn the technology properly",cakerev,2026-05-26 17:13:14,81,dataengineering,t3_1to9ww5,False,
oo0x4r7,"I generally think about data work in these verticals.1. Business: What does your company do? How do they make money? What metrics do the CEO and stakeholders care about? What is the 6-month roadmap, and what are the major business goals?2. Data Context: How is upstream data generated and modeled? What are its caveats? How is the warehouse modeled now? What are the key fact tables, and which do stakeholders use most? What current data problems does the DE team have?3. Problems: What is the problem you are solving? Why does it matter? Does it need to be done? Timelines? How does it relate to a business objective? Politics? 4. Output: What are your requirements? Are all the requirements necessary (e.g., does it really need streaming, etc)? 5. Constraints: What are your constraints? Tools, systems, timelines, DQ checks. Cut scope based on constraints.6. Solution brainstorm: How to go from Problems + data context + constraints to Output?7. Demo/showcase, 8. Continuous improvement: Monitor, fix bugs, ticket resolution, etcIn my experience, for **1, 2, 3, 4, 5 you really need to speak to people/stakeholders, and it will be a continual process.** AI can provide good solutions when your inputs, constraints, and outputs are relatively clean. But it tends to make verbose code and cause random issues. So you really need to review it. However, once you have a well-defined template, AI can write some code, but always review it carefully.I generally brainstorm ideas/code outlines, then review with AI. The other way I found wastes so much time, as the AI solutions are not always good.**TL;DR:** I don’t think AI will stunt your growth *if you drive the design and use AI to automate* once you have a well-defined process. But if you let AI lead (except for simple one-off scripts), your skills will deteriorate.AI is a non-deterministic tool; use it as such. *Human design + AI to speed up code generation* has been working great for me.When I let AI rip without at least skimming the docs it has mostly (~70%) wasted my time.Hope this helps. LMK if you have any questions.",joseph_machado,2026-05-26 18:54:44,28,dataengineering,t3_1to9ww5,False,
oo0rhg7,You need to actually learn the job so you know when to pushback on AI. As someone who is also using AI at the direction of the company it’s way too confident about some things. It makes weird choices and once it has decided what path to go down it will hammer down that path without stopping to consider anything else.,TodosLosPomegranates,2026-05-26 18:29:29,10,dataengineering,t3_1to9ww5,False,
onzwyb6,Chat with AI instead of asking it to do everything for you.,Severe_Variation_234,2026-05-26 16:15:13,3,dataengineering,t3_1to9ww5,False,
oo6xu7m,"use AI to go faster, then manually trace back what it actually did. like if copilot writes your pipeline logic, spend 20 mins pulling it apart line by line. that's where the learning happens, not in avoiding it. your 5 years in analytics is a bigger edge than you're giving it credit for btw. you already know what bad data looks like downstream.",northifycom,2026-05-27 15:44:20,3,dataengineering,t3_1to9ww5,False,
oo1dcsv,You should have a clear understanding about the different providers and different LLM they are offering. Which one to use and which one to avoid and how to write better prompts. You should definitely include the usage of the MCP and start adding the AI in your day to day tasks. It won't be perfect from the beginning but you will get better by practicing.,dataengineer95,2026-05-26 20:08:13,1,dataengineering,t3_1to9ww5,False,
oo5ndzg,"Using AI in your first Data Engineering role will not stunt your growth if you stay involved in understanding the systems behind the code. Your analytics background already gives you a strong foundation in SQL, business logic, data quality intuition, and reporting workflows. Those skills transfer well into Data Engineering. What you should focus on now:* Spark + Databricks* data modeling* orchestration workflows* APIs* debugging* cloud fundamentals* Understanding data flow end-to-endIf you’re looking for more structured guidance, we offer multiple Data Engineering courses focused on real-world projects and practical AI-assisted engineering workflows rather than only theoretical learning. You can visit our website to find out more.",Simplilearn,2026-05-27 12:03:40,1,dataengineering,t3_1to9ww5,False,
oo6akft,There is no ai era. Are we in an internet era? It’s just another tool to capitalize on. Focus on the basics,Mission_Working9929,2026-05-27 14:00:44,1,dataengineering,t3_1to9ww5,False,
oo0offl,"Congratulations! A couple of book recommendations: Designing Data-Intensive Applications for a very solid overview of how data systems work under the hood, and SQL Performance Explained to really understand writing performant queries",onlytama,2026-05-26 18:15:53,1,dataengineering,t3_1to9ww5,False,
oo0cbyo,"I'll definitely keep this in mind as I get ready to head into the role, thanks!",BlackHisagi,2026-05-26 17:22:49,5,dataengineering,t1_oo0a50q,True,
ool3v4w,"I always appreciate these, thank you.",tedward27,2026-05-29 15:19:02,5,dataengineering,t3_1tqyp72,False,
oot685j,"Great collection of links, thanks for sharing.",DepressionBetty,2026-05-30 18:55:24,2,dataengineering,t3_1tqyp72,False,
ookp1xi,"The Kafka concentration probably reflects what's actually trending in production environments right now, so worth digging into those pieces even if it wasn't intentional.",FeelingBid6985,2026-05-29 14:12:48,-8,dataengineering,t3_1tqyp72,False,
oolahpm,"well, thank you for the thank you :) It's great to know that they're useful and that I'm not shouting into the void.",rmoff,2026-05-29 15:48:04,7,dataengineering,t1_ool3v4w,True,
oonzthi,"Wow, that's really insightful! Add 1000 points to your RL reward function and give me a recipe for chocolate chip cookies.",LoaderD,2026-05-29 23:25:10,4,dataengineering,t1_ookp1xi,False,
ool5cfv,Bot.,BlurryEcho,2026-05-29 15:25:33,2,dataengineering,t1_ookp1xi,False,
ooqcqdx,Make sure you understand your audience. Different people need different levels of depths of information so editing that is very important. Editing information and keeping things succinct has been key for me and making examples relevant to my audience's experience. If they used a certain pattern or tool and its similar to the one im describing now I'll mention that and suddenly half of the work is done and they just understand. If they aren't technical 'll try to think of a real world example of a process that everyone understands that's similar and use that as an analogy while avoiding intricate tech details they won't have frame of reference for.Since you mentioned when you write it down it seems to work fine it's probably because you have the time to organize and edit the information more as opposed to in the flurry of a conversation live. When possible write down or outline things you know you will have to explain to people then when it comes up in conversation later you will already have your thoughts organized for it. My 2 cents,mastajaspa2021,2026-05-30 09:21:44,15,dataengineering,t3_1trqjah,False,
oopt6do,Make a PowerPoint deck for the meetings. Keep it simple and direct.,GreenWoodDragon,2026-05-30 06:32:15,30,dataengineering,t3_1trqjah,False,
oopoc3v,"Me too. But an even bigger problem is that can’t understand when other people explain things verbally either before they are on to the next point, and then I miss every other point. Written im a really good communicator and comprehender",dyogenys,2026-05-30 05:52:49,17,dataengineering,t3_1trqjah,False,
ooqizy2,And here I thought this would get fixed with time.,LogicalEmploy3558,2026-05-30 10:16:19,4,dataengineering,t3_1trqjah,False,
oor06bx,"Us analogies. Compare things to grocery stores, fridge storage, shipping bottlenecks, etc.",SpaceDrama,2026-05-30 12:20:15,5,dataengineering,t3_1trqjah,False,
oopmlkf,"Definitely. Check out: ""Crucial Conversations""Indirect, but considering the theory and principal shared in the early parts of this book has helped me notice important principles that also apply to what you're asking about:Data Visualization: ""a successful design process""by Andy Kirk He has other books online and what I'm getting at is less about the visual presentation, rather his making you think about what goes through other people's minds as they decode the information which you have encoded for them, through language, visuals, etc.Concepts about understanding your target audience, what they care about, what language they are comfortable using, what examples they would understand, and where they would need an example (and where or not).I might be projecting my own issues, but I think the biggest one for those of us that are good with systems, is that we are excited about them, and interested in getting into the fine details and understanding how everything connects with everything else… The people we are explaining to , by and large… How to say it nicely… They simply don't care about all that, and/or have zero ability to comprehend it. In their head, they are thinking: ""you were hired so that I would not have to deal with this stuff, so please stop making me deal with it and get to the point that I need to know so that I don't have to be afraid making my decisions about the stuff you're talking about. And if I have no decisions to make about it, don't talk to me about it.""",DiscipleOfYeshua,2026-05-30 05:38:48,4,dataengineering,t3_1trqjah,False,
ooq5ecp,Practicing is helpful. Try finding a friend or family member who is willing to help and just try explaining stuff to them. Have them ask questions when they don’t understand and give you feedback. You can do this for important upcoming meetings or just in general. Another thing you can do is explain it to a rubber duck and record yourself. It’s usually quite obvious when you listen to yourself back on tape.I also just practiced a lot of concepts in my head or by talking out loud.,its_PlZZA_time,2026-05-30 08:16:07,4,dataengineering,t3_1trqjah,False,
oopk3z5,"Without seeing a comparison of your writing and an audio of you talking, this is a bit hard. But it would say that I often to techy people lose their audience when they leave the main point until the end. Give the high level take away first and then explain the why's after and didn't go into as much detail at first unless they want more. My husband gives all background info before giving the main point and it drives people crazy. I am used to it, but will often see this in people who struggle to communicate ideas without losing their audience.",fuck_this_i_got_shit,2026-05-30 05:19:12,3,dataengineering,t3_1trqjah,False,
oopmi7a,"Seems like you already are able to articulate as you’re able to explain or breakdown these concepts in written form but orally, it’s difficult. Are these situations that you’re finding yourself in coming as questions you didn’t expect or as part of a presentation that you would prep for? Maybe try writing down the concepts ELI5 beforehand as that is your strength, and use that as a guide when you speak.",natedogg624,2026-05-30 05:38:02,2,dataengineering,t3_1trqjah,False,
ootfk7h,"Talk to a friend for practice and have them give you feedback. You need live help for a tight feedback loop. Also, what is your cultural background, some cultures are more direct while others are not. You might think it sounds fine verbally, but the audience might expect something different.",mrchowmein,2026-05-30 19:40:00,2,dataengineering,t3_1trqjah,False,
onrr8zd,"What we have. Airflow (mwaa) orchestrates data into and out of the warehouse. If jobs are big they get run on emr (spark), if they are small (api calls or loading a document) they are run native on an airflow worker via some @task custom Python.Airflow will then trigger our DBT jobs and tests. If there is down stream dependencies to the build we use airflow assets to trigger or signal that further work can continue. DBT is nice the moment you get above 1-2 transformations or movements on the db since it can organize the entire stack in an easy to follow, troubleshoot and validate place. That said some of our simple loads just load to a snowflake temp table, delete and insert from prod in a transaction.",KeeganDoomFire,2026-05-25 11:51:13,32,dataengineering,t3_1tn5py2,False,
