id,body,author,created_utc,score,subreddit,parent_id,is_submitter,distinguished
orpszzp,"You need to know how to write and debug code without it, otherwise you can't tell if it's slop or even if it's correct, and you can't help when it gets stuck. That takes at least four years, maybe a lot more. If you're not a senior then you're not done learning and people are still learning a lot even after 20+ years. If you're not even out of university and you're already having this thing think for you then you're cooked.People are saying ""just read the code"" but that's like learning math by only reading the solutions at the back of the book and never even trying. That's the same reason why people suck at learning LeetCode, because they skipped all the CS courses and they're just trying to memorize like an LLM.When people are bad at learning, it's almost always because they're trying to memorize. They are just pattern repeaters, like those guys who used to copy from StackOverflow without even looking at the code. Watching how LLMs work has really been enlightening for this discussion of what thinking and learning really is, because the way people have been ""learning"" over the past 15 years, with short attention spans and only memorization, has been exactly like AI. People who use AI wrong or to do things they've never learned are becoming exactly like AI, with none of its speed benefits or broad knowledge, and all of its limitations. They will be replaced by AI.",code_tutor,2026-06-15 02:53:27,5,cscareerquestions,t3_1u62pjj,False,
orpq11t,"How useful is an apple picker, after tree shakers exist?",RealNamek,2026-06-15 02:35:46,11,cscareerquestions,t3_1u62pjj,False,
orpldhr,"My company just jumped on the agentic coding train and I swear to f\*cking god Claude code has been a dumbass in our codebase. Leadership INSISTS all coding decisions go through Claude, right? Don’t even bother looking through the code to find the solution to an issue, just let Claude handle it!So I’ve used it on 3 or 4 different bugs now and implemented It’s solution at leadership’s request (it’s faster!!). It has been wrong about every single bug. EVERY. SINGLE. ONE. So I secretly fixed all the bugs with my brain (shhhh, don’t tell on me).Side / personal projects are a whole different ballgame than enterprise applications. The more I use Claude code in our repositories, the more I feel it can’t replace us.",AdventurousAir002,2026-06-15 02:08:26,7,cscareerquestions,t3_1u62pjj,False,
orq1q8b,"First time as a senior engineer? Welcome to the next level. You now solve bigger problems, figure out what to do, tell others what and how to do it and make sure it's done right. We all went through what you just described, just with jr engineers rather than AIs.Just remember, there's still craftsmanship and challenges, but they are on another level. Tackle big projects. Make sure they are done well so you don't have to keep going back to them. Building top of the things you built. Have fun.",ZenEngineer,2026-06-15 03:47:13,2,cscareerquestions,t3_1u62pjj,False,
orr157n,I think what you’re mourning is the struggle part. Humans weirdly attach value to suffering through the process. If something suddenly becomes easier part of your brain feels like you cheated even when the result is real.,Thr04w4yFinance,2026-06-15 08:19:20,2,cscareerquestions,t3_1u62pjj,False,
or6z4eu,"Back then companies were way more desperate for anyone who could even spell ""HTML"" correctly. Most interviews were just proving you weren't completely lying about knowing programming - like they'd ask you to write simple loop or explain what object-oriented means. Way less of these leetcode grinding marathons we have today.",Adventurous_Wrap_712,2026-06-12 08:49:45,144,cscareerquestions,t3_1u3pmos,False,
or78s4t,"In my experience, interviewing for Microsoft in the late 90s, STE and PM roles were mainly problem solving (brain teasers), estimation, and product design (design a better salt shaker). However, for SDE roles, it was what I would call LeetCode-light. Specific questions I remember getting in 1998:* Reverse a linked list* Cycle detection in a graph* Cursor (carat) navigation in a string that uses a multi-byte character set* Counting bits in an integerBack then you mostly went into the interviews blind (or at least I did) as there weren't a lot of resources. IMHO this made those types of problems more fair/reasonable than today's approach where people practice LeetCode problems for hours and hours on-end and it becomes a game of memorization and pattern matching instead of solving an unseen problem from first principles and talking through the solution with the interviewer.One common problem that really depended on the interviewer is that some of the questions required an ""ah ha!"" insight. A good interviewer would coach you toward the solution.",GoldenShackles,2026-06-12 10:11:55,25,cscareerquestions,t3_1u3pmos,False,
or73uvr,"you get interview questions like ""how many golf balls can you fit in a school bus?"" or ""how many car washes exists in NYC area?"" I vaguely remember those are the kind of questions that ""interview prep"" tells you to prepare for, companies like Microsoft, Cisco, IBM all famously asked them (at that time Google, Facebook/Meta flat out didn't even exist yet, and Apple was literally ~3 months from bankruptcy)",NewChameleon,2026-06-12 09:31:34,38,cscareerquestions,t3_1u3pmos,False,
or772cv,in the 90s it was way less leetcode and way more can you actually build the thing. the bar shifted to algorithm puzzles somewhere in the 2010s. honestly the old way filtered for better engineers imo,dsv853,2026-06-12 09:58:15,57,cscareerquestions,t3_1u3pmos,False,
or7iojk,"I liked Linux, had long hair, ate lots of Pizza that I washed down with Red Bull. That's what got me hired into my first freelance job, then apprenticeship.",h0uz3_,2026-06-12 11:22:55,12,cscareerquestions,t3_1u3pmos,False,
or82b5n,Do you know what html is? you're hired.,shachar1000,2026-06-12 13:15:46,13,cscareerquestions,t3_1u3pmos,False,
or90d0g,"My first tech interview was in 2000, and at that time the standard interview questions included brainteaser-style questions like, ""If you had to guess how many blue cars exist in the USA, how would you go about it?"" And ""Why are manhole covers round?"", and the answer to the latter was not ""Because the holes are round."" I think i even got the puzzle ""You're on a boat that you need to take a wolf and a rabbit across the river but you can fit only..."" Leetcode is an improvement upon this, i guess, but in both cases i think the test should be if the candidate meets a minimum threshold and isn't useful for differentiating between acceptable candidates.",albino_kenyan,2026-06-12 15:47:44,3,cscareerquestions,t3_1u3pmos,False,
or82afn,"If you were a tree, what kind of tree would you be?",swingincelt,2026-06-12 13:15:40,2,cscareerquestions,t3_1u3pmos,False,
or8f7nb,"Easy. I often found myself more knowledgeable than the guy interviewing me. I got more jobs by being able to talk to them and explain the tech. Keep in mind, first tech job was while I was still in high school, barely a driver's license.Also, it was more like a graphic design career. I just pointed to finished projects that I completed to show that I can get things done.",holy_handgrenade,2026-06-12 14:14:53,2,cscareerquestions,t3_1u3pmos,False,
or9x2ro,"Actually learning things was a lot more difficult but getting job was way easier. The interview process was pretty casual all in all.Dallas semiconductor flew me out I meet with a couple engineers, one asked me how I might swap memory data or clear a register , That's all I remember. I also met with a real estate agent while there to see how much house I could afford.Around the same time I went to Logitech having an office near my home, showed them some code I was working on in assembly at my internship at Japanese semiconductor company, and they asked me how long it took me to do it... I said a few days and apologized cuz have to leave and catch my flight to DC to integrate with Raytheon...Raytheon asked me what a pwm was after I brought it up in conversation. I gave a half assed answer and they sent me home.Finally that big japanese electronics company I interned with didn't ask me anything of substances and just told me the would transfer me me to Japan so I took the job.Logitech called back asking if there was anything they could do to change my mind. LoL8 years later I looked for three months, already employed i interviewed at Panasonic, they asked me a bit about what I've been working on. I highballed my asking price and they didn't get call back. Then within the same month interviewed with a leading automation company. Pulled out my laptop again showing some code. Ask me what a #pragma def was. By this time I knew the basics and they offered me a job.After 23.5 years total I retired early. Things were different.",Hairless_Gash,2026-06-12 18:13:26,2,cscareerquestions,t3_1u3pmos,False,
orj3sjq,"For me it would be a red flag, but my industry is AAA game dev. I would imagine it's different for stuff like web work.",ploxneon,2026-06-14 03:04:49,36,cscareerquestions,t3_1u59fhb,False,
orjawcy,"My company is at the point where they really want to make sure that candidates are capable of understanding the what, why, and how behind a particular implementation, but confident and comfortable enough to use AI to achieve that implementation.",BeauloTSM,2026-06-14 03:46:59,27,cscareerquestions,t3_1u59fhb,False,
orj30x5,I need to see both tbh. Sharp engineer who knows how to attack problems. And if u know how to do so with an agent huge huge plus. If ur an expert agentic operator I'd trust u to also use it to up skill u in whatever u need.,_itshabib,2026-06-14 03:00:17,56,cscareerquestions,t3_1u59fhb,False,
orjni3b,"It’s an okay signal. But if you’re committing code you clearly haven’t thought through, understand or recall, then thats not just a bad signal, you’ve lost my trust for a long time and ill assume you’re way further behind than i did before. Juniors are about coach-ability and potential. I want to mentor you, not claude.",mizzerem,2026-06-14 05:10:14,12,cscareerquestions,t3_1u59fhb,False,
orjspoa,I think it's probably easier to teach a strong software engineer how to use AI properly than it is to teach a strong AI user how to do proper software engineering.,qqqqqx,2026-06-14 05:48:09,10,cscareerquestions,t3_1u59fhb,False,
orj1yr6,I’m more interested in seeing strong traditional SWE skills/fundamentals myself,lhorie,2026-06-14 02:53:59,34,cscareerquestions,t3_1u59fhb,False,
orj4ce9,"It sounds like you're focusing too much on specific tools and workflows instead of fundamentals. When I hire I look for strong CS fundamentals first, but yes, you also have to be good at using tools. But the specific tools don't matter, I look for those who have natural curiosity and try a lot of different stuff.",unconceivables,2026-06-14 03:08:02,6,cscareerquestions,t3_1u59fhb,False,
orjdbiv,"if I'm hiring a junior I definitely want someone who isn't cynical about the tools, but I also need someone with real understanding to drive them",gordonnowak,2026-06-14 04:01:58,3,cscareerquestions,t3_1u59fhb,False,
orklf1v,"the biggest thing we look for in junior hires is are you good to work with. you're not really expected to possess specific skills yet. you're young, you're inexperienced, and quite frankly you know nothing yet. but if you have the fundamentals and you're a good worker, that gives us confidene that you can pick up the necessary skills to do the job well. and this is why we only hire juniors through return offers on internships now. interns are cheap (in the scheme of things) and low commitment. and the junior roles that eventually become available are much fewer than that. so that means we can hire a lot of interns and take chances on some of them, then actually get to see how they work for 2-3 months, and pick the ones we like. that was a bit of a long winded way to say that, as a junior (and a true junior who's just finishing school + no full time experience), your specific skills matter little. because ultimately, you having taken a course for a semester doesn't put you nearly at the level that you think it might.",VastAmphibian,2026-06-14 09:43:10,3,cscareerquestions,t3_1u59fhb,False,
orlfvav,"Yes, but for a specific reason — agentic debugging is different from traditional debugging. Agents fail silently: wrong confidence, incomplete tool calls, context drift midway through a task. A junior who's debugged those has developed a failure-mode intuition that's hard to fake. The red flag is the inverse: candidates who get working code through AI but can't explain why something broke.",ultrathink-art,2026-06-14 13:20:58,3,cscareerquestions,t3_1u59fhb,False,
oqvgqv1,"I'm going to take a minority position here -- the really good manual testers in our org deliver consistent quality findings -- unique findings and rarely if any false positives. they are absolute heroes in my mind. the automated tests beyond basic code-level unit and integration tests are something more like a reverse centaur. The top wants automation everywhere because they view it as cheap, and the new QA engineers want automation too, often because they themselves see QA as a stepping stone to SWE and see writing automation scripts as a step in that direction.My other minority take on QA in general is that they should be paid more than SWEs in most cases. I think what they do is both harder and more critical to the health of the product. QA at minimum should be viewed as the deep, highly specialized skill that it is. For years I have watched others view it as kind of a SWE ""stepping stone"" which is so, so, so, harmful to software quality.As AI slop of the mid 2020s has shown plainly, real people value quality. So once wall street implodes and what people really want matters again, i think that QA will indeed show a huge boom.( I do not work nor have I ever in QA. But as a SWE, the quality QA workers are my most valuable resource, without question. )",Appropriate-Bet3576,2026-06-10 17:15:47,73,cscareerquestions,t3_1u265jd,False,
oqv9fqf,"No, I see SDET roles becoming more sophisticated. Manual QA is slowly evolving into SDET too",lhorie,2026-06-10 16:44:11,12,cscareerquestions,t3_1u265jd,False,
oqv3ecy,"No, manual QA was already becoming obsolete or redundant in many projects before even GPT 3.5 was releasedIts more like devs will be expected to Product Owners, PMs, QA, Architects, Front End, Back end, DBA and Cybersecurity analysts because ""with AI you are 10X faster"" and now software engineering wont be considered a skilled but rather a normal office job like bank teller was before because Claude does the hard part",PejibayeAnonimo,2026-06-10 16:17:52,73,cscareerquestions,t3_1u265jd,False,
oqvmddz,i think human QA will always be needed no matter if its is AI developing or human,CommentGreedy8885,2026-06-10 17:39:52,8,cscareerquestions,t3_1u265jd,False,
oqv1oyj,No. QA/QE will remain a software engineering responsibility.,drew_eckhardt2,2026-06-10 16:10:26,19,cscareerquestions,t3_1u265jd,False,
oqv78ft,"No, even before AI, QA has been heavily automated. AI will likely further automate QA.",skilliard7,2026-06-10 16:34:38,10,cscareerquestions,t3_1u265jd,False,
oqvlyec,"No. But as a former QA tester I am often shocked at what simple crap these supposed genius developers and their 100000 AI tools did not catch. But eh... I was just a simple QA now being a service owner. I give developers absolute shit for bugs. They were given all the money, tools and responsibility over QA so they eat that shit they give me. I even take money from their contract if bugs caused damages in the operations proces.",balletje2017,2026-06-10 17:38:04,3,cscareerquestions,t3_1u265jd,False,
oqvlsyk,"Disagree with the comments here saying ""just automated it lol""A good QA with that ""6th sense"" is incredibly valuable and will weed out edge cases no one else thought of. Or even just to act as an additional, objective pair of eyes on a feature.And the trouble with relying on automation which, to be honest, is likely written with AI in this day and age, is if theres a bug in the system or a feature is not aligned to the business value you're going for, it'll assert the bug exists lol. Seen this quite a lotNo there won't be a resurgence. Higher ups are on the same ""AI ALL THE THINGS"" train. But they should become more valuable going forward and imo should have a resurgence",Competitive_Clue_752,2026-06-10 17:37:26,5,cscareerquestions,t3_1u265jd,False,
oqvajoe,"Unless you’re working in hardware or some piece of software worth in the billions ie browser or OS, I think it’s fairly at the low end of the totem pole for org budgets",vamos_davai,2026-06-10 16:49:02,2,cscareerquestions,t3_1u265jd,False,
oqvbgpw,"Before AI companies had already started moving away from standalone QA roles and started having developers do the QA, along with automated regression testing suites, and sufficient unit/integration testing.I'm not sure I see how AI would change that. Devs could ship slop pre-AI, and they can still ship slop post-AI. The quality gate has always been a critical part of our workflow.If anything, I see AI causing the opposite. The companies out there that still have dedicated QA are going to see that with all the productivity boosts AI is giving to their devs, they can just skip the middle man and have the developers do the QA like everyone else is already doing. *Developers* who are good at both writing code, and testing and checking for regression will be a valued commodity.And a company that's so shoddy that they didn't have sufficient quality practices prior to AI, they're going to continue to be shoddy. They won't suddenly change their minds and decide quality is important. They were shipping slop pre-AI, and they'll continue to ship slop post-AI. Slop's their business.",CapableHerring,2026-06-10 16:52:59,2,cscareerquestions,t3_1u265jd,False,
orcy2cy,"Personally, I'd say you're undervaluing 6 in comparison to 1-5. I think the ""skill atrophy"" issue is much less of an issue than people make it out to be. I guess leetcode might be worth doing though, given how disconnected our interview process is from actual problems we're trying to solve.",CoVegGirl,2026-06-13 04:13:49,22,cscareerquestions,t3_1u4g6lq,False,
orddugt,"Your list is mostly fine, but behavior should not be “refresh before interview” if you’re actively searching. Keep a tiny story bank warm: project tradeoff, conflict, failure, leadership, ambiguous bug, production issue. Ten minutes a day beats trying to become an emotionally available narrator the night before an onsite.",kadaumsk8,2026-06-13 06:20:36,2,cscareerquestions,t3_1u4g6lq,False,
oro1o73,"1. Don’t panic 2. Sign up for unemployment and any benefits you’re entitled to. Get it taken care of as it takes a while for it to come online 3. You can’t search all day so exercise regularly, sign up for new jobs for an hour , look for networking connections who are hiring and get their inside scoop 4. I’ve taken other jobs to bring in income as well as volunteering as well with all the time you’ll have. 5. I’ve also doubled down and kept myself really busy and active as volunteer work is always needed. I worked with ski school in the morning and then helped tutor student veterans. 6. It’s very hard to not panic when this happens as it’s out of your control.",HackVT,2026-06-14 20:54:29,2,cscareerquestions,t3_1u4g6lq,False,
ordwspn,"Build the project, but pick one that solves a real problem you have -- motivation holds longer when there's actual utility. Pair it with deliberate interview prep: 2-3 LeetCode problems/day (hard on weekends), systems design reading for senior roles. 16 hours/day is a genuine advantage. Most people prep for interviews while working 50hr weeks -- you can get 2 months of prep done in 3 weeks.",Aritra7777,2026-06-13 09:10:01,1,cscareerquestions,t3_1u4g6lq,False,
ore0w0s,1. System design 2. Pet projects 3. Health,No-Pattern-9266,2026-06-13 09:47:24,1,cscareerquestions,t3_1u4g6lq,False,
orepcdb,Build a rust app,Trick-Interaction396,2026-06-13 12:49:20,1,cscareerquestions,t3_1u4g6lq,False,
orjpuyy,"Honestly your breakdown is solid but I'd push back on sys design ""sticking"" as it needs reps, not just refreshers, especially for distributed systems edge cases. With 16 hrs a day I'd bump that to at least 30-45 min daily, not just pre-interview. Also 1 hr leetcode is fine but make sure you're doing timed mocks, not just solving with hints on. For sharpening sys design specifically, CalibreOS has solid structured practice if you want something guided. The API-from-scratch approach before BE interviews is genuinely one of the best things you can do, keep that.",Opening_Bed_4108,2026-06-14 05:27:27,1,cscareerquestions,t3_1u4g6lq,False,
oqyvjg4,"its a compounding effect, I feel AI has a tendency to be extra verbose and if everyone uses it then the project balloons out of your mind. So you can't even keep up with the codebase because of that on top of you offloading thinking into AI.",monarchyofthedead,2026-06-11 03:36:42,25,cscareerquestions,t3_1u2nqnt,False,
oqyvbe3,yes i feel the same thing. AI has corroded my critical thinking skills and now i can’t use reddit search so i post the same question that gets asked every day.,octocode,2026-06-11 03:35:33,60,cscareerquestions,t3_1u2nqnt,False,
oqyx9j0,"Yes, now stop using it as much and use your own brain instead.",Unfilteredz,2026-06-11 03:46:14,10,cscareerquestions,t3_1u2nqnt,False,
oqz7mok,"Yep, for sure!",Remote-Telephone-682,2026-06-11 04:54:47,3,cscareerquestions,t3_1u2nqnt,False,
or1or6h,honestly this is something more people need to talk about. appreciate you putting it out there.,Miamiconnectionexo,2026-06-11 14:58:58,2,cscareerquestions,t3_1u2nqnt,False,
or7uw2z,"I've been feeling this as well, you've essentially boiled down hours of work and understanding into a few mins and you're just meant to blindly believe it. What I do is verify the AIs assertions and handle cases in case it's wrong but it's definitely jarring",1millionnotameme,2026-06-12 12:36:26,1,cscareerquestions,t3_1u2nqnt,False,
or05eo0,If something is atrophying and your output hasn't decreased in quality then it's a sign that the skill is not useful anymore.,tilted0ne,2026-06-11 09:37:35,0,cscareerquestions,t3_1u2nqnt,False,
oqzfb1f,"Same boat for a while. What actually helped: stopping accepting AI output without tracing the control flow myself. Not just ""does it look right"" — actually building the mental model from the diff. Slower, but I started trusting my own reads again. The AI is a tool, not your reviewer. You still have to be the one who understands the system.",CivilCandidate1349,2026-06-11 05:53:06,-5,cscareerquestions,t3_1u2nqnt,False,
oqzvuo6,Lol upvote for you good sir,what_cube,2026-06-11 08:12:21,6,cscareerquestions,t1_oqyvbe3,False,
oqzwia8,"theyre in a war with ""yeah but DAE think if you don't embrace this new technology that you'll be a left behind dinosaur?""",pydry,2026-06-11 08:18:14,3,cscareerquestions,t1_oqyvbe3,False,
oqxhcrg,I've had managers and senior devs that I've called intermediate at most but that's just my experience dealing with 0 leadership from people in leadership positions.,iDexTa,2026-06-10 22:51:48,31,cscareerquestions,t3_1u2hg2c,False,
oqxhi95,"Yeah, I work with a guy who’s been at the company for ten years that started as like an it support person or something. Dude has no fucking clue what he’s doing but thinks he is a god at all things tech. The company migrated to cloud and their solution was to manually spin up an ec2 server, load a bunch of code on it without version control, and run scripts on cron jobs. Fucking mess I had to unravel and spend tons of time convincing that we need to move away from that. You’ll correct him on something and he’ll start talking over you and be like “oh yeah, I knew that and you can do this”. Talks over everyone anyways. Never wrong. Fortunately he got moved off my team about a year after joining. But he still works in same org so I cross paths with him every now and then. Still insufferable. Just want to tell him to shut the fuck up and listen to someone else for once.",theNeumannArchitect,2026-06-10 22:52:36,32,cscareerquestions,t3_1u2hg2c,False,
oqxixqm,"Slightly different situation, But I’ve had a high level engineer say something that struck me as wrong, so I asked for clarification and they immediately started to explain very very basic stuff, to an insulting degree. Like they claimed system does X, but I thought it did Y and pushed back, and they started explaining how for loops work. It gives the impression to everyone else’s that you don’t understand because you’re junior, not because there is a fundamental flaw in their logic. When I’ve tried to get these conversations back on the rails they defaulted to “I don’t have time to explain this stuff to you, ask your lead”.",No_Scallion174,2026-06-10 23:00:18,25,cscareerquestions,t3_1u2hg2c,False,
oqxv0zy,There is a pervasive problem in industry where time in the chair is conflated with skill level and growth in one's skillset and wisdom. You seem to be encountering this phenomenon and it can be a challenge because management often doesn't know the distinction.,shadwwulf_,2026-06-11 00:08:48,15,cscareerquestions,t3_1u2hg2c,False,
