id,body,author,created_utc,score,subreddit,parent_id,is_submitter,distinguished
oglul8p,try 'rm -rf /' next if you want to advance to VP of Data,TyrusX,2026-04-16 22:15:45,327,dataengineering,t3_1snhrsc,False,
oglsq7o,I hope you retro the many ways you could prevent this in the future still :rolling_on_the_floor_laughing:,Evilcanary,2026-04-16 22:05:57,73,dataengineering,t3_1snhrsc,False,
oglugr1,"Congratulations!:party_popper::balloon::bottle_with_popping_cork: At my first job, from time to time I was sitting at interviews conducted by my lead. On each interview he was asking each candidate the same question again and again: “Have you ever dropped production database?”When I asked him what’s the purpose of this question, he said: “If engineer never dropped prod - he will definitely do it in your project”. Jokes aside, such situations are never a responsibility of any engineer, especially junior one. Architect, Lead or DevOps should care about such things.",lieber_augustin,2026-04-16 22:15:05,45,dataengineering,t3_1snhrsc,False,
ogltyk2,I'm wondering why you have access to drop production tables so easily.,squirrel_crosswalk,2026-04-16 22:12:23,91,dataengineering,t3_1snhrsc,False,
oglsnp7,![gif](giphy|3ohzAu2U1tOafteBa0),DMAspira,2026-04-16 22:05:35,22,dataengineering,t3_1snhrsc,False,
oglzjyf,I think security policies need to be reviewed if developers have access to nuke prod.products.Edit: saw the other comment about it being a privileged account.But I also have questions about testing PRs in a prod database,AndrewLucksFlipPhone,2026-04-16 22:42:57,8,dataengineering,t3_1snhrsc,False,
ogm3bp6,"""Enginner"". Like a gunner. Evolve into a DBA, you could drop databases, maybe even entire clusters!",taker223,2026-04-16 23:03:42,6,dataengineering,t3_1snhrsc,False,
ogltet8,Congrats. See you on the soup line.,vfdfnfgmfvsege,2026-04-16 22:09:29,10,dataengineering,t3_1snhrsc,False,
ogltk8h,I feel oddly proud of you :beaming_face_with_smiling_eyes:,Final-Mix-9106,2026-04-16 22:10:16,8,dataengineering,t3_1snhrsc,False,
ogluckg,I totally wanted the Star Wars meme here. But you had a backup… right?,Wistephens,2026-04-16 22:14:27,8,dataengineering,t3_1snhrsc,False,
ogqarvr,"Are you interested in transitioning into Data Engineering? Read our community guide: https://dataengineering.wiki/FAQ/How+can+I+transition+into+Data+Engineering*I am a bot, and this action was performed automatically. Please [contact the moderators of this subreddit](/message/compose/?to=/r/dataengineering) if you have any questions or concerns.*",AutoModerator,2026-04-17 15:31:07,1,dataengineering,t3_1so4cro,False,moderator
ogqd1wf,This isn’t even wrong. It’s creatively incorrect.,ScottyDoes_Kno,2026-04-17 15:41:27,277,dataengineering,t3_1so4cro,False,
ogqhhxc,"Holy crap. Theres server-side-rendering, and then there's apparently database-side-rendering!",SimpleSimon665,2026-04-17 16:01:26,141,dataengineering,t3_1so4cro,False,
ogqcc2z,"When you select the string in powerBI it renders the JavaScript/HTML? That’s pretty cool if so, but this is horrific and awful",mistanervous,2026-04-17 15:38:14,83,dataengineering,t3_1so4cro,False,
ogqcuay,It‘s genius :face_with_tears_of_joy::face_with_tears_of_joy::face_with_tears_of_joy: I love it :face_with_tears_of_joy::face_with_tears_of_joy::face_with_tears_of_joy::face_with_tears_of_joy:,Ready-Marionberry-90,2026-04-17 15:40:30,36,dataengineering,t3_1so4cro,False,
ogqfmdv,"""Sadly the string exceeds the length of VARCHAR(MAX),""At this point he seems to just overcomplicate it for the seek of it",Zatujit,2026-04-17 15:53:01,40,dataengineering,t3_1so4cro,False,
ogqp203,Robert Tables grew up and he's now your colleague. Congrats.,pacopac25,2026-04-17 16:36:10,28,dataengineering,t3_1so4cro,False,
ogqdpko,Looks like he doesn't know how to use PBI in the traditional way,happy_and_sad_guy,2026-04-17 15:44:25,21,dataengineering,t3_1so4cro,False,
ogqf457,Honestly I used to work for BofA and they used to stuff html .. like really thick and long html into Oracle in a record ;and when the webserver came up it would pull that record (html) and draw a custom page for the customer. Coolest think I ever saw .. so innovation comes in all shapes and sizes. But in 2026 I'm becoming rapidly convinced that there's nothing more dangerous than the ignorant and AI together.,TheOverzealousEngie,2026-04-17 15:50:44,18,dataengineering,t3_1so4cro,False,
ogqkp3b,why dont you wrap that in a pipeline for him? Then leave it undocumented for the next guy,VipeholmsCola,2026-04-17 16:16:12,16,dataengineering,t3_1so4cro,False,
og5cu8r,Don't be sad. You'll get a ton of money and learn a bunch of new stuff for your next job. Whether it works or is cost efficient isn't your problem.,codykonior,2026-04-14 15:26:35,262,dataengineering,t3_1slbseg,False,
og5s087,"Databricks is still much more mature and suited for enterprise scale. Fabric is improving at a steady rate, but that means prepare to hit blockers, work around those blockers, and then have those workarounds become redundant in about a year when MSF finally adds the feature you needed. I have yet to see a convincing enterprise SDLC model for Fabric akin to Dbx DABs. If you want that, you are basically rolling your own DAB using a CLI tool that Microsoft doesn’t even officially maintain last I knew.",iknewaguytwice,2026-04-14 16:34:05,30,dataengineering,t3_1slbseg,False,
og5ku0c,Fabric is better than synapse. Snowflake and databricks are better than Fabric. Some tools are worse than Fabric. But since you aren’t the decision maker and they already chose Fabric. All you can do is learn to use it and figure out how to make it work as that’s why they pay you. Maybe in a year or two your company will realize they should have moved to Snowflake,notnullboyo,2026-04-14 16:01:51,11,dataengineering,t3_1slbseg,False,
og5dda1,"Fabric is bad but is over hated. It mostly works with some very jagged edges. Just focus on learning and when things go wrong, understand why and keep that in mind for your next position.",No_Lifeguard_64,2026-04-14 15:28:56,75,dataengineering,t3_1slbseg,False,
og5ox3q,"If this post was made only a year ago, I would 100% agree. However Fabric has come a long way, whether it's the Warehouse. MLVs etc..The only issue is that Fabric datafactory is kind of shit and very resource intensive.",Befz0r,2026-04-14 16:20:24,9,dataengineering,t3_1slbseg,False,
og5dvud,"Fabric is definitely a good replacement for Synapse. Both are equally terrible :grinning_face_with_sweat:We went from synapse to Databricks and we finally have a stable, modern system that doesn’t break for no reason. That said, most of the concepts translate well between the two so while for most companies it’s a bad choice, for the engineers it’s not all terrible. Unless it’s your job to fix broken pipelines on a Saturday night…",dr00Ze,2026-04-14 15:31:12,29,dataengineering,t3_1slbseg,False,
og5occr,"We've had a limited rollout of Fabric and are fully migrating everyone to it very soon. I still have some issues with it, but it has improved quite a bit in the last year. My last job used Informatica Cloud and let me just say I will take Fabric over IICS any day of the week.",Luminter,2026-04-14 16:17:47,15,dataengineering,t3_1slbseg,False,
og5dxnm,It's just a tool at your job just like any other. I am not very opinionated about these things.,Demistr,2026-04-14 15:31:25,34,dataengineering,t3_1slbseg,False,
og6axbf,It doesn't matter what platform you use. You're gonna migrate it in two years anyway.Oh and I kinda like fabric.,Waste_Membership_483,2026-04-14 17:56:41,6,dataengineering,t3_1slbseg,False,
og6z6ju,I worked at a a company with Fabric and just took some data bricks certs when applying for new jobs. I said we used Databricks and I got the job you’ll be fine. Better Fabric than some legacy stack that is more outdated.,LivingRespond9059,2026-04-14 19:44:55,3,dataengineering,t3_1slbseg,False,
ofyatdk,"Awesome that DuckLake has reached v1.If any DuckDB/DuckLake developers are reading this:Could you add first-class support for the SMB protocol? I do not mean locally mounted filesystems, since those are OS-dependent.I want to be able to read files directly from paths like smb://mystorage/myshare/foo/bar/baz.csv within DuckDB.It should work well in traditional enterprise Windows environments too, with DFS, Kerberos, and the whole shebang, but it should also work on macOS and Linux machines. That is why I want SMB support added directly to DuckDB.Why? A lot of enterprises still rely on SMB on-premises.Basically, could you tone down the S3/cloud focus a bit?I would also love to see better documentation in the DuckLake docs around authentication and authorization, it seems like that is a second thought, but it is important for enterprises to understand.",SutMinSnabel4,2026-04-13 15:12:40,20,dataengineering,t3_1skalz9,False,
ofzefja,"sorry, I'm still catching up on a lot of this stuff, but how would a BI tool like Tableau query a ducklake table?",SoloArtist91,2026-04-13 18:07:17,9,dataengineering,t3_1skalz9,False,
ofy3v57,"So fun fact about MotherDuck, and I’m not sure if this also the same for duck lake… but the people who started motherduck are not the people who created duckdb. Just food for thought.",nonamenomonet,2026-04-13 14:42:13,13,dataengineering,t3_1skalz9,False,
ofzvbzz,> DuckLake stores all metadata in a databaseLike Apache Hive? What would be a key difference from Hive Metastore?,hadoopfromscratch,2026-04-13 19:23:15,5,dataengineering,t3_1skalz9,False,
og0rwar,So data is still stored as Parquet - are we able to create something like indexes? I would like to sort on two different and unrelated axis - like id or position.,DeepFryEverything,2026-04-13 21:54:39,3,dataengineering,t3_1skalz9,False,
oggbe0t,Congratulations to the team. Building and launching a new OLAP engine plus a corresponding catalog format is no easy feat. More competition is good :).,warehouse_goes_vroom,2026-04-16 03:06:32,2,dataengineering,t3_1skalz9,False,
og0j9km,"lol, why my comment was deleted?",Substantial-Cow-8958,2026-04-13 21:12:29,2,dataengineering,t3_1skalz9,False,
ofzouxz,Congrats to all people involved. Really eager to check this out.,brunogadaleta,2026-04-13 18:53:57,1,dataengineering,t3_1skalz9,False,
ofyhplp,"Hey, why motherduck got so expensive out of nowhere?",Substantial-Cow-8958,2026-04-13 15:43:30,9,dataengineering,t1_ofy3o08,False,
og1ovkk,"This is not advice, nor am I telling you what to do, but be aware that the pace you set will be the pace you're held to. Same issue a lot of juniors run into, shooting up really fast, then burning out.If you really do 10x your ship rate with agents, that'll be the new expectation (and future expectation to beat). If you were to improve by, say, 3x and make it appear/sound that you're working in parallel to a 10x degree, then you won't be held to the higher amount, and exceeding it when necessary becomes much easier.Source: a former junior who killed myself with all-nighters early in my career to impress higher-ups with my output, got no recogintion, and was actively hurt when settling to a normal pace.",MakeoutPoint,2026-04-14 00:54:33,151,dataengineering,t3_1sktgoh,False,
og1p0di,Looks like this is the industry expectation across the board now. My boss expects the same thing,IntraspeciesFerver,2026-04-14 00:55:19,89,dataengineering,t3_1sktgoh,False,
og1vrr9,"My workplace and boss are exactly de same. Really sad to be honest, they just see us as numbers and not as people. They care about speed, not quality.",errorOccurred_,2026-04-14 01:33:33,16,dataengineering,t3_1sktgoh,False,
og33uak,"The Mythical Man Month was the idea that throwing bodies at a project does not scale the project to the same ratio, because of communication overhead.Miller's Law is that you can only keep 7 plus/minus 2 things in your head at any given time.Juggle what you're comfortable juggling. Try to add a ball every once in awhile.For me, the difficulties are not with WIP, but with backlog refinement and blockers.",SaintTimothy,2026-04-14 06:36:52,13,dataengineering,t3_1sktgoh,False,
og1oksq,">His idea is that if it works, it works.I'm always reminded of that parable of the drunk guy and his keys with people and their ""if it works"" generated code. Guy drops his keys walking home at night, crosses the road to look for them under the street lamp.",Atticus_Taintwater,2026-04-14 00:52:51,31,dataengineering,t3_1sktgoh,False,
og1yt09,"Ask what his boss's threshold for errors, risk, or critical events are. 10% fail rate? More? lol, have fun. AI operates in reality on fail rates, not pushing code or sending your emails. What a joke.",No-Agency-No-Agenda,2026-04-14 01:50:47,10,dataengineering,t3_1sktgoh,False,
og1wtry,This is going to be a major limitation of AI for pure data development / software development. Humans are only capable of multitasking and managing so much context in their brain. We can't be scaled up by the same factor that agentic AI can be. The AI the average developer can deploy is not going to be autonomously sourcing work and seeking feedback. So inevitably productivity will be capped by our human limits.,Oxford89,2026-04-14 01:39:33,15,dataengineering,t3_1sktgoh,False,
og2deoo,![gif](giphy|3ornka9rAaKRA2Rkac),NoleMercy05,2026-04-14 03:17:26,3,dataengineering,t3_1sktgoh,False,
og2yt3w,"This is the old ""how can we parallelize mindset"" from managers/leaders flowing through the ""Agentic era"". I can sympathize with the feeling that there is the expectation that we ship much faster.It's becoming unrealistic because every time the bar is set even higher without concerns that the team/people will burn out faster than before.",One_Citron_4350,2026-04-14 05:54:31,3,dataengineering,t3_1sktgoh,False,
og2sbl9,"sounds like ur boss is stuck in the “more is better” mindset, but that’s a surefire way to burn out quality. i’d push back by showing how focusing on fewer things leads to higher quality and fewer reworks. context switching kills long-term velocity, even with agents. if he’s shipping fast without reviewing, that’s a red flag for stability in the long run. either u set boundaries or it’ll be tough to sustain in the long term.",Enough_Big4191,2026-04-14 05:02:09,5,dataengineering,t3_1sktgoh,False,
ogabuue,"Personally as a junior, I find it hard to want to learn systems thoroughly that I feel are being replaced by newer tech",iSeeXenuInYou,2026-04-15 07:34:50,192,dataengineering,t3_1slz2lk,False,
ogad6rj,“Why don’t Jrs want to use our shitty old stack that doesn’t transfer anywhere because even the most archaic firms have moved to new tooling?”Whenever I get stuck using GUI boomer tech I write python automations to do code -> gui,LoaderD,2026-04-15 07:47:05,155,dataengineering,t3_1slz2lk,False,
ogajhni,"Anecdotally, people who come from legacy systems also have a habit of rejecting new tools. Git is ""too complicated"" and ""I don't want to learn Python"" when it is clearly the most popular language in any data stack currently. Why? Because they're eyeing up retirement. I don't blame them at all for feeling that way and I do think we're all going to end up as people who are ready to stop working and collect our pensions.New people are building their career. More experienced people are winding down. Both viewpoints are valid for different reasons.",MikeDoesEverything,2026-04-15 08:44:27,61,dataengineering,t3_1slz2lk,False,
ogacjzx,"Blame this on orgs who got sold on the low-code / no-code solutions and then had to find and upskill engineers to actually use these tools.Data engineering as a profession should've always had the standards Software Engineering has vis a vis CI/CD, code quality etc. it is a damn shame we instead got adulated with unusable crap that also ruins your chances to transitioning to diff roles because you've got few transferable skills early on. It is a death sentence IMO. Glad we're atleast shifting away from that expensive trash.",alt_acc2020,2026-04-15 07:41:17,49,dataengineering,t3_1slz2lk,False,
ogach32,"Engineers don't want to touch SSIS and Informatica because they are not for engineers. They are for non-technical people pretending to engineer.Updating an Airflow DAG (or other code-first tool) often requires changing a few args. Updating GUI flows can take a lot longer, and often requires steps like copy pasting. Not to mention challenges with visibility, customization, version control...by the time you solve these issues, you are just coding.IME data engineering is never as simple as set and forget, and that's the only scenario I'd trust to GUI etls.",lab-gone-wrong,2026-04-15 07:40:32,125,dataengineering,t3_1slz2lk,False,
ogam3mp,"Senior here. I don't want to touch those tools either. It's been almost over 10 years since I last worked with SSIS and even longer since working with PowerCenter. SSIS thought me to generate pipelines, using BIML at that time. Now I prefer to work with tooling that helps me to work efficient, consistent, configurable, testable etcWhich none of the ""old"" tools allow me to do. With the help of LLM this applies even more so.",Spookje__,2026-04-15 09:08:31,19,dataengineering,t3_1slz2lk,False,
ogaqrz5,"Sr. Data Architect here. Everyone is entitled to an opinion. Some opinions are expensive and problematic - like this one. It's 2026. Successful businesses don't shell out cash to get locked in - they're bolting to the agility of a modern tech stack to match their ever changing needs. Even governments are looking to rid themselves of things like Informatica. Informatica and SSIS should be choices - not necessities. Unlike Informatica and SSIS, though, Python, Java, and Rust are useful ... everywhere. Progamming skills are sought after skills even in a post agentic world. That alone lowers costs and widens the jon markets aperture. It is fallacious to assume imperative programming languages are less capable or less consistent than proprietary stacks... especially since some of those languages are used to build those ""consistent"" stacks. Our industries just learned to cut those fat, pricey middlemen out.",yaq-cc,2026-04-15 09:50:13,19,dataengineering,t3_1slz2lk,False,
ogbfk2u,Thank god I never had to use those tools in my career.,studentofarkad,2026-04-15 12:39:15,5,dataengineering,t3_1slz2lk,False,
ogafvgw,Because it's shit.,compulsive_tremolo,2026-04-15 08:11:20,18,dataengineering,t3_1slz2lk,False,
ogae5gf,Maybe they don’t want to touch because it’s old and outdated? And experience in such etl wouldn’t be needed in future?,suhigor,2026-04-15 07:55:52,13,dataengineering,t3_1slz2lk,False,
ogsrr4e,"Good job, youd be surprised how often someone fresh can easily fix things that have been in place for a whileBut make sure you wait a bit to confirm everything works fine and 1 min cooldown is acceptable before you present stuff to your boss :)",aes110,2026-04-17 22:38:29,101,dataengineering,t3_1sofmoj,False,
ogsrq6b,You would be absolutely shocked if you saw how awful most implementations are. The sins of the cloud data warehouse is that they make things so easy and fail proof that you can still get things working in the worst way. It’s amazing when it feels like magic but it can give false sense of confidence that you are doing things correctly.,Pittypuppyparty,2026-04-17 22:38:20,34,dataengineering,t3_1sofmoj,False,
ogsrv72,Make an update. Either it was a low hanging fruit or it was set like that for a particular reason. We'll know. Great work.,Alternative-Guava392,2026-04-17 22:39:08,26,dataengineering,t3_1sofmoj,False,
ogt0tb0,“Snowflake reps hate this one simple trick”,tequilamigo,2026-04-17 23:30:38,20,dataengineering,t3_1sofmoj,False,
ogt4yip,I hate when juniors do this shit and fuck up everyone's user experience.,One-Employment3759,2026-04-17 23:54:51,14,dataengineering,t3_1sofmoj,False,
ogtbpmf,"It’s funny seeing everyone blindly glazing without knowing downstream impact. At a previous role (DS research) our DE manager decided to cut synapse auto suspends down. The issue was, he cut it down to 5 minutes. So you would run code that could take 20ish minutes to start the instance and complete the run and instead of sitting on your hands you would task switch or handle SME requests. So it was about 75% of the time you would come back to your work to find out you missed the idle window by 1-2 minutes and had to restart from scratch.So people just said “fuck using this unless I have an hour of uninterrupted time to run code and do 1+ revision”. Cloud costs dropped, because no one was using it.Inb4 “save state, run auto-wake scripts to keep the instance running, etc.” I did, but a lot of people didn’tManager ended up having to revert the timeout and by then many people had moved to work arounds and overall it made the process a fucking mess",LoaderD,2026-04-18 00:35:46,10,dataengineering,t3_1sofmoj,False,
ogsspcq,"People are sensitive to changes like this, especially if there is a >5 second spin up time for clusters. We use databricks where similar configs changes can be made. For user facing compute we were told not to set TTL less than 5 minutes",ElCapitanMiCapitan,2026-04-17 22:44:01,9,dataengineering,t3_1sofmoj,False,
ogszqn6,I reduced frequency of backups from every hour to every week. Boss doesn't know yet.,FirstOrderCat,2026-04-17 23:24:25,8,dataengineering,t3_1sofmoj,False,
ogssjoo,"Hell yeah. Nice work. If you’re lucky, they might even give you a 1-2% raise now",ironmagnesiumzinc,2026-04-17 22:43:07,14,dataengineering,t3_1sofmoj,False,
ogssj98,"It’s good that you’ve made impact with this low hanging fruit. I understand you want to share and take credits immediately. It’s definitely worth writing on the cv and it’s honestly impressive. Unfortunately, I think you should also consider the bureaucratic implication on you. If you present it, you will have built an expectation that you’ll have to live up to. It’s, however, unlikely you’ll have any real gain from sharing the news so early on. Instead, if you time it near salary/performance review, provided you have a good manager who doesn’t steal your credit, you might get an actual reward for what you’ve done.",romainmoi,2026-04-17 22:43:02,16,dataengineering,t3_1sofmoj,False,
ogbvhkc,Take the easy money while it's there. Do a few certifications while you're sitting there and get a new job for more cash.,Pab_Zz,2026-04-15 14:01:17,145,dataengineering,t3_1sm6u62,False,
ogbxppt,Why are you watching it like a security guard. Have it send you alerts and go do something else.,VynlliosM,2026-04-15 14:11:54,44,dataengineering,t3_1sm6u62,False,
ogbvc9m,"well damn, start a new hobby ya lucky SOB",VonDenBerg,2026-04-15 14:00:35,62,dataengineering,t3_1sm6u62,False,
ogbvqvj,welcome to data babysitting phase enjoy the alerts and fake dashboards it’s normal then they cut staff cause job market is trash,CottonShirtWithStain,2026-04-15 14:02:31,8,dataengineering,t3_1sm6u62,False,
ogbx4oe,"Maybe invest some personal time with a non-profit that you care about, and build them a fully open source BI solution, to expand on your tech knowledge, and gain experience + reference.Will make getting a certification easier if you build something that needs the knowledge for it. Rather than using only Udemy.Not being paid from a non-profit usually can get you some side benefits that you'll appreciate. Worth looking into.Like the Make-A-Wish foundation, as an example. Or Leukemia. They usually need volunteers and on a weekend fund raising event you get some extra social life, free food, part of a team.",SirGreybush,2026-04-15 14:09:08,7,dataengineering,t3_1sm6u62,False,
ogcvqx9,Imagine you're doing tons of ETL deployment and schema architecture and now you just support a dying oracle APEX application and do minor prod database changes. I haven't used git or python in like 5 years.,Rodeo9,2026-04-15 16:44:39,4,dataengineering,t3_1sm6u62,False,
ogcjnoz,This isn't far from my own situation. Go find business problems to solve if you're bored. Or play the piano! Or get into a new hobby. Honestly this is a jackpot situation as long as you stay sharp.,KazeTheSpeedDemon,2026-04-15 15:50:40,3,dataengineering,t3_1sm6u62,False,
ogcr9vl,"Even some DE's at FAANG say that some jobs become a maintenance and basic reporting stuff after a while since most of it is already built. Enjoy the salary, benefits, try to upgrade knowledge and skills on companies dime and get some certs if interested. Job market out there is pretty scary with AI ""skills"" listed in every job posting.",69odysseus,2026-04-15 16:24:37,3,dataengineering,t3_1sm6u62,False,
ogd8jyv,"Slowly getting in the same situation but definitely not a problem of you're not supervised too much. Plus there's always stuff to add and improve on the pipeline, unless you've already been doing that for months of course. Like others said its a great time to do hobbies or learn another discipline you want to move towards to. To many it's a great time.",mean_king17,2026-04-15 17:41:05,3,dataengineering,t3_1sm6u62,False,
ogd9lda,Congratulations! You built it and they came.This is a pretty common pattern for non-tech focused businesses.,remainderrejoinder,2026-04-15 17:45:38,3,dataengineering,t3_1sm6u62,False,
