id,body,author,created_utc,score,subreddit,parent_id,is_submitter,distinguished
o5u9yqa,"recruiter here. gonna be blunt: the market for new grads with no internships is brutal right now, but it's not impossible. here's what actually moves the needle from the hiring side.the assembler position at a medical device company is more valuable than you think. don't dismiss it. you're in a regulated industry doing technical work. that checks boxes for a lot of companies.skip the AWS cert for now. i know that's controversial, but certs alone don't get new grads hired. what gets you hired is being able to show you can build things. one solid project that solves a real problem beats three certifications.what i'd actually do in your position: build something small but real. not a todo app. something you can demo in 2 minutes that makes someone go ""oh that's useful."" deploy it, put it on GitHub, link it on your LinkedIn. hiring managers at startups and mid-size companies eat this stuff up.also, the networking thing you skipped in school? that's your biggest gap. not the missing internship. most jobs at this level get filled through referrals. start showing up to local meetups, contribute to open source, be active on tech communities. it feels awkward at first but it's how 70% of people actually get hired.the good news: once you get that first real dev role, nobody will ever ask about how long it took you to find it.",dailydotdev,2026-02-17 09:54:14,29,cscareerquestions,t3_1r6unpo,False,
o5tfo5u,"I had to take a shit paying job to get my foot in the door and build experience. Honestly the markets fucked, look for small business and see if you can automate or digitize some of their processes for a low price and flip that experience into something better. Prepared to have your hopes and dreams crushed too btw",Titoswap,2026-02-17 05:21:50,5,cscareerquestions,t3_1r6unpo,False,
o5u46o1,That’s the million dollar question,Positive_Budget3823,2026-02-17 08:58:36,3,cscareerquestions,t3_1r6unpo,False,
o5twfv8,1) Nepotism2) Be born into a high Indian caste3) 1000+ apps and flawless DSA/Behavioral performances through 5 or more rounds (many boots will be licked)4) Get Lucky,LilBitchBoyAjitPai,2026-02-17 07:44:57,23,cscareerquestions,t3_1r6unpo,False,
o5v6snl,"I couldn’t land a software job in 2020, 2021, 2022, 2023, 2024, or 2025 - and I’m sure I won’t find one in 2026 either.",CyberneticVoodoo,2026-02-17 13:55:33,2,cscareerquestions,t3_1r6unpo,False,
o5vftf8,looks like you optimized for the wrong thing in college,Pure-Assistant6548,2026-02-17 14:44:23,2,cscareerquestions,t3_1r6unpo,False,
o5vhsdt,You will not get a software job after having no relevant experience for over a year. Your degree and certs may mean very little to an HM who stacks you against recent grads or still in school students who have 2+ internships by now.Time to start in IT help desk.,Romano16,2026-02-17 14:54:28,2,cscareerquestions,t3_1r6unpo,False,
o6hesjs,"You think the people in the backlog are going to stay unemployed until the next boom period? Nobody knows when that is, so a lot of people will have to switch fields. If they are employed in a field other than CS for too long, and they have to go against a CS Grad with internships, they will lose every time. Either way, the entry level market will stay saturated forever imo.",papayon10,2026-02-20 20:09:06,203,cscareerquestions,t3_1ra5v4i,False,
o6hmuls,"people pivot away to other jobs, there is no ""backlog"" hypothetically, let's say the next boom is in 2035, what do you think will happen? you think someone who graduated in 2025 is still going to be in the competition pool? and that they're still competitive enough? or... company can simply pick the 2035 grads the world moves on and earth continues to spin regardless whether you can get a job or not, and every year there's a new batch of students",NewChameleon,2026-02-20 20:48:49,41,cscareerquestions,t3_1ra5v4i,False,
o6hg4dq,"In past instances (for entry level only) they’ll usually go fill the then current new grad pipeline first, after that it’s a bit of a free for all for whoever’s still in the market. Basically supply and demand + freshness at work. There’s also a bit of an age bias in tech for inexperienced candidates, so probably a LIFO scenario there as well.",walkslikeaduck08,2026-02-20 20:15:33,19,cscareerquestions,t3_1ra5v4i,False,
o6hgwc6,"Most CS graduates do not become software engineers. And of those who do become software engineers, not all of them make a long-term career out of it. They may do it for a few years before pivoting to a different role. There is no “backlog.”",kevinossia,2026-02-20 20:19:22,68,cscareerquestions,t3_1ra5v4i,False,
o6hm32c,"Economic conditions are cyclical which impact job markets, but the job markets themselves are not usually cyclical.> **Even if hiring increases, won’t there still be a large backlog of CS grads competing for jobs? How does an oversupply affect the market when demand picks up?**A good question. Even if we went full-on ZIRP mode again I just don't see how 3 years of CS grads will find work when *EVERY* year hundreds of thousands of new ones are pumped out of schools.",ForsookComparison,2026-02-20 20:45:05,10,cscareerquestions,t3_1ra5v4i,False,
o6j3azt,"Most people fail to realize that while it may be true that market goes up and down, the supply of cs graduates in the market is a steadily increasing line. That's why people claiming that it will all come back to normal are full of shit.",AndAuri,2026-02-21 01:37:23,9,cscareerquestions,t3_1ra5v4i,False,
o6i2riv,"Couple of things:1. A good number of people will leave the field - they'll take their CS undergrad and move on to a different career. 2. And also, yes - you will need about the same number of boom years to offset however many bust years you had. Probably not exactly the same number of years, but something close. 3. However, that is to get back to a world where all the juniors are landing jobs comfortably - in the meantime mid-career and senior devs are going to be worth stupid amounts of money because there will be proportionally way fewer senior people since so many juniors couldn't get their careers going right away.",dfphd,2026-02-20 22:08:16,9,cscareerquestions,t3_1ra5v4i,False,
o6hkudl,"Undergrad enrollments are trending down due to all the social media doom and gloom, and people today can't just sit around waiting for 5 years, so they eventually pivot out and underemploy. Lots of people got discouraged from entering the industry after the dotcom bust, and when the mobile/cloud revolutions kicked in many years later, not many people had the skillsets for them.",lhorie,2026-02-20 20:38:57,13,cscareerquestions,t3_1ra5v4i,False,
o6i53ip,"You are imagining all people work extremely hard and think about long terms.I keep telling people how important it is to grind LeetCode, read system design books, and work on open-source projects. Not many new grads have the patience to do all of that, and they still complain that they can’t find jobs... There is no oversupply, there are just too many people waiting for a booming job market to return while doing nothing in the meantime.",zero1004,2026-02-20 22:20:22,12,cscareerquestions,t3_1ra5v4i,False,
o6igm37,"I'd also argue the current times are fairly unprecedented. Yearly market trends aren't so applicable when the reason for these hard times are technology related. Even during the Covid layoffs, when's the last time a global pandemic has led to such a large wave of hire->fires? Whether or not you think this new use of AI will be sustainable is an armchair enthusiast's guess, but I certainly wouldn't call it cyclical.",LucyIsaTumor,2026-02-20 23:22:52,5,cscareerquestions,t3_1ra5v4i,False,
o6mqgmu,"The truth is in the middle which causes [a Golden Mean Fallacy](https://www.explainxkcd.com/wiki/index.php/690:_Semicontrolled_Demolition). Two things can be true simultaneously:- The current level of investment in AI is disproportionate to its utility, which could cause a crash- LLMs have actual utility that people will pay serious money for and will not disappear if there is a crash",minimaxir,2026-02-21 17:25:39,138,cscareerquestions,t3_1rawkys,False,
o6mop8m,"If you're looking for somewhere which isn't a huge echo chamber, you shouldn't be on Reddit. Yes, including this subreddit.",calvintiger,2026-02-21 17:16:42,230,cscareerquestions,t3_1rawkys,False,
o6mohdy,Part of that is genuine product. Part is massive bubble about to burst.,JustGulabjamun,2026-02-21 17:15:36,51,cscareerquestions,t3_1rawkys,False,
o6mpfpy,All I can say is it's going to be different from now. But don't know what that is.,zacce,2026-02-21 17:20:25,29,cscareerquestions,t3_1rawkys,False,
o6mpf7f,"imo, like another person commented, its a mix of both. There is some real value here, but not nearly as much as the hype says. Our field is changing, but wont be revolutionized. We will still be here. I dont think its a bubble, but it definitely is inflated. We'll likely see some sort of correction eventually, but it wont be devastating.",MaximusDM22,2026-02-21 17:20:21,24,cscareerquestions,t3_1rawkys,False,
o6mqjtq,"You've figured it out. It's somewhere in the middle. It will make some people more efficient and fail to deliver in other aspects. In other words it will be a tool that is useful in some areas and not in others. It will take judgement on your part to know when that tool should be used. Those that use it like it's the only tool in their toolbox won't do well. Look at Amazon, they just had a big outage due to AI. Of course they tried to blame the humans. But AI was the one that made the mistake. That is very telling.Unfortunately there isn't an unbiased news source on AI. As you read articles you'll have to think about what the author is benefiting from by their stance. E.g. article by C\*O of an AI company that AI will replace white collar workers in x time in the future (long enough for people to forget the said declaration at that time). Translation buy my AI tools and don't get left in your competitors dust. If you don't we'll go broke because our tools aren't profitable yet because they aren't good enough. If we get you to pay then we might be around long enough to make them profitable.",desert_jim,2026-02-21 17:26:05,9,cscareerquestions,t3_1rawkys,False,
o6n6arj,"It is absolutely a bubble.It also is NOT absolutely useless. Which is why the bubble is lasting for so long. People know it has value, but they don't yet know how much value.The improvements that companies keep making, makes it seem like the potential value is much, much higher than it actually is. Right now, everyone knows it is not as valuable as it is valued at, which is leading to the intense speculative bubble we're seeing. It is the belief in what it will do later that keeps the bubble so strong; if several PhD level papers come out showing we're not even close... that will probably kill the bubble.And of course, that probably won't happen for a while. The folks who would do such research are also largely funded by the people who need the bubble to continue.This is normal for an immature technology. What is NOT normal, is thinking the technology is going to replace everyone, without actually proving it can, and everyone hedging their bets on this happening anyways.Companies like Apple are probably going to be the big winners at the end of this. They're not firing their teams and replacing them with unproven AI. And at this point in time, it is looking more and more like AI usage just shifts the bottleneck further down the line rather than eliminates it (as far as automated programming goes).Since the changes it makes can be breaking and it has no accountability, a lot of devs are being forced into code review for thousands upon thousands of changes. It is likely to lead to unstable software, with limited ability to diagnose and maintain, even if companies increase headcount. You just cannot fit the context of the changes into your head fast enough to tell when the AI is doing something dumb.As such, the workflow we're accustomed to is not very accommodating to AI autonomous changes... until it can actually take over dev jobs, which is still a long time away.Site Reliability Engineers and Cybersecurity developers are going to feast.",Won-Ton-Wonton,2026-02-21 18:44:14,7,cscareerquestions,t3_1rawkys,False,
o6n15ws,"Calculator won’t make you a Newton, neither will chat gpt. Rules stays the same: you need to grind for years until you will be able to use those tools for something useful.",tetrash,2026-02-21 18:19:13,10,cscareerquestions,t3_1rawkys,False,
o6muj6c,"If they deliver what the hype promises, society is fucked, not just swd.If they don't, we are probably still fked because lack of realized value will bring this shaky economy to its knees.",HelicopterNo9453,2026-02-21 17:46:25,7,cscareerquestions,t3_1rawkys,False,
o6mqa9r,"To me llms are just a better search engine for their answer you're looking for. As for the promises made by Sam Altman, he's trying to sell a product and I think that part of it is a bubble",HundleyC09,2026-02-21 17:24:45,8,cscareerquestions,t3_1rawkys,False,
o6yev8u,I have recently transitioned from swe -> solutions engineer. Staying close to the customer looks like a much safer bet.,magicsign,2026-02-23 14:25:15,73,cscareerquestions,t3_1rcieuy,False,
o6yd16n,"Why would “traditional vocations” return in a post-acceleration technocapital worldI get it’s the hip thing to doom and gloom about the future of tech rn, but at least be realistic in your analysisArt is not going to overtake technological professions, no",xvillifyx,2026-02-23 14:15:11,77,cscareerquestions,t3_1rcieuy,False,
o6yczt0,FIRE is the only option for meThere is nothing I can do to get an actual paycheck other than SWEPessimistic timeline: 2 yearsOptimistic timeline: 5 years,Marcostbo,2026-02-23 14:14:58,69,cscareerquestions,t3_1rcieuy,False,
o6yfno6,"I think it'll be a lot longer than most others think before AI replaces us. The hard part of the job was never slinging code, that's always been easy. The hard part is gathering the business requirements and thinking through all of the implications of it. Even in an AI fueled world there's going to be a lot of that work left to do. If you aren't already trying to do that, then you're already on the short list anyway.I've got about 10 years left in the industry, and I've positioned myself well. I'll probably grind where I'm at for another 5 years, and then rest and vest for the last 5.In the meantime I've been picking up woodworking as a hobby. CNC has already taken its toll in that industry and I don't see AI being able to make much of an impact, so if I'm wrong and the shit really hits the fan, I'll be able to get by.I'm telling my kids to look for jobs that are difficult to automate and are not purely digital. Construction is a good area that I don't see AI being able to do much to. If I was starting over, I'd probably go electrician, grind it out for a decade, then try to start my own business.",Shaftway,2026-02-23 14:29:31,36,cscareerquestions,t3_1rcieuy,False,
o6yi68r,I think there's a lot of value in becoming a subject matter expert in addition to having an aptitude for software design and coding. The investor class thinks that enterprise SaaS companies will be surpassed by in-house AI generated tools but the reality is that many non-tech companies have laid off a lot of their IT staff years ago. And. the average operations staff doesn't have the skills or inclination to build these AI apps. This will create some opportunities.,jfcarr,2026-02-23 14:43:05,10,cscareerquestions,t3_1rcieuy,False,
o6yehzx,Need to do something outside the mainstream economic system that it not viable to automate with AI/robotics. Maybe gathering mushrooms in the forests of Oregon.,AdministrativeHost15,2026-02-23 14:23:15,19,cscareerquestions,t3_1rcieuy,False,
o6yo7vr,Might consider taking out a loan to do schooling for a healthcare role. This would be if my back is against the wall and I see everything in my field has dried up.,mathtech,2026-02-23 15:14:09,6,cscareerquestions,t3_1rcieuy,False,
o6yp43p,Getting a second bachelors in nursing. I’m nowhere near close enough for FIRE but I also have 10 yoe. I started nursing school when I saw what was happening in the field and am finishing up my last semester.,doingittodeath,2026-02-23 15:18:37,6,cscareerquestions,t3_1rcieuy,False,
o6yyluf,"I've been thinking a lot about this lately.I chose to major in CS as an 18 year old not because I had some deep love for software development but mainly:- I was told it was a mostly stable high paying career.- Didn't require many debt-financed years of advanced schooling.- I was pretty good at it.It's given me a pretty good ~20 year career but now I'm closing in on 40, married, hopefully a kid soon, and it seems like I've got three choices:1. Try to weather the storm, maybe AI turns out to be less apocalyptic than we all thought and everything ends up okay.2. Try to pivot into something sort of tech adjacent. Someone will need to test the AI slop apps of the future or review the code they generate or whatever sad new jobs come about in the AI era. No guarantee these jobs are great, or that I could get one, or that they'll even exist. 3. Start over. I've spent the last 20 years building tech products that have by any measure made the world a worse place. Maybe this time pick a 2 career that actually does some good. 25 years is still a long time so while it feels too late to make a change, maybe it's not.",ghostinthepost,2026-02-23 16:03:55,13,cscareerquestions,t3_1rcieuy,False,
o6yvrf0,!remindme 5 years,Fuehnix,2026-02-23 15:50:40,5,cscareerquestions,t3_1rcieuy,False,
o62gqjn,"Hehehe. Going by your comment and post history, you mostly don’t even stay in the US. Oh, btw, one can still search for your posts and comments on your profile. You can’t really hide anything. :slightly_smiling_face:",GrimReaper-01,2026-02-18 15:30:57,31,cscareerquestions,t3_1r7w4qg,False,
o60ptb4,Aren’t these for people who already work there? These numbers seems too low regardless,Dry_Criticism8691,2026-02-18 08:22:09,66,cscareerquestions,t3_1r7w4qg,False,
o60k6vj,They are already working for the company.,megor,2026-02-18 07:30:26,53,cscareerquestions,t3_1r7w4qg,False,
o60wq0p,Numbers surprisingly low tbh if this is accurate,MBAtoPM,2026-02-18 09:27:15,26,cscareerquestions,t3_1r7w4qg,False,
o62eiwy,"Those are miniscule numbers, I’m actually surprised it’s this low. Of course someone is already in this thread saying “they should go home”. The job will go with them, unfortunately, you’re not getting it.",ForeverYonge,2026-02-18 15:20:38,3,cscareerquestions,t3_1r7w4qg,False,
o60k24k,I mean those numbers aren’t very high….. the best engineers in the world are valued at 50x the avg American. I’m sure most of these people are deep into the 6 figures or 7 figure territory. They aren’t taking Blakes 90k a year gig,No-Test6484,2026-02-18 07:29:14,31,cscareerquestions,t3_1r7w4qg,False,
o62cjjd,"As others in the comments have said, this is for current employees You just sound like a bitter person who doesn’t understand labor regulations",xvillifyx,2026-02-18 15:11:19,9,cscareerquestions,t3_1r7w4qg,False,
o63bvz5,"Companies use shady external sites and job listings to justify hiring foreign visa workers instead of domestic workers. They inflate the qualifications in the job postings, list extremely niche skills, and then tell the government, “I can’t find any domestic talent, so give this person we have PERM.” Ironically, that person often does not even meet 30% of the qualifications listed in the original job posting.",RationalPoint,2026-02-18 17:51:56,2,cscareerquestions,t3_1r7w4qg,False,
o62vpdg,You can go here to search as well: https://h1bfacts.com/,Intrepid_Mode8116,2026-02-18 16:38:55,1,cscareerquestions,t3_1r7w4qg,False,
o6903ec,this data only shows the tip of the iceberg. these flc applications are for people already here wanting green cards but the real damage happens with the regular h1b lottery and contractor flooding. ive worked at 3 different companies where they would post impossible job requirements like 10+ years experience with a framework thats only been around for 3 years then claim no qualified american candidates applied. meanwhile theyre bringing in whole teams from indian consulting firms at half the cost. the whole ai layoffs narrative is perfect cover for this massive labor arbitrage scheme,mockerinterviews,2026-02-19 14:52:43,1,cscareerquestions,t3_1r7w4qg,False,
o6lu945,"I'm not sure it's necessarily because you're a student... it has more to do with you accepting a $65k/year job and expecting you were going to get some miraculous 53% raise. That just doesn't happen.This situation would've happened whether you started as a student or not. Happens to lots of people. If you accept a wage lower than your peers, you're going to be on that wage track for your entire tenure at that company, unless you play hardball and threaten to quit. This is true at the new grad level, and it's true at the Senior SWE level.If you value yourself at $100k+, you should be applying to jobs that offer you $100k+ out of the gate. Don't accept a job because of an assumption, or a promise, of an imagined future-wage.",CapableHerring,2026-02-21 14:40:08,225,cscareerquestions,t3_1rasanm,False,
o6lu9z0,"Companies will always try to minimize costs. That includes giving the smallest raise they can to existing employees. Institutionalizing this using a dual-track compensation structure is just an example of this.If you had been hired as a new graduate, you would have started on the other compensation track, but the raises would also be less then you expect. You'll need to switch jobs to get the compensation increase you want. Ultimately, you are in this situation because you are considered a steady performer with a low flight-risk. Don't change that to a disgruntled employee, change to a high achiever instead, and quietly start looking for new opportunities.",Aero077,2026-02-21 14:40:17,40,cscareerquestions,t3_1rasanm,False,
o6m64fs,I've never heard of a company that has a different track for FTEs depending on if they had an internship or not. If you think you are worth an extra $20k/year then go get another job. I guarantee they'll suddenly find money for a raise when you tell them you're leaving.,SamurottX,2026-02-21 15:43:49,18,cscareerquestions,t3_1rasanm,False,
o6m29jw,"I changed jobs when I graduated and then said “well I have 3 years experience, so I’m not the usual for entry-level” when negotiating salary at the first after-graduation job.",macoafi,2026-02-21 15:24:07,6,cscareerquestions,t3_1rasanm,False,
o6m5yzf,"Your entry salary is very important, but only when staying at that company. When you go somewhere else you can get a fair salary.",NatasEvoli,2026-02-21 15:43:03,6,cscareerquestions,t3_1rasanm,False,
o6m81ef,You got more experience as your peers. You need to change jobs every 2-3 years unfortunately until you get to more experienced levels.,k3liutZu,2026-02-21 15:53:24,6,cscareerquestions,t3_1rasanm,False,
o6m6oqc,It doesn't if you switch companies as you have more experience than everyone else,dbxp,2026-02-21 15:46:40,5,cscareerquestions,t3_1rasanm,False,
o6mupzy,"The conclusion you jumped to is pretty broad and probably wrong. What’s most important is the compensation of the first job you take after college. You didn’t have to take 65k, but when you did that’s what put you in the situation you’re in. Not the fact that you worked during college",ThatLj,2026-02-21 17:47:23,4,cscareerquestions,t3_1rasanm,False,
o6n07jr,"I started as a student making minimum wage as a programmer and make 300k/year now :man_shrugging: I just told myself after college “fuck this, I want to make more.” And applied to jobs lol (this was after the market started going down).I think it’s more about your personality and it you’re  comfortable not making much.",kennpacchii,2026-02-21 18:14:33,3,cscareerquestions,t3_1rasanm,False,
o6nn7wz,"this is a well-known trap with internal comp tracks. the math is harsh but simple: companies set salary bands by track, and internal promotions usually just edge you up within the same band, not bridge across tracks.the practical fix is an external offer. once you have an offer at market rate, you either get matched internally or you leave. it sucks but the leverage always comes from outside -- never from performance reviews or tenure. the people on the standard SE track are not there because they are better, they just came in through a different door.you should be job hunting right now.",AttitudeGlass64,2026-02-21 20:10:15,3,cscareerquestions,t3_1rasanm,False,
o6cfnow,"Work hours is only one concern. Assuming you mean earlier stages startups, you're not going to see equity liquidity any time soon (we're talking like in the next 8+ years, or often never at all). Late stage startups are not really that different from public big techs, but again with the caveat that liquidity events may not be available quite as readily, or at all.I see a bunch of people boomerang back to big techs from startups. If you're in for the money and you're able to land big tech roles, being an startup employee is generally not the way to go.",lhorie,2026-02-20 01:20:25,56,cscareerquestions,t3_1r9h3ju,False,
o6ccyqr,"depends on the startup stage. early-stage = higher risk but you actually build stuff. late-stage startup = basically big tech with worse benefits. the ""mission"" thing is marketing half the time.",jesusonoro,2026-02-20 01:03:49,28,cscareerquestions,t3_1r9h3ju,False,
