id,title,author,subreddit,content,score,upvote_ratio,num_comments,url,created_utc,extracted_at
1py533m,Does anyone else struggle to hold complex code in their head while coding? How do you deal with it?,SuccessOk4378,learnprogramming,"Hey everyone, I'm curious about something that's been bugging me.When I'm coding, especially with complex logic (nested loops, recursion, async code, state mutations), I find myself losing track of what's happening mentally. I either have to:* Keep writing things down* Constantly scroll back to see what I did* Re-read the same code 5 times to understand the flow* Debug slower because I can't mentally trace executionIt feels like a short-term memory problem—like my brain can't hold all the pieces at once while I'm actually coding.**Questions for you:**1. Do you experience this? Or is it just me?2. If you do, how do you handle it? (Tools, techniques, habits?)3. Do you think there's a tool that could help developers get better at mentally tracing/understanding code without constantly looking back?Just curious what the community does. Any tips appreciated.",10,0.82,15,https://www.reddit.com/r/learnprogramming/comments/1py533m/does_anyone_else_struggle_to_hold_complex_code_in/,2025-12-28 22:52:00,2025-12-31 01:49:04
1pwr7jq,Most of the Youtube channels are flooded with AI model review!,aks3289,learnprogramming,"I have learned a lot about programming from YouTube channels, and they have really helped accelerate my learning to the next level. I still watch them, but I don’t think I will continue subscribing to them for long.Almost every YouTube channel has turned into an AI model review channel. Whenever a new model is released, they rush to upload yet another shallow video either praising it or criticizing it and compare it with other models. This trend is spreading like a virus.I honestly don’t understand what they are doing or WHY. I wonder what AI has done to senior engineers(as they talk about themselves). I don’t like how the community is being ruined. It has become increasingly difficult to discover new, genuine channels as the algorithm aggressively pushes these repetitive videos.I am going to unsubscribe lots of youtube channel next year!",6,0.67,7,https://www.reddit.com/r/learnprogramming/comments/1pwr7jq/most_of_the_youtube_channels_are_flooded_with_ai/,2025-12-27 06:47:03,2025-12-31 01:49:04
1pwndmz,Should I learn Ruby On Rails or JavaScript? My end goal is to build a startup.,etiisgod,learnprogramming,"I’m doing The Odin Project and I’ve just finished the foundations course. They offer 2 pathways, Full stack JavaScript and Full Stack Ruby on Rails but I don’t know which one to pick. Ive read a bit about both languages, at least that with RoR you can build and ship faster but its mainly backend, but with js you can use it both for backend and front end.What do you guys think I should learn?PS: I made a previous post about learning to code for sake of a startup, and a lot of people said that it was backwards thinking/ i shouldnt learn to code just to build a startup or I should find a developer and stuff like that. But I want to be in a position where I‘ll know how to code at least a MVP just by myself so I can move as fast as possible without having to break the bank because not knowing how to code is holding me back. I’m sorry if I say something that’s wrong or completely stupid because I’m pretty new to this and I don’t know much about programming besides the basics.",7,0.71,20,https://www.reddit.com/r/learnprogramming/comments/1pwndmz/should_i_learn_ruby_on_rails_or_javascript_my_end/,2025-12-27 03:23:19,2025-12-31 01:49:04
1pvujnw,How do you decide when code is ‘good enough’ to ship?,Informal-Cod-7723,learnprogramming,"I’ve noticed that code can almost always be improved, but at some point it has to ship. How do you personally decide when it’s “good enough” versus worth more time refining?",8,1.0,13,https://www.reddit.com/r/learnprogramming/comments/1pvujnw/how_do_you_decide_when_code_is_good_enough_to_ship/,2025-12-26 03:37:57,2025-12-31 01:49:04
1pvklab,Does uni feel like memorizing algorithms rather than deep learning to anyone else,Sea-Village-3610,learnprogramming,"Hello everyone, Im second year cs student. This is my second university experience, I dropped my last one. So I have some perspective and experience about universities. I originally self tought for one year, it was okay but I was curious about more and enrolled for this and a diploma. It is free, due to my country.So, my problem. My main issue is how we learn stuff and the testing model. In classes like Calculus, electronics, or physics, you can add more, it feels like we just memorize algorithms to solve questions. I can learn the 'why' from external sources, for example books or Prof.Leonard for calculus but at uni, if you solve 100 past years questions or questions from books, you still can get a good grade, without truly knowing the material. This means that you cannot solve a different kind of problem that involves the integral that you learned 1 week ago and passed the exam, because you didn't understand what you doing, just memorize algorithm.I have many friends, even when they got a good grade, they still lack an understanding. I don't want to be same but what's point? Am I right to feel this way or I'm being ignorant? Sorry for long post and bad english.**TL;DR:** University exams feel like testing memorized solution patterns rather than deep conceptual understanding. Is this a valid concern or just how academia works?",8,0.63,16,https://www.reddit.com/r/learnprogramming/comments/1pvklab/does_uni_feel_like_memorizing_algorithms_rather/,2025-12-25 19:18:25,2025-12-31 01:49:04
1pucur0,What can I code on?,Ok_Preference402,learnprogramming,"I currently do not have access to my PC and I've been extremely bored, all I have is this extremely old laptop with 4 gigs of ram, lenova yoga 500. I've tried vs code and that almost worked but then my laptop couldn't handle that.what do I use??",9,0.68,43,https://www.reddit.com/r/learnprogramming/comments/1pucur0/what_can_i_code_on/,2025-12-24 03:05:10,2025-12-31 01:49:04
1pyltoh,I need help,Roboking365,learnprogramming,"For context I'm a first year comp sci student at BarcelonaTech. I'm mostly acing everything (physics, math, hardware...) but when It comes to programming shit is tough. We are learning C++ from scratch (for, while, recursivity, vectors, arrays, algorithms...). First midterm was a shit show I got a 1.7/10 like most of my class (only about 10% passed). Now my finals are coming up and I a little more than two weeks to prepare for programming and I'm scared shitless. While preparing programs that should take me 30 minutes become into brainstorming debugging hour long sessions. I feel like the dammed subject is designed to be passed only if you have prior experience Essentially what I come to ask are tips to convert my thought into the code and to make my life easier to debug code (they haven't taught us about debugging sessions (we use VS code).Edit: any other tips regarding mindset and mindfulness are welcome, anything that helped you and can help me is welcome.",8,0.76,11,https://www.reddit.com/r/learnprogramming/comments/1pyltoh/i_need_help/,2025-12-29 13:06:23,2025-12-31 01:49:04
1pxoqrs,"Debugging Checklist quote from book ""The Pragmatic Programmer""",wuweei,learnprogramming,">Debugging Checklist>Is the problem being reported a direct result of the underlying bug, or merely a symptom?This quote seems simple and not simple for me for some reason. Is it put subtly or I think too much?If the problem being reported on is merely a symptom of underlying bug isn't it at the same time direct result of the underlying bug? Because If you fix the underlying bug you directly fix the problem being reported. Or does it just mean that sometimes you just look at the symptom and you don't go deeper to see underlying bug? PS: Sorry if this too dumb question lol",9,0.84,6,https://www.reddit.com/r/learnprogramming/comments/1pxoqrs/debugging_checklist_quote_from_book_the_pragmatic/,2025-12-28 11:00:11,2025-12-31 01:49:04
1pvulot,What does a ‘normal’ productive day look like for you?,CaffeinatedPotato007,learnprogramming,"Some days feel busy but not productive, and others are quieter but more effective. What does a “normal” productive day usually look like for you?",6,0.72,8,https://www.reddit.com/r/learnprogramming/comments/1pvulot/what_does_a_normal_productive_day_look_like_for/,2025-12-26 03:40:58,2025-12-31 01:49:04
1pvs5g2,learning website JavaScript (dom manipulation etc),Old9999,learnprogramming,"so, i was wondering when will watching a youtube tutorial be beneficial or not. i am a self learning developer (no college) and i have 0 experience with various stuff so i have to completely learn it from scratch. is it okay to watch a tutorial for this kind of thing? just learning how to use it. not watching a specific guide(eg. make this button behave like this when x) also is my approach to these tutorials right?: watching, seeing i can do x, making a little something interesting out of it(loop back). Also, when should i know when to watch a said video or open a doc and try to do x having that doc? Thanks!",7,0.82,12,https://www.reddit.com/r/learnprogramming/comments/1pvs5g2/learning_website_javascript_dom_manipulation_etc/,2025-12-26 01:32:14,2025-12-31 01:49:04
1pyf1l0,How to Continue Learning C After CS50x?,softsyntax__,learnprogramming,"Hey everyone! I’m a beginner to programming and I’m currently taking CS50x. I’m on week 6, and the C programming part of the course has ended. While CS50x teaches the basics of C, I want to learn more in depth.What are the best ways to continue learning C? Are there any good courses or YouTube channels you would recommend? I’m also planning to do my final project in C.",5,0.7,3,https://www.reddit.com/r/learnprogramming/comments/1pyf1l0/how_to_continue_learning_c_after_cs50x/,2025-12-29 06:35:41,2025-12-31 01:49:04
1pxo3li,Just want to share this.,situ139,learnprogramming,"I never really thought of myself as a programmer, mainly because I was horrible at math.But I'm 31 now, and it's like I've tried a lot of things in my life. I've tried pro sports, making music, running a photography business, content creation, landscaping, serving, along with a ton of other things to which I've had varying success in.But nothing really seems to give satisfaction like programming, now I'm new to programming, I only really have been ""doing"" it since like the last few months.Two main things I've coded.\- A league of legends cool down app (it basically tracks when an enemy uses key spells in the game, the tracking is manual you have to tap the button to start it)\- A program that trains a specific skill in League of Legends called kiting, which is basically clicking your mouse fast in a specific sequence.I think the fun part of programming is you can just make things, it's like Lego but you have no limits and growing up I always loved Lego.Another aspect I like is while I am very good at content creation, I've had close to 500 million views on social media from content I've made. Content creation doesn't really scratch the same itch.It's like with content creation you make things that people watch but how impactful is that? Half of the stuff we watch we don't even remember ....but with coding you make things that people USE.And that's what I think is so cool.Part of me worries that because I'm bad at math I'll never really ""get"" programming, I also worry I'm not smart enough for it...but I enjoy it.Anyway I don't know if this post is something that people will love, or not, but I just wanted to share it. It's late here, 4am and I've been really struggling last few days with figuring out what I enjoy.I've been trying to be a ""content creator"" for the last few weeks, and while I'm really good at it, I don't think I enjoy it. It feels really fake and tbh, a large portion of content out there is entirely fake anyway.I still don't really understand where I fit in with life, but I like the idea of making stuff people use and I see myself for the next while making programs or apps that solve simple problems in peoples lives. (or my own life)",5,0.65,10,https://www.reddit.com/r/learnprogramming/comments/1pxo3li/just_want_to_share_this/,2025-12-28 10:19:47,2025-12-31 01:49:04
1pxebnk,"Should I learn then build, or learn while I build?",Ok_Swordfish1021,learnprogramming,"Would you say it is better to learn with a course then make a project after every big topic? Or is it more efficient to learn the topic very broadly then go in depth (syntax, libraries) while building a project?",4,0.61,22,https://www.reddit.com/r/learnprogramming/comments/1pxebnk/should_i_learn_then_build_or_learn_while_i_build/,2025-12-28 01:22:00,2025-12-31 01:49:04
1px91uf,Feeling Behind in Year 2 college,MaverickBelmont,learnprogramming,"Hello everyone,I’m a second year IT student, and I’m reaching out because I’m at a crossroads. I’m looking for some serious advice on how to push myself forward when I feel like I’m stuck at a standstill. To give you some context: I’ve never considered myself a natural at tech. I didn’t do any advanced prep before starting my degree, and honestly, I struggled through my first year. I managed to pass, but looking back, I realize I was just surviving, not actually learning.This year, due to personal circumstances, I had to switch to online classes. It’s been a disaster for my learning style. My professor primarily uploads modules and assessments without live sessions, leaving me to teach myself through YouTube and documentation. Here is the predicament: In trying to teach myself, I realized I’ve forgotten a lot from my first year. Even the most basic concepts have slipped away. I’ve decided to ""start from scratch"" while still trying to keep up with my current 2nd year workload. I’m currently grinding through Java learning strings, characters, loops, and operators while simultaneously staring down a mountain of Networking and SQL coursework including C++ and other programming languages that we’ve studied in my first year that I have to run through again, I feel completely overwhelmed. My progress feels incredibly slow. I see others online who seem to grasp these concepts effortlessly, and I can’t help but feel a deep sense of envy and doubt. I’m questioning if I’m even making progress or if I’m just not cut out for this. I’m not planning on changing my course I genuinely want to be good at this but the anxiety that I’ll never ""get it"" is starting to take over. I know going back to face-to-face classes eventually will help, but I also know that won't fix the fact that I'm currently starting from zero.Has anyone else felt like they were ""starting over"" in the middle of their degree? How do you deal with the slow progress and the feeling that you'll never catch up?I’d really appreciate any advice on how to manage this workload or how to change my mindset so I can stop feeling like a failure.",5,0.7,10,https://www.reddit.com/r/learnprogramming/comments/1px91uf/feeling_behind_in_year_2_college/,2025-12-27 21:25:30,2025-12-31 01:49:04
1pwygui,Looking for advice to improve and think like a programmer,mister_haruharu,learnprogramming,"Hello everyone,I 34M, would like to get some advice on how to improve.Currently work as a pipeline programer in 3D animation using python. So far, never use any database such as postgresql or mysql. Only use file based such as json. After 7 years, I don't really improve. I still afraid to do something, I am afraid that I can delete files in the server. In conclusion there is a little confident despite having 7 years of experience.Of course, I watch some programming YouTube channel to broaden my knowledge and tried to apply that in real production.But it just every time I accomplish something, another problem arises and it makes me feel down again.What should I do to improve and to gain confident?I would like to make a good API instead of shitty API which unusable, I also like to make my code scalable.I am reading a pragmatic programmer book, still not finished yet.Open to any advice, I have done what I could but still missing something.Thank you very much in advance",7,0.71,9,https://www.reddit.com/r/learnprogramming/comments/1pwygui/looking_for_advice_to_improve_and_think_like_a/,2025-12-27 13:59:34,2025-12-31 01:49:04
1pzekr7,What languages should I spend time on learning if I wish to make my ideas come to life?,theconfusedarab,learnprogramming,"I have a little knowledge of HTML/CSS/JS and I wish to capitalize on it to make two websites that are related to a personal project that I have. I am also learning python for work related projects. That being said, I have also two projects that I wish to start working on in the near feature, a desktop app, and a light indie game. I have been trying to do some research but everywhere now I feel that I am falling in generic answers rabbit hole so I need to ask experienced individuals. I know that I have a long way ahead of me but I want to start anyway. For the next few months, maybe the first quarter of 2026, I will be working on the Frontend and the python for my personal project and work. But I wish to have a foundation I can build on later when I have the chance to work on my desktop app and my game. What additional languages do I need to learn in the future? I have seen suggestions regarding the app that I can use the HTML/CSS/JS + Electron + python but I have no clue if this is a good idea or not. Any comments would be greatly appreciated. Edit: I realized that I didn't add enough information for the app idea I have. I am adding the details I have now to help be more clear: It is an app for writing, but it is tailored first to Arab Writers, and I intend to add features to it along the way. I am not comfortable with the idea that I need different apps or resources to work on one novel or story. So, I want to make my own, an app that I can write in, export docs, it also can spellcheck, provide ambience (background and music), do grammatical checks suggestions, have some widgets inside the app that helps the writer move forward in the form of questions and answers that help with roadblocks in plot, characters, story, idea...etc.I hope this is a bit more helpful.",4,0.71,12,https://www.reddit.com/r/learnprogramming/comments/1pzekr7/what_languages_should_i_spend_time_on_learning_if/,2025-12-30 10:17:46,2025-12-31 01:49:04
1pz42or,Qwustion about the book called: 'code : The Hidden Language of Computer hardware and Software',taylor-white1,learnprogramming,"It has both 1st and 2nd edition. And I read the preview of both books.For me, it seems the 1st version is slightly more friendly to a very beginner-level person, because the 1st version started with a simple explanation about Morse code(which was easy to understand), while the 2nd version does so with some seemingly complicated electricity stuff(I didnt read that much specifically)And becuase I'm highschooler who have no knowledge about computer science and planned to do a major in it in future, I'd like to start with 1st edition. But at the same time, I have doubts about the 1st version because it was published a long time ago(1999). So I'm not sure which edition should I buy.because I also think that I might not notice that there's no difficulty difference between 1st and 2nd version. (If true, it's reasonable to buy a recent one.)please help me.",3,0.62,8,https://www.reddit.com/r/learnprogramming/comments/1pz42or/qwustion_about_the_book_called_code_the_hidden/,2025-12-30 01:07:45,2025-12-31 01:49:04
1pypujs,Spent ~1 year on The Odin Project (frontend-heavy) but I hate frontend — should I switch to backend?,BraveAttitude4633,learnprogramming,"Hey everyone,I’m looking for advice and perspective from people who’ve been through something similar.I’ve been studying programming for about a year now using The Odin Project. So far, most of what I’ve learned has been frontend-related (HTML, CSS, JavaScript, some React concepts). The problem is… I’ve slowly realized that I really don’t enjoy frontend work.I don’t like dealing with UI, layout, styling, or making things “look nice.” I find it frustrating and draining. What I do enjoy is logic, problem-solving, data handling, and figuring out how things work behind the scenes. Deep down, I feel more drawn to backend development.Now I’m stuck mentally because: I’ve already invested around a year in TOP I don’t want to feel like I “wasted” that time I’m thinking of shifting toward backend-focused learning (maybe Python, APIs, databases, etc.)So my questions are:Is this a normal realization?Is my frontend knowledge from TOP still useful if I move to backend?Would switching to backend now be a mistake, or is it better than forcing myself to continue frontend?If you were in my position, what would you do?I’d really appreciate honest advice, especially from people who disliked frontend but found their place elsewhere.Thanks!TL;DR: 1 year into TOP, realized I hate frontend and prefer backend logic. Thinking of switching to backend (maybe Python) but worried I’ll waste what I’ve already learned. Looking for advice.",4,0.63,13,https://www.reddit.com/r/learnprogramming/comments/1pypujs/spent_1_year_on_the_odin_project_frontendheavy/,2025-12-29 15:56:10,2025-12-31 01:49:04
1pxpda7,Java Resources -> Competitve Programming,Character_System_928,learnprogramming,"Please any tell me that other than solving question on codeforces or solving some CP-31 like sheets what needed to study for competitive programming, like other than Linked list ,stacks and queues what needed to be studied for maths used in competitive programming , if anyone of you know about java resources for the same please share them here.",4,0.71,2,https://www.reddit.com/r/learnprogramming/comments/1pxpda7/java_resources_competitve_programming/,2025-12-28 11:38:16,2025-12-31 01:49:04
1px68uq,firefighter paramedic to software engineer,FerdaFlow,learnprogramming,"Hi there, if this is not the correct sub for this inquiry I apologize. My name is krystal and I am currently a firefighter paramedic in colorado. I am looking to switch careers and I am very interested in software engineering. I have very little experience in the programming world. The little bit I've learned about HTML and CSS I have thoroughly enjoyed and I do believe this will be a good change.I have enrolled in the **MIT xPRO Professional Certificate in Coding: Full Stack Development with MERN** that is set to start on 2/18/26. Does anyone have any experience with this program as a beginner and the career services they offer? If you've been successful in this program do you have any tips? What did finding a job after the program look like for you?I am open to other options/advice on how to go about starting in this field. I do work full-time and will need a bootcamp that allows more of a self-paced environment which was appealing about the aforementioned bootcamp. Does anyone have any advice for a beginner starting a bootcamp? What would you recommend I do before starting?",4,0.67,12,https://www.reddit.com/r/learnprogramming/comments/1px68uq/firefighter_paramedic_to_software_engineer/,2025-12-27 19:26:20,2025-12-31 01:49:04
1pww5w0,What makes someone truly senior-level?,SecureSection9242,learnprogramming,"Let me start off by saying I know it means different things depending on company's standards. But I'm asking the question because I keep getting a bit lost here and there. I used to think being senior means you can build technically advanced software, have more experience with programming languages, know how to work with many kinds of tech tools.This is why I fell into a trap where I built a comment section with Redux. I used every ""advanced pattern"" I could think of to make the problem seem more ""significant"". I thought I'd be able to show competence and skill. I was stuck in a narrative where I tell myself others know way more than I do. How am I supposed to get just as good? I realized it's all about problem solving and using the right tool for the job, but I still don't understand what being senior is about.Is it all just about being able to solve problems well and articulate the solution? That's my focus but I'd appreciate some guidance.",3,0.57,21,https://www.reddit.com/r/learnprogramming/comments/1pww5w0/what_makes_someone_truly_seniorlevel/,2025-12-27 11:57:46,2025-12-31 01:49:04
1pvltq6,Help with Beginner Setup,Mister_Sea_8958,learnprogramming,"Looking for advice as a beginner / hobbyist. I hope this is the right place but let me know if another sub would be better.There's a lot of resources for learning to code, but the biggest hurdle has been figuring out the set-up (venvs, packages, home-brew, terminal emulators, terminal fonts, etc.). I'm finally getting a workflow (below), just working with little datasets and APIs using Python right now, but hoping to skill up into making apps this year using Swift and Xcode.As I start making more complicated projects over time, is there a better way to set up dev environments so I can work seamlessly between computers?\- I have a Mac laptop and a studio desktop. I use iCloud for my desktop and all my files / folders. \- I use a venv for my projects. Right now, I think it's technically in iCloud because I have it as a folder on my desktop.\- I have wezterm installed on each computer and separately configured. \- I mostly work out of Jupyter lab by activating the venv from wezterm and then launching Jupyterlab from the venv.",3,0.63,3,https://www.reddit.com/r/learnprogramming/comments/1pvltq6/help_with_beginner_setup/,2025-12-25 20:16:13,2025-12-31 01:49:04
