id,title,author,subreddit,content,score,upvote_ratio,num_comments,url,created_utc,extracted_at
1trnima,Semantic layer,cyamnihc,dataengineering,"What exactly is it ? Annotated table and field names and definition of every field in a text doc? Seems like execs are convinced AI enablement’s first step is the semantic layer. Documenting field and metric definitions which also evolve will take a long time, how is this being done at scale ?Thoughts from folks who have been successful in this exercise?",181,0.97,114,https://www.reddit.com/r/dataengineering/comments/1trnima/semantic_layer/,2026-05-30 02:42:22,2026-06-02 04:05:25
1to92g6,Future of data engineering,Alternative-Guava392,dataengineering,What will be the future of data engineering in your opinion ? Some say that programmers of all types will be redundant after 2028 when AI advances and learns all those skills. What will happen in your opinion to data engineering as a field ? I'm of the impression that smart people will always land on their feet in every scenario.,166,0.88,125,https://www.reddit.com/r/dataengineering/comments/1to92g6/future_of_data_engineering/,2026-05-26 14:43:34,2026-06-02 04:05:25
1tqe63e,Well played Dagster,blu_lazr,dataengineering,No content,120,0.82,20,https://i.redd.it/21q3e6wdmx3h1.png,2026-05-28 19:44:55,2026-06-02 04:05:25
1trqjah,How to become more articulate as a DE,dataenfuego,dataengineering,"senior data engineer here, 15+ years, big tech.I have a problem that is limiting my career. when i write things down (slack, docs, emails, design proposals) people seem to get it pretty quickly.when I speak, especially in meetings, I feel like I lose people. I understand the concepts, but when i’m explaining something I can literally see people’s faces and they don’t seem to follow. then later i’ll write the exact same thing and suddenly it’s clear.anyone else deal with this? how did you become more articulate and better at explaining technical concepts in real time? Any books? Podcasts? Also English is my second language and while I have an accent, I speak it very well.",112,0.96,38,https://www.reddit.com/r/dataengineering/comments/1trqjah/how_to_become_more_articulate_as_a_de/,2026-05-30 05:11:16,2026-06-02 04:05:25
1tqyp72,Interesting Links in Data Engineering (May 2026),rmoff,dataengineering,"It May be time … for the May edition of Interesting Links :)There's more Kafka than usual this month for some reason, plus a HN hit, a new Iceberg release, data modelling advice (and just a bit of shitposting too).[https://rmoff.net/2026/05/28/interesting-links-may-2026/](https://rmoff.net/2026/05/28/interesting-links-may-2026/)",108,0.96,8,https://www.reddit.com/r/dataengineering/comments/1tqyp72/interesting_links_in_data_engineering_may_2026/,2026-05-29 11:18:40,2026-06-02 04:05:25
1to9ww5,How to improve as a new Data Engineer in the AI era?,BlackHisagi,dataengineering,"I'm a data analyst (5 YOE) that has recently graduated (!) and will be moving into my firm's Data Engineering team as an associate engineer within a few weeks.I'm looking forward to the opportunity, but my firm is \*\*\*very\*\*\* upfront about the fact that I & all other devs and engineers will be expected to make extensive use of the AI tools we have/will have available. My concern of course is that being expected to extensively utilize AI in my \*very first Data Engineering role\* will ""stunt my growth"" as an engineer, so to speak.What would you guys recommend I do to develop my skills and avoid becoming \*reliant\* on LLMs as I head into my new position? Any books/Udemy courses/etc that I should look into? Project recommendations for a new DE? Suggestions for how to utilize AI as a beginner \*without\* growing to rely on it? Any and all advice is welcome!",89,0.97,18,https://www.reddit.com/r/dataengineering/comments/1to9ww5/how_to_improve_as_a_new_data_engineer_in_the_ai/,2026-05-26 15:13:20,2026-06-02 04:05:25
1ttfhj7,"Facts and dims, or just heading straight to making metrics?",ketopraktanjungduren,dataengineering,"I need to clarify whether or not making facts and dims are the gold standard to achieve when doing data modeling. DBT tutorial shows two types of modeling. The first one is the star/snowflake schema modeling, which many people seem to follow it. The second one is to make whatever metrics you need.",79,0.98,49,https://www.reddit.com/r/dataengineering/comments/1ttfhj7/facts_and_dims_or_just_heading_straight_to_making/,2026-06-01 02:55:02,2026-06-02 04:05:25
1tq0wa5,Nikola Ilic - Data Modeling for Analytics Engineers: The Complete Primer,rmoff,dataengineering,No content,68,0.98,4,https://towardsdatascience.com/data-modeling-for-analytics-engineers-the-complete-primer/,2026-05-28 11:32:41,2026-06-02 04:05:25
1trsk0y,Dagster - Power BI Orchestration Side-Project Demo,nahyoubuggin,dataengineering,"https://reddit.com/link/1trsk0y/video/5vz1nuaq284h1/playerHello, all,I managed to create a modern BI architecture project, using Dagster and some help from Claude. Very proud of this project, as it is my first BI Engineering project.Technologies used:* Orchestration - Dagster* Datawarehouse - Snowflake* Object Store - Google Cloud Storage* Transformation - DBT* Extract, Load - AirByte* Business Intelligence - Power BII might do a full write up on the whole project as there is a lot to discuss!Regards.",65,0.95,9,https://www.reddit.com/r/dataengineering/comments/1trsk0y/dagster_power_bi_orchestration_sideproject_demo/,2026-05-30 06:58:15,2026-06-02 04:05:25
1traxtx,Is there a standard for modern data architecture?,Trick-Interaction396,dataengineering,"Edit: Since I communicated poorly. My analytics platform pulls data into a data lake staging environment via Spark batch processing files. Our typical compressed file size is 200MB. I prefer the pull method because all I need is creds and I can do everything I need quickly. The push method usually requires months of meetings and ""we're too busy right now"" conversations. There is a new source I need and the team who owns it says it's only available via a Kafka topic and the data will be serialized. I've never done streaming or non-parquet serialization so I'm not sure how to do that in a data lake. Their solution seems (to me) unnecessarily complicated. It's 1B rows daily so I am worried I will have millions of KB sized files deserialized into JSON (annoying). I am wondering if their solution is niche or if it's the new way of doing things. I have 20 YOE so I want to know if I am a dinosaur.My team uses an orchestrator to manage batch ETL jobs. A team I am working with uses Kafka for event driven architecture. In order to get data from them our system has to be added to their topics and we have to deserialize their data. Is this the new paradigm?",64,0.93,38,https://www.reddit.com/r/dataengineering/comments/1traxtx/is_there_a_standard_for_modern_data_architecture/,2026-05-29 18:25:58,2026-06-02 04:05:25
1tp2ydw,dbt sanity check,Brief-Knowledge-629,dataengineering,"I joined a new company in February and for the first time in my life, I am using dbt in production. I have \~5 YoE as a data engineer but I am a Udemy all-star when it comes to dbt. Everywhere I have ever worked, dbt has been some aspirational goal we want to implement some day but we end up being too dysfunctional to make it work. I can set up a dbt project skeleton, profile, sources, etc in my sleep because I have PoC'ed dbt so many times.However, our dbt architecture seems needlessly complex, but maybe not?We have 8 layers, I think, honestly not even sure what counts as a layer. On paper, we have the standard raw >> staging >> marts set-up but each layer has multiple sub-layers to it. Between raw and clean, we have a snapshot layer, but before we do a snapshot, there is an ephemeral layer to do some light transforms. Within our marts layer, there is another ephemeral layer. There is also a bridge layer within marts and an intermediate layer between staging and marts.So from start to end, a table passes through up to 8 steps. Every step has either a .sql file a .yml file, or in most cases, both. So from raw to mart, there ends up being about 12 files.Normal? Too complex? Are ephemeral, snapshot, intermediate, bridge ""layers"" or aren't they?",59,0.95,39,https://www.reddit.com/r/dataengineering/comments/1tp2ydw/dbt_sanity_check/,2026-05-27 11:39:06,2026-06-02 04:05:25
1todgks,Feeling Way Out of Depth Trying to Become Senior,shittyfuckdick,dataengineering,I’m a mid level DE with 9 years experience. I work heavily with python and sql and modern tooling like airflow and dbt. like 6 months ago I was grinding hard to get Senior DE role but was getting rejected left and right. I think the market was just bad as well. I had a company that turned me down reach back out and offer me a mid level role with the path to become Senior. I accepted cause I was desperate and the pay was good. Im 2 months into this role and im way out of depth. The company focuses a lot more on documentation and planning than technical skills. I’m stuck on these ambiguous problems that I have no idea how to solve and overall just confuse me. When I tell my boss this he just tells me to write more documentation to think it through. I’m honestly so sick of writing docs. I’m a technical guy I just want to code. The company keeps dangling the senior promotion in front of me though so I’m trying to do what they ask. im starting to think I’m just not senior level. I don’t really care about this stuff I just want to build data pipelines. Is there maybe another career out there for me? I just feel inadequate all my peers have leap frogged me and are senior or above. I feel embarrassed to be in my 30s stuck at mid level.,58,0.98,26,https://www.reddit.com/r/dataengineering/comments/1todgks/feeling_way_out_of_depth_trying_to_become_senior/,2026-05-26 17:14:28,2026-06-02 04:05:25
1tsuils,A Double Shot of DuckDB: Vector Similarity Search and Quack,pdoherty926,dataengineering,No content,57,0.93,1,https://peterdohertys.website/blog-posts/double-shot-of-duck.html,2026-05-31 12:50:58,2026-06-02 04:05:25
1tsatro,Is it fact or a dim?,PhilosopherRemote177,dataengineering,"Hey there, at my company we work by these best practice, every table must start with a dim or a fct prefix. for example: dim\_material, fct\_sales.but lately i am not sure how to categorize certain tables, and thought you guys might help me decide.two use cases that comes to my mind are: 1. a hierarchy table is it a dim or a fact? (many to many, meaning one material can have many parents, so it’s not a simple attribute and must be stored on a different table)2. if i have connection table between two dims, (for example table that shows material, and a store that sells it).i’m sure i’ll have more use cases, so if you guys could help me to find some “rule of thumb” that will help me make a decision. Thanks in advanced!",58,0.94,63,https://www.reddit.com/r/dataengineering/comments/1tsatro/is_it_fact_or_a_dim/,2026-05-30 20:38:14,2026-06-02 04:05:25
1tpnr8n,"Fresh grad dropped into a data swamp. ~20 tools (that I know of), very little (and highly fragmented) documentation, and a black-box warehouse. How do I reverse-engineer this?",HelpMeMapData,dataengineering,"Hello reddit,I’m a fresh college grad and a brand-new hire in the Data Analytics department at a large-ish company (\~5K employees or so). My initial onboarding task was to create ""data governance recommendations,"" which I thought was pretty vague and confused me in regards to what was actually expected. But I did my best to try to look into things and quickly realized that this was going to be a pretty impossible task. I managed to convince my department head of the current reality of the department, which is that we can't possibly govern what we don't understand. And right now, literally nobody in our department actually understands our data pipelines work :/The current situation:* Our black box warehouse: The company recently paid outside consultants to set up a new cloud data warehouse and spent months migrating data into it. But last week, I literally overheard a data engineer distressed because they have zero idea how to use it.* Tech stack that seems very confusing and redundant?: We don’t actually do much coding here (that I know of...). Although there is a decent amount of SQL I think is happening. Instead, we have a massive, fragmented ecosystem of tools. I’ve been gradually building a list of what I hear mentioned as being used, and I'm pushing 20+ different pipeline orchestration tools, DBMSs, and SaaS sources (think Alteryx, Talend, IBM CDC, Control-M, etc.).* A bunch of data sources: Data is being pulled into the cloud warehouse from at least two different SaaS platforms and multiple on-prem databases running on at least two different DBMSs. * Documentation??: Knowledge is basically completely siloed. Whatever data dictionaries we might have exist as random excel files on one person's computer or buried three directories deep on some SharePoint page.My issue is that since the consultants built everything and left behind a total black box, nobody trusts the new cloud data warehouse. The department is still treating the original on-prem databases and SaaS platforms as the fragmented ""sources of truth,"" which completely defeates the purpose of the expensive migration, doesn't it?My current survival plan is to schedule interviews with absolutely anyone and everyone who touches data so I can try to manually reverse-engineer these pipelines and map out our data lineage.As a fresh grad, I feel incredibly out of my depth. I want to use this as an opportunity to add real value, but I need some guidance (please help me guys, IDK what I'm doing).\-- Is interviewing everyone (i.e. starting with one person, then interviewing whoever they point me to, and so on) the right first step? Or is there a smarter, less painful way to go about this?\-- When knowledge is this siloed, what specific questions should I be asking to piece everything back together?\-- What should the end product look like? I'm thinking an official ""data catalog"" (although I don't really know how to go about creating one). Are there specific frameworks I should use to document this disaster so the department can actually benefit from this? My current best idea is a giant directed graph of data flow (a la Neo4j or something like that. then we could use a graph query language to analyze things, which seems pretty useful.)Oh also, these is currently no version control being used. In theory we have a GitHub, but nobody uses it. Like somebody literally said ""oh yeah, I don't use that"".",50,0.94,36,https://www.reddit.com/r/dataengineering/comments/1tpnr8n/fresh_grad_dropped_into_a_data_swamp_20_tools/,2026-05-28 00:29:37,2026-06-02 04:05:25
1toby9z,Don't Go Dark: Visibility Is a Data Engineering Skill (Chris Hillman),rmoff,dataengineering,No content,49,0.92,0,https://ghostinthedata.info/posts/2026/2026-05-23-dont-go-dark/,2026-05-26 16:22:58,2026-06-02 04:05:25
1tsci4v,Evolution of Data Architect Role,DataProfessional_GT,dataengineering,"Hello! I'am wondering what is next for the people who are aspiring to be a Data Architect. Off late the Job descriptions were nothing like what was earlier. The lines are getting more and more blurred due to the advancements in AI/ML & decentralization. To those who are already in the Architect role, Are you still doing ""architecting"" in the traditional sense, or has your role basically evolved into a high-level systems engineer? What skills are you prioritizing now that weren't on your radar 3 years ago? What should someone focus on if they aspire to be an architect in the near future. Appreciate all your feedback and thoughts.",44,0.91,16,https://www.reddit.com/r/dataengineering/comments/1tsci4v/evolution_of_data_architect_role/,2026-05-30 21:46:26,2026-06-02 04:05:25
1tq4a8a,Minarrow: a lightweight Arrow-shaped columnar data library for Rust,peterxsyd,dataengineering,"**Minarrow is a columnar data library for Rust.****What:** Apache Arrow is the columnar run-time that backs major libraries like Polars, Apache Data Fusion, and optionally in Pandas. Minarrow is a from-scratch implementation of the open Arrow format.**The pitch:** Arrow-shaped data with Python-style ergonomics, Rust-level safety, and fast builds. It sits as the backing run-time for data libraries, or engineers that like to start with something minimal for working with data in Rust.**Benefit:** strong typing and a compiler that agents like Claude can fall back on when iterating on a data pipeline to receive real-time feedback during development for self-diagnosis and improvement loops.**Why?** I built it after using `arrow-rs` as the base layer of a larger project and finding that, while Apache Arrow itself is excellent, the Rust implementation did not always fit the way I like to build data systems.The main pain points I wanted to improve were Rust-related:* Heavy compile times when Arrow becomes a base dependency.* Lots of dynamic typing and downcasting in application code.* Boilerplate around builders and type-specific variants.* Friction when building higher-level data tooling on top.**TLDR**: how can I get the speed benefits of Rust, including something ready to integrate into a real application, while keeping it easy for AI tools like Claude to work effectively with by not getting confused about data types and syntax?**How?** In Python, inner typing is mostly taken care of for you, but it slows down the code. That is why many Python libraries wrap C, C++, or Rust.In Rust, Minarrow aims to keep the high-level ergonomics as much as possible, whilst supporting interop with other libraries like Polars and roundtrips to/from Python**:** use minarrow::{arr_i32, arr_f64, arr_str32, fa, tbl, Print}; /// Create arrays let ids = arr_i32![1, 2, 3, 4]; let prices = arr_f64![10.5, 20.0, 15.75, 7.25]; let names = arr_str32![""alice"", ""bob"", ""charlie"", ""dan""]; /// Create a table with labelled columns let users = tbl!(""users"", fa![""Id"", ids], fa![""Name"", names], fa![""Price"", prices], ); /// Pretty print users.print(); /// Sends data directly to Apache Arrow let arrow = users.to_apache_arrow(); /// Sends data to Polars let series = users.to_polars();The outcome is a smaller, faster, more ergonomic base layer for Rust data applications where you want:* Fast clean and incremental builds.* Straightforward table and array construction.* Pandas-like row and column selection.* Strong compile-time data guarantees.* Optional support for dictionaries, matrices, and chunked/streaming containers.* Interop with `arrow-rs`, Polars, and PyArrow at the boundary.* \* Fast foundations, including hot paths that support sub-millisecond live data flow, though not sub-microsecond latency.**Who is it for:** Users who are :* Building data libraries* Working with data in a live application or streaming context* Data engineering in Rust and inter-oping with Polars* Quant Trading (e.g., building Risk models) that need Rust speed or integration but need a fast and easy zero-copy Python roundtrip on their dataFor Data Engineers who are working with tools in Python, you may be more likely to encounter it as a backing run-time of a library than directly, however I'd still like to encourage you to check it out if you've been thinking about checking out Rust.**Performance:**Some benchmark numbers for summing 1,000 `i64`s on an Intel Ultra 7 155H:|Implementation|Time||:-|:-||Raw `Vec`|85 ns||Minarrow `IntegerArray` direct|88 ns||Minarrow `IntegerArray` via enum|124 ns||`arrow-rs` `Int64Array` struct|147 ns||`arrow-rs` `Int64Array` dyn|181 ns|With SIMD + Rayon, 1 billion integers sum in \~114ms.Note: These are in the repository, so you can run them on your own machine if you'd like to.# CaveatMinarrow is currently flat-columnar only. It does not support deeply nested `List` / `Struct` schemas, so if your workload depends heavily on nested Arrow types, `arrow-rs` is a great choice.**Repo**: [GitHub](https://github.com/pbower/minarrow/) **Docs**: [crates.io](https://crates.io/crates/minarrow)**License**: Apache 2.0Sharing it here because I think some data engineers working on high-performance pipelines, Python/Rust bridges, embedded analytics, live data systems, or custom data infrastructure may find it useful. If you believe it is, a GitHub star is appreciated as it helps other people find the project.Questions and feedback welcome.Thanks everyone.",29,0.95,7,https://www.reddit.com/r/dataengineering/comments/1tq4a8a/minarrow_a_lightweight_arrowshaped_columnar_data/,2026-05-28 13:52:01,2026-06-02 04:05:25
1ttwn6h,Quarterly Salary Discussion - Jun 2026,AutoModerator,dataengineering,"https://preview.redd.it/ia7kdykk8dlb1.png?width=500&format=png&auto=webp&s=5cbb667f30e089119bae1fcb2922ffac0700aecdThis is a recurring thread that happens quarterly and was created to help increase transparency around salary and compensation for Data Engineering where everybody can disclose and discuss their salaries within the industry across the world.# [Submit your salary here](https://tally.so/r/nraYkN)You can view and analyze all of the data on our [DE salary page](https://dataengineering.wiki/Community/Salaries) and get involved with this open-source project [here](https://github.com/data-engineering-community/data-engineering-salaries).If you'd like to share publicly as well you can comment on this thread using the template below but it will not be reflected in the dataset:1. Current title2. Years of experience (YOE)3. Location4. Base salary & currency (dollars, euro, pesos, etc.)5. Bonuses/Equity (optional)6. Industry (optional)7. Tech stack (optional)",28,0.95,13,https://www.reddit.com/r/dataengineering/comments/1ttwn6h/quarterly_salary_discussion_jun_2026/,2026-06-01 16:00:11,2026-06-02 04:05:25
1toa1hd,Suggest AWS ETL tools,dink-mimer7,dataengineering,"We are migrating a client's data stack to AWS (S3 and Redshift). Our initial architecture used AWS Glue for all the ETL pipelines. Good for internal database replication but using Glue to ingest external data (Salesforce, Zendesk) is problematic.We don't want to keep writing PySpark scripts just to handle basic incremental API syncs. This is also increasing Glue DPU costs. Better to go with external ingest. What AWS tools should be try out? Any open source ones? What else?",26,0.96,21,https://www.reddit.com/r/dataengineering/comments/1toa1hd/suggest_aws_etl_tools/,2026-05-26 15:17:55,2026-06-02 04:05:25
1tt5fdx,Whats the moat of Astronomer?,Ok_Illustrator_816,dataengineering,"As the title says, does anyone use Astronomer at work? I personally use MWAA just fine without any issues. Whats the difference with using Astronomer? Is it cheap/more reliable?The company seems to be valued close to a billion dollars but i never see it in any job listings specifically. So who is using it?",24,0.77,27,https://www.reddit.com/r/dataengineering/comments/1tt5fdx/whats_the_moat_of_astronomer/,2026-05-31 19:48:41,2026-06-02 04:05:25
1tpzxyw,LLM Analytics in Enterprises?,twattymanky,dataengineering,"Hi folksIm curious to understand if and how teams are building their LLM analytics for internal usage across different organisations. Additionally, how would you test to ensure theres low hallucinations etc.For example in my team (small organisation <50 people), we built an MCP server that runs on Cloudflare workers. We then have our main MCP client which is Claude that connects to that MCP. We have developed many skills and amongst it is a data warehouse skill which contains knowledge.md and skills.md files to describe the data warehouse. Those md files essentially are our semantic layer. We have some test coverage by domain which we try to evaluate desired sql outputs based on sample questions but its really rudimentary at the moment.This was meant to help 'democratise' data but without proper testing and a robust evaluation infrastructure, it has really led exposing a lot of the key gaps, data quality and documentation issues.I'm keen to understand how people are tackling this across organisations of varying sizes!",20,0.96,15,https://www.reddit.com/r/dataengineering/comments/1tpzxyw/llm_analytics_in_enterprises/,2026-05-28 10:46:42,2026-06-02 04:05:25
1tpopiq,Would you risk vendor lock in for your career? Is it worth it to become take a Pentaho developer job for $130k?,nigelwiggins,dataengineering,Or become an entry level data engineer with a more mainstream stack for $100k?,18,0.85,46,https://www.reddit.com/r/dataengineering/comments/1tpopiq/would_you_risk_vendor_lock_in_for_your_career_is/,2026-05-28 01:11:11,2026-06-02 04:05:25
1tqzidp,Getting Salesforce data ready for AI analytics?,Odd-String29,dataengineering,"Currently we simply have our Salesforce objects/tables available in BigQuery and keep that structure basically intact. I inherited from the guy that was here before me and it works fine for our setup. We just create tables for our dashboards in Data Studio (which likes OBT). Big advantage is that we can easily see what causes differences between Reports in Salesforce and our dashboards because the underlying structure is the same.But now we are looking getting our data ready for an AI Agent. I'm currently experimenting with using the column descriptions in BigQuery, sample queries and synonyms using BigQuery's built-in agent builder. It seems to work ok, but not as good as I want. Probably because I need better descriptions, more sample queries and better synonyms and such. But it also made me wonder if modelling the data in a different way might help. Has anyone have any experience with getting Salesforce data ready for this?",18,0.95,23,https://www.reddit.com/r/dataengineering/comments/1tqzidp/getting_salesforce_data_ready_for_ai_analytics/,2026-05-29 11:54:26,2026-06-02 04:05:25
