id,title,author,subreddit,content,score,upvote_ratio,num_comments,url,created_utc,extracted_at
1pn1vsg,I want to Learn C/C++,bakaaa34,learnprogramming,"Hello, I'm a fellow beginner programmer and I want to learn the C language but I'm having some trouble. In my VSC when I write gcc --version, it says: The term 'gcc' is not recognized. I have the MSYS2 installed after this but I still get the same message. What should I do? Thank you!",8,0.73,17,https://www.reddit.com/r/learnprogramming/comments/1pn1vsg/i_want_to_learn_cc/,2025-12-15 07:54:14,2025-12-22 01:52:24
1prnad8,Resources for learning best practices when coding projects/working in a dev team?,Marine_Big100,learnprogramming,"I'm trying to self educate on best practices when developing projects and working in a team with topics such as git version control. I'm looking for resources that can lay ""best practices"" out for me when it comes to software development such as how to handle API keys when using version control and etc. I know Google exists, however I'm looking to find a comprehensive starter resource if available. Recommendations would be appreciated!",9,1.0,8,https://www.reddit.com/r/learnprogramming/comments/1prnad8/resources_for_learning_best_practices_when_coding/,2025-12-20 20:01:14,2025-12-22 01:52:24
1pps21m,Is JavaScript good for Hackathons?,Standard_Calendar_66,learnprogramming,I am learning webdev. So I was thinking about starting DSA from January 2026. So before starting I was thinking which language to learn for DSA in order to go to Hackathons...,8,0.74,15,https://www.reddit.com/r/learnprogramming/comments/1pps21m/is_javascript_good_for_hackathons/,2025-12-18 14:23:29,2025-12-22 01:52:24
1poepdy,Doing codewars exercises as a beginner.,Diligent_Silver2254,learnprogramming,So I've been trying to self learn python from scratch for a month with a goal of getting a job and have started doing exercises on codewars along side learning theory and I feel like I've done good so far and just want some feedback if what I'm doing is a good idea and maybe what I should do later when I start learning more advanced topics,9,0.86,5,https://www.reddit.com/r/learnprogramming/comments/1poepdy/doing_codewars_exercises_as_a_beginner/,2025-12-16 21:49:42,2025-12-22 01:52:24
1pryh7m,"Working on a compiler for x86-64 windows, any advice?",DirtWhisper,learnprogramming,"Been working on writing an x64 compiler lately, mainly for learning more about programming at a lower level, but also for fun! Anyways, hit a personally milestone today and wanted to brag a little haha. It doesnt do much yet, and it doesnt even have flow control functionality (yet), but very proud that I have even managed to get this far lol, (debugging hell 200%)Uses NASM and Golink in the backend.Has anybody else ever done anything similar? Any advice? Ive learned so much so far that im already contemplating restarting haha Written in C++, managed to get these features:Function definitions and calling Global and local variables definitions Integer mathematics that follow BEDMAS (Use shunting yard algorithm), can also nestle functions in the expressions Can link to external dll for more functionality The string types are = \[4bytes - length, 4bytes - capacity, 8 bytes - pointer\] and also null terminated, for working with C style string functions one can use the syntax $stringVariable.cHere is an example that I managed to sucesfully compile today: #inc: ""core.ni"" #def: $text : string = ""This strings length = %d, capacity = %d\n"" #def: $number : int32 = 95 #def: .main() int32 { .c_printf( $text.c, $text.length, $text.capacity ) $number = 50*11 .c_printf( ""Number (50*11) is: %d\n"", $number ) $number = .getNumber() .c_printf( ""Number after function is: %d\n"", $number ) .c_printf(""Enter a number: "") .c_scanf(""%d"", ?number ) .c_printf( ""Number entered is: %d\n"", $number ) .exit(0) } #def: .getNumber() int32 { .return(123456789) }And here is the ""core.ni"" #lnk: ""msvcrt.dll"" #ext: .c_printf : printf( $text : pntr , $arg1 : any , $arg2 : any , $arg3 : any ) void #ext: .c_scanf : scanf( $text : pntr , $arg1 : pntr ) void #ext: .c_malloc : malloc( $size : int32 ) pntr #ext: .c_free : free( $address : pntr ) void #ext: .c_realloc: realloc( $address : pntr, $size : int32 ) pntr #lnk: ""kernel32.dll"" #ext: .exit : ExitProcess($code : int32) voidWanted to make linking to external functions easy! (I think this is fairly simple)I use the variable type ""any"" as a workaround for overloads atm hahaOther than control flow functionality, what other basics should I try to implement next? (I also need to implement floating point mathematics) (or general advice on compiler development)",7,1.0,3,https://www.reddit.com/r/learnprogramming/comments/1pryh7m/working_on_a_compiler_for_x8664_windows_any_advice/,2025-12-21 05:12:48,2025-12-22 01:52:24
1prwl4r,Language choice for open source and GSoC preparation: Go vs Rust vs Java,GabbarSingh3,learnprogramming,"Hi everyone,I already have a good foundation in Python and I’m preparing early for Google Summer of Code–style open-source contributions.I want to invest time in ONE additional language that:- Is commonly used in active open-source projects- Allows faster onboarding and meaningful contributions- Is useful long-term beyond just interviewsI’m considering Go, Rust, and Java.I’d really appreciate advice from developers who have contributed to open source or mentored students:Which language has helped you contribute most effectively and why?",8,1.0,5,https://www.reddit.com/r/learnprogramming/comments/1prwl4r/language_choice_for_open_source_and_gsoc/,2025-12-21 03:31:22,2025-12-22 01:52:24
1prn163,Teaching early versions of JS,Ill-Raccoon-1038,learnprogramming,"I have begun to study CS in a university recently, have a lecture called intro to programming and it contains JS. However it is not the “new”, redesigned 2016, but the old version. In which only var is used, no arrow function etc.I have a hard time to understand the reason? It seems so waste of time and unnecessarily making things harder and more confusing. I am able to understand what is going on with the lecture, getting confused yes but still when I spend some time I can understand nearly everything. However why teaching practically a dead version? No one seems to use JS in this format anymore.Writing here so maybe I miss some points. Just want to hear some experienced voices. Cheers.PS: English not my primary language, so hope this makes sense.",9,0.8,12,https://www.reddit.com/r/learnprogramming/comments/1prn163/teaching_early_versions_of_js/,2025-12-20 19:49:59,2025-12-22 01:52:24
1ppxaa6,Confused about choosing a specialization as a beginner software engineering student,Eng_AG,learnprogramming,"Hey everyone,​Freshman Software Engineering student here. I’m currently grinding through the basics (loops, logic, etc.), but I’m honestly getting a bit of analysis paralysis looking at all the different tracks out there—AI, Web Dev, Mobile, Full-Stack, etc. It feels like there are too many options.​A few questions for those who have been there:​Is there a 'best' path to cut my teeth on as a total beginner?​Is it bad if I just stay general for now, or is it better to niche down early?​What specific skills should I be nailing down in my first year or two so I don't fall behind?​Any advice from experienced devs or students further down the road would be awesome. Thanks!",8,0.71,28,https://www.reddit.com/r/learnprogramming/comments/1ppxaa6/confused_about_choosing_a_specialization_as_a/,2025-12-18 17:52:36,2025-12-22 01:52:24
1ppk5lk,How to properly use HackerRank for practice (beginner)?,purvigupta03,learnprogramming,"Hi,I’m a beginner and want to learn how to use HackerRank properly. I’ve never used it before.I want to know:How to start practicing any programming language on HackerRankHow to choose the right problems as a beginnerHow much time to spend daily and how to track progressAny simple guidance or beginner tips would help. Thanks!",6,0.73,2,https://www.reddit.com/r/learnprogramming/comments/1ppk5lk/how_to_properly_use_hackerrank_for_practice/,2025-12-18 06:43:37,2025-12-22 01:52:24
1po76sj,CS degree,Inner_Boysenberry930,learnprogramming,"I work in documentation for a mid-size tech company, but I want to break into more tech roles. There are not a lot of options available other than PM, dev, QA, PO. Is it worth getting a CS degree to gain credibility and a structured framework for learning new concepts? Or should I just learn multiple coding languages and build apps end-to-end?",6,0.81,22,https://www.reddit.com/r/learnprogramming/comments/1po76sj/cs_degree/,2025-12-16 17:00:23,2025-12-22 01:52:24
1po1jbc,Deep with one or shallow with many,Soft_Day_8051,learnprogramming,"I am a developer and know both JavaScript and Python on a pretty good level, as I am able to code very proficiently with both. Should I keep learning more languages or become really experienced/knowledgeble with 1 specific? And if so, which one?Edit: After getting some responses I would like to add some details:I am a hobby webdeveloper and know basic database communication, have used NextJS and React.js and even a lil Django. I know Typescript and have used it multiple times. Although I am getting tired of webdevelopment and would like to go more into system development-like areas. But I don't know if I should go deeper with my already very good knowledge of Python and JavaScript or if I should learn more languages. I can't really go by the logic of ""learn based on what you need"" because I am still just learning coding in general.",7,0.72,20,https://www.reddit.com/r/learnprogramming/comments/1po1jbc/deep_with_one_or_shallow_with_many/,2025-12-16 13:10:12,2025-12-22 01:52:24
1pmzkgv,Am I making myself an unskilled developer?,Due-Consequence-7699,learnprogramming,"Didn't know where to post, this seemed the most reasonable place simply based off the name of the subreddit. Feel free to correct me if maybe this belongs on an AI subreddit.I'm taking a python course through https://carpentries.org/. Part of it is learning to use the numpy library for drawing a really simple graph. I ran into an issue with one of the exercises, where I couldn't add any lines to adjust any parameters because every time the finished graph was closed, everything I entered into the REPL was deleted from the queue and I had to enter the whole program into the REPL again.I went to AI to find this out, and asked about putting this all into a script. Two days later I have a script, an understanding of why I would have multiple files for a script (for separation of concerns), why I would put these files in the project directory and not a \~/bin directory, and a few other things that I can't recall atm, but that I did not know before, or without, AI.I had to do some thinking to figure out what the script was doing, but not much thinking. I asked the AI a ton of questions along the way. I didn't simply copy-pasta the whole thing, but that only sounds like I'm justifying after-the-fact. Am I doing myself a dis-service? Is this essentially how developers let AI do all the thinking and don't learn anything?",5,0.62,13,https://www.reddit.com/r/learnprogramming/comments/1pmzkgv/am_i_making_myself_an_unskilled_developer/,2025-12-15 05:30:42,2025-12-22 01:52:24
1pmy9wz,"Is there a structured way of learning, for getting a job as a Backend Developer?",Open_River9425,learnprogramming,"I’ve applied for backend developer intern jobs, but either I don’t get responses or I get rejected. I know python, C++, Django, FastAPI, DSA, AWS, Docker, Kubernetes, Machine learning, Deep learning and other AI/ML related techniques. Can anyone tell where I’m lacking? I’ve good command on my programming, I have some good projects too. I am in college right now It’d be great if someone guides me how to start.",8,0.84,8,https://www.reddit.com/r/learnprogramming/comments/1pmy9wz/is_there_a_structured_way_of_learning_for_getting/,2025-12-15 04:20:11,2025-12-22 01:52:24
1pmxh7a,Should I continue this or beyond it?,FeeAdventurous9338,learnprogramming,"I am currently in 1st year computer science and engineering and I have been learning C language for the entirety of my first semester. I wanted to explore front end development and learned HTML and CSS from tutorials online, then I built some basic projects and due to My midterms in the middle my progress was halted, and I eventually put a break on it, due to the break I forgot most of what I learned then I again ended up in the tutorial loops, then I finished it up, built a project then started JS from tutorials again and built a basic tic-tac-toe project. I again messed it up due to My heavy college workload in the middle, so after a bunch of failures I discovered a certification course from Freecodecamp and I have started it, But I am again starting over from HTML and CSS in the course. Should I continue this course and move on to the JS part of the course, or should I just start from online tutorials again and move forward?",8,0.85,13,https://www.reddit.com/r/learnprogramming/comments/1pmxh7a/should_i_continue_this_or_beyond_it/,2025-12-15 03:38:13,2025-12-22 01:52:24
1prkxom,When don't use new framework and cutting edge technology? When you always should?,pepiks,learnprogramming,"Technology moving fast, new tools are on the way right now. I see a lot of guide and suggestion about using something new because of benefits. But from your experience when you suggest avoid using new technology stack, architecture, programming language or framework? I am asking about decision making and good practices to design final solution which will be good to work one few years later. So at the same time I am asking when choose new one tools for the job.What your recommendation from your experience and common pitfalls?",5,0.74,14,https://www.reddit.com/r/learnprogramming/comments/1prkxom/when_dont_use_new_framework_and_cutting_edge/,2025-12-20 18:19:37,2025-12-22 01:52:24
1pqd6ym,What should I learn to build a Micro Saas?,Hot_Point5033,learnprogramming,"Hello there! I want to start and run a micro saas business. I have learnt html, css and currently learning JavaScript. I am thinking about learning react next. Will all this be sufficient or do I need to learn a backend language like python as well. I have heard react or next js functions as a backend. Please advise me. Thankyou.",7,0.74,5,https://www.reddit.com/r/learnprogramming/comments/1pqd6ym/what_should_i_learn_to_build_a_micro_saas/,2025-12-19 05:36:36,2025-12-22 01:52:24
1ppvoun,My 14-year-old is about to finish Tynker level 5/6 and will hopefully complete level 6 in about six months. I'd be grateful for recommendations on the next logical online programming course.,kraft_mk,learnprogramming,"My 14-year-old started his coding journey three years ago without any pressure. It's time for me to think about the next step after Tynker.I'd appreciate any recommendations for his next online programming course with a clear, progressive structure.Thank You.Tynker's 6 LevelsLevel 1: Block-based basics:sequencing, puzzles.Level 2: Create stories, animations, games with blocks.Level 3: Advanced blocks: variables, functions, algorithms.Level 4: Intro to Python: syntax, loops, conditionals.Level 5: Advanced Python: functions, data structures, classes.Level 6: Real-world Python: data viz, games, simulations.",4,0.61,14,https://www.reddit.com/r/learnprogramming/comments/1ppvoun/my_14yearold_is_about_to_finish_tynker_level_56/,2025-12-18 16:50:41,2025-12-22 01:52:24
1ppk4rx,Where should I practice SQL + build small projects?,purvigupta03,learnprogramming,"Hi,I’m practicing SQL on HackerRank, but now I want to practice the same questions on a real SQL environment and also start building small SQL-based projects.Can you suggest:Which platform is best for hands-on SQL practice (MySQL Workbench, VS Code, SQLite, PostgreSQL, etc.)?What setup is better for projects (beginner level)?How do you usually move from platform-based practice to real projects?Short suggestions would really help. Thanks!",5,0.68,10,https://www.reddit.com/r/learnprogramming/comments/1ppk4rx/where_should_i_practice_sql_build_small_projects/,2025-12-18 06:42:16,2025-12-22 01:52:24
1pomcka,How do i learn about libraries in programming.,mole_panda,learnprogramming,"if i want to learn about a whole new library in c++ for my projects, how do i , and should i memorize everything?",4,0.63,13,https://www.reddit.com/r/learnprogramming/comments/1pomcka/how_do_i_learn_about_libraries_in_programming/,2025-12-17 03:36:26,2025-12-22 01:52:24
1po2ej4,Advice for DotNet Backend Developer,Dismal_Charity7713,learnprogramming,"I am currently a Junior Developer with a remote job. On some days, it's relatively more hectic, in a good way, & there's tasks that I need to accomplish, tasks that help me learn more, & move faster. But some days are just WAY more lazy, I don't get delegated much, cuz apparently there's just not much to do. I do some self-study every now & then, & most of what is delegated to me, I can accomplish with the occasional snags, but I eventually get it done within a short time frame. I am a little concerned. Should I do be doing more? What else must I do for now?",4,0.76,6,https://www.reddit.com/r/learnprogramming/comments/1po2ej4/advice_for_dotnet_backend_developer/,2025-12-16 13:49:40,2025-12-22 01:52:24
1pnux94,Best book for learning OOP in C++?,carrotcannon6,learnprogramming,"I'm a college student currently taking object-oriented programming in C++ and I would really like to enhance my learning by picking up a book. I know a good way to learn is just by doing, but I feel like there's just so much going on as someone who is new to C++ that I would prefer it if I could find a specific book that just puts it all together.The book doesn't have to focus around C++, but it would be nice if it did. I've heard things like Design Patterns by Gang of Four is good and also Head First Design Patterns and Head First Object Oriented Analysis and Design. Hoping anyone could just push me in the right direction of which book to try. The only other language I'm very familiar with is Python, if that changes anything.",4,0.76,1,https://www.reddit.com/r/learnprogramming/comments/1pnux94/best_book_for_learning_oop_in_c/,2025-12-16 06:23:35,2025-12-22 01:52:24
1pninph,Getting Back to Coding After a Long Break – What Should I Do?,Jboorgesz,learnprogramming,"I completed the CS50 course in early 2025 during my college holidays. A few days later, I started The Odin Project (TOP). I was very consistent for about three to four months, but around mid-2025, I hit a wall—specifically with Data Structures. I didn’t understand any of it and eventually gave up.Now I’m on holiday again and want to give programming another try, but I’m facing another challenge: I don’t remember anything after not writing a single line of code for five to six months.What do you think is the easiest and fastest way to review the basics? Should I redo the projects, start the course over, or watch YouTube tutorials? I feel pretty lost right now.",6,0.67,11,https://www.reddit.com/r/learnprogramming/comments/1pninph/getting_back_to_coding_after_a_long_break_what/,2025-12-15 20:50:48,2025-12-22 01:52:24
1prev6h,PyCharm feels heavy at first… did it grow on you over time?,Doug24,learnprogramming,"Whenever I open PyCharm after using lighter editors, it always feels like a lot. Menus, inspections, warnings everywhere. But once a project gets past a few files, I start appreciating how much it does for you.I noticed the same thing when I added Sweep AI into the mix. At first I wasn’t sure I needed it, but over time it started helping more with real refactors and multi-file cleanup rather than just quick suggestions.Did PyCharm eventually click for you, or did you decide it was just too much?",5,0.7,3,https://www.reddit.com/r/learnprogramming/comments/1prev6h/pycharm_feels_heavy_at_first_did_it_grow_on_you/,2025-12-20 13:53:39,2025-12-22 01:52:24
1pq72yr,Approaches to testing a unit of code that makes indirect changes to state,Sorlanir,learnprogramming,"I'm writing some unit tests for a class member function (method). This method makes calls to orher methods that change the object's state. A simplified example:`SomeClass::unit_under_test(){ this->f(); // changes the state of this // ... }`I've used C++ syntax since that's the language I'm using, but the question itself is not specific to C++. For those unfamiliar, `this` refers to the current object of the class that you are in scope of.My question is: how do you properly test `unit_under_test`? I am not really that interested in testing `f()`, because there is a separate unit test for that. I also can't mock it without making changes to source code, because there is no way to link in a mock for `f()` that will end up getting called here instead of the actual member function.You could also imagine that `f()` could be fairly complex. It could itself call a bunch of other functions that do various things and which should themselves be unit tested. Digging into the implementation of those functions starts to feel like it's getting outside the scope of the test of just this function.So, it seems hard to know how best to test this kind of thing, and I wanted to know what others' thoughts are.",5,0.79,21,https://www.reddit.com/r/learnprogramming/comments/1pq72yr/approaches_to_testing_a_unit_of_code_that_makes/,2025-12-19 00:32:26,2025-12-22 01:52:24
1pprt8c,Need feedback on code quality from people more experienced than me.,EmploymentLeft1481,learnprogramming,"Hey, I'm a beginner python dev and just finished this task tracker project. I’d really appreciate feedback on code structure, readability, and error handling — especially from people more experienced than me. I built this as part of the [roadmap.sh](http://roadmap.sh) backend project series. I also used Claude for an initial review so I could make some improvements. I didn't use AI to write the code, I wrote every single line of it, I only used it for review. But I also want some people, preferably more experienced than me, to review it and give some suggestions.Repo: [GitHub Link](https://github.com/jurabek-abd/python-roadmap-projects/tree/main/task-tracker) roadmap.sh: [Project Link](https://roadmap.sh/projects/task-tracker/solutions?u=692db4d2a17ff74763dc81f1)",4,0.76,6,https://www.reddit.com/r/learnprogramming/comments/1pprt8c/need_feedback_on_code_quality_from_people_more/,2025-12-18 14:12:56,2025-12-22 01:52:24
1ppn69d,Code Review of first personal project,Canukcannot,learnprogramming,"I wrote my first personal project, which is a toy memory allocator with a simulated heap, malloc, realloc and free. When i was writing it, everything made sense to me and followed logically, however i feel like it might appear somewhat like spaghetti to anyone else. There is quite alot of if statements and pointer arithmetic. I feel like it maybe could have been refactored to be more clear/readable, but I'm new to C, and programming in general, so i honestly do not know.[https://gist.github.com/matt181888-hub/7f7552e461dca9d4a7545c9632a17c54](https://gist.github.com/matt181888-hub/7f7552e461dca9d4a7545c9632a17c54)That is a link to the code itself. I would really appreciate any feedback, I had so much fun writing it but i want to be better for my next project!",5,0.86,2,https://www.reddit.com/r/learnprogramming/comments/1ppn69d/code_review_of_first_personal_project/,2025-12-18 10:03:16,2025-12-22 01:52:24
1ppeaaz,"When it comes to coding for video games, how do y’all figure exactly what you need to put.",Affectionate-Ad-3234,learnprogramming,"This post may be all over the place, so my apologies. I’m always getting stuck and need to google what to do. Or I easily give up, and when I decide to go back to try again, I start over from the beginning. I tried to learn how to do game development by watching YouTube videos like Brackeys, but when I try on my own, nothing seems to click and I end up getting stuck in tutorial mode. I watched the game awards for this year, and when one of the developers for expedition 33 brought up how they watched YouTube videos because they didn’t know how to make a game before, it has been stuck in my mind how they manage to do something this big. I want to be able to one day work for a company to make games, but I don’t know where to start, or how to continue.",5,0.78,20,https://www.reddit.com/r/learnprogramming/comments/1ppeaaz/when_it_comes_to_coding_for_video_games_how_do/,2025-12-18 01:32:46,2025-12-22 01:52:24
1po6urt,Open source first time,Beginning-Leek-7087,learnprogramming,"Hi guys I was hoping I will find some advice from you, I was thinking a lot about open source lately, and when I went to GitHub I felt pretty overwhelmed, so my question is how do I pick the best first project? Do you guys have any recommendations? What I was thinking, I would focus on small softwares, or simple mobile games, or is there something better that you would recommend to me as a begginer?",5,0.71,12,https://www.reddit.com/r/learnprogramming/comments/1po6urt/open_source_first_time/,2025-12-16 16:47:45,2025-12-22 01:52:24
