id,title,author,subreddit,content,score,upvote_ratio,num_comments,url,created_utc,extracted_at
1q3kj41,Job prospect questions,themanwith2names,dataengineering,"I’d like to gain advice on what people think here about where I can realistically take my career next within a year or so. My experience includes this:At a bank writing SQL queries to clean financial data into standardized formatsConsulting, using SQL to analyze data and make interpretations where I helped my client make business decisions (though between you and me I was more of a support role helping the main analyst do the heavy thinking and presenting)Business for a Salesforce instance where I went through the whole sprint processSenior Data Analyst currently where I’m more of an excel junkie, but doing a stretch assignment where I will be helping to further build out the current the database that feeds into PowerBI for insightsI thought about things like data engineer but job descriptions seem way too much for me to catch up to those anytime soon. What are some career paths I can realistically take from my current skillset (and what else can I upskill or look for other stretch assignments in?)",6,0.69,8,https://www.reddit.com/r/dataengineering/comments/1q3kj41/job_prospect_questions/,2026-01-04 08:16:44,2026-01-07 01:49:58
1q1euus,How can I export my SQLExpress Database as a script?,LordLoss01,dataengineering,"I'm a mature student doing my degree part time. Database Modelling is one of the modules I'm doing and while I do some aspects of it as part of my normal job, I normally just give access via Group Policy.However, I've been told to do this for my module:**Include the SQL script as text in the appendices so that your marker can copy/paste/execute/test the code in the relevant RDBMS.**The server is SQLExpress running on the local machine and I manage it via SSMS. It does only have 8 tables and those 8 tables all only have under 10 entries.I also created a ""View"" and created a user and denied that user some access.I tried exporting by right clicking the Database, selecting ""Tasks"" and then ""Generate Scripts..."" and then doing ""Script entire database and all database objects"" but looking at the .sql in Visual Studio Code, that seems to only create a script for the database and tables themselves, not the actual data/entries in them. I'm not even sure if it created the View or the User with their restrictions.Anyone able to help me out on this?",8,1.0,3,https://www.reddit.com/r/dataengineering/comments/1q1euus/how_can_i_export_my_sqlexpress_database_as_a/,2026-01-01 20:56:36,2026-01-07 01:49:58
1q17j57,Best learning path for data analyst to DE,Strong-Cry-7641,dataengineering,What would be the best learning path to smoothly transition from DA to DE? I've been in a DA role for about 4.5 years and have pretty good sql skills. My current learning path is:1. Snowpro Core certification (exam scheduled Feb-26)2. Enroll in DE Zoomcamp on GitHub3. Learn pyspark on databricks4. Learn cloud fundamentals (AWS or Azure - haven't decided yet)Any suggestions on how this approach could be improved? My goal is to land a DE role this year and I would like to have an optimal learning path to ensure I'm not missing anything or learning something I don't need. Any help is much appreciated.,6,0.65,11,https://www.reddit.com/r/dataengineering/comments/1q17j57/best_learning_path_for_data_analyst_to_de/,2026-01-01 16:02:44,2026-01-07 01:49:58
1q4zpu8,Any advice to get into DE?,Dlimon19,dataengineering,"A few time ago I started getting more information about DE and got really interested. Since then I learned Python and got PCAP certification. I have 3 YOE as PLSQL developer mainly within Oracle EBS ERP and 1.5 YOE as fullstack developer with .NET. I've also done a DE course where I learned a little about Docker and Airflow. Hopefully I had the possibility to develop an ETL proccess using these tools but my current job is in a manufacturer company with a small IT department.I'm also currently doing another DE course to learn Spark, dive more in Airflow, Kafka and some other tools and studying to get DP-900 certification, I have AZ-900 but to DE idk if it helps at all.I already started aplying to DE positions but can't find anything yet. Any advice?",5,0.78,3,https://www.reddit.com/r/dataengineering/comments/1q4zpu8/any_advice_to_get_into_de/,2026-01-05 22:06:32,2026-01-07 01:49:58
1q4z5qu,Beginner schema review: galaxy schema for stock OHLC + news sentiment analysis,FlaggedVerder,dataengineering,"https://preview.redd.it/p1tk5dxcplbg1.png?width=1937&format=png&auto=webp&s=bb7c46afd1c21837841629dc87a9989d8f7e91b2Overview: I’m building a small analytics lakehouse to analyze stock price trends and the relationship between news sentiment and stock price movement. I’m still a beginner in DE, so I’d really appreciate any feedback.Data sources + refresh cadence:* Company tickers by exchange: “List all companies by exchange” Mapping API (monthly* News sentiment: Alpha Vantage API (3 times/day)* Stock OHLC bars: Stocks REST API (EOD - end of day, daily)Questions:* Data/time keys in bridge facts: * Do I need date\_published\_sk + time\_published\_sk in both bridge facts (fact\_news\_ticker\_bridge, fact\_news\_topic\_bridge) if dim\_news already has published\_ts? * I’m unsure whether duplicating date/time keys in the bridge tables is good practice vs storing the publish timestamp only in dim\_news and joining via news\_sk when filtering by time.* Upsert vs append-only for facts: * I'm inclined to use upsert for these bridge facts as the API may update sentiment/relevance scores intraday (at least I think that can happen). * However, I’ve read that fact tables should generally be immutable/append-only. What's the recommended approach in this scenario?",4,0.76,0,https://www.reddit.com/r/dataengineering/comments/1q4z5qu/beginner_schema_review_galaxy_schema_for_stock/,2026-01-05 21:45:42,2026-01-07 01:49:58
1q4feu2,"Snowflake Scale-Out Metadata-Driven Ingestion Framework (Snowpark, JDBC, Python)",dingopole,dataengineering,No content,4,0.7,0,https://bicortex.com/bicortex/snowflake-scale-out-metadata-driven-ingestion-framework-snowpark-jdbc-python/,2026-01-05 07:32:13,2026-01-07 01:49:58
1q4d83n,How to Read the checkpoint file generated and maintained by Autoloader in Databricks,Artistic-Rent1084,dataengineering,"Hi DE's, let me know how to read the checkpoint file which is maintained by the autoloader while structured batch streaming ? i tried few ways i coudn't able to get it. curious what will be inside it.",4,0.84,1,https://www.reddit.com/r/dataengineering/comments/1q4d83n/how_to_read_the_checkpoint_file_generated_and/,2026-01-05 05:29:33,2026-01-07 01:49:58
1q411xg,Worth getting a degree if I already have experience? And do I have a place in DE? (UK),No-Gap8376,dataengineering,"I'm 33 and have almost 13 years of experience in a public sector data/analytics team in the UK. I'm looking to make a move over the the DE side of things and wondered if I had a place long-term with my experience, but without a degree.I got into the data team from an administrative role and had/still have no degree, just a lacklustre secondary school education (high school level). The department is a mix of those with stellar academic records, random degrees and people like me who fell into the work - I've found a similar split at most organisations and businesses I've worked with or met at conferences.I've experience working with a ton of different systems and a variety of stakeholders both within the organisation and externally such as software companies, central government departments etc. to tackle complex operational problems.I started my career using basic SQL, Excel and VBA. Currently I'm using advanced SQL (including performance tuning, building pipelines and data warehousing), Python (mainly pandas, numpy and matplotlib), Power BI (with a great understanding of DAX and TMDL, plus I do some platform administration). I've a sound(ish) knowledge of stats, though we don't really using anything too advanced. I'm considered mid-senior atm and paid £47k, which is quite typical for the public sector in the UK \*Americans recoil in horror\*.Outside work I mess around with my home server to expand my wider IT knowledge and explore some more modern tooling and cloud platforms.My organisation are moving to Azure next year and I'm lining myself up for a DE role (there's no bump in pay) as that's where my interest lies.Would it be worth me getting a degree at this point in my career? My employer has offered to put me through a degree apprenticeship (not sure how familiar people are with those outside the UK), with the Open University, a distance-learning university.Recently, I applied for ten BI/DA jobs in other companies (just to test my marketability) and was invited to eight, so I'm not worried at all about the immediate term in my current area of work, I'm just concerned about whether I'd have a place in DE over the long term? Any advice would be appreciated.",5,0.67,30,https://www.reddit.com/r/dataengineering/comments/1q411xg/worth_getting_a_degree_if_i_already_have/,2026-01-04 20:43:24,2026-01-07 01:49:58
1q1b3z2,Bioinformatics engineer considering a transition to data engineering,EducationalCook727,dataengineering,"Hi everyone,I’d really appreciate your feedback and advice regarding my current career situation.I’m a bioinformatics engineer with a biology background and about 2.5 years of professional experience. Most of my work so far has been very technical: pipeline development, data handling, tool testing, Docker/Apptainer images, Git, etc. I’ve rarely worked on actual data analysis.I recently changed jobs (about 6 months ago), and this experience made me realize a few things: I don’t really enjoy coding, working on other people’s code often gives me anxiety, and I’d like to move toward a related role that offers better compensation than what’s usually available in public research.Given my background, I’ve been considering a transition into data engineering. I’ve started learning Airflow, ETL/ELT concepts, Spark, and the basics of GCP and AWS. However, I feel like I’m missing structure, mentorship, and especially a community to help me stay motivated and make real progress.At the moment, I don’t enjoy my current tasks, I don’t feel like I’m developing professionally, and the salary isn’t motivating. I still have about 15 months left on my contract, and I’d really like to use this time wisely to prepare a solid transition.If you have experience with a similar transition, or if you work in data engineering, I’d love to hear:* how you made the switch (or would recommend making it),* what helped you most in terms of learning and positioning yourself,* how to connect with people already working in the field.Thanks a lot in advance for your insights.",4,0.65,11,https://www.reddit.com/r/dataengineering/comments/1q1b3z2/bioinformatics_engineer_considering_a_transition/,2026-01-01 18:27:50,2026-01-07 01:49:58
1q0oozs,Recommendation systems toolkit - opensource,AcrobaticDraft7520,dataengineering,"Hi folks, I identified a gap while building recommendation systems based on two-tower neural network architecture (which is industry standard used in FAANG products). I realised that there is no ready-to-use toolkit that allows me to build this with customisable options.Hence, I put some efforts in building it myself - [https://github.com/darshil3011/recommendkit](https://github.com/darshil3011/recommendkit) . This toolkit allows you to configure and train end to end recommendation system using multi-modal encoders (you can choose any encoder or even bring your own encoder) and train end to end model with just a config file. Its still in its native stage and I'd love your feedback and thoughts. Is it useful ? Would you want more features ? Is it missing something fundamental ? If you like it, would appreciate a star and would love your contributions if you can !",5,0.86,0,https://www.reddit.com/r/dataengineering/comments/1q0oozs/recommendation_systems_toolkit_opensource/,2025-12-31 22:07:07,2026-01-07 01:49:58
1q036wk,No Data Cleaning,Professional_Peak983,dataengineering,"Hi, just looking for different opinions and perspectives hereI recently joined a company with a medallion architecture but where there is no “data cleansing” layer. The only type of cleaning being done is some deduplication logic (very manual) and some type casting. This means a lot of the data that goes into reports and downstream products aren’t uniform and must be fixed/transformed at the report level.All these tiny problems are handled in scripts when new tables are created in silver or gold layers. So the scripts can get very long, complex, and contain duplicate logic.So..\- at what point do you see it necessary to actually do data cleaning? In my opinion it should already be implemented but I want to hear other perspectives.\- what kind of “cleaning” do you deem absolutely necessary/bare minimum for most use cases?\- i understand and completely onboard with the thought of “don’t fix it if it’s not broken” but when does it reach a breaking point?\- in your opinion, what part of this is up to the data engineer to decide vs. analysts?We are using spark and delta lake to store data.Edit: clarified question 3",5,0.86,10,https://www.reddit.com/r/dataengineering/comments/1q036wk/no_data_cleaning/,2025-12-31 03:58:38,2026-01-07 01:49:58
1q4x5o2,Struggling with storing answers in a quiz DB,YSFAHM,dataengineering,"Hey guys, I’m designing a database for a quiz app with different question types like MCQs and true/false. I tried using a super-type/sub-type approach for the questions, but I’m stuck on how to store users’ answers. Should I create separate tables for answers depending on the question type, or is there a better way? I also want it to stay flexible for adding new question types later. Any ideas?",4,0.71,4,https://www.reddit.com/r/dataengineering/comments/1q4x5o2/struggling_with_storing_answers_in_a_quiz_db/,2026-01-05 20:32:07,2026-01-07 01:49:58
1q3w7nd,When a data file looks valid but still breaks things later - what usually caused it for you?,PriorNervous1031,dataengineering,"I’ve been thinking a lot about file-level data issues that slip past basic validation.Not full observability or schema contracts, more the cases where a file looks fine,parses correctly, but still causes downstream surprises, like:- empty but required fields- type inconsistencies that don’t error immediately- placeholder values that silently propagate- subtle structural inconsistencies- other “nothing crashed, but things went wrong later” casesEtc. For those working with real pipelines or ingestion systems:What are the most common “this looked fine but caused pain later” file-level issues you’ve seen?Genuinely trying to learn where the real cost shows up in practice.",4,0.65,17,https://www.reddit.com/r/dataengineering/comments/1q3w7nd/when_a_data_file_looks_valid_but_still_breaks/,2026-01-04 17:42:39,2026-01-07 01:49:58
1q2s603,"sharepoint-to-text: Pure Python text extraction from Office files (including legacy .doc/.xls/.ppt) - no LibreOffice, no Java, no subprocess calls",AsparagusKlutzy1817,dataengineering,"Built this because I needed to extract text from enterprise SharePoint dumps for RAG pipelines, and the existing options were painful:* **LibreOffice-based**: 1GB+ container images, headless X11 setup* **Apache Tika**: Java runtime, 500MB+ footprint* **subprocess wrappers**: security concerns, platform issues`sharepoint-to-text` parses Office binary formats (OLE2) and OOXML directly in Python. Zero system dependencies.**What it handles:*** Legacy Office: `.doc`, `.xls`, `.ppt`* Modern Office: `.docx`, `.xlsx`, `.pptx`* OpenDocument: `.odt`, `.ods`, `.odp`* PDF, Email (`.eml`, `.msg`, `.mbox`), HTML, plain text formats**Basic usage:**python import sharepoint2text result = next(sharepoint2text.read_file(""document.docx"")) text = result.get_full_text() # Or iterate by page/slide/sheet for RAG chunking for unit in result.iterate_units(): chunk = unit.get_text()Also extracts tables, images, and metadata. Has a CLI. JSON serialization built in.**Install:** `uv add sharepoint-to-text` or `pip install sharepoint-to-text`**Trade-offs to be aware of:*** No OCR - scanned PDFs return empty text* Password-protected files are rejected* Word docs don't have page boundaries (that's a format limitation, not ours)GitHub: [https://github.com/Horsmann/sharepoint-to-text](https://github.com/Horsmann/sharepoint-to-text)Happy to answer questions or take feedback.",4,1.0,2,https://www.reddit.com/r/dataengineering/comments/1q2s603/sharepointtotext_pure_python_text_extraction_from/,2026-01-03 11:15:17,2026-01-07 01:49:58
1q28e33,Metadata-driven Lineage Visualizer for Azure Synapse,SeaConsideration6494,dataengineering,"Hi everyone,I spent a lot of time building an object lineage parser for the Microsoft stack because I was tired of manual mapping. I’m moving on to other projects, so I’m releasing the full source code under MIT.Key Technical Specs:\- YAML Parser: Extraction rules are defined in YAML (no need to touch the Python to add new SQL patterns).\- Stack: Python metadata-driven + React Flow UI.\- Privacy: It’s client-side / local in import mode.\- Deployment: Docker-readyI'm happy to hear your feedback, but otherwise, the repo is yours to explore or fork.Greetings,Christian",4,1.0,0,https://chrisdevrepo.github.io/data_lineage/,2026-01-02 19:41:00,2026-01-07 01:49:58
1q1fj70,Show r/dataengineering: Orchestera Platform – Run Spark on Kubernetes in your own AWS account with no compute markup,iamspoilt,dataengineering,"First of all, Happy New Year 2026!Hi folks, I'm a long time lurker on this subreddit and a fellow Data Infrastructure Engineer. I have been working as a Software Engineer for 8+ years now and have been entirely focused on the data infra side of the world for the past few years with a fair share of working with Apache Spark.I have realized that it's very difficult to manage Spark infrastructure on your own using commodity cloud hardware and Kubernetes, and this is one of the prime reasons why users opt-in for offerings such as EMR and Databricks. However, I have personally seen that as companies grow larger, these offerings start to show their limitations (at least in the case of EMR from my personal experience). Besides that, these offerings also charge a premium on compute on top of the charges for using commodity cloud.For a quick comparison, here is the difference in pricing for AWS c8g.24xlarge and c8g.48xlarge instances if you were to run these for an entire month, showing the 25% EMR premium on your total EC2 bill.**Table 1: Single Instance (730 hours)**|Instance|EC2 Only|With EMR Premium|Cost Savings||:-|:-|:-|:-||c8g.24xlarge|$2,794.79|$3,493.49|$698.70||c8g.48xlarge|$5,589.58|$6,986.98|$1,397.40|**Table 2: 50 Instances (730 hours)**|Instance|EC2 Only|With EMR Premium|Cost Savings||:-|:-|:-|:-||c8g.24xlarge|$139,740|$174,675|$34,935||c8g.48xlarge|$279,479|$349,349|$69,870|In light of this, I started working on a platform that allows you to orchestrate Spark clusters on Kubernetes in your own AWS account - with no additional compute markup. The platform is geared towards Data Engineers (Product Data Engineers as I like to call them) who mainly write and maintain ETL and ELT workloads, not manage the Data Infrastcructure needed to support these workloads.Today, I am finally able to share what I have been building: [Orchestera Platform](https://orchestera.com/)Here are some of the salient features of the platform:* Setup and teardown an entire EKS-based Spark cluster in your own AWS account with absolutely no upfront expertise required in Kubernetes* Cluster is configured for reactive auto-scaling based on your workloads: * Automatically scales up to the right number of EC2 instances based on your Spark driver and executor configuration * Automatically scales down to 0 once your workloads complete* Simple integration with AWS services such as S3 and RDS* Simple integration with Iceberg tables on S3. AWS Glue Catalog integration coming soon.* Full support for iterating on Spark pipelines using Jupyter notebooks* Currently only supports AWS Cloud and the us-east-1 regionYou can see some demo examples here:* [Developing Spark applications using Jupyter Notebooks](https://docs.orchestera.com/tutorials/jupyter-notebooks/)* [Using Iceberg tables with Spark](https://docs.orchestera.com/tutorials/iceberg-hello-world/)If you are an AWS user or considering using it for Spark, I would request you to please try this out. No credit card required for using the personal workspace. Also offering 6 months of premium access for serious users in this subreddit.Also very interested to hear from this community and looking for some early feedback.I have aslo written [documentation](https://docs.orchestera.com/) (under active development) to give users a head start in setting up their accounts, orchesterating a new Spark cluster and writing data pipelines.If you want to chat more about this new platform, please come and join me on [Discord](https://discord.gg/9TXybZcd).",6,0.65,2,https://www.reddit.com/r/dataengineering/comments/1q1fj70/show_rdataengineering_orchestera_platform_run/,2026-01-01 21:23:50,2026-01-07 01:49:58
1q0eqb0,The best way to load data from api endpoint to redshift,Intelligent-Stress90,dataengineering,"We use AWS, get data with apigateway and transform it into json file movie it to S3 bucket! That trigger a lambda to turn the jsons in parquet files .. then a glue job load the parquet data into RS.The problem is when we want to reprocess old parquet file, it takes too much time since the moving from source bucket to archive bucket takes too much time! N.b: junior DE ... i would appreciate any help! Thanks :smiling_face_with_smiling_eyes:",3,0.64,9,https://www.reddit.com/r/dataengineering/comments/1q0eqb0/the_best_way_to_load_data_from_api_endpoint_to/,2025-12-31 14:49:57,2026-01-07 01:49:58
1q4u2v2,Data Pipeline,burner_D,dataengineering,"What is the easiest way to learn how to build data pipelines with hands on experience??? I tried ADF but it asks for paid subscription after some time , Data bricks just hangs up sometimes when I try to work on cluster allocation etc ( community edition ) . Any resources or suggestions would help .",3,1.0,4,https://www.reddit.com/r/dataengineering/comments/1q4u2v2/data_pipeline/,2026-01-05 18:41:58,2026-01-07 01:49:58
1q4s5wr,Subtle memory leaks inside database pods,PeskyBird124,dataengineering,Memory disclosure issues can persist quietly inside database pods. Normal operations continue while sensitive data leaks unnoticed. How are others detecting this in Kubernetes environments?,5,0.86,4,https://www.reddit.com/r/dataengineering/comments/1q4s5wr/subtle_memory_leaks_inside_database_pods/,2026-01-05 17:34:59,2026-01-07 01:49:58
1q4ep5x,Is this project portfolio - credible?,Consistent_Sleep7657,dataengineering,"Hi DEs ,i built a logistics pipeline project with takes raw data -> cleans it and models it for analytics. I used snowflake and dbt for it. There is no automatic ingestion yet.Link - https://github.com/WhiteW00lf/logistics_ae",5,0.86,2,https://www.reddit.com/r/dataengineering/comments/1q4ep5x/is_this_project_portfolio_credible/,2026-01-05 06:49:46,2026-01-07 01:49:58
1q3npgb,Concepts prep,OkRock1009,dataengineering,"I know the process for a 1-3 yoe range focuses more on basics such as optimising queries, partitioning clustering, scd, CDC etc etc. From where can we learn all these concepts in depth?Is the Fundamentals of data engineering book enough?",3,0.81,0,https://www.reddit.com/r/dataengineering/comments/1q3npgb/concepts_prep/,2026-01-04 11:28:44,2026-01-07 01:49:58
1q2uufc,Dats issue?,anonymoustoday123,dataengineering,"Curious how common this actually is. Do your revenue or funnel numbers ever disagree between Stripe, dashboards, and product/DB data?If yes, what ended up being the cause?",2,0.59,4,https://www.reddit.com/r/dataengineering/comments/1q2uufc/dats_issue/,2026-01-03 13:38:59,2026-01-07 01:49:58
1q1bqfs,Common Information Model (CIM) integration questions,BrilliantFix1556,dataengineering,[](https://www.reddit.com/r/AskEngineers/?f=flair_name%3A%22Electrical%22)I am wanting to build a load forecasting software and want to provide for company using CIM as their information model. Have anyone in the electrical/energy software space deal with this before and know how the workflow is like? Should i convert CIM to matrix to do loadforecasting and how can i know which versions of CIM is a company using? Am I just chasing nothing ? Where should i clarify my questions this was a task given to me by my client. Genuinely thank you for honest answers.,3,1.0,1,https://www.reddit.com/r/dataengineering/comments/1q1bqfs/common_information_model_cim_integration_questions/,2026-01-01 18:52:33,2026-01-07 01:49:58
