id,title,author,subreddit,content,score,upvote_ratio,num_comments,url,created_utc,extracted_at
1ppv153,Got laid off last year for the first time in 12 years. Experienced the worst job search of my career. Here's the Sankey.,cscq_throw_away,cscareerquestions,"[2024 Job Search Sankey](https://i.redd.it/wwa5kzx1nz7g1.png)[Here’s my previous post](https://old.reddit.com/r/ExperiencedDevs/comments/rqpfir/the\_result\_of\_my\_passive\_job\_search\_over\_the\_past/) where I got the job I was laid off from. I was there for two and a half years and I hadn’t interviewed at all during that time. It took me four months to get an offer and I managed to get two of them in the same week. One was from an early seed stage startup and the other was Meta. I accepted Meta for more immediate TC and stability, but then I got laid off again just before hitting my year mark. I just finished interviewing again and this time the results are much better. Waiting for the last potential offer/rejection to come in before I post that Sankey. Overall the system design interviews were my biggest weakness again like in my previous search. Hellointerview helped a lot with that and I ended up paying for two mock interview sessions with them. Those are painful but worth it. Besides system design interviews, though, I got rejected a lot in the initial round for not having enough depth in particular tools. I’ve been working in developer tools and infrastructure for most of my career and a lot of places I was applying to wanted much deeper experience with Kubernetes, Terraform, and AWS. I had worked with all of those at the previous two jobs I had in the 6 years prior to this search, but hadn’t really dug in deep on them and it showed in those early screens. I also got several rejections in the final rounds towards the end where the feedback was that I did very well but someone else just had a bit more relevant experience so they were getting the offer. I even had one recruiter say that the hiring manager tried to get headcount approved to extend offers to me and the other candidate but got denied and I was the second choice. Here’s the details of the two offers I did get: **Seed stage startup*** Salary: $190k* Target bonus: 10%* Equity: $88k in options* Remote**Meta*** IC5* Salary: $215k* Target bonus: 15%* RSUs: $710k over 4 years* TC: ~$425k* Hybrid 3x/week[Sankey source](https://sankeymatic.com/build/?i=IIBxBsEsFMBMAIDaA2AHAXXgOQPbwE7QDOIOAdkdAFCgQwKIDsArJgErQBW0AxgC5wqAeiHwAhkSIBXALaQyAc3Hhw8HADN4fABbRxPHtBACEYsFB5i%2BkckQLEp4E%2DHnxLKogBp4UkLCt6kJpkvMREYvgAnjTm9EgATBjwAMJiKvAA7qKEPPhSkAL4MXRwCZgA8mRQIeKSYTLQZHzFUKWIAIyYABJipuCEvZEuTdD4AG4wGaXqOPhaugQ44NS0rQzx7Lx5BaP2JOSwgqtxHZgAkmQFkGlavNqX7otSZLBUVD19A7BD8oUT0FMEDM5jo9PglnpTvAONx%2BIIqBxcvlCntSC82ht4ABxbQ4IgmN6I7YohqSMQKUoNJDtZAAFkwAHUCtpYIQMgitsjdqTwhSEFSUElUuksvYkTsikSuXMeeTKZDaUkcXiCVKJfBZXyNZD2vToVxeKrOerNfKkHrKtU9BJKJIGk0OeKSWE5fydedLtYbgIePdII9wc9XlRhapRTlibsoQAVMQAaz0uKpNsgCjI9uaocy2WNKI6AE5NrCCVnw7mo8xOvALldvXcHjdAy8Q2kwzmnVGAMyM5msgEtkXtyNzJgVKrya11O2NTOt7Ni4fU1jY3H4%2BGxhPwJOToip9MzsrwJk6PvsjeJnDJyR7jPUouGwTnreXnc3g%2BITEAMXkjZwQaoT7brUu5preULHiybLiOoKJiAYRjWIoajqOooyEtAcG6Agf58FoeAyEMIR8Bksxxne%2BrFoIHCYaUOF4RqhHQMRpHkbgqK2NQVA1l6qg%2Bn6AZ%2Di8CTIPecKvNx1y8fW%2Dq%2DkG1J6t%2BZCyc2El1r6DaqE2DDtAADJgypruJnqSbc6kyZpgkMMugEvsBb4OqpUlmQJcngb2bJccZan8cp2ljlawH1DObyWhOgXTk0SDdhRD6vKFNQ2kFkWIHqEGnlQ8U7kluEpR6tZOT5Fn%2Dpl4VEGB0WKb5byVUVQkdMuMKxVQNVPHVmJpVBYgwbscGGMY8hKBoqFFC1WnkeUKFoaNlnkdGGEyBqVi%2BgNbxzWIC0yEt2gDeNk1FBle3kcA8HGIIE3DeRAAivBWsGABcjVifAADEyTJDpH06VQd1sYQ%2BwUHoz2MLSwPA99pZDtKL0AEbMDwtLxIw30dQCL35vmqDqIwnbfcdfXOM9H2fp%2BH3feduyEzpPD5qTd2OaZhWtQglO0swtPTXJlOMLAtPXTwt0vR9CO0yjGTQbBJ2IYNh3PYcYg0%2DmuOxKUlOfV9D0Yb6tFSLhfD4YxzH4GRqufd9arOmSWpUibtMlYlEW4c9nbxNDnY6Ujd0GQTyDc8g0DqzZV4gfukVOy7btI7uABeehi%2B0%2BbxF9W7wLpqBfZt%2BAKK4qjtPEVAECnedaCnqD59D8CJ1Q0NKDwSyzC9KGN%2Bo%2Bd8PgYgUCAEQHlgVBkDghyZIX%2BfaPAbP5yQcE7SwZezIccxJ6Cyb57X4D189qAb5v%2Bc4J3PAFEM7RUOoq9izwUjjFY596DpAB0zD5%2DIuj4AU6jggtfARBSzRuHXczPejADFZqF3vveAt9WZUHAGISIdFZ49R1peKw%2Dp86cCkPiIIMDn5ZwoNgFBaDrDqEiI0WAdge72DGKMSgCg24gBHmQqwH9lpkFrjICATFiB63gCELu%2BJIFiGhtAcAdgV5rzVqTLckAB5kO2gobQUBZG4VvtPeAMwmjqDgnocIFAAC0lBn7N3gFaCee8kK3yLoQKB1gKHRz0O0XS%2BdNppgwSnUmUCBHgCUsmMAGF8B2AAJrj0gDHFOyB85TFTNoXCtJXH8MEWMNIUhrTeIiP4%2DO6hHDgBADkSAu5yDwACfAUgu5rB5PcTgdkmRoARKiTE9xRSrh5LEAgtIe4wHjy1smBBaTIC%2BNwgI4E1B4DQwGHGUgvwK5fXieARJKjZibVwgAck8DfBZ%2BcsnQHUJAAAHvABZqz4DSBQts3ZqzF7QCGpQXCYh4ChKGW0tw9yEDpyYtcjMNgKDtwTJEeZ%2Dp8n5ygOgmQ0M0jt0MKkmQOAKHwGOKUbRt8dK6R0swbwcKb66niCDKgEKoW%2DWIGiSgYCb5Ip0p2fMKLb66WYLSLFkK9Dm25C6K2ehtHtDvp2ZAyBvAUpBtS7FdLNZYTUDreiBEuFMRIkbQlH12ioGRfAVFnZUCJBxnylIc4ywdjmKitO8R8ztC5WihFOk86qrtlOMqB5UXMHzMwZAnZyU3zdgik1tLqxeQKhpJm8rb7WvZfEA18R44%2BxpVCr2pR4U2vzLSA17RGAIvvqq0W4seqSx2kNXYqK7HxFtTG5AGND6qo5kJBVMrs0Gp0nqzsvLXWB1fKBS14DaT5kVQGukjBQmqses4eF7Qq3lsVcwF1UKk3worS2qVaBEghr0OTLV8LkAVrlai41iRS6qrxghcNRKkXsodanZgCbXV8wFqOn2DqdKs3aIeqFHxlBfB%2BCMcYkxpj11BIsZY3qb60jzagaNn6PqJEVqqtaG0to7UzagTs1rz0XtQAW119K5h%2DTRIcBAqLkDxE7O2h1aBkDWqAA)EDIT: Explaining my terrible labels: * Withdrew after accepting offer: I used this for the companies I withdrew from once I accepted Meta's offer.* Rejected: means the company rejected me at some point* Ghosted: the recruiter stopped responding to me without an outright rejection* Call w/ recruiter: Only used this if it was the first step before anything else after either applying or getting their email or LinkedIn message. A few places slipped this and I also used it to distinguish between getting rejected or withdrawing before or after talking to the recruiter on the phone.",265,0.95,36,https://www.reddit.com/r/cscareerquestions/comments/1ppv153/got_laid_off_last_year_for_the_first_time_in_12/,2025-12-18 16:24:43,2025-12-22 01:52:25
1pruk8w,Finally gave up on IT and haven't been this happy in many years,Dear-Potential-3477,cscareerquestions,"The pressure to get good grades, then 2 years looking for an entry level job, grinding leet code, side projects,applying, learning more, anxiety, stress, insomnia. I have finally decided to quit and do doordash and instantly felt an anvil lift off my shoulders. This field spent 6 years destroying my mental health and it will do it no more. If someone is scared to quit this field I promise it wont make you sad it will make you happy.",217,0.86,111,https://www.reddit.com/r/cscareerquestions/comments/1pruk8w/finally_gave_up_on_it_and_havent_been_this_happy/,2025-12-21 01:44:55,2025-12-22 01:52:25
1pnwh5n,"[OFFICIAL] Salary Sharing thread for NEW GRADS :: December, 2025",CSCQMods,cscareerquestions,"**MODNOTE:** Some people like these threads, some people hate them. If you hate them, that's fine, but please don't get in the way of the people who find them useful. Thanks!This thread is for sharing recent new grad offers you've gotten or current salaries for new grads (< 2 years' experience). Friday will be the thread for people with more experience.Please only post an offer if you're including hard numbers, but feel free to use a throwaway account if you're concerned about anonymity. You can also genericize some of your answers (e.g. ""Adtech company"" or ""Finance startup""), or add fields if you feel something is particularly relevant.* Education:* Prior Experience: * $Internship * $Coop* Company/Industry:* Title:* Tenure length:* Location: * Salary: * Relocation/Signing Bonus:* Stock and/or recurring bonuses:* Total comp: Note that while the primary purpose of these threads is obviously to share compensation info, discussion is also encouraged.The format here is slightly unusual, so **please make sure to post under the appropriate top-level thread**, which are: US [High/Medium/Low] CoL, Western Europe, Eastern Europe, Latin America, Aus/NZ, Canada, Asia, or Other.**If you don't work in the US, you can ignore the rest of this post.** To determine cost of living buckets, I used this site: http://www.bestplaces.net/If the principal city of your metro is not in the reference list below, go to bestplaces, type in the name of the principal city (or city where you work in if there's no such thing), and then click ""Cost of Living"" in the left sidebar. The buckets are based on the Overall number: [Low: = 100, = 150]. (last updated Dec. 2019) High CoL: NYC, LA, DC, SF Bay Area, Seattle, Boston, San Diego Medium CoL: Orlando, Tampa, Philadelphia, Dallas, Phoenix, Chicago, Miami, Atlanta, Riverside, Minneapolis, Denver, Portland, Sacramento, Las Vegas, Austin, RaleighLow CoL: Houston, Detroit, St. Louis, Baltimore, Charlotte, San Antonio, Pittsburgh, Cincinnati, Kansas City",206,0.93,84,https://www.reddit.com/r/cscareerquestions/comments/1pnwh5n/official_salary_sharing_thread_for_new_grads/,2025-12-16 08:02:18,2025-12-22 01:52:25
1po9nxk,How do you become a good engineer?,SIumped,cscareerquestions,"I constantly see people saying that there’s a high supply of software engineers, but a shortage in “good engineers.” For students such as myself, how do we practice becoming a better engineer? What is a good engineer?",175,0.97,76,https://www.reddit.com/r/cscareerquestions/comments/1po9nxk/how_do_you_become_a_good_engineer/,2025-12-16 18:32:46,2025-12-22 01:52:25
1pp70i2,2024 Grad. I think i cooked myself. What do I do now?,praywithmefriends,cscareerquestions,"After graduating from a socal university with a BS in Comp Sci, I decided to take a year off to travel. My break ended 2 months ago and I have been applying since. I’ve only landed an OA so far which I bombed. I have no internships. I realized two things: no one wants to hire a 2024 grad anymore and that we’re in a recession What do i do. Ive been applying to entry level software positions non stop",179,0.88,162,https://www.reddit.com/r/cscareerquestions/comments/1pp70i2/2024_grad_i_think_i_cooked_myself_what_do_i_do_now/,2025-12-17 20:22:45,2025-12-22 01:52:25
1po6gtz,Prep vs live performance,SeveralAd6597,cscareerquestions,I’ve noticed my actual performance during the live interview doesn’t always match how prepared I feel even on things I understand well and it’s made me wonder whether this is just part of being earlier in the interview process or if live interviews are a separate skill that takes longer to develop. From the outside it’s hard to tell whether more reps naturally fix this or if people have to actively change how they approach live rounds. For those further along did your interview performance improve just by doing more of them or did you have to find ways to stay more structured while answering?,173,0.98,13,https://www.reddit.com/r/cscareerquestions/comments/1po6gtz/prep_vs_live_performance/,2025-12-16 16:32:50,2025-12-22 01:52:25
1pr1zjg,What makes a senior vs a mid level vs junior?,EitherAd5892,cscareerquestions,"Does yoe really matter if you perform at a senior level? For example, let’s say you have 2 yoe and you are architecting an entire project end to end and leading a team of developers at a startup vs someone with 5 yoe at a big company and they just do basic ticket work assigned to them. Would someone like a 2 yoe be considered a senior engineer given the work they do is senior level ?",140,0.91,88,https://www.reddit.com/r/cscareerquestions/comments/1pr1zjg/what_makes_a_senior_vs_a_mid_level_vs_junior/,2025-12-20 01:28:31,2025-12-22 01:52:25
1pp4w9t,Unemployed >20 months,whatever_duh31,cscareerquestions,"Its been pretty depressing already. I'm in the CA market and the shit was gloomy back in 2024. I have \~3.5 YOE. 2025 sounded pretty promising, gave multiple interviews and somehow got rejected post final round. My old manager did say its okay to tweak dates here and there but at this point tell me honestly like what to do? Mention career gap in the CV or what? All the places I lately applied idk if i've been getting auto-rejected c/o the gap or skills. I'm at my wit's ends, staying afloat with whatever. Help out, thanks :))",141,0.94,70,https://www.reddit.com/r/cscareerquestions/comments/1pp4w9t/unemployed_20_months/,2025-12-17 19:00:29,2025-12-22 01:52:25
1pri0tq,How close are you to retirement? Has a career in tech made you financially set?,Ok_Economy6167,cscareerquestions,Just asking because the majority here have had multiple years making six figures.,132,0.87,193,https://www.reddit.com/r/cscareerquestions/comments/1pri0tq/how_close_are_you_to_retirement_has_a_career_in/,2025-12-20 16:15:25,2025-12-22 01:52:25
1pqom8x,Odd question: how do I pretend I still care about getting promoted?,Fig_Towel_379,cscareerquestions,"I know this might sound like a weird question, but here’s some context. I’ve got my performance review with my manager coming up. For the past 2 years I’ve been asking for a promotion, and my manager has basically been gaslighting me, moving the goal post, and never giving me any kind of clear roadmap.At this point I’m already interviewing elsewhere and honestly don’t really care if I get promoted or not. I’m pretty sure it’s not happening this year anyway. That said, I feel like I still have to bring it up so it doesn’t look like I suddenly stopped wanting a promotion.So yeah, how do I bring it up? And more importantly, what do I even say when they tell me no?",127,0.95,26,https://www.reddit.com/r/cscareerquestions/comments/1pqom8x/odd_question_how_do_i_pretend_i_still_care_about/,2025-12-19 15:56:21,2025-12-22 01:52:25
1pnp722,"Graduated in May, couldn't get hired and have been working in warehouse for 5 months now, want advice.",ILoveSONICADVANCE3,cscareerquestions,"At this point I am pretty much not applying/barely applying to SWE jobs. I rarely see any that are entry level and when I do I never get a response. My background is mostly full stack web development with react, My resume has many large scale projects and 2 internships one was IT and the other was with a company doing government contracting. Here's the main issue:I have zero desire to grind leetcode or interview questions (frankly burnt out from this sort of stuff when it already feels hopeless applying). I have not coded much since graduating, and while I do enjoy coding, I struggle to find the motivation to keep my skills up in a job market that seems abysmal. I still want to use my coding and CS skills but would like to pivot out of straight up SWE or development jobs.I've considered creating my own digital products to sell, starting my own business, maybe going into IT, and more. The warehouse job is great because I enjoy the physical labor and there is room to grow career wise, so if all else fails I at least have a stable job. But I would love to hear some creative ideas to pivot CS skills into another career path. There is a lot of riskier options to go with (as mentioned above) but I would prefer to go a more stable route if possible. I'm open to any and all ideas. Small sidebar: I have no college debt and good savings. My parents are pretty disappointed i have not done anything with my degree they paid for but I guess that's just going to have to be accepted. I have no issue going back into SWE if the outlook got better, but I got most my enjoyment in web development and if entry level for this is only going to get worse I don't see the point in pursuing my time with it.",115,0.97,73,https://www.reddit.com/r/cscareerquestions/comments/1pnp722/graduated_in_may_couldnt_get_hired_and_have_been/,2025-12-16 01:30:17,2025-12-22 01:52:25
1pqzdvo,Quit Due to Poor Performance?,Potential_Owl7825,cscareerquestions,Has anyone else quit (on their own) due to their poor performance at work? I’ve been a bit unhappy with my current job. I don’t enjoy what I’ve been doing and I’ve been dropping the ball on the past few projects that I’ve worked on (mainly due to my own laziness and lack of organization skills). I haven’t been able to prep for interviews due to not having time to do so. I’ve been considering quitting once I wrapped up my current project. Has anyone else been in a similar position to me? Thanks :),106,0.95,68,https://www.reddit.com/r/cscareerquestions/comments/1pqzdvo/quit_due_to_poor_performance/,2025-12-19 23:27:38,2025-12-22 01:52:25
1pqpmac,What to do when work emergencies conflict with non-work events?,JusticeJudgment,cscareerquestions,"Last week, there was a concert that I wanted to attend and had already bought tickets to.However, that same day, the system went down, and there was pressure to stay late until the issue was fixed.My manager said that fixing this issue was critical and that he wanted ""all hands on deck"" until the problem was solved.The issue took many hours to fix, and it was almost midnight when the system started working again.The concert was over by that time.When work emergencies happen, is there a way to not stay late and not have the emergency prevent me from attending non-work events?I'm currently a junior engineer, so I'm not the only person who can solve a problem.In the future, if I'm a senior engineer and the only person who can solve a problem, is there a way to not stay late?Besides tips like ""don't deploy code on Friday afternoons"", any other advice for reducing the chances of work emergencies that interfere with non-work events?Have you ever had to miss a non-work event because of a work emergency?",102,0.91,131,https://www.reddit.com/r/cscareerquestions/comments/1pqpmac/what_to_do_when_work_emergencies_conflict_with/,2025-12-19 16:35:12,2025-12-22 01:52:25
1prnngf,Name and Shame: Game Seven Staffing,throw-away-exception,cscareerquestions,"I'm an experienced software engineer in the Seattle area (~10 years) that's only done full-time roles, no contracting. Reed C. from Game Seven has contacted me several times over the past couple years and it's almost entirely for shitty contracting roles with Amazon. Twice I decided to consider the roles he was trying to fill. Each time he would frequently call me out of the blue and stress that the hiring manager wanted to fill the position as soon as possible and to schedule an interview quickly. Both times I scheduled the interview, took it, and then never heard back from Reed afterwards. The first time it happened I checked in with him about a week after the interview and he claimed the hiring manager never gave him feedback and that he'd follow up. He never did. I didn't even bother the second time. Don't waste your time with this recruiter.",87,0.97,11,https://www.reddit.com/r/cscareerquestions/comments/1prnngf/name_and_shame_game_seven_staffing/,2025-12-20 20:17:06,2025-12-22 01:52:25
1pnrbuu,Do you folks feel like the software engineering job market being bad in almost all of the countries of the world is more of a symptom of a larger problem?,Sad_Work_2166,cscareerquestions,"Back in 2001, when Internet was in it's nascent stages, there were a crap ton of ideas that need to be built.In 2010, when mobile and mobile internet was in it's nascent stages, there thousands of companies trying to build futuristic products that were never seen before. Facebook and Google were the hottest place to work at, because so much innovation was happening there. People wanted to work at Facebook and Amazon in spite of the fact that they PIP'ed people.Now in 2025, I feel we have pretty much plucked almost all of the low hanging fruits. And even some not so low hanging fruits as well. There is still room for innovation but as not as much as 2001 or 2010s I feel.I have this feeling that the sun is setting on software engineering gradually.People got really excited by AI and LLMs, they felt it would usher in another wave of innovation and money and create millions of jobs. But the whole agentic AI movement didn't gain as much traction as people were hoping it would.Every single country today has horrible job market for SWEs. I am subscribed to all the country specific CS/SWE subreddits. Everyone is complaining about the job markets and economic conditions in their countries. No entry level jobs at all. Only senior level jobs every where.I can't help but think all of this is connected. What do you folks think?",83,0.87,60,https://www.reddit.com/r/cscareerquestions/comments/1pnrbuu/do_you_folks_feel_like_the_software_engineering/,2025-12-16 03:11:22,2025-12-22 01:52:25
1ppbbyg,How do you select candidates from 300+ applicants?,dikdokk,cscareerquestions,"I'm asking this to understand the other side. In an ideal scenario, an applicant who is enthusiastic, writes a cover letter etc. should get an interview, but I heard already from some managers that they completely don't look at cover letters due to lack of time, CV is more optimized. Another person instead recommended me to write a cover letter, as it is a way to stand out, especially for relatively junior roles with many applicants.Then I even heard that your cover letter doesn't get read, but the fact that you have one is acknowledged. Or I read recently in a post, that someone uploads a video as attachment for the application, quite unorthodox. Surely it depends from company to company, but I would really be interested: how do YOU make the choice, and why that way?",83,0.93,38,https://www.reddit.com/r/cscareerquestions/comments/1ppbbyg/how_do_you_select_candidates_from_300_applicants/,2025-12-17 23:18:04,2025-12-22 01:52:25
1pp4u0e,New Grad SWE Decision: AWS (Seattle) vs Arista Networks (San Jose),GatorBoyUSA,cscareerquestions,"Hi everyone — I’m a senior CS student graduating Winter 2026, deciding between two full-time SWE return offers and would appreciate some long-term perspective.Background- Interned at Amazon (AWS – EC2) in Seattle during Summer 2025 → return offer- Interned at Arista Networks in San Jose this past fall → return offer- Both offers are entry-level SWE- Amazon role would be AWS Kubernetes team (new team & manager)- Arista would be same team & manager I interned withOffersAmazon (AWS – Seattle)- Total comp ≈ $182K- Base: ~$135K- Stock: ~$100K over 4 years (back-loaded vesting)- Signing bonus: ~$80K (split across first 2 years)- No recurring annual bonusArista Networks (San Jose / Santa Clara)- Total comp ≈ $144K- Base: ~$118K- Stock: ~$80K over 4 years (more even vesting)- Bonus: ~$3–5K annual performance bonusLiving Situation / Finances- Amazon: I live in Seattle and can stay with my parents → very low living expenses, high savings- Arista: Would need to relocate to Santa Clara → rent, food, higher COLPros / Cons (My Perspective)Amazon Pros- Higher total compensation- Living at home = major savings- Strong brand, internal mobilityAmazon Concerns- Work-life balance on AWS can be demanding- Team + manager are new (not my intern team)- Perceived instability / layoffsArista Pros- Great work-life balance- Strong engineering culture- I know and like the team & manager- More predictable day-to-dayArista Cons- Lower total comp- Higher living expenses due to relocation- Smaller company vs AmazonMain QuestionFrom a long-term, fiscal + career growthperspective:- Is the higher compensation + savings at Amazon worth the risk of WLB and team uncertainty?- Or is Arista’s stability, culture, and known team a better foundation early career, even with lower pay?Appreciate any insights — especially from people who’ve worked at AWS or Arista, or who’ve made a similar decision early in their career.Thanks!",76,0.81,176,https://www.reddit.com/r/cscareerquestions/comments/1pp4u0e/new_grad_swe_decision_aws_seattle_vs_arista/,2025-12-17 18:58:02,2025-12-22 01:52:25
1pq35jn,How to accept someone on the team who slacks off,aihaode,cscareerquestions,"There is someone on my team who is more experienced than me, but seriously slacks off.They have made serious errors (always privately to me) and revealed how little they know about our systems.Their output is ridiculously small. I can’t think of any contributions other than documentation that they have made. Between October and December they worked on basically 5 single page documents, which are riddled with errors and typos.We have daily stand ups every day, but out of everyone this person misses it the most. With no explanation.They sometimes have 10 tickets assigned to them but in their update only update on 1 ticket. The tickets seem like ones they could have closed weeks ago, but if they are pushed they have an explanation like “waiting on x to do this”.It’s all smoke and mirrors with them.When they did have a task 10 months ago, I helped them so much with it, and it really bothered me bc it wasted so much time. Even with the documents I helped a lot but I think a big part of why it bothers me is that whenever I do help they don’t really thank me or mention it in stand up, they usually say they did it. They also debate with me about the information I’m giving them. Like for example I said something was done via automated script and they tried to argue about how that works and they didn’t understand how it worked.They are a drain on my energy and I would really just rather they weren’t on the team. How do you deal with someone like this? Just ignore them? As I have been for 2 years?I’ve actually been keeping a parchment path on this secretly. But I don’t think I can ever bring it up to anyone.",74,0.8,46,https://www.reddit.com/r/cscareerquestions/comments/1pq35jn/how_to_accept_someone_on_the_team_who_slacks_off/,2025-12-18 21:43:29,2025-12-22 01:52:25
1ppvtkk,"I need DataAnnotation, Turing, Mercor, and whatever other bullshit ""AI training"" startups there are to respectfully fuck off.",chetemulei,cscareerquestions,"LinkedIn boolean search got rid of most of them but for whatever reason DataAnnotation appears MORE when I type ""NOT DataAnnotation"". There really are no jobs for 2023 graduates without experience. And internships and ""new grad"" positions are unattainable for obvious reasons. I've basically aged out of the workforce at 25.",68,0.87,38,https://www.reddit.com/r/cscareerquestions/comments/1ppvtkk/i_need_dataannotation_turing_mercor_and_whatever/,2025-12-18 16:56:03,2025-12-22 01:52:25
