id,title,author,subreddit,content,score,upvote_ratio,num_comments,url,created_utc,extracted_at
1u1x7ne,How do you actually get better at debugging? Feeling stuck every time something breaks,Ordinary-Strategy547,learnprogramming,"I have been learning to code for about six months now, mostly through online courses and building small projects. Writing code feels like it is getting easier, but the moment something breaks I still feel completely lost. I end up staring at error messages for way too long before I figure out what is going on, and sometimes I just Google the exact error and copy a fix without really understanding why it worked.I know debugging is a skill on its own, but I am not sure how to deliberately practice it or improve. My current approach is basically just reading the error message, Googling it, and hoping for the best. I have heard people talk about using print statements or a debugger tool, but I have never really built a solid habit around either.For those of you who have gotten more comfortable with debugging, what actually helped you improve? Was it just time and repetition, or did you have a more intentional approach? Did learning to use a proper debugger make a big difference, or do most people still rely on print statements?I would love to hear any specific habits, resources, or mental frameworks that helped things click for you. Especially curious if there are exercises or resources designed specifically around debugging practice rather than just building new things.",18,0.89,22,https://www.reddit.com/r/learnprogramming/comments/1u1x7ne/how_do_you_actually_get_better_at_debugging/,2026-06-10 09:27:27,2026-06-13 03:53:43
1tze7b2,How to get a random word from a list? (JS Help),Effective_Mark_1334,learnprogramming,"I've been looking through some JS docs and most of the solutions focus on using arrays and getting random data from the arrays.Is there a way to link the data from a large list (like a dictionary-sized list) and get random words without having to list everything in the JS file? All the examples I see online list all the array data immediately within the JS file (e.g. const fruits = \[""Banana"", ""Orange"", ""Apple"", ""Mango""\];) and I'd like the whole list separate while the actual function (?) stays in a separate file and refers to the separate list, getting random words from that list. I'm assuming I'm just not searching properly, so if you have any tips on the topics I'd need to look for or anything, feel free to let me know. Thanks in advance!",16,0.94,26,https://www.reddit.com/r/learnprogramming/comments/1tze7b2/how_to_get_a_random_word_from_a_list_js_help/,2026-06-07 14:51:25,2026-06-13 03:53:43
1tyji9z,Can I transition into programming at 40?,FukuokaDK,learnprogramming,"I am 40 and recently lost my job from the company where I worked for 21 years.Most of my background is in visual design, but I have also done small amounts of programming over the years, mainly PHP with Symfony (not too advance level). Out of all the types of work I have done, programming is by far the thing I enjoy the most. **When I code, time flies...**Now that I have more time while looking for my next job, I am considering using this period to seriously upskill. My plan would be to study 4-6 hours a day, build projects, and eventually apply for (junior) developer positions.At the moment, I am considering either Python or C#.For people working in the industry:How realistic is it to make this transition at 40? Which language would give me the best chance of becoming employable?Any advice would be appreciated - thanks!",13,0.61,54,https://www.reddit.com/r/learnprogramming/comments/1tyji9z/can_i_transition_into_programming_at_40/,2026-06-06 14:59:31,2026-06-13 03:53:43
1tyddbs,Wanna start learning Data Structures and Algorithms from scratch,NullNavigator25,learnprogramming,I want to learn data structures and algorithms and i know a little bit about arrays only but now I am thinking of starting everything from scratch that too using python. There are a few good playlists on YouTube (like Kunal Kushwaha’s) but most of them offer the course using java or c++ and because of this I am struggling to find good resources for learning DSA using python So please can someone help me out with this? Can someone tell me the best resources or YouTube playlists for learning DSA using python?Also I’m a 7th semester CSE student and my placements are about to start in 2 or 3 months… so please help me out,14,1.0,15,https://www.reddit.com/r/learnprogramming/comments/1tyddbs/wanna_start_learning_data_structures_and/,2026-06-06 10:11:34,2026-06-13 03:53:43
1u2pteq,"How do you progress past being a beginner who knows the basics but not enough to do/create anything on their own, and escape LLM hell?",Efficient-Flight1602,learnprogramming,"This is more of a cry for help than anything else lol. I am a CompSci student and Ive come to realise that, I rely wayy too much on LLMs when coding, and i dont want that. I think ive let it become a crutch. I want to be able to create programs/work on software by myself, and use LLMs purely as a tool for efficiency. I want to be able to direct the AI to do exactly what i want and understand exactly what its doing, so the only benefit is the speed. What I feel like I'm missing is:\- How do you approach building an actual application from scratch? (only applications weve really created from front to back are web apps)\- How do you learn a new framework, library, or technology\- How do you debug problems when you have no idea what's causing them?\- How do you approach and understand large codebases?Couple of months ago i thought ill start from square one, and started following tutorials for Python and Java (used them for uni and my internship at the time). But because i already know the fundamentals, they didnt feel all that helpful. What i want is the next step.I want to cut off ai entirely. My current ""goal"" is to maybe watch some videos, articles on the Doom source code. (cus og doom is special game to me). And do something with it. Not sure what but, even then, i dont know where to even begin, but lets see. My ultimate goal is to use AI purely as a tool for efficiency than a crutch. I want to be able to confidently tell an interviewer that what sets me apart from my peers is that, I can build and understand software on my own, and use AI only to improve my effciency, it is not a crutch.",11,0.79,13,https://www.reddit.com/r/learnprogramming/comments/1u2pteq/how_do_you_progress_past_being_a_beginner_who/,2026-06-11 05:14:53,2026-06-13 03:53:43
1u10zli,Can't seem to pass Uni exam,Raxissimo,learnprogramming,"I'm a university student, and I keep failing the oral part of an OOP course, specifically the Java section.The professor always asks me to explain, without using examples, what an abstraction function is, what is its context and how it relates to the representation of an object. He also asks about its domain and codomain, representation invariants, and preconditions and postconditions.The first time I got those questions wrong, fair enough. The next time, I repeated almost word for word what was written in the textbook, but he said, ""You just repeated the definition; you didn't actually study it."" The last time, I tried to explain everything in my own words, but he still didn't like my answers.I'm honestly confused about what kind of explanation he's expecting.How would you answer those questions in an oral exam?",12,0.88,15,https://www.reddit.com/r/learnprogramming/comments/1u10zli/cant_seem_to_pass_uni_exam/,2026-06-09 10:20:36,2026-06-13 03:53:43
1u3rf8p,How to write code for complex problems as a beginner and how to think beforehand before writing any code ?,TreacleFlaky2283,learnprogramming,"its like i can write code of simple problems but i finds myself not so easy when it comes to the program like terminal games and i feels like i am lagging the ""right thinking"" before writing any code. well the thing is i completed like 22 projects from the book big book of small python projects and i am still writing codes like this [https://paste.pythondiscord.com/HGNA](https://paste.pythondiscord.com/HGNA) i feels like i know python but lacks in thinking on how to approach a problem and making it run properly. and i feels like if i keep practising like this i wouldn't get any close to writing code more effectively any sooner unless i have someone to tell me the right way or i learns it from a tutor or a course or a book on how to approach and think of a problem, cuz if i were to just practise and do it on my own i would be doing hit and trials and it might take me much longer compared to if i m being taught on how to write it better. so how should i go further on now ? i just want to ask how to think when we were given a problem say we were given to make a terminal program and i always just confuse like yeah i can make it work but i still feels like i need to learn to write it neatly. i can make small programs but i want to learn how to make complicated programs or think/design beforehand on making these programstldr; asking if it will be good to read some ""tips"" from somewhere or watch any lectures on thinking properly instead of just practising which i think might take ""more"" time for e.g. will it be beneficial to read books like ""think like a progrmmer"" by al sweigart ? instead of just practising and finding the neat ways on my own ?",11,0.82,26,https://www.reddit.com/r/learnprogramming/comments/1u3rf8p/how_to_write_code_for_complex_problems_as_a/,2026-06-12 10:24:38,2026-06-13 03:53:43
1u2b8ub,What path to choose in programming?,Dismal-Cell-9770,learnprogramming,"Hi! I'm trying to figure out which programming direction I should focus on for my future career. Right now I'm studying so I don't have to worry about a job at the moment. I code for some years now as a hobby and I'm just experimenting.For some years I was mainly coding websites and apps in react and python but I had a period when I tried to learn C++ and dive a bit into cybersecurity. I had fun but some topics were to advanced for me at the time, I gave up and went back to web development. Now I came back to C++ and cybersecurity because I find web development a bit boring now.I honestly think I am doing better right now and it just fascinates me because it's more challenging and I like undestanding systems more deeply.My main question is: Is it worth it to learn this right now to get a job in future or I should leave it as a hobby?",9,0.86,11,https://www.reddit.com/r/learnprogramming/comments/1u2b8ub/what_path_to_choose_in_programming/,2026-06-10 18:51:34,2026-06-13 03:53:43
1u34580,"Trying to learn CS and DSA, but I'm not very good at math",MikeADenton,learnprogramming,"I've been watching MIT's course MIT 6.006 Introduction to Algorithms, Fall 2011. Started the first lecture, took my time with it to understand the algorithms presented (Binary Search, Greedy Ascent and Divide and Conquer). I learned them, used three languages each (C using pointers, Python and JavaScript). used a bit of AI just to review my code for any weird thing or tips about how to code things more effectively (I know some people may not like the use of AI, but I'm using it as a code buddy)But the math part is super confusing, I have no clue what's going on, the recitation videos makes it even worse. I'm not sure what to do anymore. should I go back and learn the math before taking this course? Use OSSU as my roadmap?I love the coding part, visualizing these algorithms and code them. Some say that you can skip the math part but once you get to the next course, the math it necessary, and I don't want to do it just to pass it, but to understand it. Thank you :(",10,0.78,17,https://www.reddit.com/r/learnprogramming/comments/1u34580/trying_to_learn_cs_and_dsa_but_im_not_very_good/,2026-06-11 16:36:58,2026-06-13 03:53:43
1u2rt0d,Need Advice with the AI situation.,Real_Ad_6723,learnprogramming,"Long story short. I been learning rust and also doing open source contributions by coding by hand. I dont use tab complete too so that i would learn quickly. i am using Ai only in ask mode so that it would help me understand complex code, suggest me better way of writing code etc so that i myself would eventually get better at programming. i dont do much coding in my day job so no pressure of using AI. I code in my free time so i have the option to code by hand, learn , get good at it and switch.My simple belief is that even in an era where everything is written using AI, people who know how coding is done , understand how the cpu executes machine code, like understand how the stuff is happening will be more valuable. But with the drop of mythos and fable 5, i am feeling little uncertain . Would appreciate if you guys can share what you think. i will still do what i am doing cause that all i can do honestly. i can either give up or continue.",9,0.7,14,https://www.reddit.com/r/learnprogramming/comments/1u2rt0d/need_advice_with_the_ai_situation/,2026-06-11 07:06:37,2026-06-13 03:53:43
1u0eudi,How to start learning C++,Ok_Lie9608,learnprogramming,"I'm starting a C++ course at university this September and I'd like to get a bit of a head start before classes begin. I'm completely open to learning through videos, websites, practice projects, or anything else that helped you when you were starting out.Are there any YouTubers, online courses, or websites that explain C++ concepts particularly well for beginners? Also, if there are any topics you think I should focus on before the semester starts, I'd love to hear your suggestions.",9,0.72,13,https://www.reddit.com/r/learnprogramming/comments/1u0eudi/how_to_start_learning_c/,2026-06-08 17:37:09,2026-06-13 03:53:43
1tzco2b,"I wrote a simple script to calculate angles in python, but I am having trouble making it properly answer when you don't enter the proper values",Vegetable-Loquat9118,learnprogramming,"import math print(""Fill in the values (leave - if it is unknown):"") hypotenuse = input(""Hypotenuse:"") opposite = input(""Opposite:"") adjacent = input(""Adjacent:"") if adjacent == ""-"":     if opposite == ""-"" or hypotenuse == ""-"":          print(""Enter atleast 2 numbers."")     else:             hypotenuse = float(hypotenuse)         if hypotenuse > opposite:                 angle =  math.degrees(math.asin(opposite/hypotenuse))                 print(""Angle is: "" + str(angle))         else:             print(""Impossible triangle. Check the numbers and try again. (Hypotenuse has to be the largest number)"") if opposite == ""-"":     adjacent = float(adjacent)     hypotenuse = float(hypotenuse)     if hypotenuse > adjacent:             angle =  math.degrees(math.acos(adjacent/hypotenuse))             print(""Angle is: "" + str(angle))     else:           print(""Impossible triangle. Check the numbers and try again. (Hypotenuse has to be the largest number)"") if hypotenuse == ""-"":     adjacent = float(adjacent)     opposite = float(opposite)       angle =  math.degrees(math.atan(opposite/adjacent))     print(""Angle is: "" + str(round(angle, 1)))   elif hypotenuse != ""-"" and adjacent != ""-"" and opposite != ""-"":     adjacent = float(adjacent)     opposite = float(opposite)       angle =  math.degrees(math.atan(opposite/adjacent))     print(""Angle is: "" + str(round(angle, 1)))   else:     print(""Please fill in atleast 2 valid numbers"") You prolly should know this is my second day of working with python",9,0.81,10,https://www.reddit.com/r/learnprogramming/comments/1tzco2b/i_wrote_a_simple_script_to_calculate_angles_in/,2026-06-07 13:49:42,2026-06-13 03:53:43
1u2ozo6,Hey users I want to learn C programming language any suggestions or advice would helpful for me!,randomladka_,learnprogramming,"How much time I should give to learn. Any methods,books, tutorials etc..",8,0.79,18,https://www.reddit.com/r/learnprogramming/comments/1u2ozo6/hey_users_i_want_to_learn_c_programming_language/,2026-06-11 04:31:50,2026-06-13 03:53:43
1u1zj3j,[DBMS] What's the use of defining a Primary Key?,Root4356plus3,learnprogramming,"Recently i learned that under 1NF, PK is not required, but at least one candidate key is (to distinguish the elements). And it makes sense because PK is just an arbitrarily chosen CK.Foreign keys can refer to any of the CKs. Indexing can be done on any of the attribute. So what's the use of defining a PK?",8,0.79,26,https://www.reddit.com/r/learnprogramming/comments/1u1zj3j/dbms_whats_the_use_of_defining_a_primary_key/,2026-06-10 11:31:12,2026-06-13 03:53:43
1tznu02,TDD - How to Approach Mocking in C++,MeChamoLegend,learnprogramming,"**C++ devs - How do you approach mocking and unit test isolation in C++?**Is the correct approach to write virtual interfaces for just about every component (to enable mocking with tools like gMock, trompeloleil, and FakeIt) or is it acceptable to lean more heavily on live collaborators during C++ testing to cut down on boilerplate?Is there a different approach altogether that is recommended in this language?My (admittedly limited) professional programming experience has been in JavaScript. Tools like Sinon make mocking and stubbing so easy in JavaScript that I learned to apply TDD by mocking every dependency during unit testing. The unit under test basically never uses its actual dependencies in unit tests.I've been studying C++ in my own time and want to bring TDD discipline to my projects in that language. However, I've quickly discovered that mocking in C++ is more difficult than in JS. Previous experience would compel me to write a virtual interface for just about everything in my project so that I can plug those interfaces into mocking tools. That satisfies my instinct on what it means to unit test by isolating each unit, but in C++ it also means a lot of boilerplate virtual interfaces. I'd love to get a pro's advice on what the correct approach is.Thanks!",8,0.85,14,https://www.reddit.com/r/learnprogramming/comments/1tznu02/tdd_how_to_approach_mocking_in_c/,2026-06-07 20:56:52,2026-06-13 03:53:43
1u0o2ty,Opinions Needed,Professional-Date308,learnprogramming,"Hi everyone!I have a question on behalf of my best friend who is looking to learn programming or to go to school for programming. Is there anything that she should know beforehand as a prerequisite skill? Is it worth it to go to school for programming in your opinion?I am sorry if this is not the correct place to be posting something like this, but she doesn’t have Reddit and I am trying to help her make informed decisions :)Thank you!",7,0.89,16,https://www.reddit.com/r/learnprogramming/comments/1u0o2ty/opinions_needed/,2026-06-08 23:15:25,2026-06-13 03:53:43
1tz6w90,How to get into full stack development ?,According-Phone7214,learnprogramming,"Pretty much what the title says, which language should i choose ? and can anyone share some particular useful resources, free ones, or if the paid ones are better then those will work too, like some certification, i want to learn this skill to combine it with AI/ML further down the line, i have practically zero experience in both, i have finished second yr in college so i just know the basics of java, C and sql, and will full stack and ml be enough to land a good job in the future? i know more skills will be needed and i've seen many things mentioned pretty much everywhere but i want to start somewhere",7,0.78,8,https://www.reddit.com/r/learnprogramming/comments/1tz6w90/how_to_get_into_full_stack_development/,2026-06-07 08:53:12,2026-06-13 03:53:43
1u3ta4v,Should I learn DSA using a course?,_Starblaze,learnprogramming,Should I use a DSA course or should I just start solving Neetcode 150 and learn along the way?My programming fundamentals (up to OOP) are already clear.,7,0.89,6,https://www.reddit.com/r/learnprogramming/comments/1u3ta4v/should_i_learn_dsa_using_a_course/,2026-06-12 12:01:12,2026-06-13 03:53:43
1u3fnt1,Passionate student in doubt,Ok_Muscle7408,learnprogramming,"Hi! I hope I found the right community and that you can help me with some advice :) I am a Computer Science student at the end of my 2nd year, and I am facing what I think most students are facing... entering the IT industry in 2026. I am a passionate guy, I learn quickly, and I like to put what I learn into practice, but it seems to me that university itself doesn't help you become employable; the solution is self-learning, which I completely agree with.​The problem is the following: what do you recommend I do, what branch of computer science should I focus on? I know I'll get answers along the lines of ""It depends on what you like"", but honestly, having studied only theoretical things for 2 full years and only 25% practical stuff, I don't know what I like :)​I practice a lot on LeetCode, continuing my competitive programming experience from high school, and in university, what I liked most was: data structures, operating systems, differential and integral calculus, probability and statistics, computer networks, databases, genetic algorithms. The courses related to OOP seemed very poorly executed to me, which is why, honestly, I now have a distaste for Java and C++.&#x200B;​I look forward to your advice!​Thanks!",4,0.76,8,https://www.reddit.com/r/learnprogramming/comments/1u3fnt1/passionate_student_in_doubt/,2026-06-12 00:01:24,2026-06-13 03:53:43
1u3esaf,"Finished CS50 and a few Python tutorials, feeling stuck on how to actually build something real",marblevelvethub,learnprogramming,"I've been grinding for about 4 months now. I finished CS50 (which was intense but great) and I've been working through some Python basics on various platforms. I can solve most LeetCode easy problems and I understand the fundamentals like loops, dictionaries, and basic OOP, but as soon as I open a blank VS Code window to start a project, I completely freeze. I feel like I'm stuck in tutorial hell. I can follow a video to build a weather app or a simple calculator, but if I try to add a feature that wasn't in the video, I have no idea where to start or how to structure the logic. I don't want to just keep doing more tutorials because it feels like I'm not actually learning to think like a dev. Should I dive into a specific framework like Django or React next? Or should I focus more on Data Structures and Algorithms? I really want to build a portfolio that actually looks decent, but I'm worried about choosing the wrong path and wasting time. Any advice on how to transition from 'following instructions' to 'solving problems' would be huge.",8,0.91,8,https://www.reddit.com/r/learnprogramming/comments/1u3esaf/finished_cs50_and_a_few_python_tutorials_feeling/,2026-06-11 23:22:06,2026-06-13 03:53:43
1u375ai,Help a sci-fi writer understand how to approach their fictional software,DualistX,learnprogramming,"Hi everyone! I'm an unpublished but long-time writer who just wrapped up on a fantasy manuscript and am trying to gear up for a near-future sci-fi one. A central piece of the world building is a massive tech company that created/manages a heavily used consumer and enterprise product nationwide. And as part of it, I need to understand how entitlement systems sit within a larger software... framework.Ok, so for the sake of simplicity, let's say the company makes a magic box that can turn into whatever you need. A phone. A car. A building. Don't worry about the reality of it. This is not the actual THING but just a convenient placeholder.To make this thing work, the way I imagine it working as a relative software novice (who has just done a bit of reading and barely understands) is roughly as follows:There's a kernel level system that tells the box how to work, has critical security measures, etc. This is the base ""function instruction"" level. Then you'd have a sub-system with a registry of things the box can turn into. The box would check in here when a user asks ""become a chair"" to see ""what the hell is a chair?""Finally, you have the entitlement system that determines who can access the system in general based on different factors -- the specifics of which are probably irrelevant for the sake of this conversation.All that said, am I on the right track? Is this how a system would be set up in the real world? COULD it be set up in this way without stretching realism too far? And assuming all this fits, what would the organizational structure propping this system up look like?I appreciate anyone who can offer any help -- and hopefully this is an appropriate place to ask this question. I'm sure a mod will tell me if not (and sorry in advance if that's the case)! I know it's all very abstract, so just know any advice/perspective/resources for further reading are welcome!",7,0.82,19,https://www.reddit.com/r/learnprogramming/comments/1u375ai/help_a_scifi_writer_understand_how_to_approach/,2026-06-11 18:26:06,2026-06-13 03:53:43
