id,title,author,subreddit,content,score,upvote_ratio,num_comments,url,created_utc,extracted_at
1pq72c5,My penultimate year as a CS student frustrates me,Remote_Opinion3873,learnprogramming,"Hello folks, I am studying CS at my penultimate year and I feel really overwhelmed about the heave load and so many different languages we have to use. We are currently have modules regarding databases, advanced programming and api development with a client app. The problem is that the database lectures was so theoritical but for the assignments we had to create 2 DB systems with PostgreSQL and MongoDB, without learning any of these languages during lectures. I hardly managed to do the assignments since it was the first time I had to write postgre and mongo and they assessments required to apply advanced knowledge to code the systems. On the API module it was the same. The professor focused on teaching material regarding how to complete the weekly assignments but the final one was doable since the most of the part covered from the weekly tasks. On advanced programming we had to use c# that we used in the previous years but we had to create a cross platform app with blazor and we never saw examples during lectures on how to set up a blazor app and I felt overwhelmed from the amount of reseach I had to do myself. The following semester we have an IoT's module and the prof told us we will create an IoT device in a simulator with python for the final assessment. We never touched python before. The other module is about game development and they changed the curriculum to use unreal engine with c++ instead of unity, we never wrote c++ before. The last module is about penetration testing and the module guide says that we will have to write bash scripts and python to simulate some attacks on our Uni's servers. What do you recommend me to study during our next semester's gap in order to cope with the assessments and not get frustrated again?",9,0.75,16,https://www.reddit.com/r/learnprogramming/comments/1pq72c5/my_penultimate_year_as_a_cs_student_frustrates_me/,2025-12-19 00:31:38,2025-12-25 01:47:59
1pup6ow,Which assembly language to learn for an ideal career start?,QuantumC-137,learnprogramming,"High level programmer trying to get into Embedded Programming. My goal is for later apply for jobs and to dedicate to it as my professional career. Some other points would be:* To work with electronics (radio, sensors, analog/digital signal analysis and processing)* To cover as much potential job opportunities* To cover as much range of electronics (does it correlates with the previous point?)I know the basics of C, though I believe there's many benefits about investing in Assembly, specially in EP. I've heard that ARM is quite popular, but somehow MIPS are most used in Academics, somehow.Because **Assembly Languages depends on the device Architecture**, which one would you advise for me to learn?",8,0.79,15,https://www.reddit.com/r/learnprogramming/comments/1pup6ow/which_assembly_language_to_learn_for_an_ideal/,2025-12-24 14:55:08,2025-12-25 01:47:59
1prwl4r,Language choice for open source and GSoC preparation: Go vs Rust vs Java,GabbarSingh3,learnprogramming,"Hi everyone,I already have a good foundation in Python and I’m preparing early for Google Summer of Code–style open-source contributions.I want to invest time in ONE additional language that:- Is commonly used in active open-source projects- Allows faster onboarding and meaningful contributions- Is useful long-term beyond just interviewsI’m considering Go, Rust, and Java.I’d really appreciate advice from developers who have contributed to open source or mentored students:Which language has helped you contribute most effectively and why?",9,1.0,5,https://www.reddit.com/r/learnprogramming/comments/1prwl4r/language_choice_for_open_source_and_gsoc/,2025-12-21 03:31:22,2025-12-25 01:47:59
1ppxaa6,Confused about choosing a specialization as a beginner software engineering student,Eng_AG,learnprogramming,"Hey everyone,​Freshman Software Engineering student here. I’m currently grinding through the basics (loops, logic, etc.), but I’m honestly getting a bit of analysis paralysis looking at all the different tracks out there—AI, Web Dev, Mobile, Full-Stack, etc. It feels like there are too many options.​A few questions for those who have been there:​Is there a 'best' path to cut my teeth on as a total beginner?​Is it bad if I just stay general for now, or is it better to niche down early?​What specific skills should I be nailing down in my first year or two so I don't fall behind?​Any advice from experienced devs or students further down the road would be awesome. Thanks!",6,0.65,28,https://www.reddit.com/r/learnprogramming/comments/1ppxaa6/confused_about_choosing_a_specialization_as_a/,2025-12-18 17:52:36,2025-12-25 01:47:59
1pps21m,Is JavaScript good for Hackathons?,Standard_Calendar_66,learnprogramming,I am learning webdev. So I was thinking about starting DSA from January 2026. So before starting I was thinking which language to learn for DSA in order to go to Hackathons...,9,0.75,15,https://www.reddit.com/r/learnprogramming/comments/1pps21m/is_javascript_good_for_hackathons/,2025-12-18 14:23:29,2025-12-25 01:47:59
1pu7xd5,Is looking at a solution and then coding it from memory an effective way to learn?,ReserveNo5080,learnprogramming,"I was wondering is this an fine way to learn programming (specifically, Python) ? For me, it's really hard for me to learn from documentation or the textbook, in the sense that, I can't look at it, and then know how to answer an programming problem given to me. I often have no idea where to even start from, so what I've been doing is as soon as I don't understand it, I try to look at the soltuion, and then try to code form memory without looking at the solution. But the only thing with that, is that unless I am repeating the same problems everyday, it's hard to develop long-term retention, so I was curious if what I am doing fine or is there a better alternative?",7,0.71,19,https://www.reddit.com/r/learnprogramming/comments/1pu7xd5/is_looking_at_a_solution_and_then_coding_it_from/,2025-12-23 23:07:46,2025-12-25 01:47:59
1pscdt5,"Meaning behind this quote from ""The pragmatic programmer"" book",wuweei,learnprogramming,"In the book pragmatic programmer, there is part which says:>Building the model introduces inaccuracies into the estimating process.Doesn't building mental model makes everything clear and more associated with each other to make decisions? How does it introduce inaccuracies I don't get it.",8,0.9,9,https://www.reddit.com/r/learnprogramming/comments/1pscdt5/meaning_behind_this_quote_from_the_pragmatic/,2025-12-21 17:47:48,2025-12-25 01:47:59
1prn163,Teaching early versions of JS,Ill-Raccoon-1038,learnprogramming,"I have begun to study CS in a university recently, have a lecture called intro to programming and it contains JS. However it is not the “new”, redesigned 2016, but the old version. In which only var is used, no arrow function etc.I have a hard time to understand the reason? It seems so waste of time and unnecessarily making things harder and more confusing. I am able to understand what is going on with the lecture, getting confused yes but still when I spend some time I can understand nearly everything. However why teaching practically a dead version? No one seems to use JS in this format anymore.Writing here so maybe I miss some points. Just want to hear some experienced voices. Cheers.PS: English not my primary language, so hope this makes sense.",7,0.74,12,https://www.reddit.com/r/learnprogramming/comments/1prn163/teaching_early_versions_of_js/,2025-12-20 19:49:59,2025-12-25 01:47:59
1ppk5lk,How to properly use HackerRank for practice (beginner)?,purvigupta03,learnprogramming,"Hi,I’m a beginner and want to learn how to use HackerRank properly. I’ve never used it before.I want to know:How to start practicing any programming language on HackerRankHow to choose the right problems as a beginnerHow much time to spend daily and how to track progressAny simple guidance or beginner tips would help. Thanks!",7,0.78,2,https://www.reddit.com/r/learnprogramming/comments/1ppk5lk/how_to_properly_use_hackerrank_for_practice/,2025-12-18 06:43:37,2025-12-25 01:47:59
1pucur0,What can I code on?,Ok_Preference402,learnprogramming,"I currently do not have access to my PC and I've been extremely bored, all I have is this extremely old laptop with 4 gigs of ram, lenova yoga 500. I've tried vs code and that almost worked but then my laptop couldn't handle that.what do I use??",6,0.64,31,https://www.reddit.com/r/learnprogramming/comments/1pucur0/what_can_i_code_on/,2025-12-24 03:05:10,2025-12-25 01:47:59
1pu7i8v,"Understanding variable types in regards to pointers and addresses, C++",spunky_crunk,learnprogramming,"I'm trying to understand why I can pass arrays into functions by declaring a pointer parameter. I've done this several times to pass arrays of different lengths into general purpose functions (along with their lengths) for software that I've written, but although I thought I had a grasp on the inner workings, I've found I'm unable to fully explain what's going on.Here's my understanding, using a simple example. #include using std::cout; float averageScores(float* scores, int length) {     float sum;         for (int i=0; i<length; i++)     {         sum = sum + scores[i];     }     float average = sum/length;     return average; } int main() {     float testScores [] = {81.2, 90, 91.8, 76.3, 78.4};     int numScores = sizeof(testScores)/sizeof(testScores[0]);     float classAverage = averageScores(testScores, numScores);     cout<<classAverage;     return 0; } Might not be the most efficient way to do this but you get the idea. What I've done is passed an array of test scores into a function that calculates their average. However, to my understanding, when I declare an array variable, it's actually interpreted as something like &testScores\[0\], or the memory location of the first float variable in testScores. First question: the entire array is stored at that memory location, correct? So if the memory location is something like 0x5ffe60, that's where the entire array is stored?Now, in my function I have declared the parameters float\* scores and int length. float\* scores is a pointer. So, this to me seems like creating a pointer to a memory address, similar to the classic example folks usually show when discussing pointers:int x = 6; int \*pX = \&x;Where pX is a pointer to the memory location at which the value of x is stored. So, similarly, it seems that float \*scores = &testScores\[0\].Now, my ultimate question: given that C++ is particular about variable types matching, does this mean that &x and &testScores\[0\] are ""pointer types?"" Like, \* and & are just inverses of the same variable type, and that's why I can write a function that expects a pointer and pass it a memory address.So both \*scores and &testScores\[0\] are float\* numbers? I think I'm missing something because my explanation feels inconsistent. If anyone could clarify what I have right and wrong about this, that would be greatly appreciated. Thanks!",7,0.83,22,https://www.reddit.com/r/learnprogramming/comments/1pu7i8v/understanding_variable_types_in_regards_to/,2025-12-23 22:49:14,2025-12-25 01:47:59
1ptl8fg,Trying to learn DSA is honestly making me depressed.,magic_123,learnprogramming,"I've been seriously working on my programming skills for about 6 months now. I've built a couple things and have a decent grasp on JavaScript and now Typescript, and I am now currently working on a resume project that will hopefully show I understand how to build a full stack app (CRUD, react front end, secure and efficient backend with a rest API for SQL database queries, users, authentication and authorization, deployed on AWS, making a point to use minimal AI and only use it when I'm stuck on something usually just syntax related, etc)and I have made excellent progress on it so far. However, I am feeling a bit burnt out on it and need some time to breathe as I've been working on it for hours every day after coming home from my full time job for almost a month, but I still want to make progress on my learning journey.So I decided to really start working on my DSA fundamentals and about a week and change in...I have never felt so dumb and overwhelmed. I can't even solve basic array problems. I've been trying to study the patterns like sliding window and two pointer and can usually identify when to use them , but I either cant figure out the solution or the correct implementation for that solution even after hours of trying in many cases. It's seriously making me wonder if I'm even cut out for this field because it's so overwhelming. I've seen many people say they took courses or they learned it in college, but I just cannot afford an expensive course let alone going to college. Does anyone have some advice? Have you felt similarly in the past when you started learning it? How did you overcome it? Any input especially from those experienced in the field is greatly appreciated.",6,0.75,9,https://www.reddit.com/r/learnprogramming/comments/1ptl8fg/trying_to_learn_dsa_is_honestly_making_me/,2025-12-23 04:56:55,2025-12-25 01:47:59
1psmtfh,Levelling Up,babaqewsawwwce,learnprogramming,"My background was completely unrelated software development. I worked in law enforcement, degree in commerce and finance, and I’m an entrepreneur on the side. I was promoted and inherited my IT Department. I’ve always loved tech and was a gamer when I was younger. I wasn’t a programmer but I could google and Reddit through technical issues. I never called IT because I usually figured it out (I learned that’s why they liked me - I always had new stuff without asking for it). I wanted to make sure I could relate to my people, so I decided to do some homework on IT related stuff. My love of math and problem solving combined with undiagnosed adhd kicked in and I found myself in a Python course. Became a bit obsessed because it felt natural. I am using AI to answer questions about why things operate the way they do and to assist, but only use it now for smaller blocks because it gets dumb really fast. I find myself correcting it when I get it to write blocks for me now. Fast forward to the future. I’ve been building apps at work (mostly power apps, power automate - but learning Python made learning these EASY) and my database is now active. I’ve also built standalone tools with Python at work that are being used. I’ve got no formal education in technology. But I clearly understand the concepts that have been introduced to me. I find myself now gravitating towards a career in technology. I could do this all day. Managing people is great when things are going well but……there’s downsides. I guess I’m wondering what I should learn next to level up and make me valuable to a software development company? I’d even do simple things as a side hustle to level up my experience. My journey so far is Python (object oriented programming, pyqt -> still learning), sql, JSON, html. Where would an experienced professional tell me to research next?",5,0.73,6,https://www.reddit.com/r/learnprogramming/comments/1psmtfh/levelling_up/,2025-12-22 01:28:25,2025-12-25 01:47:59
1ps8789,Operating Systems Basics for Complete Beginners,SessionFederal5122,learnprogramming,"I'm a complete beginner and confused about operating systems. I don't know which one to use. I also don't really understand how operating systems work, like the difference between Linux and a Linux distribution. What are the best resources or explanations for learning about operating systems and all the basics I need before I start learning a programming language?",6,0.8,11,https://www.reddit.com/r/learnprogramming/comments/1ps8789/operating_systems_basics_for_complete_beginners/,2025-12-21 14:49:38,2025-12-25 01:47:59
1przu75,Are Hackathons really important in college life?,JuggernautNo7180,learnprogramming,"As a 3rd-year college student, I’ve participated in many hackathons, especially in Kolkata, where there are a lot of great hackathon events happening. I try to take part in almost every opportunity I get.The biggest benefit for me has been the exposure. You meet new people, work with different teams, and learn new things beyond regular classroom coding. Hackathons improve not just coding skills, but also communication, collaboration, and networking. You also get to know about new platforms, tools, and technologies, which is really helpful. What makes hackathons exciting is the experience of solving a real-world problem within a limited time — whether it’s a 24-hour or 36-hour hackathon. Thinking of an idea, building a solution from scratch, and implementing it under pressure is challenging but incredibly fun and rewarding.Overall, the experience is top-notch and honestly enjoyable. I personally recommend college students to participate in hackathons along with their regular studies. They help improve coding knowledge, problem-solving skills, creative thinking, and even leadership skills.For me, hackathons have been one of the most valuable parts of my college journey.",5,0.78,4,https://www.reddit.com/r/learnprogramming/comments/1przu75/are_hackathons_really_important_in_college_life/,2025-12-21 06:30:46,2025-12-25 01:47:59
1pryh7m,"Working on a compiler for x86-64 windows, any advice?",DirtWhisper,learnprogramming,"Been working on writing an x64 compiler lately, mainly for learning more about programming at a lower level, but also for fun! Anyways, hit a personally milestone today and wanted to brag a little haha. It doesnt do much yet, and it doesnt even have flow control functionality (yet), but very proud that I have even managed to get this far lol, (debugging hell 200%)Uses NASM and Golink in the backend.Has anybody else ever done anything similar? Any advice? Ive learned so much so far that im already contemplating restarting haha Written in C++, managed to get these features:Function definitions and calling Global and local variables definitions Integer mathematics that follow BEDMAS (Use shunting yard algorithm), can also nestle functions in the expressions Can link to external dll for more functionality The string types are = \[4bytes - length, 4bytes - capacity, 8 bytes - pointer\] and also null terminated, for working with C style string functions one can use the syntax $stringVariable.cHere is an example that I managed to sucesfully compile today: #inc: ""core.ni"" #def: $text : string = ""This strings length = %d, capacity = %d\n"" #def: $number : int32 = 95 #def: .main() int32 { .c_printf( $text.c, $text.length, $text.capacity ) $number = 50*11 .c_printf( ""Number (50*11) is: %d\n"", $number ) $number = .getNumber() .c_printf( ""Number after function is: %d\n"", $number ) .c_printf(""Enter a number: "") .c_scanf(""%d"", ?number ) .c_printf( ""Number entered is: %d\n"", $number ) .exit(0) } #def: .getNumber() int32 { .return(123456789) }And here is the ""core.ni"" #lnk: ""msvcrt.dll"" #ext: .c_printf : printf( $text : pntr , $arg1 : any , $arg2 : any , $arg3 : any ) void #ext: .c_scanf : scanf( $text : pntr , $arg1 : pntr ) void #ext: .c_malloc : malloc( $size : int32 ) pntr #ext: .c_free : free( $address : pntr ) void #ext: .c_realloc: realloc( $address : pntr, $size : int32 ) pntr #lnk: ""kernel32.dll"" #ext: .exit : ExitProcess($code : int32) voidWanted to make linking to external functions easy! (I think this is fairly simple)I use the variable type ""any"" as a workaround for overloads atm hahaOther than control flow functionality, what other basics should I try to implement next? (I also need to implement floating point mathematics) (or general advice on compiler development)",5,0.78,3,https://www.reddit.com/r/learnprogramming/comments/1pryh7m/working_on_a_compiler_for_x8664_windows_any_advice/,2025-12-21 05:12:48,2025-12-25 01:47:59
1prkxom,When don't use new framework and cutting edge technology? When you always should?,pepiks,learnprogramming,"Technology moving fast, new tools are on the way right now. I see a lot of guide and suggestion about using something new because of benefits. But from your experience when you suggest avoid using new technology stack, architecture, programming language or framework? I am asking about decision making and good practices to design final solution which will be good to work one few years later. So at the same time I am asking when choose new one tools for the job.What your recommendation from your experience and common pitfalls?",4,0.71,14,https://www.reddit.com/r/learnprogramming/comments/1prkxom/when_dont_use_new_framework_and_cutting_edge/,2025-12-20 18:19:37,2025-12-25 01:47:59
1pqqlbi,34 year old man ready to switch careers into programming.,kell3023,learnprogramming,"As the title says I’m ready to switch careers into programming. I was dabbling in making websites with html, css, and basic event listeners with JS just before I got into trucking( about 6 months ago). Im already over trucking and ready to get back into it, which was my plan all along. I’m going to get a used Mac to take OTR and study when I can. I just need some advice on how to approach this. I would like to go the self taught route but leaning toward WGU just to get the degree. I would like to have a strong foundation before I start WGU so I can knock it out ASAP. With that being said I was planning on going a different route and instead of jumping into html, css, JS immediately, I was thinking about doing cs50x first. I just need some advice on how to approach this. Can yall give me some advice on what to learn/ study to be prepared for WGU or just things I should know so interviewers can tell I know what I’m doing. Also , is their any people out there that made a career change into tech that was in their 30’s? I would appreciate any feedback.",8,0.6,27,https://www.reddit.com/r/learnprogramming/comments/1pqqlbi/34_year_old_man_ready_to_switch_careers_into/,2025-12-19 17:12:57,2025-12-25 01:47:59
1pqd6ym,What should I learn to build a Micro Saas?,Hot_Point5033,learnprogramming,"Hello there! I want to start and run a micro saas business. I have learnt html, css and currently learning JavaScript. I am thinking about learning react next. Will all this be sufficient or do I need to learn a backend language like python as well. I have heard react or next js functions as a backend. Please advise me. Thankyou.",6,0.76,6,https://www.reddit.com/r/learnprogramming/comments/1pqd6ym/what_should_i_learn_to_build_a_micro_saas/,2025-12-19 05:36:36,2025-12-25 01:47:59
1ppvoun,My 14-year-old is about to finish Tynker level 5/6 and will hopefully complete level 6 in about six months. I'd be grateful for recommendations on the next logical online programming course.,kraft_mk,learnprogramming,"My 14-year-old started his coding journey three years ago without any pressure. It's time for me to think about the next step after Tynker.I'd appreciate any recommendations for his next online programming course with a clear, progressive structure.Thank You.Tynker's 6 LevelsLevel 1: Block-based basics:sequencing, puzzles.Level 2: Create stories, animations, games with blocks.Level 3: Advanced blocks: variables, functions, algorithms.Level 4: Intro to Python: syntax, loops, conditionals.Level 5: Advanced Python: functions, data structures, classes.Level 6: Real-world Python: data viz, games, simulations.",5,0.64,14,https://www.reddit.com/r/learnprogramming/comments/1ppvoun/my_14yearold_is_about_to_finish_tynker_level_56/,2025-12-18 16:50:41,2025-12-25 01:47:59
1ppk4rx,Where should I practice SQL + build small projects?,purvigupta03,learnprogramming,"Hi,I’m practicing SQL on HackerRank, but now I want to practice the same questions on a real SQL environment and also start building small SQL-based projects.Can you suggest:Which platform is best for hands-on SQL practice (MySQL Workbench, VS Code, SQLite, PostgreSQL, etc.)?What setup is better for projects (beginner level)?How do you usually move from platform-based practice to real projects?Short suggestions would really help. Thanks!",6,0.76,11,https://www.reddit.com/r/learnprogramming/comments/1ppk4rx/where_should_i_practice_sql_build_small_projects/,2025-12-18 06:42:16,2025-12-25 01:47:59
1pui49t,"Balancing learning, building and the AI challenge",CleverReza,learnprogramming,"Lately I’ve been learning and building some normal projects. I’m curious how others balance time between learning new things and actually building projects!I’ve also started feeling concerned about AI affecting job opportunities. It’s a bit worrying to invest time and effort into gaining expertise in a field, only to see others using AI and low-code tools to get ahead. How do you handle this challenge?",4,0.84,7,https://www.reddit.com/r/learnprogramming/comments/1pui49t/balancing_learning_building_and_the_ai_challenge/,2025-12-24 08:04:33,2025-12-25 01:47:59
1ptldn6,"While solving DSA, my mind just stops working and I instantly switch to YouTube solutions",Responsible-Air-8026,learnprogramming,"Whenever I try to solve DSA problems, my brain just freezes after a few minutes. Instead of thinking more, I immediately open YouTube and watch the solution.It feels easy while watching, but later I realize I didn’t really *learn* how to solve it on my own. Then the same thing happens again with the next problem.Has anyone dealt with this? How do you stop yourself from checking solutions too early and actually think through the problem? Would really appreciate advice from people who overcame this. :folded_hands:",6,0.69,16,https://www.reddit.com/r/learnprogramming/comments/1ptldn6/while_solving_dsa_my_mind_just_stops_working_and/,2025-12-23 05:04:27,2025-12-25 01:47:59
