id,title,author,subreddit,content,score,upvote_ratio,num_comments,url,created_utc,extracted_at
1prgn6h,DBT fusion Postgres adapter,orru75,dataengineering,Anyone know what’s up with the Postgres adapter? Its been blocked for ages.,4,0.75,0,https://www.reddit.com/r/dataengineering/comments/1prgn6h/dbt_fusion_postgres_adapter/,2025-12-20 15:16:29,2025-12-25 01:47:59
1pqpnxu,The Lady with the Data: How Florence Nightingale Invented Modern Visualization - NVEIL,nveil01,dataengineering,No content,3,0.67,0,https://www.nveil.com/florence-nightingale-visualization-history/,2025-12-19 16:37:01,2025-12-25 01:47:59
1pqoppf,{Blog} SQL Telemetry & Intelligence – How we built a Petabyte-scale Data Platform with Fabric,raki_rahman,dataengineering,"I know Fabric gets a lot of love on this subreddit :upside-down_face: I wanted to share how we designed a stable Production architecture running on the platform.I'm an engineer at Microsoft on the SQL Server team - my team is one of the largest and earliest Fabric users at Microsoft, scale wise.This blog captures my team's lessons learned in building a world-class Production Data Platform from the ground up using Microsoft Fabric.Link: [SQL Telemetry & Intelligence – How we built a Petabyte-scale Data Platform with Fabric | Microsoft Fabric Blog | Microsoft Fabric](https://blog.fabric.microsoft.com/en-us/blog/sql-telemetry-intelligence-how-we-built-a-petabyte-scale-data-platform-with-fabric?ft=All)You will find a lot of usage of Spark and the Analysis Services Engine (previously known as SSAS).I'm an ex-Databricks MVP/Champion and have been using Spark in Production since 2017, so I have a heavy bias towards using Spark for Data Engineering. From that lens, we constantly share constructive, data-driven feedback with the Fabric Engineering team to continue to push the various engine APIs forward.With this community, I just wanted to share some patterns and practices that worked for us to show a fairly non-trivial use-case with some good patterns we've built up that works well on Fabric.We plan on reusing these patterns to hit the Exabyte range soon once our On-Prem Data Lake/DWH migrations are done.",6,0.61,6,https://www.reddit.com/r/dataengineering/comments/1pqoppf/blog_sql_telemetry_intelligence_how_we_built_a/,2025-12-19 16:00:13,2025-12-25 01:47:59
1ptyqgv,Best of 2025 (Tools and Features),AMDataLake,dataengineering,"What new tools, standards or features made your life better in 2025?",3,0.71,3,https://www.reddit.com/r/dataengineering/comments/1ptyqgv/best_of_2025_tools_and_features/,2025-12-23 16:48:52,2025-12-25 01:47:59
1ptsgky,How to find Cloudera?,reiiiiiiiiiaaaaa,dataengineering,"Does anybody know where to download Cloudera iso for oracle virtualbox? I'm new in this field and I have to set it up for class. I only find the old versions, I think I need a more recent one- sorry if I sound quite clueless...",3,0.81,2,https://www.reddit.com/r/dataengineering/comments/1ptsgky/how_to_find_cloudera/,2025-12-23 12:14:15,2025-12-25 01:47:59
1psy7m4,DBA career pivot to Data Engineer,Hopeful-Pack-8713,dataengineering,"Hi,I’m looking to pivot in my career, I’m a DBA though due to potential career growth and the demands that come with it (On-call, constant production support etc,), I’m thinking of a shift towards more data engineer type roles. I have some previous experience with Python and plan on quickly up-skilling and implementing as much as I can within my current role through automation, using AWS SDK etc as well as making projects in my own time. My current role now involves managing Aurora as part of it, there’s also ‘ownership of data’ and everything that brings amongst our AWS deployments.I guess my current role is transitioning away from standard DBA things though I want to make more deliberate movements towards data engineering largely for financial reasons. I’m currently on about £75k, I have no plans to move at the moment but with the job market things can change and tomorrow my company could decide I am no longer needed. I’d like to do what I can to be in a position where I could pivot if needed without taking too much of a hit salary wise.Obviously I’ve not given too much information, but can you give an idea of the skills I ought to prioritise, things to focus on etc based on the above and if possible given an idea as to how well versed I need to be with them. e.g. with AWS is it a case of simply using EKS, MKS and being able to write functional python code or does it need to be super performant. Also is it realistic and achievable to pivot from DBA to Data Engineer on a salary of around £75k without too much of a reduction or am I being unrealistic?",3,0.67,12,https://www.reddit.com/r/dataengineering/comments/1psy7m4/dba_career_pivot_to_data_engineer/,2025-12-22 12:19:21,2025-12-25 01:47:59
1psi5ae,"Building an Autonomous ""AI Auditor"" for ISO Compliance: How would you architect this for production?",doctorallfix,dataengineering,"I am building an agentic workflow to automate the documentation review process for third-party certification bodies. I have already built a functional prototype using Google Anti-gravity based on a specific framework, but now I need to determine the absolute best stack to rebuild this for a robust, enterprise-grade production environment.​The Business Process ​Ingestion: The system receives a ZIP file containing complex unstructured audit evidence (PDFs, images, technical drawings, scanned hand-written notes).​Context Recognition: It identifies the applicable ISO standard (e.g., 9001, 27001) and any integrated schemes.​Dynamic Retrieval: It retrieves the specific Audit Protocols and SOPs for that exact standard from a knowledge base.​Multimodal Analysis Instead of using brittle OCR/Python text extraction scripts, I am leveraging Gemini 1.5/3 Pro’s multimodal capabilities to visually analyze the evidence, ""see"" the context, and cross-reference it against the ISO clauses.​Output Generation: The agent must perfectly fill out a rigid, complex compliance checklist (Excel/JSON) and flag specific non-conformities for the human auditor to review.​The Challenge:The prototype proves the logic works, but moving from a notebook environment to a production system that processes massive files without crashing is a different beast.​My Questions for the Community​Orchestration & State: For a workflow this heavy (long-running processes, handling large ZIPs, multiple reasoning steps per document), what architecture do you swear by to manage state and handle retries? I need something that won't fail if an API hangs for 30 seconds.​Structured Integrity: The output checklists must be 100% syntactically correct to map into legacy Excel files. What is the current ""gold standard"" approach for forcing strictly formatted schemas from multimodal LLM inputs without degrading the reasoning quality?​RAG Strategy for Compliance: ISO standards are hierarchical and cross-referenced. How would you structure the retrieval system (DB type, indexing strategy) to ensure the agent pulls the exact clause it needs, rather than just generic semantic matches?​Goal: I want a system that is anti-fragile, deterministic, and scalable. How would you build this today?",3,0.67,3,https://www.reddit.com/r/dataengineering/comments/1psi5ae/building_an_autonomous_ai_auditor_for_iso/,2025-12-21 21:52:32,2025-12-25 01:47:59
1ps9x0j,Creating aggregates on big data,FormalVegetable7773,dataengineering,We have a redshift table that has aggregate sum of interactions per customer per day. This table is c.300m rows and will continue to grow by c.300m rows per year.I have to create another table that provides a sum of the interactions per customer over the last 90 days. This process runs daily. Should I just truncate and load the results each time for simplicity? Or attempt to try and merge the results somehow ?Thanks,3,0.81,5,https://www.reddit.com/r/dataengineering/comments/1ps9x0j/creating_aggregates_on_big_data/,2025-12-21 16:04:53,2025-12-25 01:47:59
1ps2vwi,Can a BCom graduate transition directly into data engineering?,SchemeOk9781,dataengineering,"Hi everyone, I’ve completed my BCom and I’m interested in moving into data engineering. I’ve been researching different paths and came across the Microsoft DP-700 (Data Engineering on Microsoft Azure) certification.I had a few questions and was hoping to get some guidance:1. Is it realistic for someone with a BCom background and little or no CS experience to move directly into data engineering? What skills should I focus on first? Do I need strong programming or CS fundamentals before aiming for this role?2. Is DP-700 a good certification to start with? Would it actually help in landing an entry-level or junior role, or is it more useful after getting some experience?3. Are there other certifications or learning paths you’d recommend instead or alongside DP-700?",2,0.59,18,https://www.reddit.com/r/dataengineering/comments/1ps2vwi/can_a_bcom_graduate_transition_directly_into_data/,2025-12-21 09:47:05,2025-12-25 01:47:59
1prw5cv,Side project using AI or studying fundamental knowledge?,Numerous-Tip-5097,dataengineering,"Hi, I get different opinions about this.Some say doing side projects using AI is much worth than studying/practicing basics(i.e. practicing python skills in Leetcode, studying for aws certificate, etc). And others say the opposite like anyone can make things with AI so knowing fundamentals deeply is more important (for example, upskilling your python level than doing side projects with just using AI).What do you guys think it's better for your future job hunting and future career development? I am not sure if companies doing live coding anymore? Could you give me some advice? :)",2,0.67,2,https://www.reddit.com/r/dataengineering/comments/1prw5cv/side_project_using_ai_or_studying_fundamental/,2025-12-21 03:07:39,2025-12-25 01:47:59
1pqzhsw,iceberg-loader,ivanimus,dataengineering,"Just released my first Python package on PyPI iceberg-loader! The gist: everyone's shifting to data lakes with Iceberg for storage these days. My package is basically a wrapper around PyIceberg, but with a much handier API it auto-converts that messy JSON you often get from APIs (like dicts/lists) into proper Iceberg structures. Plus, it handles big datasets without hogging memory.It's still in beta, I'm testing it out, but overall it's running reliably. Yeah, I built it with LLM help would've taken me half a year otherwise. But linters, tests, and checks are all there.It also plays nice natively with PyArrow data. Right now, I'm prepping a test repo with examples using Dagster + ConnectorX + iceberg-loader. Should end up as a fast open-source data loader since everything runs on Arrow.Would love if any devs take a look with their experienced eye and suggest improvements or feedback.https://github.com/vndvtech/iceberg-loader",3,0.81,0,https://www.reddit.com/r/dataengineering/comments/1pqzhsw/icebergloader/,2025-12-19 23:32:16,2025-12-25 01:47:59
1pqncik,Help with Deciding Data Architecture: MySQL vs Snowflake for OLTP and BI,khushal20,dataengineering,"Hi folks,I work at a product-based company, and we're currently using an RDS MySQL instance for all sorts of things like analysis, BI, data pipelines, and general data management. As a Data Engineer, I'm tasked with revamping this setup to create a more efficient and scalable architecture, following best practices.I'm considering moving to Snowflake for analysis and BI reporting. But I’m unsure about the OLTP (transactional) side of things. Should I stick with RDS MySQL for handling transactional workloads, like upserting data from APIs, while using Snowflake for BI and analysis? Currently, we're being billed around $550/month for RDS MySQL, and I want to know if switching to Snowflake will help reduce costs and overcome bottlenecks like slow queries and concurrency issues.Alternatively, I’ve been thinking about using Lambda functions to move data to S3 and then pull it into Snowflake for analysis and Power BI reports. But I’m open to hearing if there’s a better approach to handle this.Any advice or suggestions would be really appreciated!",1,0.57,20,https://www.reddit.com/r/dataengineering/comments/1pqncik/help_with_deciding_data_architecture_mysql_vs/,2025-12-19 15:05:28,2025-12-25 01:47:59
1psogoi,Role confusion & future growth,No_Song_4222,dataengineering,"Things have been slow lately. Was working on a contractual job which eventually ended this month and I am unemployed.My current tech stack : Airflow + GBQ + SQL + Python. (\~ 2 years in this)My team is extremely lean (4 people) . There is a **another data team** which bring the raw data to GBQ ( e.g. salesforce, Dynamics. etc) .My job1. Ask strong business questions with stakeholders -> translate them to SQL/buisness outcomes -> design metrics to track etc -> then from various raw tables bring it to production layer ( bronze -> gold ).2. Sometimes I build dashboards on Superset and sometimes I don't. There are another Business analyst team who do that but they are not technical/skilled in terms of Airflow, pipeline design, handle schema changes etc.I am hired as Data Analyst on paper but I have been doing #1 always with the current tech stack.I don't touch a lot GCP UI , configurations and do not handle the CI/CD and Infra and Terraform stuff. Just have enough idea to talk with people and have done couple of cloud courses in Azure & AWS during college to understand it enough at a base layer.My job ended this December1. Is my role a data engineer or analyst or analytical engineer ? confused as hell at what to market as myself as I have started actively looking in the job market.2. How should I grow from here ?Current location : Toronto.Overall Data Experience \~ 3 Year ( 1 year was mostly Excel in a non technical industry)Ppen to Work in Toronto or in India ( currently a PR holder)",3,0.64,11,https://www.reddit.com/r/dataengineering/comments/1psogoi/role_confusion_future_growth/,2025-12-22 02:48:31,2025-12-25 01:47:59
1pso232,Any recommendations for a data extractor tool?,Le06224,dataengineering,We’re manually copying data from PDFs into Excel every week and it’s taking so much. Is there a data extractor tool we could use to automate this?,2,0.6,7,https://www.reddit.com/r/dataengineering/comments/1pso232/any_recommendations_for_a_data_extractor_tool/,2025-12-22 02:29:05,2025-12-25 01:47:59
1ps3yic,Snowflake put and get commands,freaking_scared,dataengineering,"Hi Snowflake users. I am currently working on a small stored proc which would create files and upload them to an EXTERNAL stage.I am using python to do so. Now the problem I am facing is:I am currently using just a simple with open and create the txt file in the current directory, so for example if the job is run on a warehouse it'd be in warehouses memory. I move this file to an external stage using a put command.Now it all works fine but my manager wants this python script to run locally as well - we do our development locally in a repo. I looked at alternatives which were for example put\_stream, but none of the solutions would work in both local environment and when run on the warehouse. Some solutions wouldn't let me create a txt file.Does anyone know if there is a solution to this problem? Has anyone faced a similar problem?The key things is: the ouput has to be a TXT file and it is the EXERNAL stage I have to upload the files to.",2,0.67,1,https://www.reddit.com/r/dataengineering/comments/1ps3yic/snowflake_put_and_get_commands/,2025-12-21 10:56:48,2025-12-25 01:47:59
1prcir3,Anyone using Talend 8 on-prem to build SOAP / REST services? How does it scale?,GarpA13,dataengineering,"I’m currently working with Talend 8 on-premises and using it to expose SOAP and REST web services (mainly DB-backed services via ESB / Runtime).I’d like to understand if others here are using Talend in a similar way and get some real-world feedback.Specifically:Are you using Talend to build and expose SOAP and/or REST APIs in production?Which components / approach are you using (ESB Provider, REST Jobs, Karaf runtime, etc.)?How is the scalability of the platform in your experience?Concurrent requestsHorizontal scalingStability under loadAny lessons learned, limitations, or best practices would be really appreciated.",2,0.76,7,https://www.reddit.com/r/dataengineering/comments/1prcir3/anyone_using_talend_8_onprem_to_build_soap_rest/,2025-12-20 11:45:30,2025-12-25 01:47:59
1pqnml4,Director and staff engineers,educationruinedme1,dataengineering,How do you manage your projects and track the work. Assuming you will have multiple projects/products and keeping a track of them can be cumbersome. What are ways/tools that have helped you in managing and keeping track of who is doing what ?,2,0.67,5,https://www.reddit.com/r/dataengineering/comments/1pqnml4/director_and_staff_engineers/,2025-12-19 15:16:59,2025-12-25 01:47:59
1pql697,Weird Snowflake future grant behavior when dbt/Dagster recreates tables,poopdood696969,dataengineering,"I’m running into a Snowflake permissions issue that I can’t quite reason through, and I’m hoping someone can tell me if this is expected or if I’m missing something obvious.Context: we’re on Snowflake, tables are built with dbt and orchestrated by Dagster. Tables are materialized using DBT (so the compiled dbt code is usingcreate-or-replace semantics). This has been the case for a long time and hasn’t changed recently.We effectively have two roles involved:* a read-only reporting role (SELECT access)* a write-capable role that exists mainly so Terraform can create/provision tables (INSERT / TRUNCATE, etc.)Important detail: Terraform is *not* managing grants yet. It’s only being explored. No Snowflake grants are being applied via Terraform at this point.Historically, the reporting role had database-level grants:* usage on the database* usage on all schemas and future schemas* select on all tables* select on future tables* select on all views* select on future viewsThis worked fine. The assumption was that when dbt recreates a table, Snowflake re-applies SELECT via future grants.The only change made recently was adding schema-level future grants for the write-capable role (insert/truncate on future tables in the schema). No pipeline code changed. No dbt config changed. No materialization logic changed.Immediately after that, we started seeing this behavior:* when dbt/Dagster recreates a table, the write role’s privileges come back* the reporting role’s SELECT does notThis was very obvious and repeatable.What’s strange is that the database-level future SELECT grants for the reporting role still exist. There are no revoke statements in query history. Ownership isn’t changing. Schemas are not managed access. Transient vs permanent tables doesn’t seem to matter.The only thing that fixes it is adding schema-level future SELECT for the reporting role. Once that’s in place, recreated tables keep SELECT access as expected.So now everything works, but I’m left scratching my head about why:* database-level future SELECT used to be sufficient* introducing schema-level future grants for another role caused this to surface* schema-level future SELECT is now required for reporting access to survive table recreationI’m fine standardizing on schema-level future grants everywhere, but I’d really like to understand what’s actually happening under the hood. Is Snowflake effectively applying future grants based on the most specific scope available? Are database-level future grants just not something people rely on in practice for dbt-heavy environments?Curious if anyone else has seen this or has a better mental model for how Snowflake applies future grants when tables are recreated.",2,0.76,4,https://www.reddit.com/r/dataengineering/comments/1pql697/weird_snowflake_future_grant_behavior_when/,2025-12-19 13:31:45,2025-12-25 01:47:59
1ptr7yd,what is the best websites/sources to look for jobs in Europe/GCC,Ill_Persimmon388,dataengineering,"i am looking for opportunities in Data especially analytics engineer, data engineer, data analyst titles in europe or gcci am from Egypt and i have like 2.5 years experience so what do i need to consider and where i can look for opportunities in europe or gcc?",0,0.5,4,https://www.reddit.com/r/dataengineering/comments/1ptr7yd/what_is_the_best_websitessources_to_look_for_jobs/,2025-12-23 11:03:16,2025-12-25 01:47:59
1psy1wm,Delta Lake on ADLS: single query with OR vs multiple queries + union?,frithjof_v,dataengineering,"Hi all,I’m working with a large Delta Lake fact table stored in Azure Data Lake Storage and querying it using Spark.I need to read data based on two different lists of item IDs, where each list has its own timestamp watermark filter. The results from both should be written into a single destination table (that is a given constraint).I’m considering two approaches:A) Single query with a WHERE clause using OR, e.g.```(item_id IN list_A AND time >= watermark_A) OR (item_id IN list_B AND time >= watermark_B)```B) Two separate queries (one per item list + watermark), then UNION the two dataframes into a single dataframe before writing.From a Delta Lake / Spark performance perspective, which approach is generally preferable? Does it even matter?Thanks in advance!",1,0.6,6,https://www.reddit.com/r/dataengineering/comments/1psy1wm/delta_lake_on_adls_single_query_with_or_vs/,2025-12-22 12:10:37,2025-12-25 01:47:59
1ppj7o4,Hello,Vegetable-Drive-2559,dataengineering,"Hi! I'm a university student majoring in big data living in Korea. I want to become a data engineer, but I'm still unsure where to start. How should I study? Also, what are the ways to get hired by a foreign company?",2,0.62,3,https://www.reddit.com/r/dataengineering/comments/1ppj7o4/hello/,2025-12-18 05:47:37,2025-12-25 01:47:59
1pr30pz,"Finding out there is a lot more to tech than just ""Frontend vs Backend""",daniel_odiase,learnprogramming,"I have been working with Python for about 5 years now, and for most of that time, I was stuck in a bit of a bubble. I assumed the career path was basically just moving from junior to senior backend roles, building APIs and scaling web services. It felt like the industry was 90% CRUD apps and centered around the same few ""cliché"" frontend and backend frameworks.Recently, I started looking into Quant Finance, and it has been a total eye-opener. It is a completely different world where the problems aren't about HTTP requests or CSS; they are about high-frequency execution, mathematical modeling, and processing massive amounts of data in real-time. It made me realize how many deep technical niches we completely ignore because they aren't as ""loud"" as web development.I wanted to share this because if you are starting to feel a bit burnt out or bored with standard web stacks, I really encourage you to look at these non-obvious fields. Whether it is Quant, Embedded Systems, or Bio-informatics, there are rabbit holes out there that are way more technically challenging than the standard paths. I spent years thinking I had seen most of what the industry had to offer, but I am finding out I was barely scratching the surface of what we can actually do with code.",390,0.96,60,https://www.reddit.com/r/learnprogramming/comments/1pr30pz/finding_out_there_is_a_lot_more_to_tech_than_just/,2025-12-20 02:19:58,2025-12-25 01:47:59
1pqn9jd,"My Python farming game has helped lots of people learn how to program! As a solo dev, seeing this is so wholesome.",AdSad9018,learnprogramming,"Program a drone using a simple python-like language to fully automate various farming tasks that would otherwise be very grindy. Feel the satisfaction of simply pressing ""execute"" and watching your drone do all the hard work.Unlike most programming games the game isn't divided into distinct levels that you have to complete but features a continuous progression.Farming earns you resources which can be spent to unlock new technology.Programming is done in a simple language similar to Python. The beginning of the game is designed to teach you all the basic programming concepts you will need by introducing them one at a time.While it introduces everything that is relevant, it won't hold your hand when it comes to solving the various tasks in the game. You will have to figure those out for yourself, and that can be very challenging if you have never programmed before.If you are an experienced programmer, you should be able to get through the early game very quickly and move on to the more complex tasks of the later game, which should still provide interesting challenges.Although the programming language isn't exactly Python, it's similar enough that Python IntelliSense works well with it. All code is stored in .py files and can optionally be edited using external code editors like VS Code. When the ""File Watcher"" setting is enabled, the game automatically detects external changes.Hope you like the coding game concept! :)You can find it here:  [https://store.steampowered.com/app/2060160/The\_Farmer\_Was\_Replaced/](https://store.steampowered.com/app/2060160?utm_source=RD)",270,0.96,32,https://www.reddit.com/r/learnprogramming/comments/1pqn9jd/my_python_farming_game_has_helped_lots_of_people/,2025-12-19 15:01:59,2025-12-25 01:47:59
