id,title,author,subreddit,content,score,upvote_ratio,num_comments,url,created_utc,extracted_at
1sxp87k,Im really lost but I'd like to not be,FANCY_GP,learnprogramming,"First of all I'm sorry if this is a common question, I read a bit thru the newer posts and I think my I guess ""question"" is not as big of a copy paste from the others. I'm so new to this and in general adult life but I'm not dumb and I can't adapt (at least I like to think that) I hope the ones who read this don't get annoyed by my ignorance and youth but I tried to explain everything well and concisely enough. I guess I need some guidance because this is a world I don't particularly know that much about or understand it's system but I am VERY interested in all of the possibilities and comfortability it could bring and I mean specifically hireability and money altho I'm not crazy about money)Like a lot of people I've read, I ALSO started this course of 5 months to learn about web creating and publishing. We started off by learning the basics of wifi, history, those things. Then html, CSS3 and now JavaScript. We will be learning Dreamweaver and some Photoshop aswell, it's my last month before a 140 hours internship in a company about web creating aswell. Java seems more complicated as it's a coding language, altho to me it's simmilar to CSS3 enough just more...complex logic wise. Anyway, the question is will this be a good career for me to pursue, and how...where? And to specify better on the complexity of this question, I've read all about ai and how it's good or isn't good for coding, how it saves time but won't replace, others say it will, but that's not necessarily my fear unless it should be? I do like this and I plan on learning more JavaScript and even dabble into the C family and python eventually, I'm very ambitious. But in reality what should one focus on? What is there to do? All I know is creating things aka engineering, making websites front and back end and finally making games. I'm not sure what the job market is out there? I know all about art the infinite amounts of jobs you can have as its been my primary interest all my life but for coding I feel like there's just a few options and it logically sounds dumb so there must be more? I also know different languages serve different purposes or at least are generally used for different purposes. Ugh I don't even know if this is making sense... But if any kind people have read this far... I'm lost but intrigued... I don't want to be rich and earn 70k-100k a year I'd be fine with 30k or so (euros, I live in Spain) what is there for me out there? will websites be good? As someone with love for design of any kind but specifically graphic and fashion. I'm not limiting myself to that tho, I just don't have a clue what I can do other then websites games or creating apps. Give my any advice if you can and want to , any guide into where to branch off with coding and where I could end up maybe?",8,0.91,8,https://www.reddit.com/r/learnprogramming/comments/1sxp87k/im_really_lost_but_id_like_to_not_be/,2026-04-28 03:01:10,2026-05-02 02:48:12
1t0sdyu,Surrounded with great enginners in internship cant make use of,erebrosolsin,learnprogramming,"Hi guys. In my internship there are really really great engineers here. I have mentor which i ask my most questions but i also want to learn from others. For example solution architects, other seniors, expert levels ect. But there hasnt been any situation to ask a question to them. Like either they are too simple or ones I can get answer from internet easily( so i will probably face with ""go google"")How do you guys make use of this great environment, learn from them",7,0.78,8,https://www.reddit.com/r/learnprogramming/comments/1t0sdyu/surrounded_with_great_enginners_in_internship/,2026-05-01 12:44:16,2026-05-02 02:48:12
1szya3f,"i keep getting flagged for ""too similar to source"" even when i write everything myself",DrewJohn22323,learnprogramming,"im a beginner and most of my learning right now comes from docs, tutorials, and random blog poststhe problem is when i try to write things in my own words after reading, it still ends up being really close to the original without me realizing. like logically i understand it, but my wording kind of mirrors what i just readthis has started to mess with assignments and even personal notes because i dont know if what im writing is actually mine or just slightly rewordedso far ive tried a few things like waiting a bit before writing, explaining the idea out loud first, even closing the source while i write, and at one point i also ran my stuff through something like qսеtехt just to see how close it actually was, which helped a little but didnt fully fix iti think part of the issue is i dont have strong enough fundamentals yet, so i end up leaning on the phrasing i just read without meaning tohow do you guys actually break out of that pattern and write things in a way thats clearly your own, especially when youre still learning and dont fully own the concepts yet",8,1.0,14,https://www.reddit.com/r/learnprogramming/comments/1szya3f/i_keep_getting_flagged_for_too_similar_to_source/,2026-04-30 14:50:28,2026-05-02 02:48:12
1szspm4,Aspiring Data Engineer here :waving_hand:,starz_in_their_eyes,learnprogramming,"Hello! I’m currently an engineering student, and since I have fewer units this semester, I’m looking for something productive to focus on.Right now, I’m watching freeCodeCamp videos on Data Analysis, starting with SQL since it’s not my strongest area yet. I also installed MySQL earlier and have been exploring it. I already have some background in Excel and Python, but I still plan to go through the lessons thoroughly.I wanted to ask for some advice: • How do you usually build a data portfolio? Is it better to create a PDF, or should I focus on GitHub projects instead? • Any tips on applying to companies while still an undergrad?My family is currently facing some financial challenges, so I’m hoping to find a work-from-home opportunity related to data engineering if possible.I’d really appreciate any guidance or suggestions. Thank you!",5,0.74,7,https://www.reddit.com/r/learnprogramming/comments/1szspm4/aspiring_data_engineer_here/,2026-04-30 10:56:31,2026-05-02 02:48:12
1sz3tv5,I’m failing my A-levels because of programming..,mimi_utm100,learnprogramming,"I’m (18F) am currently doing A-Level computer science and CTEC engineering at college. Right now, i’m struggling with programming because it is in DEFOLD, which i’m clueless about. It’s a week before the deadline and I’ve had no help from tutors or peers. I’m unsure of what to do. If anyone has advice that would be appreciated. CONTEXT:I’m remaking a different version of flappy bird for myproject, plus the write up and analysis for it. No matter what I do to debug the game, it all goes wrong over and over. So far, my sprite is not moving, my side scroller isn’t functional and it just won’t run.",7,0.71,22,https://www.reddit.com/r/learnprogramming/comments/1sz3tv5/im_failing_my_alevels_because_of_programming/,2026-04-29 16:28:24,2026-05-02 02:48:12
1syplau,Does anybody else feel like your assignments have nothing to do with what you just learned?,rarityy2k,learnprogramming,"Just making sure because I seriously feel stupid. This is my first semester and it feels like I read a chapter of my course materials that seems simple and intuitive, then suddenly the assignment is asking me to do something that is just not mentioned in the chapter at all. Sometimes it feels like i'm expected to just know something without even being taught what i'm supposed to know. Is/was anybody else's college experience like this?",6,0.81,7,https://www.reddit.com/r/learnprogramming/comments/1syplau/does_anybody_else_feel_like_your_assignments_have/,2026-04-29 05:30:08,2026-05-02 02:48:12
1sx8q0y,Does any dev now needs to be an ai security and privacy expert??,johnypita,learnprogramming,"with all the regulations, sunctions and reforms that are being formed in the EU, lawsuites and penelties aginst even solo devs using ai and llms, do we all need to gain privacy and security knowledge?? also i want to make sure that the users are safe, i mean really safe , not the fake coverage that the model providers give. the knowledge gap is huge and risks are real, what everyone here doing about this ?? does anyone else feeling this ??",8,1.0,9,https://www.reddit.com/r/learnprogramming/comments/1sx8q0y/does_any_dev_now_needs_to_be_an_ai_security_and/,2026-04-27 16:26:59,2026-05-02 02:48:12
1swugko,Coding agents taking over my skills,QualityOk6614,learnprogramming,"Hey guys, I been using Claude code and GitHub copilot a lot more to write code, especially for my internship because I need to get work done in strict deadlines where I have to use coding agents and if I don’t, it would probably take me 2 weeks to do something Claude code would do in just one day. The problem is, I feel like I’mNot learning the programming languages anymore. Sometimes I feel like I have no idea what kind of Js code I’m looking at. I’ve become more of a tester and guiding the ai agents to do the work and less of a programmer. Anyone else also feels this way? Or am I the only one. I’m scared this is hurting my future as I’m not developing coding skills.",7,0.62,12,https://www.reddit.com/r/learnprogramming/comments/1swugko/coding_agents_taking_over_my_skills/,2026-04-27 05:26:07,2026-05-02 02:48:12
1swjyx8,In desperate need of help learning computer science,verystressedpotato,learnprogramming,"Hello, I am a new international bachelors student at a decent university. Before I came here, I thought I was going to learn from the basics but after I started taking classes, I got to know they expect you to know the basics and some languages like html css and .c...I have little to no idea about them but I really want to learn. Can anyone tell me what I should do now? I feel really dumb atp. I am in desperate need of help, advice, anything helps.",5,0.65,23,https://www.reddit.com/r/learnprogramming/comments/1swjyx8/in_desperate_need_of_help_learning_computer/,2026-04-26 21:20:11,2026-05-02 02:48:12
1svg9io,Object type in programming,Ok-Presentation-94,learnprogramming,"Hi! I know that in object‑oriented programming, an object is basically a reference (a “pointer”) to a memory location that contains data. For example, MaClass is an object: it’s a representation of data, a structured set of information.What I have trouble understanding, however, is what the object type really means when used as a type in C#, for example: (object maVariable;) I know that myVariable can hold any kind of data, because object is the base type of all types in C#. So the variable will be treated as a reference type.But does that mean it has two types at the same time? For example:(object maVariable = 5;) Here, *maVariable* is both of type *object* and of type *System.Int32*. I really have a hard time understanding this paradox.",7,0.89,22,https://www.reddit.com/r/learnprogramming/comments/1svg9io/object_type_in_programming/,2026-04-25 16:10:02,2026-05-02 02:48:12
1t0nf6c,29 and starting from scratch — looking for a roadmap into networking and cybersecurity/ethical hacking,ParticularStomak,learnprogramming,"Hi everyone,I am 29 and making a pivot into the world of Networking and Cybersecurity. I’m currently a total beginner. I am comfortable with computers in general, but I have no formal experience in IT or programming.I’m planning to pursue a Master’s degree in Networking/Cybersecurity eventually, but before I get there, I want to build a solid technical foundation. A few things I'd love some guidance on:\- What core skills should I be building first? (Networking fundamentals, Linux, programming languages, etc.)\- Are there any certifications worth pursuing early on — like CompTIA Network+, Security+, or CEH?\- Any resources — courses, platforms that you'd recommend for a total beginner?",5,0.63,8,https://www.reddit.com/r/learnprogramming/comments/1t0nf6c/29_and_starting_from_scratch_looking_for_a/,2026-05-01 08:27:32,2026-05-02 02:48:12
1szqyqy,Need help of what to do with my Life and continue My Career as a SWE,DuskyDino,learnprogramming,"Hello, I just wanted to get this out of my chest, so right now I'm a CS student in my Junior year, 24 years old, and throughout my career as a CS Major student I've taken Java, C, bash, and learn assembly (never coded it, but my teacher talked about the code and what's it about). And overall I'm just thinking of what to do with my life and thinking of bad thoughts like I'm a failure because I can't code like a simple code, or I think I can't because throughout my year I never practice in my 2 years of learning and I liked Programming or I think I do because I like how it does, and I just don't what to do I feel like I should just restart everything going back to everything of learning all the basics again and the problem I have is with practice what simple projects can I do like I hear calculator tic-tac-toe and I have never done them because I was lazy, and I hated, and I keep thinking there too advanced, and I just don't know what to do since I have forgotten all of OOP and DSA stuff, or I think I did, and I just feel stuck like I don't know what to do I want to relearn everything and IDK I'm retarded but reading a book I just can't, I don't know why but reading a book for some reason just doesn't work with me and yes I do use AI, but I never let it code the answer for me, I more like guide it for me to do the answer and I always feel like am I actually learning, or I'm just doing my homework assignment, and I was thinking after this semester is over with I was thinking of using the Claude AI to help me make a road map of relearning my fundamentals OOP and DSA. I guess the main reason I felt this was also me doing Leet code questions like twoSums and Palindrome and I remember palindrome, but I just can't do it at all and overall I just feel like a failure and I don't know if someone can give me advice on anything because every time I want to look up at something like look at the answer or how to do this or that I feel like cheating like I should know this by now and get it done in one sit like everyone, and It's sad to say don't I remember what is stack and heap are, and I just feel like a failure of a student and I don't know.If someone does read this, thank you for reading this post and have a wonderful day/night.Also sorry for the grammar and long text and how I write because I suck at it and I don't even know how I passed school if I can't grammar right at all.",6,0.76,14,https://www.reddit.com/r/learnprogramming/comments/1szqyqy/need_help_of_what_to_do_with_my_life_and_continue/,2026-04-30 09:19:37,2026-05-02 02:48:12
1sypn6y,I want to build an OS for Android using the mainline linux kernel.,inoobie_am,learnprogramming,"Hi, I have been making small projects here and there but nothing big and important to me, small stuff like websites and some algorithmic implementation of stuff I read, but not actual important piece of software that I'd like to use.I want to make a minimal, customisable OS for Android, with priority on intentional use. No distracting stuff just productivity focused.But I don't have an idea where to start and what resources to look for. I know this is an ambitious project and I may fail. But regardless, I want to do this and learn new stuff along the way, I'm doing okay with C/C++. I want to know more about how people use linux kernel to build custom OS and how to build for Android. Thanks in advance!",5,0.78,10,https://www.reddit.com/r/learnprogramming/comments/1sypn6y/i_want_to_build_an_os_for_android_using_the/,2026-04-29 05:32:54,2026-05-02 02:48:12
1sxysfy,How to know best practices when using AI as a crutch,Life-Moose7000,learnprogramming,"I've been currently working at a company that one big thing is the utilization of AI. I've been put into a project as a solo full-stack developer with a tight schedule that really doesn't give me enough to really grasp new concepts etc. I'm a trainee/junior status, so using AI with this tight of a time window really takes it out of me. I try to do things myself and would probably do alright without AI if the time wasn't an issue. The problem currently is that I have no clue when I prompt AI that the answer is the optimal solution for my case. I can grasp frontend quite well but I'm having a hard time understanding backend/database logic.",6,0.81,11,https://www.reddit.com/r/learnprogramming/comments/1sxysfy/how_to_know_best_practices_when_using_ai_as_a/,2026-04-28 11:35:51,2026-05-02 02:48:12
1sv6xn7,what are the skill i need to get some freelance work as a cs student webdev,SeveralMajors,learnprogramming,"i have started making some websites i want improve my skills coz going through financial difficultiestech i have worked withnext.js ,reactJavaScript, typescriptmongoDBsolidity,ether.js,web3.js,docker,kubernetes,then as just hobby i have done these likesetup an single node openshift cluster , n8n automations , homelab projects with cloudflare tunnel and tailscale to get access from anywhere , run local ai models and image generation via telegram bot using ollama comfy ui n8n ,as a small project build an ai agent as a smart complaint box for the collage students can send thier complaints and suggetions ai agents review it and sent it to the designated persons of the collage such as for department heads , principal's etc using ollama,n8n,qdrant,telegram-api,gmail-api,also have worked as team lead for hosting a introduction to robotics workshop using esp8266 and ultrasonic sensors to make a simple obstacle avoiding car to give a practical session for 5th grade students of nearby schooli have some of these codes i just do these things as just hobby when bored so i didnt documented well i",5,0.86,7,https://www.reddit.com/r/learnprogramming/comments/1sv6xn7/what_are_the_skill_i_need_to_get_some_freelance/,2026-04-25 08:54:31,2026-05-02 02:48:12
1sv4uv8,Capstone Project,dogthugz14,learnprogramming,"My group and I are currently building a scheduling system website for a small district that handles the local government services and health center ( excluding the finance part ) with a fingerprint kiosk for authentication. Now, if we have the approval for deployment in that district, where do we go for the deployment of our website?",7,1.0,5,https://www.reddit.com/r/learnprogramming/comments/1sv4uv8/capstone_project/,2026-04-25 06:54:32,2026-05-02 02:48:12
1t0jngr,Feeling stuck after learning Node/Express/Mongodb - what project should i build next?,PewDiePie66,learnprogramming,"I’ve been learning web development and recently finished building a backend using Node.js, Express, and MongoDB. I was about to move on to React, but I feel like I’m starting to forget some of the backend concepts.I’m thinking of building a small project to reinforce what I’ve learned before moving forward.I don’t want something too overwhelming that leads to burnout, but I still want it to be meaningful.Would building a portfolio website (with some backend features) be a good idea, or should I try a different kind of project?Any suggestions for beginner-to-intermediate projects that help solidify backend skills without being too heavy?",3,0.64,6,https://www.reddit.com/r/learnprogramming/comments/1t0jngr/feeling_stuck_after_learning_nodeexpressmongodb/,2026-05-01 04:59:14,2026-05-02 02:48:12
1szqvms,"Stuck at 50–60% in concepts of programming languages course quizzes/tests, not sure what I’m doing wrong",everydayreligion1090,learnprogramming,"I'm taking a Concepts of Programming Languages course (syntax/semantics, type systems, imperative vs functional, etc.) and I keep getting around 50–60% on quizzes and the midterm.I do study, and I understand things while reviewing, but in the actual exam I get stuck between two answers and usually pick the wrong one like it feels like I recognize concepts but don’t fully get themThe exams are mostly multiple choice and focus on understanding, not memorization, which might be where I’m messing up... but Im not sure if the final exam is going to be multiple choice so I need to prepare for thr worstHas anyone dealt with this kind of course before? How do you actually study for it and get past that 50–60% range and into the 90-100% range?",7,1.0,12,https://www.reddit.com/r/learnprogramming/comments/1szqvms/stuck_at_5060_in_concepts_of_programming/,2026-04-30 09:14:48,2026-05-02 02:48:12
1synhv9,Improve my programming skills,0DuckM4st3r6,learnprogramming,"Hi! While I’m not new to programming, I still consider myself a junior. I started at 15 and deepened my knowledge at university, but I feel like I've hit a plateau. Although I can build complex projects with AI assistance, I want to truly master architecture and algorithms. My goal is to eventually write something as ambitious as an OS or a compiler just for fun.​Do you have any advice for my personal growth? I'm looking to improve my fundamental skills, even though I know AI is the standard in professional environments. Maybe this question is fool, but i feel lost and I would like to read real programmers answers.",5,0.67,10,https://www.reddit.com/r/learnprogramming/comments/1synhv9/improve_my_programming_skills/,2026-04-29 03:44:01,2026-05-02 02:48:12
1sycb1d,I keep hitting walls trying to modernize our old desktop app and need a solid WPF course,xyz9342,learnprogramming,working as the only senior dev on a manufacturing tool that has been around forever. the ui layer is all custom controls and heavy data binding that breaks every time we add a new report. spent weeks watching scattered youtube videos but they never cover how to untangle years of accumulated mess without breaking production. tried building a small test project on the side to practice better patterns but keep running into the same binding and command issues.really tired of piecing together random tutorials that assume everything starts clean. looking for something structured that walks through real world refactoring step by step.has anyone found a WPF course that actually helped clean up a tangled legacy desktop application?,4,0.84,2,https://www.reddit.com/r/learnprogramming/comments/1sycb1d/i_keep_hitting_walls_trying_to_modernize_our_old/,2026-04-28 19:54:50,2026-05-02 02:48:12
1sx535c,How to start learning Lua?,EvenIssue6289,learnprogramming,"Hey, I want to start learning Lua as a new skill. I have programming knowledge but I'm new to Lua.Any good resources, tips, or beginner projects to start with?Thanks!",7,1.0,9,https://www.reddit.com/r/learnprogramming/comments/1sx535c/how_to_start_learning_lua/,2026-04-27 14:19:19,2026-05-02 02:48:12
1svv75x,Help I'm dumb 4,Zearog,learnprogramming,"Might be on the wrong thread. Apologies for the wording. I have the vocabulary of a two year old.Java class // For some reason, big O notation is not clicking for me. So far, the two main concepts that keep coming up in the is class run time and memory complexity(efficiency?). I understand those concepts, I think. Runtime: how long the code takes to run. Memory: how much resource(?) it takes to run the code. The issue I've repeatedly run into is the math(?) portion of it; rather, how do I determine what's O(1), O(logn), O(n), O(nlogn), O(n\^2), O(2\^n), or O(!n)? What I think I know:If the longest runtime of a piece of my code is O(n\^2), then it does not matter how many lower runtime pieces of code I add, the end result will still be O(n\^2).Stacking the same runtime will result in the same runtime. i.e. stacking an n amount of O(n) will still result in O(n).",6,0.67,14,https://www.reddit.com/r/learnprogramming/comments/1svv75x/help_im_dumb_4/,2026-04-26 02:31:58,2026-05-02 02:48:12
1svem6b,"If you could quantify the relationship between being good at formal stuff(discrete math proofs, linear algebra etc.) and being good at making software, what would that number be?",Intrepid_Witness_218,learnprogramming,"let's say from 1 to 10, 1 being no effect whatsoever, 10 being that skill in programming softwares is basically equivalent to skill in formal stuff.I've been coding for almost 7 months now, and I came across this youtube video of this guy basically arguing that skill in formal stuff == skill in programming",5,0.67,16,https://www.reddit.com/r/learnprogramming/comments/1svem6b/if_you_could_quantify_the_relationship_between/,2026-04-25 15:05:25,2026-05-02 02:48:12
1sve2lx,"Beginner here, do you know how to make a complete randomizing machine on js?",Secret-Newspaper1180,learnprogramming,"I want to make a random color generator that displays the hex and rgb, but I'm still only two weeks into javascipt. Is this feasible for now and if so how should I do it?",4,0.84,7,https://www.reddit.com/r/learnprogramming/comments/1sve2lx/beginner_here_do_you_know_how_to_make_a_complete/,2026-04-25 14:44:06,2026-05-02 02:48:12
1t17ygk,? in C#,Ok-Presentation-94,learnprogramming,"Hi, I've often seen the expression ""?"" in Microsoft's C# documentation. What does it mean?Here's an example to illustrate my point:public string? FirstName;",4,0.67,31,https://www.reddit.com/r/learnprogramming/comments/1t17ygk/t_in_c/,2026-05-01 22:25:30,2026-05-02 02:48:12
