id,title,author,subreddit,content,score,upvote_ratio,num_comments,url,created_utc,extracted_at
1tpqnt6,How are silicon valley upper managers created?,MrGiantsFan,cscareerquestions,"They are some of the most out of touch people in the industry. I'm 6 YOE, at a certain washed up social media company. But it still pays well, so we still attract some of the ""top"" ""talent"" that the bay has to offer. Previously worked at another large company here in the bay area, prior to that, first job was at a mid-sized company in Philly.At the low-level direct managerial level, I have almost no complaints. Managers have a hand on the pulse, and a good-enough understanding of the tech.But there's been lots of churning at the upper managerial level over the last 2 years, and every single new project manager have brought their own unique flavor of fuckery.1. AI. AI. AI. It's all these drones can talk about. While I was on vacation, PM tried to contribute AI-generated code (as a performative act, since he can't actually code) and it was complete garbage. Ofc it got merged with minimal input since nobody will say no to the PM. A coworker had to spend few weeks refactoring some of the stupid architectural decisions that it made.2. Each introduce their own ""ways to improve efficiency"" but it just ends up being yet another thing to have to track since the previous process still has to be done so these managers can justify their existence. It's the XKCD ""Standards"" comic for the managers: [https://xkcd.com/927/](https://xkcd.com/927/)3. They always yap about ""let's think from the user's point of view"" but then when you talk to them during lunch, they don't do shit in their free time but post ""inspirational"" thought pieces on Linkedin or sit around generating AI slop videos/music. One PM was trying to show off the AI-generated ""reggae"" that he ""made"". My guy you're the furthest thing from being able to see the ""end user's point of view.""4. They read one business management book or some MBA course and they think they're Steve Jobs. Latest PM unironically walks around with a black turtleneck and refers to managers as ""vanguards"" and the engineers as ""soldiers.""How do silicon valley PMs turn into this? Every time I see their employment history on Linkedin, the last time any of them even looked like they sniffed code was in 2003 or some shit. On the other hand, I've talked to our division head and even the CTO, and they were normal.Just gotta keep putting the fries in the bag.",73,0.84,35,https://www.reddit.com/r/cscareerquestions/comments/1tpqnt6/how_are_silicon_valley_upper_managers_created/,2026-05-28 02:38:17,2026-06-02 04:05:27
1ttpfkn,How are students applying to 500+ jobs? Where do they find them all?,OkRecording2267,cscareerquestions,"I've been seeing a lot of posts from students and new grads saying things like:* Applied to 400–500+ jobs* Got 300 rejections* Had 20 interviews* Finally landed 1 offerMy genuine question is: where are people even finding 400–500 relevant job openings?I'm currently searching for jobs and after checking LinkedIn, company career pages, and a few job boards, I feel like I run out of openings pretty quickly.A few things I'm curious about:1. What websites, job boards, communities, or resources are you using to find so many openings?2. How do you discover jobs as soon as they are posted?3. Do you set up alerts somewhere, and if so, where?4. Are people applying across multiple cities/countries, or are there really that many openings available?5. How do you keep track of hundreds of applications?I'd appreciate hearing about your process, especially if you've gone through a large-volume job search recently.Thanks!",64,0.83,40,https://www.reddit.com/r/cscareerquestions/comments/1ttpfkn/how_are_students_applying_to_500_jobs_where_do/,2026-06-01 11:33:55,2026-06-02 04:05:27
1tt5gb1,"I used to love my job, now I hate it.",Jetnjet,cscareerquestions,"I used to love this job, it’s my first professional tech job, and I would consistently work overtime and really believed in the vision of the product we were making.Fast forward about 1.5 years and it’s just miserable now. The other devs are 99.9% vibe coders, sometimes putting more effort into making it easier to make the AI do the work than themselves doing it.Working on this codebase is miserable it’s just AI junk I can’t even be bothered to try anymore. I’ve fully committed myself to lazily letting Claude code do it all for me and I really don’t even care anymore. I even stated this to my boss and he did not object, he clearly values speed over anything else.I used to be so happy seeing a team’s message and talking to everyone but at this point it’s genuinely depressing and for whatever reason stressful if that’s not an overstatement, I feel like I’m just putting on a fake face.Because of all this I feel my feelings are heavily impacting my work negatively and my boss is picking this up. I’m not as close anymore and my quality of work has dropped. Nothing that would be a cause for concern but definitely something that’s noticeable.\*the question\*It’s not the worst feeling to just float through my job and collect the paycheck each week but I can’t see the growth or mentorship I need I am quite literally a the beginning.I want to get out and get a new job which I’m expecting to pay more but adding onto this I have a few issues.1) I have basically no reasonable personal projects, I have recently started one at a decent scale but I would say it’s still in its starting stages.2) in this market how do I know I can even find anything3) my company is a start up and I am on a 2 year contract. We are very close to some very big deadlines so if I leave at this stage while I previously had a good relationship with my boss I’m worried all this will cause is a poor reference and a fractured connection.Essentially what to do. I know a lot of what I said is essentially a rant for the context but if there’s a good route to take let me know.",55,0.88,36,https://www.reddit.com/r/cscareerquestions/comments/1tt5gb1/i_used_to_love_my_job_now_i_hate_it/,2026-05-31 19:49:37,2026-06-02 04:05:27
1tom138,Job stability vs salary?,Brilliant_Grade7388,cscareerquestions,I’m getting \~80k a year as a junior swe in east coast. Talked to a senior that’s been here 30 years and he only makes \~120k. I think that’s very low. However our job is very stable and never has layoffs. I’ve been debating whether I should pursue a different job with higher salary… with my student loans it’s very hard to save while paying rent so I feel that this salary is not enough. What do you guys think?,53,0.95,91,https://www.reddit.com/r/cscareerquestions/comments/1tom138/job_stability_vs_salary/,2026-05-26 22:11:36,2026-06-02 04:05:27
1tsl0rf,Are devs on here seriously learning everyday or is this just a bullshit HR response that they give?,Impossible_Stock8885,cscareerquestions,"I am genuinely confused by people who constantly preach the whole ""You have to learn and keep your skills up or you will be obsolete"".Like really? With all this AI bullshit, how do you find motivation to work on your skills at all. Ever since my company gave us all Claude Code subscriptions, I've completely given up on coding and giving a shit about memorizing syntaxes and patterns.I can't even bring myself to build any app anymore, I just vibe code it to oblivion because let's be honest, I'm not going to get any significant users for it and doing one for resume is also pointless, your interviewers / reviewers will look at it and think ""oh Claude probably wrote this"".Or am I completely misunderstanding what they mean by ""I learn everyday"" as in they just do interview prep everyday because you can't use AI during interviews?Edit: Ah I get it now, learn how to use Claude Code better. That's a really good one, let me spend my weekends exploring new AI agents and optimize my token usage. Amazing, I've learned something new today!",48,0.74,48,https://www.reddit.com/r/cscareerquestions/comments/1tsl0rf/are_devs_on_here_seriously_learning_everyday_or/,2026-05-31 04:21:57,2026-06-02 04:05:27
1tpzf60,How do you grow on a team that is quietly hostile?,contrawarp,cscareerquestions,"I’m a few years into my SWE career at a large company. I got promoted once pretty quickly already, and all my formal reviews have been really positive, which is great. But now, people I joined the company with around the same time who are on other teams are all getting promoted again, while I’m being told now by my manager that they got “mixed feedback” around consistency, engagement, visibility, etc.There are no actual concrete deliverables to improve on. It just feels vague and perception/vibes based.But here's the context. Those same teammates who gave her ""mixed"" feedback, are the ones who consistently nitpick small mistakes or have had a passive aggressive “how do you not know this?” attitude toward me since the day I joined, even when I was a fresh engineer and they knew this was my first swe job.I’ve literally had some of them say things like “Do you have a CS degree?” in such a condescending way if I ask about a system, or “I showed you this 7 months ago” while I'm sharing my screen and driving in front of the entire team, and then basically refuse to help further while I sit there and hear crickets. It's extremely awkward and uncomfortable.What really threw me off is that a newer teammate who joined recently privately called me after one of the meetings and asked me if I was okay because they noticed how hostile the team was being toward me for completely normal stuff, especially as a newer engineer who is expected to ask relevant questions on company specific info/procedures that I couldn't figure out myself through googling/researching.At this point I can’t tell if I just need to continue to ignore it and accept this is just the cards I'm dealt, or if this environment is genuinely hurting my growth and reputation long term, and I need to escalate it to someone higher up or request to switch teams.\---TLDR: Newer engineer, got a great review on paper from manager, but passive aggressive teammates + vague “perception” feedback from those same teammates are stalling my promotion and I can’t tell if I should keep grinding through it or get off this team.",45,0.95,10,https://www.reddit.com/r/cscareerquestions/comments/1tpzf60/how_do_you_grow_on_a_team_that_is_quietly_hostile/,2026-05-28 10:19:07,2026-06-02 04:05:27
1trcgyg,Is it unreasonable to ask about a standing desk during offer stage?,Bromoblue,cscareerquestions,"Just a hypothetical that crossed my mind. I've only ever worked remotely. If I were in the offer stage of an interview, could I realistically insist about bringing my standing desk to work? I don't have a doctor's order for it, I just find my posture and back have been doing exceptionally better since I made the switch to using a standing desk for most of the work day.",45,0.83,35,https://www.reddit.com/r/cscareerquestions/comments/1trcgyg/is_it_unreasonable_to_ask_about_a_standing_desk/,2026-05-29 19:14:28,2026-06-02 04:05:27
1tqffw7,Have not leetcoded in 3 years. Am I cooked? Should I use a companies technical screen for practice?,bert_cj,cscareerquestions,"Applied for a role, after HR screening I dont want it, (fully in person) , they offered 1 hour technical screen with medium leetcode problems, interviewer told me. I have not leetcodes in years and was never good at it.Should I do this assessment knowing I will fail for practice?",39,0.73,90,https://www.reddit.com/r/cscareerquestions/comments/1tqffw7/have_not_leetcoded_in_3_years_am_i_cooked_should/,2026-05-28 20:28:38,2026-06-02 04:05:27
1tq7cis,"Those of you who can’t land a good job, what’s your backup plan?",Intelligent_Ebb_9332,cscareerquestions,I landed a job in AZ after 1500 apps but it’s in the middle of nowhere in AZ. I know that if I lost this job I’d be basically fucked because I haven’t gotten another offer even after all those apps. I’m a U.S. citizen and I haven’t seen anyone else struggle this much. The general consensus is that it takes 500-1000 apps to land a good job if you’re a U.S. citizen. It took me 1500 apps so I’ve been wondering wtf could be the issue. My resume looks fine imo and I can link it later if enough people want to see it.I’ve been debating changing fields but that’s going to be another 2-3 years and other than healthcare I don’t know what other field would provide a decent salary with good job security.Are the people that went to low tier universities for undergrad just fucked forever? I’m doing my masters currently at a T50 school but everyone is saying that masters doesn’t matter much and you’re undergrad ranking is everything.Is everyone who went to a low tier university for undergrad just doomed to work in low paying jobs? I hate what the people in charge are doing to this field but I don’t see myself changing fields because I’m an older adult.,39,0.76,49,https://www.reddit.com/r/cscareerquestions/comments/1tq7cis/those_of_you_who_cant_land_a_good_job_whats_your/,2026-05-28 15:43:41,2026-06-02 04:05:27
1tpbm2v,Has anyone here ever got a job off LinkedIn?,VariationLivid3193,cscareerquestions,Has anyone here ever got a job off LinkedIn?,37,0.91,64,https://www.reddit.com/r/cscareerquestions/comments/1tpbm2v/has_anyone_here_ever_got_a_job_off_linkedin/,2026-05-27 17:00:04,2026-06-02 04:05:27
1tu4d95,Who has at least 5 years of tech experience and yet has been struggling to find a tech job(or any job),Historical_Donut6758,cscareerquestions,How do you deal with rejection after rejection ...knowing that you know the tech that is required for the job?,35,0.9,13,https://www.reddit.com/r/cscareerquestions/comments/1tu4d95/who_has_at_least_5_years_of_tech_experience_and/,2026-06-01 20:16:01,2026-06-02 04:05:27
1todbv4,1 YOE at AWS. Market outlook?,goldensolocup,cscareerquestions,"Hi all. I am an engineer at AWS. I know youve had these posts, but the toxic work environment is really dragging on me here. I am not looking to leave just yet, but just wanted some insight into the current market and competiveness, to help ease the stress a bit. I have around a year experience as an SDE 1 at a customer facing AWS team. I also have the 3-4 month internship before with the same team, so in total around 1.25 YOE here. As far as resume/interview goes. I am sure I can make a good resume with the projects I've worked on, as I have shipped a few impactful projects with the team. I think my resume will look nice in that sense. For interviewing, I am not worried about practicing. The thing I am concerned about is my current YOE. It will only increase now but I want to understand how if I left or was layed off or pipped how 1 yoe with AWS would look in the current market. Will i be competitive/have a chance at getting a job that is equal or better to my current? With hopefully better WLB? Please if me know if anyone here has been in a similar position, the job is taking a big toll on my mental, and the uncertainty is scary. Thanks.",33,0.78,83,https://www.reddit.com/r/cscareerquestions/comments/1todbv4/1_yoe_at_aws_market_outlook/,2026-05-26 17:09:56,2026-06-02 04:05:27
1tonrwy,"What do people mean when they say ""I don't write code anymore""",svix_ftw,cscareerquestions,"Genuinely curious about this, since this could actually mean a couple different things. 1. They don't physically type code anymore, and just review AI output. 2. The AI fully autonomously writes the code and they push up the code without review. I'm a Senior SWE at a Fortune 100 and my workflow is heavily number 1 most of the time for easy/simple stuff, with some ""hand coding"" on some specific complex tasks/bugs. For people doing #2, what is your workflow? How are you doing prompting? Where do you draw the line between trust/verification?",31,0.7,84,https://www.reddit.com/r/cscareerquestions/comments/1tonrwy/what_do_people_mean_when_they_say_i_dont_write/,2026-05-26 23:19:35,2026-06-02 04:05:27
1tpnai1,"Getting a remote job after uni has ruined me, What do I even do?",I-already-redd-it-,cscareerquestions,"First and foremost, I’m very lucky to be in this position - many people are still struggling to find jobs today. I don’t want to come off as ungrateful, I’m just frustrated with our world right now. 22m 85kMy friends have all left my college town, there are no 3rd places, and I can't meet anyone my age. I haven’t spoken with anyone but the cashier in ages. My mental health is down the drain, and since my company just lost a huge client, I’m terrified of layoffs.So what do I do? Stay here and rot alone, getting auto-rejected in a horrid job market because I don’t live where the job was posted and I have hardly any experience yet? Or move to a wildly expensive tech hub to live in a shoebox, just for the chance to network and just hope I don’t get laid off in the process? move to a smaller city and stunt any growth because of the aforementioned ats systems? move back in with parents until things are stable? Every option leaves me stressed, alone, or miserable.I don’t mean to complain, apologies. Everyone has it rough right now, but where do I even move? Where do I go? Where would you go?",32,0.78,48,https://www.reddit.com/r/cscareerquestions/comments/1tpnai1/getting_a_remote_job_after_uni_has_ruined_me_what/,2026-05-28 00:09:28,2026-06-02 04:05:27
1ttv5ra,Are you going to change careers if you can’t land a tech job?,Intelligent_Ebb_9332,cscareerquestions,"I’m really considering leaving this field but sunk cost fallacy is what’s holding me back. I hate the idea of needing to go back to college for another 2-3 years just to start with no experience again. Healthcare and accounting seems like the only decent stable options. Everything else is fucked.There’s no jobs and after 1500+ apps, I’ve lost hope.",33,0.69,73,https://www.reddit.com/r/cscareerquestions/comments/1ttv5ra/are_you_going_to_change_careers_if_you_cant_land/,2026-06-01 15:10:25,2026-06-02 04:05:27
1tt4yyr,Question on the future of tech,A_sandlerGOAT,cscareerquestions,"All I see here is how there is no jobs, CS degree is a waste etc.. but it still shows tech as one of the top growing careers in the next few years. I’m about 20% done with my CS degree and I’m not sure exactly what to believe.",26,0.79,52,https://www.reddit.com/r/cscareerquestions/comments/1tt4yyr/question_on_the_future_of_tech/,2026-05-31 19:31:19,2026-06-02 04:05:27
1tp1cht,What happens to IT employees who gets laid off from tech companies ?,Individual-Jacket928,cscareerquestions,"As guys you know Hundreds of tech companies are laying off hundred thousands of employees literally the market is bloodthbath and cookedSo My question is what happens to employee's who get laid off ?Do they still try for tech jobs or pivot their careers in different field like Finanace , Marketing and sales , Consulting and etc",29,0.69,57,https://www.reddit.com/r/cscareerquestions/comments/1tp1cht/what_happens_to_it_employees_who_gets_laid_off/,2026-05-27 10:18:24,2026-06-02 04:05:27
1tto549,Is C++ desktop/system software still a good career path in 2026?,programlover,cscareerquestions,"Hi everyone,I recently built a Chromium-based browser project using C++, and I enjoyed it a lot.Most clients I meet today ask for Electron, Tauri, SwiftUI, or web apps for desktop software. I understand why, because they are faster to build and easier to ship.But I’m more interested in complex software where C++ still gives a real advantage.For people working professionally with C++: **what career paths or product areas still need strong C++ skills?**I want to focus my learning and portfolio on projects that can actually help my career, not just build random toy apps.What kind of C++ desktop/system projects would be worth building in 2026?",25,0.87,9,https://www.reddit.com/r/cscareerquestions/comments/1tto549/is_c_desktopsystem_software_still_a_good_career/,2026-06-01 10:31:07,2026-06-02 04:05:27
1ttad0q,Nervous about starting oncall,Rich-Put4159,cscareerquestions,"I'm a new grad that started back in July last year, got laid off in January, then got rehired a month ago at the same company. I start oncall work as part of the team's rotation in about two months, and I feel kind of nervous about it. I've done oncall before, but it was always low severity requests from adjacent teams on my last team - never a high-severity incident. So, I don't really have experience with handling those. This new team has about 1 Sev2 every 1-3 days usually, and I worry that it'll stress me out, that I won't be able to resolve the incidents on my own, that I'll have to fix something late at night or early in the morning, etc. I was wondering if anyone happened to have any advice for tackling oncall, as well as potential stress management tips for it if any.",24,0.93,7,https://www.reddit.com/r/cscareerquestions/comments/1ttad0q/nervous_about_starting_oncall/,2026-05-31 23:03:51,2026-06-02 04:05:27
1tq7p0q,Vacation during internship?,collegeranthrowaway,cscareerquestions,"So I went into this summer thinking I wouldn’t have an internship. In the last week I’ve ended up getting really lucky and accepted an offer for a 10 week internship for this summer that starts in less than 2 weeks.The problem is with how late I got this, my family ended up planning a 2 week vacation in late July and I’m not sure what the best way to go about this is.Now I won’t be doing the full two weeks regardless, I’ll at most do one week.The internship is hybrid 3 days in office 2 days remote, and I’d be able to work remotely during the trip. I can also leave the trip early (or even not go at all), so I was thinking when I propose this I could just offer one of the weeks fully remote which really amounts to asking off 3 days.My family wants me to at least ask but I’m not sure whether or not this is a bad look to be asking for time off during such a short internship even if I would be offering to work remotely. I know I likely wouldn’t get my offer rescinded just for asking but with how hard it was to get this I don’t want to risk jeopardizing my chances at a return offer with a bad first impression. I also fear if it does get approved that I could fall behind during that week and not leave a good impression the last couple weeks of the internship.I’m also not sure about the best time to ask whether it’s before the internship starts in a couple weeks or if it’s better to wait until the first couple weeks of the job when I’ve gotten to know the company and team a bit more. I’m thinking in the first couple weeks I could also learn if it’s even worth asking or if the work structure and stuff would make it unrealistic.I got mixed answers seeing this online and most threads were either 5+ years old when the market was very different or for fully in person internships so I’m wondering what people’s recent experiences were with this and what the best thing to do is.",23,0.8,42,https://www.reddit.com/r/cscareerquestions/comments/1tq7p0q/vacation_during_internship/,2026-05-28 15:55:59,2026-06-02 04:05:27
1tqee74,Advice for Junior Dev,InshallahSIUUUUUUUUU,cscareerquestions,"Hello everyone,Like you I have struggled with this job market and only managed to land two interviews. I am fortunate to have done good in my interviews and was offered a great Junior Software Engineer role in Big Tech.I would like to do my level best to make a great impression when I start, to have a great on-boarding experience and to be competent on the job within a reasonable timeframe.I would love some advice from you all!And to those who are still in the trenches looking for a full time new grad role don’t give up! Both my interviews came from reaching out to hiring managers (hundreds of cold applications never lead anywhere) so I suggest doing as much reaching out as possible.",21,0.93,13,https://www.reddit.com/r/cscareerquestions/comments/1tqee74/advice_for_junior_dev/,2026-05-28 19:52:40,2026-06-02 04:05:27
1tptes2,How do I get back in the industry now?,refTakeAFreakingLook,cscareerquestions,"Hi, I studied Computer Science in college and graduated with a B.S. in CS 8 years ago. I worked in the industry for about 5 years after graduating. For reference, I went to a fairly well-reputed Engineering/CS program and worked at a few household name companies in the Silicon Valley area (Amazon, Nvidia, Google). Unfortunately, the truth is that despite this I never really liked coding at the time and so I quit my job almost 3 years ago. Since then I have lived abroad doing completely unrelated things and have not paid any attention to the industry or recent AI coding trends. I have recently returned to the US and have wanted to give the industry another chance as it's all I have known in terms of work. However, looking at recent trends and changes in the industry especially in terms of AI, I realize that I am quite clueless and out of practice in the rapidly changing world of software engineering. I am looking at some engineering adjacent positions as well but I am also looking for any tips or advice on how to get back in touch with the trends and skills required to be a SWE now. Not necessarily trying to be at a cutting-edge startup or big name company at the moment but just want something to get back into gear again and learn what's going on now compared to a couple years ago. Any resources or companies to look into?Any and all advice or tips are welcome! Thanks in advance.",22,0.8,26,https://www.reddit.com/r/cscareerquestions/comments/1tptes2/how_do_i_get_back_in_the_industry_now/,2026-05-28 04:48:11,2026-06-02 04:05:27
