id,title,author,subreddit,content,score,upvote_ratio,num_comments,url,created_utc,extracted_at
1pzdizd,Stream Huge Datasets,Suspicious-Pick-7961,dataengineering,"Greetings. I am trying to train an OCR system on huge datasets, namely:* [OCR Cyrillic Printed 1](https://huggingface.co/datasets/DonkeySmall/OCR-Cyrillic-Printed-1)* [Synthetic Cyrillic Large](https://huggingface.co/datasets/pumb-ai/synthetic-cyrillic-large)* [Cyrillic Handwriting Dataset](https://www.kaggle.com/datasets/constantinwerner/cyrillic-handwriting-dataset)They contain millions of images, and are all in different formats - `WebDataset`, `zip` with folders, etc. I will be experimenting with different hyperparameters locally on my M2 Mac, and then training on a [Vast.ai](http://Vast.ai) server. The thing is, I don't have enough space to fit even one of these datasets at a time on my personal laptop, and I don't want to use permanent storage on the server. The reason is that I want to rent the server for as short of a time as possible. If I have to instantiate server instances multiple times (e.g. in case of starting all over), I will waste several hours every time to download the datasets. Therefore, I think that streaming the datasets is a flexible option that would solve my problems both locally on my laptop, and on the server. However, two of the datasets are available on Hugging Face, and one - only on Kaggle, where I can't stream it from. Furthermore, I expect to hit rate limits when streaming the datasets from Hugging Face. Having said all of this, I consider just uploading the data to Google Cloud Buckets, and use the `Google Cloud Connector for PyTorch` to efficiently stream the datasets. This way I get a dataset-agnostic way of streaming the data. The interface directly inherits from PyTorch `Dataset`: from dataflux_pytorch import dataflux_iterable_dataset PREFIX = ""simple-demo-dataset"" iterable_dataset = dataflux_iterable_dataset.DataFluxIterableDataset( project_name=PROJECT_ID, bucket_name=BUCKET_NAME, config=dataflux_mapstyle_dataset.Config(prefix=PREFIX) )>The `iterable_dataset` now represents an iterable over data samples.I have two questions: 1. Are my assumptions correct and is it worth uploading everything to Google Cloud Buckets (assuming I pick locations close to my working location and my server location, enable hierarchical storage, use prefixes, etc.). Or I should just stream the Hugging Face datasets, download the Kaggle dataset, and call it a day? 2. If uploading everything to Google Cloud Buckets is worth it, how do I store the datasets to GCP Buckets in the first place? [This](https://github.com/GoogleCloudPlatform/gcs-connector-for-pytorch/blob/main/demo/simple-walkthrough/Getting%20Started%20with%20Dataflux%20Dataset%20for%20PyTorch%20with%20Google%20Cloud%20Storage.ipynb) and [this](https://github.com/GoogleCloudPlatform/gcs-connector-for-pytorch/blob/main/demo/image_segmentation/README.md) tutorials only work with images, not with image-string pairs.",3,0.81,0,https://www.reddit.com/r/dataengineering/comments/1pzdizd/stream_huge_datasets/,2025-12-30 09:12:50,2025-12-31 01:49:04
1pzcyz7,Persist logic issue in data pipeline,VisitAny2188,dataengineering,"Hey hi guys did any one come across this scenario:So for complex transformation pipelines to optimize it we're using persist and cache but unknowingly we missed the fact that this is a lazy transformation and in our pipeline the action is getting called at the very end i.e. table write So this was causing cluster instability, time consumption and most time failure issue I saw a solution to add some dummy action like count but adding unnecessary action for huge data is not a feasible solution Did anyone came across this scenario and solved, excited to see some solutions",3,0.81,3,https://www.reddit.com/r/dataengineering/comments/1pzcyz7/persist_logic_issue_in_data_pipeline/,2025-12-30 08:38:23,2025-12-31 01:49:04
1pz8m4b,Leading underscores or periods (hidden/sys files) not being read into pyspark?,DarkNoodleSlam,dataengineering,"I’m saving tables from MS SQL into a json layer (table names and columns have all sorts of weird shit going on) before loading into databricks delta tables, but some of the source tables have leading underscores and pyspark is ignoring those files. Is there a best practices way to deal with this? Can I just add text in front of the file name or is there a method in pyspark that lets me switch the setting to allow leading underscores?",2,0.76,2,https://www.reddit.com/r/dataengineering/comments/1pz8m4b/leading_underscores_or_periods_hiddensys_files/,2025-12-30 04:36:10,2025-12-31 01:49:04
1pymrfy,Importance of DE for AI startups,otto_0805,dataengineering,"How important is DE for AI startups? I was planning to shoot my shot, as a junior dev, will I be able to learn more about DE in AI startups? Share your experience pls!",3,0.67,14,https://www.reddit.com/r/dataengineering/comments/1pymrfy/importance_of_de_for_ai_startups/,2025-12-29 13:49:38,2025-12-31 01:49:04
1pyeoa3,S3 Vectors - Design Strategy,PrestigiousDemand996,dataengineering,"**According to the official documentation**: With general availability, you can store and query up to two billion vectors per index and elastically scale to 10,000 vector indexes per vector bucket**Scenario:**We currently build a B2B chatbot. We have around 5000 customers. There are many pdf files that will be vectorized into the S3 Vector index. \- Each customer must have access only to their pdf files \- In many cases the same pdf file can be relevant to many customers**Question:**Should I just have one s3 vector index and vectorize/ingest all pdf files into that index once? I could search the vectors using filterable metadata. In postgres db, I maintain the mapping of which pdf files are relevant to which companies.Or should I create separate vector index for every company to ingest only relevant pdfs for that company. But it will be duplicate vector across vector indexes. Note: We use AWS strands and agentcore to build the chatbot agent",2,0.76,2,https://www.reddit.com/r/dataengineering/comments/1pyeoa3/s3_vectors_design_strategy/,2025-12-29 06:15:34,2025-12-31 01:49:04
1pydumv,API Integration Market Rate?,Familiar-Grape-3362,dataengineering,"hello! my boss has asked me to ask for market rate for API Integration.For context, we are a small graphics company that does simple websites and things like that. However, one of our client is developing an ATS for their job search website with over 10k careers that one can apply to. They wanted an API integration that is able to let people search and filter through the jobs.We are planning to outsource this integration part to a freelancer but I’m not sure how much the market rate actually is for this kind of API integration. Please help me out!!Based in Singapore. And I have 0 idea how any of this works..",2,0.63,2,https://www.reddit.com/r/dataengineering/comments/1pydumv/api_integration_market_rate/,2025-12-29 05:32:05,2025-12-31 01:49:04
1pxf12w,Will I end up getting any job?,shimell,dataengineering,"I am currently working as data engineer, and my org uses SAS for ETL and Oracle for warehouse.For personal reasons I am about to quit the job and I want to transition into DBT, Snowflake. How do I get shortlisted for these roles? Will I ever get a job?Looking for job in Europe. I have valid visa to work as well.",1,0.56,6,https://www.reddit.com/r/dataengineering/comments/1pxf12w/will_i_end_up_getting_any_job/,2025-12-28 01:55:52,2025-12-31 01:49:04
1pwecy9,Learning to ask the right questions,Frosty_Musician_3278,dataengineering,"So my company runs qualitative tech audits for several purposes (M&A, Carveouts, health checks…). The questions we ask are a bit different from regular audits in the sense that they aren’t very structured with check list items. My team focuses specifically on data and analytics (typically downstream of OLTP), so It ends up being more of a conversation with data leads, data engineers, and data scientists. We ask questions to test maturity, scalability and reliability. I’m in a junior role and my job is basically taking notes while a lead conducts the questionnaire and deliver the write up based on my lead’s diagnosis and prescription. I have come to learn a lot of concepts on job and through projects of my own but I still lack the confidence and adaptability required to run interviews myself. So I need practice…Does anyone know where I can go to practice interviewing someone on either a data platform they have at work or something they built for a personal project? Alternatively, is anyone here interested in being interviewed (I imagine we could work something out that could be good prep for folks in the job market)?",2,0.76,3,https://www.reddit.com/r/dataengineering/comments/1pwecy9/learning_to_ask_the_right_questions/,2025-12-26 20:38:11,2025-12-31 01:49:04
1pvumcv,3 Desert Island Applications for Data Engineering Development,GuhProdigy,dataengineering,Just got my new laptop for school and am setting up my space. Led me to think about the top programs we need to do our work.Say you are new to a company and can only download 3 applications to your computer what would they be to maximize your potential as a data engineer?1. IDE - VSCode. With extensions you have so much functionality. 2. Git - obviously 3. Docker I guess these three are probably common for most devs lol. Coming in 4th for me would be an SFTP client. But you could just use a script instead. Docker is more beneficial I think. Edit: for sake of good conversation let’s just say VS Code and Git are pre installed. Edit 2: obviosuly the computer your work gave you came with an OS and a web browser. Like where are you working at bell labs LOL?,2,0.55,9,https://www.reddit.com/r/dataengineering/comments/1pvumcv/3_desert_island_applications_for_data_engineering/,2025-12-26 03:41:58,2025-12-31 01:49:04
1pur81k,Sql server views to snowflake,Ordinary_Bread6892,dataengineering,"Hi all, merry Christmas.We have few on premise sql server views, we are looking ways to move the to snowflake. Few options we are considering: airflow.Can you all please recommend best approach, we don’t want to use fivetran or any costly tool.Thanks in advance.",2,0.75,2,https://www.reddit.com/r/dataengineering/comments/1pur81k/sql_server_views_to_snowflake/,2025-12-24 16:26:34,2025-12-31 01:49:04
1pzkrx1,Tagging data (different file types and directories) for Windows,Aeriessy,dataengineering,"I've pursued this line of research for years now, often coming to resources that don't fit what I'm looking for (like TagSpaces didn't handle terabytes of media files well). I'm a data hoarder/enthusiast looking for a system to tag a variety of file types and directories in Windows (I'm not opposed to learning a different OS). The default ""Properties"" (for the NTFS ?) are easiest to search, but you can't tag all file types or directories.I use XYPlorer as my file explorer and I like it as a general file browser. I liked the flexibility of the tags, but didn't like how running a script in Command Line to bulk rename hundreds of image files would break the tag link since the tags are all recorded in a tag.dat file (which I'm not opposed to writing something to also change it in there, but I also didn't think it was a very flexible tag data storage method. I'm gathering people's experiences in hopes of finding something I can invest time into when it comes to tagging my media and being able to access it. Things I'm looking for:1. Ease of access (I figure I can write a script to handle the tag hierarchy and categories as needed)2. Tag flexibility (like bulk renaming a tag)3. Ease of tag-ability (while I liked Adobe Bridge to edit tags, it didn't flow the best for me)4. Data versatility (if I can access the data for different visuals at some point or export it into an Excel format)5. Kind of an extra would be doing the opposite of point 4 (adding tags from an Excel spreadsheet)Questions I have:1. Is it more efficient for my uses for tags to be in one main file (like how XYPlorer stores it's tags) or sidecar files (which I liked the concept, but not how TagSpaces did it, and I'm worried about a search function scouring all the sidecar files)?2. Are there other solutions that exist now that I haven't experienced?My solution that stands now is to figure out the way XYPlorer can natively batch rename files and just go with all tags being in the plain text file. I would love to know if anyone has encountered other options. Thank you!",1,0.6,1,https://www.reddit.com/r/dataengineering/comments/1pzkrx1/tagging_data_different_file_types_and_directories/,2025-12-30 15:20:47,2025-12-31 01:49:04
1pzjflo,13 Apache Iceberg Optimizations You Should Know,codingdecently,dataengineering,No content,1,0.56,1,https://overcast.blog/13-apache-iceberg-optimizations-you-should-know-85bc25690f00,2025-12-30 14:25:44,2025-12-31 01:49:04
1pyncvn,Data Engineering Template you can copy and make your own,DataSling3r,dataengineering,"I struggled for years trying to find the best way to create a Portfolio Site for my Projects, Articles etc. FINALLY found one I liked and am sticking to it. Wanted to save others in the same boat the time and frustration I faced so made this walkthrough video for how others can quickly copy it and customize it for their own use case. Hope it helps some folks out there. [https://youtu.be/IgB7TM5wRQ8](https://youtu.be/IgB7TM5wRQ8)",1,0.57,0,https://www.reddit.com/r/dataengineering/comments/1pyncvn/data_engineering_template_you_can_copy_and_make/,2025-12-29 14:16:09,2025-12-31 01:49:04
1py0prt,Workflow processes,Pucci800,dataengineering,"How would you create a project to showcase possibly a way to save time, money, and resources through data? 1. Say you know the majority of issues stem from points of entry. Incorrect PII, paperwork missing important details/format other paperwork needed to validate other information etc. These can be uploaded via mobile, through a branch, online or physical mail.2. You personally log errors provided by the ‘opposing’ company for why this process didn’t complete. 55% of the time you get an actual reason provided and steps to resolve by sending a communication or resolving by updating or correcting issue with information provided. Other times it will be a generic reason provided by the ‘main team’ and nothing notated by the ‘opposing team’ and you would have to do additional research to send the proper communication to a client or their advisor/liaison. Or figure out the issue and resolve it then and there. 3. There are appropriate forms of communication to send to the client/advisor with steps to complete the process. If you collected data from the top biggest ‘opposing teams’ and have data to present would they be able to change some of their rules? Would you be able impose stricter guidelines at the point of entry when information comes through so the issue ceases before reaching point b? Once enough data and proof have been collected and shown to these ‘opposing teams’? 4. Issue is there is no standardization for these rejection reasons. The given ones in lists are not exhaustive enough. Majority work but do not fit all situations. If you were to see the same rejection reason from specific ‘opposing teams’ aka Firms. How would you collect and present that data to impose change? Could you collect enough data organize it by Firm, rejection reason, true reason & system reason, time/date, and visualize it? “This firm caused by X amount to y. This firm caused us xyz if we were to do this and eliminate this it would save us xyz. Basically reducing same reoccurring issues so we could focus on more complex things? This might not make sense as I’m not using names etc etc but it is in the financial services realm. Was seeing if there was a type of creative angle for this. Or any ideas from data professionals as something I could work on as a project throughout the year in 2026.",0,0.5,1,https://www.reddit.com/r/dataengineering/comments/1py0prt/workflow_processes/,2025-12-28 19:54:29,2025-12-31 01:49:04
1pxolkh,Building an AI Data Analyst: The Engineering Nightmares Nobody Warns You About,squadfi,dataengineering,"Building production AI is 20% models, 80% engineering. Discover how Harbor AI evolved into a secure analytical engine using table-level isolation, tiered memory, and specialized tools. A deep dive into moving beyond prompt engineering to reliable architecture",0,0.5,0,https://harborscale.com/blog/building-an-ai-data-analyst-the-engineering-nightmares-nobody-warns-you-about/,2025-12-28 10:51:16,2025-12-31 01:49:04
1pxs25a,9 Data Lake Cost Optimization Tools You Should Know,codingdecently,dataengineering,No content,0,0.5,1,https://overcast.blog/9-data-lake-cost-optimization-tools-you-should-know-2a5995be8f4b,2025-12-28 14:02:09,2025-12-31 01:49:04
1pwynww,Released new version of my python app: TidyBit. Now available on Microsoft Store and Snap Store,swaroop_34,dataengineering,"I developed the python app named TidyBit. It is a File Organizer app. Few weeks ago i posted about it and received good feedback. I made improvements to the app and released new version. The app is now available to download from Microsoft store and Linux Snap store.**What My Project Does:**TidyBit is a File Organizer app. It helps organize messy collection of files in folders such as Downloads, Desktop or from External drives. The app identifies each file type and assigns a category. It groups files with same category and total file count in each category then displays that information in main UI. It creates category folders in desired location and moves files to their category folders.*The best part is: The File Organization is Fully Customizable.*This is one of the important feedback that i got. The previous version didn't have this feature. In this latest version, in app settings, there are file organization rules.The app comes with commonly used file types and file categories as rules. These rules define what files to identify and how to organize them. The predefined rules are fully customizable.Add new rules, modify or delete existing rules. Customize the rules how you want. In case you want to reset the rules to defaults, an option is available in settings.**Target Audience:**The app is intended to be used by everyone. TidyBit is a desktop utility tool.**Comparison:**Most other file organizer apps are not user-friendly. Most of them are decorated scripts or paid apps. TidyBit is a cross-platform open-source app. The source code is available on GitHub. For people who worry about security, TidyBit app is available on Microsoft Store and Linux Snap store. The app is also available to download as an executable file for windows and portable Linux App Image format on GitHub releases.Check the app: [TidyBit Github Repository](https://github.com/Veda-Swaroop/TidyBit)",0,0.44,0,https://www.reddit.com/r/dataengineering/comments/1pwynww/released_new_version_of_my_python_app_tidybit_now/,2025-12-27 14:08:29,2025-12-31 01:49:04
1puel0t,Need guidance: Next move of DE,DayIll941,dataengineering,"Hey all :waving_hand:,I’m currently a senior data engineer, primarily focused on data pipelines (batch ETL/ELT, Spark/Glue/Iceberg, etc.).Lately, I’ve noticed a subtle shift towards building data processes using microservices instead of pipelines and a recommendations from principal engineers and senior PE towards microservices instead of data lakes etcHas anyone here done this in your projects ? What was the feedback? Did it work?Also, I’m toying with the idea of learning Java-based microservices, learning API modeling and potentially transitioning into an SDE role within my company.Would love to hear from folks who’ve walked this path. Any regrets, lessons learned, or unexpected benefits?",0,0.45,10,https://www.reddit.com/r/dataengineering/comments/1puel0t/need_guidance_next_move_of_de/,2025-12-24 04:36:56,2025-12-31 01:49:04
1pzlrbp,Seeking advice on starting a Data Engineering career in Germany as a recent immigrant,Green_Inspector5904,dataengineering,"Hello, I recently moved to Germany(Hamburg) and wanted to ask for some advice, as I’m still trying to objectively understand where I stand in the German job market.I’m interested in starting a career in Data Engineering in Germany, but I’m honestly not fully sure how to approach the beginning of my career here. I’ve already applied to several companies for DE positions, but I’m unsure whether my current profile aligns well with what companies typically expect at the entry or junior level.I have hands-on experience using Python, SQL, Qdrant, Dataiku, LangChain, LangGraph.I’ve participated in launching a production-level chatbot service, where I worked on data pipelines and automation around AI workflows. One of my main concerns is that while I understand PySpark, Hadoop, and big data concepts at a theoretical level, I haven’t yet used them extensively in a real production environment. I’m actively studying and practicing them on my own, but I’m unsure how realistic it is to land a DE role in Germany without prior professional experience using these tools.# Additionally, I’m not sure how relevant this is in Germany, but, I graduated top of my class from a top university in my home country and I previously worked as an AI problem solver intern (3 months) at an MBB consulting firm.Any advice or shared experiences would be greatly appreciated. Thank you very much for your time and help in advance.",0,0.31,4,https://www.reddit.com/r/dataengineering/comments/1pzlrbp/seeking_advice_on_starting_a_data_engineering/,2025-12-30 15:59:45,2025-12-31 01:49:04
1py4j8c,Databricks SQL DW - stating the obvious.,SmallAd3697,dataengineering,"Databricks used to advocate storage solutions that were based on little more than delta/parquet in blob storage. They marketed this for a couple years and gave it the name ""lakehouse"". Open source functionality was the name of the game.But it didn't last long. Now they are advocating a proprietary DW technology like all the other players (snowflake, fabric DW, redshift,.etc)Conclusions seem to be obvious:- they are not going to open source their DW, or their lakebase- they still maintain the importance of delta/parquet but these are artifacts that are generated as a byproduct of their DW engine.- ongoing enhancements like MST will mean that the most authoritative and the most performant copy of data is found in the managed catalog of their DW.The hype around lakehouses seems like it was so short lived. We seem to be reverting back to conventional and proprietary database engines. I hate going round in circles, but it was so predictable.EDITED: typos",0,0.47,24,https://www.reddit.com/r/dataengineering/comments/1py4j8c/databricks_sql_dw_stating_the_obvious/,2025-12-28 22:29:03,2025-12-31 01:49:04
1pvpiyb,Data Christmas Wishes,thealexmerced,dataengineering,What do you wish you me tools can do for you they aren’t doing now? Maybe Data Santa will reward you in 2026 if your modeling is nice and not naughty!,0,0.36,6,https://www.reddit.com/r/dataengineering/comments/1pvpiyb/data_christmas_wishes/,2025-12-25 23:19:03,2025-12-31 01:49:04
1pz4il1,"It is worth joining dataexpert.io's ""The 15-week 2026 Data and AI Engineering Challenge"" Bootcamp, priced at $7,500.",ChiragLakhanpal1228,dataengineering,"I'm considering whether to join dataexpert.io's ""The 15-week 2026 Data and AI Engineering Challenge"" Bootcamp, which costs $7,500. It feels quite expensive, so I'm curious if there are additional benefits, like networking opportunities, especially if my goal is to secure a job at a big tech company.",0,0.1,9,https://www.reddit.com/r/dataengineering/comments/1pz4il1/it_is_worth_joining_dataexpertios_the_15week_2026/,2025-12-30 01:27:53,2025-12-31 01:49:04
1pymutm,Working in Netherlands as data engineer,ConsiderationKey6478,dataengineering,"Anyone who is working in Netherlands as data engineer, who applied from India ?",0,0.1,0,https://www.reddit.com/r/dataengineering/comments/1pymutm/working_in_netherlands_as_data_engineer/,2025-12-29 13:53:55,2025-12-31 01:49:04
1py3rg0,1TB of Parquet files. Single Node Benchmark. (DuckDB style),averageflatlanders,dataengineering,No content,0,0.41,6,https://dataengineeringcentral.substack.com/p/1tb-of-parquets-single-node-benchmark,2025-12-28 21:57:30,2025-12-31 01:49:04
1pylzvk,Creating Pipelines using AI Agents,Toosterpan06,dataengineering,"Hello everyone! I was too much fed up with creating pipelines so I created a multiagent system which will create like 85 percent of the pipelines, essentially letting us the developers the rest of 15 percent of the project.Requesting your views on the same!GitHub: https://github.com/VishnuNambiar0602/Agentic-MLOPs",0,0.27,2,https://www.reddit.com/r/dataengineering/comments/1pylzvk/creating_pipelines_using_ai_agents/,2025-12-29 13:14:46,2025-12-31 01:49:04
