id,title,author,subreddit,content,score,upvote_ratio,num_comments,url,created_utc,extracted_at
1qoiat1,Are you seeing this too?,Thinker_Assignment,dataengineering,"Hey folks - i am writing a blog and trying to explain the shift in data roles in the last years.Are you seeing the same shift towards the ""full stack builder"" and the same threat to the traditional roles?please give your constructive honest observations , not your copeful wishes.",470,0.97,64,https://i.redd.it/be8dnrui2xfg1.png,2026-01-27 16:17:38,2026-02-02 02:23:59
1qp0f0i,The Data Engineer Role is Being Asked to Do Way Too Much,FreshIntroduction120,dataengineering,"I've been thinking about how companies are treating data engineers like they're some kind of tech wizards who can solve any problem thrown at them.Looking at the various definitions of what data engineers are supposedly responsible for, here's what we're expected to handle:1. Development, implementation, and maintenance of systems and processes that take in raw data2. Producing high-quality data and consistent information3. Supporting downstream use cases4. Creating core data infrastructure5. Understanding the intersection of security, data management, DataOps, data architecture, orchestration, AND software engineeringThat's... a lot. Especially for one position.I think the issue is that people hear ""engineer"" and immediately assume ""Oh, they can solve that problem."" Companies have become incredibly dependent on data engineers to the point where we're expected to be experts in everything from pipeline development to security to architecture.I see the specialization/breaking apart of the Data Engineering role as a key theme for 2026. We can't keep expecting one role to be all things to all people.What do you all think? Are companies asking too much from DEs, or is this breadth of responsibility just part of the job now?",424,0.97,45,https://i.redd.it/w4zzttsgh0gg1.jpeg,2026-01-28 03:43:28,2026-02-02 02:23:59
1qqdp7l,"With ""full stack"" coming to data, how should we adapt?",Thinker_Assignment,dataengineering,"I recently posted a diagram of how in 2026 the job market is asking for generalists.Seems we all see the same, so what's next? If AI engineers are getting salaries 2x higher than DEs while lacking data fundamentals, what's stopping us from picking up some new skills and excelling?",223,0.85,103,https://i.redd.it/rhfuo2oygbgg1.png,2026-01-29 16:42:38,2026-02-02 02:23:59
1qnispr,[Laid Off] I’m terrified. 4 years of experience but I feel like I know nothing.,bi-polar--bear,dataengineering,"I was fired today (Data PM). I’m in total shock and I feel sick.Because of constant restructuring (3 times in 1.5 years) and chaotic startup environments, I feel like I haven't actually learned the core skills of my job. I’ve just been winging it in unstructured backend teams for four years.Now I have to find something again and I am petrified. I feel completely clueless about what a Data PM is actually supposed to do in a normal company. I feel unqualified.I’m desperate. Can someone please, please help me understand how to prep for this role properly? I can’t afford to be jobless for long and I don’t know what to do.",201,0.96,64,https://www.reddit.com/r/dataengineering/comments/1qnispr/laid_off_im_terrified_4_years_of_experience_but_i/,2026-01-26 15:17:29,2026-02-02 02:23:59
1qqm5vk,"Being the ""data guy"", need career advice",jonfromthenorth,dataengineering,"I started in the company around 7 months ago as a Junior Data Analyst, my first job. I am one of the 3 data analysts. However, I have become the ""data guy"". Marketing needs a full ETL pipeline and insights? I do it. Product team need to analyze sales data? I do it. Need to set up PowerBI dashboards, again, it's me. I feel like I do data engineering, analytics engineering, and data analytics. Is this what the industry is now? I am not complaining, I love the end-to-end nature of my job, and I am learning a lot. But for long-term career growth and salary, I don't know what to do. Salary: 60k",144,0.96,47,https://www.reddit.com/r/dataengineering/comments/1qqm5vk/being_the_data_guy_need_career_advice/,2026-01-29 21:47:36,2026-02-02 02:23:59
1qnqbqm,The Certifications Scam,ivanovyordan,dataengineering,"I wrote this because as a head of data engineering I see aload of data engineers who trade their time for vendor badges instead of technical intuition or real projects.Data engineers lose the direction and fall for vendor marketing that creates a false sense of security where ""Architects"" are minted without ever facing a real-world OOM killer. And, It’s a win for HR departments looking for lazy filters and vendors looking for locked-in advocates, but it stalls actual engineering growth. As a hiring manager half-baked personal projects matter way more than certification. Your way of working matters way more than the fact that you memoized the pricing page of a vendor.So yeah, I'd love to hear from the community here:\- Hiring managers, do ceritication matter?\- Job seekers. have certificates really helped you find a job?",142,0.91,83,https://www.datagibberish.com/p/the-certifications-scam,2026-01-26 19:34:19,2026-02-02 02:23:59
1qqsfmm,Got told ‘No one uses Airflow/Hadoop in 2026’.,Useful-Bug9391,dataengineering,They wanted me to manage a PySpark + Databricks pipeline inside a specific cloud ecosystem (Azure/AWS). Are we finally moving away from standalone orchestration tools?,134,0.94,87,https://www.reddit.com/r/dataengineering/comments/1qqsfmm/got_told_no_one_uses_airflowhadoop_in_2026/,2026-01-30 02:06:30,2026-02-02 02:23:59
1qrlhoj,Shopify coding assessment - recommendations for how to get extremely fluent in SQL,Bnerna,dataengineering,"I have an upcoming coding assessment for a data engineer position at Shopify. I've used SQL to query data and create pipelines, and to build the tables and databases themselves. I know the basics (WHERE clauses, JOINs, etc) but what else should I be learning/practicing.I haven't built a data pipeline with just sql before, it's mostly python.",69,0.95,26,https://www.reddit.com/r/dataengineering/comments/1qrlhoj/shopify_coding_assessment_recommendations_for_how/,2026-01-30 23:18:21,2026-02-02 02:23:59
1qozv1g,Real-life Data Engineering vs Streaming Hype – What do you think?,FreshIntroduction120,dataengineering,"I recently read a post where someone described the reality of Data Engineering like this:Streaming (Kafka, Spark Streaming) is cool, but it’s just a small part of daily work.Most of the time we’re doing “boring but necessary” stuff: Loading CSVs Pulling data incrementally from relational databases Cleaning and transforming messy dataThe flashy streaming stuff is fun, but not the bulk of the job.What do you think?Do you agree with this?Are most Data Engineers really spending their days on batch and CSVs, or am I missing something?",69,0.95,46,https://www.reddit.com/r/dataengineering/comments/1qozv1g/reallife_data_engineering_vs_streaming_hype_what/,2026-01-28 03:18:04,2026-02-02 02:23:59
1qqm3io,Was asked by a client to build a Finance Cube in 1.5 months,Better_Code5670,dataengineering,"As title says!4 ERPS, no infrastructure, just an existing SQL Server!They said okay start with 1 ERP and to be able to deliver by Q1, daily refresh, drill down functionality! I said this is not possible in such a short timeframe!They said; data is clean, only a few tables in ERP, why would you say it takes longer than that? They said Architecture is at most 2 days, and there are only a few tables! I said for a temporary solution since they are interested not to do these excel reports manually most I can offer is an automated excel report, not a full blown cube! Otherwise Im not able to commit a 1.5 months timeline without having seen myself the ERP landscape, ERP connectors, precisely what metrics/kpis are needed etc! They got mad and accused me of “sales pitching” for presenting the longer timeline of discovery->architecture->data modelling->medallion architecture steps!!",63,0.93,32,https://www.reddit.com/r/dataengineering/comments/1qqm3io/was_asked_by_a_client_to_build_a_finance_cube_in/,2026-01-29 21:45:05,2026-02-02 02:23:59
1qq9o22,Reading 'Fundamentals of data engineering' has gotten me confused,Online_Matter,dataengineering,"I'm about 2/3 through the book and all the talk about data warehouses, clusters and spark jobs has gotten me confused. At what point is a RDBMS not enough that a cluster system is necessary?",64,0.93,69,https://www.reddit.com/r/dataengineering/comments/1qq9o22/reading_fundamentals_of_data_engineering_has/,2026-01-29 14:14:34,2026-02-02 02:23:59
1qsm2gq,How to learn OOP in DE?,EconMadeMeBald,dataengineering,"I’m trying to learn OOP in the context of DE, while I do a lot of work DE work, I haven’t found a reason why to use classes which is probably due lack of knowledge. So I was wondering are there sources that you recommend that could help fill in the gaps on OOP in DE?",53,0.94,43,https://www.reddit.com/r/dataengineering/comments/1qsm2gq/how_to_learn_oop_in_de/,2026-02-01 02:32:50,2026-02-02 02:23:59
1qq5902,Is Microsoft Fabric really worth it?,kaapapaa,dataengineering,"I am a DE with 7 years of experience. I have 3 years of On-prem and 3 years of GCP experience. For the last 1 year, I have been working on a project where Microsoft Fabric is being used. I am currently trying to switch, but I don't see any openings on Microsoft Fabric. I know Fabric is in its early years, but I'm not sure how to continue with this tech stack. Planning to move to GCP related roles. what do you think?",55,0.92,86,https://www.reddit.com/r/dataengineering/comments/1qq5902/is_microsoft_fabric_really_worth_it/,2026-01-29 10:40:56,2026-02-02 02:23:59
1qr1ah1,Alternate careers from IT/Data ??,No_Song_4222,dataengineering,"Switched to data field \~2yrs back ( had to do a masters degree) while I enjoy it I feel the time I spent in the industry isn't sufficient. There is so much more I could do would have wanted to do. Heck I have just been in one domain also.My company lately have been asking us to prepare datasets to feed to agentic AI. While it answers the basics right it still fails at complex things which require deep domain and business knowledge.There are several prompts injected and several key business indicators defined so the Agent performs good ( honestly if we add several more layers of prompt and chain few more agents it would get to answer come hard questions involving joining 6+ tables as well)Since it already answers some easy to medium questions based on your prompts the headcounts are just slashing. No I am good at what I do but I won't self proclaim as top 1%. I have very strong skillset to figure things out if I don't know about it. A coworker of mine has been the company for 6 years and didn't even realize how to solve things which I could do it ( even though I had no idea in the first place as well) . I just guess this person has become way more comfy and isn't aware how wild things are outside.Is there anyone actively considering goose farming or something else out of this AI field ?There is joy in browsing the internet without prompts and scrolling across website. There is joy in navigating UIs, drop downs and looking at the love they have put in. There is joy in minimizing the annoying chat pop that open ups at the website.And last thing I want to read is AI slop books by my fav authors.There is reason why chess is still played by humans and journalist still put heart out in their writing. There will also be a reason human DE/DS/DA/AE would be present in future but maybe a lot less.What's the motivation to still pursue this field ? I love anything related to data to be honest and for me that is the only one. I love eat and breathe data even if I am jobless now because of AI first policy my company has taken.",51,0.88,21,https://www.reddit.com/r/dataengineering/comments/1qr1ah1/alternate_careers_from_itdata/,2026-01-30 09:55:38,2026-02-02 02:23:59
1qqlucd,Oops it's a Drakanian Product,aleda145,dataengineering,No content,52,0.96,1,https://i.redd.it/v7l5msq2xcgg1.png,2026-01-29 21:35:12,2026-02-02 02:23:59
1qsg6tc,Puzzle game to learn Apache Spark & Distributed Computing concepts,Elegant_Debate8547,dataengineering,"https://i.redd.it/fsa3dtvkfrgg1.gifHello all!I'm new in this subreddit! I'm a Data Engineer with +3 years of experience in the field.As shown in the attached image, I'm making an ETL simulator in JavaScript, that simulates the data flow in a pipeline.Recently I came across a Linkedin post of a guy showcasing this project : [https://github.com/pshenok/server-survival](https://github.com/pshenok/server-survival)He made a little tower defense game that interactively teaches Cloud Architecture basics.It was interesting to see the engagement of the DevOps community with the project. Many have starred and contributed to the Github repo.I'm thinking about building something silimar for Data Engineers, given that I have some background in Game Dev and UI/UX too. I still need your opinion though, to see whether or not it is going to be that useful, especially that it will take some effort to come up with something polished, and AI can't help much with that (I'm coding all of the logic manually).The idea is that I want to make it easy to learn Apache Spark internals and distributed computing principles. I noticed that many Data Engineers (at least here in France), including seniors/experts, say they know how to use Apache Spark, yet they don't deeply understand what's happening under the hood.Through this game, I'll try to concretize the abstract concepts and show how they impact the execution performance, such as : transformations/actions, wide/narrow transformations, shuffles, repartition/coalesce, partitions skew, spills, node failures, predicate pushdown, ...etcYou'll be able to build pipelines by stacking transformer blocks. The challenge will be to produce a given dataframe using the provided data sources, while avoiding performance killers and node failures. In the animated image above, the sample pipeline is equivalent to the following Spark line : `new_df = source_df.filter($""shape"" === ""star"").withColumn(""color"", lit(""orange""))`I represented the rows with shapes. The dataframe schema will remain static (shape, color, label) and the rendering of each shape reflects the content of the row it represents. Dataframe here is a set of shapes.I'm still hesitant about this representation. Do you think it is intuitive and easy to understand ? I can always revert to the standard tabular visualisation of rows with dynamic schemas, but I guess it won't look user friendly when there are a lot of rows in action.The next step will be to add logical multi-node clusters in order to simulate the distributed computing. The heaviest task that I estimated would be the implementation of the data shuffling.I'll share the source code within the next few days, the project needs some final cleanups.In the meanwhile, feel free to comment or share anything helpful :)",48,0.98,3,https://www.reddit.com/r/dataengineering/comments/1qsg6tc/puzzle_game_to_learn_apache_spark_distributed/,2026-01-31 22:21:37,2026-02-02 02:23:59
1qq39sr,Is Microsoft Fabric revenue just Power BI revenue?,AwayCommercial4639,dataengineering,"Microsoft folks on Linked In have been talking up Fabric's growth and revenue calling it the fastest growing ... 2B $ growing at 60% YoY. But then then of our partners pointed out in 2022 when Power BI was mentioned in their financials as part of Power Platform, Power Platform revenue was 2B $ growing at 72% YoY.Today there is no mention of Power Platform revenue.Since Fabric is a pay to play subscription with F64s replacing the good old P1s. My guess is that the lion's share of that 2B is Power BI.Power BI subscriptions still rule :)",44,0.96,16,https://www.reddit.com/r/dataengineering/comments/1qq39sr/is_microsoft_fabric_revenue_just_power_bi_revenue/,2026-01-29 08:41:08,2026-02-02 02:23:59
1qsqhzm,How to become senior data engineer,Sudden-Inflation2686,dataengineering,I am trying to develop my skills be become senior data engineer and I find myself under confident during interviews .How do you analyze a candidate who can be fit as senior position?,38,0.79,17,https://www.reddit.com/r/dataengineering/comments/1qsqhzm/how_to_become_senior_data_engineer/,2026-02-01 06:08:16,2026-02-02 02:23:59
1qprrd8,Is a ~12% pay cut worth it to pivot from Consulting to Analytics Engineering (Databricks) at a stable End Client?,Prudent-Finger6368,dataengineering,"Hi everyone,I am facing a career dilemma and would love some insights, especially from those who have transitioned from Consulting to an Internal Role (End Client).My Profile:•Current Role: Data Analyst / BI Consultant.•Experience: 5 years (mainly Power BI, SQL, some Python).•Current Situation: Working for a Consulting Firm (ESN) in a major French city. My mission ended in December due to budget cuts, and I am currently “on the bench” (inter-contract) with my probation period ending soon.•The Issue: I am tired of the consulting model (instability, lack of ownership, dependency on random missions). I want to stabilize and, most importantly, transition into Analytics Engineering / Data Engineering.The Offer (Internal Role):I have an offer for a permanent contract (CDI) at an End Client (a digital subsidiary of a massive Fortune 500 industrial group, approx. 50 people in this specific entity).•Title: Senior Analytics Engineer (New position creation).•Tech Stack: Databricks / Spark + Power BI (Medallion architecture, Digital Performance & E-commerce focus). This is exactly the stack I need to master for my future career steps.•The “Catch”: The fixed base salary offer is 12.5% lower than my current base salary in consulting.•Variable: There is a 10% variable bonus (performance-based), which brings the total package closer to my current pay, but the guaranteed monthly income is definitely lower.My Plan / Strategy:1.Tech: Acquire deep expertise in Databricks and Data Engineering (highly in demand).2.Domain: The role focuses on Digital Performance / E-commerce, which seems valuable.My Questions for the community:1.Does taking a 12.5% step back on base salary seem justified to gain the Databricks expertise + the stability of an internal role?2.Is it risky to accept a “Senior” job title that pays below market rate for that level, or will the title itself be valuable on my CV in 2 years?3.Has anyone here taken a pay cut to pivot technically? What was the ROI after 2-3 years?Thanks in advance for your advice!",38,0.91,35,https://www.reddit.com/r/dataengineering/comments/1qprrd8/is_a_12_pay_cut_worth_it_to_pivot_from_consulting/,2026-01-28 23:30:22,2026-02-02 02:23:59
1qpurc0,Streamlit Proliferation,MahaloCiaoGrazie,dataengineering,"With the push of Claude code at larger enterprises, how are people planning on managing Streamlit proliferation.It’s an incredibly powerful tool, and I imagine a situation where someone architects Snowflake to agentically build databases and tables for each app, but I’m a little nervous that by the end of the year I will have 1000 Streamlit apps with in a single database.What’s everyone else thinking, and how are y’all planning to manage and govern it?",35,0.91,26,https://www.reddit.com/r/dataengineering/comments/1qpurc0/streamlit_proliferation/,2026-01-29 01:35:28,2026-02-02 02:23:59
1qplapl,How and where can i practice PySpark ?,SnooCakes7436,dataengineering,Currently learning PySpark. Want to practice but unable to find any site where i can do that. Can someone please help ? Want a free online source for practicing,28,0.98,28,https://www.reddit.com/r/dataengineering/comments/1qplapl/how_and_where_can_i_practice_pyspark/,2026-01-28 19:27:26,2026-02-02 02:23:59
1qp1uqw,That feeling of being stuck,Expensive-Worry9166,dataengineering,"10+ years in a product based companyWorking on an Oracle tech stack. Oracle Data Integrator, Oracle Analytics Server, GoldenGate etc.When I look outside, everything looks scary.The world of analytics and data engineering has changed. Its mostly about Snowflake or Databricks or few other tools. Add AI to it and its giving me a feeling I just cant catch upI fear how can i catch up with this. Have close to 18 YOE in this area. Started with Informatica then AbInitio and now onto the Oracle stack. Learnt Big Data, but never used it. Forgot it. Trying to cope with the Gen AI stuff and see what can do here (atleast to keep pace with the developments)But honestly, very clueless about where to restart. I feel stagnant. Whenever I plan to step out of this zone, I step behind thinking I am heavily underprepped for this. And all of this being in India. More the YOE, lesser the value opportunities you have in market.",22,0.88,13,https://www.reddit.com/r/dataengineering/comments/1qp1uqw/that_feeling_of_being_stuck/,2026-01-28 04:51:17,2026-02-02 02:23:59
1qqvw49,Data Engineer with Analytics Background (International Student) – What Should I Focus on in 2026?,NeitherWarning3834,dataengineering,"Hi everyone, I recently graduated with a Master’s in Data Analytics in the US, and I’m trying to transition into a Data Engineering role. My bachelor’s was in Mechanical Engineering, so I don’t have a pure CS background.Right now, I’m on OPT (STEM OPT coming later), and I’m honestly feeling a bit overwhelmed about how competitive the market is. I know basic Python and SQL, and I’m currently learning:* AWS (S3, Glue, Lambda, Athena)* Data modeling (fact/dimension tables)* dbt and Airflow* Some PySpark My goal is to land an entry-level or junior Data Engineer role in the next few months. I’d really appreciate advice on:1. What skills are actually critical for junior Data Engineers in 2026?2. What projects would make my cv stand out?3. Should I focus more on Spark/Databricks, AWS pipelines, or software engineering fundamentals (DSA, system design)?4. Any tips for international students on finding sponsors or W-2 roles?Be brutally honest; even if the path is hard, I want realistic guidance on what to prioritize.",23,0.88,13,https://www.reddit.com/r/dataengineering/comments/1qqvw49/data_engineer_with_analytics_background/,2026-01-30 04:46:25,2026-02-02 02:23:59
1qqhdks,Thoughts on Metadata driven ingestion,Famous_Substance_,dataengineering,"I’ve been recently told to implement a metadata driven ingestion frameworks, basically you define the bronze and silver tables by using config files, the transformations from bronze to silver are just basic stuff you can do in a few SQL commands.However, I’ve seen multiple instances of home-made metadata driven ingestion frameworks, and I’ve seen none of them been successful.I wanted to gather feedback from the community if you’ve implemented a similar pattern at scale and it worked great",21,0.94,22,https://www.reddit.com/r/dataengineering/comments/1qqhdks/thoughts_on_metadata_driven_ingestion/,2026-01-29 18:51:49,2026-02-02 02:23:59
