id,title,author,subreddit,content,score,upvote_ratio,num_comments,url,created_utc,extracted_at
1q060x6,Feeling overwhelmed as an entry SWE. Looking to vent / for advice.,PokaHatsu,cscareerquestions,"My entire team is filled with senior developers and I am the only recent entry hire. When I was interning, there was another entry developer that stayed on for around two years but left due to no promotion (they said he kinda sucked delivery wise).I am told I do good work and meet expectations, I expect a promotion this year after a year of work post grad. But our team is a little dysfunctional in the sense that it isn't a team and individuals are siloed on specific applications. We have little to no documentation. So anytime I am introduced to new tech or systems, my seniors really do hand hold me, to which I am appreciative of. I am not the type that asks the same questions over and over, I just need to see it once throughly and I can replicate what they've taught me.The problem is, after a year of this siloed style of work, I am getting burnt out. I can not stand coding. There have been multiple occasions for multiple projects where I have stayed at work alone and extremely late, staying until 8-10pm, just typing away at my computer. Recently I have been tasked with developing an entire web app alone. It's functionality seems simple but no application meant for production is ever simple. We are understaffed, so there is nobody else to divy up project tasks with. I've asked if we have any plans to get more entry hires on the team and it is always met with a soft no, the company is on a hiring freeze, economy yada yada.I talk with my friends from uni who are all working. Their teams practice agile and scrum philosophies, and their coding tasks are divided up for multipe team members. They love their jobs. Their eyes bulge when I tell them about my work load and my work effort. I always feel unfortunate when I hear about how lucky they have been, but really, it sounds like those types of tech teams are the standard and I am the unlucky one to have landed in an underdeveloped team. Senior developers can afford to ignore a team dynamic like this and still be successful in it.In my eyes, saying that this is too much work is basically telling them I am not up for the job and I might as well quit honestly. I know I can handle it, I mean I am meeting their latest expectation for an entire web application on my own, but I do not want to handle this anymore. It used to make me so happy to run an application and see the results of my hard work in action, but I genuinely can't even stand opening visual studio anymore.With how bad the job market is, I am scared to walk away. But I know if I continue to eat my feelings about this, I might turn impulsive and quit without any plan for my career or cut ties in a bad way. I don't want to fall into a slump.",48,0.87,20,https://www.reddit.com/r/cscareerquestions/comments/1q060x6/feeling_overwhelmed_as_an_entry_swe_looking_to/,2025-12-31 06:25:58,2026-01-07 01:49:59
1q56xiq,What should a junior SWE do in the age of LLMs?,ShadowCyph,cscareerquestions,"It's been widely discussed that junior headcount will be reduced over the coming years due to AI, and I was wondering what the best course of action is for juniors who are employed *right now*. Of course, up-leveling is obvious as well as getting used to + being proficient in AI tooling. But is there anything else that can be done at this stage? This is not meant to be a doom post at all, just curious.",37,0.77,52,https://www.reddit.com/r/cscareerquestions/comments/1q56xiq/what_should_a_junior_swe_do_in_the_age_of_llms/,2026-01-06 03:01:25,2026-01-07 01:49:59
1q4698z,"Those who live in tech hubs, how long did it take you to achieve what you came there for?",I-already-redd-it-,cscareerquestions,"Those of you who have lived in tech hubs (NYC, Seattle, SF) for the career opportunities, how long did it take to get the career progression you were looking for?Super vague and unquantifiable, I know, but I’m just curious from the perspective of someone who would love to move to one of these areas for the networking/jobs, but would prefer to live elsewhere in the long run. Did it help your career to move there for a few months? 5 years? 10? Did you not achieve them? Extremely subjective, I’m just looking for personal anecdotes. Thanks for any and all help.",38,0.91,17,https://www.reddit.com/r/cscareerquestions/comments/1q4698z/those_who_live_in_tech_hubs_how_long_did_it_take/,2026-01-05 00:13:12,2026-01-07 01:49:59
1q4t5e1,Canada is definitely inflecting higher...I guess interest rate cuts actually work?,Affectionate_Nose_35,cscareerquestions,"[Software Development Job Postings on Indeed in Canada (IHLIDXCATPSOFTDEVE) | FRED | St. Louis Fed](https://fred.stlouisfed.org/series/IHLIDXCATPSOFTDEVE) Definitely a positive trend...if this continues, a recovery in jobs should be palpable by jobs seekers.",36,0.83,48,https://www.reddit.com/r/cscareerquestions/comments/1q4t5e1/canada_is_definitely_inflecting_higheri_guess/,2026-01-05 18:09:11,2026-01-07 01:49:59
1q0hquq,What industries appreciate PhD graduates?,TheIntrusiveThoughs,cscareerquestions,"I've just finished all my prerequisite courses and am looking for full time employment as I do my dissertation. I want to work full time and do my dissertation after hours/over the weekend (I have literally no other classes or obligations right now so this is viable for me). If I'm lucky I heard other people submitted their paid work for their dissertation, though I'm not relying on that.I’ve been specializing in data science/AI, but I was wondering what other industries that prefer PhD's over bachelors (and the corresponding pay raise).In essence, as I look for employment what other job titles should I consider?Clarification: My degree is ""Doctor of Philosophy in Computer Engineering"" and I used my electives to get a graduate certificate in Data Science, I just want to know what other opportunities are available before I fully commit to data science.Clarification 2: Yes I've done my basic research and generally intend to go into data science because of higher pay and because higher education provides a competitive advantage in the industry. This is my last chance to change course before I fully commit, so I was wondering if anyone actually in industry knew of other opportunities not listed in the ""top 10"" sites which I should know about.",33,0.69,89,https://www.reddit.com/r/cscareerquestions/comments/1q0hquq/what_industries_appreciate_phd_graduates/,2025-12-31 16:58:17,2026-01-07 01:49:59
1q5bh28,Anyone else deliberately not move up as they get more senior? Looking for perspectives on burnout and longevity.,Number1Mango,cscareerquestions,"I have been in tech for 20+ years and currently work as a Senior Solutions Architect with a focus on cloud. I wear a lot of hats, presales, solution design, implementation, and work independently most of the time. I am also fully remote, which is a big part of why this setup works for me.I have had multiple opportunities to move into more “senior” or leadership roles but have consistently declined. In practice, those roles usually mean hybrid work, more meetings, more politics, less hands-on delivery, and often more exposure during layoffs. I have seen plenty of people make that move and then get cut early during restructures.The downside is burnout. Covering multiple phases and constant context switching takes a toll, especially as I get older. I am trying to think about sustainability and career longevity rather than titles.For those who have been at this a long time:Did switching roles actually reduce burnout?Did you feel more exposed during layoffs?How did you make your value visible when outcomes were less tangible?Looking for real-world experiences, not theory.",31,0.97,8,https://www.reddit.com/r/cscareerquestions/comments/1q5bh28/anyone_else_deliberately_not_move_up_as_they_get/,2026-01-06 06:47:17,2026-01-07 01:49:59
1q5acoz,"Junior dev looking for fulltime work for 3 years, desperately needing funds. What can I do?",WistfulHopes,cscareerquestions,"I'm 23 years old, and I've had several part time/contract jobs for indie game development studios, and a wealth of programming projects. However, I have never had a full-time job. Unfortunately, my current part-time job has had struggles with finances, leaving me unable to afford paying bills for myself and my long-distance girlfriend without posting on social media begging for donations, even with both of us having part-time jobs. I've been searching for a job as a programmer for 3 years now, with no luck due to the major crash in both the game development and general software scene.I don't have a degree, but I've taught myself programming over the last 5 years and have what I'd consider pretty decent knowledge for a junior. I have 5 years of C++ and Python and 4 years of C#. I'm also quite experienced in Unreal Engine, and to a lesser degree, Unity. Additionally, I am versed in x86 and ARM assembly, as I spend a lot of time reverse engineering binaries in IDA Pro/Ghidra/Binary Ninja. However, I'm struggling to find jobs that meet my relatively lower-level language experience while hiring a junior dev in terms of workplace experience. Game development and malware analysis are probably where I'd do best, and I could definitely handle general software engineering, but the game development scene is obviously fucked, malware analysis jobs are extremely hard to come by, and my skillset doesn't include web development yet. I'd be fine with learning on the job, but it seems that these days, job postings require experience in almost every aspect to begin with.I'm aware that contacts are usually the best way to get a job in this industry, but all of my job-related contacts exist in the game dev sphere, and no one's hiring for roles that I'd meet in that scene at the moment. I don't have much connection to people in general software engineering or malware analysis. I cannot afford to travel even close distance due to lack of funds and physical disability, so I don't have much of a chance going to in-person developer meetups. My parents seem content to keep me stuck inside their house while having me pay rent monthly, so I cannot rely on them for funding or travel.This has obviously been taking a severe toll on my mental state, as I'm struggling to find work that pays me enough to allow me and my girlfriend to survive, let alone move in together. I'm pretty desperate for a job that pays half-decently, and due to my disability I don't think I could physically handle a minimum wage job, never mind the fact that it probably wouldn't be able to pay the bills where I live, around the Seattle area. I'm already barely earning more than minimum wage for where I live to begin with.If anyone is curious, [here's my GitHub page.](http://github.com/WistfulHopes)",29,0.73,39,https://www.reddit.com/r/cscareerquestions/comments/1q5acoz/junior_dev_looking_for_fulltime_work_for_3_years/,2026-01-06 05:45:29,2026-01-07 01:49:59
1q2h0qv,Should I still choose OMSCS over Columbia MSCS?,ExcitingCommission5,cscareerquestions,"If cost isn’t a factor, would you still pick GT? Both are online part time. I know OMSCS is a great program but I’m haven’t seen much info about Columbia.",28,0.79,39,https://www.reddit.com/r/cscareerquestions/comments/1q2h0qv/should_i_still_choose_omscs_over_columbia_mscs/,2026-01-03 01:28:13,2026-01-07 01:49:59
1q3a75y,5 YoE. Feel like I'm making a mistake accepting an offer.,agentxtaco,cscareerquestions,"Hey everyone, looking for some career advice here.I’m an L2 engineer (5 YOE) currently at an e-commerce shop. I generally love my job—I own features from backend to frontend, write my own Terraform, manage GCP resources, the works. It feels fulfilling to ship stuff that people actually see and use.The problem I’m experiencing is trying to get an internal promotion. I’ve been acting at a Senior level for a while. My manager pushed for my promotion last year, but the Director blocked it because they haven’t heard enough about me to deserve it and my manager cited ""people outside the team don't know me"" (I'm fully remote and introverted, don’t get a lot of opportunities to network). Now my manager wants me to rotate to another team for a quarter just to ""prove visibility"" before they consider the promo again. It feels like moving goalposts and political hoop-jumping, and hasn't been sitting well with me since.Recently, a recruiter reached out to me about a job at a late stage health tech startup, I went through the whole interview process not expecting to get it, but I did receive an offer. I negotiated it up and signed, but now I’m having intense buyer's remorse.* **Positives:** Senior title, good pay bump. Marketable tech stack.* **Negatives:** The work sounds like it could be pretty dry, mostly data processing and generating reports. No Greenfield development and I’d be working in a monorepo. I’m worried I’ll lose that spark I get from building new features for the website.* **Some weirdness:** I’d be reporting to a “manager” who is also an IC on the team. He’s never managed before and is new to interviewing. I’m worried he won’t have the clout to advocate for me or help me grow.Has anyone made a jump like this? Is reporting to a fellow IC on my team a massive red flag?I’m afraid I’m leaving a job I enjoy (mostly) for a place where I’ll be bored and stuck, just for money and to chase a title my current company is gatekeeping.",26,0.84,19,https://www.reddit.com/r/cscareerquestions/comments/1q3a75y/5_yoe_feel_like_im_making_a_mistake_accepting_an/,2026-01-03 23:51:28,2026-01-07 01:49:59
1q4uaec,Masters Vs Personal Projects for Career Boost,vanoth,cscareerquestions,"Hi all, I’m about to start my first semester in an online masters program (GTech OMSCS) in Spring 2026. I recently graduated with a bachelors in CE and am currently working full time as a SWE. I was hoping to use the degree as a lever into a higher paying / more prestigious swe job. I plan to take 2-3 years to finish the program then apply for new jobs once complete. I’m having some second thoughts about whether my time would be better spent working on personal projects relevant to my desired position instead of the degree. I have a pretty clear target area that I know I could work on side projects for, but I don’t know if this will be taken less seriously than certified courses. For anyone who has been in a similar position as me, do you think the degree was key for boosting your career? (I’m not worried about time commitment differences as I would be working the same in either case. The cost of the program is also not a factor.)Any advice is appreciated!",30,1.0,19,https://www.reddit.com/r/cscareerquestions/comments/1q4uaec/masters_vs_personal_projects_for_career_boost/,2026-01-05 18:49:02,2026-01-07 01:49:59
1q1dti7,"If you get somewhere and realize it’s not a good fit after a week, how long do you stay?",keeperpaige,cscareerquestions,Title,27,0.83,42,https://www.reddit.com/r/cscareerquestions/comments/1q1dti7/if_you_get_somewhere_and_realize_its_not_a_good/,2026-01-01 20:14:10,2026-01-07 01:49:59
1q4vr40,What are some good “parallel” fields if I cant find a CS job right out of graduation? Is this even worth considering?,supplas,cscareerquestions,"I’m graduating in May and know the market sucks and want to prepare for the worst.My only return offer right now is from a med-tech firm where I’ll be working within the Microsoft ecosystem on things like Purview (data security & governance) and also creating AI Copilots.They know I have a CS background and this work is meant to fit my strengths, but obviously not direct software development. Director loves me but thinks SWE is a dying industry.The office is local, so my \*current\* post-grad plan is to live at home for 1-2 years and save money while I continue to look for CS jobs.HOWEVER, I’m worried this is just shoehorning myself into data security / no-code development roles.Is this okay or should I decline and focus on applying for an actual SWE role?Desperately looking for some guidance, please give me a reality check!",28,0.97,13,https://www.reddit.com/r/cscareerquestions/comments/1q4vr40/what_are_some_good_parallel_fields_if_i_cant_find/,2026-01-05 19:41:08,2026-01-07 01:49:59
1q06uh9,What’s it like working in QA?,Glareolidae,cscareerquestions,More on the automation and engineering side.,24,0.89,18,https://www.reddit.com/r/cscareerquestions/comments/1q06uh9/whats_it_like_working_in_qa/,2025-12-31 07:13:28,2026-01-07 01:49:59
1q0xhpo,What skills make a mid level swe?,harsh1588,cscareerquestions,"I’m currently a junior swe at a very well known tech company (not faang or anything but household name) and am coming up on my 2 years, wanted to switch sometime in 2026 to start earning more as well as get a better location, I was wondering if there are any skills in particular that I should be working to pick up?I know system design is a major one, but do you think things like understanding one of the major cloud providers (gcp, aws, azure) is also a requirement? And to learn these things is it best to study theory or just build some medium scale project",24,0.84,32,https://www.reddit.com/r/cscareerquestions/comments/1q0xhpo/what_skills_make_a_mid_level_swe/,2026-01-01 06:20:20,2026-01-07 01:49:59
1q5lm0s,how do you stay motivated when the job hunt feels endless?,Affectionate-Lie2563,cscareerquestions,"i’ve been applying, tweaking my resume, brushing up on skills, and it still feels like shouting into the void sometimes. some days i’m fired up, other days i’m just tired and wondering if i’m doing something wrong or if this is just how it goes.for those who’ve been through a long search and made it out the other side, what actually helped you keep going without burning out?",23,0.97,8,https://www.reddit.com/r/cscareerquestions/comments/1q5lm0s/how_do_you_stay_motivated_when_the_job_hunt_feels/,2026-01-06 15:27:59,2026-01-07 01:49:59
1q2foi7,Is my grad school affecting my job hunting opportunities?,Altalio,cscareerquestions,"So basically, I graduated May 2025 with a CS degree from NYU, and I found an unpaid internship during summer of 2025 post graduation that eventually led to a paid job as a SWE at a really small company that pays... minimum NYC wage + occasional bonuses—not very ideal, but a job is a job.I wanted to improve my ""resume"" for better recruiting opportunities and learn new skills so I started an online MCS degree at UIUC. As of Jan 2026, I'm a grad student while also employed as a SWE. I continued to job hunt and apply for full-time/internship roles in October 2025, and so far I'm 300+ job apps in, but haven't gotten much results besides a few OAs—for both internship and full time roles.Since my program is online, I'm open to both full-time roles and internships, but I'm beginning to wonder whether listing my status as a current grad student is affecting my chances for full-time roles, and whether listing my current job as an actual job rather than an internship is affecting my chances my chances for internship roles.",22,0.86,11,https://www.reddit.com/r/cscareerquestions/comments/1q2foi7/is_my_grad_school_affecting_my_job_hunting/,2026-01-03 00:30:40,2026-01-07 01:49:59
1q25qh8,"Anyone here beat youtube addiction? If so, how?",Legitimate-School-59,cscareerquestions,"Im developing a pretty bad case of youtube addiction, and its starting to really affect my work output. Has anyone here beat it?Im asking in this sub because in our careers, we are kinda tied to our computers, so the traditional advice to remove the triggers or leave the computer doesn't seam feasible.",19,0.63,47,https://www.reddit.com/r/cscareerquestions/comments/1q25qh8/anyone_here_beat_youtube_addiction_if_so_how/,2026-01-02 18:04:11,2026-01-07 01:49:59
1q0jq9o,Mid level dev in Canada feeling stuck in LCOL city,AlternativeTales,cscareerquestions,"I’m in my mid 20s sitting at about 5.5 years of experience (1 year co-op + 4.5 full-time) and currently working as a mid-level software dev at a big insurance company. Tech stack is mostly **.NET** (mix of legacy and .NET Core). I’m pulling in around **95k CAD TC** in a LCOL city (in the prairies) -- Hybrid position 1 day in the office. Did my CS degree at a top 3 Canadian university.The job is super stable, got good relationship with my team and my boss even sponsored my PR in 2023 (which I’m super grateful for). Future Projects are expected to be good (maybe closer to startup in terms of impact) but salary and my title might remain as is for years to come.But honestly, I can’t shake the feeling that I’m a bit underpaid, and on top of that, I’m pretty lonely here. While I have made friends with locals through sports activities, there's not a lot of community for people sharing my background (not from a typical immigrant country) compared to other prairie city I had moved from, and that’s starting to weigh on me.I’m thinking about moving to a different city perhaps BC, Alberta, Ottawa, maybe GTA. Ideally mid-to-large companies like banks, insurance or other legacy companies for stability. Planning to start applying early to mid next year since I need to stick around here for a few more months.Do you think I’ve got a decent shot at landing something in those cities? Preferably BC, AB or Ottawa. Any advice on timing, salary expectations, or companies to look at?**TL;DR:** Mid-20s, **5.5 YOE** (mostly .NET), making 95k CAD TC in a LCOL prairie city. Job is stable, good team, good projects but salary/title likely stagnant. Feeling lonely due to lack of cultural community. Thinking of moving to **BC, Alberta, Ottawa, or GTA** for better pay + diversity. Prefer mid-to-large companies for stability (banks, insurance, or legacy company). Planning to apply early/mid 2026.**Question:** Do I have a good shot at landing something in those cities? What are realistic salaries and companies to target?",22,0.84,33,https://www.reddit.com/r/cscareerquestions/comments/1q0jq9o/mid_level_dev_in_canada_feeling_stuck_in_lcol_city/,2025-12-31 18:20:50,2026-01-07 01:49:59
1q36iwx,What happens to the senior dev with mid-level experience?,I-Groot,cscareerquestions,"I have 6 YOE as SDE worked with 3 companies so far, all the projects I have been involved in the teams were usually 15-20 people size and always the features were developed by architect/lead. We usually had sprint refinement meetings where they would explain the features with follow up questions but wouldn’t involve us during the building stage. Mostly I ended up implementing business logics, bug fixes and occasional deployments. Never had a chance to work on end to end feature from design to documentation, the ones where I worked end to end were internal tools which were mostly useless when I left the company. I am a senior at my current role, I am involved in sprint refinements and creating stories but the actual feature Deisgn is already provided and I help with story creations. I had asked multiple times to be involved in feature discussions but always get sidelined by my lead/PO with the solutions architect.I am worried I would be stuck in this phase and didn’t get to work on high level design. How do I improve my system Deisgn skills when I didn’t get an opportunity to work on enterprise application. I have also noticed I am getting good at writing acceptance criteria and understand the feature requirements just by looking at the diagrams. thanks to non technical BA on our team. I am at cross roads and feel the imposter syndrome and think about switching roles.",20,0.8,12,https://www.reddit.com/r/cscareerquestions/comments/1q36iwx/what_happens_to_the_senior_dev_with_midlevel/,2026-01-03 21:21:23,2026-01-07 01:49:59
1q1ugex,Sometimes I feel like I’m too dumb to get deeper into CS. How do I know if this is true or normal?,Ale_Bricks,cscareerquestions,"Im currently in 10th grade and I learn CS and programming at my school. My dream would be to work in this field, but I realized that I’m not that good at programming. I know more stuff than most of people my age, and I get really good marks on tests. The problem is that when I try to learn or make something by myself I get stuck. Idk if this is because CS is a minor subject at my school (just 2 hours per week) or im too young. I tried entering the Team Programming Olympics, but me and my team sucked and got like 45/900 points. Is this because I simply don’t have enough knowledge yet or am I just cooked and I should give up and look for something else to study?",19,0.95,23,https://www.reddit.com/r/cscareerquestions/comments/1q1ugex/sometimes_i_feel_like_im_too_dumb_to_get_deeper/,2026-01-02 09:38:34,2026-01-07 01:49:59
1q1snim,Are Algo and DS style questions still relevant for getting a job?,Glum_Worldliness4904,cscareerquestions,"Senior/Staff Eng, 13 YoE.Took a break from the market for more than 1 year and now considering looking for a job. The current one sucks in all aspects: unpaid overtime, low technical tasks, tons of bureaucracy.Are standard LC-style algo and DS still relevant for a job interview? About 2 years ago the bar was already pretty damn high. I was usually asked 1 Med 1 hard during 1 hour interview. And system design, how is it going now? I suppose no one asks to design url shortners any more.How is interview currently going?",18,0.85,11,https://www.reddit.com/r/cscareerquestions/comments/1q1snim/are_algo_and_ds_style_questions_still_relevant/,2026-01-02 07:45:28,2026-01-07 01:49:59
