id,title,author,subreddit,content,score,upvote_ratio,num_comments,url,created_utc,extracted_at
1prkc9r,"Joined a Remote US Company from India, They Offshored, and Now the Culture Sucks",goonermvp,cscareerquestions,"I am Indian and in a funny situation. I got into a US company and team 2 years ago. Work was chill. Due to poor hikes in the past, the majority of the US team left. Now all new hires are Indians. Obviously, I don’t care. The timings help me.And I can pinpoint exactly when this shift happened. A new Director was hired from a WITCH company and suggested offshoring. He’s just pushing sprint after sprint with no overall goal or idea from top to bottom. We are making useless products and being overworked for basically nothing.When this happens, it particularly sucks more for the US employees since they have less leverage due to much higher salaries.When you see this trend, run. Although, the offshore engineers are amazing. The issue is when they only want offshore engineers and not the best ones. They have a plan ahead for their own selfish benefits. It doesn’t help the company.PS - We didn’t even get Christmas week off Edit - Addition",360,0.83,74,https://www.reddit.com/r/cscareerquestions/comments/1prkc9r/joined_a_remote_us_company_from_india_they/,2025-12-20 17:54:30,2025-12-25 01:48:00
1ppv153,Got laid off last year for the first time in 12 years. Experienced the worst job search of my career. Here's the Sankey.,cscq_throw_away,cscareerquestions,"[2024 Job Search Sankey](https://i.redd.it/wwa5kzx1nz7g1.png)[Here’s my previous post](https://old.reddit.com/r/ExperiencedDevs/comments/rqpfir/the\_result\_of\_my\_passive\_job\_search\_over\_the\_past/) where I got the job I was laid off from. I was there for two and a half years and I hadn’t interviewed at all during that time. It took me four months to get an offer and I managed to get two of them in the same week. One was from an early seed stage startup and the other was Meta. I accepted Meta for more immediate TC and stability, but then I got laid off again just before hitting my year mark. I just finished interviewing again and this time the results are much better. Waiting for the last potential offer/rejection to come in before I post that Sankey. Overall the system design interviews were my biggest weakness again like in my previous search. Hellointerview helped a lot with that and I ended up paying for two mock interview sessions with them. Those are painful but worth it. Besides system design interviews, though, I got rejected a lot in the initial round for not having enough depth in particular tools. I’ve been working in developer tools and infrastructure for most of my career and a lot of places I was applying to wanted much deeper experience with Kubernetes, Terraform, and AWS. I had worked with all of those at the previous two jobs I had in the 6 years prior to this search, but hadn’t really dug in deep on them and it showed in those early screens. I also got several rejections in the final rounds towards the end where the feedback was that I did very well but someone else just had a bit more relevant experience so they were getting the offer. I even had one recruiter say that the hiring manager tried to get headcount approved to extend offers to me and the other candidate but got denied and I was the second choice. Here’s the details of the two offers I did get: **Seed stage startup*** Salary: $190k* Target bonus: 10%* Equity: $88k in options* Remote**Meta*** IC5* Salary: $215k* Target bonus: 15%* RSUs: $710k over 4 years* TC: ~$425k* Hybrid 3x/week[Sankey source](https://sankeymatic.com/build/?i=IIBxBsEsFMBMAIDaA2AHAXXgOQPbwE7QDOIOAdkdAFCgQwKIDsArJgErQBW0AxgC5wqAeiHwAhkSIBXALaQyAc3Hhw8HADN4fABbRxPHtBACEYsFB5i%2BkckQLEp4E%2DHnxLKogBp4UkLCt6kJpkvMREYvgAnjTm9EgATBjwAMJiKvAA7qKEPPhSkAL4MXRwCZgA8mRQIeKSYTLQZHzFUKWIAIyYABJipuCEvZEuTdD4AG4wGaXqOPhaugQ44NS0rQzx7Lx5BaP2JOSwgqtxHZgAkmQFkGlavNqX7otSZLBUVD19A7BD8oUT0FMEDM5jo9PglnpTvAONx%2BIIqBxcvlCntSC82ht4ABxbQ4IgmN6I7YohqSMQKUoNJDtZAAFkwAHUCtpYIQMgitsjdqTwhSEFSUElUuksvYkTsikSuXMeeTKZDaUkcXiCVKJfBZXyNZD2vToVxeKrOerNfKkHrKtU9BJKJIGk0OeKSWE5fydedLtYbgIePdII9wc9XlRhapRTlibsoQAVMQAaz0uKpNsgCjI9uaocy2WNKI6AE5NrCCVnw7mo8xOvALldvXcHjdAy8Q2kwzmnVGAMyM5msgEtkXtyNzJgVKrya11O2NTOt7Ni4fU1jY3H4%2BGxhPwJOToip9MzsrwJk6PvsjeJnDJyR7jPUouGwTnreXnc3g%2BITEAMXkjZwQaoT7brUu5preULHiybLiOoKJiAYRjWIoajqOooyEtAcG6Agf58FoeAyEMIR8Bksxxne%2BrFoIHCYaUOF4RqhHQMRpHkbgqK2NQVA1l6qg%2Bn6AZ%2Di8CTIPecKvNx1y8fW%2Dq%2DkG1J6t%2BZCyc2El1r6DaqE2DDtAADJgypruJnqSbc6kyZpgkMMugEvsBb4OqpUlmQJcngb2bJccZan8cp2ljlawH1DObyWhOgXTk0SDdhRD6vKFNQ2kFkWIHqEGnlQ8U7kluEpR6tZOT5Fn%2Dpl4VEGB0WKb5byVUVQkdMuMKxVQNVPHVmJpVBYgwbscGGMY8hKBoqFFC1WnkeUKFoaNlnkdGGEyBqVi%2BgNbxzWIC0yEt2gDeNk1FBle3kcA8HGIIE3DeRAAivBWsGABcjVifAADEyTJDpH06VQd1sYQ%2BwUHoz2MLSwPA99pZDtKL0AEbMDwtLxIw30dQCL35vmqDqIwnbfcdfXOM9H2fp%2BH3feduyEzpPD5qTd2OaZhWtQglO0swtPTXJlOMLAtPXTwt0vR9CO0yjGTQbBJ2IYNh3PYcYg0%2DmuOxKUlOfV9D0Yb6tFSLhfD4YxzH4GRqufd9arOmSWpUibtMlYlEW4c9nbxNDnY6Ujd0GQTyDc8g0DqzZV4gfukVOy7btI7uABeehi%2B0%2BbxF9W7wLpqBfZt%2BAKK4qjtPEVAECnedaCnqD59D8CJ1Q0NKDwSyzC9KGN%2Bo%2Bd8PgYgUCAEQHlgVBkDghyZIX%2BfaPAbP5yQcE7SwZezIccxJ6Cyb57X4D189qAb5v%2Bc4J3PAFEM7RUOoq9izwUjjFY596DpAB0zD5%2DIuj4AU6jggtfARBSzRuHXczPejADFZqF3vveAt9WZUHAGISIdFZ49R1peKw%2Dp86cCkPiIIMDn5ZwoNgFBaDrDqEiI0WAdge72DGKMSgCg24gBHmQqwH9lpkFrjICATFiB63gCELu%2BJIFiGhtAcAdgV5rzVqTLckAB5kO2gobQUBZG4VvtPeAMwmjqDgnocIFAAC0lBn7N3gFaCee8kK3yLoQKB1gKHRz0O0XS%2BdNppgwSnUmUCBHgCUsmMAGF8B2AAJrj0gDHFOyB85TFTNoXCtJXH8MEWMNIUhrTeIiP4%2DO6hHDgBADkSAu5yDwACfAUgu5rB5PcTgdkmRoARKiTE9xRSrh5LEAgtIe4wHjy1smBBaTIC%2BNwgI4E1B4DQwGHGUgvwK5fXieARJKjZibVwgAck8DfBZ%2BcsnQHUJAAAHvABZqz4DSBQts3ZqzF7QCGpQXCYh4ChKGW0tw9yEDpyYtcjMNgKDtwTJEeZ%2Dp8n5ygOgmQ0M0jt0MKkmQOAKHwGOKUbRt8dK6R0swbwcKb66niCDKgEKoW%2DWIGiSgYCb5Ip0p2fMKLb66WYLSLFkK9Dm25C6K2ehtHtDvp2ZAyBvAUpBtS7FdLNZYTUDreiBEuFMRIkbQlH12ioGRfAVFnZUCJBxnylIc4ywdjmKitO8R8ztC5WihFOk86qrtlOMqB5UXMHzMwZAnZyU3zdgik1tLqxeQKhpJm8rb7WvZfEA18R44%2BxpVCr2pR4U2vzLSA17RGAIvvqq0W4seqSx2kNXYqK7HxFtTG5AGND6qo5kJBVMrs0Gp0nqzsvLXWB1fKBS14DaT5kVQGukjBQmqses4eF7Qq3lsVcwF1UKk3worS2qVaBEghr0OTLV8LkAVrlai41iRS6qrxghcNRKkXsodanZgCbXV8wFqOn2DqdKs3aIeqFHxlBfB%2BCMcYkxpj11BIsZY3qb60jzagaNn6PqJEVqqtaG0to7UzagTs1rz0XtQAW119K5h%2DTRIcBAqLkDxE7O2h1aBkDWqAA)EDIT: Explaining my terrible labels: * Withdrew after accepting offer: I used this for the companies I withdrew from once I accepted Meta's offer.* Rejected: means the company rejected me at some point* Ghosted: the recruiter stopped responding to me without an outright rejection* Call w/ recruiter: Only used this if it was the first step before anything else after either applying or getting their email or LinkedIn message. A few places slipped this and I also used it to distinguish between getting rejected or withdrawing before or after talking to the recruiter on the phone.",271,0.95,36,https://www.reddit.com/r/cscareerquestions/comments/1ppv153/got_laid_off_last_year_for_the_first_time_in_12/,2025-12-18 16:24:43,2025-12-25 01:48:00
1pri0tq,How close are you to retirement? Has a career in tech made you financially set?,Ok_Economy6167,cscareerquestions,Just asking because the majority here have had multiple years making six figures.,149,0.87,213,https://www.reddit.com/r/cscareerquestions/comments/1pri0tq/how_close_are_you_to_retirement_has_a_career_in/,2025-12-20 16:15:25,2025-12-25 01:48:00
1pr1zjg,What makes a senior vs a mid level vs junior?,EitherAd5892,cscareerquestions,"Does yoe really matter if you perform at a senior level? For example, let’s say you have 2 yoe and you are architecting an entire project end to end and leading a team of developers at a startup vs someone with 5 yoe at a big company and they just do basic ticket work assigned to them. Would someone like a 2 yoe be considered a senior engineer given the work they do is senior level ?",147,0.91,99,https://www.reddit.com/r/cscareerquestions/comments/1pr1zjg/what_makes_a_senior_vs_a_mid_level_vs_junior/,2025-12-20 01:28:31,2025-12-25 01:48:00
1purk4q,Judge rejects challenge to Trump’s $100K H-1B visa fee,cantdeletethisapp_,cscareerquestions,This lawsuit was from the Chamber of Commerce. Wonder whether the multi state lawsuit seeking to challenge the 100k fee will play out similarly. https://thehill.com/regulation/court-battles/5662050-h1b-visa-fee-ruling-trump-administration/,134,0.92,137,https://www.reddit.com/r/cscareerquestions/comments/1purk4q/judge_rejects_challenge_to_trumps_100k_h1b_visa/,2025-12-24 16:41:40,2025-12-25 01:48:00
1ptijt2,AWS vs Bloomberg (Google + Meta finals) New Grad (advice),Lost_Armadillo3194,cscareerquestions,"Hi, I’m a CE senior graduating in May 26, based in NYC and was lucky enough to get 3 full time offers so far from previous internship at Warner Bros. Discovery (HBO Max) then Bloomberg, and now fall internship return offer from AWS.Right now:\- I am signed with Bloomberg for full-time SWE (NYC) 191K cash (no stocks bc private)\- I also have a return offer at AWS (going to be on SageMaker/BedRock which is pretty good space at AWS to be in bc doesnt get affected from lay offs in the present not sure if that would change) TC is 205k from what I heard (NYC)\- I previously interned on SageMaker, so my background is more ML infra and I enjoy working on MLE problems so had lot of fun especially when I got to do some low level ML stuff. I had a great 3 months and got strong incline and got told I was the best intern they had and built good connections with the team i would return to, but I guess wlb is the big con\- I reneged a Warner Bros. Discovery (HBO Max) (NYC) SWE return earlier for Bloomberg.Upcoming interviews:\- Google SWE final (on site beginning of january): worried about team matching and timeline uncertainty I heard it takes forever.\- Meta Production Engineering (PE) interviews in a week or so, not sure if PE aligns with my long term goals, so not sure if i should do the interviewsI was able to get a sense of the bad Esh work life balance this fall at AWS, even though I had a great 3 months and was raised constantly for the work I was doing, it was a lot of work I owned a lot more than a “project” and seen the other full timers around me (was there during reinvent times which are known to be most stessful). I know it is better career growth and I would learn more than if I was at Bloomberg which is why I am considering it, but would love any advice from people at Bloomberg or know in general about the company. Sage maker is pretty secure no one gets affected from lay offs but thats just in the present, BB is known for way better security. Also should I still do the meta interviews which seems to be a long process and I am pretty happy with aws/bb or google if it happens. Also heard meta isnt the most secure. Thanks a lot in advance!",129,0.83,146,https://www.reddit.com/r/cscareerquestions/comments/1ptijt2/aws_vs_bloomberg_google_meta_finals_new_grad/,2025-12-23 02:42:42,2025-12-25 01:48:00
1pqom8x,Odd question: how do I pretend I still care about getting promoted?,Fig_Towel_379,cscareerquestions,"I know this might sound like a weird question, but here’s some context. I’ve got my performance review with my manager coming up. For the past 2 years I’ve been asking for a promotion, and my manager has basically been gaslighting me, moving the goal post, and never giving me any kind of clear roadmap.At this point I’m already interviewing elsewhere and honestly don’t really care if I get promoted or not. I’m pretty sure it’s not happening this year anyway. That said, I feel like I still have to bring it up so it doesn’t look like I suddenly stopped wanting a promotion.So yeah, how do I bring it up? And more importantly, what do I even say when they tell me no?",131,0.95,23,https://www.reddit.com/r/cscareerquestions/comments/1pqom8x/odd_question_how_do_i_pretend_i_still_care_about/,2025-12-19 15:56:21,2025-12-25 01:48:00
1ptx70j,Results feel inconsistent,Mundane-Wrongdoer275,cscareerquestions,I’ve been interviewing for roles that seem like a reasonable fit based on my background but the outcomes have been inconsistent. A lot of the time the result seems to hinge on narrow moments or specific questions that don’t reflect how I work day to day. What I struggle with is reading the signal after a rejection and it's unclear whether it points to how the interview went For people who’ve gone through a lot of interviews how did you learn to separate real feedback from noise?,132,0.97,22,https://www.reddit.com/r/cscareerquestions/comments/1ptx70j/results_feel_inconsistent/,2025-12-23 15:47:54,2025-12-25 01:48:00
1publbg,Is it really that hard to find entry level job in tech right now?,Bergmeister_A,cscareerquestions,"As the title says, is it really that difficult to find entry level jobs right now? I'm referring to big techs (not sure about smaller ones). Surely it's not as good as a few years ago, but at least my org has entry level and \~3yoe openings all the time. Is it only a small companies/startup thing?",118,0.87,54,https://www.reddit.com/r/cscareerquestions/comments/1publbg/is_it_really_that_hard_to_find_entry_level_job_in/,2025-12-24 02:01:33,2025-12-25 01:48:00
1pqzdvo,Quit Due to Poor Performance?,Potential_Owl7825,cscareerquestions,Has anyone else quit (on their own) due to their poor performance at work? I’ve been a bit unhappy with my current job. I don’t enjoy what I’ve been doing and I’ve been dropping the ball on the past few projects that I’ve worked on (mainly due to my own laziness and lack of organization skills). I haven’t been able to prep for interviews due to not having time to do so. I’ve been considering quitting once I wrapped up my current project. Has anyone else been in a similar position to me? Thanks :),111,0.95,68,https://www.reddit.com/r/cscareerquestions/comments/1pqzdvo/quit_due_to_poor_performance/,2025-12-19 23:27:38,2025-12-25 01:48:00
1pup1ae,"Can hardly code anymore, been at the same job for the last 4.5 years. Am I cooked?",LoXatoR,cscareerquestions,"Hi,I have been at my job as a Frontend Developer for the last 4.5 years. In this time, we have built the same product twice with fresh UI and some other things to rebrand it. I was hired as a mid-level React developer, and have seen the team grow and shrink. We got acquired last year and now I am the only person in my team with a couple of outsourced devs.Naturally, due to people leaving, I have been promoted to lead but I am hardly able to concentrate or produce any work. I am just cruising on the work of others and I feel like I have lost all interest, or forgotten everything I have learnt. My motivation is dead, every day I am on some calls, fix some small bugs and do some PR reviews which also I rarely read through.I thought it was burnout and took a 2 weeks break, but came back to the same empty feeling that I am just existing at this place, the joy I had when I first joined is dead.It's a nice remote job, they pay on time and given the market right now, I am in a pretty comfortable position. I have tried interviewing at other places in hopes that maybe a new environment will help me, but I rarely prepare for them either, which means I fail them constantly then just stop giving anything a shot. Add to the fact that coding agents are quickly catching on, some days I just use it to do my work, I feel like a fraud and don't know if I should continue down this path, or try to learn something new, maybe some other stack or completely distance myself from programming.Has anyone been in similar situations? How did you make it out? Thanks!",112,0.94,19,https://www.reddit.com/r/cscareerquestions/comments/1pup1ae/can_hardly_code_anymore_been_at_the_same_job_for/,2025-12-24 14:48:17,2025-12-25 01:48:00
1prnngf,Name and Shame: Game Seven Staffing,throw-away-exception,cscareerquestions,"I'm an experienced software engineer in the Seattle area (~10 years) that's only done full-time roles, no contracting. Reed C. from Game Seven has contacted me several times over the past couple years and it's almost entirely for shitty contracting roles with Amazon. Twice I decided to consider the roles he was trying to fill. Each time he would frequently call me out of the blue and stress that the hiring manager wanted to fill the position as soon as possible and to schedule an interview quickly. Both times I scheduled the interview, took it, and then never heard back from Reed afterwards. The first time it happened I checked in with him about a week after the interview and he claimed the hiring manager never gave him feedback and that he'd follow up. He never did. I didn't even bother the second time. Don't waste your time with this recruiter.",110,0.98,12,https://www.reddit.com/r/cscareerquestions/comments/1prnngf/name_and_shame_game_seven_staffing/,2025-12-20 20:17:06,2025-12-25 01:48:00
1pty6o7,My latest job search after getting laid off for the 2nd time in 2 years,cscq_throw_away,cscareerquestions,"[Here's my latest Sankey diagram from this year's job search](https://i.redd.it/xp4tufwh7z8g1.png).[Sankey Source](https://sankeymatic.com/build/?i=IIBxBsEsFMBMAIDaBWAbAXXgOQPbwE7QDOIOAdkdAFCgQwKIDMjmAStAFbQDGALnDTBQ4SAByYAwgENw4eAHcA9AR74ArpH75BdEU0wB5MlDLR4UopUsBbaGV5Uq7bus3R88W5akBzEbaRUACZMAHVNAAtYQnknVQ0tT2IiX38zRCCARkkZOSUVFwT3OMK3Dy8UvwQAxHF4AHEInCJ%2BWEd2KW4IkRw1XnhePGsAT3hTXnkcfABrJGz4di4%2BAQ6unr6BodHxyZm5nNkFZUJSrTjO7oRe%2DsHPbegJqdnEeYBJMk1IGQGeCI%2Dub74XpkNqrS7wa6bO5jB67Z7zXAqEjkSiOaSHfInVyJFBhSLRaCxdF5Y7xMpIADsbE4PFaVGJRwK2PcSBYDSaLTgAEh6blGViih4XshMO9Pt9%2BF1%2DoDgW0GZiyTj5gAVKTTMxNAIWIiQHxkWz2XkY0mnFn6eDhXhRGLmABmiU63GgIF4kDIPghVpZOFttuKVCMJjM2uSBv6L2pSzpgbdwcsobs4bZluthIDxlj5njNkT%2B3gADE3TK1CDHMBXuY%2DPZzEJ6PBbVMkkgACwHElMwU0CupatSWsiBvldLzGOmLNWIhhxxi10S37SuRAksMNmLWkCGdfOSSv6QAGL2V5lME2KbudSvfFkFIELs5qtLmPqhn7fzy8H5diTCFshXtovn4L33AhDwjeBRzjCcpwAncFxAz8wOPG0pHtFlHWdV13U9boPB9P1tCoVV1XgTVIN1fVc0Q%2DEYkcH8%2DxvSN1zaOiP2vRBWwtajCTtB1uCdF03Q9HAvVw31ihY%2BC2LZAwxIImT8LzYA%2BIwgR5LNW8ABEeCDNoqAALjXZYEAAYgkCQAAZLPM%2DTEUIZEKDMYyKWbZznP0%2BUTWZDxjIAI2QbhmyCCl9KQ7jjIATnC0RbQpRh9KU%2DjWngYzLPzfNLP0tTvMs7hwoyvSYLfYCl2vFLzObZB8okkqTMsilYHyrTuB05LLMC%2DLQvkHi0OUgSsOEnCIVk5LYGgKQ8vC%2BL%2B1qqz8vLStcz7XQEEHJsytm%2DSwXWG4thhR49nWqzNsVFkKlSapHNm%2DKIPHBNq2Mxggh8xhzOCvTGnvERjNQerUGgaydQALzMLrMnCoJrJI%2BBMnM0RrOsKR8B8N14DkTIgioAhoYxgZodETGfPgCGqB8j1uBwcBG2M30adtTHeHwKQKBARHcywKgyBwUaFGxzGIngSrMZITpBPgClkAJqZRo8SGvS1THycp7zRBV1XMZwFnuE0UZMioW1Ka67g1HwAA3KReGNsxzIAOgl%2BA3RwzRbSBawBkRvwHHgRWqci33JohTXtfgG2KqocApGGSEpbQvocAR11uExjg1BaSBbUj%2DBdTdIhsCTlPXXTuxYBz9mVBN9xKB8RmQH50vzd4C43XJ6wIAeYhblMVmWjDqQfOgcAc%2B97Krr5yBudLiJdQiKAfAifobfFzGG3sW1OjMFIKAAWkoTO6dR2Nha1rCbZxwhw9dcugbMTIYcxhG9TTnWMvDvvwF%2DLUwDG%2DAc4ATSFyBgbQ1QJjeQ0Ap79GbM%2DXu%2DczbgDUMGT%2BiNf5LzULIEAJxIA6nIPAP%2B8BSA6ldNg1%2BOBYgKDAbPCBUDX74M%2BNgqQscZDkWDkLNYWpY5L0gN%2DfofdBzUHgD5QgapSBun6PjWB8D6xTHjvAAA5AAGmtjIzG6DoC2kgAAD1kUo%2BARA1C%2Bg0VoqgctoB4UoP0KQ8BgH8OYV7GxCB4YPAsWGSAKImbqmGPHPcODMZQFTtYHyMgmZOmQdYHA5d4C0GEPYuR8BN423KpFCWoTwm2WIKQBywdraWVQMgCkMS4nW0yKgF6GNklmGcF5JI3gqhNgKW1RgmQYk2yKaITISSwnlLGmsK4GxbgjD2nCTJllMiiGQPkm2jBRBBFEHFMp8APIdnJPE5AlVmxNKycgUZpSOngQzGOEMOZqzNPMowcW6zzJBCCM2SaczCpAXos0kZQRGDjKyS9Rg7TwkfU5PYrJ4VkDhTWZkzIFJzJtKoHM6qh54moHMsgRpQyrLNghTsoiGo45kT1GGWJyzkDNheTirJrTRkovCYZJK8TwptNQK8x6pzkVzM6pkoImznmvJhqgfFpKzBZURVFMZhKrKRW5RE3qSU6kUlQP815cKgjhWAXMpqLUJW5IJfEik6NtnhPmj2cx01JFDkRejAlBTTlRVmTsplKFeKJVFgNb0w14nmVQEU9ZN9yrICAA)My previous job search posts:* [2024 after also getting laid off](https://old.reddit.com/r/cscareerquestions/comments/1ppv153/got_laid_off_last_year_for_the_first_time_in_12/) ([Direct link to Sankey](https://i.redd.it/wwa5kzx1nz7g1.png))* [2021's passive search](https://old.reddit.com/r/ExperiencedDevs/comments/rqpfir/the_result_of_my_passive_job_search_over_the_past/) ([Direct link to Sankey](https://ibb.co/wNs95nfL))This latest search was after getting laid off at Meta after not quite 1 year as an E5 in Bellevue. Overall the search went much better than last time. With it being only a year since I had gone through this whole thing I felt a lot more prepared and I think it shows in the numbers.A few clarifying points about my labels:* ""Reached out to my network"" was me reaching out to anybody I had interacted with previously including co-workers, recruiters I had worked with before, and actually the offer I turned down last year. The company that gave me the offer I turned down last year met with me but they didn't have anything open and it didn't go beyond that.* ""AI agent applied for me"": I used several AI services to find and apply for jobs on my behalf. These were Jobhire AI, Wobo AI, and Sonara. I didn't count all of the applications they sent out for me because the vast majority of them were ignored. I estimate that it was approximately 200 applications that got sent out by these. I could make another post on my thoughts on these, but to sum it up, Jobhire was absolute trash, Wobo wasn't much better, and Sonara was worth the price in my mind. Overall the AI agents got me interviews with 3 companies, 2 of which proceeded to the final round (1 rejected me and the other I withdrew after accepting another offer).* ""Withdrew after accepting other offer"": This means that I withdrew from interviews before getting an offer from the place I was interviewing with because I had already accepted a different offer. If a company made me an offer, that got counted with the ""Declined"" label after ""Offer"".I've got 13 years of experience with two FAANGs and a FAANG+ on my resume and my specialization for most of that has been in developer tools and infrastructure. System design questions are still my weakest point, and I'm hoping that this next role will help me with more practical hands-on experience that I can use in the future for those problems.My offers:Series A Startup | Series B Startup | Axon-------------------|--------------------|------accepted | declined | declined$205k base | $200k base | $188k baseno bonus | 15% bonus | 10% bonusOptions | Options | $160k RSUs over two years with 1 year cliff (+ refreshers)2-3 days hybrid | 2-3 days hybrid | 4 days mandatory in office Tue-FriSome quick stats from the Sankey:* Acceptance rate from manual applications: 11% (11/100)* Pass rate for initial rounds: 64% (9/14 - not counting ones I withdrew from)* Pass rate for final rounds: 60% (3/5 - not counting ones I withdrew from) - this is a personal best for me. I'm not sure if the 4 companies I withdrew from would have been a similar success rate, but I'm happy with it.* Nearly half the recruiters that messaged me first were for shitty contracting gigs even though I indicated on LinkedIn that I was not interested in those. Ironically at least 10 of those were third party recruiters that wanted to put me right back in at Meta doing almost exactly what I was doing before ... hmm ...* A huge percentage of companies I interviewed with (maybe 85%?) had ""AI"" in their name and almost every company I talked to emphasized how they were incorporating AI in their product or process. The startup I accepted an offer from is the type of company that is selling shovels during this AI gold rush.Overall this search only lasted two months. I hit the ground running as soon as I got laid off from Meta and I had accepted an offer before 60 days had passed. So much better than last year!",106,0.97,32,https://www.reddit.com/r/cscareerquestions/comments/1pty6o7/my_latest_job_search_after_getting_laid_off_for/,2025-12-23 16:26:47,2025-12-25 01:48:00
1pqpmac,What to do when work emergencies conflict with non-work events?,JusticeJudgment,cscareerquestions,"Last week, there was a concert that I wanted to attend and had already bought tickets to.However, that same day, the system went down, and there was pressure to stay late until the issue was fixed.My manager said that fixing this issue was critical and that he wanted ""all hands on deck"" until the problem was solved.The issue took many hours to fix, and it was almost midnight when the system started working again.The concert was over by that time.When work emergencies happen, is there a way to not stay late and not have the emergency prevent me from attending non-work events?I'm currently a junior engineer, so I'm not the only person who can solve a problem.In the future, if I'm a senior engineer and the only person who can solve a problem, is there a way to not stay late?Besides tips like ""don't deploy code on Friday afternoons"", any other advice for reducing the chances of work emergencies that interfere with non-work events?Have you ever had to miss a non-work event because of a work emergency?",106,0.91,128,https://www.reddit.com/r/cscareerquestions/comments/1pqpmac/what_to_do_when_work_emergencies_conflict_with/,2025-12-19 16:35:12,2025-12-25 01:48:00
