id,title,author,subreddit,content,score,upvote_ratio,num_comments,url,created_utc,extracted_at
1u78x3i,Made a GitHub Repository of beginner projects/resources for students trying to build their resume,Dezzki-builds,learnprogramming,"I'm a Computer Science student who's just starting to build projects seriously.One thing I kept struggling with was figuring out **what to build** . I'd spend hours watching tutorials or browsing GitHub instead of actually making progress.So I started compiling beginner-friendly project ideas and resources that I found useful into a single repository. The goal is to help students and self-taught developers who know some basics but don't know where to go from there.The projects are grouped by technology and difficulty level, and I plan to keep expanding the list as I learn more. I'd also love contributions from people who have resources or project ideas that helped them when they were starting out.I'm still very much a beginner myself, so this isn't meant to be the ""ultimate roadmap"" this is just a starting point that can grow with the more people.Hopefully, it helps someone else get from **""I don't know what to build""** to **""I made my first project.""**Repository: [https://github.com/dezzki/0-to-projects](https://github.com/dezzki/0-to-projects)",29,0.95,11,https://www.reddit.com/r/learnprogramming/comments/1u78x3i/made_a_github_repository_of_beginner/,2026-06-16 09:45:36,2026-06-18 04:05:28
1u88it2,Actually knowing and retaining code knowledge,JW1643,learnprogramming,"Hi guys, in the past few months I’ve began to learn programming/development in the evenings after work. Currently I have been learning React, typescript and bit of HTML/CSS. Currently I’ve been following notjustdev who is great as well as using ai to walk me through particular code for understanding and other sites like stackoverflow.However, although I have been doing all this and have built a couple projects already and currently have some I’m working on, I don’t think I’m actually retaining much of the information. Like if you told me to create an app tomorrow with no web help, I wouldn’t know where to start. I know the general premise like setting up indexes, src’s, components etc but I wouldn’t be able to fully write the code from memory.Do you guys have any advice on better retaining the info or is it just that no one really builds stuff completely from their head and they use other tools as well, especially in this day with AI.Any thoughts or advice would be much appreciated, thank you.Edit: Thank you all for the advice. I am wondering if something like the Odin Project would be a recommended path, or just trying to work on my own projects?",25,0.9,55,https://www.reddit.com/r/learnprogramming/comments/1u88it2/actually_knowing_and_retaining_code_knowledge/,2026-06-17 12:15:19,2026-06-18 04:05:28
1u7fe8o,"Is the book ""The C Programming Language"" still worth it for a begginer despite the changes in C ?",Koichidank,learnprogramming,"i want learn C using this book but many people said it's outdated, what changes do i need to be aware of ?",26,0.87,31,https://www.reddit.com/r/learnprogramming/comments/1u7fe8o/is_the_book_the_c_programming_language_still/,2026-06-16 14:38:21,2026-06-18 04:05:28
1u3zkfh,how do I smartly learn to code with the prominence of ai?,Educational-West7394,learnprogramming,Hey I'm 17 and I want to be able to do more than print hello world. I've covered rudimentary concepts in mainly Java and python in school and I want to sort of get ahead before I get into uni where I'll hopefully be pursuing a similar stream. Materials online seem to have different approaches and it's only confused me more. How do I efficiently learn how to simultaneously code and use ai tools? I'm very new to all this and any advice at all will be really helpful!,23,0.79,22,https://www.reddit.com/r/learnprogramming/comments/1u3zkfh/how_do_i_smartly_learn_to_code_with_the/,2026-06-12 16:05:59,2026-06-18 04:05:28
1u7h5ij,How do people remember documentations?,Hot_Climate9153,learnprogramming,I’m just abit in to coding like python and I am struggling to remember the documents of which things does which and how do i solve this or create this thing and it’s like driving me crazy. I have to spend soo much time to read the documents and try to code and stuff. I genuinely don’t even know how do people code so easily.,21,0.8,37,https://www.reddit.com/r/learnprogramming/comments/1u7h5ij/how_do_people_remember_documentations/,2026-06-16 15:42:40,2026-06-18 04:05:28
1u7os2z,Looking for advice,dr_isso,learnprogramming,"Hey everyone,I am from Türkiye and I officially graduated with a degree in Computer Engineering this past February. Since then, I've been diving into the job hunt, and like many others, I'm realizing just how incredibly tough and stagnant the current entry-level job market is.The constant ghosting and rejections can get a bit demoralizing, so I want to make sure I’m using this downtime as strategically as possible.For those who managed to land their first role recently, or industry veterans who see what works right now:What should my main daily focus be? (LeetCode, building niche/complex projects, networking, or just spamming applications?)How can a fresh grad actually stand out when even ""entry-level"" roles require years of experience?Any tips on keeping your sanity and staying disciplined while waiting for that first break?I'm willing to put in the hard work, I just want to make sure I'm pointing my energy in the right direction. Appreciate any advice or reality checks you can give. Thanks!",17,0.92,13,https://www.reddit.com/r/learnprogramming/comments/1u7os2z/looking_for_advice/,2026-06-16 20:13:34,2026-06-18 04:05:28
1u7bynw,Guide to naming identifiers in programming languages,Competitive_Aside461,learnprogramming,"Phil Karlton said ""There are only two hard things in Computer Science: cache invalidation and naming things and off-by-one errors."" When I was new to programming, I barely worried about naming variables or functions and used whatever came to mind.There was lack of consistency and almost no thought put behind names. Fast-forward today, having been programming for over a decade, I can seriously bet on the sheer importance of naming. It's more important than you think.Most beginners never ever care about naming as much as they care about algorithms, data structures, learning React, learning cloud, and whatnot. Naming is such an integral part of good software engineering that beginners must develop good habits early on.In this respect, I've written a guide on naming identifiers in programming languages. It's not an exhaustive list but rather the most practical things programmers often ignore even though they shouldn't. If you're new to programming, you should definitely read this.[https://www.codeguage.com/blog/guide-to-naming-identifiers](https://www.codeguage.com/blog/guide-to-naming-identifiers)",16,0.79,15,https://www.reddit.com/r/learnprogramming/comments/1u7bynw/guide_to_naming_identifiers_in_programming/,2026-06-16 12:21:02,2026-06-18 04:05:28
1u3lnah,Learning C++ as an absolute beginner.,Attack_Helikopter,learnprogramming,"Hello everyone, I wanted to learn C++ (I have 0 knowledge about it), I was wondering what resources should I follow 9I would prefer written resources over youtube videos)I though of following [learncpp.com](http://learncpp.com)",18,0.95,13,https://www.reddit.com/r/learnprogramming/comments/1u3lnah/learning_c_as_an_absolute_beginner/,2026-06-12 04:53:18,2026-06-18 04:05:28
1u62931,How do I get started on projects?,MilkyMadness6,learnprogramming,"I am on my second year of Software Engineering going into mid year break. I would like to start working on my portfolio so that I can start applying for interships this year. I know it'll be very hard to get an intership in my second year but I'd like to get started on my portfolio early at least.The issue is I just don't know how to start a project. Do I only stick to stuff I know how to program? If not, how do I go on about learning new concepts, etc. I know I'm supposed to learn while doing the project but I just have no clue how to or what I'm required to learn. Do I need to do research beforehand? How much time should I realistically need to spend and how do I know if it's within my current experience/knowledge.Any tips or help would be appreciated.",15,0.9,9,https://www.reddit.com/r/learnprogramming/comments/1u62931/how_do_i_get_started_on_projects/,2026-06-15 01:08:42,2026-06-18 04:05:28
1u872f9,Do we need to read any books to learn the advanced stuff of a language or rather watch guided advance projects and make projects along with?,Infinite-Jaguar-1753,learnprogramming,"I learning c Language and have been with Basic stuff and also made some beginner projects. However, I wanted to get into low level with C and hence wanted to learn advance language. Should I read a book on(Please recommend if you have any) Or Follow making projects from YouTube videos(As I have found some videos with so advanced, low level, C programming projects)? pls suggest",14,0.94,12,https://www.reddit.com/r/learnprogramming/comments/1u872f9/do_we_need_to_read_any_books_to_learn_the/,2026-06-17 11:03:48,2026-06-18 04:05:28
1u5zxbu,Should I start learning programming early?,DAN1MOrt,learnprogramming,"I’m 15 years old, and in my country, I’m going to start a program that requires a strong foundation in math, physics, and chemistry. I’ve already thought about what I want to be in the future, because in my country, at my age, everything you do has an impact on your future. I plan to become an electrical engineer, but since I’ll need to know how to code, I’m not sure if I should start learning now. The program I’m going to attend won’t have a course dedicated solely to programming, and I won’t be doing any programming at all, so I’m not sure if I should start learning early so that I’ll already know how to do it by the time I get to college.Any suggestions?",13,0.69,33,https://www.reddit.com/r/learnprogramming/comments/1u5zxbu/should_i_start_learning_programming_early/,2026-06-14 23:20:25,2026-06-18 04:05:28
1u5nfso,C# Resources,Lonely_Management110,learnprogramming,"Recently I have been employed as a back end developer, my first ever dev gig after doing a fullstack bootcamp. The codebase and projects are quite large and complicated, mainly e-commerce and integration.Senior gave me Pro C# 10 to read through to sharpen up my skills, yet I find it not too beginner friendly.I am in a rut of imposter-syndrome mixed with me not being capable of doing this job, although my senior tells me I am more than capable enoughAre there any resource recommendations other than freecodecamp and scenario-based Youtube videos?",15,0.9,8,https://www.reddit.com/r/learnprogramming/comments/1u5nfso/c_resources/,2026-06-14 15:01:47,2026-06-18 04:05:28
1u5h29h,How do you guys know what is the best method at the time?,doktorfuturee,learnprogramming,"Every time I need an algorithm while or for loops are first that came into my mind. However, I always hesitate when I use them. How can I be sure the fastest method is a loop or another function or whatever? I don't want to search all the time for the alternatives and I think this is not good for me. Do you think my bias for loops are unwarranted ?",15,0.83,25,https://www.reddit.com/r/learnprogramming/comments/1u5h29h/how_do_you_guys_know_what_is_the_best_method_at/,2026-06-14 09:56:46,2026-06-18 04:05:28
1u3rf8p,How to write code for complex problems as a beginner and how to think beforehand before writing any code ?,TreacleFlaky2283,learnprogramming,"its like i can write code of simple problems but i finds myself not so easy when it comes to the program like terminal games and i feels like i am lagging the ""right thinking"" before writing any code. well the thing is i completed like 22 projects from the book big book of small python projects and i am still writing codes like this [https://paste.pythondiscord.com/HGNA](https://paste.pythondiscord.com/HGNA) i feels like i know python but lacks in thinking on how to approach a problem and making it run properly. and i feels like if i keep practising like this i wouldn't get any close to writing code more effectively any sooner unless i have someone to tell me the right way or i learns it from a tutor or a course or a book on how to approach and think of a problem, cuz if i were to just practise and do it on my own i would be doing hit and trials and it might take me much longer compared to if i m being taught on how to write it better. so how should i go further on now ? i just want to ask how to think when we were given a problem say we were given to make a terminal program and i always just confuse like yeah i can make it work but i still feels like i need to learn to write it neatly. i can make small programs but i want to learn how to make complicated programs or think/design beforehand on making these programstldr; asking if it will be good to read some ""tips"" from somewhere or watch any lectures on thinking properly instead of just practising which i think might take ""more"" time for e.g. will it be beneficial to read books like ""think like a progrmmer"" by al sweigart ? instead of just practising and finding the neat ways on my own ?",16,0.86,27,https://www.reddit.com/r/learnprogramming/comments/1u3rf8p/how_to_write_code_for_complex_problems_as_a/,2026-06-12 10:24:38,2026-06-18 04:05:28
1u46b5s,Looking for books that are centered around programming exercises,Maleficent-Boss5564,learnprogramming,"My languages of choices are:PythonC#BashJavaScript Edited: I'm an intermediate level programmer in Python and C#, and love BIG books. I realize that not all big books are worth the page-count.",15,0.9,12,https://www.reddit.com/r/learnprogramming/comments/1u46b5s/looking_for_books_that_are_centered_around/,2026-06-12 20:14:05,2026-06-18 04:05:28
1u5ggf0,"People say build projects, but how can i know that i've built it correctly?",Responsible_Fan2464,learnprogramming,"I understand building projects is important, but i need some sort of feedback. How can i know that this is the most efficient or the best way to write this code? I wouldn't fully trust AI in this to be honest.",12,0.83,28,https://www.reddit.com/r/learnprogramming/comments/1u5ggf0/people_say_build_projects_but_how_can_i_know_that/,2026-06-14 09:19:25,2026-06-18 04:05:28
1u52luz,Confused about naming in the Zig standard library,Confused-Armpit,learnprogramming,"I have recently been checking out Zig, however it has been difficult. A lot due to the fact that most info online is outdated after the 0.16.0 changes, but that's a topic for another day. What I am confused about, is the modules in the standard library.Coming from C, I assumed that the std.time module would have things that are about time, features such as timestamps and sleeping. However, std.time just contains information about different epoch times. On the other hand, timestamps and sleeping are contained in std.Io. This isn't only about time features too, a lot of other things are kept in the std.Io module for seemingly no reason.Is there a distinction between the io I am thinking about (coming from C and a little bit of Rust) and Zig's std.Io? Is it just anything that talks to the kernel/hardware, so anything taking use of syscalls basically?",13,0.93,6,https://www.reddit.com/r/learnprogramming/comments/1u52luz/confused_about_naming_in_the_zig_standard_library/,2026-06-13 21:24:28,2026-06-18 04:05:28
1u6gh02,W3 Schools certificate?,No_Growth1420,learnprogramming,"I've taken a mandatory introductory class in Computer Science, Data Science, and Machine Learning this year during my bachelor's program at HSG. During the year, we used W3Schools for documentation. I saw that they propose online certificates. Are they of any value?",9,0.7,12,https://www.reddit.com/r/learnprogramming/comments/1u6gh02/w3_schools_certificate/,2026-06-15 13:21:51,2026-06-18 04:05:28
1u674aj,Learning JavaScript as my first programming language – should I learn touch typing and switch keyboard layouts first?,Legitimate_Host_887,learnprogramming,"&#x200B;&#x200B;Hi everyone,&#x200B;I'm planning a career change into software development and have decided to start learning JavaScript as my first programming language. Before diving into JavaScript, I've been spending a little time learning HTML.&#x200B;However, while practicing, I realized something: I type very slowly. I've always typed like the average person using only 2–4 fingers, and it made me wonder whether I should learn proper touch typing (10-finger typing) before focusing heavily on programming.&#x200B;My reasoning is that if I can type without constantly looking at the keyboard, learning and coding might become much smoother and more efficient in the long run.&#x200B;That led me down a rabbit hole of keyboard-related questions:&#x200B;1. QWERTZ vs. QWERTY&#x200B;I live in Germany, so I use a QWERTZ keyboard layout. Should I switch to QWERTY for programming, or is it not worth it?&#x200B;2. Programming-focused keyboard layouts&#x200B;I've seen some programmers using layouts where symbols seem much easier to access. I've even seen setups where the top number row produces symbols by default instead of numbers.&#x200B;Are there keyboard layouts that are particularly good for JavaScript or programming in general? If so, which ones would you recommend?&#x200B;3. Should I just keep everything as it is?&#x200B;Part of me thinks it might be better to stick with the standard German layout because then I can sit down at almost any computer and start typing immediately without having to switch layouts or reconfigure anything.&#x200B;How important is keyboard layout really once you're an experienced developer?&#x200B;4. German vs. US physical keyboards&#x200B;I'm also wondering whether I should buy a different keyboard altogether.&#x200B;German keyboards use the ISO layout with the large L-shaped Enter key, while US keyboards use the ANSI layout. I've heard some people say the US layout is better for programming.&#x200B;Would you recommend switching to a US keyboard, or is the difference mostly personal preference?&#x200B;5. Future-proofing for laptop use&#x200B;Right now I use a desktop PC, but in the future I might get a laptop and work remotely.&#x200B;If I buy a new keyboard now, how can I make sure that transitioning between my desktop keyboard and a future laptop keyboard will be as smooth as possible?&#x200B;I'd really appreciate hearing from people who have gone through a similar transition or who work professionally as developers.&#x200B;Thanks!",10,0.76,38,https://www.reddit.com/r/learnprogramming/comments/1u674aj/learning_javascript_as_my_first_programming/,2026-06-15 05:09:56,2026-06-18 04:05:28
1u5k9ol,"Studying Pascal, but why exactly?",The_mister_Mike,learnprogramming,"So, they say ***I should learn Pascal*** *to pick up ""better practices""*... but what exactly am I looking at?To clarify, I already know **C**, **PHP**, and **JavaScript** (and Bash) to some extent, and I'm planning to dig deeper into **C**, which feels like home to me. However, there's a common piece of advice to study **Pascal** to ""learn some better practices"" – whatever that means – so I'm just wondering. I'm *really curious* and eager to study it (I'm actually starting later this month), so please don't take my question as mockery or sarcasm!I simply want to hear what the more experienced would have to say about it, especially those older than me who actually studied **Pascal** at university while I was studying **QBasic** at school in the 90s.From a practical standpoint, I want to know *exactly* what to focus on in my upcoming 2-4 months brief course of studying **Pascal**, that I never plan to actually use beyond that course.If that makes sense!",9,0.63,38,https://www.reddit.com/r/learnprogramming/comments/1u5k9ol/studying_pascal_but_why_exactly/,2026-06-14 12:47:08,2026-06-18 04:05:28
1u5fgpc,How To Learn Vim in 2026?,Odd-Boysenberry-3009,learnprogramming,"Hi all, I am Learning Java I am in my 1st year of CSE UG i am using Itellij currently and want to switch to Vim to make my life more difficult . Also What is the difference between Vim and NeoVim?I am currently using Mac OS",11,0.79,17,https://www.reddit.com/r/learnprogramming/comments/1u5fgpc/how_to_learn_vim_in_2026/,2026-06-14 08:17:25,2026-06-18 04:05:28
1u2pteq,"How do you progress past being a beginner who knows the basics but not enough to do/create anything on their own, and escape LLM hell?",Efficient-Flight1602,learnprogramming,"This is more of a cry for help than anything else lol. I am a CompSci student and Ive come to realise that, I rely wayy too much on LLMs when coding, and i dont want that. I think ive let it become a crutch. I want to be able to create programs/work on software by myself, and use LLMs purely as a tool for efficiency. I want to be able to direct the AI to do exactly what i want and understand exactly what its doing, so the only benefit is the speed. What I feel like I'm missing is:\- How do you approach building an actual application from scratch? (only applications weve really created from front to back are web apps)\- How do you learn a new framework, library, or technology\- How do you debug problems when you have no idea what's causing them?\- How do you approach and understand large codebases?Couple of months ago i thought ill start from square one, and started following tutorials for Python and Java (used them for uni and my internship at the time). But because i already know the fundamentals, they didnt feel all that helpful. What i want is the next step.I want to cut off ai entirely. My current ""goal"" is to maybe watch some videos, articles on the Doom source code. (cus og doom is special game to me). And do something with it. Not sure what but, even then, i dont know where to even begin, but lets see. My ultimate goal is to use AI purely as a tool for efficiency than a crutch. I want to be able to confidently tell an interviewer that what sets me apart from my peers is that, I can build and understand software on my own, and use AI only to improve my effciency, it is not a crutch.",11,0.79,13,https://www.reddit.com/r/learnprogramming/comments/1u2pteq/how_do_you_progress_past_being_a_beginner_who/,2026-06-11 05:14:53,2026-06-18 04:05:28
1u8a7e4,Wanting to learn Data Science — where do I even start? Free or paid course recommendations needed,SameCardiologist2440,learnprogramming,"So I've been thinking about getting into Data Science for a while now and I finally want to commit to actually learning it.A few things I want opinions on:1. Online vs offline — does it actually make a difference like i dont think anybody is giving me job just because i have learned through a specific institute etc will it ?2. Are there any good free courses that actually take you somewhere?3. Is a paid course like those on Coursera, Udemy, or Scaler actually worth the money, or can you get the same thing for free?4. Any YouTube channels, specific playlists, or learning paths you actually finished and would recommend?5. What's a realistic roadmap — like how long before I can actually do something useful or put it on a resume?i dont want road maps etc i just want to know how would you learn data science and land a job i think i can manage some refferals too i just want a good source for learning",8,0.8,5,https://www.reddit.com/r/learnprogramming/comments/1u8a7e4/wanting_to_learn_data_science_where_do_i_even/,2026-06-17 13:28:23,2026-06-18 04:05:28
1u34580,"Trying to learn CS and DSA, but I'm not very good at math",MikeADenton,learnprogramming,"I've been watching MIT's course MIT 6.006 Introduction to Algorithms, Fall 2011. Started the first lecture, took my time with it to understand the algorithms presented (Binary Search, Greedy Ascent and Divide and Conquer). I learned them, used three languages each (C using pointers, Python and JavaScript). used a bit of AI just to review my code for any weird thing or tips about how to code things more effectively (I know some people may not like the use of AI, but I'm using it as a code buddy)But the math part is super confusing, I have no clue what's going on, the recitation videos makes it even worse. I'm not sure what to do anymore. should I go back and learn the math before taking this course? Use OSSU as my roadmap?I love the coding part, visualizing these algorithms and code them. Some say that you can skip the math part but once you get to the next course, the math it necessary, and I don't want to do it just to pass it, but to understand it. Thank you :(",10,0.74,17,https://www.reddit.com/r/learnprogramming/comments/1u34580/trying_to_learn_cs_and_dsa_but_im_not_very_good/,2026-06-11 16:36:58,2026-06-18 04:05:28
1u4iwgb,Java or C++ ??,Automatic_Muscle3906,learnprogramming,"Guys I am going to start DSA , I am confused about whether I should learn in Java or C++ . Help me",9,0.81,20,https://www.reddit.com/r/learnprogramming/comments/1u4iwgb/java_or_c/,2026-06-13 05:59:04,2026-06-18 04:05:28
