id,title,author,subreddit,content,score,upvote_ratio,num_comments,url,created_utc,extracted_at
1pooc45,me and my coworkers,ElectronicMenu3230,dataengineering,No content,695,0.97,70,https://i.redd.it/yqrddasj8p7g1.jpeg,2025-12-17 05:20:58,2025-12-22 01:52:23
1ppuky6,My “small data” pipeline checklist that saved me from building a fake-big-data mess,Jhaspelia,dataengineering,"I work with datasets that are not huge (GBs to low TBs), but the pipeline still needs to be reliable. I used to overbuild: Kafka, Spark, 12 moving parts, and then spend my life debugging glue. Now I follow a boring checklist to decide what to use and what to skip.If you’re building a pipeline and you’re not sure if you need all the distributed toys, here’s the decision framework I wish I had earlier.1. Start with the SLA, not the techAsk:* How fresh does the data need to be (minutes, hours, daily)?* What’s the cost of being late/wrong?* Who is the consumer (dashboards, ML training, finance reporting)?If it’s daily reporting, you probably don’t need streaming anything.2. Prefer one “source of truth” storage layerPick one place where curated data lives and is readable by everything:* warehouse/lakehouse/object storage, whatever you have Then make everything downstream read from that, not from each other.3. Batch first, streaming only when it pays rentStreaming has a permanent complexity tax:* ordering, retries, idempotency, late events, backfills. If your business doesn’t care about real-time, don’t buy that tax.4. Idempotency is the difference between reliable and hauntedEvery job should be safe to rerun.* partitioned outputs* overwrite-by-partition or merge strategy* deterministic keys If you can’t rerun without fear, you don’t have a pipeline, you have a ritual.5. Backfills are the real workloadDesign the pipeline so backfilling a week/month is normal:* parameterized date ranges* clear versioning of transforms* separate “raw” vs “modeled” layers6. Observability: do the minimum that prevents silent failureAt least:* row counts or volume checks* freshness checks* schema drift alerts* job duration tracking You don’t need perfect observability, you need “it broke and I noticed.”7. Don’t treat orchestration as optionalEven for small pipelines, a scheduler/orchestrator avoids “cron spaghetti.” Airflow/Dagster/Prefect/etc. is fine, but the point is:* retries* dependencies* visibility* parameterized runs8. Optimize lastMost pipelines are slow because of bad joins, bad file layout, or moving too much data, not because you didn’t use Spark. Fix the basics first:* partitioning* columnar formats* pushing filters down* avoiding accidental cartesian joinsMy rule of thumbIf you can meet your SLA with:* a scheduler* Python/SQL transforms* object storage/warehouse and a couple checksthen adding a distributed stack is usually just extra failure modes.Curious what other people use as their “don’t overbuild” guardrails. What’s your personal line where you say “ok, now we actually need streaming/Spark/Kafka”?",466,0.98,29,https://www.reddit.com/r/dataengineering/comments/1ppuky6/my_small_data_pipeline_checklist_that_saved_me/,2025-12-18 16:06:50,2025-12-22 01:52:23
1ppksi4,Report: Microsoft Scales Back AI Goals Because Almost Nobody is Using Copilot,City-Popular455,dataengineering,Saw this one come up in my LinkedIn feed a few times. As a Microsoft shop where we see Microsoft constantly pushing Copilot I admit I was a bit surprised to see this…,430,0.97,80,https://i.redd.it/go2g4s0bzw7g1.jpeg,2025-12-18 07:23:01,2025-12-22 01:52:23
1pqqnmp,Realization that I may be a mid-level engineer at best,I_Blame_DevOps,dataengineering,"Hey r/dataengineering, Feeling a bit demoralized today and wondering if anyone else has come to a similar realization and how they dealt with it. Approximately 6 months ago I left a Sr. DE job on a team of 5 to join a startup as their sole data engineer. The last job I was at for 4.5 years and helped them create reliable pipelines for \~15 sources and build out a full QC process that all DEs followed, created code standards + CI/CD that linted our code and also handled most of the infrastructure for our pipelines. During this time I was promoted multiple times and always had positive feedback. Cut to my current job where I have been told that I am not providing enough detail in my updates and that I am not specific enough about what went wrong when fixing bugs or encountering technical challenges. And - the real crux of the issue - I failed to deliver on a project after 6 months and they have of course wanted to discuss why the project failed. For context the project was to create a real time analytics pipeline that would update client reporting tables. I spent a lot of time on the infrastructure to capture the changes and started running into major challenges when trying to reliably consume the data and backfill data.We talked through all of the challenges that I encountered and they said that the main theme of the project they picked up on was that I wasn't really ""engineering"" in that they felt I was just picking an approach and then discovering the challenges later. Circling back to why I feel like maybe I'm just a mid-level engineer, in every other role I've been in I've always had someone more senior than me that understood the role. I'm wondering if I'm not actually senior material and can't actually do this role solo. Anyways, thanks for reading my ramble and let me know if you've found yourself in a similar position.",300,0.97,55,https://www.reddit.com/r/dataengineering/comments/1pqqnmp/realization_that_i_may_be_a_midlevel_engineer_at/,2025-12-19 17:15:29,2025-12-22 01:52:23
1pmy7a2,"How many people here would say they're ""passionate"" about DE?",spawn-kill,dataengineering,"I don't want this to be a sob story post or anything but I've been feeling discouraged lately. I don't want to do this forever and I'm certainly not even that experienced. I think I'm just tired of always learning (I'm aware that sounds ignorant). I've only been in this field about two years and learned SQL and enough python to get by. 9 hour day and then feeling like I need to sit down after that to ""improve"" or take a course has proved exceptionally challenging and draining for me. It just feels so daunting.I guess I just wanted to ask if anyone else felt this way. I made the shift to DE from another discipline a few years ago so maybe I just feel behind. I'd like to start a business that gets me outside but that takes gobs of money and risk.",125,0.98,55,https://www.reddit.com/r/dataengineering/comments/1pmy7a2/how_many_people_here_would_say_theyre_passionate/,2025-12-15 04:16:09,2025-12-22 01:52:23
1pn7iay,A Data Engineer’s Descent Into Datetime Hell,nonamenomonet,dataengineering,"This is my attempt in being humorous in a blog I wrote about my personal experience and frustration about formatting datetimes. I think many of you can relate to the frustration.Maybe one day we can reach Valhalla, Where the Data Is Shiny and the Timestamps Are Correct",118,0.97,37,https://www.datacompose.io/blog/fun-with-datetimes,2025-12-15 13:36:00,2025-12-22 01:52:23
1pp58zz,Folks who have been engineers for a long time. 2026 predictions?,uncomfortablepanda,dataengineering,"Where are we heading? I've been working as an engineer for longer than I'd like to admit. And for the first time, Ive been struggled to predict where the market/industry is heading. So I open the floor for opinions and predictions.My personal opinion: More AI tools coming our way and the final push for the no-code platforms to attract customers. Data bricks is getting acquired and DBT will remain king of the hill.",103,0.94,99,https://www.reddit.com/r/dataengineering/comments/1pp58zz/folks_who_have_been_engineers_for_a_long_time/,2025-12-17 19:14:03,2025-12-22 01:52:23
1pqxp2n,How are you exposing “safe edit” access to business users without giving them the keys to the warehouse?,nagel393,dataengineering,"Curious how other teams are handling this, because I have seen a few versions of the same problem now.Pattern looks like this:* Warehouse or DB holds the “real” data* Business / ops / support teams need to fix records, update statuses, maybe override a few fields* Nobody wants to give them direct access in Snowflake/BigQuery/Postgres or let them loose in dbt modelsI have seen a bunch of approaches over the years:* old-school: read-only views + “send us a ticket to change anything”* Excel round-trips that someone on the data team turns into SQL* custom internal web apps that a dev built once and now everyone is scared to touch* more recently: low-code / internal tool builders like Retool, Appsmith, UI Bakery, Superblocks, etc, sitting in front of the warehouse or APIsRight now I am leaning toward the “small internal app in front of the data” approach. We are experimenting with a builder instead of rolling everything from scratch, partly to avoid becoming a full-time CRUD developer.UI Bakery is one of the tools we are trying at the moment because it can sit on-prem, talk to our DB and some OpenAPI-described services, and still give non-technical users a UI with roles/permissions. Too early to call it perfect, but it feels less scary than handing out SQL editors.Curious what the rest of you are doing:* Do you let business users touch warehouse data at all, or is everything ticket-driven?* If you built a portal / upload tool / internal UI, did you go custom code or something like Retool / Appsmith / UI Bakery / similar?* Any “we thought this would be fine, then someone updated 50k rows by mistake” stories you are willing to share?Trying to find a balance between safety, governance and not spending my whole week building yet another admin panel.",74,0.94,22,https://www.reddit.com/r/dataengineering/comments/1pqxp2n/how_are_you_exposing_safe_edit_access_to_business/,2025-12-19 22:02:58,2025-12-22 01:52:23
1pp67g0,Salesforce is tightening control of its data ecosystem,georgewfraser,dataengineering,No content,67,0.97,31,https://www.cio.com/article/4108001/salesforce-is-tightening-control-of-its-data-ecosystem-and-cios-may-have-to-pay-the-price.html,2025-12-17 19:51:30,2025-12-22 01:52:23
1po138m,Which DE offer should I take? which tech stack will you pick?,AH1376,dataengineering,"Hey you all, I have been looking to change job as a data engineer and I got 3 offers that I have to choose from. Regardless of salary and every thing else, My concern is now just about tech stack of the offers and want to know your opinion on which tech stack do you think is best, considering on going trends in data engineering. To add context, I live in Germany and have about 2.5 full time YO and 2 years of internships in data engineerings. - Offer 1: Big Airline company - main tech stack: Databricks, Scala, Spark - Note: I will be the only data engineer in the team working with an analysts, intern and team lead. - High responsibility role and a lot of engagement needed- Offer 2: Mid size 25 YO ecommerce company - main tech stack: Azure Fabrics, dbt, python - Note: I will be the only data engineer in the team working with 3 analysts and team lead. - The want someone to migrate their old on-prem tech stack to azure Fabrics and use dbt to enable analysts - High responsibility role and a lot of engagement needed- Offer 3: Tech start up (Owned by big German auto maker) - main tech stack: AWS, python, protobufs - Note: data platform role. I will be working with 4 data engineers (2 senior) and a team lead - Medium responsibility role as there are other data engineers in the team My main back ground is close to offer 2 and 3, but I have no experience in databricks (The company ofc knows about this). I am mostly interested in offer 1 as the company is the safest in this market, but have some doubts about whether the tech stack is the best for future job changes and if it is popular in DE world. I would be glad to hear your opinions.",66,0.9,76,https://www.reddit.com/r/dataengineering/comments/1po138m/which_de_offer_should_i_take_which_tech_stack/,2025-12-16 12:48:24,2025-12-22 01:52:23
1pq4tkx,Making 100k with 5 years experience with Snowflake and Databricks,Lanky-Fig8945,dataengineering,"It was my first job, and I cant take it anymore. If i get let go could I find another DE job making about the same MCOL. How is the job market. I feel like I am very underpaid but salary beats no salary or should i shoot for 135k",62,0.76,55,https://www.reddit.com/r/dataengineering/comments/1pq4tkx/making_100k_with_5_years_experience_with/,2025-12-18 22:51:59,2025-12-22 01:52:23
1pnavqd,Who else is coasting/being efficient and enjoying amazimg WLB?,lightpassion,dataengineering,"I work at a bank as a DE, almost 4 years now, mid level.I got pretty good at my job for a while now. That combined with being in a big corporate allow me to work maybe 20 hours of serious work a week. Much less when things are busy.Recently got an offer for 15% more pay, fully remote as opposed to hybrid, but is a consulting company which demands more work.I rejected it because I didn't think WLB was worth the trade.I know it's case by case but how's WLB for you guys? Do DEs generally have good WLB?Those who complain a lot or are not good at their job should be excluded. Even in my own team there are people always complaining how demanding the job is because they pressure themselves and stress out from external pressures.I'm wondering if I made the right call and whether I should look into other companies.",64,0.94,45,https://www.reddit.com/r/dataengineering/comments/1pnavqd/who_else_is_coastingbeing_efficient_and_enjoying/,2025-12-15 15:55:54,2025-12-22 01:52:23
1pojhd1,How to deal with messy Excel/CSV imports from vendors or customers?,North-Ad7232,dataengineering,"I keep running into the same problem across different projects and companies, and I’m genuinely curious how others handle it.We get Excel or CSV files from vendors, partners, or customers, and they’re always a mess. Headers change, formats are inconsistent, dates are weird, amounts have symbols, emails are missing, etc.Every time, we end up writing one-off scripts or manual cleanup logic just to get the data into a usable shape. It works… until the next file breaks everything again.I have come across this API which takes excel file as an input and resturns schema in json format but its not launched yet(talked to the creator and he said it will be up in a week but idk).How are other people handling this situation?",53,0.93,50,https://www.reddit.com/r/dataengineering/comments/1pojhd1/how_to_deal_with_messy_excelcsv_imports_from/,2025-12-17 01:17:09,2025-12-22 01:52:23
1pr16h8,Spark 4.1 is released :D,holdenk,dataengineering,The full list of changes is pretty long: [https://issues.apache.org/jira/secure/ReleaseNote.jspa?projectId=12315420&version=12355581](https://issues.apache.org/jira/secure/ReleaseNote.jspa?projectId=12315420&version=12355581) :D The one warning out of the release discussion people should be aware of is that the (default off) MERGE feature (with Iceberg) remains experimental and enabling it may cause data loss (so... don't enable it).,51,0.97,17,https://spark.apache.org/news/spark-4-1-0-released.html,2025-12-20 00:49:13,2025-12-22 01:52:23
1pqdjh9,Left DE Before Even Getting a Job,HarvesterOfReveries,dataengineering,"Just sharing my story here, not a successful one. I was trying to switch from legacy backend dev at a government organization to a DE role. Did relevant projects, learned a lot, but no luck. I was comfortable working with python, docker, a few frameworks like Airflow, Spark, Dagster, DBT etc. and of course git and Java + a few tools that nobody uses in DE from the job that I was doing.Did about 100 applications, spending a fair bit of time tweaking applications to match every job that I applied to. Did not apply for stuff that I wasn't interested in. Got pretty much nothing.I did however also applied to a few software dev roles too. Ended up landing one and got incredibly lowballed but I was so tired of my previous job, I had to take it like an idiot.Well, started the new job and the work was pretty fun. But colour me surprised, the thing that pushed me out from the previous job wasn't the culture or the work just being boring, it was the cycle. I'm only 26 and honestly, I can't imagine working 9-5 until I turn 50 or 60. I'm drafting up some ideas, learning and researching what's required to create products on my own. Once I'm confident enough in an idea and the progress, I'll probably quit. Or get fired because I'm distracted. Staying for a few for months because of financial constraints.Anybody else have similar experiences? I find it so weird that I was so interested in DE just a year ago, still confident that I can perform well in it, but completely lost interest to put in the effort because in the end I know I'll just get paid peanuts for the actual amount of work I'll do (pay in my country is garbage). The only thing that might change this would be life changing compensation, but obviously that requires much more prep that I don't know if I have the time for (or the ability for that matter). Even that wouldn't be a sustainable way out of this dumb rotten week cycle we humans invented for ourselves. Work like a mchine for 5 days and be tired for the rest of the day after work? Recover from that shit for 2 days and then get back to it again? Fuck. That.Thanks for listening to my rant, please share your own thoughts, because obviously there's lots of people who enjoy what they do and have much more ""work endurance"" than me. Also curious to see if there's more people who feel the same way as me too.",40,0.78,30,https://www.reddit.com/r/dataengineering/comments/1pqdjh9/left_de_before_even_getting_a_job/,2025-12-19 05:56:18,2025-12-22 01:52:23
1pqom0w,What do you think fivetran gonna do?,Fair-Bookkeeper-1833,dataengineering,Now that they have both SQLMesh and DBT.I think probably they'll go with SQLMesh as standard and will slowly move DBT customer base to SQLMesh.what do you guys think?,43,0.84,85,https://www.reddit.com/r/dataengineering/comments/1pqom0w/what_do_you_think_fivetran_gonna_do/,2025-12-19 15:56:04,2025-12-22 01:52:23
1poueor,Redshift vs Snowflake,Harxh4561,dataengineering,"Hi. A client of ours is in a POC comparing Redshift (RA3 nodes) vs Snowflake. Engineers are arguing that they are already on AWS and Redshift natively integrates with VPC, IAM roles, etc. And with reserved instances, cost of ownership looks cheaper than showflake.Analysts are not cool with it however. They complain about distribution keys and the trouble with parsing of json logs. They are struggling with Redshift's SUPER data type. They claim it’s ""weak for aggregations"" and requires awkward casting hacks. They want snowflake because it works no frills (especially VARIANT and dot notation) and they can query semi structured data.The big argument is that savings on Redshift RIs will be eaten up by the salary cost of engineers having to constantly tune WLM queues and fix skew.What needs to be picked here? What will make both teams happy?",40,0.93,31,https://www.reddit.com/r/dataengineering/comments/1poueor/redshift_vs_snowflake/,2025-12-17 11:39:05,2025-12-22 01:52:23
1pq9aei,Good books/resources for database design & data modeling,zipArk,dataengineering,"Hey folks,I’m looking for recommendations on **database design / data modeling books or resources** that focus on **building databases from scratch**.My goal is to develop a **clear process** for designing schemas, avoid common mistakes early, and model data in a way that’s **fast and efficient**. I strongly feel that even with solid application-layer logic, a poorly designed database can easily become a bottleneck.Looking for something that covers:* Practical data modeling approach* Schema design best practices* Common pitfalls & how to avoid them* Real-world examplesBooks, blogs, courses — anything that helped you in real projects would be great.Thanks!",38,0.95,16,https://www.reddit.com/r/dataengineering/comments/1pq9aei/good_booksresources_for_database_design_data/,2025-12-19 02:17:40,2025-12-22 01:52:23
1pn4ts2,What's your document processing stack?,Any_Hunter_1218,dataengineering,"Quick context - we’re a small team at a logistics company. We process around 500-1,000 docs per day (invoices, BOLs, customs forms).Our current process is:1. Download attachments from email2. Run them through a python script with PyPDF2 + reg⁤ex3. Manually fix if something breaks4. Send outputs to our systemThe reg⁤ex approach worked okay when we had like 5 vendors. Now we have 50+ and every new vendor means we have to handle it in new ways.I've been looking at IDP solutions but everything either costs a fortune or requires ML expertise we don't have.I’m curious what others are us⁤ing. Is there a middle ground between pyt⁤hon scripts and enterprise IDP that costs $50k/year?",35,0.95,23,https://www.reddit.com/r/dataengineering/comments/1pn4ts2/whats_your_document_processing_stack/,2025-12-15 11:13:02,2025-12-22 01:52:23
1porgop,Offering Help & Knowledge — Data Engineering,Astronaut-Proud,dataengineering,"I’m a backend/data engineer with hands-on experience in building and operating real-world data platforms—primarily using Java, Spark, distributed systems, and cloud data stacks.I want to give back to the community by offering help with:* Spark issues (performance, schema handling, classloader problems, upgrades)* Designing and debugging data pipelines (batch/streaming)* Data platform architecture and system design* Tradeoffs around tooling (Kafka, warehouses, object storage, connectors)This isn’t a service or promotion—just sharing experience and helping where I can. If you’re stuck on a problem, want a second opinion, or want to sanity-check a design, feel free to comment or DM.If this post isn’t appropriate for the sub, mods can remove it.",30,0.88,12,https://www.reddit.com/r/dataengineering/comments/1porgop/offering_help_knowledge_data_engineering/,2025-12-17 08:31:22,2025-12-22 01:52:23
1poyoks,How to data warehouse with Postgres ?,Defiant-Farm7910,dataengineering,"I am currently involved in a database migration discussion at my company. The proposal is to migrate our dbt models from PostgreSQL to BigQuery in order to take advantage of BigQuery’s OLAP capabilities for analytical workloads. However, since I am quite fond of PostgreSQL, and value having a stable, open-source database as our data warehouse, I am wondering whether there are extensions or architectural approaches that could extend PostgreSQL’s behavior from a primarily OLTP system to one better suited for OLAP workloads.So far, I have the impression that this might be achievable using DuckDB. One option would be to add the DuckDB extension to PostgreSQL; another would be to use DuckDB as an analytical engine interfacing with PostgreSQL, keeping PostgreSQL as the primary database while layering DuckDB on top for OLAP queries. However, I am unsure whether this solution is mature and stable enough for production use, and whether such an approach is truly recommended or widely adopted in practice.",32,0.87,46,https://www.reddit.com/r/dataengineering/comments/1poyoks/how_to_data_warehouse_with_postgres/,2025-12-17 15:00:33,2025-12-22 01:52:23
