id,title,author,subreddit,content,score,upvote_ratio,num_comments,url,created_utc,extracted_at
1ttysc7,SmallTalk as introduction for Object Programming,pepiks,learnprogramming,"Today I found strange advice - to learn SmallTalk to grasp idea of Object Programming. I grow on C++, TurboPascal, now I the most job I do in Python or Go. But anyone use this ancient language (1970s)? It make any sense suggest it as tool for learning concept? I am more interested not real possibility as I see my current duo the most useful but in context introduction passionate students to Object Programming - are you will recommeded them SmallTalk?",3,0.81,10,https://www.reddit.com/r/learnprogramming/comments/1ttysc7/smalltalk_as_introduction_for_object_programming/,2026-06-01 17:11:19,2026-06-02 04:05:26
1ttqzal,Is making sort of difficult programs despite not knowing much syntax a good way to learn programming?,starlangg,learnprogramming,"I do know the basics and I’ve been learning GUI through our university course. However, sometimes, I do wanna make personal apps and websites, but i feel like I “don’t know enough.” Like, I fear if I jump into a project and just research every step of the way about what I need to do this and that, it would lessen my understanding? Like, I should learn from the bottom up (like follow a resource—a video, a book, etc).",3,0.81,9,https://www.reddit.com/r/learnprogramming/comments/1ttqzal/is_making_sort_of_difficult_programs_despite_not/,2026-06-01 12:40:29,2026-06-02 04:05:26
1tt3uh9,Any Beginner-Friendly Course Recommendations?Struggling to Learn AI/ML,Pretty-Paramedic9675,learnprogramming,"i have been trying to learn AI/ML but there are so many courses that it’s hard to know where to start.looking for something beginner-friendly, practical, and project-based. I have seen LogicMojo, Coursera, Udacity, and Great Learning.any recommendations from people who have actually taken these courses?",5,0.86,11,https://www.reddit.com/r/learnprogramming/comments/1tt3uh9/any_beginnerfriendly_course/,2026-05-31 18:50:14,2026-06-02 04:05:26
1tsua0a,unable to run javascript and html code in vscode,Famous_Wolf162,learnprogramming,"EDIT: THANKS TO FLAME IN THE COMMENTS I FINALLT RESOLVED THE ISSUES EXCEPT 3RD ONEim very newbie to all of this just learning syntax of javascript (first time learning coding language)i m just trying use vscodebut i m having so many issues with itfollowing certain tutorials i installed node js as the tutorial person said to install it to be able to run js in vscode and some extensions extensions and errors - 1) live server extension to run html file (issue- if i reload the page it doesnt update with any changes i made in html file. i have to turn it off and on again to see changes) and any styles i added in style.css do not appear in the webpage.2) code runner extension (issue- it runs the code says done but nothing appears in consolelets say i write console.log(""something"") it runs but the ""something"" doesnt appear3) some another weird error when i try running the code..vscode sends a pop up saying ""cannot connect to localhost:some number(and popup asks me to go to launch.json file)""4) reference error: document not found /defined (i forgot)(in console of vscode)5) some error in output - node is not recognised as an internal or external command , operable program or batch fileso i uninstalled node js because it was giving me problems and reinstalled it. and 4th error went away.but still it is not showing any output in console when i run a js code.6) (as mentioned in 1st error that before the changes i make in html file were not appearing on webpage if i reload the web page) but now .anything i put in html file is not showing in the browser/webpage.7) any code i write in js file does not show up in browser page's console when i inspect the page",3,0.81,2,https://www.reddit.com/r/learnprogramming/comments/1tsua0a/unable_to_run_javascript_and_html_code_in_vscode/,2026-05-31 12:40:20,2026-06-02 04:05:26
1tss1ww,How to learn a new programming concept?,zainulabdin100,learnprogramming,"I'm a beginner programmer, and I'm curious about how experienced developers learn new concepts.For example, when you encounter something like recursion, OOP or even just a new function/library, what process do you follow to make sure you actually understand it?I'm looking for a framework or checklist. How do you know you've gone from ""I read the explanation"" to ""I can confidently use this in a real project""?A few things I struggle with:* Visualizing what is happening step-by-step.* Can follow a tutorial but unable to implement things in a new scenario.* Understanding the flow of inputs and outputs.* Knowing whether I truly understand a concept or have just memorized an example.* Deciding how deep to go when learning something new.That last point is a big one for me. If I try to learn every concept in depth, I never make progress on actual projects. But if I only learn things superficially, I worry that I'm building on weak foundations.How do you decide when a concept deserves a deep dive versus when it's enough to learn the basics and move on? What does your learning process look like?Lastly what if i encounter the same problem 1 month later by that time i would have forgotton that concept?",4,0.67,12,https://www.reddit.com/r/learnprogramming/comments/1tss1ww/how_to_learn_a_new_programming_concept/,2026-05-31 10:52:35,2026-06-02 04:05:26
1ts0xoo,Help becoming technical,IllustriousGround143,learnprogramming,"Hii, I haven't been technical all my life infact all my tech experience consists of roblox luau and harvard's cs50, I'm looking forward to learn how to program and design Apps, And most importantly because it's what interests me, Hardware all sorts of cool stuff. My issue is 1. Where can i go from cs50 2. Am i wasting 100's of hours for something that AI can make in an instant, Because I've been getting fed up with all those ai bros (Claude code + 1k a day + 6am workouts) types of people but they might have a point 3. Do you start your passion project as soon as you begin or when you master the learning 4. I'd love helpful insights from the countless gifted brains on this subreddit",4,0.83,5,https://www.reddit.com/r/learnprogramming/comments/1ts0xoo/help_becoming_technical/,2026-05-30 14:07:15,2026-06-02 04:05:26
1tru9ib,How to implement scheduler/cron the right way?,kneegrow7,learnprogramming,"I already posted this on r/nestjs but decided to post here.I implemented a scheduler that fetches the entire record except the already processed one and processed it with business logics to and saved it in to another table. Right now, it runs smoothly except it stops at 5500 records out of 100k+ unprocessed records. *this.processLogic* is where i stored all of the business logics and updates the unprocessedTable isProcessed to true. The *Date to skip* are those rows that has incomplete data upon ingestion timing (**db ingestion on schedule and user has no logout yet or still working at that time**) and i have to skip them in order to avoid wrong output.I already finished the project and realised that this module should be fixed as i am expecting thousands of ingestions each day and this should not break. I am thinking about I already created an infinite loop but I dont know where as I am not really a backend guy. I just started in the fullstack ecosystem.Will surely appreciate your suggestions/insights! Thank you so much in advance! @Timeout(0)   async processRecords() {     const projectCodes = await this.codes.findMany();     const now = new Date();     const lilo =       await this.unprocessedTable.findMany({         where: {           isProcessed: false,         },         include: {           a: true,           b: true,           c: true,         },         orderBy: {           d: 'desc',         },       });     for (const record of lilo) {       const GRACE_PERIOD = 5 * 60 * 60 * 1000; // +5 hours       if (record.shiftDate && record.shiftFrom && record.shiftTo) {         const shiftEnd = new Date(record.shiftDate);         const hours = record.shiftTo.getUTCHours();         const minutes = record.shiftTo.getUTCMinutes();         const seconds = record.shiftTo.getUTCSeconds();         shiftEnd.setUTCHours(hours, minutes, seconds, 0);         if (record.shiftFrom > record.shiftTo) {           shiftEnd.setDate(shiftEnd.getDate() + 1);         }         const processAfter = new Date(shiftEnd.getTime() + GRACE_PERIOD);         if (now < processAfter) {           console.log('Date to SKIP:', processAfter);           continue;         }         if (!record.vcLastLogout || !record.proLastLogout) {           continue;         }         console.log(`${record.recordId} timelog success!`);         await this.processLogic(record, projectCodes);       }     }     console.log('Cron executed');   }",3,1.0,9,https://www.reddit.com/r/learnprogramming/comments/1tru9ib/how_to_implement_schedulercron_the_right_way/,2026-05-30 08:35:15,2026-06-02 04:05:26
1tr0qym,SQL Learning Material,babaqewsawwwce,learnprogramming,"Hello everyone,I’m really worried about the viability of losing some of my support staff as a result of AI. I do not want to see them get laid off, so I’m trying to integrate them with my dev ops team. They manage our cloud database right now, but my team is also building internal pwas for our org. I’m looking to level up their skills and want to start them on sql, html, css, and graduate to js. Then get them on react over the next year?Are there any resources anyone recommends? Are the free resources like ODIN project and free code camp any good?My background is math and finance and I was able to self teach and get into the industry. But is there anything that provides problems questions etc?Thx",3,1.0,2,https://www.reddit.com/r/learnprogramming/comments/1tr0qym/sql_learning_material/,2026-05-29 12:45:00,2026-06-02 04:05:26
1tq9ojw,"I can build apps locally, but how do I actually launch one for real users?",StunningProposal3579,learnprogramming,"Hey everyone,I’ve been learning and building apps for a while now, mostly using tools like Supabase, Vercel, Claude, etc. The thing is… everything I’ve made so far only runs locally on my computer.Now I’m trying to launch my first real project: an inventory management app for the company where I work (small company). I’ll also be using it myself internally.The app would handle things like:* inventory tracking* stock alerts* movement history* requests* dashboards/reports* low stock indicators* categories and consumablesThe problem is: I have basically 0 formal programming background and almost no experience deploying production apps for real users.I understand how to build things locally, but I’m confused about what actually needs to happen so multiple people in the company can use the app without depending on my computer being turned on.Right now I’m trying to understand:* what services I actually need* how hosting works* if Vercel + Supabase is enough* whether I need a VPS/Hostinger/server/VPN/etc* how authentication/security should work* what I should be careful about before letting a real company use itThe company is small, so I’m trying to keep things simple and affordable while still making it reliable and professional.Would really appreciate any advice, architecture recommendations, beginner mistakes to avoid, or examples of how you launched your first internal company app.Thanks :grinning_face_with_smiling_eyes:",2,0.67,9,https://www.reddit.com/r/learnprogramming/comments/1tq9ojw/i_can_build_apps_locally_but_how_do_i_actually/,2026-05-28 17:07:11,2026-06-02 04:05:26
1tq1mf2,"I want to work in IT, but it's very difficult to get started. I have a higher education diploma, but I don't know how to make a portfolio, because they didn't teach me at the university.",gladiator04n73,learnprogramming,"Hello everyone, I'm studying for a master's degree in applied computer science: methods and technologies of AI. I have a bachelor's degree in applied Computer Science: cognitive technologies, so I'm thinking of going to Data Science. At the moment, I'm not working in my specialty. How do I make a portfolio and resume so that I can be hired by an IT company?",1,0.55,9,https://www.reddit.com/r/learnprogramming/comments/1tq1mf2/i_want_to_work_in_it_but_its_very_difficult_to/,2026-05-28 12:05:55,2026-06-02 04:05:26
1tpxwrp,I’m looking for advice from people who have handled very large Excel/CSV imports in production systems.,just_human_right,learnprogramming,"Current requirement from my client:Upload 3 Excel sheetsOne sheet contains 150k+ rowsAnother contains 40k+ rowsData needs to be inserted into multiple relational tables based on hierarchical categorizationEach text field may also need translation into multiple languages (up to 15 languages, though realistically 3–5 most of the time)The biggest challenge is making the import:ReliableScalableConsistentFault tolerantUser friendly with proper progress/error handlingCurrent approach:Process/import data in chunks instead of loading the full file into memoryImport only the source language first (English)Save core data into DBPush translation processing into background jobs/queues (npm BullMq Package)This works better than translating during import, but once the dataset becomes huge, even the background translation jobs become extremely heavy and time consuming.I’d really like to hear how experienced engineers handle cases like this in real-world production systems.Tech stack is mainly Node.js, Next js and MySQL for databse",3,1.0,13,https://www.reddit.com/r/learnprogramming/comments/1tpxwrp/im_looking_for_advice_from_people_who_have/,2026-05-28 08:55:37,2026-06-02 04:05:26
1tphk5l,Projects,Hot_Gur4315,learnprogramming,How do you know what the right game engine to use is?,5,0.86,7,https://www.reddit.com/r/learnprogramming/comments/1tphk5l/projects/,2026-05-27 20:26:03,2026-06-02 04:05:26
1to2xzi,What stack would you pick if it has to keep running after I'm gone?,Neat_Hand4068,learnprogramming,"Building a little web app for a volunteer club (equipment lending + some maintenance tracking). Solo, spare time. Thing is, I won't maintain it forever, it gets handed off to non-technical volunteers, so it has to just keep running with basically no babysitting.I know SvelteKit/Next and a bit of Java/Python, open to whatever. What would you go with, and what would you regret 5-10 years later? Managed (Supabase/Firebase) or something simple and self-hosted?",3,0.81,22,https://www.reddit.com/r/learnprogramming/comments/1to2xzi/what_stack_would_you_pick_if_it_has_to_keep/,2026-05-26 10:30:55,2026-06-02 04:05:26
1to28nd,Does any one have any notes or comments on the Philosophy of Coding?,Big_Example_3390,learnprogramming,"I started off thinking I needed to simply memorize Modules and go through each and find a way to apply each of them linearly through the docs.Thinking about it that was kind of a retarded approach, but i blame it on classroom conditioning. My inconsistent life stability as well, going off and on with studying.Anyway, I found progress in freeCodeCamp and Ive took these notes:\###########So far, I've built a report card printer and a employe profile generator. Both are in the python certificate exam with freeCodeCamp##################\*\*\*\*\*\* in Python, code blocks are determined by indentation.\*\*\*\*\*\* CONGRATULATIONS ASSHOLE!!!!!!!!!!!! You can now start writing programs that make decisions based on logic and input. Whether you’re comparing values or branching through multiple conditions, these tools are the foundation to writing flexible, responsive code.Congrats G, you can write more flexible and readable conditional logic.I built a movie ticket calculator.Redundacny Is A BIG Logic Problem I have in learning Python.Think of parameters as placeholder variables that act as ""slots"" for the values you pass into functions when you call them. To use the parameters, you have to pass in ""arguments"". Arguments are the values you pass to a function when you call it.I built a Discount function.In Python it seems that you should learn to do things with incredible detail and specifics. In the FCC it seems an unspoken lesson is to pay careful attention to what is not said, don't under-cut and don't exceed the expectation. That might be something to ponder later.In note taking i have also fouond that it is much more meaningful and efficient to only record pointers, not executions or further examples. That type of stuff should be stored by memory so you can execute independently. caesar cipher which is an encryption method that shifts letters in the alphabet to encode messagesMaybe the point its teaching me at this point is to go out and find the information myself instead of just using what has been given to me in the exam, Im gonna have to read up on stuff myself. \*\*That was exactly what i was supposed to do.order matters whenever it comes to for loops also a if statement is a for loop \*\*\*\* I originally made a bunch of notes of different commands like a short summary manual, but then i realize later that my efforts were wasted because i should memorize most of the stuff and the other stuff i hould be referencing the Docs.some of it is just me giving myself recognition because i get to feeling like im not making progress and i can look at it and think - oh shit yeah nah i am completing things thats cool. or sum like that... but anyway does anyone else do this?",3,0.71,8,https://www.reddit.com/r/learnprogramming/comments/1to28nd/does_any_one_have_any_notes_or_comments_on_the/,2026-05-26 09:54:55,2026-06-02 04:05:26
1tu1jfc,Those who are parents here.. do you want your kids to learn coding?,sagson,learnprogramming,My daughter is 8 years old and I dont know whether i should introduce her to coding.,1,0.55,18,https://www.reddit.com/r/learnprogramming/comments/1tu1jfc/those_who_are_parents_here_do_you_want_your_kids/,2026-06-01 18:39:57,2026-06-02 04:05:26
1tu0ysf,Help with parallel FastAPI / Python testing with real DB,OkWater4180,learnprogramming,"Would like to see if there is a common setup / library for parallel testing with DB access.Our tests have access to the real postgres DB - when run locally, use same as dev DB. In CI, use the sidecar postgres.At the start, all alembic revisions are run to bring the schema up to date.Then per function, the table data is deleted and the function is run.I'd like to make this parallelizable.I know Django has this built into it.",2,1.0,4,https://www.reddit.com/r/learnprogramming/comments/1tu0ysf/help_with_parallel_fastapi_python_testing_with/,2026-06-01 18:21:39,2026-06-02 04:05:26
1ttglix,Need some Guidance,Rushi_Dani,learnprogramming,"I am 2027 CS grad from tier-3 college of Gujarat. I want higher package but companies came to my college is 6-7 LPA. I don't want to go outside Gujarat if not necessary. Everyone in my family and relatives are waiting for me to succeed and want me to break generational lower middle class group. Every day they tell me that (kab teri nokari lagegi....). They say to my parents (bas abhi to 6-7 months he phir aapko aaram hi aaram he). The only thing I can do is hard work but clarity that what will actually going to help in what thing I can give me time and energy. I was having 2 months of summer vacation (may, june) may is gone in overthinking that what will happen in future. I don't want that june goes like this I can easily give 12-14 hours a day but what to give.",2,0.76,8,https://www.reddit.com/r/learnprogramming/comments/1ttglix/need_some_guidance/,2026-06-01 03:47:50,2026-06-02 04:05:26
1ttg4nn,"Software Testing - If an E2E test already covers some workflow, is it still worth having unit tests for that same workflow?",Working-Row-6116,learnprogramming,"Im having trouble on deciding on when to implement unit tests if you already have e2e tests that cover the same ""area"". For example say we have a web app, and I have a set of playwright tests (e2e tests) for a particular functionality on the app. In this specific case lets say we are testing the filtering and sorting of some table. The e2e tests already covers all core logic and edge cases regarding filtering and sorting via interacting with the UI, acting like a real user.Under the hood, the filtering and sorting is controlled by 2 helper functions -> filter() and sort(). Is it it worth to have unit tests for these 2 functions? Or is it a waste of time? Because I already am testing those implicitly via interacting with UI in the e2e tests. Would it not be redundant?",2,0.76,6,https://www.reddit.com/r/learnprogramming/comments/1ttg4nn/software_testing_if_an_e2e_test_already_covers/,2026-06-01 03:25:02,2026-06-02 04:05:26
1tt0zvd,Where can I learn the system design behind Enterprise Data Ontologies?,Sangcreed,learnprogramming,"Hi everyone,I recently went down a rabbit hole watching how companies (like Palantir) use Data Ontologies to connect massive, messy datasets into intuitive graph and interface that human can easily control.The system design behind mapping real world objects to database nodes has completely hooked my attention, and I can't get it out of my head.I really want to learn how these are actually built under the hood. Does anyone have recommendations for textbooks, open-source projects, or resources to learn about building ontologies and knowledge graphs from scratch?Thanks!",2,0.67,3,https://www.reddit.com/r/learnprogramming/comments/1tt0zvd/where_can_i_learn_the_system_design_behind/,2026-05-31 17:05:49,2026-06-02 04:05:26
1tsywd6,Read and write AG32VF,PartyZestyclose,learnprogramming,What device can Read and write AG32VF QFN32,2,0.76,1,https://www.reddit.com/r/learnprogramming/comments/1tsywd6/read_and_write_ag32vf/,2026-05-31 15:46:58,2026-06-02 04:05:26
1tswka9,Code map,2thick2fly,learnprogramming,"I know this question might not be exactly for this subreddit, but I think since it is related to learning in some way, there might some good insight.What I am trying to do is to create a code map of my repo (python) to ease junior devs into it, but I am stuck. The code structure is workflow-based, where the top layer is the business process step-by-step. The orchistrator calls each step - which then calls the necessary module(s) - and when a step is finished, the orchistrator calls the next step. A bit oversimplified, but you get the idea. Any ideas for tools that can do that?PS: I tried AI, but it was just laying everything out either horizontally or vertically in mermaid, which did not make it visually pleasing.",2,0.76,12,https://www.reddit.com/r/learnprogramming/comments/1tswka9/code_map/,2026-05-31 14:16:32,2026-06-02 04:05:26
1tssm3z,looking for dev bros learning js/ front - end,Ok_Cut2375,learnprogramming,"Hey everyone , i started my front -end journey this year and have been learning for the last 5 months and honestly I feel like I am circulating around ""js"" last one month it will be great if there is any body learning this pls help out it like am only follow the freecodecamp site untill and am not into video watch type I rather do try and get dirty in filed type so it will great if just kind enough to give tip not a spoons feat and am welcome seniors and juniors like me who was learning and i wise you doing well in your life and pls spare me from this uneven english and am looking forward . and little about am from ( Tamilnadu ) and my current work is bike mechanic.",2,1.0,0,https://www.reddit.com/r/learnprogramming/comments/1tssm3z/looking_for_dev_bros_learning_js_front_end/,2026-05-31 11:21:03,2026-06-02 04:05:26
1tql754,"Built a full-stack auth system with Express + React + TypeScript — JWT, bcrypt, RBAC, Zustand, React Query. Feedback welcome!",2dem463,learnprogramming,"Hey, I've been learning full-stack development and built a complete authentication system from scratch.What it includes:\- Express + Prisma + SQLite backend\- bcrypt password hashing\- JWT authentication\- Role-Based Access Control (RBAC)\- React + TypeScript frontend\- Zustand for auth state\- Axios interceptors for token management\- Protected + Admin routes\- Zod form validationGitHub: [https://github.com/AdemZaddem/Authentication\_System](https://github.com/AdemZaddem/Authentication_System)Any feedback on the code structure or improvements welcome!",2,1.0,2,https://www.reddit.com/r/learnprogramming/comments/1tql754/built_a_fullstack_auth_system_with_express_react/,2026-05-29 00:12:09,2026-06-02 04:05:26
1tqjmmj,Better solution for News API,Expensive_Bank9080,learnprogramming,"I recently started using NewsAPI for scraping news articles online but this only works in your localhost, can anyone recommend any free APIs that work in production too (especially when deploying with Vercel):folded_hands:",2,1.0,2,https://www.reddit.com/r/learnprogramming/comments/1tqjmmj/better_solution_for_news_api/,2026-05-28 23:06:26,2026-06-02 04:05:26
