id,title,author,subreddit,content,score,upvote_ratio,num_comments,url,created_utc,extracted_at
1q5m1uk,FastAPI vs Spring Boot: A Question on Programming Feel,Existing_Steak,learnprogramming,"I am trying to learn programming and have a question about frameworks/programming languages.I have made a simple HTTP-based API in both python (using fastAPI) and java (using Spring Boot).In fastAPI framework, I notice that I mainly write functions which are either passed in as parameters into other functions or called by other functions. To me, this makes sense from my perspective, or at least feels intuitive. I can literally see the programming ""primitives"" I wrote interacting with each other in my source code. For example, I build an endpoint like```python@APIRouter().get(""/blah"")def get_blah(): return ""blah""```then I must tell my main FastAPI() object about the routes using `.include_router()`. Nice. I can also somewhat imagine whats going on in my head, like the `APIRouter` object has some record of all the routes I defined via the decorator and that object is being passed to my `FastAPI()` object.Spring Boot, on the other hand, I notice that I create classes, and some of these classes are never instantiated! At least they're certainly never called in my source code. I can run my application with Gradle and the class I created that was never instantiated actually did something. E.g., I make this class```java@RestControllerpublic class TextController { @GetMapping(""/texts"") public List getTexts() { return service.getTexts(); }}```but I never wrote ""TextController blah = new TextController()"" anywhere?Like, I feel more in control of my FastAPI application than I do with my Spring application? Do others feel like this? Do I just chalk up the framework differences to ""thats how the authors who designed each framework intended it to be""?",8,0.84,13,https://www.reddit.com/r/learnprogramming/comments/1q5m1uk/fastapi_vs_spring_boot_a_question_on_programming/,2026-01-06 15:44:24,2026-01-07 01:49:58
1q50dsm,Learning how to use a debugger,FirmAssociation367,learnprogramming,"Im a beginner at programming and I am currently trying to learn how to use a debugger. numbers = [5, 10, 15] total = 0 count = 0 for n in numbers:     total = total + n     count = count + 1 average = total / count print(""Average:"", average) This was a code I pasted and by adding a breakpoint in `total= total + n` I was able to see how each variable change on the left panel each iteration. My questions are1. Whats the purpose of a breakpoint? 2. Aside from seeing how each of my variable change, what other situations can I use a debugger? 3. Do you have any suggestions on how I should approach learning how to use debugger next? or is this enough for now? what I did was very simple but it felt amazing that I was able to see how each of my variable change, cause I had to imagine it in my mind beforeThank you for your patience.. this field is still very complicated for me so its hard to formulate questions",6,0.72,13,https://www.reddit.com/r/learnprogramming/comments/1q50dsm/learning_how_to_use_a_debugger/,2026-01-05 22:31:47,2026-01-07 01:49:58
1q41unv,Aspiring to being a Data Engineer,MoonliteColdbrew,learnprogramming,"Hi allI’m aspiring to become a Data Engineer and need some help in identifying what to learn and excel.To give some context and background : I’m not from IT background and thinking to study roughly 3-4 hrs per day. For now I got started with SQL and AWS.From a little bit of Chatgpting and Redditing, I am thinking to go over these below tech stack in the exact order. SQL, Git & GitHub, Python, AWS, DataBuilt Tool, Data bricks, Apache Airflow.Also for AWS, Data bricks, DBT and Airflow, I’m thinking to do certifications as I believe they’ll add credentials to my profile.I need help and advice on the following please : 1. Does the tech stack and order look good or Do I need to add/remove anything?2. Regarding certifications, I’m a bit confused as both AWS and Data bricks are offering similar kind of certifications. Should I do both or choose one, if one which would be better.3. I have chosen AWS rather than GCP and Azure as I read that AWS has the highest market share among these. I’m open to any suggestions even outside of my questions. Thank you in advance!!",7,0.89,6,https://www.reddit.com/r/learnprogramming/comments/1q41unv/aspiring_to_being_a_data_engineer/,2026-01-04 21:14:01,2026-01-07 01:49:58
1q18msg,Backend stack - Python or NodeJS?,RadioMysterious945,learnprogramming,"Hi guys, I’m a frontend developer and I’m thinking about becoming full-stack. Which backend stack would you recommend learning - Python or Node.js? I already have some experience with Node.js and PostgreSQL. I’d really appreciate your advice.",8,0.72,13,https://www.reddit.com/r/learnprogramming/comments/1q18msg/backend_stack_python_or_nodejs/,2026-01-01 16:48:57,2026-01-07 01:49:58
1q5fgzc,Structured Python backend course? (GitHub Student Dev Pack),-no_mercy,learnprogramming,"I struggle to stay consistent with unstructured resources, so I’m looking for a **structured, end-to-end Python backend path** covering Python, DSA, frameworks, APIs, databases, and deployment to become job-ready.Courses from anywhere or **free structured roadmaps** are fine. I also have the **GitHub Student Developer Pack**.Any recommendations?",5,0.7,4,https://www.reddit.com/r/learnprogramming/comments/1q5fgzc/structured_python_backend_course_github_student/,2026-01-06 10:53:22,2026-01-07 01:49:58
1q4pror,How do you know when youre ready to move past tutorials,Ok-Message5348,learnprogramming,I understand stuff when watching videos but starting a project from scratch feels impossible. Like I blank outDo you just push through this or am I missing something,7,1.0,20,https://www.reddit.com/r/learnprogramming/comments/1q4pror/how_do_you_know_when_youre_ready_to_move_past/,2026-01-05 16:09:23,2026-01-07 01:49:58
1q3wwmo,Not able to create Logic of my own,iPostX,learnprogramming,"hey! I started learning ""Python."" everything is going good, but when I'm trying to solve questions on my own, at that time I'm not able to create logic of my own. It felt like I don't know anything about python. It seems like my :brain: is completely empty. what should I do ?",6,0.67,20,https://www.reddit.com/r/learnprogramming/comments/1q3wwmo/not_able_to_create_logic_of_my_own/,2026-01-04 18:08:14,2026-01-07 01:49:58
1q212yi,"For those that learned game programming, how did you start and how would you start now?",eh_it_works,learnprogramming,"I've been in backend and automation for years, done some QA too. And I've always wanted to make a game, pico 8 looks pretty fun for that style.Aside from pico 8, what else should I get started on?",7,0.74,6,https://www.reddit.com/r/learnprogramming/comments/1q212yi/for_those_that_learned_game_programming_how_did/,2026-01-02 15:12:25,2026-01-07 01:49:58
1q1x1om,Help Me With Subject Selection Please!!!!,LordMafia777,learnprogramming,"Hi everyone,Hope your day went well...I am a student of Computer Engineering department (Entering 6th Semester),and currently I have received Mail from University regarding Subject Selection, there are 4 options and have to select 1 Subject please help me to know which subject should I select and will be helpful in future.Sorry for my bad english but currently a little bit nervous and anxious regarding subject selection...Here are the subject list...1. Advance Computer Networks.2. Distributed Computing.3. Cloud Infrastructure and Services.4. Linux and Shell Programming.Thanking you for carrying out your precious time to help Me...Thank You SO Much Respected Members:folded_hands_light_skin_tone:",6,0.88,12,https://www.reddit.com/r/learnprogramming/comments/1q1x1om/help_me_with_subject_selection_please/,2026-01-02 12:10:32,2026-01-07 01:49:58
1q1wym2,IT tech first before Game Developer?,Human-Spirit2380,learnprogramming,"25m and have a basic background in IT. This year (2026) I started learning IT fundamentals to understand how systems and technology work. My long term goal is to move into coding for game development and eventually create a multiplayer online game.Am I on the right track by starting with IT, or should I shift my focus more toward programming now? What would you recommend I study to realistically build my own game in the future?",7,0.77,7,https://www.reddit.com/r/learnprogramming/comments/1q1wym2/it_tech_first_before_game_developer/,2026-01-02 12:05:54,2026-01-07 01:49:58
1q1wkuy,header abstraction solution,mjhl714843,learnprogramming,"is there a header that abstracts windows.h ? i checked ""webstt"" website but removed all the headers",4,0.71,3,https://www.reddit.com/r/learnprogramming/comments/1q1wkuy/header_abstraction_solution/,2026-01-02 11:44:41,2026-01-07 01:49:58
1q1d2se,Your Start,NoKey8507,learnprogramming,"When you all learned to program, when did you start programming? I am a high school senior who is currently learning how to code, and I have not taken any prior programming classes, and while doing it, I realized I like it. I have been using Brilliant, Sololearn, Mimo, and Enki and YouTube to help me learn. I am looking to be a software engineer in the future, and I figured now would be a good start, and I will also be taking programming classes when I start college.",5,0.86,13,https://www.reddit.com/r/learnprogramming/comments/1q1d2se/your_start/,2026-01-01 19:44:37,2026-01-07 01:49:58
1q0du3o,Learning C++ - Where to continue?,Foxhill11,learnprogramming,"Hello World! I am very keen on learning C++, for games and apps and just general computer knowledge. So I’ve started doing just that, learning the very basics, and I’ve been able to write a few programs with the help og tutorials and basic understanding of if-statements, while loops etc. I did this following an easy tutorial on youtube. Thing is, that tutorial is finished, and I have no idea where to go next. I’ve searched around and found a lot of resources for learning. I have books, pages, youtube tutorials and much more, but I still don’t have an «end-goal» with those. What should I work toward learning? I got interested in OpenGL, and started there. It went alright, but it is some steps ahead of my very basic knowledge and it ends with me just copying code without *really* understanding most of it. So let’s say I want to start making very basic apps. Say a to-do list, a calculator or something like that (with some sort of graphics library so I can make something else than just prompt programs :face_with_tears_of_joy:), but I’m still very fresh, what should I do?",6,0.76,9,https://www.reddit.com/r/learnprogramming/comments/1q0du3o/learning_c_where_to_continue/,2025-12-31 14:08:25,2026-01-07 01:49:58
1q4auwz,Need motivation/advice,relaxitskev,learnprogramming,"What motivated you guys to learn in the first place or keep learning especially when you started out and struggled? I am learning python and C for a nuclear physics internship but I feel so slow and dumb. I want the adrenaline of coding for hours and writing hundreds of lines of efficient code every day, if there is such a feeling.",4,0.67,9,https://www.reddit.com/r/learnprogramming/comments/1q4auwz/need_motivationadvice/,2026-01-05 03:35:40,2026-01-07 01:49:58
1q3zbzh,I need advice on presenting my project,yptonic,learnprogramming,"Hello everyone. I hope I’m allowed to post this here, but I didn’t know where to put this. I apologize for any grammatical mistakes in advance, English isn’t my native language.I’m a student in CS. For one of my classes, I had to code an Internet Service Provider on VM Oracle with DHCP services, DNS, internet speed, and everything that you expect from an ISP. On Wednesday, I’ll have to present my project to my (very strict) teachers as if they were clients and I was a developer. I have never done this before, and I am very nervous. I don’t know what to expect. Can any senior developers or anyone who works in a tech company tell me what, exactly, would make me look professional? Do you do PowerPoints to explain stuff to clients ? Do you explain the code, or maybe more the concept and how the software works ? What is expected of you? Anything would be helpful because I’m very out of my depth. I really want to impress my teachers. One of them worked for years at Microsoft in a high position and is a bit of a snob. I really want this to be a learning experience but I’m going in blind. Again, anything would be helpful. Thank you in advance!",7,1.0,13,https://www.reddit.com/r/learnprogramming/comments/1q3zbzh/i_need_advice_on_presenting_my_project/,2026-01-04 19:38:36,2026-01-07 01:49:58
1q36u3r,Bachelor program,Broad_Train_683,learnprogramming,I just started my bachelor program in computer science. This is the actual program name for my school Bachelor of Science (BS) in Computer Science - Business and AI pathway. I was wondering when would be a good time to start trying to get an internship and in what areas of Software Engineering to look for being so new in the field to get the experience to stand out?,7,1.0,8,https://www.reddit.com/r/learnprogramming/comments/1q36u3r/bachelor_program/,2026-01-03 21:33:30,2026-01-07 01:49:58
1q2o4oh,What is the right flow to understand DSA ?,MountainCandidate212,learnprogramming,Please Help everyone. I need guidance.,4,0.76,9,https://www.reddit.com/r/learnprogramming/comments/1q2o4oh/what_is_the_right_flow_to_understand_dsa/,2026-01-03 07:11:40,2026-01-07 01:49:58
1q2mcz7,How do I build problem-solving intuition for DSA as a complete beginner with no CS background?,Substantial-Drink900,learnprogramming,"Hi everyone,I come from a non-CS background (B.Com) and recently transitioned into software development.Current context:\- Enrolled in an IIT Patna hybrid MCA program\- Working as a Full Stack Developer + AI Agent Developer\- Limited time due to job and studies(currently give 2hrs/day)DSA status:\- Solved \~40 problems so far\- Mostly Arrays\- I can usually think of brute-force solutions\- I struggle to “see” optimal approaches on my own\- I consider myself a complete beginner in DSAMy main confusion is NOT about finishing all topics (I know that will happen eventually).What I’m struggling with:\- How do people \*develop intuition\* for problems?\- How do you know which data structure or pattern to try?\- How do you move from brute force → optimized thinking naturally?Also, since I don’t have a CS background:\- What non-DSA habits helped you long-term? (thinking patterns, analysis techniques, daily practices)\- Is there anything I should add to my daily routine that will help me think like a CS grad over time?**I’m looking for mindset-level advice, not just a topic list. As I know I would make it big, just wanted a bit of guidance**Thanks in advance :folded_hands:",6,0.8,6,https://www.reddit.com/r/learnprogramming/comments/1q2mcz7/how_do_i_build_problemsolving_intuition_for_dsa/,2026-01-03 05:36:33,2026-01-07 01:49:58
1q1ozht,Learning C and lacking math skills,Pancakes1741,learnprogramming,"Hey everyone for the past several months I've been trying to teach myself C. I'd I'am actually making pretty good headway til I reach math related portions. Such as using modulo, and other related math issues I've been presented with.For full transparency I hobbled through algebra and pre-algebra and I do realize I'am functionally retarded when it comes to mathematics.Is C a language I should keep trying to learn or would it be wise to simply use another language that isnt as math intensive? I don't have very little foundation with mathematics beyond basic +,-,\*,/ problems.Any input is very welcome as I'm struggling pretty hard to get through the math related portions.Thanks in advance for any wisdom/experience you guys can offer! :D",4,0.6,41,https://www.reddit.com/r/learnprogramming/comments/1q1ozht/learning_c_and_lacking_math_skills/,2026-01-02 04:24:35,2026-01-07 01:49:58
1q0zh24,combining civil Engineer with programming,Ambitious-Bake8173,learnprogramming,"I am a civil engineer with a full-time job, but I also want to learn programming as an additional skill. I am excellent in math and absolutely love programming—I’ve just learned the basics of Python and I really enjoy the way programming works. I want to focus on Python, JavaScript, HTML, CSS, web development, and even some ethical hacking. Considering my civil engineering job and current skills, is it realistic and effective for me to achieve proficiency in these programming areas? What strategies would you advise for balancing both fields effectively without burning out?",6,0.8,8,https://www.reddit.com/r/learnprogramming/comments/1q0zh24/combining_civil_engineer_with_programming/,2026-01-01 08:29:59,2026-01-07 01:49:58
1q0pc66,What does inheritance buy you that composition doesn't—beyond code reuse?,ByteMender,learnprogramming,"From a ""mechanical"" perspective, it seems like anything you can do with inheritance, you can do with composition.Any shared behavior placed in a base class and reused via `extends` can instead be moved into a separate class and reused via delegation. In practice, an inheritance hierarchy can often be transformed into composition by:* Keeping the classes that represent the varying behavior,* Removing `extends`,* Injecting those classes into what used to be the base class,* Delegating calls instead of relying on overridden methods.From this perspective, inheritance looks like **composition + a relationship**.With inheritance:* The base class provides shared behavior,* Subclasses provide variation,* The `is-a` relationship wires them together implicitly at compile time.With composition:* The same variation classes exist,* The same behavior is reused,* But the wiring is explicit and often runtime-configurable.This makes it seem like inheritance adds only:* A fixed, compile-time relationship,* Rather than fundamentally new expressive power.If ""factoring out what varies"" is the justification for the extra classes, then those classes are justified independently of inheritance. That leaves the inheritance *relationship itself* as the only thing left to justify.So the core question becomes:**What does the inheritance relationship actually buy us?**To be clear, I'm not asking ""*when is inheritance convenient?""* or ""*which one should I prefer?""*I’m asking:**In what cases is the inheritance relationship itself semantically justified—not just mechanically possible?** In other words, when is the relationship doing real conceptual work, rather than just wiring behavior together?",5,0.62,55,https://www.reddit.com/r/learnprogramming/comments/1q0pc66/what_does_inheritance_buy_you_that_composition/,2025-12-31 22:39:50,2026-01-07 01:49:58
1q0f3qj,Classes versus dictionaries in c#? And general doubts,Puzzleheaded-Law34,learnprogramming,"Hello! New poster here. I just started to practice some C# and learn its style with a couple simple projects. I guess I have some questions on it as a whole, firstly: for most cases where you need a data-holding object, do you just use a class? Coming from python I keep defaulting to a dictionary, but there it's extremely simple to initialize one with whatever key value pairs I need, whereas in c# the statement is so complex I wonder if it's because objects with more than just a string-number or string-string pairs are meant to be classes. Also, I read that classes are faster in execution.Secondly, I guess I've been struggling to explain the need for all the explicit type declarations and other things that to a beginner seem more complicated than they need to be. Like, it was very complicated in VS to just figure out how to run the script I created, having to choose a debugger and running console commands to get there. What do you do if you want to test a snippet of one script in isolation? Also, I had a class script in the same namespace as the main one, but its class wasn't being recognized. Eventually I noticed the class script was in a different subfolder of the project, so I moved it and it worked fine. But what's the point of a namespace if the file still needs to be in the same directory... I imagine all these details are for good reasons, so wanted to ask some experts haha",5,0.86,21,https://www.reddit.com/r/learnprogramming/comments/1q0f3qj/classes_versus_dictionaries_in_c_and_general/,2025-12-31 15:06:24,2026-01-07 01:49:58
1q0dj0j,"Devs who learned to love coding and build projects again, how do I do it?",Space-man17,learnprogramming,"I dont know how to say this, but i have lost all will to build projects. As a reference, Im from a not as prestigious university, and I have been trying to build projects, but one time or another, I always get stuck on somethingI used to try to build stuff on Java and Springboot, but maybe because im a dumbass, I couldnt build anything bigger then a simple CRUD, so tried to migrate to C# and [ASP.NET](http://ASP.NET), do 1 or 2 hobbieish proejcts in rust, but I have simply lost all wil to code, to build things, when I manage to sit in front of a kanban board, I can simply not think of what ineed to know, i cant imagine what features my projects need, I cant get excited about any technologyThis is something that is also affecting me in other areas of life, losing the interest in literally anything and losing the ability to judge or diferentiate good things to do or bad (in the sense of, playing videogames and coding or studying has the same emotional impact on me, none, zero), does anyone has any ideia on how to get around this?",5,0.78,11,https://www.reddit.com/r/learnprogramming/comments/1q0dj0j/devs_who_learned_to_love_coding_and_build/,2025-12-31 13:53:44,2026-01-07 01:49:58
1q5onk5,How would you optimize collision detection? (C#),Puzzleheaded-Law34,learnprogramming,"Hello! So I've recently been working on a simple test game with Monogame. After some trial and error, I made a collision detection system based on several parts:\> under Scenes class, I load textures for obstacles in each scene and create a dictionary to map each scene to the obstacle textures to be drawn. Also created a dictionary to map each texture to its position.\> in my Map class, I create a 2d array of zeros to represent terrain; then, a method loops thru the dictionary from Scenes, to place 1's on all array elements corresponding to the texture's width&height on the grid.\> In the map class, I create methods like this for each direction, which are called in the main Update() method later when the arrow key is detected: (EDIT: position and tex1 in CanMoveL() refer to the player)         public bool CanMoveL(Vector2 position, Texture2D tex1)         {             bool check = true;             if (position.X == Xbounds[0]+10)             {                 return false;             }             for (int y = 5; y < tex1.Height-1; y++){                 if (terrain[(int)position.Y+y, (int)position.X +1]==2)                 {                     check = false;                 }             }             return check;         }Note: I know there are built-in detection methods in monogame, but I'm not really interested in refactoring in the best way possible, I just had the objective of figuring it out from scratch in a way that makes sense. But, if you have some ideas on how you would have approached it/whether my method is way too inefficient, I'd be happy to hear them!Mainly, I'm concerned about the loop that looks through each ""row"" of my character's height, seeing if it hits the obstacle when projected. I was thinking of Numpy style slicing but I couldn't figure that out in c#?Secondly, It seems like this method is kinda fragmented, with the scene textures loaded in Scenes, but the actual mapping of them in Maps. Should both those be in Maps?Thanks!",5,0.86,7,https://www.reddit.com/r/learnprogramming/comments/1q5onk5/how_would_you_optimize_collision_detection_c/,2026-01-06 17:18:22,2026-01-07 01:49:58
1q5hj1k,Windows installer shows “Windows protected your PC” + extra files in install folder — normal?,ifeelinvincible0,learnprogramming,"I’m distributing a small Windows desktop app via an installer (Inno Setup + PyInstaller).When users download it, Windows shows “Suspicious download blocked” / “Windows protected your PC” unless they click Run anyway.After install, the app folder contains the main EXE plus a few other files (runtime folder + uninstall files). The app works fine.My questions:1. Is this folder layout normal for modern Windows apps, or is there a cleaner way to ship only a single visible EXE?2. Is there any realistic way to avoid SmartScreen warnings without paying for a code-signing certificate, or is signing essentially mandatory now?",2,0.67,1,https://www.reddit.com/r/learnprogramming/comments/1q5hj1k/windows_installer_shows_windows_protected_your_pc/,2026-01-06 12:41:27,2026-01-07 01:49:58
1q59pe6,Looking for some advice,Beginning_NewCareer,learnprogramming,Looking for some adviceHi all. I'm looking to see if I could get some advice on a few things. My husband is looking into changing careers. The 2 things he has looked at is cyber security Boot camps/ or full stack Web development Boot camps. We are trying to figure out if they are Worth it at all or is there a better way to go. We are trying to better our future as a family and want to purchase our dream property. We really would like to have something that he could do remotely. We have done some research on both but I figured I ask on here and see if anyone has done any of these programs and might have some advice to give or some input on the boot camps.,2,0.63,5,https://www.reddit.com/r/learnprogramming/comments/1q59pe6/looking_for_some_advice/,2026-01-06 05:12:35,2026-01-07 01:49:58
