id,title,author,subreddit,content,score,upvote_ratio,num_comments,url,created_utc,extracted_at
1sya39r,I scan LinkedIn daily for Data Engineering Job trends,Dubinko,dataengineering,"Hi Folks, I made a tool that draws statistics from LinkedIn job postings. Once per day I scan around 5000 Data Engineering job posts, run them through LLM to extract tool names and make a dashboard.I did those daily scans for the last 11 months so I have some data to share. I often see what I should learn posts here and I hope this will be a useful tool to address those questions. You can access the dashboard under [https://prepare.sh/trends](https://prepare.sh/trends) (no paywall)",348,0.98,53,https://i.redd.it/y5mpywyo6zxg1.png,2026-04-28 18:36:06,2026-05-02 02:48:11
1sy3oti,"""Junior"" role asking for +5 years...",Relative-Cucumber770,dataengineering,"I honestly give up on getting my first DE / Databricks job. Even with my Associate DE cert (which I already regret buying), I simply don't exist to HR",160,0.96,37,https://i.redd.it/wxnfwow22yxg1.png,2026-04-28 14:52:52,2026-05-02 02:48:11
1t12tjh,sqlglot is now 5x faster while still being written in python,captaintobs,dataengineering,"hey folks! i'm the creator of SQLGlot and currently work at Fivetran. i wanted to share some really exciting work that my team has been doing on, which is ALL open source.sqlglot is a SQL parser and transpiler/analysis framework. it's fully written in Python and although it's very powerful, it wasn't super fast. we love that sqlglot is so easy to install and use in the Python ecosystem so didn't want to rewrite it. instead, we used mypyc to compile typed Python code into fast C!while doing this work, we had to make many contributions to mypy, but we're happy now that all of you can enjoy faster sql parsing of your data pipelines!https://www.fivetran.com/blog/how-we-accelerated-transpilation-by-compiling-sqlglot-with-mypyc",130,0.97,17,https://www.reddit.com/r/dataengineering/comments/1t12tjh/sqlglot_is_now_5x_faster_while_still_being/,2026-05-01 19:09:01,2026-05-02 02:48:11
1sy3tcd,"Just laid off, what am I facing?",JDub-loves-mulligans,dataengineering,"I have 15+ years of experience but no python skills, 14 years at my last company. Every job already has 100+ applicants. What’s your estimate before I find a new job? What salary should I expect? What can I do to improve my chances?",127,0.89,128,https://www.reddit.com/r/dataengineering/comments/1sy3tcd/just_laid_off_what_am_i_facing/,2026-04-28 14:57:25,2026-05-02 02:48:11
1swamxj,"I couldn't find a fun way to learn SQL, so I built one",Far-Round2092,dataengineering,[SQLProtocol.com](http://sqlprotocol.com/)Honest feedback welcome. Tell me what's broken or boring.,127,0.93,20,https://v.redd.it/63tsl4axzjxg1,2026-04-26 15:31:14,2026-05-02 02:48:11
1swbo6p,Why alternatives to Spark aren’t a thing in the industry?,Snoopy-31,dataengineering,"Hi all,I’m an engineer that is in charge of a big data platform. Data warehouses, SQL, workflows, you name it.Recently, I’ve decided to start migrating a legacy workload into a more traditional tech stack using Parquet, Spark, Databricks or something equivalent.I have noticed that all platforms have something in common you cannot avoid - Java.Now hear me out, Java by itself isn’t bad me and my developers team use the language for developments and all but the performance ain’t there. The JVM overhead starts every time you query the data warehouse, the garbage collector etc.Recently, I’ve came across a few projects that wrote Spark in Rust. By doing that, the problems of Java disappeared and the performance became extremely good. I did my own benchmarks and it looks like very promising technology for speed. So my question is, why this is not more common?",115,0.9,113,https://www.reddit.com/r/dataengineering/comments/1swbo6p/why_alternatives_to_spark_arent_a_thing_in_the/,2026-04-26 16:10:07,2026-05-02 02:48:11
1sx4p9v,From Solo Data Engineer to Head of Data & Processes,Either-Exercise3600,dataengineering,"For over a year now, I’ve been working at a company where I’m the one-person data department. I literally handle all the functions of a data department: from data ingestion and cleaning to BI design and business support to facilitate decision-making. In addition, thanks to my interest in AI and my proactive approach, I’m doing a lot of process automation on the Power Platform and helping design AI-powered solutions for various teams within my company.Now, a few weeks ago, the company told me they wanted to form a Data + Processes team with me at the helm... and I’m a bit lost on how to go about it (for those of you who don’t know, I’m an “outsider”—I have a background in Communications and taught myself to code online). Has anyone else been in a similar situation?",115,0.97,17,https://www.reddit.com/r/dataengineering/comments/1sx4p9v/from_solo_data_engineer_to_head_of_data_processes/,2026-04-27 14:05:27,2026-05-02 02:48:11
1sv9nhy,What is Apache Kafka and how does it work? (34-min article + Claude/Codex skills),2minutestreaming,dataengineering,"Hey all. I just published a very thorough [34-minute read on ""What is Apache Kafka and how does it work?""](https://medium.com/@stanislavkozlovski/what-is-apache-kafka-and-how-does-it-work-16023aa2efee) which I think will be of use to this community. (not paywalled)The backstory is this: After working on the Apache Kafka project for 6 years, I transitioned into writing about it full-time for \~two years now.One thing that always irked me was that no good single resource existed that explained the project end-to-end. Most were either written by AI, too shallow, or outdated. The ones who were good and thorough-enough were books that were 400+ pages.This resource aims to be the in-between of both. I think it's the most thorough single-resource on the internet about Kafka and should be enough to get any human (or AI agent) up to speed. (happy to accept contributions/suggestions if something is missing)While at it, I also packaged it up in a AI-friendly markdown git repo, with the ability to install as a Skill/Plugin to Codex or Claude Code. (e.g \`$ak what is kafka streams\` \`/ak when should i not use kafka\`)You can check the repo out here: [https://github.com/stanislavkozlovski/what-is-apache-kafka](https://github.com/stanislavkozlovski/what-is-apache-kafka) (Apache 2.0 license)",96,0.94,3,https://stanislavkozlovski.medium.com/what-is-apache-kafka-and-how-does-it-work-16023aa2efee,2026-04-25 11:29:55,2026-05-02 02:48:11
1sy1i2t,What’s the biggest data engineering problem you are facing today?,compass-now,dataengineering,What’s the biggest data engineering problem you are facing today?,96,0.92,144,https://www.reddit.com/r/dataengineering/comments/1sy1i2t/whats_the_biggest_data_engineering_problem_you/,2026-04-28 13:29:39,2026-05-02 02:48:11
1szvhtu,Where do you find real opinions about data engineering these days?,olgazju,dataengineering,"Especially curious about blogs, do people still read independent technical blogs or did most of that shift to corporate/sponsored content? What about newsletters, anything actually worth it? X / LinkedIn? Or is it mostly Reddit at this point?If I’m honest I’m trying to figure out two things. First, it’s really hard to collect new updates from different places. Second, a lot of the content feels off. I’m subscribed to a couple of newsletters but more and more it turns into “Company X built Y” and it looks obviously sponsored. On Reddit it’s often the same topics ""got laid off"" or ""how to get to de"" or endless “amazing new SaaS”. LinkedIn I won’t even start.Is it just me or did the whole information space shift into something where everything is either bought or written by AI?",63,0.9,37,https://www.reddit.com/r/dataengineering/comments/1szvhtu/where_do_you_find_real_opinions_about_data/,2026-04-30 13:03:43,2026-05-02 02:48:11
1szh9u7,Databricks for 500 GB of data. Worth it or too expensive?,rg_cyborg77,dataengineering,"We have an on-prem SQL Server with about 500 GB of data.The goal is to move the data to the cloud with proper data governance. We decided to go with Azure since we are already in the Microsoft ecosystem.My current plan is to use a medallion architecture:Raw parquetBronze → Silver → GoldMain use cases are dashboards and ML pipelines.A few thoughts/questions:1. We were considering Microsoft Fabric, but I have heard it is stronger for Power BI use cases and may not be as mature for ML pipelines.2. Databricks seems more mature for engineering and ML, but I am wondering if it is too expensive or overkill for 500 GB of data.Our planned budget is around 1,000 to 1,500 USD per month.Would Databricks or Fabric be overkill at this scale? Or is Databricks still worth it if we care about governance, ML pipelines, and long-term scalability? What would be the expected cost?Experts, would love to hear your thoughts.",58,0.91,71,https://www.reddit.com/r/dataengineering/comments/1szh9u7/databricks_for_500_gb_of_data_worth_it_or_too/,2026-04-30 00:58:36,2026-05-02 02:48:11
1svgtc8,"Two job offers, which one would you choose?",dsl237,dataengineering,"I (31M) am a data engineer based in NYC. My partner has a similar income, and we have no kids.Been interviewing around and got two job offers. Both jobs sound interesting and are with companies I would actually want to work for. Here's the rundown:Job 1 (healthtech company, series C+)* $220k a year + startup equity.* 15 days PTO* 4x a week in-office* Seems like it would be a decent amount responsibility, probably moderate to high stress, potentially weeks going over 40hrs* On-call rotation* Fancy title, looks good on paper* Opportunity to learn about a new domain (healthcare/healthtech) that can open doors in the future* Tech stack has useful tools to gain experience in (Dagster, Snowflake)* Like most tech companies right now, fairly AI pilledJob 2 (well-funded nonprofit)* $175k a year* 20 days PTO* Hybrid work policy, but not really enforced* Likely better work-life balance* No on-call rotation* Lateral title and pay* Complete greenfield opportunity, would be working with others to more or less build the data platform from the ground up* Tech stack will likely be things I've used before* I would be coming in with the most tech/engineering experience (others on the team have a more business intelligence or data warehouse admin background)* A bit behind the curve on AIWhich would you choose?",56,0.9,49,https://www.reddit.com/r/dataengineering/comments/1svgtc8/two_job_offers_which_one_would_you_choose/,2026-04-25 16:30:58,2026-05-02 02:48:11
1t0qwzx,"First day at new job: manager asked me to revamp a 4+ years-old legacy infrastructure, both on-premise and cloud, along with the database",Sad-Economist-1061,dataengineering,"I would like to seek advice from you guys who are familiar with computer vision + data engineer issues: \- legacy system is monolithic, tightly coupled, over-featured for most clients \- senior data engineer left after i joined \- requirement to design a lean, modular V2 with lower resource usage, \- camera -> inference result(payload) -> RabbitMQ -> middleware v2(what i am working on) \- camera will detect person, cars, plate number etc. \- soon data coming in will be from mqtt, kafka etc \- so ive sketched the db schema, but some product/tech manager asked me to separate raw\_inference\_payload schema and the processed\_payload schema which im not sure why. the table from different schema can be join. so whats the point? anyone has good usecase? things ive figured out so far: \- bronze layer is the inference payload, messy data, ill ingest those data, and store in raw\_inference table. basic info like camera\_id, camera\_ip, and payload(jsonb) in the payload it has like model\_name, detection, logic (inout, dwell, occupancy), etc, very big payload(idk why) \- silver layer: ill process the data and store into processed\_event where the table will be normalized. it will has clear separation of the concern, the big payload from inference result will be sanitized and in their own respective tables. \- gold layer: data is ready to be consume by frontend, generate dashboard, report etc. background about myself: \- 3+ years of exp \- mostly web development or fullstack (js/ts/go) \- not familiar with computer vision & hardware \- not very familiar with strong data engineering culture and practices like dag, dbt, jargon data engineer stuff lol",48,0.91,33,https://www.reddit.com/r/dataengineering/comments/1t0qwzx/first_day_at_new_job_manager_asked_me_to_revamp_a/,2026-05-01 11:37:39,2026-05-02 02:48:11
1szgb6g,I am a former data analyst possibly turning into a data manager. What things do you wish a data analyst know about a data engineer's work?,Arethereason26,dataengineering,Basically the title.,47,0.91,49,https://www.reddit.com/r/dataengineering/comments/1szgb6g/i_am_a_former_data_analyst_possibly_turning_into/,2026-04-30 00:15:16,2026-05-02 02:48:11
1sy322k,Dbt usage in your org,SuccotashPopular9660,dataengineering,"Hi fellow data engineers! I’m trying to understand how dbt has been useful for you & your team… if the use case is to build out a bunch of data products for an org which is on one platform (Databricks / snowflake) - why would you use dbt with these platforms? Can’t you build your transformation logic + semantic views + attach relevant metadata info directly in snowflake & databricks?What is the use case of using something like dbt on top of these tools? I understand that dbt is platform agnostic, so for an org that has maybe both snowflake + Databricks (don’t see this often) - it probably makes sense but in other cases could you please tell me why and when you chose to use dbt?Thanks!!EDIT: thanks everyone for your input! it’s been helpful.",43,0.94,40,https://www.reddit.com/r/dataengineering/comments/1sy322k/dbt_usage_in_your_org/,2026-04-28 14:29:19,2026-05-02 02:48:11
1szkwt0,How many times have you lost your job?,No-Theory6270,dataengineering,"In your careers, how many times have you lost your job for whatever reason?",41,0.94,76,https://www.reddit.com/r/dataengineering/comments/1szkwt0/how_many_times_have_you_lost_your_job/,2026-04-30 03:45:39,2026-05-02 02:48:11
1sv71by,Single Node Data Processing? (Laptop Data),AMDataLake,dataengineering,Just watched a fun presentation on doing data processing from your laptop. Curious how far people have pushed this with things like Polars/DuckDB/Datafusion.What is the largest dataset you’ve been able to work with from your laptop?,39,0.97,26,https://www.reddit.com/r/dataengineering/comments/1sv71by/single_node_data_processing_laptop_data/,2026-04-25 09:00:46,2026-05-02 02:48:11
1swtd13,Data engineering study plan,Fit_Improvement_277,dataengineering,I am looking to opt for the data engineering career. I have good background in data analytics. Please suggest what will be the best way to approach learn more detail about data engineering. Any suggestions will be great help. Any open sources which are effective way to learn. Thank you.,36,0.82,30,https://www.reddit.com/r/dataengineering/comments/1swtd13/data_engineering_study_plan/,2026-04-27 04:28:46,2026-05-02 02:48:11
1sy3xl0,Should I leave a stable team lead role for a Google L4 offer and a 100k raise?,DangerousLog5995,dataengineering,"I need to make a career decision and I was hoping to get your perspective. I have about 8 YOE and since about 2 years I've been leading a team (been with the company for 6 years now). The company where I am at is in general good, I can work from home 3-4 days a week and I have the trust of my managers. I have mainly 2 issues here: - The time I spend coding is becoming less and less. I still drive some of the designs and do some small feature development or PoC, but realistically I can code for like 20-30% of the time. I feel I'm slowly losing my technical edge and I miss coding (although the team leading part is not bad). - Since about 6 months the company is undergoing a strong AI push. My team has actually a key role in the AI part of my product, which is good from a ""political"" point of view but it also means that the pressure has increased. The level of bureacracy and ""glue"" work has also increased. Few months back I applied at Google and I actually got a position which seems interesting. The salary would be 320k, while now I am at 220k. The problem is that they offered me an L4 position, so medium level. Additionally I'm honestly kind of afraid because of the continuos layoffs and high pressure environment. For additionaly context, I currently live with my partner and we plan to start having kids in a couple of years, so losing my job would honestly be quite bad. At the same time it would be a good opportunity to go back to pure dev work, add a good brand on the CV and potentially have more interesting work. What are your thought?",36,0.69,68,https://www.reddit.com/r/dataengineering/comments/1sy3xl0/should_i_leave_a_stable_team_lead_role_for_a/,2026-04-28 15:01:26,2026-05-02 02:48:11
1sy5rdy,Ultimate list of zero-infrastructure SQL querying tools,silvi9,dataengineering,"Hi everyone! Just compiled a list of SQL query engines that let you analyze data without the infrastructure headache. These are perfect for ad-hoc analysis, data exploration, or when you just need to query that random CSV someone sent you lol.If there are any other lightweight query engines you would like to recommend, drop them in the comments! Will update this list as recs come in.Hope you find these useful. :)(Note to mods: I have no affiliation with any of the tools/brands listed, just sharing resources.)**Local File Query Engines*** [**ClickHouse Local**](https://clickhouse.com/docs/en/operations/utilities/clickhouse-local): This tool allows you to run SQL on local Parquet/CSV files without any database server. Just download the binary and go... honestly super handy for quick data checks or converting between formats. Way faster than pandas for large files.* [**DuckDB**](https://duckdb.org): The SQLite for analytics. Query Parquet files, CSVs, even S3 data with regular SQL. Embeds into Python/R without any setup drama. Honestly it's just so much faster than pandas for anything over a few MB.* [**WhatTheDuck**](https://github.com/incentius-foss/WhatTheDuck): Yes, you can also run DuckDB in your browser, and this tool allows you to run it locally in-browser. You can drop CSVs in and this tool will query them immediately. Pretty useful when someone sends you data and you just want to peek at it real quick without writing any code.* [**Ibis**](https://ibis-project.org/): Open-source dataframe library that works locally. It supports over 20 backends so you can use the same API for multiple backends. You can also create expressions in Python and they are compiled into SQL, which is pretty damn cool :) **Build Your Own Analytics Engine*** [**Apache Arrow DataFusion**](https://arrow.apache.org/datafusion/): This is a Rust-based query engine for building custom analytics tools. Uses Arrow's columnar format so it's stupid fast. Honestly kinda niche unless you're building your own data tool, but if you are... this is the way.**Serverless Query Engines*** [**AWS Athena**](https://aws.amazon.com/athena/): Obviously one of the most popular options, but thought I'd include it here. You can query S3 data with SQL and pay only for data scanned. No servers to manage with this, and it works great with pandas via boto3. Can get pricey if you're scanning tons of data though... partition your tables lol.* [**quack-reduce**](https://github.com/BauplanLabs/quack-reduce): Serverless DuckDB on S3/GCS. Great for one-off analyses when you don't want to wait for Spark to boot up. Still pretty new but it's solid.**Hybrid Cloud/Local Solutions*** [**MotherDuck**](https://motherduck.com): DuckDB but with cloud storage and team sharing. Perfect when your laptop starts dying on that 50GB parquet file. Free tier is pretty generous too tbf* [**GlareDB**](https://www.glaredb.com): Open-source SQL database for analytics. Query across S3, local files, and databases with one SQL interface. Postgres-compatible so works with existing tools. Kinda like if DuckDB and Presto had a baby... useful when your data is everywhere.**Local*** [**Flatsql Studio**](https://github.com/NaceKapus/flatsql-studio): Desktop IDE that lets you query flat files with DuckDB locally. It's got an excellent UI, and an intuitive interface. Looks pretty new but solidWhat did I miss? I would like to update this with even more libraries/resources, so if you have any recommendations, drop them in the comments below.Thanks for reading! :)",31,0.98,8,https://www.reddit.com/r/dataengineering/comments/1sy5rdy/ultimate_list_of_zeroinfrastructure_sql_querying/,2026-04-28 16:06:01,2026-05-02 02:48:11
1syyy7e,Not-so-confident junior applicant preparing for jobhunt,ArisRayle,dataengineering,"To those currently working as DEs: Please help a junior out!To better prepare for jobhunting soon, I have a few questions po as I learn and study more. You can answer even just one if you're super busy but I would really appreciate it if you could answe a couple/all >.<\---------------------1. How are pipelines built/planned in your company? \- We were only taught Kimball's: Select the organizational process, declare the grain, identify the dimensions, and identify facts. Inmon top down/Kimball bottom up. However, I feel like this is too theoretical for actual practice and I wanna know what actually happens once I'm in a proper work setup. \-- Do you sprint plan with a PM first?\-- Do you have to wait from the BRD from a BA before you start planning?\-- What does your plan usually contain? If we're not creating and only modifying a pipeline, does the flow/steps in planning change? 2. In what parts of your workflow do you use AI? In contrast, what parts of your workflow will you NEVER use AI no matter what? A DE has told me that he uses it to write tests and scripts. \---------------------3. What's the common mistake that you notice junior DEs do? And/or rather what's the biggest mistake you've seen a junior do/you had to deal with?4. What are the common issues that you experience nyo on a daily/weekly/frequent basis?5. What was the hardest challenge you had to deal with po and what did you do?\---------------------6. I have never worked with a ""real"" pipeline before. When the time comes to work, how can I ""settle in"" sa existing codebase bukod sa ""just read the docs""?I'm being endorsed for a Jr. DE role after my DE internship. However, I feel anxious and scraed because I do not hardcode Python/Java. I SQL is doable. But most of the time, what I did was plan the architecture, set up the environment, etc. basically plan on my own but when the building part actually comes, I use AI to code. Don't get me wrong, I don't prompt the AI to ""build a pipeline based on this plan and make no mistakes."" But rather, when I plan, I plan part by part, then I ""build"" those parts one by one by component, and turn off auto-approve in Claude Code so that I can read, understand, and check the edits one by one. TL;DR— 7. Do I have to be a coding god for a DE role? A blank IDE makes me freeze. I recently took a coding exam for the first time ever in my life and I definitely bombed it...\---------------------Ultimately, I'm not so confident in being a DE and have honestly been applying to BA/DA roles thus far. However, given the current job market for juniors/fresh grads, I'll take any opportunity I can and that includes not declining the endorsement. I just want to at least be well-prepared so that I don't waste the time of the managers who will talk to me me even if I'm sure as hell I'll flunk any coding assessment.Thank you so much! :folded_hands:",30,0.88,15,https://www.reddit.com/r/dataengineering/comments/1syyy7e/notsoconfident_junior_applicant_preparing_for/,2026-04-29 13:32:51,2026-05-02 02:48:11
1sxixzs,Building our first data platform,Brilliant_Ad_4520,dataengineering,"We’re fairly new to data engineering and trying to find a simple but production-grade stack.The main requirement is loading data from REST APIs, modeling it for reporting/analytics, and also activating some of that data back into other systems.From our research, a minimal setup could be dlt, Postgres, dbt, and Airflow, plus some lightweight reverse ETL / data activation layer.The idea would be: dlt for API extraction/loading, Postgres as a small warehouse, dbt for transformations, Airflow for scheduling, and then sync selected outputs back to tools/APIs.Does this sound like a reasonable starting point, or is there a simpler/better stack we should look at?",28,0.94,29,https://www.reddit.com/r/dataengineering/comments/1sxixzs/building_our_first_data_platform/,2026-04-27 22:29:47,2026-05-02 02:48:11
