id,title,author,subreddit,content,score,upvote_ratio,num_comments,url,created_utc,extracted_at
1qoz6ag,Help with problem solving,Obvious-Self-6463,learnprogramming,"Hey everyone, I'm new to programming and I'm struggling with problem-solving. I wanted to know the best way to approach it. How do you usually solve problems? How much time should I spend on a problem before looking for the answer? And how do you turn an idea into code when you know what you want to do but aren't sure how to implement it?Any advice would be greatly appreciated.",12,0.88,11,https://www.reddit.com/r/learnprogramming/comments/1qoz6ag/help_with_problem_solving/,2026-01-28 02:48:11,2026-02-02 02:24:01
1qse8x1,do colleges or other institutions offer single courses for CS?,ChrispyGuy420,learnprogramming,"i have been programming on my own for a few years, just trying to learn as much as i can. the only structured learning i got was a 3 month bootcamp at the start of my journey, and since then its been tutorials and personal projects between working my day job. what i really want now, is some more structured learning(with an instructor) but any college course has a bunch of prerequisites i cant afford. is there some way to get structured learning, with an instructor, to further my learning?as far as what specifically i want to learn, i can use js and c#, along with basic usage of sql, mysql, and nodejs. right now im trying to connect a local fastify server to a local mongodb and im having trouble. networking and other things like that have held me at a standstill for most of my coding journey. theres also a lot of terminology, structure principals, and techniques i dont know which makes it harder to search for solutions.",8,0.84,12,https://www.reddit.com/r/learnprogramming/comments/1qse8x1/do_colleges_or_other_institutions_offer_single/,2026-01-31 21:05:16,2026-02-02 02:24:01
1qo7zci,What’s the simplest system you use to keep track of tasks or ideas?,pixelbrushio,learnprogramming,"I’ve gone from Notion, to physical note taking, to Jira, to Trello, BACK to Notion, spun up my own personal dashboard… now I’m back to mostly using pen & paper. I’m interested in what tools other programmers use to keep track of everything?",8,0.75,16,https://www.reddit.com/r/learnprogramming/comments/1qo7zci/whats_the_simplest_system_you_use_to_keep_track/,2026-01-27 08:13:42,2026-02-02 02:24:01
1qntoqb,Is there a TOP version of C/C++ programming?,AliveAge4892,learnprogramming,"I have enjoyed learning TOP fullstack and man it is such a relief. yea some might be a lil hard to comprehend but getting your brain squeezed out sure is a good way to mentally work out and have fun learning. I was thinking, is there also a C++ version of TOP? Maybe you guys can recommend me one? Just for context: I'm learning two languages per day, JS and C and yes i know its not advisable but I'm having fun with it so please dont flame me for it",10,0.73,16,https://www.reddit.com/r/learnprogramming/comments/1qntoqb/is_there_a_top_version_of_cc_programming/,2026-01-26 21:32:24,2026-02-02 02:24:01
1qtdu3d,If you have no job but wan´t to start making money programming how would you start?,ItamarFRANCO,learnprogramming,"I´m in my second semester in my IT degree but finding a job in the area has proven to be very difficult ,how can I start making money in the area without a formal job and with no experience?",8,1.0,6,https://www.reddit.com/r/learnprogramming/comments/1qtdu3d/if_you_have_no_job_but_want_to_start_making_money/,2026-02-01 23:03:55,2026-02-02 02:24:01
1qt1ajd,The best feeling when programming,Qwertyluk2,learnprogramming,"For the past several months, I've been solving LeetCode problems. My usual approach is to first try to solve the problem on my own and then - even if I succeed - watch a YouTube video with deeper explanation to gain better understanding of the problem. Recently, I worked on [LeetCode 778: Swim in Rising Water](https://leetcode.com/problems/swim-in-rising-water/). It was a bit different from the problems I had solved before - I hadn't worked on this kid of problems yet. Although I managed to solve it successfully using a min-heap strucutre and a graph traversal algorithm. But it was something new for me, I had never used them two together. If you're an advanced programmer, when you hear a min-heap and graph traversal, you probably know what it means - but I didn't. Only when I was watching an explanatation of the optimal solution on YouTube, I realized that I had actually implemented a Dijkstra's algorithm - an algorithm invented by one of the greatest figures in computer science history. So even though this algorithm was created many decades ago, I was very excited that my analytical and problem-solving thinking process naturally led me to the same solution as Dijkstra's solution many decades ago. I'm sure that wouldn't happen if I was solving LeetCode blindly, learning only patterns. I wish every programmer feel this kind of moment from time to time to stay motivated on the path of learning!",8,0.78,1,https://www.reddit.com/r/learnprogramming/comments/1qt1ajd/the_best_feeling_when_programming/,2026-02-01 15:24:32,2026-02-02 02:24:01
1qrqhuk,no idea where to start when opening a game engine,mushroombunny2,learnprogramming,"might be a dumb question, but when I follow tutorials it makes sense, and then I open the engine myself and my brain just goes blank like… what do people actually build first when they’re brand new?small systems? tiny games? just experiments? or dummy project?",7,0.74,12,https://www.reddit.com/r/learnprogramming/comments/1qrqhuk/no_idea_where_to_start_when_opening_a_game_engine/,2026-01-31 02:53:31,2026-02-02 02:24:01
1qrbolv,Need some project ideas that uses full stack,Potential-Pumpkin390,learnprogramming,"For our Web Technologies course this semester, we are asked to develop a real-world project that solves a personal problem in a practical way. I am currently exploring ideas and would love to hear suggestions. Any helpful resources, tools, or references would also be greatly appreciated.TIA! :grinning_face:",6,0.81,4,https://www.reddit.com/r/learnprogramming/comments/1qrbolv/need_some_project_ideas_that_uses_full_stack/,2026-01-30 17:20:25,2026-02-02 02:24:01
1qpfx22,"I can't decide what language, stack or domain to begin learning deeper. Need some help to get pointed in the right direction",Crapahedron,learnprogramming,"I've been a floater so far. I've dabbled with a handful of different languages (python, ruby, java, c, c#, js) mostly because I was curious about what this programming thing was all about. My curiosity is growing significantly. I started solving basic problems with some scripting languages (sorting files with python, made some VERY BASIC selenium web automation scripts with java etc) and I really enjoyed it. I want to take it one billion steps further, however I don't know what direction to take it. In some ways, because I dont know what I don't know - as in there are a lot of programming professional domains that probably exist that I don't even know of. There are lots of languages and learning resources I probably don't know of. (I only know of the few big recommended ones like freecodecamp, odin, cs50 etc)With only a few exceptions, I'm pretty open minded to where I want to take this. I want to learn about data structures, algorithms and general design patterns and all the things professional developers eventually grow into. However to WHAT I apply these to? I have no idea. Here's what I know: I have no interest in traditional web development - especially front-end work. I tried to force myself to like it but I can't. (which is kind of a shame, because even traditional desktop applications are essentially getting deprecated in favor of cloud based web apps.) The biggest thing I think I'm mostly looking for is a language or technology stack that a) Has AMPLE resources to help someone go from beginner to contributor in a fairly streamlined fashion, b) interesting open source projects I could eventually try to contribute to and build experience working through the workflow of contributing to a team based project and c) something that has some kind of remote employment culture attached to it. (I live in a very remote part of the world and all current and future employment relies on remote work unless I want to climb an oil rig or hunt polar bears.). <--- stretch super longterm goal / bonus pointsThings I am curious about:* c# / windows desktop application development (whether this is even a thing in 2026 and beyond I have no idea)* c and systems / OS level programming (under the hood nuts n' bolts is incredibly interesting. Would love to learn how an OS works, whether it's windows or linux.)* MUD's / text based multiplayer games. See /r/mud for what I mean. I think these are interesting learning vehicles to get involved in. They stress OOP, classes, networking and efficiency while also working on what is probably a very legacy codebase. (some of these mud's have been online for 30 years!)* the ruby language in general - yeah I know I mentioned webdev as things I don't like, but ruby as a standalone scripting language is a beautiful thing. I would have strong interest in delving way deeper into it. (What are the odds rails devs can get by without giving a crap about the front-end? lol)I'm an older dude, so building dedicated desktop applications initially sounded interesting. (so probably c# .net windows apps in visual studio). I dont know if there's any professional demand for this stuff long term however these days. I'm from the Winamp/ICQ/Napster era so that's where my brain immediately went :D. I was looking at the TIOBE index for inspiration, but I think all it does is create FOMO so I stopped. Got overwhelming. Anyways, while I sit in this meeting listening to people blather on about quarterly financials, I thought I'd post this to solicit some ideas or feedback for where I could consider aiming my thirsty brain at. Thanks so much!",10,0.79,8,https://www.reddit.com/r/learnprogramming/comments/1qpfx22/i_cant_decide_what_language_stack_or_domain_to/,2026-01-28 16:22:22,2026-02-02 02:24:01
1qshtmp,C++,Equivalent_Unit_9797,learnprogramming,"So I want to learn C++ so in future to be able to make some stuff ""game engine + game"" I know that this would take many years but I'm ready to learn, the problem is there that when I search for cpp tutorial, in those tutorials, they don't explain what ""cout, include, int, and the others words"" means and what they doSo can someone give me some easy to understand resources so I could learn",8,0.76,18,https://www.reddit.com/r/learnprogramming/comments/1qshtmp/c/,2026-01-31 23:28:36,2026-02-02 02:24:01
1qsfezm,This is so heartening,Its_Warm_Outside,learnprogramming,"Reading most of the posts here really warm my heart. So many people are so supportive of a person who has a struggle. It really puts this community in a great light in that so few are trying to simply tear someone down. This is what a good community does, help. I read this thread and it really lifted my day. Thanks to all of you who provided a positive message for giving me a lift for my day.",6,0.88,1,https://www.reddit.com/r/learnprogramming/comments/1qsfezm/this_is_so_heartening/,2026-01-31 21:50:51,2026-02-02 02:24:01
1qocimr,Computer Science time balance,TommyShelby0448,learnprogramming,Good afternoon. Trust we are doing great. I need advice or tip. As a computer science student who first focus is to become a Full Stack developer through The Odin Project.I'm currently in my second year in the university.Honestly I'm finding it difficult on focusing on my roadmap and what's being taught at lectures. for instance we are learning Java and other stuffs which are not a requirement in my roadmap. I can't fail too. Can anyone suggest a way to balance between my self studying and lectures. Thank you.,6,0.76,10,https://www.reddit.com/r/learnprogramming/comments/1qocimr/computer_science_time_balance/,2026-01-27 12:29:24,2026-02-02 02:24:01
1qsco31,I need help pleaase,CheesecakeMission426,learnprogramming,"""I'm already in my **second year of studying** Computer Science, and I feel like I haven't learned anything. My lack of discipline and motivation **causes me to learn** very slowly, and I feel stressed about being so far behind my classmates. Now, I don't know where to **start over** to do things right. I need to learn C++ and build a solid foundation. Where did you guys start learning, or what are your methods? Thanks!",5,0.63,17,https://www.reddit.com/r/learnprogramming/comments/1qsco31/i_need_help_pleaase/,2026-01-31 20:03:58,2026-02-02 02:24:01
1qs1s7t,How do I learn to make REAL websites,DaRealDani,learnprogramming,"A few days ago i started working on FreeCodeCamp, so far I'm still on the basics but it is looking great, then i heard about ""the Odin project"", should I switch to that, keep going in FreeCodeCamp or finnish FCC and then go into the Odin project",6,0.69,16,https://www.reddit.com/r/learnprogramming/comments/1qs1s7t/how_do_i_learn_to_make_real_websites/,2026-01-31 13:02:12,2026-02-02 02:24:01
1qrapsx,How important is Linux for programming careers in the future?,mandevillelove,learnprogramming,I am a final engineering student trying to upskill before graduating. I keep hearing that Linux is really important especially for developers. If I am starting now what parts of Linux should I focus on and how should I go about learning it?,4,0.6,18,https://www.reddit.com/r/learnprogramming/comments/1qrapsx/how_important_is_linux_for_programming_careers_in/,2026-01-30 16:46:46,2026-02-02 02:24:01
1qr0ke4,"Cant seem to solve this simple(for you prob, not for me i guess xd) task..., LeetCode",Commercial-Novel-611,learnprogramming,"class Solution {     public boolean isPalindrome(int x) {         String number = Integer.toString(x);         int length = (int) (Math.log10(x));                 if (number.contains(""-"") || number.charAt(0) == 0){             return false;         }         if (length==0 || x == 0){             return true;         }         for (int i=length; i>=0; i--){ // 6             for (int j=0; j<=length-1; j++){ //0                 if(number.charAt(i) == number.charAt(j)){                 return true;                 } else {                     return false;                 }             }                     }         return false;     }     /* for backwards loop (von last index bis index 0 in ein neues array kopieren und von links / rechts abgleichend ob     es sich um ein Palindrom handelt)     121     1     */ } i get 11506/11511 answers correct, but i cant seem to fix the problem off x = 1000021. If i get the the x = 1000021 to work, other instead stop working.Can someone give me a hint instead of a full blow on answer? Oh and please dont blame me for my code xd!",4,0.76,39,https://www.reddit.com/r/learnprogramming/comments/1qr0ke4/cant_seem_to_solve_this_simplefor_you_prob_not/,2026-01-30 09:11:20,2026-02-02 02:24:01
1qqzhjt,How hard would it be to learn to program limbs?,AntonDeMorgan,learnprogramming,"https://www.instagram.com/reel/DUGYEFAjnMG/?igsh=MWl6eXN5OGN1YTVwdw==[Source](https://www.instagram.com/cameronhughes?igsh=d3NpMjJhY3ljeW4w) : Cameron Hughes on Instagram I have no programming experience. My best work is print ""hello world"" or the crappy website I did in highschool.How hard would it be to learn to program something like this or at the very least one simple set of movement ? Where do I start after basics? I suppose python be best",5,0.78,5,https://www.reddit.com/r/learnprogramming/comments/1qqzhjt/how_hard_would_it_be_to_learn_to_program_limbs/,2026-01-30 08:04:44,2026-02-02 02:24:01
1qqwraw,Getting started with open source local LLMs,l0rd0fthe0ni0nrings,learnprogramming,"I'd like to start dabbling with ai projects utilizing local LLMs on my gaming PC (intel i7 12th gen, rtx5080) but I'm very privacy conscious (i.e. paranoid) and have no trust/confidence in popular tools like ollama (silicon valley vulture capital funded). Can anyone recommend well-documented, trusted open source projects for this purpose?",5,0.78,3,https://www.reddit.com/r/learnprogramming/comments/1qqwraw/getting_started_with_open_source_local_llms/,2026-01-30 05:29:43,2026-02-02 02:24:01
1qq424k,I built a ZK proof visualizer while learning - it might help you as well,InternationalGoal238,learnprogramming,"I was learning ZK proofs and found that visualizing things really helped me understand them. Noticed there aren't many interactive visualizations out there, so I built one.Here's the first version: zkvisualizer.comIt walks through the full pipeline step by step (Problem → Circuit → R1CS → Polynomials → Witness → Proof → Verification) with real Groth16 proofs generated in your browser using snarkjs.You can toggle between what the prover knows vs what the verifier sees, and there's a tamper detection demo where you can watch verification fail.Would be very happy to see if something like this is useful to any of you!",6,0.72,5,https://www.reddit.com/r/learnprogramming/comments/1qq424k/i_built_a_zk_proof_visualizer_while_learning_it/,2026-01-29 09:30:18,2026-02-02 02:24:01
1qpd47l,Best free structured course for recursion and advanced Java topics?,sumitxmishra,learnprogramming,"Hey folks,I’ve already been learning Java and now I want to move beyond the basics. Specifically, I’m looking for the **best free course or resource** that teaches **recursion** properly and then continues into the topics that usually come after recursion (like backtracking, divide & conquer, dynamic programming, DSA, etc.).My requirements:* No one-shot crash explanations* No revision-style playlists* Needs to be a structured, beginner to advanced progression I don’t mind whether it’s on YouTube, a university site, or a learning platform, as long as it’s free and designed for someone who wants to really understand recursion and then move into the next big topics in programming.So, my question is: **from whom or where can I find the best free recursion + advanced Java course that actually teaches step by step?**Would love to hear what worked for you, what didn’t, and which sources you’d recommend.",4,0.71,20,https://www.reddit.com/r/learnprogramming/comments/1qpd47l/best_free_structured_course_for_recursion_and/,2026-01-28 14:39:32,2026-02-02 02:24:01
1qp9b49,State of Spring / Spring Boot in 2026 and beyond,Impressive_Round_798,learnprogramming,"Hi! Im a student and I’d like to get some up-to-date opinions on the state of Spring / Spring Boot in 2026 and looking forward, especially regarding job market demand, long-term viability, and industry trends.I have professional experience with TypeScript, mainly in the modern frontend/backend ecosystem but i felt that the lack of strong structure, the huge dependency ecosystem, and how fast tools and frameworks change can make it easy to feel “lost”, even on medium-sized projects. Because of that, I’m looking to move toward something I think is more serious, structured, and predictable in the long run.I narrowed my options down to C# (.NET) and Java (Spring / Spring Boot). At first, I was leaning toward C#, partly because several indexes (for example, TIOBE) show C# growing while Java appears stable or slightly declining. I also had the impression that the .NET community is larger and more “welcoming”.However, when I looked at the actual job market, the number of openings requiring Java + Spring (at least in my region and for remote positions) seemed significantly higher so i started learning it.i Would like to know the point of view of people that works with Spring/Spring boot, things such as:How do you see Spring/Spring Boot in 2026 and over the next 5–10 years?Is it still a solid choice for backend systems?Do you see it losing relevance compared to .NET, Node.js, Go, in the long run?From a career perspective, is Java + Spring still a good way to progress?I’d really appreciate your insights, thanks!",5,0.67,7,https://www.reddit.com/r/learnprogramming/comments/1qp9b49/state_of_spring_spring_boot_in_2026_and_beyond/,2026-01-28 11:53:06,2026-02-02 02:24:01
1qnmfwj,[Looking for advice] I feel stuck and I want to cry,Brave_Egg_8572,learnprogramming,"Hi everyone, I’ve been working for a startup, and I can finally say I hate this job. The problem is they’ve had me jumping from language to language, working on useless features, and most important of all, wasting my time with meetings that could have been a short email sent to the right people (Why do I have to hear about this sales and marketing crap?). I feel like if I were to interview again, I would not get very far because I’m not proficient at anything anymore.I want to branch away from web dev if possible, but I’m not exactly “passionate” for anything anymore. I think I've become server-phobic. Medical problems drained my savings and I’m back to square one, and this time I really don’t know what I should focus on. I understand I sound like I need a therapist more than anything right now lol, but I don’t know what to learn or study as I stay in this job until I’ve saved up enough to interview again. Maybe I’m not even looking for advice, and I just want to hear stories from others. I just feel like I’m stuck in a job I hate, and I should use this time to learn something that could become handy in the future. Do personal projects even work for getting a job anymore? I’m so lost.",8,0.72,9,https://www.reddit.com/r/learnprogramming/comments/1qnmfwj/looking_for_advice_i_feel_stuck_and_i_want_to_cry/,2026-01-26 17:24:06,2026-02-02 02:24:01
1qsbmok,How to learn to build solutions/products to becoming a SWE,Drairo_Kazigumu,learnprogramming,"Build, build, build.I think it's obvious that the best way to learn to program (and the most time-efficient) is by playing the long game of learning to program. Meaning understanding fundamentals and ensuring you're understanding every step you're taking, like when probing Claude with 50+ questions about how tf a pointer works and why it works.But it's kind of confusing to make sense of the idea of how you're supposed to get to the point of being able to score an internship by maybe your second or third year. Especially nowadays, when they ask for more experience in stuff like Docker, AWS, etc., etc.**I guess the question is:** Is it possible to get into SWE when you're just starting to learn to code in your first year of college? Especially when becoming a good developer takes time?",5,0.7,2,https://www.reddit.com/r/learnprogramming/comments/1qsbmok/how_to_learn_to_build_solutionsproducts_to/,2026-01-31 19:24:45,2026-02-02 02:24:01
1qr4rlg,What is wrong with cplusplus.com what inaccuracies does it have ?,None,learnprogramming,i see the only issue with it is that it is not updated to the latest c++ standards like c++17 and 20 and so on and i am not really interested in c++20 or 17 or whatever c++11 really fits so what is ur opinion on using cplusplus.com for c++11 only ?,5,0.59,11,https://www.reddit.com/r/learnprogramming/comments/1qr4rlg/what_is_wrong_with_cpluspluscom_what_inaccuracies/,2026-01-30 12:58:45,2026-02-02 02:24:01
1qr4eav,Fresher here — need guidance for my first internship,Imaginary_Anteater_4,learnprogramming,"I recently joined an AI SaaS startup as a backend intern, but I’m currently the only backend developer on the team.The entire backend was AI-generated before I joined. There is no documentation, minimal logging, and I don’t fully understand what many APIs do or how the database is structured.My responsibilities are to:Understand and organize the existing backend codeClean up and organize the databaseAdd proper documentationGradually fix and refactor where needed.I don't know where should I start. I need an experienced engineer to give me a high level over-view on how to fix this kind of messed up backend and database.",4,0.67,8,https://www.reddit.com/r/learnprogramming/comments/1qr4eav/fresher_here_need_guidance_for_my_first_internship/,2026-01-30 12:41:49,2026-02-02 02:24:01
1qqoz3b,C# programming language,Flames_xm,learnprogramming,So I’m building a website or I’m hoping to build a website I do know HTMLCSS so what would be the plan to build a fully functional website and can I integrate c# to it?What are the steps to build that website full stack as I am a new programmer and I would like to do that and what other programming languages do I need?,7,0.77,5,https://www.reddit.com/r/learnprogramming/comments/1qqoz3b/c_programming_language/,2026-01-29 23:38:29,2026-02-02 02:24:01
1qq8nib,How can I improve bayond the basics?,NeonArchon,learnprogramming,"I've been learning how to code for awhile, but I feel I'm stuck. So far I've only grasped the basics (pretty much pseudo coding in Pseint), but I still find diffivult to do more complex stuff, and as I'm looking for a job, I feel my klnowledge is leaking out of my head. What can I do to learn and keep improving my prgramming skills?I've mainly learned Jaca, HTML, Python and some C#, and I want to improve on these languagesm mainly the last 2.",7,0.74,11,https://www.reddit.com/r/learnprogramming/comments/1qq8nib/how_can_i_improve_bayond_the_basics/,2026-01-29 13:32:59,2026-02-02 02:24:01
