id,title,author,subreddit,content,score,upvote_ratio,num_comments,url,created_utc,extracted_at
1u6hr6q,Tired of wasting my time,PolloMecha,cscareerquestions,"Hi people, It has been a while since I lost my job as a PHP dev. Until now I only got interviews that were borderline crazy, calls from HR wasting my time just to get my CV and then disappear or rejections without even looking at my CV or talking with me, everything based on age and my salary expectations.I sincerely don't know what to do, I started because I loved to create new things, I spent countless week-ends improving myself, for nothing at this point.Until now I did send hundreds of CV also to junior roles, even if I work in this field since 2013, and nothing.There's always something wrong, I got the following said to me:\- You're too old, we prefer under 30 due to tax benefits ***(I am 36)*** \- Yeah, ok you did the code challenge, but not as we do it ***(Because I am supposed to know how they do it)*** \- The company decided to hire a candidate that was recommended by an internal person ***(This at the last stage, after wasting 3 times my time with them)***The world has gone insane, before it would take maximum 1 week to find a new role. Now, first of all if you do PHP you are stupid it seems. If you try reskilling, as I was doing with Python, then ""You do not have field experience"", are we for real?I also applied directly to companies, but it's like throwing your CV in a black hole nowadays.",72,0.89,82,https://www.reddit.com/r/cscareerquestions/comments/1u6hr6q/tired_of_wasting_my_time/,2026-06-15 14:11:26,2026-06-18 04:05:30
1u7d6ym,Just got laid off and incredibly anxious of whats to come,marbles12,cscareerquestions,"I got the news 5 days ago, and took the rest of the week to reflect and process, but Monday was rough to adjust to a new routine.I’m not too worried about savings, and my wife also works, but the uncertainty of the timeline kind of terrifies me. I’ve also never been great at technical interviews so to have to go through that is nerve wracking. I have 4 YOE and hope that’s enough to get some callbacks but who the hell knows in this market…I’m not sure why i’m posting this but i would love some advice and some positive stories from people who experienced this, cause this sub is often considered doon posting galore.",71,0.99,32,https://www.reddit.com/r/cscareerquestions/comments/1u7d6ym/just_got_laid_off_and_incredibly_anxious_of_whats/,2026-06-16 13:13:13,2026-06-18 04:05:30
1u3yfst,Is it only entry level positions that are cooked?,boiyo12,cscareerquestions,"Is the software market cooked just for entry or all levels? Everytime I hear people talking about how destroyed the market is rn, it's always about getting entry level jobs. But it seems that the people I know who got over that first hurdle are still living the ""old"" developer lifestyles; huge salaries, WFH, can job hop easily etc.&#x200B;So is it REALLY just getting that first job that's the issue and afterwards it's not that bad, or are my friends lucky and even senior positions and stuff are cooked?",66,0.8,101,https://www.reddit.com/r/cscareerquestions/comments/1u3yfst/is_it_only_entry_level_positions_that_are_cooked/,2026-06-12 15:26:08,2026-06-18 04:05:30
1u3e8dj,New grad: Take $100k for 50hr/week job or wait for better offer? Worth risking my mental health?,RudeInvestment1,cscareerquestions,"I've received an offer for $100k/year from a medtech firm where I'm expected to be in office 8 AM to 6 PM every day. Plus a $30k bonus after I've stayed for two years.I'm extremely conflicted on whether to take this.Bull case: * I'm a new grad with time to focus on my career and no family obligations.* I'm lucky to have any offer in this job market, especially a 6-figure one. No guarantee I'll receive any other offers any time soon.* This firm a very high average tenure and room for internal advancementBear case: * The salary equates to $38/hour or $80k at a regular job. That's basically what I get at my part-time internship, which has much more flexible hours and PTO.* I don't know how I'll handle the relocation and 10 hours/day in office. I'm excited and might end up loving it, but also worried I'll burn out.* Burning out = quit early and lose the $30k bonus, or stay and potentially sacrifice my mental health",68,0.7,119,https://www.reddit.com/r/cscareerquestions/comments/1u3e8dj/new_grad_take_100k_for_50hrweek_job_or_wait_for/,2026-06-11 22:57:53,2026-06-18 04:05:30
1u5l2el,"Math/Physics PhD holder and can't find a job for the life of me, what tech/CS career am I suited for?",TheZStabiliser,cscareerquestions,"I feel like physicists are useless outside of academia: like we're a jack of all trades. We can program, but CS students do it better. We can do data analysis, but people who studied data analytics do it better. We can do finance but finance students are better. Et cetera.My skills:\- Python, C++\- Quantum computing\- Can translate abstract mathematics to practicalities (strong analytical skills)\- My field was adjacent to cryptography so could easily learn that\- Adobe Illustrator/PowerPointWhat I tried, among many others:\- Every major quant finance company in the country\- Consultancy firms\- Grant specialist at a university\- Quantum computing companies\- Some energy companies\- CERN and ESA\- Data analysis team of my local hospitalLooking for:\- Highly quantitative field\- Healthy work-life balance but make more than 50k€/year (anything less is not livable in the Netherlands)\- Social environment to work in, not tucked away in a small office of 2 people for 40 hoursI am at my wits' end. Been at home for a year and my money is running out. Even quantum computing companies won't hire me on the EXACT topic I wrote my thesis on because they think having no industry experience is a dealbreaker.",63,0.83,113,https://www.reddit.com/r/cscareerquestions/comments/1u5l2el/mathphysics_phd_holder_and_cant_find_a_job_for/,2026-06-14 13:22:59,2026-06-18 04:05:30
1u8mvnw,"Laid off for almost a year, is there any hope?",seagal_impersonator,cscareerquestions,"I was a senior software engineer and got laid off last july. I haven't had any offers in all that time. I keep wishing software companies would come to their senses on AI but that's not happening.I'm trying to figure out something to pivot to that won't be replaced by AI. It all seems so hopeless - either the pay is shit, or I need a degree. And I dropped out of college, so don't have _any_ degree to use as a stepping stone.",58,0.74,142,https://www.reddit.com/r/cscareerquestions/comments/1u8mvnw/laid_off_for_almost_a_year_is_there_any_hope/,2026-06-17 21:15:25,2026-06-18 04:05:30
1u5ywam,How do you claw your way back into software after a layoff and a long gap when you feel this far behind?,Moneymoneymoney1122,cscareerquestions,"I don't totally know how to put this, but I'm pretty lost right now and could use any perspective.The short version of how I got here: I've got a CS degree (2023) and worked about 2 years as a software/data engineer — Python, AWS, SQL, building data pipelines at a big financial company. Got laid off at the start of last year, and that's kind of where everything started unraveling. I tried for a while to get back into software and it just wasn't happening. I'd get interviews here and there but never an offer, and I'm pretty sure the non-tech jobs I had to take to pay the bills make me look like I gave up on engineering, even though I didn't.At some point I got desperate and figured maybe I'd switch careers entirely, so I started a CNA program to get into healthcare. It seemed stable and like I'd be helping people. I pushed through a lot of it, did the clinicals, the hands-on patient care, all of it. But I couldn't stomach the bedside stuff. I was working two jobs at the same time and dreading every single clinical, and I finally admitted to myself that patient care isn't for me and quit the program when I was almost done. I feel guilty about it, but also kind of relieved, if that makes sense.So now I'm here. I know what I want. I want to get back into tech, as a software or data engineer, and I'm really drawn to the AI/agentic stuff that's blowing up right now. But I feel completely stuck on how to actually get there. I've got a gap on my resume, I'm behind on all the new tools and buzzwords, money is tight, and I'm exhausted. I keep going in circles like should I do a master's, build projects, just keep applying, grind to learn the new AI stack? I can't even tell what's a smart move versus what's just me spinning.Lately I've even started wondering if I should just take whatever IT job I can get maybe something like help desk level 1, even if it's a step down from engineering, just to have something stable that pays enough to live a decent life. I'm so tired of barely getting by that part of me doesn't even care about the ""career"" part anymore. I just want to be okay financially.So I'm looking for any honest advice from people who've been through something like this. How do you dig yourself out of a resume gap and get back into the field when you feel this far behind? Is it a mistake to take a step back into something like help desk just to stabilize, or should I hold out for getting back to engineering? Has anyone restarted from a spot like this and made it work? Appreciate anyone taking the time.",56,0.93,20,https://www.reddit.com/r/cscareerquestions/comments/1u5ywam/how_do_you_claw_your_way_back_into_software_after/,2026-06-14 22:35:12,2026-06-18 04:05:30
1u3ntir,For seniors: how do you avoid de-skilling in the age of AI?,stjimmy96,cscareerquestions,"Agentic AI has gotten pretty good nowadays, not to the point it can implement entire systems end-to-end on its own as it still constantly makes mistakes and takes shortcuts, but to the point it can work on a ticket and come up with a PR I can review (and correct most of the time).The problem is: it's true, I don't write as much code as I used to. So I've been thinking, how do I avoid forgetting how to code, how to properly implement an algorithm and how to stay a sharp engineer? How do you avoid atrophy of your skills? I reflected on what I have been my usual sources of learning in my life\\career:1. **Coding outside of work\\personal projects**. Possible, but time is limited and I generally work on projects with entirely different technologies and approaches. At work, I am a fullstack web developer, at home I generally code games in Unity. Some crossovers but the paradigms, patterns and skillset is different.2. **Learning on the job**, which feels impossible now that the expected throughput is over the roof. I could write the code myself, but it would take much longer and it would be noticed, in the long term.The thing is, we don't know how the future of our career is going to look like. Maybe coding is dead and we will all become AI managers, or maybe there will be a backlash and coding skills will become central again. Regardless, I've found that in many Senior-level SWE interviews I've been doing recently I've been asked to code, reason about code, implement code and so on... So coding is still definitely an element of our careers. What's your approach on this?",53,0.78,109,https://www.reddit.com/r/cscareerquestions/comments/1u3ntir/for_seniors_how_do_you_avoid_deskilling_in_the/,2026-06-12 06:52:55,2026-06-18 04:05:30
1u8se01,Going into the trades doesn't seem like a viable pivot for those out of work,throwaway10015982,cscareerquestions,I applied to the Stationary Engineers union and honestly I was somewhat right in the sense that getting a trade job is almost as hard as getting a FAANG job lol. The amount of work you would have to do to get into any unionized trade makes it to the point where if you're a new grad it honestly seems to make more sense to try to thug it out and apply to every single open job in the country and hope for the best rather than spend another 4-5-6-7-8 years before you get to make any real money OR you finally land an SWE role and make $100k+ right out of the gate like it doesn't really make sense and getting the experience of trying to test into a skilled labor union made me have a somewhat more positive outlook on this field. It is literally less work to just run through the Odin Project and vibecode some slop projects and spam apply until you get luckyand to be honest I took four semesters of calculus and have coke bottle glasses and have never had a girlfriend my ass is 100% getting kicked out a job site first day,50,0.92,29,https://www.reddit.com/r/cscareerquestions/comments/1u8se01/going_into_the_trades_doesnt_seem_like_a_viable/,2026-06-18 01:09:50,2026-06-18 04:05:30
1u6xmg4,Is it too late for me?,BouncyOreo,cscareerquestions,"I graduated a year ago with a B.S in comp sci. I was pretty desperate for *any* job so I took the first one I could find, an I.T jr sys admin/desktop support type role. I hate it. I enjoy coding. I don’t enjoy troubleshooting someone else’s code via GUIs and replacing monitors. It’s just not for me. Is it too late to transition back? I still kept up with coding, and have one internship under my belt. I feel like I trapped myself into an I.T career.",50,0.83,40,https://www.reddit.com/r/cscareerquestions/comments/1u6xmg4/is_it_too_late_for_me/,2026-06-15 23:56:10,2026-06-18 04:05:30
1u3l28m,Do people still fight over their favorite languages ?,VariationLivid3193,cscareerquestions,Back in uni everyone was arguing on what was the best programming language.,48,0.82,93,https://www.reddit.com/r/cscareerquestions/comments/1u3l28m/do_people_still_fight_over_their_favorite/,2026-06-12 04:22:20,2026-06-18 04:05:30
1u62pjj,How should I feel right now about Claude code?,prettyg00d1729,cscareerquestions,"I just got a side project nearly finished (gonna make tweaks) with Claude code and it has me feeling weird. On one hand I’m happy I got it done but on the other it felt like the entire craftsmanship of the project got taken out. So like, how do I feel? Should I just make another one that I did or should I be happy that the world is changing like this? It used to take so much longer but my god this thing went crazy. It’s also my first time using the pro stuff, I’ve been hesitant to adopt it.",49,0.75,88,https://www.reddit.com/r/cscareerquestions/comments/1u62pjj/how_should_i_feel_right_now_about_claude_code/,2026-06-15 01:30:45,2026-06-18 04:05:30
1u3pmos,How were selections like in the 90s?,VariationLivid3193,cscareerquestions,How were the interviews?,48,0.84,33,https://www.reddit.com/r/cscareerquestions/comments/1u3pmos/how_were_selections_like_in_the_90s/,2026-06-12 08:40:14,2026-06-18 04:05:30
1u59fhb,"For those hiring juniors: is heavy agentic/AI workflow experience a signal you want to see, or a red flag?",vsicle,cscareerquestions,"I'm lost and confused. Honestly, that might be an understatement.I graduated in spring of 2026, and for a couple of reasons I didn't get an internship during school, the closest thing I have to experience is an L3Harris sponsored capstone project. I went to the U of U and graduated with a 3.8. Along the way I took a security class that got me fired up about SQL injection, XSS, MITM attacks, cryptography, etc. I took a fuzzing class that feels super valuable for the real world, but nobody seems to care. And I took a one-off class, taught by the best professors in the department (imo), where we got unlimited credits for the frontier AI models and learned the limitations, strengths, and workflow of using agents and AI to their fullest potential. It was my favorite class in all of my schooling, because the instructors made us run into all the problems associated with vibe coding naturally, then taught us how to avoid them. I could talk about this all day, but again, nobody seems to care.I'm posting to see if anyone in the industry can give me advice or some idea of what the industry actually wants so I can learn/acquire it. I love programming and making things, and AI has sort of put everything in a blender.I don't know if I should flex my agentic development experience, which I'd say is quite strong. I keep seeing ""pro tips"" or people raving about new techniques they discovered, and it's always something I was either taught or discovered on my own in that class. But if I flex the agentic piece, I feel like I come off as a vibe coder. If I don't, I feel like I'm underselling myself.I'm also getting rusty at hand-writing code, which feels like both an issue and not at the same time. This isn't to say I've been vibe coding. I've actually been engineering: setting up proper architectures, proper testing, CI/CD pipelines, AND knowing what my code does, why it does it, and why everything is where it is.On the job-hunt side, I've been using AI heavily to tailor my applications. I keep a master JSON file of all my skills, experience, and jobs, and have the model pull in the most relevant pieces when tailoring each one.I just don't know what I should be doing right now to get a job, or even an interview. And if I don't know the steps or process to passing the final exam of getting a job, I have no idea how I can make progress toward it.",43,0.84,55,https://www.reddit.com/r/cscareerquestions/comments/1u59fhb/for_those_hiring_juniors_is_heavy_agenticai/,2026-06-14 02:49:54,2026-06-18 04:05:30
1u4g6lq,"After being laid off, how to prevent skills from being rusty and how are you job prepping?",badboyzpwns,cscareerquestions,"Got laid off, I got 16 hours a day. Do I build a random project to prevent my skills from rusting? I currently break my time in :1. Behavior (only refresh before interview)2. Sys design (I think once you learn it, it sticks with you. Just need a refresher and not practice.)3. Leetcode, practice 1 hr everyday4. When I have an upcoming BE interview, I try to build API from scratch (controller, middleware, etc)5. When I have an upcoming FE interview, i build small FE features6. Enjoy my hobbies, live life, travel.How else do you fill your time so you nail interviews?",41,0.86,21,https://www.reddit.com/r/cscareerquestions/comments/1u4g6lq/after_being_laid_off_how_to_prevent_skills_from/,2026-06-13 03:34:27,2026-06-18 04:05:30
1u5bsuq,Second guessing studying CS,BallisticMonke,cscareerquestions,"Hi everyone, I'm about to graduate year 12 and I've wanted to study CS for the longest time, since around 5 years ago, I decided that's what I wanna do. I like math and I also like programming, I've got a couple projects and I take CS as a subject and right now I'm doing pretty good in it.But with the usual talk of how terrible the market is along with almost everyone saying that finding a job is basically impossible, and how AI is basically going to replace any junior level jobs left, I'm seriously reconsidering. I could do law or commerce as an alternative, but with all the conflicting information out there I'm lost. I'd probably go to unsw or usyd, and try to find work in Sydney.Does anyone have any experience as a new grad in Sydney or adjacent, and is it really as bad as they say? What are your opinions on the viability of a CS degree right now? Any advice would be great, thanks",34,0.9,37,https://www.reddit.com/r/cscareerquestions/comments/1u5bsuq/second_guessing_studying_cs/,2026-06-14 04:49:55,2026-06-18 04:05:30
1u4enk4,"New grad got stuck in a low code / SDET adjacent role, how do I let my manager know in our 1:1 that this was not what I wanted?",MarkZuccsForeskin,cscareerquestions,"got a return offer from an internship at a famous game company and I'm already learning some alarming things about my new role. For context, my previous manager got promoted(?) or moved to a different team and my previous team was soft reorged.This new team I'm being placed on doesn't actually do any coding or building. They don't own any features in the game. They just write c# scripts for bots to play the game / go through menus and fish for bugs / crashes.I've already spoken with some of my old coworkers and they've confirmed that the team I was placed on is basically more of a support team and that there isn't any coding or building, but that ""after i get some more experience"" i can probably jump to a more exciting team.Personally I think that that's kinda BS, especially since it's not guaranteed. I'd be stuck learning proprietary non-transferable skills for a year before having a chance at doing something real, especially amidst layoffs coming soon. It really sucks because everyone in my cohort got placed on an actual gameplay team whereas I got stuck on this one.My career is very important to me, and I don't really know what to do with this information. I really, **really** don't want to be stuck in a role that is historically first on the layoff chopping block. How should I approach this with my manager in my 1:1?",30,0.73,16,https://www.reddit.com/r/cscareerquestions/comments/1u4enk4/new_grad_got_stuck_in_a_low_code_sdet_adjacent/,2026-06-13 02:18:21,2026-06-18 04:05:30
1u8giw9,15-20 agent projects?,Then_Finding_797,cscareerquestions,"I had an interview for an Agentic AI startup. They’re looking for Swarm AI experience which I don’t have but I was interviewing for a paid internship role. I have an AI degree but mainly machine learning/advanced algorithms background. I will take a certificate on Agentic AI, vectoring, and router workflows etc. But the interviewer asked me if I have ever done a project where I ran an 15-20 AI agents running at once. Correct me if I’m wrong but a personal project on that scope would be expensive for me no? I have project ideas where I could need many AI agents but the question threw me off. I’m not sure how many new graduates would have this experience unless they had industry experience. Since the person interviewing me is not technical at all, Is this a normal question?",30,0.85,29,https://www.reddit.com/r/cscareerquestions/comments/1u8giw9/1520_agent_projects/,2026-06-17 17:22:42,2026-06-18 04:05:30
1u7x82c,I know for sure I'm going to bomb this technical. Haven't had a technical in 4 yrs. Help me go through with it still,lucid_anon,cscareerquestions,"I've been applying since January as I wanted to go back to software development. I stepped away from being a dev and I currently have a stable Desk Support job that pays the bills but with this job and childcare, I haven't been able to practice and ""grind"" leetcode.To my surprise I got an interview and then they scheduled me to a technical with 4 panelists. I am allowed to use AI but not use just copy and paste the problem. I've talked myself out of this many many times but my husband has told me to atleast try. As I've said in the title, I'm 100% positive I'll fail this technical. lol. But I have this paralizing fear that they would laugh at me because I won't write a single line of code. I would still like to try though.Any recommendations how to just go through with it. As devs, have u ever blanked out of a technical?",30,0.87,11,https://www.reddit.com/r/cscareerquestions/comments/1u7x82c/i_know_for_sure_im_going_to_bomb_this_technical/,2026-06-17 02:07:11,2026-06-18 04:05:30
1u5zdww,Is this career path more about luck than anything else now if we want to do well financially?,BakeFar4317,cscareerquestions,"Feeling like I can work very very hard & still would need a lot of luck in this field, to get a high paying SWE role & also to not get laid off. I get the sense it wasn’t like this until the last few years, but I admit I feel frustrated as a new grad because I feel like I could work my ass off but just not have the right opportunity. So I feel like my destiny is less and less in my hands, which frustrates me.Versus if I put in a high workload even a few years back, I could much more easily reap the dividends & land a high paying role. Kinda feel like the odds are stacked against new grads at this point, but maybe I’m overthinking it.",27,0.74,52,https://www.reddit.com/r/cscareerquestions/comments/1u5zdww/is_this_career_path_more_about_luck_than_anything/,2026-06-14 22:56:38,2026-06-18 04:05:30
