id,title,author,subreddit,content,score,upvote_ratio,num_comments,url,created_utc,extracted_at
1u3e8dj,New grad: Take $100k for 50hr/week job or wait for better offer? Worth risking my mental health?,RudeInvestment1,cscareerquestions,"I've received an offer for $100k/year from a medtech firm where I'm expected to be in office 8 AM to 6 PM every day. Plus a $30k bonus after I've stayed for two years.I'm extremely conflicted on whether to take this.Bull case: * I'm a new grad with time to focus on my career and no family obligations.* I'm lucky to have any offer in this job market, especially a 6-figure one. No guarantee I'll receive any other offers any time soon.* This firm a very high average tenure and room for internal advancementBear case: * The salary equates to $38/hour or $80k at a regular job. That's basically what I get at my part-time internship, which has much more flexible hours and PTO.* I don't know how I'll handle the relocation and 10 hours/day in office. I'm excited and might end up loving it, but also worried I'll burn out.* Burning out = quit early and lose the $30k bonus, or stay and potentially sacrifice my mental health",64,0.7,110,https://www.reddit.com/r/cscareerquestions/comments/1u3e8dj/new_grad_take_100k_for_50hrweek_job_or_wait_for/,2026-06-11 22:57:53,2026-06-13 03:53:44
1tz4m2c,Bad time to get into cs field?,Pro_Chatter,cscareerquestions,"I should preface by saying that I know the market sucks right now because it’s very over-saturated,but I feel like I have a slightly different circumstance.Most people I see talking about this career field are already looking for jobs, but I’m currently a sophomore in high school, so I’m not sure if it’ll be any better in like 6 or so years when I would graduate. Is it projected to get better or is it just going to get worse? Also, I’ve seen varying opinions on ai and whether it poses a threat to the field but I can’t seem to find a clear answer.I don’t mean to sound like a pick me high schooler, I’m just interested in programming so I want to know if it’s worth the investment before starting. Thanks guys",59,0.8,82,https://www.reddit.com/r/cscareerquestions/comments/1tz4m2c/bad_time_to_get_into_cs_field/,2026-06-07 06:37:27,2026-06-13 03:53:44
1u47v21,Huge uptick in recruiters reaching out this week,jholliday55,cscareerquestions,"Not trying to credit farm or looking to get smoke blown up my ass, but I noticed the largest uptick in recruiters reaching out to me the last week than ever before. I have 7 yoe and work in the nyc area. I have linkedin but don’t even open the app. I haven’t even responded to a recruiter in months. I see the notifications from my email. The past week I’ve gotten more than ever. Is it related to companies finding out how expensive AI is? My company did a round in March prior to GitHub announcing the skyrocketing price. They have since taken away opus and gpt 5.5 due to costs. I’m sure all the bots deployed by the AI companies and doomers on the sub will downvote me real quick just wondering if anyone else noticed similar behavior.",57,0.9,25,https://www.reddit.com/r/cscareerquestions/comments/1u47v21/huge_uptick_in_recruiters_reaching_out_this_week/,2026-06-12 21:14:49,2026-06-13 03:53:44
1u1mekv,how do you even study after work?,Careful-Peace2978,cscareerquestions,"i had been job hunting for an year before i got my job. it’s been 2 months since my new job has started. i loved AI and was constantly learning stuff about it until i got my job. i start at 8am and work until 6pm ( it’s remote but i log out when i finish atleast one issue/bug). maybe that’s burning me out? idk but ever since, i couldn’t get myself to work on personal projects, or even read an article. ppl with fte, how are you even studying after a day full of work? how do you sit down and grind dsa after 9-5?",56,0.94,31,https://www.reddit.com/r/cscareerquestions/comments/1u1mekv/how_do_you_even_study_after_work/,2026-06-10 00:09:28,2026-06-13 03:53:44
1tzljzl,There’s still Hope out there.,Okitraz1986,cscareerquestions,"I’ve been spending a lot of time on this subreddit lately, and I know the mood around tech hiring is pretty bleak right now. Layoffs, ghosting, hundreds of applications, stories about people with CS degrees struggling to land anything. It can make it feel like the industry is completely dead.I just wanted to share a different perspective. I’m an SDET with about 5 years of experience. I’m not a Staff Engineer, I don’t work at a FAANG company, and I don’t have some crazy AI startup on my resume. I write a lot of Python, build automation frameworks, work on backend testing, reliability tooling, synthetic monitoring, performance testing, and quality engineering. Over the last few months, I’ve had multiple recruiters reach out to me without applying first. That includes outreach from **two FAANG companies**, along with several other well-known tech companies.I’m not saying this to brag. I’m saying it because if you spend enough time on Reddit, you can start believing that nobody is hiring and that every tech career is doomed. That simply hasn’t been my experience. The market is definitely tougher than it was in 2021. Companies are more selective. Interviews are harder. Recruiters aren’t throwing money at everyone with a LinkedIn profile anymore. But good engineers are still getting interviews. What I’ve noticed is that companies seem to care more than ever about demonstrated impact. Not just “I used Python” or “I automated tests,” but:What problem did you solve? How much time or money did it save? Did reliability improve? Did performance improve? Did customers have a better experience? Can you clearly explain your work? The people I know who are getting traction aren’t necessarily the smartest people in the room. They’re the people who can point to tangible results. So if you’re early in your career, unemployed, or feeling discouraged, don’t let this subreddit convince you that there are zero opportunities left in tech. Keep building. Keep learning. Keep interviewing. Keep improving your resume. Keep practicing. The market isn’t easy right now, but it isn’t hopeless either. Just figured I’d post something positive since most of what gets upvoted here tends to be doom and gloom. Good luck out there. You’re probably closer than you think.",47,0.73,32,https://www.reddit.com/r/cscareerquestions/comments/1tzljzl/theres_still_hope_out_there/,2026-06-07 19:28:52,2026-06-13 03:53:44
1ty6v7d,Am I wrong about my read on AI and how to use it at my work?,ScarletViolin,cscareerquestions,"30YO, 8YoEMy workplace has obviously been drowning themselves in the AI Kool-Aid, but I haven't been too interested in partaking in the way everybody is clamoring about it.Not that I don't use AI, I use it quite frequently and it has been genuinely helpful to just bounce ideas or get critiques. But it seems to me that everybody is dogpiling onto making skills (without evals) and just delegating everything to AI with next to zero engineering thought.People leaders, product owners, especially non-technical folks all think that somehow Claude Code is magic but ... it's literally just a code harness that hits an inference endpoint?I guess my main issue is that when I look at what I want to use AI for, I jump straight to writing workflows/my own harnesses rather than deferring everything to Claude Code. I don't ask Claude Code to hit an API command for me, I just hit it myself with code and then I use code to spin up Claude sessions if I need it for reasoning. Is this just the wrong take on how to use AI?I'm feeling like I'm that unc who thinks new innovations are just old things with better branding. Subagent is just invoking another session of Claude, having it output to a file on disk, and then having another Claude session read it. Agent teams are just multiple sessions of Claude writing to an RPC stream or shared database. Claude Code is convenient if you want to leverage their biased way of implementing these patterns (restricting agents to 200k context window, etc), but if you wanted to make your own enterprise tooling I always figured that you'd just write your own harness to make it model agnostic.These are all pretty clear patterns that I think engineers far more competent than me already recognize and leverage (esp existing MLE engineers in my company who have probably been using LangChain for years), but I don't see any of that rising up in terms of visibility / adoption in my company.I'm struggling to figure out if I'm just woefully behind and I'm not seeing the uplift or if it's just great marketing is pulling the wool over peoples eyes. I just feel like I don't know what the ""right"" direction is to be a good engineer right now and wonder what other people are seeing in their spaces that would be helpful to progress my career.",44,0.87,21,https://www.reddit.com/r/cscareerquestions/comments/1ty6v7d/am_i_wrong_about_my_read_on_ai_and_how_to_use_it/,2026-06-06 04:05:54,2026-06-13 03:53:44
1u265jd,Do you guys think there will be a resurgence of QA?,kevin074,cscareerquestions,"given how AI driven companies are now, squeezing developers thin with velocity, and quality is constantly in question (and that developers don’t know what the shit they push), do you guys think QA, testers who are good at testing black box products and checking for regression, will see a resurgence in the market?? I think that’s definitely possible given that quality HAS to be an issue that need a better guardrail now that (AI driven) developers can’t provide that anymore.",42,0.77,53,https://www.reddit.com/r/cscareerquestions/comments/1u265jd/do_you_guys_think_there_will_be_a_resurgence_of_qa/,2026-06-10 15:53:41,2026-06-13 03:53:44
1u4494e,With rising cost of AI will its adoption keep increasing?,Glum_Worldliness4904,cscareerquestions,"AI is getting more and more expensive. Huge enterprises burning tokens like crazy. My ex-collegues from F500 companies have roughly $8-10k monthly limits. It costs well above entry-level position and roughly as a mid-engineer.At my company (us broker) I’ve got $15k monthly limit which is quite huge. Providing that \~80% of a senior sde job is not coding (stakeholder alignment, standardising and clarifying requirements, getting approvals from 2nd party teams like legal, kyc, sec, etc…) do you think entriprises will keep paying those huge paycheques to Anthropic?",39,0.84,107,https://www.reddit.com/r/cscareerquestions/comments/1u4494e/with_rising_cost_of_ai_will_its_adoption_keep/,2026-06-12 18:55:48,2026-06-13 03:53:44
1u3l28m,Do people still fight over their favorite languages ?,VariationLivid3193,cscareerquestions,Back in uni everyone was arguing on what was the best programming language.,43,0.82,87,https://www.reddit.com/r/cscareerquestions/comments/1u3l28m/do_people_still_fight_over_their_favorite/,2026-06-12 04:22:20,2026-06-13 03:53:44
1u3ntir,For seniors: how do you avoid de-skilling in the age of AI?,stjimmy96,cscareerquestions,"Agentic AI has gotten pretty good nowadays, not to the point it can implement entire systems end-to-end on its own as it still constantly makes mistakes and takes shortcuts, but to the point it can work on a ticket and come up with a PR I can review (and correct most of the time).The problem is: it's true, I don't write as much code as I used to. So I've been thinking, how do I avoid forgetting how to code, how to properly implement an algorithm and how to stay a sharp engineer? How do you avoid atrophy of your skills? I reflected on what I have been my usual sources of learning in my life\\career:1. **Coding outside of work\\personal projects**. Possible, but time is limited and I generally work on projects with entirely different technologies and approaches. At work, I am a fullstack web developer, at home I generally code games in Unity. Some crossovers but the paradigms, patterns and skillset is different.2. **Learning on the job**, which feels impossible now that the expected throughput is over the roof. I could write the code myself, but it would take much longer and it would be noticed, in the long term.The thing is, we don't know how the future of our career is going to look like. Maybe coding is dead and we will all become AI managers, or maybe there will be a backlash and coding skills will become central again. Regardless, I've found that in many Senior-level SWE interviews I've been doing recently I've been asked to code, reason about code, implement code and so on... So coding is still definitely an element of our careers. What's your approach on this?",40,0.76,84,https://www.reddit.com/r/cscareerquestions/comments/1u3ntir/for_seniors_how_do_you_avoid_deskilling_in_the/,2026-06-12 06:52:55,2026-06-13 03:53:44
1u3pmos,How were selections like in the 90s?,VariationLivid3193,cscareerquestions,How were the interviews?,37,0.84,27,https://www.reddit.com/r/cscareerquestions/comments/1u3pmos/how_were_selections_like_in_the_90s/,2026-06-12 08:40:14,2026-06-13 03:53:44
1u2nqnt,Coding/Debugging atrophy?,Sufficient-Year4640,cscareerquestions,"Work at faang. I feel like i've lost the ability to scan through a codebaseYes it's ""slow"", inefficient, but there was something about it that gave me conviction in the mental-models I built of systems.Now I use AI and slop out crap. I'm not confident in anything it says and generally have less conviction in my own PRs.Lost a lot of confidence in my abilities.Anyone in the same boat?",39,0.93,11,https://www.reddit.com/r/cscareerquestions/comments/1u2nqnt/codingdebugging_atrophy/,2026-06-11 03:31:01,2026-06-13 03:53:44
1u17p3y,I can't ship code that I don't understand and I'm not sure AI is making me faster for some tasks,fiveMop,cscareerquestions,"I'm just writing this to get it off my chest or maybe some form of a ""Is it only me?!"", anyway, there’s no denying that AI is highly useful; I’m definitely not dismissing it as just a bubble. It really boosts your output on greenfield projects, during prototyping, or when you just need to get something out the door for quick feedback without worrying about long-term maintenance.**However**, on brownfield projects involving complex business logic, the kind that touches multiple files and flows (like adding a new login method to migrate legacy user data), I'm starting to think it's better not to let AI write the whole thing. It's not that the AI does a poor job; it actually does quite well. But the generated code almost always needs some tweaks. To spot those necessary changes, you have to fully understand what's going on, which can be exhausting and tedious. Reviewing hundreds of lines of code across multiple files is incredibly tiring and grueling and I'm starting to think it is taking me more time than writing the thing myself!I’m still figuring this out, but my next step is to try implementing these complex tasks myself. I'll still have AI write the utility functions and tests, and use it to review my code for missing edge cases or ACs, but I’ll put in the overall structure myself. I think this approach might save some time (or maybe not) but it will definitely be far more engaging and rewarding.",36,0.94,19,https://www.reddit.com/r/cscareerquestions/comments/1u17p3y/i_cant_ship_code_that_i_dont_understand_and_im/,2026-06-09 15:08:01,2026-06-13 03:53:44
1tyx80g,How many meeting do you have daily?,kenzo-tx,cscareerquestions,What does your day to day look like? And what about extra responsibilities outside of your usual work?,34,0.88,23,https://www.reddit.com/r/cscareerquestions/comments/1tyx80g/how_many_meeting_do_you_have_daily/,2026-06-07 00:19:25,2026-06-13 03:53:44
1u3yfst,Is it only entry level positions that are cooked?,boiyo12,cscareerquestions,"Is the software market cooked just for entry or all levels? Everytime I hear people talking about how destroyed the market is rn, it's always about getting entry level jobs. But it seems that the people I know who got over that first hurdle are still living the ""old"" developer lifestyles; huge salaries, WFH, can job hop easily etc.&#x200B;So is it REALLY just getting that first job that's the issue and afterwards it's not that bad, or are my friends lucky and even senior positions and stuff are cooked?",36,0.75,81,https://www.reddit.com/r/cscareerquestions/comments/1u3yfst/is_it_only_entry_level_positions_that_are_cooked/,2026-06-12 15:26:08,2026-06-13 03:53:44
1tyss9v,Transitioning away from SWE after gap,Busetin,cscareerquestions,"I have 2 years of SWE experience but have been almost 2 years now without a role, I have done as much as I reasonably can to fill that gap with a family job to at least get through ATS but at this point I don't think it's likely I'll get another development role.I have two general questions, if anyone has been in a similar difficult position as a dev, what were you able to transition away to? I have tried most kinds of development roles now including QA . It is difficult finding else something in tech where I can leverage my experience but don't seem 'overqualified' and likely to leave for a dev role. Most low level IT like help desk seems like that, where I might get more traction hiding my dev experience and CS BS. I've tried looking into some more mid level IT like sys admin but I'd have to reframe my experience as basically the same type of role, and the overlap between SWE and sys admin roles doesn't seem like quite enough to jump directly in. What other roles have you found where a SWE can credibly transition in without seeming like a flight risk? Even besides tech, like other roles using the math foundation from my degree like accountant for example.My other question, how would you frame a gap and career change like this? I don't think ""The SWE market is so awful I had to branch out"" would be a winner. I think something along the lines of ""I'm skeptical about the future of SWE because of AI and feel more confident about IT/etc"" is closer since it doesn't seem as likely for me to go back to SWE.The way I see it, I have to signal genuine interest in the new direction and some reasoning on why I am not going to be a dev anymore besides desperation. Maybe signalling that SWE work was burning me out and I think IT/etc would be a better fit.With IT there is a tiny bit of overlap with SWE so I can say that got me interested in focusing on IT, like managing servers or infrastructure. For something that isn't really a tech role though, it isn't as clear how to show interest in say accounting besides being enthusiastic about math.I don't think getting into personal details for additional context would help much besides saying I had a 6 month vacation after my first dev role ended. Maybe saying I was taking care of family framed in a way where it isn't a concern about my own health going forward.I'm open to being more 'honest' but I don't think recruiters generally want to hear much about personal ups and downs like mental health, relationships, moving, etc.",32,0.89,3,https://www.reddit.com/r/cscareerquestions/comments/1tyss9v/transitioning_away_from_swe_after_gap/,2026-06-06 21:04:00,2026-06-13 03:53:44
1u2hg2c,"Any of you have a dev that is less skilled than you, call you a junior?",Lanky-Ad4698,cscareerquestions,"At the last place I worked, there was this ""experienced"" dev mentoring. Well because he built the whole system (solo homegrown dev). No technical management, so nobody knew about the code quality or even what that meant. So he took advantage. This dev built one of the worse codebases known to man.* No documentation (I had to reverse engineer everything)* Built an API and told me the responses are random. (had to teach myself a whole different language and reverse engineer it and built TS definitions to consume it)* No type safety* Used libs when the language supported that natively...Tests* Massive lack of process.* Low cohesion* Tight couplingAnyways...it takes me a while to fix some bugs and changes (Note this was when AI hype and ChatGPT was all the craze and new, not Claude Code quality at all). A big part of the codebase was definitely AI generated. So at this time its very bad.And there were times he got mad at me why it took so long for me to fix a bug or when me and others made mistakes. Kept calling me a junior. Like bro...majority of the time when stuff gets messed up in software its because there is no process or system. If I didn't make the mistake, the next dev would have... Had to spend a while to get testing to prevent regressions ugh. The unawareness to realize that he was the bad dev and didn't know how to build maintainable and extensible systems. Let me build a home with duct tape and wood, it works right?",33,0.72,30,https://www.reddit.com/r/cscareerquestions/comments/1u2hg2c/any_of_you_have_a_dev_that_is_less_skilled_than/,2026-06-10 22:45:18,2026-06-13 03:53:44
1u1p6sh,I’ve realized I am miserable working an office job? Career advice,sheuenej,cscareerquestions,"Hi, I’m so embarrased to even write this. I grinded my ass off this year and ended up landing an internship at a big tech company!! It’s literally my dream job at a crazy good company, and I get to help them develop their internal AI and also work on some hands on stuff with hardware. The issue is I hate it a lot :( and I feel so guilty because I know people would die to be in my position!!!I’m not used to staring at my screen for 8 hours a day. I get so bored even though what I’m working on is objectively interesting and I have a lot to do! I just get bored doing the same task for more than a couple of hours…. Idk. Maybe it’s that I’m working on something that isn’t for a personal project for once??? I guess I don’t mind when I get to work from home, it helps to get to sit in bed and work and not be right next to people all day? I’m not sure.Anyways I really am considering my choice of career in tech. I’ve always loved CS but I just love doing volunteer projects, research and hackathons with friends. An actual job like this is very draining. Are there any careers I should maybe look at if I’m not enjoying a cushy 9-5? Anything I should consider pivoting to? I wish I was an engineer that could opt to go and work “on the field” but as a CS major it’s not really realistic haha. I’m currently looking into academia, but I’ve heard so many horror stories, I have never really considered it before.At this point I’m considering a full career change :( I feel very lost in life. I was genuinely happier scooping ice cream 9 hours a day than working in an office. It’s just jarring because I’m on track to graduate next year :crying_face:",33,0.92,35,https://www.reddit.com/r/cscareerquestions/comments/1u1p6sh/ive_realized_i_am_miserable_working_an_office_job/,2026-06-10 02:17:02,2026-06-13 03:53:44
1u0caq3,"People that weren’t good programmers after uni, how did it turn out?",What_eiva,cscareerquestions,"It is something I have been trying to avoid admitting to myself. Deep down I wish I could find a job that doesn't require me to write a SINGLE code. Another part of me doesn't wanna give up. Where I live CS and engineering fields are usually longer and include master in them so I am doing my masters in CS and still not sure. I mean it is too late for me to drop out or change. I have been deluding myself for far too long thinking all the struggle and sleepless nights I put into it was normal and I shouldn't give up. I did a few personal projects last summer, even tho I liked it more thsn school I kinda was still not that excited or into it. All in all I have come to the conclusion and hard pill that I don't like and may never like programming. I can code and have solved many leetcodes last summer but I am not a good programmer. I genuinely feel like I fked myself up so much. In todays economy and world even people with solid programming skills and lots of experience struggle to find a job. What will become of me? Work retail after all those sleepless nights? Has anyone ever felt the same way? How did it go?",29,0.77,41,https://www.reddit.com/r/cscareerquestions/comments/1u0caq3/people_that_werent_good_programmers_after_uni_how/,2026-06-08 16:07:18,2026-06-13 03:53:44
