id,title,author,subreddit,content,score,upvote_ratio,num_comments,url,created_utc,extracted_at
1u3ea72,"What did you learned for c++ in university, and what subjects did you have/had for software development?",I-eat-gayz,learnprogramming,"Hi, sorry if that's a dumb question, but I couldn't find the answer.I am going to uni soon, I live in Romania, and I want to learn in advance, so I could focus on other stuff.IDK how does education works in your country, but we have 2 courses for general knowledge, and then you choose what do you want to be specialiazed. Nevertheless, I will choose my specialty later, but want to be sure what other learn, so I could ready up!Thanks in advance!",5,0.86,2,https://www.reddit.com/r/learnprogramming/comments/1u3ea72/what_did_you_learned_for_c_in_university_and_what/,2026-06-11 23:00:08,2026-06-18 04:05:28
1u2vdzs,Stuck in tutorial hell with Python/Django and not sure how to actually bridge the gap to real projects,Saltypois0n21,learnprogramming,"I've been following a few different Udemy courses and YouTube playlists for about six months now. I feel like I have a decent handle on Python syntax, loops, and basic data structures, and I've managed to follow along with a few Django tutorials to build a basic blog site and a simple task manager. But the second I close the video and stare at a blank VS Code window, I completely freeze up. I know I should just start building something, but I don't actually know what a 'real' project looks like outside of a guided tutorial. I find myself constantly going back to watch the same videos because I'm afraid of hitting a wall I can't climb without someone explaining the logic to me first. Should I try to build something completely from scratch even if it's a tiny, useless app? Or is there a middle ground where I can practice without feeling like I'm just guessing? I want to move toward being job-ready, but I feel like I'm just mimicking instructions instead of actually learning how to architect a solution. Any advice on how to break this cycle and start thinking like a developer rather than a student?",4,0.75,11,https://www.reddit.com/r/learnprogramming/comments/1u2vdzs/stuck_in_tutorial_hell_with_pythondjango_and_not/,2026-06-11 10:36:29,2026-06-18 04:05:28
1u7mwm4,Complex JSON queries,ReclusiveEagle,learnprogramming,"I have many images with xmp sidecar metadata. DAM I am using is DigiKam for the keyword tagging however, all software that supports cataloging is very limited in terms of querying metadata. This includes Lightroom and Capture One.For example, lets say I have many images, some have 1 person and other 2 - 5 people. Now, I want to assign metadata per person in an image.To do it in DigiKam, Lightroom or Capture One I would either need to create nested keywords like Person 1 Name Bob Eye Color Brown Person 2 Name Zen Eye Color Brown Person 3 Name James Eye Color RedOr just accept that I can't do unique assigning of data on a per person level.Even if I do create multiple person keywords it is almost impossible to query this because if I search for contains keywords ""Name|Zen"" AND ""Eye Color|Brown""I would get all images that contain Zen and someone else with the eye color brown even if Zen does not have brown eyes in that specific image. And if I wanted to be specific I would have to know exactly which Person \[ID\] Zen is in this specific image which is impossible to remember so I'd have to create a search pattern like this ""Person 1"" AND ""Name|Zen"" AND ""Eye Color|Brown"" OR ""Person 2"" AND ""Name|Zen"" AND ""Eye Color|Brown"" OR ""Person 3"" AND ""Name|Zen"" AND ""Eye Color|Brown"" OR ""Person 4"" AND ""Name|Zen"" AND ""Eye Color|Brown"" OR ""Person 5"" AND ""Name|Zen"" AND ""Eye Color|Brown""This is stupid and tedious.So instead I want to create a program that will allow me to create complex queries. Lets say I use HTML as the front end a database that can store nested json arraysexample ""color"": { ""primary color"": [""green""], ""secondary color"": [""white"", ""tan""], ""accent color"": [""black"", ""red""] }This (I assume) should allow me to search generally for any images containing ""Color:Red"" or images that specifically contain ""Primary Color:Red""I could also then search for ""Person.Name:Zed"" AND ""Eye Color:Red"" or another example ""Location"": { ""City"": [""Hong Kong"" }Then I can query ""Location:Hong Kong"" or ""City:Hong Kong"" or generally as ""Hong Kong""(these are just pseudo code examples). This is far more useful than having simplistic nested keywords that requires tedious specifications.# QuestionIs this possible? I am new to databases and querying. Can I store and query json in this way? Or is it more limited than what I think? I assume it should be possible to query the parent array or multiple nested arrays for informationWhat database would be best for doing something like this? PostgreSQL? MySQL? and how would I query this? From the database itself or would I need a separate query solution?",3,0.68,13,https://www.reddit.com/r/learnprogramming/comments/1u7mwm4/complex_json_queries/,2026-06-16 19:06:20,2026-06-18 04:05:28
1u7f8hd,Hello everyone . i am confused please help,Fit_Manufacturer586,learnprogramming,"My love for computers started when I was 10 years old. I was given a laptop back then, which I just used for gaming for about a year; of course, I didn't even know about coding and all. Then, slowly, I got into this coding thing. During the lockdown, I enjoyed it a lot. I did HTML, CSS, and JavaScript when I first started, and then my uncle told me to learn to code if I loved it. He suggested I start with C—he holds a high position in one of the world's leading companies. I tried it, but I didn't like it since I was already doing HTML. I know it wasn't a ""programming"" language, but as a kid, I just liked making websites.Then, I got to know Java and Python. I learned them to an intermediate or maybe slightly lower level. Then came Class 10, but I didn't stop coding, even during my board exams. This led to a lower percentage in my Class 10 ICSE boards; I got 88%, which was, of course, not what my family expected—the average Indian family situation.Then, in Class 11, I had to stop coding a little since the syllabus increased drastically. Now, in Class 12, I am preparing for the JEE too. But you see, I haven't coded for months, and it feels kind of strange studying all day at home. So, I think I should start coding again, maybe for just half an hour a day instead of the whole day.However, I have realized one thing: the coding I did as a child is nothing now. I have to do something that actually matters. I have two options: either learn something advanced—but it will take time, and I need to give time to the JEE too—or I can just improve my Python since Python is my main language. I can do LeetCode problems and get better at Python so that when I get into my dream college, which I hope I do, I can start to place my foot in the vast world of computers.",1,0.56,3,https://www.reddit.com/r/learnprogramming/comments/1u7f8hd/hello_everyone_i_am_confused_please_help/,2026-06-16 14:32:18,2026-06-18 04:05:28
1u6jabv,How do i code online with my friend?,Alone-Swordsman,learnprogramming,How can I code online with my friend who is in other pc and and me in other pc online,5,0.65,33,https://www.reddit.com/r/learnprogramming/comments/1u6jabv/how_do_i_code_online_with_my_friend/,2026-06-15 15:08:43,2026-06-18 04:05:28
1u66b9m,What should I learn in python for AI ?,6_SAM_9,learnprogramming,"So, I am a [B.tech](http://B.tech) CSE first year student. My college hasn't even started yet. My goal is to become an AI engineer and i know that learning python is very crucial for that. But I haven't got any direction on what and how deep i have to learn things in python and WHAT ARE THE THINGS THAT I HAVE TO FOCUS ON MORE THAN OTHERS. Please help me to get some clarity.",2,0.63,6,https://www.reddit.com/r/learnprogramming/comments/1u66b9m/what_should_i_learn_in_python_for_ai/,2026-06-15 04:26:12,2026-06-18 04:05:28
1u53yyr,Learning Software Dev Languages,Crumbs_on_carpet,learnprogramming,"So I have experience in basic Python, and early-intermediate level/late beginner C# skills, with some other knowledge on SQLite for building very simple databases.I want to continue down the self taught route and just can’t seem to find a solid answer on what language i should be focusing on to land a software developer job.Some people say JS is great to start, others say Python, YouTube videos have entire pathways they recommend and so on.I’m more so interested in app development, not necessarily full stack just yet but maybe front or back end but I haven’t quite made up my mind.Any advice is helpful and I am grateful in advance!",4,0.83,4,https://www.reddit.com/r/learnprogramming/comments/1u53yyr/learning_software_dev_languages/,2026-06-13 22:24:50,2026-06-18 04:05:28
1u4rj49,Books for basics of comp sci and java,peculiar_hobo,learnprogramming,I'm trying to learn Java as essentially a beginner my only experience with programming was a python elective in high school,3,0.8,1,https://www.reddit.com/r/learnprogramming/comments/1u4rj49/books_for_basics_of_comp_sci_and_java/,2026-06-13 13:51:35,2026-06-18 04:05:28
1u4ikgg,Feeling stuck with DSA,SkullDriv3rr,learnprogramming,"Recently i was asked to implement some data structures and their basic functions in university (structures like queues, nodes, and trees). Ii just couldn't figure out what to do. I get that it's hard and that I have to piece things together to get it done, but when I sit and stare at the IDE, I keep reading the same lines over and over. This was especially true for the n-ary tree. We were given a simple template for the tree, including the node struct we would use and the basic tree class with only the root set. We had to add all the other functions, like add, remove, and a few others. Any tips to help with this? i try to avoid IA as much as possible since i know im there to learn and not to assign my things to others. im looking for sources that would help me too, would really like to hear how you guys learnt it(would like other tips that helped you throught your career too). &#x200B;Thx in advance",3,0.72,7,https://www.reddit.com/r/learnprogramming/comments/1u4ikgg/feeling_stuck_with_dsa/,2026-06-13 05:40:17,2026-06-18 04:05:28
1u45iaf,"Hey!, please help",OutrageousPlan9483,learnprogramming,"I am an undergraduate going in my second year of college in 1 month now . I tried c programming and understood the concepts through some youtube videos but never had the urge to be excited doing it unlike subjects like maths which i did all my schooling years.The main problem here for me is that I want to enjoy programming, not just wanting to learn programming for the sake of passing exams. I don't know whether i should take help of books, any courses or YouTube videos, i just couldn't figure it out. Right now just started to rebuild some basics through cpp but dont know whether it will end like my first c programming experience.So if anyone could help me would be a huge help for me :folded_hands:.",1,0.55,11,https://www.reddit.com/r/learnprogramming/comments/1u45iaf/hey_please_help/,2026-06-12 19:43:19,2026-06-18 04:05:28
1u40jwp,What classes should I take at UMBC if I have no past experiences with any Software Engineering at all? (I'm thinking about transfering after about a year a two to UMD),Acceptable-Chest-725,learnprogramming,"Also I'm kind of late on trying to get some scholarships, so what easy scholarships and potential intern jobs that relate to my career can I take that I can apply to. This is really my last hope of getting anywhere with my life.",3,0.81,1,https://www.reddit.com/r/learnprogramming/comments/1u40jwp/what_classes_should_i_take_at_umbc_if_i_have_no/,2026-06-12 16:40:53,2026-06-18 04:05:28
1u3x1hh,Reading documentation,CloudYRR,learnprogramming,I wanted to ask and see if anyone has had the same issue and how they dealt with it. My problem is i have issues reading documentation or understanding logic. I just dont understand how to use it and end up relying on AI then but i want to stop it. Do i just ask other programmers then?,2,0.63,11,https://www.reddit.com/r/learnprogramming/comments/1u3x1hh/reading_documentation/,2026-06-12 14:34:51,2026-06-18 04:05:28
1u8orc6,Confused on trying to run C files on computer,Longjumping_View_668,learnprogramming,"So recently i have been learning the C language and and currently I have hit a roadblock. In my most recent projects I have been making use of the `#include ` so I can use the `sin` and `fabs` functions. However, the IDE I have been using, Microsoft Visual Code, keeps returning errors: `Starting build...``/usr/bin/gcc -fdiagnostics-color=always -g '/home/deck/Downloads/C programing stuff/SineCosineTable.c' -o '/home/deck/Downloads/C programing stuff/SineCosineTable'``/usr/x86_64-unknown-linux-gnu/bin/ld.bfd: /tmp/ccFKoXBT.o: in function \`SineCosine':``/home/deck/Downloads/C programing stuff/SineCosineTable.c:14:(.text+0x18): undefined reference to \`cos'``/usr/x86_64-unknown-linux-gnu/bin/ld.bfd: /home/deck/Downloads/C programing stuff/SineCosineTable.c:14:(.text+0x2b): undefined reference to \`sin'``collect2: error: ld returned 1 exit status`If I were to run it on a C compiler on my browser it for some reason works just fine. If anyone could help that would be great.I use a steam deck if that helps.My Code: /* Name: Santiago Sancio Date: 6/16/2026 This program goes through a while loop incrementing by 0.1 at a time starting from 0.1 and ending at 0.9. After each incrememnt the program will print out the sine and cosine values of the current value the loop is at Creating a table of these values. Lastly the program will end the table with a little line. */ #include #include // adds the sin and cos functions void SineCosine( double interval) { printf(""sin( %lf ) = %lf, cos( %lf ) = %lf |\t"", interval, sin(interval), interval, cos(interval)); //prints out the sine and cosine of the number between 0 and 1 and adds thgem to the table. } int main( void ) { double interval; int i; for(i = 1; i <10; i++) // loop that moves from 0.1 to 0.9 { interval = i/10.0; // divides by 10 so the loop moves inbetween 0 and 1 and not 0 and 10 SineCosine(interval); //sends the interval value to a function that prints out the sine and cosine values of the interval value } printf(""\n+++++++\n""); //ends the table return 0; //ends the program }",2,0.75,7,https://www.reddit.com/r/learnprogramming/comments/1u8orc6/confused_on_trying_to_run_c_files_on_computer/,2026-06-17 22:29:35,2026-06-18 04:05:28
1u8im53,Hey ppl :waving_hand:,nocapimnpc,learnprogramming,So it's been a month since I completed all my competitive exams and my 12th . So i took a course of the programming language of c and python and tbh idk anything about a computer and programming language and on the first day of my programming class I got to know that I missed 12 classes of c language and 4 classes of python and I'm really stressed about it &#x200B;And also I'm tensed that will i be able to complete python and c within the span of 2 months and I know that I've missed almost 30-40 percent of c and the guy who's teaching the python is the same guy who teaches c so he doesn't explain the topics in python which are already covered in c &#x200B;And in short I need to learn both languages within 2 months and please all of you guys just suggest to me the best lectures of c and python in youtube which are made for rookies and i hope you guys will suggest me &#x200B;Thank you all,4,0.62,7,https://www.reddit.com/r/learnprogramming/comments/1u8im53/hey_ppl/,2026-06-17 18:38:21,2026-06-18 04:05:28
1u7m8m8,[INFO] New Typeset PDF of SICP (based on previous community works),Dragoonfx00,learnprogramming,"For those interested, the LaTeX source of the SICP (Structure and Interpretation of Computer Programs) book was updated for better typesetting and QoL improvements.Here's a copy-pasted improvements from the README:> The biggest change in this revision is the new typesetting of the book and the> full conversion to LaTeX (completely moving away from the previous Texinfo).> Some of the improvements in this version are as follows:> > - The whole codebase structure is now modularized, making development easier and> more manageable> - Multiple macros are created to handle formatting more efficiently> - Extended build support> - Builds for multiple page layouts (A4, A5, etc.) are now supported> - Builds for individual chapters are now supported> - Many QoL improvements> - The whole book now uses the ""New Computer Modern"" typeface> - Cover page is now generated using LaTeX instead of the manual SVG format> - Chapter heading, quote and figure styles are updated> - Code blocks now have numbered lines> - Page numbers are moved to the page header area> - Page headers now show the chapter name on even pages and section name on odd> pages> - Exercises now have a heading for easier recognition, reduced margins, and> always end with a page break> - Long code lines are now properly broken> - ""List of Figures"" section is now auto-generated and shows a figure's number> and name> - Cleanup of manual page breaks and layout adjustments to allow for a more> natural and elegant output> - Multiple figures are updated to fix issues> - New cover pages are designed for printing needsIf you want to know ""Why read this decades-old book in modern times?"", please check out the [Book Review](https://github.com/junnunkarim/book__sicp_source__latex#book-review) section.source: [book__sicp_source__latex](https://github.com/junnunkarim/book__sicp_source__latex#book-review)",2,0.67,3,https://www.reddit.com/r/learnprogramming/comments/1u7m8m8/info_new_typeset_pdf_of_sicp_based_on_previous/,2026-06-16 18:42:49,2026-06-18 04:05:28
1u7fiau,Advice for 15-Days backend preparation.,Accomplished-Sir9257,learnprogramming,"I'm a 2nd-year CS student and currently have beginner-level knowledge of Node.js.So far, I've gone through tutorials and built a few projects by following them and extending them a bit, including:CRUD backend APIsA custom AI chatbot backendBasic JWT authentication and authorizationI understand the fundamentals, but I haven't built many projects completely on my own yet.I have about 15 days before I want to start applying for internships. My goal isn't to become an expert in that time, but to become employable enough to apply confidently and perform reasonably well in interviews.If you were an experienced software engineer or hiring manager, what roadmap would you recommend for the next 15 days?Specifically:What topics should I prioritize?What projects would give the highest ROI for internships?How much DSA/LeetCode should I do versus building projects?What are the biggest gaps you typically see in students at my stage?If you had to make someone internship-ready in 15 days, how would you structure those days?Any advice would be appreciated.",2,0.76,1,https://www.reddit.com/r/learnprogramming/comments/1u7fiau/advice_for_15days_backend_preparation/,2026-06-16 14:42:35,2026-06-18 04:05:28
1u3v9ge,Why are companies so evil now?,VariationLivid3193,cscareerquestions,Everyone used to be so nice.There were so many perks of working at big tech.Everyones just scared runninh for their jobs now.,939,0.91,459,https://www.reddit.com/r/cscareerquestions/comments/1u3v9ge/why_are_companies_so_evil_now/,2026-06-12 13:27:00,2026-06-18 04:05:30
1u7lak5,Robinhood Lays off 10% of staff,Free_Dum_5122,cscareerquestions,[https://techcrunch.com/2026/06/16/robinhoods-note-on-10-layoffs-shows-blaming-ai-isnt-cutting-it/](https://techcrunch.com/2026/06/16/robinhoods-note-on-10-layoffs-shows-blaming-ai-isnt-cutting-it/),565,0.98,92,https://www.reddit.com/r/cscareerquestions/comments/1u7lak5/robinhood_lays_off_10_of_staff/,2026-06-16 18:09:24,2026-06-18 04:05:30
1u6guvh,Getting rejected at final stage just breaks me.,VariationLivid3193,cscareerquestions,Going through months and multiple rounds just to get rejected in final round sucks.,527,0.97,118,https://www.reddit.com/r/cscareerquestions/comments/1u6guvh/getting_rejected_at_final_stage_just_breaks_me/,2026-06-15 13:37:14,2026-06-18 04:05:30
1u6ts4l,Jumping ship way too often?,Exciting_Problem3869,cscareerquestions,"At the start of this year, I jumped ship to a new company after being at my last company for only 9 months (salary went from $215k -> $250k). Now after only 6 months here, I am already getting recruited to roles that are way more interesting (and more pay: $350k-400k+ base). I feel like a lot of my peers are also now jumping ship < 1 year more often. Has anyone here developed a mental 'when should I jump ship' heuristic to think about these opportunities?",296,0.9,101,https://www.reddit.com/r/cscareerquestions/comments/1u6ts4l/jumping_ship_way_too_often/,2026-06-15 21:20:56,2026-06-18 04:05:30
1u7ceh5,"I am unable to maintain my manager's single-handedly vibe-coded app, and I am now the bottleneck of the company.",zzztz,cscareerquestions,"Horrible story here.So my product manager vibe-coded an LLM-powered app and then handed it over to me two days before his three-week vacation.The app is a content generation pipline, which generates some content that is supposed to be reviewed and corrected by a dedicated QA team. The original plan was that I run the pipeline and deliver content to QA while he is away.However, at handover this pipeline is only half-baked and it is still very buggy. The generated content does not make sense and it fails most of the time, and the quality is so bad that the QA team can't realistically review it. Instead of simply running the pipeline, I've become responsible for fixing it.The codebase is extremely difficult to maintain. There are temporary ""gotcha"" fixes scattered here and there. All documentations are generated by LLM and they are not consistent across the codebase because of the fast iteration. The sub won't let me to add a pic but there is a commit with 10,000 lines of code. I have Claude available, but every bug fix only make it worse because it only does temporarilly fixes and does not solve the issues systematically.This has turned me into a bottleneck for the entire workflow. The QA team depends on me to provide usable content, but they can't do their jobs until the pipeline works. Management has high expectations for the project, and we hired the QA team specifically for this project and each day passes without work for them is losing money for the company.I'm feeling increasingly overwhelmed because I'm being asked to own a critical business process built on top of a half-finished, poorly designed codebase that I am unable to maintain.What should I do in this case? Should I work overnight to do a refactor? Should I communicate with my manager and the management? Quitting is not an option for me because my visa is tied to my work.Any advice would be appreciated :face_holding_back_tears:",268,0.94,64,https://www.reddit.com/r/cscareerquestions/comments/1u7ceh5/i_am_unable_to_maintain_my_managers/,2026-06-16 12:40:34,2026-06-18 04:05:30
1u52mwo,Will be graduating with a CS degree at 33. I am really really lost.,not_rocket_appliance,cscareerquestions,I feel like I have no real skills. I know the solution is to build but then it takes me ages to actually grasp things to the point I feel competent. Then I hear other student and friends build all sorts of cool apps where they use curser or Claude code and I feel like if my time building stuff is even relevant. I also just feel so so lost on all these tech stacks and what’s relevant etc. I can’t afford to waste time on the wrong path at 33. I am broke and have no real career working experience. I feel so behind and useless and lost. I don’t know what to do. I know there is no easy path but what direction can I take over the next 6 months to help me land my first job. I feel worthless and I feel afraid I wasted my time with a cs degree. Doesn’t help that I am 33 and it took my 6 years to get this degree. I had some rough years. Please help.,263,0.93,100,https://www.reddit.com/r/cscareerquestions/comments/1u52mwo/will_be_graduating_with_a_cs_degree_at_33_i_am/,2026-06-13 21:25:47,2026-06-18 04:05:30
1u7r7m8,Halfway through my internship and just found out there's no budget to hire me,ColorfulWay,cscareerquestions,"Halfway through my internship at a very large company and had a meeting with my manager today.The feedback was honestly as positive as it could be. They said they have no notes for me, I'm doing great work, and to keep doing what I'm doing. Right now I'm working across 5 different projects and have gotten consistently positive feedback.Then came the part I was worried about.They told me they don't have the headcount or budget to hire another person, so a return offer is extremely unlikely regardless of performance. Guaranteed this fy and in the future its possible but was told to not hold out because they are a lean team.I graduated with my Master's in May, so going back to school isn't really an option. I guess I'm about to join the sea of people sending thousands upon thousands of applications and praying for a response.Not sure how I am going to stay motivated through the rest of the internship if I am not gonna get hired, feels like none of it matters if there simply isn't a position available even though the need for additional members on the team is very apparent.Anyone else been in this situation? How did things work out for you after the internship ended?GGs.",258,0.97,54,https://www.reddit.com/r/cscareerquestions/comments/1u7r7m8/halfway_through_my_internship_and_just_found_out/,2026-06-16 21:45:44,2026-06-18 04:05:30
