id,title,author,subreddit,content,score,upvote_ratio,num_comments,url,created_utc,extracted_at
1pv7t34,Am I crazy or is kafka overkill for most use cases?,Vodka-_-Vodka,dataengineering,"Serious question because I feel like I'm onto something.We're processing maybe 10k events per day. Someone on my team wants to set up a full kafka cluster with multiple servers, the whole thing. This is going to take months to set up and we'll need someone dedicated just to keep it running.Our needs are pretty simple. Receive data from a few services, clean it up, store in our database, send some to an api. That's it.Couldn't we just use something simpler? Why does everyone immediately jump to kafka like it's the only option?",260,0.95,131,https://www.reddit.com/r/dataengineering/comments/1pv7t34/am_i_crazy_or_is_kafka_overkill_for_most_use_cases/,2025-12-25 07:14:02,2025-12-31 01:49:04
1pvfp7c,New table format announced: Oveberg,EarthGoddessDude,dataengineering,"Because I apparently don’t know how to type Iceberg into my phone properly, even after 5 attempts. Also announcing FuckLake. Both hostable on ASS.",187,0.85,31,https://www.reddit.com/r/dataengineering/comments/1pvfp7c/new_table_format_announced_oveberg/,2025-12-25 15:31:08,2025-12-31 01:49:04
1px1ufp,"For people who have worked as BOTH Data Scientist and Data Engineer: which path did you choose long-term, and why?",Mean_Addendum_4698,dataengineering,"I’m trying to decide between Data Science and Data Engineering, but most advice I find online feels outdated or overly theoretical. With the data science market becoming crowded, companies focusing more on production ML rather than notebooks, increasing emphasis on data infrastructure, reliability, and cost, and AI tools rapidly changing how analysis and modeling are done, I’m struggling to understand what these roles really look like day to day. What I can’t get from blogs or job postings is real, current, hands-on experience, so I’d love to hear from people who are currently working (or have recently worked) in either role: how has your job actually changed over the last 1–2 years, do the expectations match how the role is advertised, which role feels more stable and valued inside companies, and if you were starting today, would you choose the same path again? I’m not looking for salary comparisons, I’m looking for honest, experience-based insight into the current market.",157,0.92,74,https://www.reddit.com/r/dataengineering/comments/1px1ufp/for_people_who_have_worked_as_both_data_scientist/,2025-12-27 16:27:39,2025-12-31 01:49:04
1pv5dzu,The scent of a data center,PossibilityRegular21,dataengineering,No content,161,0.93,7,https://i.redd.it/rg5qybt84a9g1.jpeg,2025-12-25 04:38:09,2025-12-31 01:49:04
1pw9ydl,Kafka setup costs us a little fortune but everyone at my company is too scared to change it because it works,Worldly-Volume-1440,dataengineering,"We're paying about 15k monthly for our kafka setup and it's handling maybe 500gb of data per day. I know that sounds crazy and it is but nobody wants to be the person who breaks something that's working.The guy who set this up left 2 years ago and he basically over built everything expecting massive growth that never happened. We've got way more servers than we need and we're keeping data for 30 days when most of it gets used in the first few hours, basically everything is over provisioned.I've tried to bring up optimizing this like 5 times and everyone just says ""what if we need that capacity later"" or ""what if something breaks when we change it"". Meanwhile, we're losing money on servers that barely do anything most of the time. I finally convinced them to add gravitee to at least get visibility into what we're actually using and it confirmed what I suspected, we're wasting so much capacity. The funniest part of it is we started using kafka for pretty simple stuff like sending notifications between services and now it's this massive thing nobody wants to touchAnyone else dealing with this? Big kafka setup is such an overkill for what a lot of teams need but once you have it you're stuck with it",103,0.93,34,https://www.reddit.com/r/dataengineering/comments/1pw9ydl/kafka_setup_costs_us_a_little_fortune_but/,2025-12-26 17:35:50,2025-12-31 01:49:04
1pyecpd,Mid Senior Data Engineer struggling in this job market. Looking for honest advice.,This_Bird6184,dataengineering,"Hey everyone,I wanted to share my situation and get some honest perspective from this community.I’m a data engineer with 5 years of hands-on experience building and maintaining production pipelines. Most of my work has been around Spark (batch + streaming), Kafka, Airflow, cloud platforms (AWS and GCP), and large-scale data systems used by real business teams. I’ve worked on real-time event processing, data migrations, and high-volume pipelines, not just toy projects.Despite that, the current job hunt has been brutal.I’ve been applying consistently for months. I do get callbacks, recruiter screens, and even technical rounds. But I keep getting rejected late in the process or after hiring manager rounds. Sometimes the feedback is vague. Sometimes there’s no feedback at all. Roles get paused. Headcount disappears. Or they suddenly want an exact internal tech match even though the JD said otherwise.What’s making this harder is the pressure outside work. I’m managing rent, education costs, and visa timelines, so the uncertainty is mentally exhausting. I know I’m capable, I know I’ve delivered in real production environments, but this market makes you question everything.I’m trying to understand a few things:•Is this level of rejection normal right now even for experienced data engineers?•Are companies strongly preferring very narrow stack matches over fundamentals?•Is the market simply oversaturated, or am I missing something obvious in how I’m interviewing or positioning myself?•For those who recently landed roles, what actually made the difference?I’m not looking for sympathy. I genuinely want to improve and adapt. If the answer is “wait it out,” I can accept that. If the answer is “your approach is wrong,” I want to fix it.Appreciate any real advice, especially from people actively hiring or who recently went through the same thing.Thanks for reading.",106,0.9,53,https://www.reddit.com/r/dataengineering/comments/1pyecpd/mid_senior_data_engineer_struggling_in_this_job/,2025-12-29 05:58:33,2025-12-31 01:49:04
1pufkm8,"Data Quality on Spark — A Practical Series (Great Expectations, Soda, DQX, Deequ, Pandera)",ivan_kurchenko,dataengineering,I'm planning to work on Data Quality improvement project at work so decided to start with current tools evaluation. So decided to write a blog series along the way.1. [**Part 1 — Great Expectations**](https://levelup.gitconnected.com/data-quality-on-spark-part-1-greatexpectations-fd4ffa126ca0)2. [**Part 2 — Soda**](https://levelup.gitconnected.com/data-quality-on-spark-part-2-soda-97d5d32e2d8b)3. [**Part 3 — DQX**](https://levelup.gitconnected.com/data-quality-on-spark-part-3-dqx-f0335b8ff07d)4. [**Part 4 — Deequ**](https://levelup.gitconnected.com/data-quality-on-spark-part-4-deequ-d82e8c2344ae)5. [**Part 5 — Pandera**](https://levelup.gitconnected.com/data-quality-on-spark-part-5-pandera-05cd494d5b01),59,0.97,16,https://www.reddit.com/r/dataengineering/comments/1pufkm8/data_quality_on_spark_a_practical_series_great/,2025-12-24 05:31:36,2025-12-31 01:49:04
1pwbwdt,"What data engineering decision did you regret six months later, and why?",AMDataLake,dataengineering,What was your experience?,54,0.92,54,https://www.reddit.com/r/dataengineering/comments/1pwbwdt/what_data_engineering_decision_did_you_regret_six/,2025-12-26 18:56:07,2025-12-31 01:49:04
1puqkx7,Rust for data engineering?,otto_0805,dataengineering,"Hi, I am curious about data engineering. Any DE using Rust as their second or third language? Did you enjoy it? Worth learning for someone after learning the fundamental skills for data engineering? If there are any blogs, I am up to read. So please share your experience.",53,0.89,55,https://www.reddit.com/r/dataengineering/comments/1puqkx7/rust_for_data_engineering/,2025-12-24 15:58:00,2025-12-31 01:49:04
1pyen4a,Kafka - how is it typically implemented ?,AdFormal9428,dataengineering,"Hi all,I want to understand how Kafka is typically implemented in a mid sized company and also in large organisations.Streaming is available in Snowflake as a Streams and Pipes (if I am not mistaken) and presume other platforms such as AWS (Kinesis) Databricks provide their own version of streaming data ingestion for Data Engineers.So what does it mean to learn Kafka ? Is it implemented separately outside of the tools provided by the large scale platforms (such as Snowflake, AWS, Databricks) and if so how is it done ?Asking because I see Joh descriptions explicitly mention Kafka as a experience requirement while also mentioning Snowflake as required experience . What exactly are they looking at and how is it different to know Snowflake streams and separately Kafka.If Kafka is deployed separately to Snowflake / AWS / Databricks, how is it done? I have seen even large organisations put this as a requirement.Trying to understand what exactly to learn in Kafka, because there are so many courses and implementations - so what is a typical requirement in a mid to large organization ? \*Edit\* - to clarify - I have asked about streaming, but I meant to also add Snowpipe.",48,0.94,19,https://www.reddit.com/r/dataengineering/comments/1pyen4a/kafka_how_is_it_typically_implemented/,2025-12-29 06:13:47,2025-12-31 01:49:04
1py48h7,"How do you explore a large database you didn’t design (no docs, hundreds of tables)?",Technical_Safety4503,dataengineering,"I often have to make sense of **large databases with little or no documentation**. I didn’t find a tool that really helps me explore them step by step — figuring out **which tables matter** and **how they connect** in order to answer actual questions.So I put together a small prototype to visually explore database schemas:* load a schema and get an interactive ERD* search across **table and column names*** select a few tables and automatically **reveal how they’re connected** **GIF below (AirportDB example)**https://i.redd.it/yklm55oeq0ag1.gifBefore building this further, I’m curious:* **Do you run into this problem as well?** If so, what’s the most frustrating part for you?* **How do you currently explore unfamiliar databases?** Am I missing an existing tool that already does this well?Happy to learn from others — I’m doing this as a starter / hobby project and mainly trying to validate the idea.PS: this is my first reddit post, be gentle :)",43,0.84,47,https://www.reddit.com/r/dataengineering/comments/1py48h7/how_do_you_explore_a_large_database_you_didnt/,2025-12-28 22:16:39,2025-12-31 01:49:04
1pyr86l,One Tool/Skill other than SQL and Python for 2026,crushed_peppe,dataengineering,"If you had to learn one tool or platform beyond SQL and Python to future-proof your career in 2026, what would it be?I’m a Senior Database Engineer with 15+ years of experience, primarily in T-SQL (≈90%) with some C#/.NET. My most recent role was as a Database Engineering Manager, but following a layoff I’ve returned to an individual contributor role.I’m noticing a shrinking market for pure SQL-centric roles and want to intentionally transition into a Data Engineering position. Given a 6-month learning window, what single technology or platform would provide the highest ROI and best position me for senior-level data engineering roles?Edit: Thank you for all your responses. I asked ChatGPT and this is what it thinks I should do, please feel free to critic:Given your background and where the market is heading in 2026, **if I had to pick exactly one tool/skill beyond SQL and Python**, it would be:# Apache Spark (with a cloud-managed flavor like Databricks)Not Airflow. Not Power BI. Not another programming language. **Spark.**",48,0.93,19,https://www.reddit.com/r/dataengineering/comments/1pyr86l/one_toolskill_other_than_sql_and_python_for_2026/,2025-12-29 16:48:13,2025-12-31 01:49:04
1pxu6ts,Are we too deep into Snowflake?,stuckplayingLoL,dataengineering,"My team uses Snowflake for majority of transformations and prepping data for our customers to use. We sort of have a medallion architecture going that is solely within Snowflake. I wonder if we are too vested into Snowflake and would like to understand pros/cons from the community. The majority of the processing and transformations are done in Snowflake. I anticipate we deal with 5TB of data when we add up all the raw sources we pull today.Quick overview of inputs/outputs:EL with minor transformations like appending a timestamp or converting from csv to json. This is done with AWS Fargate running a batch job daily and pulling from the raw sources. Data is written to raw tables within a schema in Snowflake, dedicated to be the 'stage'. But we aren't using internal or external stages.When it hits the raw tables, we call it Bronze. We use Snowflake streams and tasks to ingest and process data into Silver tables. Task has logic to do transformations.From there, we generate Snowflake views scoped to our customers. Generally views are created to meet usecases or limit the access.Majority of our customers are BI users that use either tableau or power bi. We have some app teams that pull from us but not as common as BI teams.I have seen teams not use any snowflake features and just handle all transformations outside of snowflake. But idk if I can truly do a medallion architecture model if not all stages of data sit in Snowflake. Cost is probably an obvious concern. Wonder if alternatives will generate more savings.Thanks in advance and curious to see responses.",44,0.93,34,https://www.reddit.com/r/dataengineering/comments/1pxu6ts/are_we_too_deep_into_snowflake/,2025-12-28 15:36:35,2025-12-31 01:49:04
1pw5p4v,Anyone else going crazy over the lack of validation?,SoggyGrayDuck,dataengineering,"I now work for a hospital after working for a bank and the way asking questions about ""do we have the right Data for what the end users are looking at in the front end?"" Or anything along those lines? I put a huge target on my back by simply asking the questions no one was willing to consider. As long as the the final metric looks positive it's going through get thumbs up without further review. It's like simply asking the question puts the responsibility back on the business and if we don't ask they can just point fingers. They're the only ones interfacing with management so of course they spin everything as the engineers fault when things go wrong. This is what bothers me the most, if anyone bothered to actually look the failure is painfully obvious. Now I simply push shit out with a smile and no one questions it. The one time they did question something I tried to recreate their total and came up with a different number, they dropped it instead of having the conversation. Knowing that this is how most metrics are created makes me wonder what the hell is keeping things on track? Is this why we just have to print and print at the government level and inflate the wealth gap? Because we're too scared to ask the tough questions?",39,0.96,27,https://www.reddit.com/r/dataengineering/comments/1pw5p4v/anyone_else_going_crazy_over_the_lack_of/,2025-12-26 14:35:17,2025-12-31 01:49:04
1pywd3j,How are you using Databricks in your company?,L3GOLAS234,dataengineering,"Hello. I have many years of experience, but I've never worked with Databricks, and I'm planning to learn it on my own. I just signed up for the free edition and there are a ton of different menus for different features, so I was wondering how every company uses Databricks, to narrow the scope of what I need to learn.Do you mostly use it just as a Spark compute engine? And then trigger Databricks jobs from Airflow/other schedules? Or are other features actually useful? Thanks!",34,0.89,11,https://www.reddit.com/r/dataengineering/comments/1pywd3j/how_are_you_using_databricks_in_your_company/,2025-12-29 19:56:58,2025-12-31 01:49:04
1pxtsi9,Implementation of SCD type 2,Rare_Decision276,dataengineering,"Hi all, Want to know how you guys implement SCD type 2? Will you write code in PySpark or do in databricks?Because in databricks we have lakeflow declarative pipelines there we can implement in much better way compare to traditional style of implementing?? Which one you will follow??",34,0.82,61,https://www.reddit.com/r/dataengineering/comments/1pxtsi9/implementation_of_scd_type_2/,2025-12-28 15:19:49,2025-12-31 01:49:04
1pxl447,My attempt at a data engineering project,NoOwl6640,dataengineering,"Hi guys,This is my first attempt trying a data engineering projecthttps://github.com/DeepakReddy02/Databricks-Data-engineering-project(BTW.. I am a data analyst with 3 years of experience )",32,0.84,10,https://www.reddit.com/r/dataengineering/comments/1pxl447/my_attempt_at_a_data_engineering_project/,2025-12-28 07:10:22,2025-12-31 01:49:04
1px50yt,Which ETL tools are most commonly used with Snowflake?,Commercial-Post4022,dataengineering,"Hello everyone, Could you please share which data ingestion tools are commonly used with Snowflake in your organization? I’m planning to transition into Snowflake-based roles and would like to focus on learning the right tools.",30,0.9,42,https://www.reddit.com/r/dataengineering/comments/1px50yt/which_etl_tools_are_most_commonly_used_with/,2025-12-27 18:36:33,2025-12-31 01:49:04
1pw7kgg,"Why do BI projects still break down over “the same"" metric?",Limp_Lab5727,dataengineering,"Every BI project I’ve worked on starts the same way. Someone asks for a dashboard. The layout gets designed, filters added, visuals polished. Only later do people realize everyone has a slightly different definition of the KPIs being shown.Then comes the rework. Numbers don’t match across dashboards. Teams argue about logic instead of decisions. New dashboards duplicate old ones with tiny variations. Suddenly BI feels slow and untrustworthy.At the same time, going full metrics and semantic layer first can feel heavy and unrealistic for fast moving teams.Curious how others handle this in practice. Do you lock metric definitions early, prototype dashboards first, or try to balance both? What actually reduced confusion long term?",30,0.84,33,https://www.reddit.com/r/dataengineering/comments/1pw7kgg/why_do_bi_projects_still_break_down_over_the_same/,2025-12-26 15:57:50,2025-12-31 01:49:04
1pz4ynz,How should I implement Pydantic/dataclasses/etc. into my pipeline?,paxmlank,dataengineering,"tl;dr: no point stands out to me as the obvious place to use it, but I feel that every project uses it so I feel like I'm missing something.I'm working on a private hobby project that's primarily just for learning new things, some that I never really got to work on in my 5 YOE. One of these things I've learned is to ""make the MVP first and ask questions later"", so I'm mainly trying to do just that for this latest version, but I'm still stirring up some questions within myself as I read on various things.One of these other questions is when/how to implement Pydantic/dataclasses. Admittedly, I don't know a lot about it, just thought it was a ""better"" Typing module (which I also don't know much about, just am familiar with type hints).I know that people use Pydantic to validate user input, but I know that its author says it's not a validation library, but a parsing one. One issue I have is that the data I collect largely are from undocumented APIs or are scraped from the web. They all fit what is conceptually the same thing, but sources will provide a different subset of ""essential fields"".My current workflow is to collect the data from the sources and save it in an object with extraction metadata, preserving the response *exactly* was it was provided. Because the data come in various shapes, I coerce everything into JSONL format. Then I use a config-based approach where I coerce different field names into a ""canonical field name"" (e.g., `{""firstname"", ""first_name"", ""1stname"", etc.} -> ""C_FIRST_NAME""`). Lastly, some data are missing (rows and fields), but the data are consistent so I build out all that I'm expecting for my application/analyses; this is done partly in Python before loading into the database then partly in SQL/dbt after loading.Initially, I thought of using Pydantic for the data as it's ingested, but I just want to preserve whatever I get as it's the source of truth. Then I thought about parsing the response into objects and using it for that (for example, I extract data about a Pokemon team so I make a Team class with a list of Pokemon, where each Pokemon has a Move/etc.), but I don't really need that much? I feel like I can just keep the data in the database with the schema that I coerce it to and the application currently just runs by running calculations in the database. Maybe I'd use it for defining a later ML model?I then figured I'd somehow use it to define the various getters in my extraction library so that I can codify how they will behave (e.g., expects a Source of either an Endpoint or a Connection, outputs a JSON with X outer keys, etc.), but figured I don't really have a good grasp of Pydantic here.After reading on it some more, I figured I could use it *after* I flatten everything into JSONL and use it while I try to add semantics to the values I see, but as I'm using Claude Code at points, it's guiding me toward using it *before/during* flattening, and that just seems forced. Tbf, it's shit at times.To reiterate, all of my sources are undocumented APIs or from webscraping. I have some control over the output from the extraction step, but I feel that I shouldn't do that in extracting. Any validation comes from having the data in a dataframe while massaging it or after loading it into the database to build it out for the desired data product.I'd appreciate any further direction.",23,0.86,21,https://www.reddit.com/r/dataengineering/comments/1pz4ynz/how_should_i_implement_pydanticdataclassesetc/,2025-12-30 01:47:44,2025-12-31 01:49:04
1pwwwf4,What parts of your data stack feel over-engineered today?,AMDataLake,dataengineering,What’s your experience?,24,0.85,18,https://www.reddit.com/r/dataengineering/comments/1pwwwf4/what_parts_of_your_data_stack_feel_overengineered/,2025-12-27 12:39:30,2025-12-31 01:49:04
1pz62eq,What dbt tools you use the most?,SnooGiraffes7113,dataengineering,"I use dbt on a lot on various client projects. It is certainly a great tool for data management, in general. With introduction of fusion, catalog, semantic model, insights, it is becoming an all stop shop for ELT. And along with Fivetran, you are succumbing to the Fivetran-dbt-snowflake/databricks ecosystem (in most cases; there would also be uses of AWS/GCP/Azure).I was wondering what dbt features do you find most useful? What do you or your company use it for, and along with what tools? Are there some things that you wished were present or absent?",21,0.75,19,https://www.reddit.com/r/dataengineering/comments/1pz62eq/what_dbt_tools_you_use_the_most/,2025-12-30 02:36:20,2025-12-31 01:49:04
1pygk5v,Simple ELT project with ClickHouse and dbt,AverageGradientBoost,dataengineering,"I built a small [ELT PoC](https://github.com/Connorrmcd6/fpl-elt) using ClickHouse and dbt and would love some feedback. I have not used either in production before, so I am keen to learn best practices.It ingests data from the Fantasy Premier League API with Python, loads into ClickHouse, and transforms with dbt, all via Docker Compose. I recommend using the provided Makefile to run it, as I ran into some timing issues where the ingestion service tried to start before ClickHouse had fully initialised, even with `depends_on` configured.Any suggestions or critique would be appreciated. Thanks!",18,0.95,7,https://www.reddit.com/r/dataengineering/comments/1pygk5v/simple_elt_project_with_clickhouse_and_dbt/,2025-12-29 08:03:40,2025-12-31 01:49:04
1puzstx,Is it appropriate to store imagery in parquet?,BitterFrostbite,dataengineering,"**Goal**:Im currently trying to build a pipeline to ingest live imagery and metadata queued in Apache Pulsar and push to Iceberg via Flink. **Issues**:I’m having second thoughts as I’m working with terabytes of images an hour and I’m struggling to buffer the data for Parquet file creation, and am seeing extreme latency for uploads to Iceberg and slow Flink checkpoint times. **Question**:Is it inappropriate to store MBs of images per row in parquets and Iceberg instead of straight S3? Having the data in one place sounded nice at the time.",19,0.92,23,https://www.reddit.com/r/dataengineering/comments/1puzstx/is_it_appropriate_to_store_imagery_in_parquet/,2025-12-24 23:10:46,2025-12-31 01:49:04
1purqy3,New Job working with Airflow questions,Kcrizzle87,dataengineering,"Hello! I'm starting a new job next week working as the only software engineer in a group of data engineers. They primarily work with airflow and want my first task to be to examine their DAGs etc to work on making them efficient. They're going to team me up with an SE from another department to help me through the process, but what are some things I could look for day 1 to try and impress my new bosses?",18,0.82,9,https://www.reddit.com/r/dataengineering/comments/1purqy3/new_job_working_with_airflow_questions/,2025-12-24 16:50:08,2025-12-31 01:49:04
