id,title,author,subreddit,content,score,upvote_ratio,num_comments,url,created_utc,extracted_at
1pptngp,snowpipe vs copy into : what fits the most ?,qintarra,dataengineering,"Hello all,I recently started using snowflake in my new company.I'm trying to build a metadata driven ingestion pipeline because we have hundreds of files to ingest into the plateform.Snowflake advisors are pushing the snowpipe for cost and efficiency reasons.I'm leaning more towards parametrized copy into.Reasoning why I prefer copy into : Copy into is easy to refactor and reuse, I can put it in a Stored procedure and call it using different parameters to populate different tables.Ability to adapt to schema change using the metadata tableRequires no extra setup outside of snowflake (if we already set the stage/integration with S3 etc).Why I struggle with Snowpipe :For each table, we need to have a snowpipe.Schema change in the table requires recreating the snowpipe (unless the table is on auto schema evolution)Requires setting up on aws to be able to trigger the snowpipe if we want the triggering automatically on file arrival.Basically, I'd love to use snowpipe, but I need to handle schema evolution easily and be able to ingest everything on varchar on my bronze layer to avoid any data rejection. Any feedback about this ?One last question : Snowflake advisor keep is telling us cost wise, snowpipe is WAY cheaper than copy into, and my biggest concern is management that would kill any copy into initiative because of this argument. Any info on this matter is highly appreciated Thanks all !",3,0.81,12,https://www.reddit.com/r/dataengineering/comments/1pptngp/snowpipe_vs_copy_into_what_fits_the_most/,2025-12-18 15:30:03,2025-12-22 01:52:23
1pnvrep,Thoughts on architecture (GCP + DBT),Upset_Ruin1691,dataengineering,"Hello everyone, I'm kinda new to more advanced data engineering and was wondering about my proposed design for a project I wanna do for personal experience and would like some feedback.I will be digesting data from different sources into Google storage where I will be transforming it in big query. I was wondering the following:What's the optional design of this architecture?What tools should I be using/not using?When the data is in big query I want to follow the medallion architecture and use DBT for transformations for for the data. I would the do dimensional modeling in the gold layer, but keep it normalized and relational in silver.Where should I have my CDC ? SCD? What common mistakes should I look out for ? Does it even make sense using medallion and relational modeling for silver and only Kimball for gold?Hope you can all help :)",3,0.81,4,https://www.reddit.com/r/dataengineering/comments/1pnvrep/thoughts_on_architecture_gcp_dbt/,2025-12-16 07:15:12,2025-12-22 01:52:23
1pn5t73,Free local tool for exploring CSV/JSON/parquet files,Rafferty97,dataengineering,"Hi all!*tl;dr: I've made a free, browser-based tool for exploring data files on your filesystem*I've been working on an app called Columns for about 18 months now, and while it started with pretty ambitious goals, it never got much traction. Despite that, I still think it offers a lot of value as a fast, easy way to explore data files of various formats - even ones with millions of rows. So I figured I'd share it with this community, as you might find it useful :)Beyond just viewing files, you can also sort, filter, calculate new columns, etc. The documentation is sparse (well, non-existant), but I'm happy to have a chat with anyone who's interested in actually using the app seriously.Even though it's browser-based, there's no sign up or server interaction. It's basically a local app delivered via the web. For those interested in the technical details, it reads data directly from the filesystem using modern web APIs, and stores projects in IndexedDB.I'd be really keen to hear if anyone does find this useful :)**NOTE:** I've been told it doesn't work in Firefox due to it not supporting the filesystem APIs that the app uses. If there's enough of a pull to fix this, I'll look for a workaround.",4,0.7,4,https://columns.dev,2025-12-15 12:10:13,2025-12-22 01:52:23
1pn0pup,Need Help,Fuzzy_Vegetable3349,dataengineering,"Hello All,We have Databricks job workflow with around ~30 Notebooks and each NB runs a common setup notebook using the %run command. This execution takes ~2 min every time.We are exploring ways to make this setup global so it doesn’t execute separately in every NB. If anyone has experience or ideas on how to implement this as a global shared setup, please let us know.Thanks in advance.",4,0.7,3,https://www.reddit.com/r/dataengineering/comments/1pn0pup/need_help/,2025-12-15 06:38:37,2025-12-22 01:52:23
1prgn6h,DBT fusion Postgres adapter,orru75,dataengineering,Anyone know what’s up with the Postgres adapter? Its been blocked for ages.,3,0.71,0,https://www.reddit.com/r/dataengineering/comments/1prgn6h/dbt_fusion_postgres_adapter/,2025-12-20 15:16:29,2025-12-22 01:52:23
1pqzhsw,iceberg-loader,ivanimus,dataengineering,"Just released my first Python package on PyPI iceberg-loader! The gist: everyone's shifting to data lakes with Iceberg for storage these days. My package is basically a wrapper around PyIceberg, but with a much handier API it auto-converts that messy JSON you often get from APIs (like dicts/lists) into proper Iceberg structures. Plus, it handles big datasets without hogging memory.It's still in beta, I'm testing it out, but overall it's running reliably. Yeah, I built it with LLM help would've taken me half a year otherwise. But linters, tests, and checks are all there.It also plays nice natively with PyArrow data. Right now, I'm prepping a test repo with examples using Dagster + ConnectorX + iceberg-loader. Should end up as a fast open-source data loader since everything runs on Arrow.Would love if any devs take a look with their experienced eye and suggest improvements or feedback.https://github.com/vndvtech/iceberg-loader",3,1.0,0,https://www.reddit.com/r/dataengineering/comments/1pqzhsw/icebergloader/,2025-12-19 23:32:16,2025-12-22 01:52:23
1pqncik,Help with Deciding Data Architecture: MySQL vs Snowflake for OLTP and BI,khushal20,dataengineering,"Hi folks,I work at a product-based company, and we're currently using an RDS MySQL instance for all sorts of things like analysis, BI, data pipelines, and general data management. As a Data Engineer, I'm tasked with revamping this setup to create a more efficient and scalable architecture, following best practices.I'm considering moving to Snowflake for analysis and BI reporting. But I’m unsure about the OLTP (transactional) side of things. Should I stick with RDS MySQL for handling transactional workloads, like upserting data from APIs, while using Snowflake for BI and analysis? Currently, we're being billed around $550/month for RDS MySQL, and I want to know if switching to Snowflake will help reduce costs and overcome bottlenecks like slow queries and concurrency issues.Alternatively, I’ve been thinking about using Lambda functions to move data to S3 and then pull it into Snowflake for analysis and Power BI reports. But I’m open to hearing if there’s a better approach to handle this.Any advice or suggestions would be really appreciated!",2,0.67,19,https://www.reddit.com/r/dataengineering/comments/1pqncik/help_with_deciding_data_architecture_mysql_vs/,2025-12-19 15:05:28,2025-12-22 01:52:23
1pparqo,"Thoughts on proposed ADLS, Dagster, delta-rs, polars, DBX stack?",SoloArtist91,dataengineering,"Context:We have an old MSSQL Server on prem + Alteryx for orchestration/transformations + Tableau server for visualizations. Our data ""team"" is basically just me, plus my manager and coworker - both of whom are mostly comfortable just with data visualization in Tableau. Our data comes in from various vendors (20+) in the form of flat files in SFTPs or API endpoints. Nothing overly crazy, no streaming, no more than 1-2 GB over the course of a day.While Alteryx has been ""good enough"" the last 10 years, their rapidly rising costs has led us to research various options at how we can modernize our data stack and keep costs low. My manager has given me free reign to research various options and come up with a plan that we can execute over 2026, just with the understanding that our company has a footprint in Azure, so I shouldn't branch out to AWS or GCP for example.Proposal:+ Azure Blob Storage to ingest and store all our vendors' files and data on a daily/hourly basis+ Dagster+ (hybrid) for orchestration+ Deltalake tables created/updated in blob storage for staging, warehouse, and marts layers using delta-rs and polars for transformations+ For serving to BI tools, use external tables in a Databricks SQL warehouse pointed to delta tables+ Keep Tableau as is, reduce our need for Alteryx over time to just last mile transformations/adhoc analysis for my other team membersOther considerations:+ DBT: I did some of their courses and tried to recreate an existing pipeline using dbt-core orchestrated by Dagster and it seemed overkill for my purposes. Everything I liked in it was already covered by Dagster, such as data lineage, testing, and the features that might be nice require cloud. I'm also more comfortable writing transformations in Python rather than SQL.+ Table maintenance: I'm aware that external tables are not managed by DBX and it's on me to manage the tables manually (optimize/vacuum). I figure I can set up a script that runs once a month or something to automatically do it.+ Why delta-rs? Again, we don't have overly complex data needs or sizes that require Spark computing costs. Our machines are perfectly capable of handling the compute requirements that we need. If we get to ML models down the road, then I'd probably run those in DBX notebooks and rely on their computing power.Has anyone else ran a similar design before? Any pitfalls or limitations to be aware of?",5,0.86,10,https://www.reddit.com/r/dataengineering/comments/1pparqo/thoughts_on_proposed_adls_dagster_deltars_polars/,2025-12-17 22:54:11,2025-12-22 01:52:23
1poptli,Automated notifications for data pipelines failures - Databricks,szymon_abc,dataengineering,"We have quite a few pipelines that ingest data from various sources, mostly OLTPs, some manual files and of course beloved SAP. Of course sometimes we receive shitty data on Landing which breaks the pipeline. We would like to have some automated notification inside notebooks to mail Data Owners that something is wrong with their data. Current idea is to have a config table with mail addresses per System-Region and inform the designated person about failure when exception is thrown due to incorrect data, or e.g. something is put into rescued\_data column.Do you guys have experience with such approach? What's recommended, what not?",3,0.72,11,https://www.reddit.com/r/dataengineering/comments/1poptli/automated_notifications_for_data_pipelines/,2025-12-17 06:46:59,2025-12-22 01:52:23
1po53tz,Mike Stonebraker and Andy Pavlo: DB & AI 2025 Year in Review,rmoff,dataengineering,No content,4,0.71,0,https://www.youtube.com/watch?v=RnQKluxWB5Y,2025-12-16 15:40:35,2025-12-22 01:52:23
1pna9pv,Azure Data Factory Pipeline Problems -- Copy Metadata (filename & lastmodified) of blob file to the sql table,Puzzleheaded-Car-647,dataengineering,"I only worked for the new company for 2 weeks and am still a newbi to data industry. Please give some advice.I was trying to copy a csv file from blob storage to azure sql database using pipeline in azure data factory, the table in azure sql database has 2 more columns than the csv file which are the timestamp that the csv files uploaded into blob and filename, is that possible to integrate this step into the pipeline?So far what I did is first GetMetadata and the output showed both itemName and LastModified. ( the 2 columns I want to copy to sql table), then I used copy activity, in the source I used additional columns to add these 2 columns but it didn't work and then I created a dataflow trying to derived these 2 columns, but there are som issues, can anyone help with  configuration of parameters or have a better  idea?",5,0.86,2,https://www.reddit.com/r/dataengineering/comments/1bhnh1m/azure_data_factory_use/,2025-12-15 15:31:46,2025-12-22 01:52:23
1pmwfqj,Snowflake Core/Platform Certification.,sumesan,dataengineering,Anybody know of any resources or trainings to study for this ?Also if anyone has given this exam and has some kind of question bank available ?Appreciate any help :folded_hands:,3,0.81,3,https://www.reddit.com/r/dataengineering/comments/1pmwfqj/snowflake_coreplatform_certification/,2025-12-15 02:44:51,2025-12-22 01:52:23
1prcir3,Anyone using Talend 8 on-prem to build SOAP / REST services? How does it scale?,GarpA13,dataengineering,"I’m currently working with Talend 8 on-premises and using it to expose SOAP and REST web services (mainly DB-backed services via ESB / Runtime).I’d like to understand if others here are using Talend in a similar way and get some real-world feedback.Specifically:Are you using Talend to build and expose SOAP and/or REST APIs in production?Which components / approach are you using (ESB Provider, REST Jobs, Karaf runtime, etc.)?How is the scalability of the platform in your experience?Concurrent requestsHorizontal scalingStability under loadAny lessons learned, limitations, or best practices would be really appreciated.",2,0.76,3,https://www.reddit.com/r/dataengineering/comments/1prcir3/anyone_using_talend_8_onprem_to_build_soap_rest/,2025-12-20 11:45:30,2025-12-22 01:52:23
1pqnml4,Director and staff engineers,educationruinedme1,dataengineering,How do you manage your projects and track the work. Assuming you will have multiple projects/products and keeping a track of them can be cumbersome. What are ways/tools that have helped you in managing and keeping track of who is doing what ?,2,0.67,4,https://www.reddit.com/r/dataengineering/comments/1pqnml4/director_and_staff_engineers/,2025-12-19 15:16:59,2025-12-22 01:52:23
1pp8t3o,My first pipeline: how to save the raw data.,faby_nottheone,dataengineering,"Hello beautiful commumity!I am helping a friend set a database for analytics.I get the data using a python request (json) and creating a pandas dataframe then uploading the table to bigquery.Today I encountered a issue and made me think...Pandas captured some ""true"" values (verified with the raw json file) converred them to 1.0 and the upload to BQ failed because it expected a boolean.Should I save the json file im BQ/google cloud before transforming it? (Heard BQ can store json values as columns)Should I ""read"" everything as a string and store it in BQ first?I am getting the data from a API. No idea if it will chsnge in the future. Its a restaurant getting data from uber eats and other similar services. This should be as simple as possible, its not much data and the team is very limited.",2,0.67,11,https://www.reddit.com/r/dataengineering/comments/1pp8t3o/my_first_pipeline_how_to_save_the_raw_data/,2025-12-17 21:34:27,2025-12-22 01:52:23
1pp60u0,Career stack choice : One premise vs Pure cloud vs Databricks ?,_Marwan02,dataengineering,"Hello, My 1) question is : Does not working in the cloud (AWS / Azure / GCP) or on a modern platform such as Databricks penalize a profile on today’s job market ? Should I avoid applying to job with an on premise stack ?I am working (and only worked for 5 years) on an old on premise data stack (cloudera). And I am very often rejected because of my lack of exposure on public cloud or Databricks.But after a lot of research : One company (Fortune 500 Insurance) offered me a position (still in the process but I think they wil take me) where I will be working on a pure Azure data stack. (they just migrated to azure) However, my current company (Major UE bank) offer me an oportunity to move to an other team and work on migrating informatica workflow to databricks on AWS. My 2) question is : What is the best carreer choice ? Pure Azure stack or Databricks ? Thanks in advance.",1,0.57,8,https://www.reddit.com/r/dataengineering/comments/1pp60u0/career_stack_choice_one_premise_vs_pure_cloud_vs/,2025-12-17 19:44:14,2025-12-22 01:52:23
1pp43so,Sanity Check - Simple Data Pipeline,jackielish,dataengineering,"Hey all!I have three sources of data that I want to Rudderstack pipeline into Amplitude. Any thoughts on this process are welcome!I have a 2000s-style NetSuite database that has an API that can fetch customer data from an in-store purchase, then I have a Shopify instance, then a CRM. I want customers to live in Amplitude with cleaned and standardized data. The Flow:CRM + NetSuite + ShopifyDATA STANDARDIZED ACROSS AMPLITUDE FINAL DESTINATIONProblem 1: Shopify's API with Rudderstack sends all events, so off the bat, we are spending 200/month. Any suggestion for a lower-cost/open-source solution? Problem 2: Is Amplitude enough? Should we have a database as well? I feel like we can get all of our data from Amp, but I could be wrong. I read the Wiki and could not find any solutions, any feedback welcomed. Thanks!",2,1.0,3,https://www.reddit.com/r/dataengineering/comments/1pp43so/sanity_check_simple_data_pipeline/,2025-12-17 18:29:52,2025-12-22 01:52:23
1povjsa,Need help regarding migrating legacy pipelines,arthurdont,dataengineering,"So I'm currently dealing with a really old pipeline where it takes flat files received from mainframe -> loads them to oracle staging tables-> applys transformations using pro C -> loads final data to oracle destination tables. To migrate it to GCP, it's relatively straight forward till the part where I have the data loaded into in my new staging tables, but its the transformations written in Pro C that are stumping me.It's a really old pipeline with complex transformation logic that has been running without issues for 20+ years, a complete rewrite to make it modern and friendly to run in GCP feels like a gargantuan task with my limited time frame of 1.5 months to finish it. I'm looking at other options like possibly containerizing it or using bare metal solution. I'm kinda new to this so any help would be appreciated! I",2,0.67,7,https://www.reddit.com/r/dataengineering/comments/1povjsa/need_help_regarding_migrating_legacy_pipelines/,2025-12-17 12:41:19,2025-12-22 01:52:23
1por4wa,Data VCS,cmcclu5,dataengineering,"Folks, I’m working on a data VCS similar to Git but for databases and data lakes. At the moment, I have a headless API server and the code to handle PostgreSQL and S3 or MinIO data lakes with plans to support the other major databases and data lakes, but before I continue, I wanted community feedback on whether you’d find this useful.The project goal was to make a version of Git that could be used for data so that we data engineers wouldn’t have to learn a completely new terminology. It uses the same CLI for the most part, with init, add, commit, push, etc. The versioning control is operations-based instead of record- or table-based, so it simplifies a lot of the branch operations. I’ve included a dedicated ingestion branch so it can work with a live database where data is constantly ingested via some external process. I realize there are some products available that do something moderately similar, but they all either require learning a completely new syntax or are extremely limited in capability and speed. This allows you to directly branch on server from an existing database with approximately 10% overhead. The local client is written in Rust with PyO3 bindings to interact with the headless FastAPI server backend when deployed for an organization. Eventually, I want to distribute this to engineers and orgs, but this post is primarily to gauge interest and feasibility from my fellow engineers. Ask whatever questions come to mind, bash it as much as you want, tell me whatever comes to mind. I have benefited a ton from my fellow data and software engineers throughout my career, so this is one of the ways I want to give back.",2,0.67,6,https://www.reddit.com/r/dataengineering/comments/1por4wa/data_vcs/,2025-12-17 08:09:28,2025-12-22 01:52:23
1pn52fo,Scala case class does have limit for field,Historical-Ant-5218,dataengineering,Scala case class does have limit for fieldJoinTechnical DoubtI tried to define case class with 80 field got error in spark shell. Java.lang.stackoverflowSome say there no limits but any way to resolve this issue.,2,0.63,3,https://www.reddit.com/r/dataengineering/comments/1pn52fo/scala_case_class_does_have_limit_for_field/,2025-12-15 11:27:45,2025-12-22 01:52:23
1pr30pz,"Finding out there is a lot more to tech than just ""Frontend vs Backend""",daniel_odiase,learnprogramming,"I have been working with Python for about 5 years now, and for most of that time, I was stuck in a bit of a bubble. I assumed the career path was basically just moving from junior to senior backend roles, building APIs and scaling web services. It felt like the industry was 90% CRUD apps and centered around the same few ""cliché"" frontend and backend frameworks.Recently, I started looking into Quant Finance, and it has been a total eye-opener. It is a completely different world where the problems aren't about HTTP requests or CSS; they are about high-frequency execution, mathematical modeling, and processing massive amounts of data in real-time. It made me realize how many deep technical niches we completely ignore because they aren't as ""loud"" as web development.I wanted to share this because if you are starting to feel a bit burnt out or bored with standard web stacks, I really encourage you to look at these non-obvious fields. Whether it is Quant, Embedded Systems, or Bio-informatics, there are rabbit holes out there that are way more technically challenging than the standard paths. I spent years thinking I had seen most of what the industry had to offer, but I am finding out I was barely scratching the surface of what we can actually do with code.",344,0.96,51,https://www.reddit.com/r/learnprogramming/comments/1pr30pz/finding_out_there_is_a_lot_more_to_tech_than_just/,2025-12-20 02:19:58,2025-12-22 01:52:24
1pnuj7k,"Is multithreading basically dead now, or is async just the new default for scaling?",Wash-Fair,learnprogramming,"Lately, it feels like *everything* is async-first - async/await, event loops, non-blocking I/O, reactive frameworks, etc. A lot of blogs and talks make it sound like classic multithreading (threads, locks, shared state) is something people are actively trying to avoid.So I’m wondering:* Is multithreading considered “legacy” or risky now?* Are async/event-driven models actually better for most scalable backends?* Or is this more about developer experience than performance?I’m probably missing some fundamentals here, so I’d like to hear how people are thinking about this in real production systems.",326,0.9,125,https://www.reddit.com/r/learnprogramming/comments/1pnuj7k/is_multithreading_basically_dead_now_or_is_async/,2025-12-16 06:01:23,2025-12-22 01:52:24
1pqn9jd,"My Python farming game has helped lots of people learn how to program! As a solo dev, seeing this is so wholesome.",AdSad9018,learnprogramming,"Program a drone using a simple python-like language to fully automate various farming tasks that would otherwise be very grindy. Feel the satisfaction of simply pressing ""execute"" and watching your drone do all the hard work.Unlike most programming games the game isn't divided into distinct levels that you have to complete but features a continuous progression.Farming earns you resources which can be spent to unlock new technology.Programming is done in a simple language similar to Python. The beginning of the game is designed to teach you all the basic programming concepts you will need by introducing them one at a time.While it introduces everything that is relevant, it won't hold your hand when it comes to solving the various tasks in the game. You will have to figure those out for yourself, and that can be very challenging if you have never programmed before.If you are an experienced programmer, you should be able to get through the early game very quickly and move on to the more complex tasks of the later game, which should still provide interesting challenges.Although the programming language isn't exactly Python, it's similar enough that Python IntelliSense works well with it. All code is stored in .py files and can optionally be edited using external code editors like VS Code. When the ""File Watcher"" setting is enabled, the game automatically detects external changes.Hope you like the coding game concept! :)You can find it here:  [https://store.steampowered.com/app/2060160/The\_Farmer\_Was\_Replaced/](https://store.steampowered.com/app/2060160?utm_source=RD)",265,0.96,30,https://www.reddit.com/r/learnprogramming/comments/1pqn9jd/my_python_farming_game_has_helped_lots_of_people/,2025-12-19 15:01:59,2025-12-22 01:52:24
1pn8rvc,How do attackers use SQL injections,Opposite_Second_1053,learnprogramming,"I'm confused how do malicious actors use SQL injections on an application when in order to access a database you need to authenticate to it? how are they able to get data returned from a database with their query if they are not an authenticated user to the database? and how would they even know what to inject into the SQL database to get what they want, are they just trying anything to get something back? this is purely educational because I honestly don't understand it?",227,0.95,64,https://www.reddit.com/r/learnprogramming/comments/1pn8rvc/how_do_attackers_use_sql_injections/,2025-12-15 14:31:01,2025-12-22 01:52:24
