id,title,author,subreddit,content,score,upvote_ratio,num_comments,url,created_utc,extracted_at
1sz6al8,"Bombed the final question of a React technical discussion, looking for feedback",skyturnsred,cscareerquestions,"I'm a senior full stack developer at a consulting firm, and have about 15 years of experience. Almost all of the clients I've worked with have used React, and I'm extremely comfortable using it and know it fairly deeply.This was a 30 minute discussion, and I felt really comfortable with my answers and he seemed pretty positive on how it was going. Then, I got hit with the curveball that I felt like broke the interview.It started with him asking a simple question: ""how would you manage state across components?"" I gave him multiple answers (\`useState\`, \`useContext\`, third party libraries, Tanstack Query, etc) and he liked that. He then asked ""what if you didn't have React and had no access to third party libraries?""This tripped me up bad. My first thought was either some sort of state object or firing events off, but I was so caught off guard that my confidence faltered and I could not articulate on the spot how that would look. He then described their solution in more detail (using CustomEvent is primarily how they do it) and said that they work with a lot of Web Components, which is why it was asked. For clarity, I double checked, and there was no mention of this in the job description - the only mentions of frontend is your usual NextJs/Tailwind/Tanstack/etc mentions.Is this approach to state management in vanilla JS common knowledge among developers who learned front end through these frameworks? I was surprised because up until that point, I was really feeling good with my answers. I'm going to brush up on my Web Component knowledge now, but I have never had to work with them in my entire career. It has always been through some sort of framework.",96,0.96,37,https://www.reddit.com/r/cscareerquestions/comments/1sz6al8/bombed_the_final_question_of_a_react_technical/,2026-04-29 17:54:47,2026-05-02 02:48:13
1sw03iv,"In 2026, should I study software engineering or electrical engineering?",raydditor,cscareerquestions,"I am interested in CSE and SWE but this subreddit is making me nervous about picking these options. Should I move to electrical or mechanical instead? Is the future really that bad? Will software engineers not exist in a few decades?Basically, is software engineering dead?",82,0.81,159,https://www.reddit.com/r/cscareerquestions/comments/1sw03iv/in_2026_should_i_study_software_engineering_or/,2026-04-26 06:46:19,2026-05-02 02:48:13
1t04m3q,"2 weeks notice leads to counteroffer, dont know what to do next",the-dasdardly-puppet,cscareerquestions,"I recently gave two weeks notice at my company, thinking it would be a clean exit. I need to move to a city without an office, and I accepted another offer that’s higher pay and fully remote.Then my boss begged me to stay, saying I’m the best on the team and promising a promotion. She even suggested she could get me remote work and higher pay, which seemed impossible under corporate policy. Then my current company astonishingly made a counteroffer: a bit more money than I said was the bar to staying and fully remote.My current team is good and hours are reasonable, but I don’t like the leadership or company direction. The new company has mixed reviews, the lines “we’re a family” came up during an interview which is a red flag, and my future team could be worse. Comparatively, my current company is rated worse than the new company on sites like glassdoor. I also worry that trying to leave once might make me a target in a layoff.What's a good course of action here and other things I should consider?",78,0.92,43,https://www.reddit.com/r/cscareerquestions/comments/1t04m3q/2_weeks_notice_leads_to_counteroffer_dont_know/,2026-04-30 18:26:01,2026-05-02 02:48:13
1szcj1u,"If your only offer had a 2-hour commute, would you take it?",Intelligent_Ebb_9332,cscareerquestions,Recently got an offer for a cloud SWE job but if I want to be in a decent area the commute is 2 hours away. I’ve applied to over 1300+ jobs and this is the only decent offer I’ve gotten. What would you do in my situation?Edit: It’s in Yuma AZ so really not my ideal location. There’s not much to do. I don’t do much now but it’s nice knowing I could do something if I wanted to.,78,0.65,268,https://www.reddit.com/r/cscareerquestions/comments/1szcj1u/if_your_only_offer_had_a_2hour_commute_would_you/,2026-04-29 21:39:15,2026-05-02 02:48:13
1sxs0ra,What are some good things to do while being unemployed?,VariationLivid3193,cscareerquestions,I have been unemployed for a few months and i think it will take another year or so.what are some good things to do to spend time?,68,0.97,42,https://www.reddit.com/r/cscareerquestions/comments/1sxs0ra/what_are_some_good_things_to_do_while_being/,2026-04-28 05:18:45,2026-05-02 02:48:13
1szulao,"Do developers in your company openly use AI tools in an open-space office, or does it feel more like a taboo?",Ok-Nature7613,cscareerquestions,The title,57,0.77,125,https://www.reddit.com/r/cscareerquestions/comments/1szulao/do_developers_in_your_company_openly_use_ai_tools/,2026-04-30 12:25:12,2026-05-02 02:48:13
1sw2jyh,What do you think is making your impact invisible?,SomeRandomCSGuy,cscareerquestions,"I have seen so many software engineers working their ass off but their impact is just not visible enough even if they are delivering great work and constantly upskilling, which leads to lost opportunities.have you experienced this yourself too?",53,0.87,20,https://www.reddit.com/r/cscareerquestions/comments/1sw2jyh/what_do_you_think_is_making_your_impact_invisible/,2026-04-26 09:07:12,2026-05-02 02:48:13
1svuo1f,Zero references / zero friends,SomeIngenuity1957,cscareerquestions,"So I might be screwedI've worked professionally for 6 years, 2 in health care IT and then 4 at a big name insurance companyI didn't really do a good job making friends at either of these places and am thinking I might have burned too many bridges and I'm genuinely not sure if I'll ever be able to get a job in tech again because I have absolutely zero self confidence in myself and no one who can speak for my abilitiesI've been out of work for 6 months now after voluntarily resigning due to a toxic workplace where I was bullied on a daily basis and had absolutely no help from HR. My life is a sad hopeless shell of what it used to be and I feel so alone and empty because I have no one to talk to or anyone who even remembers me from before all of this happenedSo yeah... how cooked am I?",48,0.87,25,https://www.reddit.com/r/cscareerquestions/comments/1svuo1f/zero_references_zero_friends/,2026-04-26 02:05:21,2026-05-02 02:48:13
1sz0mp4,"Engineers who've been passed over for a promotion, was it clear what you were missing?",LavishnessFormer7843,cscareerquestions,"I am a mid-level engineer and I have noticed that at most companies, the criteria for getting promoted are frustratingly vague. ""Demonstrates senior-level impact"" or ""shows technical leadership"", but no one tells you exactly what that means or how to prove it. It is not objectiveI have seen equally talented engineers get different promo outcomes because one had a better manager or knew how to ""sell"" their work better during perf cycles.Curious:\- At your company, are promo criteria clearly defined and measurable?\- Have you ever been told you're ""not ready"" without a concrete explanation of what's missing?\- Would it help to have an objective method that maps your work against your company's level framework and shows you exactly which gaps to close?Genuinely trying to understand if this is a widespread problem or just my experience.",47,0.93,45,https://www.reddit.com/r/cscareerquestions/comments/1sz0mp4/engineers_whove_been_passed_over_for_a_promotion/,2026-04-29 14:35:02,2026-05-02 02:48:13
1syrnya,"For those of you who haven’t bought a farm yet, what’s your actual plan?",eufemiapiccio77,cscareerquestions,"For those of you who haven’t bought a farm yet, what’s your actual plan?",46,0.76,81,https://www.reddit.com/r/cscareerquestions/comments/1syrnya/for_those_of_you_who_havent_bought_a_farm_yet/,2026-04-29 07:23:49,2026-05-02 02:48:13
1t0oti8,Is desktop development dying?,DeathnTaxes66,cscareerquestions,"Title. I like to make apps using WPF, Avalonia, etc. But, looking at how every job offered near me is just React native or web UI. Is this just a temporary trend or the future?",42,0.91,47,https://www.reddit.com/r/cscareerquestions/comments/1t0oti8/is_desktop_development_dying/,2026-05-01 09:48:42,2026-05-02 02:48:13
1t17st6,Offer eval bloomberg vs visa,WoodpeckerPatient723,cscareerquestions,"Role: senior software engineer Bloomberg: Location NYC Salary: approx 250k (yet to be negotiated)Visa Location Austin Salary: approx 160k (yet to be negotiated)Is it worth joining Bloomberg with high cost of living,taxes and commute.My main preference is WLB and layoff-safe",33,0.86,49,https://www.reddit.com/r/cscareerquestions/comments/1t17st6/offer_eval_bloomberg_vs_visa/,2026-05-01 22:19:01,2026-05-02 02:48:13
1t00wb2,"For those of you who have recently landed a job, what do you think did it?",Meta_Man_X,cscareerquestions,Would love to hear some success stories and gather insight into what strategies or tips people think have helped them land a new job.,33,0.95,38,https://www.reddit.com/r/cscareerquestions/comments/1t00wb2/for_those_of_you_who_have_recently_landed_a_job/,2026-04-30 16:13:37,2026-05-02 02:48:13
1szdf3g,What’s the general etiquette for PRs?,airpAth0929,cscareerquestions,"Whenever I make a PR and ask my team on slack to ask reviews, I usually get nothing. I’ve resorted to hunting down a few members who’re likely to respond quickly for reviews so I can get them approved and merged. Sometimes they request changes, which I get done pretty quickly, and let them know the PR has been updated and is ready for review. If they don’t respond within a couple hours, is it impolite to @ them again?",29,0.95,20,https://www.reddit.com/r/cscareerquestions/comments/1szdf3g/whats_the_general_etiquette_for_prs/,2026-04-29 22:13:38,2026-05-02 02:48:13
1syjj35,What’s it like working at quant firm?,No-Sink2428,cscareerquestions,"I’ve accepted a role in one of the big quant firms, which is not something I actively sought out, and I have very little idea of what to expect.My background is in big tech, and my role is (very) niche, so I’m hesitant to dox myself. It’s more on the engineering side though.What I’m wondering is if there’s anything you wish you’d known before joining a firm?Like, I have some expectations:\- Longer hours\- Lower engineering quality\- More cutthroat (in places)But the only thing I know for sure is that my pay-check is quite a bit higher.Any wisdom would be appreciated — particularly from people that have made a similar transition.",31,0.86,8,https://www.reddit.com/r/cscareerquestions/comments/1syjj35/whats_it_like_working_at_quant_firm/,2026-04-29 00:43:25,2026-05-02 02:48:13
1t17bg8,"I loved coding since I was a kid and now I am a CS major, LLMs make me depressed even if they won’t replace me",patternOverview,cscareerquestions,"i am now in my third semester (bachelors) and really enjoy all thr courses and writing every line of code by myself, but to think that in a job I won’t be writing code manually most of the time, that the algorithms and fun problems I used to enjoy since I was in high school and before are no longer really a part of the job (atleast not as much) makes me feel sad and sometimes demotivated its just a rant really, i know it won’t replace me, but i don’t want to be talking to an AI to do the fun part, also even if for personal projects and stuff it feels different when i used to write code that i had no other option but to write versus now when i feel like im doing something the ineffecient way and it makes the reward feel less than when it used to be the only wayDoes anyone feel the same",27,0.8,18,https://www.reddit.com/r/cscareerquestions/comments/1t17bg8/i_loved_coding_since_i_was_a_kid_and_now_i_am_a/,2026-05-01 21:59:41,2026-05-02 02:48:13
1t0uftb,Advice on entering a project where team uses AI for 99% of the UI and 70% of the back-end,tronybot,cscareerquestions,"I am a dev with 6 years of experience. Just recently entered this project at my company where my co-workers heavily rely on AI for all of the UI parts, and for the back-end. The architecture is MVC but basically the only part of the project that has little AI usage is the DB design. I am struggling a bit because this is my first time working with AI agents at this scale. When I ask my co-workers for reasoning on design decisions for models and views, the answers are ""I just asked Codex to do it in a similar way to what has already been done.""I feel like the cognitive debt is very high already and I would like to not keep adding to it, but at the same time I don't know how I could go about implementing things differently without breaking the consistency that the AI driven development approach has already established. My current approach is to try and document the architecture of the project so that I can get a broader picture and slowly start diverging away from full AI implementations. Any other ideas or advice?",24,0.82,26,https://www.reddit.com/r/cscareerquestions/comments/1t0uftb/advice_on_entering_a_project_where_team_uses_ai/,2026-05-01 14:07:02,2026-05-02 02:48:13
1swxakd,"Did someone ever get a job or even a first call through LinkedIn ""Easy apply""?",Ok_Silver3112,cscareerquestions,"I have applied over 100 jobs in the past month and 60-70% were easy apply, never heard anything from them, not even one call, just pure rejections the next morning. PS: I am looking for software dev. jobs",25,0.96,29,https://www.reddit.com/r/cscareerquestions/comments/1swxakd/did_someone_ever_get_a_job_or_even_a_first_call/,2026-04-27 08:07:14,2026-05-02 02:48:13
1swgzfd,Trouble coding on my free time.,Tasty_Croissants,cscareerquestions,"Hello, so for some context, I'm a second-year computer science student, and I really love coding; it feels like my thing. I'm also genuinely interested in space, science in general, etc., etc. The problem I'm having is that I'm constantly stressing over my future unemployment due to the lack of any relevant projects on my GitHub, for example, and it isn't that I don't want to code; it's more that most of the time I'm already studying for university really hard, so when I do have a little spare time, all I want to do is play video games to relax myself, not break my head over coding. This has been a real source of stress for me, because I love this field and I know that the market is really hard currently, and (from what I've been told) unless you're a remarkable coder, you'll have a hard time finding a decent job. I just need advice on this, or just to know if maybe I'm just breaking my head over nothing and everything will be fine. Everyone in uni seems to already have a LinkedIn and cool things going on, and I simply have nothing, and I feel horrible because of it. It feels like I won't achieve anything.Any advice is appreciated.",22,0.85,47,https://www.reddit.com/r/cscareerquestions/comments/1swgzfd/trouble_coding_on_my_free_time/,2026-04-26 19:25:57,2026-05-02 02:48:13
1t14wib,"If you were making 60k, would you consider a dev job at a crypto trading firm?",Legitimate-School-59,cscareerquestions,"you are currently making 60k.new crypto dev job would be 120k minimum. its a start up, so assume long hours. worried about the stability and getting a job hopper stamp on my resume if I get laid off shortly.",23,0.78,34,https://www.reddit.com/r/cscareerquestions/comments/1t14wib/if_you_were_making_60k_would_you_consider_a_dev/,2026-05-01 20:25:55,2026-05-02 02:48:13
1t0scb4,Are developers who understand users (and a bit of marketing) actually more valuable than “pure” coders?,BoysenberryLumpy8680,cscareerquestions,"I’ve been noticing that some developers focus only on writing clean code, while others think more about users, product impact, and even basic marketing.In your experience, which type actually grows faster or gets better opportunities and why?",22,0.82,26,https://www.reddit.com/r/cscareerquestions/comments/1t0scb4/are_developers_who_understand_users_and_a_bit_of/,2026-05-01 12:42:16,2026-05-02 02:48:13
1sz6s9n,Should I Go Into Retail Or Stick With Python Upskilling?,Wrong-Section-8175,cscareerquestions,"Hi everyone,My name is Philip. I have a math degree from 2008. I had a very severe mental health problem that I'm just coming out of. In 2010-2011, I worked briefly as a computer programmer. I have always been good at programming things, and have coded in C++ since I was 12.Coming out of my mental health thing, I'm finding that it's very difficult to get a job. Could someone who knows the ropes these days tell me if it is at all realistic to try to go with the following plan?...: 1) ""Upskill"" or whatever and teach myself Python/Django/SQL from internet resources, 2) Create 5 well-done portfolio projects in Python/Django/SQL--I decided on, an app that plays chess (with good AI), a poker app (with bad AI), a simple ed-tech website that lets users post ""courses"" with quizzes and text-lecture-slides and also take others' posted courses, a ""request for patents"" web directory where corporate users with corporate email addresses can post patents their firm would pay for and other users can browse those patents and comment, and a simple social app that has chat rooms and different ""admin privileges"" for users who run different groups--3) Build a good resume and write a solid cover letter and try to get junior Python jobs in Houston, TX, where I currently live or remote jobs.Is my attempted foray back into professional computer programming a waste of time? Should I just get a job in retail and try to work my way up to manager? What do you think the best course of action is for me, and is there any amount of additional learning and/or projects that I could do that would get me taken seriously by employers again?Thanks for any help anyone can provide!",23,0.83,25,https://www.reddit.com/r/cscareerquestions/comments/1sz6s9n/should_i_go_into_retail_or_stick_with_python/,2026-04-29 18:11:30,2026-05-02 02:48:13
1synlsg,Do you guys stay in touch with your college mates?,VariationLivid3193,cscareerquestions,I used to think i will stay in touch with them for a lifetime but they don't even have time to talk?,21,0.8,32,https://www.reddit.com/r/cscareerquestions/comments/1synlsg/do_you_guys_stay_in_touch_with_your_college_mates/,2026-04-29 03:49:22,2026-05-02 02:48:13
1swtgkm,I think reasonably XD / Frontend are next on the chopping board,Typical-Carrot-5997,cscareerquestions,"I'm with a F500. My employer contracted with an AI vendor and I was asked to do an eval. I gave a report to a bunch of executives and they kept me in the call while they discussed logistics. Their main concern wasn't how can we cut ppl / save money but rather how can we deliver faster. What it ended up boiling down to was that the business strategy / design arms of the company were now the bottleneck in the delivery process... and it slowly unfolded into ""how can we shift their responsibilities into SWE"".",17,0.62,30,https://www.reddit.com/r/cscareerquestions/comments/1swtgkm/i_think_reasonably_xd_frontend_are_next_on_the/,2026-04-27 04:33:50,2026-05-02 02:48:13
1svdqyl,Should i take a fully remote job at a small company?,No-Start9143,cscareerquestions,"Im a junior with 1yr experience at a midsized company working fully onsite. I was referred by a friend to this small fully remote company that has like 30 employees. The company is offering me better pay and ofcourse fully remote plus more job responsibilities and direct client handling all by myself. Also my friend swears that the work culture is great and work life balance is good. Im just worried about 2 things. First is that its a very small pretty unknown company. Second is that the job is remote and im not sure if that can have a negative impact on my career, im not against remote, im just worried it could be bad for my career. What do you guys think?Also the pay is neary 50% more (i am severly underpaid at my current company).",19,0.83,21,https://www.reddit.com/r/cscareerquestions/comments/1svdqyl/should_i_take_a_fully_remote_job_at_a_small/,2026-04-25 14:31:12,2026-05-02 02:48:13
1syufxd,What feature or improvement did you add to your code base that made your life infinitely better?,ryanjusttalking,cscareerquestions,I've been thinking about adding in some more robust error handling and routing and it got me wondering about what others might have done.,16,0.95,10,https://www.reddit.com/r/cscareerquestions/comments/1syufxd/what_feature_or_improvement_did_you_add_to_your/,2026-04-29 10:05:37,2026-05-02 02:48:13
1sxezqv,How to handle experience deep dives as a sr engineer?,Intelligent-Pay-9377,cscareerquestions,"I’m a senior SWE and have been for a while, but sometimes I run into interviews that make me feel underqualified.At big tech companies I’ve worked on well-defined parts of big systems (e.g., ads auction logic—grouping, pricing, experimentation). I can go deep in my area but I haven’t been in one place long enough to own an entire end-to-end system or every adjacent component.In interviews, I’ll get questions along the lines:* “What database stores the ads candidates?”* “How does the CI/CD system work internally?”* “How is A/B testing orchestrated end-to-end?”* “Are ads candidates streamed, queued (Pub/Sub), or pulled? What are the latencies?”* “What are the upstream/downstream bottlenecks?”At my jobs, those pieces were owned by other teams and abstracted behind services. I can reason about them, but I don’t know the exact implementations. I try to explain that these are huge systems, sometimes monolithic that have hundreds if not thousands of contributors, but as you can imagine that does not go over well.Just curious how others handle this? If I could answer these questions I would be interviewing for staff or principal not senior. It feels a bit unfair to me, because you can trip literally anyone up when you ask really niche questions rapid fire like that. Maybe at one point I could have answered them but asking me about the exact implementation details of a system I worked on 4 years ago seems unreasonable. These are things I could easily answer if I had the code in front of me, and my own internal documentation, but unfortunately that's not how it works. Feels like a trivia game.",16,0.91,7,https://www.reddit.com/r/cscareerquestions/comments/1sxezqv/how_to_handle_experience_deep_dives_as_a_sr/,2026-04-27 20:04:14,2026-05-02 02:48:13
1sxabd7,Why do job boards send me emails of potential jobs that are definitely above my skill level and capabilities?,LivingwithGranny,cscareerquestions,"I'm sure this is google-able, but I prefer human answers from humans (the irony of seeing the post earlier about AI in this subreddit fear mongering us).I graduated with my bachelor's in CS last May. Got my resume on most of the job boards, have applied to lots of places for various things, entry level SWE, IT, DevOps, etc etc. Everyday, I get an email from LinkedIn, Dice, and wherever else of jobs that I'd ""be a good fit for"" or something like that.A *decent* portion of the jobs listed are **Senior Dev or 5+ years experience** jobs.I'm 31 and have 1 year of part-time experience as an IT Student at the university, 12 years in the army and national guard, and several other jobs in my adult life that aren't related... but nothing that says I would fit as a senior software dev. I do have some personal projects and school projects on my resume, though. What gives?",18,0.91,11,https://www.reddit.com/r/cscareerquestions/comments/1sxabd7/why_do_job_boards_send_me_emails_of_potential/,2026-04-27 17:22:05,2026-05-02 02:48:13
1t1asv6,How to survive in new Senior SWE role as someone with 1 year of experience 7 times,Wild-Yogurtcloset921,cscareerquestions,"So I have 7 years of experience at 5 small companies doing full stack development but in every single role except one I was at for a year before getting hired I did basically no real work and didn’t progress pass junior tasks much. Basically the definition of 1 year of experience X7.I lied in an interview and got a job at a decent company but it is on site. What are the top skills needed to survive in the new role as a Full stack Typescript dev long as possible in this era where coding seems to have become much easier due to new tools. I asked AI and it said API design and consumption and contracts, testing, git, SQL basics, state management, debugging,async/data flow",17,0.87,9,https://www.reddit.com/r/cscareerquestions/comments/1t1asv6/how_to_survive_in_new_senior_swe_role_as_someone/,2026-05-02 00:29:19,2026-05-02 02:48:13
