id,title,author,subreddit,content,score,upvote_ratio,num_comments,url,created_utc,extracted_at
1t0cqba,Switching into a role in Analytical Engineering from a Senior BI Consultant,prod_by_b,dataengineering,"Over the years in Consulting I been doing only Power BI work and wanted to change into Analytical Engineering and do something more challenging then building models and dashboards. I took a few beginner courses and I felt engaged and it was interesting to learn more about something new since I felt a bit stagnant in my current position. I'm looking for advice on where to improve, courses to take, and how difficult is the switch I have 6 YOE and live in the Bay Area. From my understanding the responsibilities of an Analytical Engineer are: 1.Transformation (dbt, airflow)[2.Data](http://2.Data) Warehouses (Snowflake, Big Query)\-I have experience in writing queries in SQL for mostly data validation. DE used queries I created to make tables where I source across multiple dashboards. 3.Validation? (Not sure what tool or processes should I understand, but I seen this listed in the course I'm taking)4.Versioning (Git, CI/CD Pipelines)I used Azure DevOps and created a branch, done pull request, and merge changes to the main branchAlthough, I some experiences in 1,4, I know I need to ramp up in everything so I can be confident in my skills.My current skillset Power BI (DAX, Power Query, Dataflows, RLS, Column Level Security, Paginated Reports, SSRS), SQL (Beginner-Intermediate) not sure how to evaluate, Data Modeling (creating dimensions in Power BI then making a star schema and Cardinality. In my previous client I was the project lead for 1.5 years and helped delicate task to the offshore team. I'm giving myself 5 months with about 8-12 hours a week of studying to switch roles. Is this an aggressive timeline? My current role I make around 130-135k with bonus is it realistic to find a role in the 155-160k range?",2,0.75,4,https://www.reddit.com/r/dataengineering/comments/1t0cqba/switching_into_a_role_in_analytical_engineering/,2026-04-30 23:36:35,2026-05-02 02:48:11
1sz7ylq,Looking for career input,SeaYouLaterAllig8tor,dataengineering,"I'm a data engineer (title is solution architect but realistically at least 50% of my job is hands on engineering) who's got probably roughly 12 years of experience. My current company (which I've been with almost 2.5 yrs now) has shifted from relying on tools like Snowflake, dbt, Fivetran and others to using Palantir Foundry primarily because our largest client has decided to take the next 2+ years to build a new client platform with Foundry. To be clear, we still use and maintain multiple Snowflake accounts, dbt pipelines, etc. But my role has shifted to learning Foundry so I can support the business in this initiative. I've gone from a consulting role (building new client data environments) to more of a product developer role.I've been approached by another company (much smaller company, a snowflake consulting shop) multiple times to come and join their team (I'm snowflake certified fyi). I'm kind of debating whether it's worth it long term to stay and continue learning Foundry or jump back into the consulting world doing Snowflake related work. My current company is very stable and my manager here is great, but I'm not sure if it would be to my advantage to jump back into the Snowflake world. People on this sub seem to hate Foundry... But putting it on LinkedIn immediately caught the attention of multiple recruiters so... Idk.",2,0.67,4,https://www.reddit.com/r/dataengineering/comments/1sz7ylq/looking_for_career_input/,2026-04-29 18:52:12,2026-05-02 02:48:11
1sxlqtl,"Do you treat canonical models as worth the effort, or as overdesign?",KieraRahman_,dataengineering,"I’m pretty biased toward canonical models, especially when multiple systems are involved, because they make integrations and reporting less chaotic later.But I also get why some teams feel they’re too abstract or too expensive upfront.Curious where people land on this now. Has a canonical model helped your team, or mostly created extra ceremony?",2,0.75,4,https://www.reddit.com/r/dataengineering/comments/1sxlqtl/do_you_treat_canonical_models_as_worth_the_effort/,2026-04-28 00:27:17,2026-05-02 02:48:11
1t0w63m,"Are all ""AI"" assisted tools just LLM wrappers?",neededasecretname,dataengineering,"I'm looking at PGEdge: [https://www.pgedge.com/download/ai-dba-workbench](https://www.pgedge.com/download/ai-dba-workbench) (postgres) Otto: [https://www.astronomer.io/product/otto/](https://www.astronomer.io/product/otto/) (airflow)And basically anyone else whose not OpenAI/GoogleWhat are the benefits of using these additional services instead of just doing it yourself with something like Claude Code and a 'skill', apart from their 'we trained on massive datasets'?",1,0.6,6,https://www.reddit.com/r/dataengineering/comments/1t0w63m/are_all_ai_assisted_tools_just_llm_wrappers/,2026-05-01 15:10:58,2026-05-02 02:48:11
1t03iq8,"a pet project, Costly , love to get feedback on this open source code",Federal-Wishbone-216,dataengineering,"Disclosure upfront: I built this. Looking for technical feedback,not upvotesRepo: [https://github.com/njain006/costly-oss](https://github.com/njain006/costly-oss) It is open sourced, adding in next phase MCP server for easy interactions. This has always been my problem with any org i have worked with, how can monitor my spend, usgae and performance. and every tool are very expensive to get a good holistic view.",1,0.99,1,https://www.reddit.com/r/dataengineering/comments/1t03iq8/a_pet_project_costly_love_to_get_feedback_on_this/,2026-04-30 17:47:29,2026-05-02 02:48:11
1szrk6a,"Built a JSON batch exporter for Jira & Confluence; pipelines, migrations, AI",ignatalexeyenko,dataengineering,"Hello!I needed a way to get structured data out of Jira and Confluence for migration pipelines and AI training, I couldn't find anything ready so decided to built it.Two apps now Owly Json Data Exporter for Jira / Owly Json Data Exporter for Confluence do the batch export to JSON, for ETL pipelines or RAG training datasets or NoSQL migration. For now - Server/Data Center only.Full disclosure - I'm the developer and its a paid app. I'm happy to answer questions or hear what data pipeline problems you're working on as I'm always looking to improve the app.Direct links:* Jira [https://marketplace.atlassian.com/apps/1838088111/owly-json-data-exporter-for-jira](https://marketplace.atlassian.com/apps/1838088111/owly-json-data-exporter-for-jira)* Confluence [https://marketplace.atlassian.com/apps/2705437384/owly-json-data-exporter-for-confluence](https://marketplace.atlassian.com/apps/2705437384/owly-json-data-exporter-for-confluence)Cheers, Ignat.",1,1.0,0,https://www.reddit.com/r/dataengineering/comments/1szrk6a/built_a_json_batch_exporter_for_jira_confluence/,2026-04-30 09:54:23,2026-05-02 02:48:11
1szpzdt,Single SSAS Instance with * models VS 1 instance per model,PokeMowl,dataengineering,"Hi everyone,I’m hesitating to implement a new model on my company’s SSAS instance. Admitting my actual single instance is not used at 100% CPU, and I need to add this new data model for BI purpose, should I :A : Create a new instance for my modelB : simply add this new model (affiliate supply) next to the other one (sales) in the same SSAS Instance ?In this case the resources would be shared, I know but if it works well enough where is the problem.I know the « basic » pros and cons of having every model in the same place, but in the real life, what did you do ?I don’t find Microsoft official do’s and don’ts for this specific question.Thank’s for helping :pinched_fingers:",1,0.67,3,https://www.reddit.com/r/dataengineering/comments/1szpzdt/single_ssas_instance_with_models_vs_1_instance/,2026-04-30 08:22:14,2026-05-02 02:48:11
1szlk0s,I have no idea how to set up a data wiki,Huge-Hat9703,dataengineering,"We are currently looking to set up a data wiki to manage data table schemas, sometimes including related data attachments. Down the line, this information also needs to be accessible by AI agents, with agents able to read from and write to it automatically. We now have two approaches in mind: one is using Confluence, where we can use MCP to manage documents, and it also offers permission management that can meet our needs for different access levels for users. The other is MinIO, but viewing attachments there is not very user-friendly, though it’s not impossible to access. Our team isn’t quite sure yet which option is better. I’d like to ask how people usually build a data wiki, or if you could give some advice on choosing between these options.",1,0.6,5,https://www.reddit.com/r/dataengineering/comments/1szlk0s/i_have_no_idea_how_to_set_up_a_data_wiki/,2026-04-30 04:17:28,2026-05-02 02:48:11
1szb0tu,Migration to Databricks and Storage issues,james2441139,dataengineering,"We are in the process of starting migration from Azure Synapse to Databricks. The Synapse currently has a standard lakehouse setup, with three Azure resource groups (dev, test, prod), each of them has a ADLS2 storage container. The container has the Bronze, Silver, Gold folders in them. And the files are all parquet files by source systems in each of the folders. Question is, can the current storage accounts and folders be ratained and have Databricks resources connect to the ADLS2 (by access connector)? Or do we need to convert the parquet files to delta? The containers are live or course, with data being updated by Synapse pipelines daily (incremental or full load depending on the system). Or is the best approach is to create a brand new ADLS2 account for Databricks and transfer the current files to the new one? And for that one the question still remains, retain the parquet files or convert them to Delta?",1,1.0,7,https://www.reddit.com/r/dataengineering/comments/1szb0tu/migration_to_databricks_and_storage_issues/,2026-04-29 20:42:20,2026-05-02 02:48:11
1sz9iu0,Foundry Javascript,zgunner13,dataengineering,"What is the best approach to use the sandbox code widget in slate to build my ui for the app but still allow users to interact with the data? Right now my data is on fusion sheets, eventually I'll be pulling data from databricks. I am very new to foundry",1,1.0,0,https://www.reddit.com/r/dataengineering/comments/1sz9iu0/foundry_javascript/,2026-04-29 19:48:10,2026-05-02 02:48:11
1sz80jj,"For a role that could lead to tapping into data engineering, which would you choose?",SpaceDrama,dataengineering,"I have taken courses in data engineering for my masters and plan to take on additional projects to help my value. But which of the following, though only 'analyst' roles, would likely give me better experience moving forward?[Role #1: Makes 90K, contract to perm, very average reviews, onsite, healthcare through recruiter, small team](https://preview.redd.it/c4t4rmzec6yg1.png?width=1484&format=png&auto=webp&s=660d5a2c4626a2cc54a70a00856f2d2ca226e0b4)[Role #2: Makes 100k, permanent with great healthcare, PTO, much better Glassdoor reviews, hybrid, smallish team](https://preview.redd.it/4ygyu55ce6yg1.png?width=1036&format=png&auto=webp&s=955f379e1b1f1523c35c9b682ae7eac482b928e8)",1,1.0,3,https://www.reddit.com/r/dataengineering/comments/1sz80jj/for_a_role_that_could_lead_to_tapping_into_data/,2026-04-29 18:54:07,2026-05-02 02:48:11
1syumdl,Need guidance on Eventhouse and Streaming,No-Introduction-5735,dataengineering,"Hi, I'm new to Fabric and I was learning Eventhouse.I just wanted to know if I ingest data into Eventhouse and I was to make some transformation on that data, how do I do it?Should I create a shortcut of that eh kql db into a lakehouse, attach it on a notebook, make some transformations and then dump it into a ware house?And in a scenario like this where data is continuously ingesting into the EH, should I be using spark structured streaming?Please let me know the correct procedure and best one as market standard.And my 2nd qs is, if I want to automate it and if I use a pipeline, should I add the Eventhouse or the notebook will automatically read data from the eh db shortcut i created in the LH since notebook is reading data from the shortcut.",1,1.0,3,https://www.reddit.com/r/dataengineering/comments/1syumdl/need_guidance_on_eventhouse_and_streaming/,2026-04-29 10:15:31,2026-05-02 02:48:11
1t0lkt1,Advice for career in US,mollydollu,dataengineering,"In a very complex situation and would need some guidance/assurance or any piece of advice you may have.Current role: DE databricks Pyspark etc.. Fully remote. Contract. Contract ends in a month.Got a random on site contract role, pays slightly more but have to go onsite 3 days. Calculated the cost it would be around 500-600$ additional per month. Skills: power bi, analysis etc (they use excel, don’t even have a data pipeline, nor do they plan to build one)I like to be challenged. To work in latest technologies but Family time is also important for me.My spouse says to skip this PBI job n look for Databricks related jobs even if it takes few months. I am unsure of the future of jobs, will I be able to find something remote and full time, or even contract and remote. Are these skills sought for? I started applying last week and haven’t heard back from anyone.Background: 9 years of US experience in big names. 4 years of databricks experience. Databricks certified. No sponsorship needed. Location DMV USA",0,0.5,10,https://www.reddit.com/r/dataengineering/comments/1t0lkt1/advice_for_career_in_us/,2026-05-01 06:42:03,2026-05-02 02:48:11
1swdrr8,Recent Trend in Scalable Data Engineering: Languges with Down-Scaling Capabilities.,RichKatz,dataengineering,"For a long time, for people who use what we call ""Big Data"" solutions, we have been working with highly scalable and large scaled data engineering platforms. This mean using Spark and Java, Scala, Python and related solving systems. However, some more downscalable small-based systems are available. Based on languages like Rust and Julia, these systems are faster and yet less memory intensive than Java and Scala but also far less compute intensive than Python.And they are probably well suited for the needs of human portable systems though such portable systems using what we call ""AI"" have not always been suitable for complex solutions.Coming from the Spark platform, we have some 40+ solution systems using Spark solutions like Tensorflow and torch. However a) making these solvers faster has been an issue. Torch and Tensorflow use Python and Python though lovable, isn't exactly what we'd call fast. In fact the Spark platform itself written in Java/Scala was a speed compromise - where Scala provided stability that C/C++ lacked. And b) Portable AI platforms are simply not physically capable of large data access that a Spark data center will have. However, large data aside, my sense is that with these new languages Rust and Julia we can achieve both C/C++ like speed yet mobility and also flexibility enough in a world where portable AI systems make demands that require both high performance but also Python-like versatility.End of data engineering/scalabilty rant ...\-- Rich KatzRich Katz",0,0.42,0,https://www.reddit.com/r/dataengineering/comments/1swdrr8/recent_trend_in_scalable_data_engineering/,2026-04-26 17:27:44,2026-05-02 02:48:11
1t05jwf,Desarrollo de Data warehouse,Uri_gc,dataengineering,"Hola. Estoy empezando a profundizar en arquitecturas de datos avanzadas y quería comenzar a desarrollar un almacén de datos. Quería aprovechar la IA, pero solo genera las consultas SQL para crear dimensiones en mi tabla central de eventos. Mi profesor de bases de datos me dice que necesito pagar por un servicio como SQL Server para desarrollar correctamente el almacén, pero sé que no está muy familiarizado con el tema; solo conoce lo básico. En definitiva, quiero migrar un proyecto a un almacén de datos, pero me gustaría saber dos cosas: primero, si pueden guiarme mejor en el proceso de aprendizaje para su desarrollo, o dónde buscar para encontrar la ruta correcta (repositorio, sitio web, etc.). Y segundo, ¿existen servicios gratuitos para desarrollar la arquitectura? Mi objetivo es crear un almacén de datos con un cubo OLAP.",0,0.33,7,https://www.reddit.com/r/dataengineering/comments/1t05jwf/desarrollo_de_data_warehouse/,2026-04-30 18:59:47,2026-05-02 02:48:11
1sz7t5h,Migrating from ClickHouse to Starrocks (2026),Worldly_Chef_2114,dataengineering,"Is there any useful tooling or material available for moving from ClickHouse to Starrocks - it appears with the recent funding (and now spending of the VC cash) and expected recovery of that investment, their unit costs will only go up to make up for it - so want to hedge our bets and prepare an alternative.",0,0.25,6,https://www.reddit.com/r/dataengineering/comments/1sz7t5h/migrating_from_clickhouse_to_starrocks_2026/,2026-04-29 18:46:55,2026-05-02 02:48:11
1t0ugyy,Data architecture and modelling strategy for AI projects,Intrepid-Cat4462,dataengineering,"Hello Community, I'm eager to know what are the real examples of  data architecture and modelling strategy for AI projects. My thought process:1. Rbdms/Open table format - Will be less performant and costly - Not suitable2. Parquet - direct access to data but issues on data duplication and sync3. Vector DB - Have gone through some vector s3 buckets but not sure how/when it is really integrated with data pipelineTIA!",0,0.27,11,https://www.reddit.com/r/dataengineering/comments/1t0ugyy/data_architecture_and_modelling_strategy_for_ai/,2026-05-01 14:08:15,2026-05-02 02:48:11
1t04z9z,Engenharia de dados - pipeline,Tiny-Cartoonist-441,dataengineering,"Rapaziada tudo certo?Tô finalizando um **projeto de engenharia de dados** aqui e queria uma luz de quem já tá no mercado sobre quanto cobrar na entrega final pra não sair no prejuízo nem esculachar o preço.O trampo foi o seguinte: fiz o pipeline completo da base de 2025 do **CNPJ da Receita Federal** (\~100GB de dados brutos sharded). O diferencial é que ficou muito veloz e barato, olha a stack:* **Infra:** Rodei tudo em **AWS EC2 r7g.xlarge (Graviton3)** usando **Spot Instances**. O pipeline processa o ano todo em minutos e custa centavos de dólar pro cliente.* **Ingestão:** Automatizei o download via **WebDAV (PROPFIND)** direto do Nextcloud da Receita. Nada de scraping manual de iniciante.* **Processamento:** Usei o ""power combo"" **Polars (Streaming/LazyFrame)** para filtros pesados de Regex e **DuckDB** para os Joins e persistência.* **A ""Mágica"":** Fiz uma reconciliação geográfica sinistra entre códigos da RFB e IBGE (7 dígitos). A precisão do Join ficou em **99,78%**, tratando todos os acentos e nuanças de nomes de cidades.* **Entrega:** Base ""Gold"" em **Parquet** otimizada pro Power BI e um resumão em Excel.O projeto exigiu uma senioridade boa pra não estourar memória (OOM) com esse volume e pra garantir essa precisão nos dados.Considerando que o cliente vai economizar uma nota em nuvem e ter um dado limpo de verdade, qual seria um valor justo pra esse projeto ""turn-key"" (entrega pronta)?Cobra por hora ou valor fechado? Qual a faixa de preço que vocês sugerem pro mercado hoje (2025/2026)?Valeu!",0,0.25,3,https://www.reddit.com/r/dataengineering/comments/1t04z9z/engenharia_de_dados_pipeline/,2026-04-30 18:39:16,2026-05-02 02:48:11
1t01ox9,Company name in. Website out.,Practical_Surround_8,dataengineering,"For months at Potarix, we’ve had to solve the problem of finding a company website from its name.Every existing solution we tried was garbage, so we built our own. (I built this. Cofounder at Potarix.)[https://enricher.potarix.com](https://enricher.potarix.com)Open to feedback, especially on edge cases like rebrands and acquired companies.",0,0.3,6,https://www.reddit.com/r/dataengineering/comments/1t01ox9/company_name_in_website_out/,2026-04-30 16:41:53,2026-05-02 02:48:11
1syqn5e,Why matlab isn't preferred for ETL,oil_electric07,dataengineering,I have been using matlab for various analysis applications and I'm wondering why no one has provisioned matlab as an ETL tool on the cloud. Any technical hurdles?,0,0.22,12,https://www.reddit.com/r/dataengineering/comments/1syqn5e/why_matlab_isnt_preferred_for_etl/,2026-04-29 06:27:26,2026-05-02 02:48:11
1sv6rgb,Me reading about ClickHouse vs after migrating to ClickHouse,IiIIIlllllLliLl,dataengineering,`DoubleDelta` on latitude/longitude and timestamp columns is black magic,0,0.45,11,https://i.redd.it/jznj7lkktaxg1.png,2026-04-25 08:44:24,2026-05-02 02:48:11
1swdtct,the juniors who only learned to code with AI are going to have a rough time in about 5 years,Motor_Ordinary336,learnprogramming,"Two juniors on my team. Both ship fast. Both grew up on Cursor and Claude Code basicallylast week one of them pushed something that broke in staging and I watched them paste their own function back into Claude going ""what does this do."" code they wrote on monday. THEIR OWN CODE. that they mergedI know how I sound. every senior ever has complained about juniors not knowing X and I swear I'm trying not to be that guy. but when I came up you had no choice but to sit with broken shit for hours and slowly build a map of the system in your head, and that part sucked but it's also where the actual learning lived (for me anyway). now you don't have to suffer through it. you just ask.(not an anti-AI post btw, I use it constantly)year 1 is fine, year 1 they ship features. it's year 5 I keep thinking about. one of them on call at 2am, prod doing something insane, AI confidently wrong, and they need to reason through an unfamiliar codebase under real pressure. I don't know what that looks like for someone who never built the muscle",2546,0.96,363,https://www.reddit.com/r/learnprogramming/comments/1swdtct/the_juniors_who_only_learned_to_code_with_ai_are/,2026-04-26 17:29:26,2026-05-02 02:48:12
1sy70ro,What websites should every programmer know?,Artistic_Ganache4732,learnprogramming,"Hi, I’ve seen this post before on other subreddits but I wanted to know specifically for programming. It helped me discover fmhy and although that has programming and software resources. I wanted to know what you think is the most valuable or underrated? I also like fmhy because it’s comprehensive and filled with so much information. It could also be websites commonly used etc.? Stack overflow is known to be this, and Reddit. I was looking for useful websites that could be helpful though. Could be for any language or stack.",354,0.98,70,https://www.reddit.com/r/learnprogramming/comments/1sy70ro/what_websites_should_every_programmer_know/,2026-04-28 16:50:39,2026-05-02 02:48:12
1sxjys7,I built a contact form for my first portfolio project and bots found it in 2 hours. Feeling defeated.,airbornejim32,learnprogramming,"Not even kidding. Finished my first real fullstack project. A little portfolio site with a contact form for a fake coffee shop just for practice. Deployed it last night.woke up to 80 emails all spam. All from customers with perfect grammar asking about menu pricing and catering services and all fake generated by AI.I didnt even tell anyone about this site. No social media post. No link anywhere- just deployed it. And the bots still found it.I tried adding recaptcha- they still got through. I tried a honeypot field- they ignored it. I tried rate limiting-they just used different IPs.I know this is just a practice project. but it makes me wonder - if I cant even protect something nobody knows exists, how do real companies do it?i started looking into verification systems. Stuff that proves the person on the other end is human. and yeah some of it sounds intense. biometrics and hardware scanners. feels like overkill for a coffee shop form.but even Reddit is dealing with this. their CEO said they need lightweight human checks like Face ID or Touch ID. Theres open source hardware called [Orb](https://world.org/find-orb) that does similar but keeps everything on your device.not saying im building that into my practice app. but it opened my eyes that this is a real problem, not just me being bad at coding.for those of you who have actual projects with real users what do you use? Is there a beginner-friendly way to stop bot spam without spending days configuring stuff? or do I just accept that any publicly exposed form will get hammered?any advice would help ,thanks",257,0.96,64,https://www.reddit.com/r/learnprogramming/comments/1sxjys7/i_built_a_contact_form_for_my_first_portfolio/,2026-04-27 23:11:10,2026-05-02 02:48:12
1szmpsy,Why should I learn AI? It seems like learning real computer science or programming would make more sense.,hireme-plz,learnprogramming,"I really don't like it when they say, ""You need to learn AI or you'll fall behind."". IMO, It seems like learning AI is nothing more than just typing what you think, which is essentially the same as writing anything else.Take this MCP, for example. The AI influencers were acting like it’s a gift from the gods that allows agent to talk to your computer. In reality? It’s just JSON-RPC a protocol from the early 2000s, wrapped in a trendy name. We’ve had plugin architectures and middleware for decades. Telling an AI what a tool does in natural language is just a fancy way of writing a documentation file that we used to call a Readme.Some people might say I'm a Luddite. But this is what I think, and I want to hear what other people think.",159,0.88,97,https://www.reddit.com/r/learnprogramming/comments/1szmpsy/why_should_i_learn_ai_it_seems_like_learning_real/,2026-04-30 05:18:00,2026-05-02 02:48:12
