id,title,author,subreddit,content,score,upvote_ratio,num_comments,url,created_utc,extracted_at
1qqdoh4,I'm a student and I don't know anything.,Mindless-Stomach5399,dataengineering,"Hi, I'm currently studying systems engineering and I'd really like to specialize as a data engineer. I wanted to know what I need to learn to find a job. (My English is intermediate and I'm still studying btw).",3,0.64,3,https://www.reddit.com/r/dataengineering/comments/1qqdoh4/im_a_student_and_i_dont_know_anything/,2026-01-29 16:41:56,2026-02-02 02:23:59
1qpii5e,"Anyone seeing faster AWS Glue 4.0 jobs lately? (~30% cost drop, no changes)",Fofichan1,dataengineering,"Hi everyone, I wanted to check something we’ve been seeing in my company with AWS Glue and see if anyone else has run into this.We run several AWS Glue 4.0 batch jobs (around \~10 jobs, pretty stable workloads) that execute regularly. For most of 2025, both execution times and monthly costs were very consistent.Then, starting around mid-November/early December 2025, we noticed a sudden and consistent drop in execution times across multiple Glue 4.0 jobs, which ended up translating into roughly \~30% lower cost compared to previous months.What’s odd is that nothing obvious changed on our side:* No code changes.* Still on Glue 4.0.* No config changes (DPUs, job params, etc.).* Data volumes look normal and within expected ranges.* The improvement showed up almost at the same time across multiple jobs.Same outputs, same logic. Just faster and cheaper.I get that Glue is fully managed/serverless, but I couldn’t find any public release notes or announcements that would clearly explain such a noticeable improvement specifically for Glue 4.0 workloads.Has anyone else noticed Glue 4.0 jobs getting faster recently without changes? Could this be some kind of backend optimization (AMI, provisioning, IO, scheduler, etc.) rolled out by AWS? Any talks, blog posts, or changelogs that might hint at this?Btw I'm not complaining at all , just trying to understand what happened.",7,1.0,7,https://www.reddit.com/r/dataengineering/comments/1qpii5e/anyone_seeing_faster_aws_glue_40_jobs_lately_30/,2026-01-28 17:51:30,2026-02-02 02:23:59
1qnf69j,Built a new columnar storage system in C.,UniqueField7001,dataengineering,"Hi,i wanted to get rid of any abstraction and wanted to fetch data directly from disk,with this intuition i built a new columnar database in C,it has a new file format to store data.Zone-map pruning using min/max for each row group, includes SIMD.I ran a benchmark script against sqlite for 50k rows and got good metrics for simple where clauses scan. In future, i want to use direct memory access(DMA)/DPDK to skip all sys calls, and EBPF for observability. It also has a neural intent model (runs on CPU) inspired by BitNet that translates natural-language English queries into structured predicates. To maintain correctness, semantic operator classification is handled by the model while numeric extraction remains rule-based. It sends the output json to the storage engine method which then returns the resultant rows.Github: [https://github.com/nightlog321/YodhaDB](https://github.com/nightlog321/YodhaDB)This is a side project.Give it a shot.Let me know what do you think!",5,1.0,4,https://www.reddit.com/r/dataengineering/comments/1qnf69j/built_a_new_columnar_storage_system_in_c/,2026-01-26 12:50:50,2026-02-02 02:23:59
1qr4dfn,Fit check for my IoT data ingestion plan,wombatsock,dataengineering,"Hi everyone! Long-time listener, first-time caller. I have an opportunity to offer some design options to a firm for ingesting data from an IoT device network. The devices (which are owned by the firm's customers) produce a relatively modest number of records: Let's say a few hundred devices producing a few thousand records each every day. The firm wants 1) the raw data accessible to their customers, 2) an analytics layer, and 3) a dashboard where customers can view some basic analytics about their devices and the records. The data does not need to be real-time, probably we could get away with refreshing it once a day.My first thought (partly because I'm familiar with it) is to ingest the records into a BigQuery table as a data lake. From there, I can run some basic joins and whatnot to verify, sort, and present the data for analysis, or even do more intensive modeling or whatever they decide they need later. Then, I can connect the BigQuery analytics tables to Looker Studio for a basic dashboard that can be shared easily. Customers can also query/download their data directly.That's the basics. But I'm also thinking I might need some kind of queue in front of BigQuery (Pub/Sub?) to ensure nothing gets dropped. Does that make sense, or do I not have to worry about it with BigQuery? Lastly, just kind of conceptually, I'm wondering how IoT typically works with POSTing data to cloud storage. Do you create a GCP service account for each device? Is there an API key on each physical device that it uses to make the requests? What's best practice? Anything really, really stupid that people often do here that I should be sure to avoid?Thanks for your help and anything you want to comment on, I'm sure I'm still missing a lot. This is a fun project, I'm really hoping I can cover all my bases!",4,1.0,3,https://www.reddit.com/r/dataengineering/comments/1qr4dfn/fit_check_for_my_iot_data_ingestion_plan/,2026-01-30 12:40:42,2026-02-02 02:23:59
1qqx556,Why not a open transformation standard,OrneryBlood2153,dataengineering,"Open semantic interchange recently released it's initial version of specifications. Tools like dbt metrics flow will leverage it to build semantic layer.Looking at the specification, why not have a open transformation specification for ETL/ELT which can dynamically generate code based on mcp for tools or AI for code generation that can then transorm it to multiple sql dialects or calling spark python dsl calls Each piece of transformation using various dialects can then be validated by something similar to dbt unit tests Building infra now is abstracted in eks, same is happening in semantic space, same should happen for data transformation",6,0.87,7,https://github.com/open-semantic-interchange/OSI,2026-01-30 05:50:21,2026-02-02 02:23:59
1qqjh1h,Preparing for new job,Ancient_Ad_916,dataengineering,"Hi Guys!Currently, I have around 4 years experience as a junior data scientist in tech. As titles don’t mean a lot I will list my experiences wrt programming languages and tools:\- Python: much experience (pandas, numpy, simpy, pytorch, gurobi/pyomo)Query languages\- SQL: little experience (basic queries only)\- SPARQL: much experience (optimized/wrote advanced queries)Tools\- AWS: wrote some AWS lambda functions, helped with some ETL processes (mainly transformation)\- Databricks: similar to AWSSo, in 2 months I’m starting my new job where I will be doing analytics and AI/ML but especially require solid data engineering skills. As the latter is what I’m least known with, I was wondering what types of python packages, tools, or you name it would be most beneficial to gain some extra experience with. Or what do you think the essentials for a data engineer “starter pack” should contain?",3,0.72,4,https://www.reddit.com/r/dataengineering/comments/1qqjh1h/preparing_for_new_job/,2026-01-29 20:07:00,2026-02-02 02:23:59
1qq5oso,how to choose a data lake?,otto_0805,dataengineering,"Hello there! So, I was working on a project like photobank/DAM, later we intend to integrate AI to it. So, I joined the project as a data engineer. Now, we are trying to setup a data lake, current setup is just frontend + backend with sqllite but we will be working with big data. I am trying to choose data lake, what factors I should consider? What questions I should ask myself and from the team to find the ""fit"" for us? What I could be missing?",4,0.84,9,https://www.reddit.com/r/dataengineering/comments/1qq5oso/how_to_choose_a_data_lake/,2026-01-29 11:06:14,2026-02-02 02:23:59
1qq3se7,Good Data with Databricks - problem with cache in Good Data,FlanSuspicious8932,dataengineering,Hey all! got a question for people who had 'pleasure' to work with Good Data. How can I increase the cache so Good Data are not constantly querying dbx? The design looks like this: databricks is scheduled to run on 3 AM so between 3:01 and 2:59 next day nothing will change in these tables Good Data is using these tables to show data but even though it's not direct query its constantly querying dbx after filter change or whatever because it hasn't got enough space to store the refreshed data I was Power BI developer and tbh it's hard for me to understand this problem with Good Data... Im not the good data admin so I'm relying on devs team that 'it is what it is' and it's pissing me off because it's ridiculous.But my main-main problem is that it's laggy even though we (5 people) are the only data consumers. It will be laggy af when clients will start using it and going above Medium warehouse on dbx will be costly and this cost will be undefendable because ROI will be way too low.Thanks in advance!,5,1.0,0,https://www.reddit.com/r/dataengineering/comments/1qq3se7/good_data_with_databricks_problem_with_cache_in/,2026-01-29 09:13:19,2026-02-02 02:23:59
1qp48tg,[Need sanity check on approach] Designing an LLM-first analytics DB (SQL vs Columnar vs TSDB),xtanion,dataengineering,"Hi Folks,I’m designing an LLM-first analytics system and want a quick sanity check on the DB choice.# Problem* Existing Postgres OLTP DB (Very clutured, unorganised and JSONB all over the place)* Creating a read-only clone whose primary consumer is an LLM* Queries are analytical + temporal (monthly snapshots, LAG, window functions)we're targeting accuracy on LLM response, minimum hallucinations, high read concurrency for almost 1k-10k users# Proposed approach1. Columnar SQL DB as analytics store -> ClickHouse/DuckDB2. OLTP remains source of truth -> Batch / CDC sync into column DB3. Precomputed semantic tables (monthly snapshots, etc.)4. LLM has read-only access to semantic tables only# Questions1. Does ClickHouse make sense here for hundreds of concurrent LLM-driven queries?2. Any sharp edges with window-heavy analytics in ClickHouse?3. Anyone tried LLM-first analytics and learned hard lessons?Appreciate any feedback mainly validating direction, not looking for a PoC yet.",4,0.7,4,https://www.reddit.com/r/dataengineering/comments/1qp48tg/need_sanity_check_on_approach_designing_an/,2026-01-28 06:57:20,2026-02-02 02:23:59
1qnueva,DE roles in big pharma : IT vs business-aligned,peaches-zero-zero-7,dataengineering,"Hey everyone , I work as a data engineer in pharma and I’m trying to understand how roles are structured at larger pharma companies like J&J, Abbvie, Novo,Novartis etc.I’m interested in tech-heavy roles that are still closely tied to business teams (commercial, access, R&D, Finance, therapeutics areas) rather than purely centralized IT.If anyone here works in data/analytics engineering at these companies or closely with these roles, I’d love to hear how your team is set up and what the day-to-day looks like. Mainly looking to learn and compare experiences.I’m also open to casual coffee chats or just exchanging experiences over DM as I explore a potential switch.",5,1.0,0,https://www.reddit.com/r/dataengineering/comments/1qnueva/de_roles_in_big_pharma_it_vs_businessaligned/,2026-01-26 21:58:37,2026-02-02 02:23:59
1qtc0ag,Recommended ETL pattern for reference data?,Spooked_DE,dataengineering,"Hi all,I have inherited a pipeline where some of the inputs are reference data that are uploaded by analysts via CSV files.The current ingestion design for these is quite inflexible. The reference data is tied to a year dimension, but the way things have been set up is that the analyst needs to include the year which the data is for in the filename. So, you need one CSV for every year that there is data for.e.g. we have two CSV files, the first is *some\_data\_2024.csv* which would have contents:|id|foo||:-|:-||1|423||2|1|the second is *some\_data\_2021.csv* which would have contents:|id|foo||:-|:-||1|13||2|10|These would then appear in the final silver table as 4 rows:|year|id|foo||:-|:-|:-||2024|1|423||2024|2|1||2021|1|13||2021|2|10|Which means that to upload many years' worth of data, you have to create and upload many CSV files all named after the year they belong to. I find this approach pretty convoluted. There is also no way to delete a bad record unless you replace it. (It can't be removed entirely).Now the pattern I want to go to is just allow the analysts to upload a singular CSV file with a year column. Whatever is in there will be what is in the final downstream table. In other words, the third table above will be what they upload. If they want to remove a record just reupload that singular CSV without that record. I figure this is much simpler. I will have a staging table that captures the entire upload history and then the final silver table just selecting all records from the latest upload.What do we think? Please let me know if I should add more details.",3,1.0,2,https://www.reddit.com/r/dataengineering/comments/1qtc0ag/recommended_etl_pattern_for_reference_data/,2026-02-01 21:52:36,2026-02-02 02:23:59
1qt1543,Handling spark failures,Famous_Whereas_1969,dataengineering,"Recently I've been working on deploying some spark jobs in Amazon eks, the thing is sometimes they just fail intermittently for 4/5 runs continuously due to some issues like executors getting killed/ shuffle partitions lost.. ( I can go on and list the issues but you got the idea ). Right now I'm just either increasing resources or modifying some of the spark properties like increasing shuffle partitions and stuff. I've gone through couple of videos/articles, most of them fit well in theory for small scale processing but don't think they would be able to handle heavy shuffle involved ingestions.Are there any resources where I can learn how to handle such failures with proper reasoning on how/why do we add some specific spark properties?",3,1.0,2,https://www.reddit.com/r/dataengineering/comments/1qt1543/handling_spark_failures/,2026-02-01 15:18:47,2026-02-02 02:23:59
1qqhvik,Should I use redis or rocksdb for check pointing my message broker deliveries?,Aggravating_Water765,dataengineering,For ***at least once processing*** or more complicated delivery guarantees (i.e ***exactly once unordered*** or ***exactly once ordering***) we need to check point that we received the message to some data system before we finish processing to the downstream sink and then acknowledging back to the message broker that we received the message.Recall that we need this checkpoint in the situation the consumer fails post processing data sink pre message broker acknowledgment.If we don't have this checkpoint we risk the message never getting delivered at all because the alternative is acknowledging the message ***pre*** data sink or not at all resulting in the message never being in our sink if a downstream sink replica fails or the consumer itself fails.My question is what are t**he pros and cons of different checkpointing stores such as** ***rocksdb or redis*** \- and when would we use one over the other?,3,0.81,1,https://www.reddit.com/r/dataengineering/comments/1qqhvik/should_i_use_redis_or_rocksdb_for_check_pointing/,2026-01-29 19:09:25,2026-02-02 02:23:59
1qqcuy7,Do online courses actually matter to companies hiring?,CuriousSection,dataengineering,"Like, are they actually enough on their own to get entry level jobs? Please, I am just looking for answers. I don't have a college degree, but due to family, health, and mental health issues getting in the way, not intelligence. Codecademy has courses that are like 70 hours, 90 hours, labeled as career paths for Data Warehousing, Data Analysts and Data Engineers. They even have one that supposedly ends in a test that sounds like a genuine marker outside of Codecademy, CompTIAData+ certification. I am putting my all into working through, learning, and completing these, hours every day outside my (stupid, minimum wage) full time job. I need to know so I know if I'm simply wasting my time. If they are nice additions that reflect skill, but at the end of the day, not enough on their own, and businesses really want a college degree.",3,0.8,13,https://www.reddit.com/r/dataengineering/comments/1qqcuy7/do_online_courses_actually_matter_to_companies/,2026-01-29 16:13:11,2026-02-02 02:23:59
1qq98ku,Data quality stack in 2026,jackson4139,dataengineering,"How are people thinking about data quality and validation in 2026?1. dbt tests, great expectations, monte carlo, etc?2. How often do issues slip through checks unnoticed? (weekly for me)3. Is anyone seeing promise using agents? I've got a few prototypes and am optimistic as a layer 1 review.Would love to hear what's working and what isn't?",3,0.81,3,https://www.reddit.com/r/dataengineering/comments/1qq98ku/data_quality_stack_in_2026/,2026-01-29 13:57:26,2026-02-02 02:23:59
1qptvqr,Practice project idea,TheManOfBromium,dataengineering,"Hello!I want to do a practice project using the community Databricks version. I want to do something involving streaming data, and I want to use real data.My idea would be do drop files into s3, then build out a medallion layer using either spark structured streaming or declarative pipelines (not sure if this is supported on community version). Finally my gold layer would be some normalized tables where I could do analytics or dashboards. Is this a sucky idea? If not, what would be some good real raw data to drop into s3, and how do I set that up? Thanks for any insights/help",3,0.81,0,https://www.reddit.com/r/dataengineering/comments/1qptvqr/practice_project_idea/,2026-01-29 00:57:57,2026-02-02 02:23:59
1qpkei4,Noob question: Where exactly should I fit SQL into my personal projects?,the_livings_easy,dataengineering,"Hi! I've been learning about DE and DA for about three months now. While I'm more interested in the DE side of things, I'm trying to keep things realistic and also include DA tools (I'm assuming landing a DA job is much easier as a trainee). My stack of tools, for now, is Python (pandas), SQL, Excel, and Power BI. I'm still learning about all these tools, but when I'm actually working on my projects, I don't exactly know where SQL would fit in. For example, I'm now working on a project that pulls data of a particular user from the Lichess API, cleans it up, transforms it into usable tables (using a OBT scheme), and then loads it into either SQLite or CSVs. From my understanding, and from my experience in a few previous, simpler projects, I could push all that data directly into either Excel or PowerBI and go from there. I know that, for starters, I could clean it up even further in pandas (for example, solve those NaNs in the accuracy columns). I also know that SQL does have its usefulness: I thought about finding winrates for different openings, isolating win and lose streaks, and that sort of stuff. But why wouldn't I do that in pandas or Python?[The current final table after the Python scripts; I'll be analyzing this. I censored the users just in case!](https://preview.redd.it/uywee59py4gg1.png?width=1462&format=png&auto=webp&s=1188c1819ed4115924fbefc9285b217a61109fe6)Even if I wanted to use SQL, how does that connect to Excel and Power BI? Do I just pull everything into SQLite, create a DB, and then create new columns and tables just with SQL? And then throw that into Excel/Power BI? Sorry if this is a dumb question, but I've been trying to wrap my head around it ever since I started learning this stuff. I've been practicing SQL on its own online, but I have yet to use it on a real project. Also, I know that some tools like SnowFlake use SQL, but I'm wondering how to apply it in a more ""home-made"" environment with a much simpler stack. Thanks! Any help is greatly appreciated.",4,0.83,13,https://www.reddit.com/r/dataengineering/comments/1qpkei4/noob_question_where_exactly_should_i_fit_sql_into/,2026-01-28 18:56:07,2026-02-02 02:23:59
1qpctqj,Building an On-Premise Intelligent Document Processing Pipeline for Regulated Industries : An architectural pattern for industrializing document processing across multiple business programs under strict regulatory compliance,Mission-Animal9076,dataengineering,Quick 5min read: Intelligent Document Processing for Regulated Industries.,3,1.0,0,https://medium.com/@Samir.D/building-an-on-premise-intelligent-document-processing-pipeline-for-regulated-industries-9ca8a1e69070,2026-01-28 14:28:17,2026-02-02 02:23:59
1qp7fl5,How to adopt Avro in a medium-to-big sized Kafka application,PickleIndividual1073,dataengineering,"Hello, Wanting to adopt Avro in an existing Kafka application (Java, spring cloud stream, Kafka stream and Kafka binders)Reason to use Avro:1) Reduced payload size and even further reduction post compression2) schema evolution handling and strict contracts Currently project uses json serialisers - which are relatively large in sizeReflection seems to be choice for such case - as going schema first is not feasible (there are 40-45 topics with close to 100 consumer groups) Hence it should be Java class driven - where reflection is the way to go - then is uploading to registry via reflection based schema an option? - Will need more details on this from anyone who has done a mid-project avro onboarding Cheers !",3,1.0,0,https://www.reddit.com/r/dataengineering/comments/1qp7fl5/how_to_adopt_avro_in_a_mediumtobig_sized_kafka/,2026-01-28 10:08:51,2026-02-02 02:23:59
1qp6j55,CAREER ADVISE,Charming-Jello7064,dataengineering,"Hi guys, I’m a freshman in college now and my major is Data Science. I kinda want to have a career as a Data Engineer and I need advice from all of you. In my school, I have something called “Concentration” in my major so that I could concentrate on what field of Data ScienceI have 3 choices now: Statistics, Math and Economics. What so you guys think will be the best choice for me? I would really appreciate your advise. Thank you",1,0.54,10,https://www.reddit.com/r/dataengineering/comments/1qp6j55/career_advise/,2026-01-28 09:13:21,2026-02-02 02:23:59
1qot5ku,How do you decide between competing tools?,Ok-Fix-8387,dataengineering,"When you need to make a technical decision between competing tools, where do you go for advice?I can empathise. It all depends on the requirement, but here's my real question. When you are told that 'Everyone is using Tool X for this use case', how do you actually validate if that's true for your use case?""I've been struggling with this lately. Example: deciding between a couple of Archtecture decision. Now with AI, everyone sounds smart with one query away.So my question is, where do you go for advice or validation?**StackOverflow: Anonymous Experts*** 2018 - What are the best Python data frames for processing?* 2018 - (Accepted Answer) Pandas* 2024 - (comment) Actually, there is something called Polars, eats Pandas for breakfast(+200 upvotes)* But the 2018 answer stays on top forever.**Blog posts*** SEO spam* Vendor marketing disguised as ""unbiased comparison""* AI-generated, that sounds smart.**Colleagues*** Limited to what they've personally used.* We use X because... that's what we use.* Haven't had the luxury to evaluate alternatives.**Documentation (every tool)*** Scalable, Performant, Easy* But missing ""**When NOT to use our tool**""**What I really want is Human Intelligence(HI)**Someone who has used both X and Y in production, at a similar scale, who can say:* I tried both, here's what actually scaled.* X is better if you have constraint Z* The docs don't mention this, but the real limitation is...**Does anyone else feel this pain? How do you solve it?**Thinking about building something to fix this - would love to hear if this resonates with others or if I'm just going crazy.",4,0.7,10,https://www.reddit.com/r/dataengineering/comments/1qot5ku/how_do_you_decide_between_competing_tools/,2026-01-27 22:39:54,2026-02-02 02:23:59
1qo6cgm,Is nifi good for excel ETL from sftp to sql and excel format stays same does not change.,ossicor30,dataengineering,So i am working on a project where i have to make a pipeline form sftp server to sql with excel reports with fixed format that comes every 5 min or hourly.,3,0.81,8,https://www.reddit.com/r/dataengineering/comments/1qo6cgm/is_nifi_good_for_excel_etl_from_sftp_to_sql_and/,2026-01-27 06:37:29,2026-02-02 02:23:59
1qnlysg,How are you getting CDC into Iceberg?,SignificantSize2623,dataengineering,"I've built CDC to Iceberg pipelines before (Debezium + Spark) and I'm curious, for anyone else running this in production, what are your biggest pain points? Is it deployment complexity? Operational overhead? Cost of managed solutions?",3,0.81,1,https://www.reddit.com/r/dataengineering/comments/1qnlysg/how_are_you_getting_cdc_into_iceberg/,2026-01-26 17:07:51,2026-02-02 02:23:59
1qnjeht,Is Spring Batch still relevant? Seeing it in my project but not on job boards,Informal-Unit9129,dataengineering,"’m currently working on a retail domain project that uses Spring Batch, Airflow, and Linux for our ETL (Extract, Transform, Load) pipelines.However, when I search for ""Spring Batch"" on LinkedIn, I hardly see any job postings requiring it as a primary skill. This has me wondering: Is Spring Batch still widely used in the industry, or is it being phased out?",3,0.81,1,https://www.reddit.com/r/dataengineering/comments/1qnjeht/is_spring_batch_still_relevant_seeing_it_in_my/,2026-01-26 15:39:14,2026-02-02 02:23:59
