id,title,author,subreddit,content,score,upvote_ratio,num_comments,url,created_utc,extracted_at
1u1y4ue,Help with python compatibility issue,sum2008,learnprogramming,"Hello everyone, I don't know if this post should be in this sub or r/learnpython or somewhere else. Basically Ive got a 2009 laptop which came with windows 7 professional. Its been about 6 years since I touched this laptop and recently I booted it up after a long time. My main laptop which I use to code got busted so I thought of temporarily doing my work on this one. I tried installing the last compatible version of python which still supports windows 7(google said 3.8.1) through the installer from the official site but got an error(picture included). So I scrapped that and installed it via the embedded zip file into a folder which seemed to work. Then I followed some tutorials and installed pip via the [get-pip.py](http://get-pip.py) method idk what to call it in the same folder where the zip file was and added that folder as path. But when I tried to install any package like pygame for example, it never worked and always gave me the same error. I spent a lot of time trying to find a solution but it just didn't budge. So I gave up on that route as well. I remembered later that thonny IDE which I mainly use, doesn't need python installed to work and also has a way to install packages without manually installing pip. So I installed the latest version of thonny which still supports windows 7(4.1.7). Luckily that worked and I opened up thonny but when I tried to install any package, I still got the same exact error as before.Id really appreciate it if someone can share a way to make python work on windows 7 with pip. Thanks\- [https://i.postimg.cc/W4bk6SSv/failed.jpg](https://i.postimg.cc/W4bk6SSv/failed.jpg) \- error I get when I tried to install python via the installer \- [https://i.postimg.cc/44tmcrZH/thonny-error.jpg](https://i.postimg.cc/44tmcrZH/thonny-error.jpg) \- error I get when i try to install a package through thonny(The whole error isnt visible but idk if its safe to post the whole error, but the bad file descripter error always comes) \- [https://i.postimg.cc/jS9bZS4H/specs.jpg](https://i.postimg.cc/jS9bZS4H/specs.jpg) \- laptop specs in case they're needed(Sorry if this violates any rules Im new to reddit so I dont know much)",2,1.0,3,https://www.reddit.com/r/learnprogramming/comments/1u1y4ue/help_with_python_compatibility_issue/,2026-06-10 10:18:32,2026-06-13 03:53:43
1u1ehk4,Matlab array problem,Lucky_View_3422,learnprogramming,Short story: i’m learning MATLAB cause university… I’m using the free resource given by Matlab himself… Right now they are saying the function “size” is used to determine the dimensions of an array (all understood) and to create an array with the size of another one (example: Rand(size(x))) (all understood again…. Problem: but while I was playing with this function I wrote “rand(size(2))” only to see what would happen and the MATLAB response was “ans = 0.4984” how should I interpret this answer?I was expecting an error but I think he responded with an array 1x1,2,0.75,6,https://www.reddit.com/r/learnprogramming/comments/1u1ehk4/matlab_array_problem/,2026-06-09 19:04:31,2026-06-13 03:53:43
1u16l5j,I don't feel like I'm progressing at all beyond the basics.,S4d_Machin3,learnprogramming,"I don't know what happened beyond watching the tutorial, but I'm learning javascript right now, I've got a grasp of HTML/CSS but I can't build anything apart from small stuff, I'm growing as a programmer in a really slow pace, and sometimes I feel like I'm not really learning or doing anything, despite coding something.. I wanna know how to advance further beyond the basics, and actually code stuff that could potentially hire me.",2,0.67,6,https://www.reddit.com/r/learnprogramming/comments/1u16l5j/i_dont_feel_like_im_progressing_at_all_beyond_the/,2026-06-09 14:28:19,2026-06-13 03:53:43
1tyjbhy,Company is losing their minds over AI costs,jholliday55,cscareerquestions,"I made a post a few days ago how my company took away access to claude due to the increased cost. They also took away gpt 5.5.Yesterday, they sent out a company wide email how “unprecedented” and “disruptive” this has been. They seem at a complete loss on what to do, one of the options seems going all in and giving everyone a ton of monthly credits or the opposite and just bare bones.The one option is 13,000 credits through GitHub copilot a month. For the month of June, we have 11,000 and I am already at 37% after the first week.My company is around 40k employees. Is there anyway to know how much the 13,000 credit a month plan would cost? Curious to know how much they are willingly to pay. Three months ago they did a round of layoffs before GitHub announced the new business model around pricing.Edit: LMAOOOOOOO 100 credits is $1. Lmaoooo our piece of shit VP who rebranded as us “AI first” after the layoffs really thought this would replace us. This shit about to be so expensive lol.",1947,0.97,396,https://www.reddit.com/r/cscareerquestions/comments/1tyjbhy/company_is_losing_their_minds_over_ai_costs/,2026-06-06 14:51:48,2026-06-13 03:53:44
1u0uw5x,"To the people who post ""I haven't written a single line of code in 6 months"", what's Plan B?",tubemaster,cscareerquestions,"I keep reading people posting here about ""we're cooked"", ""riding out this wave"", and ""time to upskill"". To the people here who are around 27-35, what actually IS your backup plan? I'm struggling to understand how so many here are seemingly cheering on their own obsolescence.Edit: I’m not as stupid as I seem. I know that AI is a tool and software development is not being a code monkey. I just don’t understand how Reddit thinks every SWE can and should retire at 25-30 otherwise they mismanaged their money. It just screams elitism and sounds tone deaf. I put this out there to get some idea of alternative career paths or tech niches that people were referring to when they say “upskill” or “pivot”.",882,0.94,597,https://www.reddit.com/r/cscareerquestions/comments/1u0uw5x/to_the_people_who_post_i_havent_written_a_single/,2026-06-09 04:31:14,2026-06-13 03:53:44
1u3v9ge,Why are companies so evil now?,VariationLivid3193,cscareerquestions,Everyone used to be so nice.There were so many perks of working at big tech.Everyones just scared runninh for their jobs now.,654,0.91,327,https://www.reddit.com/r/cscareerquestions/comments/1u3v9ge/why_are_companies_so_evil_now/,2026-06-12 13:27:00,2026-06-13 03:53:44
1tyg1f0,Dream company is a nightmare,TemperatureFit7755,cscareerquestions,"Base: 245kBonus: 18%RSU: 150k over 5 yearsCompany: FAANG adjacentParent with 3 kids.Ive been working in a niche part of IT for 13 years and in the corporate world for 25 years. During this time Ive worked at numerous fortune 500 companies, both as a fte and consultant. Ive also worked across several different IC and Manager roles. It has also been a dream to work at one specific company which is often seen as the ultimate place to land.I was so excited when I received the offer 6 months ago. Fast forward, the company which I always positioned as the dream is a nightmare.My day to day is incredibly chaotic. My calendar is often double/triple booked from 8am to 6pm. My peers exchange emails from 7am to 11pm. I see lots of people spending their federal holidays responding to emails and teams chats. Ive witnessed numerous peers take PTO, for a week or two weeks, yet they still login to work every day and attend certain meetings. Ive seen peers with 10 hour days trade their only 30 minute break to cover another meeting. I havent had a week of consistent lunch breaks since my first month here. Generally I try to eat really quickly in meetings which is challening when you have to talk. Sometimes i dont eat my meal until 4pm. Beyond that the general org structure is atypical and people in my area essentially have no consistent team they are on.The dilemma Im facing is that I am miserable, feel shitty that the company I always wanted to be at sucks so bad, and contemplating my next move. Working here is glamerous and looks great on my resume. Peolple would die to be in my spot. I feel conflicted at the idea of leaving and am trying to work through that. I dont see this dynamics of my role or company changing. All of that said there are absolutely areas of my company that are fantastic to work in, im just not in one of those areas unfortunately. It would take 1+ year for me to move internally. Due to the economy the company is not hiring or backfilling jobs until early 2027. There are absolutely silent layoffs taking place.",575,0.91,222,https://www.reddit.com/r/cscareerquestions/comments/1tyg1f0/dream_company_is_a_nightmare/,2026-06-06 12:30:50,2026-06-13 03:53:44
1tzszk6,Anyone else just juat tired of the AI gaslighting?,aqualad33,cscareerquestions,"It's a powerful tool yes but I'm tired of the lies talking about it being some revolutionary technology that will take the world into a new age.It's a pattern recognition engine and nothing more. That can be really powerful in many use cases, but it can not and will not be something capable of independent logic. No, better models will not change this and neither will improving the technology. The whole technology itself doesn't have logic. At best it would have to be combined with a different technology to handle the logic but that wouldn't be an LLM, that would be a separate breakthrough.LLMs will always be limited by the data it's trained on and will never know more than that. I'm tired of hearing that LLMs are going to discover all this new information, where would it have even discovered it from if it wasn't already written by someone else?I'm just tired man.Edit 1: just to address everyone whos bringing up AI writing mathematical proofs. First, its solving them via weighted ""monkey on a typewriter"" methodologies. The vast majority of these proofs look good but are ultimately flawed and thus not newsworthy. Meanwhile it's taking a significant amount of human resources to debunk them. As for the two that are news worthy. I take then with a grain of salt. One of them may be true but I'm going to wait until its stood the test of time before being convinced. Theres a very good chance theres an error buried in those pages like the vast majority of the others. The other hasn't even been verified in a peer reviewed journal yet so I don't really care about it. The only place ive seen it published is by the company who owns the model... needless to say, they may have some bias.",563,0.82,486,https://www.reddit.com/r/cscareerquestions/comments/1tzszk6/anyone_else_just_juat_tired_of_the_ai_gaslighting/,2026-06-08 00:39:16,2026-06-13 03:53:44
1u0t42r,Is AI slop from new hires a problem at your company or just mine?,ElementalMist,cscareerquestions,"I work at one of the big well known tech companies (not faang but in the same realm) as a Lead Engineer. I specifically work in our hyperscaler division. I’ve been with the company around 9 years now and have seen the ups and downs, but for the most part our hires have been decent and competent and care about the work we do.In the past 18 months, our hires have become absolute dogshit. Making multi-six figure salaries while all their code is written by Codex, they openly admit this too and are almost proud of it. Constantly praising AI and how great it is. They all have huge ego’s and produce some of the worst code I’ve ever seen.We gave one of these guys, we’ll call him Jim, a simple problem in a basic shell script and guided him to the exact line of code the problem was in. An hour later he comes back with “I think I fixed it, give it a try” two of our tenured engineers review, come back and ping me and go “what the heck did this guy do”. The code is DOUBLE the lines it was when we gave it to him.I shoot him an IM “Hey Jim, what did you do to this script?”, “Oh I refactored it because it didn’t make a whole lot of sense and this makes it more readable and more resilient”, “Okay…it still doesn’t work. Check x on x commit, that resolution should work”, “hmmm. Okay I’ll take a look”.Another 30 minutes goes by and he IM’s back saying he’s fixed it, now the script is TRIPLE the size and still doesn’t work. This goes back and forth for like 3 hours until finally another one of my engineers goes and fixes the issue by going back to the old script and changing a single line of code.I go back to Jim and ask what he did to try and understand the disconnect since we basically gave him the resolution and he said “Oh well I just ran it through Codex each time!”. Safe to say I almost had a stroke as it was a simple “grep” that fixed the issue. This guy is L5.This has become a problem with every single senior level engineer we’ve hired in the past 18 months. They all use the most tokens out of all our staff too. A good 75% of those tokens are wasted on them developing internal tools that nobody ever ends up using because they’re terrible, yet they present them to upper management and act like they’ve re-invented the wheel. They’re so damn proud of the slop they’ve churned out. The chip on their shoulders is maddening, one of them told me a few days ago he’s gonna try and get Staff Engineer this year during reviews and he’s been here less than 9 months. I’m seriously considering quitting tech all together because of this.Is this an issue with my company? Or the industry as a whole?",506,0.95,164,https://www.reddit.com/r/cscareerquestions/comments/1u0t42r/is_ai_slop_from_new_hires_a_problem_at_your/,2026-06-09 03:02:44,2026-06-13 03:53:44
1u1iomv,Really don’t understand the hype around “AI writes 90% of our code now”,jholliday55,cscareerquestions,"I am really confused, hasn’t the majority of our lines of code been boiler plate code? I started as a full time engineer in 2020, and measuring by boiler plate code, 90% if not more was copying and pasting. The last ten percent was always the hardest. My first job was in Angular, so if I run the node command below ng generate component component-nameIt technically generates thousands of lines of code. After that, we took pieces of code used in other spots if the component didn’t reference a library or found it on the internet. That then left us with the remaining 10%, sometimes less. I guess what I’m asking, hasn’t this always been the case when measuring lines of code?",458,0.86,198,https://www.reddit.com/r/cscareerquestions/comments/1u1iomv/really_dont_understand_the_hype_around_ai_writes/,2026-06-09 21:36:51,2026-06-13 03:53:44
1u15koe,Anyone else feel like they are going insane with how much people rely on AI with their actual jobs?,MikeOxmaull247,cscareerquestions,"I have over 20 years of experience. I recently got a new role at company none of you have ever heard of. Since I have been there I have been shocked on how much people rely on AI. For example:- entire PR’s are just prompted, no one knows how they work but they just put up a 1000 line change and the reviews just rubber stamp it - AI introduces bugs and no one knows how to fix them. Last week we had an entire deployment fail and a whole team of devs didn’t know how to debug it and were told to “just use Claude”- No one gets stuck anymore. This is really weird to me. That touch point where you get another coworker to help you out and you get to know each other better just doesn’t exist- Capacity just doesn’t matter anymore. Get swamped with work? Just have AI agents do it! Yes I’ve been directed to do just that - Everyone is forgetting how to code and no one seems to care. I haven’t heard a single architecture discussion or even a basic coding discussion since I’ve started. This is such a massive contrast from what I experienced for years and years and I feel like I’m going insane",425,0.94,167,https://www.reddit.com/r/cscareerquestions/comments/1u15koe/anyone_else_feel_like_they_are_going_insane_with/,2026-06-09 13:50:46,2026-06-13 03:53:44
1u0hh76,"Judge blocks 100,000 h1b fee",bbrk9845,cscareerquestions,"We have the 100,000 fee on h1bs blocked by a judge, will this mean more competition for the tech industry for new grads, or has the job market for entry level tech improved, since the fee was first added last year ?[https://www.cnbc.com/2026/06/08/trump-h1b-visa-fee-blocks.html](https://www.cnbc.com/2026/06/08/trump-h1b-visa-fee-blocks.html)",412,0.87,402,https://www.reddit.com/r/cscareerquestions/comments/1u0hh76/judge_blocks_100000_h1b_fee/,2026-06-08 19:06:19,2026-06-13 03:53:44
1u0ona7,I haven't written a single line of code in 2 months. Are we all cooked?,mysticWhispr,cscareerquestions,"I switched jobs two months ago as a native mobile dev.In my last fintech job, I wrote most of the code myself and had to extend 12 to 13 hours almost twice a week just to debug issues manually.Since joining here, I have not written a single line of code myself. From unit tests to full features, AI is doing literally all the work. I just do the analysis, write a good prompt, review the code, and document it.I started shipping features in my first week. I barely had any KT and, to be honest, I still do not understand our project architecture. If we get overloaded, we just switch over to other tech stacks instantly with AI.I feel like frontend and mobile devs are completely cooked. At some point soon, companies will just hire a single developer to manage both Android and iOS.Right now, it feels like I am getting free money just to be a prompt engineer. Is anyone else experiencing this? How long can this actually sustain?",326,0.72,408,https://www.reddit.com/r/cscareerquestions/comments/1u0ona7/i_havent_written_a_single_line_of_code_in_2/,2026-06-08 23:39:12,2026-06-13 03:53:44
1u1xw9b,How do you handle engineers who are brilliant but toxic to the team culture?,Alternative_Crow_403,cscareerquestions,"I've been a Team Lead for about two years now, and I'm hitting a wall with a specific situation. I have one senior dev on my team who is, objectively, one of the most talented people I've ever worked with. His code quality is top-tier, he solves complex architectural problems in his sleep, and he's the person everyone goes to when there's a critical production outage. If it were just about tickets and technical output, he'd be my MVP.However, the cultural impact he's having is becoming impossible to ignore. He's incredibly condescending during code reviews, often making junior and mid-level devs feel stupid for asking basic questions. He's also very dismissive in sprint planning, basically shutting down any ideas that aren't his own with a level of sarcasm that makes people stop contributing altogether. I've noticed that two of my mid-level engineers have become noticeably quieter in meetings, and I'm starting to see signs of burnout and disengagement from people who used to be very proactive.I've tried the 'soft' approach. I've had 1-on-1s where I pointed out that his communication style was affecting team velocity and morale. He gets defensive and argues that he's just being 'honest' or 'efficient' and that people shouldn't be so sensitive. He views any feedback about his soft skills as a distraction from the 'real work' of engineering. My manager is pushing me to just 'manage the output' and let him be, as long as the roadmap is met, but I feel like I'm losing the rest of the team to keep this one person happy. I'm worried that if I don't take firmer action, I'm going to lose my good engineers to attrition, and then I'll be left with just one person who refuses to collaborate. For those of you in leadership roles: how do you draw the line? At what point does technical brilliance stop outweighing the cost of a toxic personality? Do you go the formal PIP route for behavioral issues, or is there a better way to coach someone who thinks they are untouchable because of their stack expertise? I'm struggling to balance the immediate delivery needs with the long-term health of the team.",262,0.94,168,https://www.reddit.com/r/cscareerquestions/comments/1u1xw9b/how_do_you_handle_engineers_who_are_brilliant_but/,2026-06-10 10:05:50,2026-06-13 03:53:44
1u2d10k,With all the layoffs. Wheres the protests? Wheres the reactions?,Noobs_Man3,cscareerquestions,Wheres the protests? Wheres the reactions? When is enough enough?I see all these posts about everyone struggling to find entry level roles being ghosted by jobs constantly and nothing positive comes from it.I see sad posts about people stuck in jobs they never wanted struggling to wake up to go to work with no future to get anywhere.In the news there are constant articles of companies laying people off or not hiring people where are those people that have been laid off do they not care?we all see the posts about fake job postings and grooling applications.I myself have contacting hundreds of alumni and other recruiters to try and network. Applied to over 1000 entry level jobs did a lot of video interviews never interview with people only video or AI. Only to get a fake Unfortunately letter from a auto response.I say we group up and show the USA what we think.,228,0.76,250,https://www.reddit.com/r/cscareerquestions/comments/1u2d10k/with_all_the_layoffs_wheres_the_protests_wheres/,2026-06-10 19:56:07,2026-06-13 03:53:44
1u330ev,Offer Revoked: THC in NYC,JohnDoeXXII,cscareerquestions,"I was recently offered a position through a consultancy at a company in NYC. I accepted and proceeded with the onboarding and background check.I noticed the Background Check included a panel - and thought nothing of it knowing that in NYC it's not permitted to test. However I was shocked when the consultancy informed me that the end-client company had rescinded the offer due to marijuana being found on the test.Has anyone else had this happen to them? How did you handle it?EDIT: This was not government - The position was with a financial company, for a loyalty rewards application",226,0.86,120,https://www.reddit.com/r/cscareerquestions/comments/1u330ev/offer_revoked_thc_in_nyc/,2026-06-11 15:55:45,2026-06-13 03:53:44
1tytvp0,Worst Thing You’ve Done at Work,deMiauri,cscareerquestions,Anyone here accidentally drop a production table?A production DB?Anything else in that realm of fuck-up?I made a mistake on friday and while I don’t think it’s that serious I need some consolation.,220,0.96,191,https://www.reddit.com/r/cscareerquestions/comments/1tytvp0/worst_thing_youve_done_at_work/,2026-06-06 21:50:26,2026-06-13 03:53:44
1u1iz5h,[Offer Advice] Stay at a hyper-stable mid-level .NET job ($140k) or take Walmart SWE III ($190k) to avoid skill stagnation?,vish184,cscareerquestions,"(used AI to sum all this up)I have an offer that looks like a solid step up on paper, but I'm really torn because of the trade-offs with location, stability, and WLB.My ultimate goal is to break into big tech or big tech adjacent companies in a major city. I want a recognizable name on my resume and want exposure to modern SWE systems/practices because I'm terrified of my skills getting devalued by AI as time goes on.Current Job (SWE II - Working at a no name non tech company)* **Stack:** C#, .NET, MS SQL, Azure* **Pros:** Hyper-stable. The product is very profitable and layoffs are basically non-existent. Don't see this changing in the foreseeable future. I also have a good relationship with my manager and teammates.The Offer (Walmart Global Tech - SWE III)* **Role:** SWE III in Global Tech PharmacyHowever Year 1 liquid comp will be the same due to RSU vesting schedule (140k)Basically, is the SWE III title, Golang exposure, and massive scale at Walmart worth uprooting my life and taking on layoff risk, just to use it as a stepping stone to better or similar companies in a better location after 2 years?Or should I ride it out at my stable job and try to upskill on the side? (I have been searching for a few months now and this offer from Walmart is the best one I've even been in the running for looking at comp and my current experience)Has anyone had any bad experiences with Walmart Global Tech Pharmacy in terms of WLB ?",215,0.9,170,https://www.reddit.com/r/cscareerquestions/comments/1u1iz5h/offer_advice_stay_at_a_hyperstable_midlevel_net/,2026-06-09 21:47:54,2026-06-13 03:53:44
1u03mhs,"Honestly, F*** LINKEDIN! Why do we still put up with it!?",SignificanceFlat1460,cscareerquestions,"FAKE COMPANIES AFTER FAKE COMPANIES! Just trying to harvest as much of your data as possible. My whole job feed is field with these companies:speechifytether(.)ioHiredmicro1Hired FeedToptalCrossoverPulseMediaNL devjobs mercorbraintrust bruntwork virtusa TALENTMATE ParamInfo Keystone Joveo Quik twine proxify Taskify Referral Crossing WorkAnd they keep on changing their GODDAMN NAMES every Tuesday intentionally to trick people into applying! Searching for a job has become more than a chore! Like it wasnt already tough in this market and now we need to be careful as to what jobs to click and what jobs are just bait to fetch more of my soul? I have reported these companies to LinkedIn REPEATEDLY! NOTHING! But GOD FORBID I use some automation to streamline my job application process! BAN! IMMEDIATELY! I want to go back to Indeed and other job platforms days where you didnt get spammed by these garbage companies. We need some form of regulation against this to stop companies from data harvesting our CVs. This is insane! Is anyone else is facing this? or am I just unlucky for this? If anyone knows how to clean up my feed, let me know.",216,0.91,50,https://www.reddit.com/r/cscareerquestions/comments/1u03mhs/honestly_f_linkedin_why_do_we_still_put_up_with_it/,2026-06-08 10:07:59,2026-06-13 03:53:44
