id,title,author,subreddit,content,score,upvote_ratio,num_comments,url,created_utc,extracted_at
1tnwwfh,Object storage and Data Lake,Uri_gc,dataengineering,"Hello! What free or open-source technologies are available for developing an object storage system that are also suitable for scaling a data lake? Also, if you have any guidelines for developing this data architecture, that would be great; it's my first time doing this. The goal is to create a storage system that can hold a large number of photos and documents for use in a structured architecture, such as a massive Postgres database, or even another architecture like a data warehouse.",4,1.0,2,https://www.reddit.com/r/dataengineering/comments/1tnwwfh/object_storage_and_data_lake/,2026-05-26 05:03:34,2026-06-02 04:05:25
1tsvax2,1B Rows Possible in the Browser DuckDb WASM OPFS,Main_Slide_7667,dataengineering,"Serverless, Fully Functionality pivot, multi level grouping, Batteries included full UOM , Calculated Columns, theme able etc., Still a WIP so be gentle but interested in feedback and thoughts . AMA",3,0.58,2,https://analytics-grid.com/,2026-05-31 13:24:33,2026-06-02 04:05:25
1toduaa,"SAP ECC to SQL Server: Rebuild Z-transaction logic in SQL, or extract processed data directly?",Inventador200_4,dataengineering,"I work part-time as a student on a supply chain analytics team (we use SAP ECC R/3) and my boss wants to stop using TXT/CSV batch jobs. Instead, they want to move SAP tables and Z-transaction data directly into a middle layer in SQL Server for reporting in Power BI and Excel.Right now, a colleague is copying the most important raw tables into SQL Server daily using the .NET connector. The issue is that the entire SCM department needs the Z-transactions, which have special business logic built on top of the raw SAP tables.Is it smart and viable to just copy the raw data from SAP into SQL Server and rebuild all the Z-transaction logic there, or is there a better, more efficient approach?",3,1.0,1,https://www.reddit.com/r/dataengineering/comments/1toduaa/sap_ecc_to_sql_server_rebuild_ztransaction_logic/,2026-05-26 17:27:02,2026-06-02 04:05:25
1ttwnav,Monthly General Discussion - Jun 2026,AutoModerator,dataengineering,"This thread is a place where you can share things that might not warrant their own thread. It is automatically posted each month and you can find previous threads in the collection.Examples:* What are you working on this month?* What was something you accomplished?* What was something you learned recently?* What is something frustrating you currently?As always, sub rules apply. Please be respectful and stay curious.**Community Links:*** [Monthly newsletter](https://dataengineeringcommunity.substack.com/)* [Data Engineering Events](https://dataengineering.wiki/Community/Events)* [Data Engineering Meetups](https://dataengineering.wiki/Community/Meetups)* [Get involved in the community](https://dataengineering.wiki/Community/Get+Involved)",2,1.0,0,https://www.reddit.com/r/dataengineering/comments/1ttwnav/monthly_general_discussion_jun_2026/,2026-06-01 16:00:17,2026-06-02 04:05:25
1tobzyc,Joining Capgemini France or a brokerage firm,DirectRead8564,dataengineering,"Hello,I'm a Data Engineer with 5 years of experience, currently based in France. I received an offer from Capgemini at €80k/year and another from a brokerage firm at €65k/year with daily on-site presence.I'm confused because I'm hearing too many bad things about Capgemini, and they're also recruiting me based on my profile without any specific projects.What would you advise me to do?",1,0.67,4,https://www.reddit.com/r/dataengineering/comments/1tobzyc/joining_capgemini_france_or_a_brokerage_firm/,2026-05-26 16:24:32,2026-06-02 04:05:25
1ttlgay,Power BI Semantic model/Tabular career,Complete-Regret-4300,dataengineering,"Hello guys,I come from the legacy MSBI suite, although I am familiar with SSAS, SSIS, SRSS and Tsql, SSAS used to be my favourite part. I never liked SSIS much although it seems the easiest part of MSBI to learn.I kind of slacked into my job for the last 15 years or so and didn't upgrade my skills.Now I have taken a new liking to my new job and want to learn again. I have been hired for my SSAS skills and we have a very mature cube database about 27Gb in size and I have been asked to migrate it to Tabular model.I have been discovering how tabular model is so different from multi dimensional;no default member, no support for unary operator and custom rollup, no key column name column for hierarchy attributes etc and I am working my way through.I am wondering if my career can get a new lease of life if I learnt this technology i.e. tabular modelling and DAX. At this stage of my career and after slacking for so long I am not really keen to get into cloud data engineering and stuff. I just want to learn what is necessary to keep my career interesting and the power bi Semantic model space sounds interesting. I wonder if this skills alone will let me survive for another 5-10 years?I am financially independent, so I am not working for money anymore, although it helps that it pays the bills without me having to dip into my portfolio. But I am mainly working so that I get engagement and I am part of the tribe.",0,0.5,3,https://www.reddit.com/r/dataengineering/comments/1ttlgay/power_bi_semantic_modeltabular_career/,2026-06-01 08:03:20,2026-06-02 04:05:25
1toxczm,jsonfold: Making Pretty-Printed JSON Compact and Readable,Yairlenga,dataengineering,"# jsonfold: Making Pretty-Printed JSON Compact and ReadableMost JSON serializers give you only two choices:* compact machine output:{""a"":{""b"":{""c"":""abc""}},""x"":{""y"":{""z"":""xyz""}}}* or fully expanded “pretty-print”:{ ""a"": { ""b"": { ""c"": ""abc"" } }, ""x"": { ""y"": { ""z"": ""xyz"" } } }I wanted something in between: the first is hard for humans to scan, and the second becomes extremely verbose on real-world nested data.I experimented with a small Python formatter `jsonfold` that can selectively:* Pack lists of scalars/simple objects* Fold small containers back onto a single line* Merge multiple small containers onto a single lineOne interesting implementation detail is that it works as a streaming wrapper around `json.dump()` output rather than reparsing JSON or building another JSON tree. json.dump(obj, JSONFoldWriter(fp), indent=2)So it works with fixed memory usage and linear processing time even for large documents.# Minimal UsagePull `jsonfold.py` from [GitHub project](https://raw.githubusercontent.com/yairlenga/jsonfold/refs/heads/main/articles/01-python/jsonfold.py) import jsonfold import sys data = { ""meta"": {""version"": 1, ""ok"": True}, ""ids"": [1, 2, 3, 4, 5], ""items"": [{""id"": 1, ""name"": ""alpha""}, {""id"": 2, ""name"": ""beta""}], } # compact can be: default, low, med, high, max jsonfold.dump(data, sys.stdout, compact=""default"")# References:Disclosure: I am the developer of `jsonfold`Repository: [https://github.com/yairlenga/jsonfold](https://github.com/yairlenga/jsonfold)Python implementation is under `python` directory.Article with implementation details: Medium (no paywall): [A Streaming JSON Formatter That Works With Existing Serializers](https://medium.com/@yair.lenga/a-streaming-json-formatter-that-works-with-existing-serializers-eced220da37d)",0,0.5,2,https://www.reddit.com/r/dataengineering/comments/1toxczm/jsonfold_making_prettyprinted_json_compact_and/,2026-05-27 06:36:43,2026-06-02 04:05:25
1tpywcf,Databricks DBU pricing is getting insane—Photon misconfiguration in a small POC caused a 5-digit cloud bill,Sadhvik1998,dataengineering,"One of our dev teams in the POC was doing some runs using Job Compute, and we suddenly saw a spike in the cloud cost usage, and our cloud-finance team reported this.https://preview.redd.it/2harsa74nu3h1.png?width=705&format=png&auto=webp&s=dc55f864a4a7ebe420a3586619f67ede40ffc164 Two things to note here.1. Databricks by default has now enabled the photon option in Databricks, which the dev didnot see cuz it was not like that earlier, due to which the instances ran with Photon2. The cost clearly (from the image above) shows that the DBU pricing (48,805 INR) is literally more than 2x compared with the Azure Compute (23,000 INR) pricing. It looks like the Databricks License is getting extremely high day by day, and I don't know how enterprises are paying such a heavy price. Just for a POC, with a small misconfiguration, we hit a number in 5 digits, and looking at a real-world scenario, how big are amounts being charged for DBU. It feels like it is better to switch to a Databricks alternative; maybe look at a Flat License based on Tiers or some alternative spark data platform.",0,0.41,16,https://www.reddit.com/r/dataengineering/comments/1tpywcf/databricks_dbu_pricing_is_getting_insanephoton/,2026-05-28 09:51:23,2026-06-02 04:05:25
1tq8wlt,We built a blazing fast Clickhouse:registered: Cloud alternative,marcmacmac,dataengineering,"Hey, Marc here, Co-Founder of ObsessionDB.I think we built some pretty cool stuff in the last months and my colleagues urge me to share a bit out of the engineering kitchen.We're a drop-in replacement for Clickhouse:registered: Cloud with an api-compatible `SharedMergeTree` table engine, with compute-storage (S3) and compute-compute separation, plus some extra special sauce.Specifically the latter kills quite some headaches we know from our experience with Clickhouse Cloud, like cold starts, inconsistent and slow query times due to the S3 latency penalty and the 1/N probability of a cache hit or a neglectable cache size at scale. We focused a lot on the ""looks great in the lab benchmark, but fails in real world"".Especially in realtime use cases on large data sets we found it impossible to get consistent sub-second results, rather extreme high variances between p50-p99.We started a few months ago, migrated and onboarded customers, already serving PB of data. For the next couple of weeks we plan to launch self service for everyone. Until then we'd like to hand out some free dev instances for anyone interested in it. No strings attached, just happy for honest feedback. Comment or hit me a DM. Looking especially for TB-PB workloadsTo support the ecosystem we open sourced some tooling, too. Like [chkit](https://github.com/obsessiondb/chkit), a schema and migration CLI, agnostic to ObsessionDB, Clickhouse Cloud, OSS CH... Or since we saw that people would [love to see SigNoz](https://github.com/SigNoz/signoz/issues/8125) on `SharedMergeTree`, we made some [adjustments](https://github.com/obsessiondb/signoz-obsessiondb) to make it work properly.Besides this: Ask me anything. I'll start sharing more details about our architecture soon and look forward to getting in touch.Little note regarding the dev instances and the console: It's heavy WIP, don't take every graph, every step etc. too serious. We just want to take you in as early as possible, before we launch it properly.",0,0.3,2,https://www.reddit.com/r/dataengineering/comments/1tq8wlt/we_built_a_blazing_fast_clickhouse_cloud/,2026-05-28 16:39:02,2026-06-02 04:05:25
1tpihvp,Did anyone else lose interest in programming after AI became mainstream?,IronBaron999,learnprogramming,"I’ve been learning Java for a while, and at first I genuinely enjoyed programming because I’ve always loved computers. But lately I’ve started questioning whether this is really the path I want to follow.One of the things that bothers me is how different programming feels now with AI. Years ago people would spend hours reading forums, experimenting, understanding code step by step, and finally feeling proud when something worked. Now everything feels extremely fast and automated. AI can generate solutions instantly, and sometimes it makes the process feel less meaningful to me.The more I study, the more I realize that software development can also be very solitary and mentally exhausting. I think I originally chose programming because I liked computers, but now I’m starting to notice that I’m probably more drawn to creative fields like animation, digital art, visual storytelling, or interactive media.I’m not saying programming is bad. I just don’t know if it fits my personality long term.Has anyone here gone through something similar? Did you stay in tech, switch careers, or combine programming with creative work somehow?",413,0.91,143,https://www.reddit.com/r/learnprogramming/comments/1tpihvp/did_anyone_else_lose_interest_in_programming/,2026-05-27 21:00:24,2026-06-02 04:05:26
1ttpvfo,Anyone else feel like they missed their calling in Programming?,Forward-Departure-16,learnprogramming,"Just wondering if anyone in the same boat as me?!I'm in my 40s, worked in admin job out of college (which i hated). Then ended up in e-commerce (mixture of sourcing, webstore manager and digital marketing) for last 10 years which I've generally enjoyed.At the back of my mind, I always thought I'd love to be a web developer/ programmer. I always enjoyed fixing frontend problems, getting apps integrated properly and the design side (I started learning css about 10 years ago to help me with my job)However, I didn't actually start learning ""coding"" properly until about 18 months ago (I'm half way through Odin project). Would have loved to do it quicker, but I have 2 young kids under 5 (one of them a newborn), so I don't have much spare time outside of work. The whole ""AI replacing coding"" debate has been a bit demoralising, but then I realised I've been really enjoying coding and the Odin project that I may as well keep going with it. Even if it amounts to nothing career wise, I'll have enjoyed it anyway.I do feel a bit sad though as when I'm coding/ learning I really feel like I'm doing what I should have been doing all along. And in many ways it seems obvious now. I always enjoyed (and was good at) languages and math in school. I ended up doing a science degree but in something that was very hard to get a job in (particularly as I graduated into the great recession)I always enjoyed problem solving and enjoyed learning languages. So now I feel a ""Duh of course"" moment, especially as I've been working in a related job in ecommerce for 10 years.Anyone else able to relate to that? Realised quite late on that programming/ software development was a great fit for you?",175,0.93,62,https://www.reddit.com/r/learnprogramming/comments/1ttpvfo/anyone_else_feel_like_they_missed_their_calling/,2026-06-01 11:53:47,2026-06-02 04:05:26
1tp1qy5,How do I become a good programmer as a self taught,ProfessionalCare5031,learnprogramming,"I'm a self taught full stack developer and I started with web dev 3 years ago, but I wanted to become a real programmer and a real software engineer not only a coder.I studied digital marketing in the university so it has nothing to do with programming and I couldn't get into computer science field, thats why i decided to become a self taught.Recently I have been job searching, and I got interviewed and rejected 2 times, in those 2 rejections, the clear why is that I dont have the basics and the problem solving mindset, I didnt build the fundamentals of full stack development and software engineering in general, and i feel like all those years were a waste of time, because I only focused on the results more than the science behind it.So I want to do better, I want to start strengthening my skills and learn the right way, but at the same time I need to find a job and thats why i have been rushing all those years, to find a job ASAP, unfortunately this is only leading me to rejections.What do you suggest? and how should I start learning after all those years that felt like a waste and I feel dissapointed at myself honestly, if anyone had the same experience or felt the same in his tech journey and figured it out, or you just want to help, I would like to hear your suggestions.",169,0.96,45,https://www.reddit.com/r/learnprogramming/comments/1tp1qy5/how_do_i_become_a_good_programmer_as_a_self_taught/,2026-05-27 10:39:19,2026-06-02 04:05:26
1to89e9,Why learn pointers in C if I can just return values ​​normally?,Sofiatheneophyte,learnprogramming,"I don't really understand the point of pointers right now. If my function can just return a value directly, why would I complicate things with 'int \*ptr = &x'?I'm new to C, and every time I read about pointers, I get the impression that it's just a complicated way to do something simple. Is there a real case where I'm forced to use them?",93,0.85,78,https://www.reddit.com/r/learnprogramming/comments/1to89e9/why_learn_pointers_in_c_if_i_can_just_return/,2026-05-26 14:14:54,2026-06-02 04:05:26
1tr4dh1,When does the computer know when the decimal starts?,Separate-Judgment949,learnprogramming,"Hello, I recently learned about types in the C language like `float` and `double`. But I am wondering when and how does the computer know when the decimal starts for those types. Like if we have a number say 250.64 we know the decimal starts between the digit 0 and 6 but how does the computer know? Also how do number types even work why are we not able to store a decimal in a integer but we can in a float? They both use bits unless it is just restricted by the compiler/computer itself.",78,0.95,35,https://www.reddit.com/r/learnprogramming/comments/1tr4dh1/when_does_the_computer_know_when_the_decimal/,2026-05-29 14:55:19,2026-06-02 04:05:26
1tt20xb,How can I practice a topic (pointers for example) if I don't understand the reason behind it's existence?,Eva_addict,learnprogramming,"Some might be very useful for bigger and more complex projects but to me, I just can't see a reason to use them yet. Now I am learning about pointers in C++ and I get that they hold an address of a value. But why? It's hard for me to practice using them since I can't find a use.I know that the best way to learn is to make a project but my level of knowledge is not that far yet. I can only make extremely simple games using the terminal which don't need pointers or memory allocation to work.",70,0.92,44,https://www.reddit.com/r/learnprogramming/comments/1tt20xb/how_can_i_practice_a_topic_pointers_for_example/,2026-05-31 17:44:15,2026-06-02 04:05:26
1ttzefv,"I joined a startup....they gave me access to the codebase and basically said ""yeah figure it out, you have 1 week""",Brave_Watercress_863,learnprogramming,"Recently I joined a startup no walkthrough straight to the codebase. Just a git repo with 47 folders, variable names that made sense to whoever wrote them 1 or half a year ago, and a [readme.md](http://readme.md) that says ""see confluence"" which I do not have access to yet.Obv i am feeling shy to ask someone to explain the whole thing So I cloned it...opened it....stared at it.Today is day 3, I still got no idea where to start Can someone help me with any good plateform which can help me get thru this mess?",53,0.83,33,https://www.reddit.com/r/learnprogramming/comments/1ttzefv/i_joined_a_startupthey_gave_me_access_to_the/,2026-06-01 17:31:33,2026-06-02 04:05:26
1towut2,Am I the only one who sees coding as some form of art?,AbandonedAuRetriever,learnprogramming,"Just a little bit of context. I’m a software developer for some years now and I never vibe coded programs. But we have right now this massive hype over not writing a single line of code and having a fully working application, so I decided to try it out and subscribed for the pro tier of Claude (which includes Claude Code).After trying to vibe code the first project, I understood that it would not work for me. And I’m not talking about the quality, it was really good. But I’m talking about the feeling. I hated that I didn’t write a single line of code.How I can I build something and call my own if I didn’t actually build it.I realized that even if AI will take over every programming job and everyone will no longer write code, I will. Not because I’m stubborn or a luddite, but because I code not to get a job, or to show-off (tbh who can show off in the current era with so little to code) but just because it means something else to me — the ability to create whatever your mind imagines captivates me.I’m not the only one who feels this way, right?Ps: what I wanted to know is how many people who think alike.",47,0.72,38,https://www.reddit.com/r/learnprogramming/comments/1towut2/am_i_the_only_one_who_sees_coding_as_some_form_of/,2026-05-27 06:10:19,2026-06-02 04:05:26
1tr7tfu,where am i supposed to code?????? (i know i sound stupid),Remarkable-Step9292,learnprogramming,"I've been wanting to learn to code for a while now, but my problem is that every guide and tutorial starts with the assumption that i know where I'm supposed to be typing. all the beginner tutorials assume the reader knows how to at least right a line, all like 'here are the philosophies and techniques' but no 'open the notes app' or 'download this or that program'. I need like a tutorial that starts with 'open the computer' cause i've never touched any of this before. any answers? cause I'm lost and on the verge of throwing my computer out the window.",41,0.73,48,https://www.reddit.com/r/learnprogramming/comments/1tr7tfu/where_am_i_supposed_to_code_i_know_i_sound_stupid/,2026-05-29 16:45:40,2026-06-02 04:05:26
1tqiwym,How do people genuinely understand documentation,Bitter-Today285,learnprogramming,"i’ve been learning C++ for at least 5 months now, but one thing i’ll always struggle with is documentation. Like to me it’s unclear because you don’t know where to start, the introductions are so long, the documentation only shows like what this interface does, what this function does but not how to actually use them in a meaningful way. That’s like handing me tires, an engine, plenty of car components and telling me what purpose each of them serve, but not how to actually build the car.",35,0.9,39,https://www.reddit.com/r/learnprogramming/comments/1tqiwym/how_do_people_genuinely_understand_documentation/,2026-05-28 22:36:58,2026-06-02 04:05:26
1ts37zr,"What makes a Programming Language, a good programming language ?",Rics-Dev,learnprogramming,"In your opinion, what differentiates Programming languages ? and what makes a programming language, a good programming language, or a bad one ?",34,0.82,56,https://www.reddit.com/r/learnprogramming/comments/1ts37zr/what_makes_a_programming_language_a_good/,2026-05-30 15:38:43,2026-06-02 04:05:26
1tq39p5,I'm a web dev student and I'm scared I'm learning skills that will be useless by the time I graduate,Sofiatheneophyte,learnprogramming,"I'm 20, studying web dev in Paris. I know HTML, CSS, JS and I'm working on my first real project. but honestly ? I'm terrified.by the time I finish my degree and find an internship, will there even be junior web dev roles left ? or will companies just use AI to build everything and hire one senior to supervise it ?I don't need to be rich. I just need a career that still exists in 3 years and lets me keep building things I'm proud of.is anyone here actually working as a junior dev right now ? does it still feel worth it ?",31,0.7,46,https://www.reddit.com/r/learnprogramming/comments/1tq39p5/im_a_web_dev_student_and_im_scared_im_learning/,2026-05-28 13:13:44,2026-06-02 04:05:26
1toizxk,How to learn to understand code?,PeacefulA25,learnprogramming,"This has probably been asked a million times but wherever i search I can't quite get the answer I'm looking for.I've dipped my toes into game making a few times where every time I gave up when I couldn't understand, but this time I'd actually want to get past that point.I'm trying to make a small 2D coop RPG in Godot to get the hang of what I'd do next if people get interested, I was successful in syncing player movement in multiple instances but only because I copied the code from a tutorial. Then I wanted to add a 2D camera to follow my player which I googled, but it only followed the first player in all instances which I managed to fix using ChatGPT.Here's the problem, I really don't want to use AI, and I won't be able to find a google or youtube tutorial for everything I want.I want to actually understand what I'm writing without having to google everything or looking it up on github, can anyone with the experience of being able to just write a script without needing to google or look something up help me find a way or place to learn this?",31,0.77,24,https://www.reddit.com/r/learnprogramming/comments/1toizxk/how_to_learn_to_understand_code/,2026-05-26 20:21:31,2026-06-02 04:05:26
1tt1bkx,"I've learned the basics of Python, but I still can't manage to do simple projects.",ComprehensiveSell480,learnprogramming,"Right now I'm learning Python, and I've picked up the basics—variables, conditionals, loops, lists, functions, POO, etc. But when I tried to do an exercise that combined all the Python concepts I’d learned, I couldn’t get it to work. I understood how to do it and which tools to use, but I didn’t know how to implement it, and it really hurt to see all the hours I’d spent learning Python go to waste—now I basically have to start over from the beginning.And yet I always did exercises before moving on to the next lesson.So what should I do? Please explain it to me.",29,0.85,31,https://www.reddit.com/r/learnprogramming/comments/1tt1bkx/ive_learned_the_basics_of_python_but_i_still_cant/,2026-05-31 17:18:12,2026-06-02 04:05:26
