id,title,author,subreddit,content,score,upvote_ratio,num_comments,url,created_utc,extracted_at
1qrkzww,Need advice on my best move as a job hopper,BarracudaPersonal449,cscareerquestions,"I graduated in 2022 and, here's an outline of my work history:1. AMD (Canada) May 2022 - Nov 2022. I quit my AMD job because I wasn't learning much and I wanted to accelerate my learning and increase my salary.2. During the break, I studied graphics.3. Biotech startup (SF bay area) May 2023 - Mar 2024. I was let go because they wanted 80 hours/week and because I brought up ethical concerns.4. AI chip startup #1 (SF bay area) June 2024 - June 2025. I was laid off along with 15-20% of the company.5. During the break, I studied AI.6. AI chip startup #2 (Canada) September 2025 - Present. My gut feeling says I'm going to get a poor performance review a month from now and it's probably a matter of time before I am put on PIP. My boss has unreasonable expectations that I'm not meeting and I can sense that I don't work well with him. We're not quite synchronized on the same wavelength, if that makes sense.So clearly this is not an ideal time to find another job and what makes it worse is that my job history makes me look like a serial job hopper. I am an embedded driver/firmware engineer.Do I just drop the AMD experience off my resume? Or should I keep it for more experience on my resume?",37,0.69,40,https://www.reddit.com/r/cscareerquestions/comments/1qrkzww/need_advice_on_my_best_move_as_a_job_hopper/,2026-01-30 22:58:52,2026-02-02 02:24:02
1qqj11y,What is it like looking for a mid level job right now?,oldmoldycake,cscareerquestions,"I am gearing up to start my search for a hopefully mid level role now from my current job. I have a degree in CS and about 3 years of experience from my current job. Its mostly legacy PHP work, how ever I have introduced microservices for the first time written in python as well as worked with a contractor to develop a RAG AI support bot and have just kind of found myself being our AI guy because I mentioned I made a Gemini wrapper discord chatbot once. I have also developed several features by my self end to end. I am interested in leaving because of lack of an structure (no code reviews, no QA, no year end reviews, no yearly raises, no mentorship) and I am just not learning anymore at my job. I have a pretty decent project portfolio since I code for a hobby to outside of work. A year ago I also made a AI chatbot discord bot using Chroma DB for RAG and some other features like sentiment analysis for relationship changes, which has 10k users and 1 paying users, I also have a homelab I practice some skills on like managing a k3s cluster, which i use for pretty standard things like Prometheus/Grafana, OpenWebUI, headlamp and some other services I use. I also have been exploring AI tooling mainly with OpenWebUI and have one of the highest rated tool on their community, a K8s monitor I made to experiment with tooling the the Kubernetes python library, though it is a small community so that might be irrelevant. I also am in the process of teaching myself rust now and I have been working on Leetcode. I've also got a couple more small projects in the works i wont detail but I am using them to learn more Typescript, React, and FastAPI. For someone like me how would I job search be? I haven't done one since the end of college and I don't really have any friends in this space to talk to it about so from my little bubble I am unsure how qualified I really am and was wondering how a job search for someone like me might go and anything I can do to improve my odds.",39,0.82,32,https://www.reddit.com/r/cscareerquestions/comments/1qqj11y/what_is_it_like_looking_for_a_mid_level_job_right/,2026-01-29 19:50:56,2026-02-02 02:24:02
1qq10hb,I graduated over a year ago and haven't had any success finding a job. How would you suggest I spend my time while looking?,Papa_Kasugano,cscareerquestions,"I graduated December 2024 with my bachelor's in Computer Science. Since then I've sent out hundreds of resumes which have resulted in only a handful of emails and two interviews (one online and one in person). I thought the interview went well. I did well on the technical assessment (some SQL queries and a bit of Python), and I had a referral from someone who works there. Unfortunately they didn't feel the same about the interview and went with another candidate.During this time I've been working on some personal coding projects, reading books to reinforce things I learned in school (DSA, networking, etc), practicing some different languages, and just trying to stay motivated to keep learning. Aside from continuing my job search, what do you think would be good ways to spend my time? Are there any particular areas that I should focus on to make myself more desirable to employers? Looking for feedback, suggestions, or if you're in the same situation, we can commiserate together.",39,0.9,26,https://www.reddit.com/r/cscareerquestions/comments/1qq10hb/i_graduated_over_a_year_ago_and_havent_had_any/,2026-01-29 06:28:46,2026-02-02 02:24:02
1qs2ul4,Am I the problem at my company or am I being gaslighted?,Time_Adhesiveness593,cscareerquestions,"I'm 24f and I work as a software developer for a startup company. This company is not a software company, but they offer software development services. They hired me as a solo developer to manage 4 different projects. There is no other technical person in the company. One of the projects specifically is a mess. The way it was built wasn't very robust. The previous developer used a bunch of technologies that they were not familiar with, and it's very messy. I was not aware of the state of this project when they hired me. It took me about a month to get set up because there was no one to onboard me; I basically had to figure everything out on my own, and there were some really niche things about the system that weren't documented properly. Actually, their entire documentation is a mess and not very helpful. It also took like 3 weeks for them to give me access to everything I needed.I've been stuck on a few issues for months, and it's driving me insane. These issues are direct symptoms of how the system was built. Initially, the system worked fine, but the way it was built is now causing a bunch of long-term problems to arise. I'm trying my best, but as soon as I fix one thing, another issue pops up. My boss and our clients don't really understand this, and they basically blame me for everything. I feel so overwhelmed right now. I've been trying my best, but I feel like it's not good enough. I've been working through nights and on weekends to try to resolve these issues, but it's like an endless cycle because more issues keep popping up. They also want me to do a full QA assessment every time I test, and that takes time.I've tried to explain to my boss that I'm just one person and that there is only so much I can do, but he doesn't care. They basically want me to do the job of an entire team while paying me below average for what a developer makes. I also mentioned to my boss that we should hire another developer or a consultant to help with the workload, and he told me that in order to do that, they would have to cut my salary by at least 45%. By their logic, they hired me to do a job, and if I need extra help to do that job, then it's going to have to come out of my pay. I'm trying my very best, but they make me feel like I'm incompetent and that I'm not even trying at all. They told me that I should be able to do this and more. I am actually questioning my skills right now. I don't know if I'm just a bad developer or if I'm being gaslighted by them.",32,0.78,52,https://www.reddit.com/r/cscareerquestions/comments/1qs2ul4/am_i_the_problem_at_my_company_or_am_i_being/,2026-01-31 13:49:52,2026-02-02 02:24:02
1qsyupi,What’s it like doing a fully remote role?,Tree8282,cscareerquestions,"Just got an offer for a fully remote role at a huge tech company, the team works in US and im based in Asia, and I was promised to be able to work at my own time zone. However it seems weird because there would likely be very few colleague active during my work hours. Seems very isolating and boring.Anyone with experience like this? How can I prepare better to cope? is it a huge red flag?",31,0.89,19,https://www.reddit.com/r/cscareerquestions/comments/1qsyupi/whats_it_like_doing_a_fully_remote_role/,2026-02-01 13:45:40,2026-02-02 02:24:02
1qqy9bc,"Rejection after the final round with hiring manager, is this common?",tkyang99,cscareerquestions,"I recently passed all the technical rounds and met the hiring manager for a final round a few weeks later which I assumed was a culture fit/levelling round which I thought went well but was rejected the next day. I was shocked because I have been in this industry for over 20 years and from my experiences getting to the final manager interview almost 99% means you get the job. Because my assumption was a hiring managers time is so precious they would only talk to a finalist. So has something changed with the hiring process? (OP note: edited to make the timeline more clear, the HM manager meeting was scheduled after the tech rounds)",32,0.77,38,https://www.reddit.com/r/cscareerquestions/comments/1qqy9bc/rejection_after_the_final_round_with_hiring/,2026-01-30 06:51:47,2026-02-02 02:24:02
1qpm6uk,Anyone else feel like LinkedIn job search has become almost unusable lately?,SalariaLabs,cscareerquestions,"I don’t know if it’s just me, but LinkedIn job search has started to feel exhausting instead of helpful.Every time I search, I see:* tons of promoted jobs* the same roles over and over* jobs I already applied to still showing up* Easy Apply posts with hundreds (sometimes thousands) of applicants* listings that look relevant… until you actually open themI was spending more time filtering through junk than actually applying.Out of frustration, I ended up building a small Chrome extension for myself that lets me hide things like:* promoted jobs* jobs I already applied to* Easy Apply roles* jobs I’ve already viewed**Does anyone else feel like LinkedIn job search has gotten worse over time?** How are you dealing with it? Different platforms? Custom workflows? Just brute forcing it?Would love to hear how others are navigating this.",32,0.92,22,https://www.reddit.com/r/cscareerquestions/comments/1qpm6uk/anyone_else_feel_like_linkedin_job_search_has/,2026-01-28 19:59:28,2026-02-02 02:24:02
1qrprw2,CS Student 4-Year Plan,Temp-Name15951,cscareerquestions,"I am writing this out in case someone needs it. I am not going to bore you all with the context behind why I wrote it. I hope this is useful for someone# CS Student 4-Year Plan## Freshman Year* Join 1-2 clubs related to your major. My recommendation is to pick a general engineering one and a more niche technical one (e.g. SHPE + Robotics or NSBE + Cybersecurity)> **Note**: If you attend school online or your school does not have active clubs, you still need to network with people in person. Look for local tech meetups for your chosen programming language, tech stack, or the local makerspace. Pick 2 and show up often and be active* Pick 1 programming language and follow an in-depth tutorial or book such as Automate the Boring Stuff with Python, or a Learn GO with Tests* Keep up your GPA as best as you can. Make a regular study schedule and stick to it* Make a resume and a LinkedIn profile## Freshman -> Sophomore Summer* Get a part-time job, anything will do* Practice more for your chosen programming language## Sophomore Year* Be more active in the same 1 - 2 club(s). Join event committees, help setup at events and show up frequently to events. Aim for a leadership position when elections are next held* Go to 2+ hackathons and work on projects* Keep up your GPA as best as you can. Make a regular study schedule and stick to it* Update your resume and a LinkedIn profile. By the end of sophomore year you should have on your resume: a part-time job, some relevant coursework, 1-3 programming languages and some technologies, and active participation in a student organization* Go to your schools careers fair if they have one. Dress nicely (slacks, a dress shirt and dress shoes can be had at Walmart). Take 5 - 10 printed copies of your resume with you and make it your goal to hand out all of them to recruiters. The point is to get accustomed to talking to professionals## Sophomore -> Junior Summer* If you got an internship, congratulations you are ahead of the curve. If not get a part-time job, anything will do* Fill in gaps as necessary (Git, SQL, basic cloud stuff, HTML & CSS, Unix CLI, basic networking)* By now you should have taken a Data Structures and Algorithms class. Time to start LeetCode. You don't have to go too crazy if you are consistent. Pick 2 days a week for ~1 hr: * **Day 1**: Watch an instructional video, attempt a problem, watch the solution video, then write the code for the solution * **Day 2**: Attempt a problem (30 mins for Easy, 45 mins for Medium, 1 hr for Hard). If you can't solve it in time, watch the solution video, then write the code for the solution. If you have more time, attempt another problem * **Repeat**: Continue with Day 2 until you run out of problems on a topic. Then start again on the next topic from Day 1 Check out NeetCode 250 for a list of problems organized by type, ordered from least to most difficult, with solutions## Junior Year* Be active in the same 1 - 2 club(s), hopefully this time in a leadership position. Try to get a leadership position during officer elections* Go to 2+ hackathons and work on projects. Take resumes and be dressed decently (clean shirt and pants with no holes). Recruiters sometimes do interviews* Keep up your GPA as best as you can. Make a regular study schedule and stick to it* Update your resume and a LinkedIn profile. Make sure to have a professional headshot. Obtain 500 connections by the end of the year. Add folks in you classes, in your student orgs, and at hackathons* Go to your schools careers fair if they have one. Dress nicely. Take 10 - 30 printed copies of your resume with you and make it your goal to hand out all of them to recruiters. You NEED an internship this upcoming summer* If you have the money, go to a national conference so you can try to get an internship (e.g. SHPE, NSBE, Grace Hopper, WICSE, IEEE, etc). Dress nicely, take resumes, add people on LinkedIn* Start looking for internships in August. The goal is to get out 2+ applications out EVERY day. Don't just apply in your city, apply nationally## Junior -> Senior Summer* Do your internship and do it well. Dress nicely, ask questions, do your best work, add folks on LinkedIn. You are trying to get a return offer## Senior Year * Be active in the same 1 - 2 club(s). If you already had 1+ leadership positions feel free to take a break this year if you like. If you have not gotten a leadership position and you have not had 1+ internships you NEED to have a leadership position senior year* Go to 2+ hackathons and work on projects. Take resumes and be dressed decently (clean shirt and pants with no holes). Recruiters sometimes do interviews* Keep up your GPA as best as you can. Make a regular study schedule and stick to it* Update your resume and a LinkedIn profile* Keep up the LeetCode* Go to your schools careers fair if they have one. Dress nicely. Take 10 - 30 printed copies of your resume with you and make it your goal to hand out all of them to recruiters. You NEED a full-time offer If you have the money, go to a national conference so you can try to get an full-time job offer (e.g. SHPE, NSBE, Grace Hopper, WICSE, IEEE, etc). Dress nicely, take resumes, add people on LinkedIn* Start looking for full-time roles in August. The goal is to get out 5+ applications out EVERY day if you do not have a return offer. Don't just apply in your city, apply nationally. Feel free to apply less or be more selective if you got a return offer that you wouldn't mind taking",29,0.74,28,https://www.reddit.com/r/cscareerquestions/comments/1qrprw2/cs_student_4year_plan/,2026-01-31 02:21:16,2026-02-02 02:24:02
1qpx9cu,Completely Stumped on Next Steps. Need some career advice :(,cjlcjl12,cscareerquestions,"So, I graduated about a year and a half ago, coming up on 2 years now. Trying to break into the CS job market has felt like a complete anomaly to me. For the first while I was putting out applications left and right, though I have admittedly slowed down and tried making fewer but more tailored applications. This strategy has at least lead to a few interviews, even making it to second stage interviews. Alas though, still ending in rejection.In the meantime I have managed to get a job at a local place with benefits and worked my way up in the past few years. While the pay isn't great and doesn't pay nearly enough to move out of my parents house, its enough income that I can afford car bills and paying chunks off of my (relatively small) student loans. Thank god for scholarships.The root of my problem though is that I'm losing motivation in the job hunt, I feel like I didn't truly understand what I was getting into going in CS. Originally I started college for Phys/Astro which was something I was extremely passionate about. Unfortunately I faced serious burnout in my courses and dealt with a pretty rough episode of depression coming fresh out of the COVID era. While I was able to keep up a nice GPA I was absolutely miserable. Then I discovered programming for the first time through some of my courses!I finally found a new thing that I was passionate about and enjoyed doing, I love math, I love applying concepts learned in tangible ways and programming felt like that to me. Sadly though I didn't really understand the scope of what I was getting into, I just saw the fun new things I was learning because learning has always been one of my favorite things to do. Now I'm sat here just having turned 25 last week with absolutely no idea what to do next. I've had to move a bit over an hour from my girlfriend and friends because I can't afford to live in the area I consider home anymore. I've considered pivoting to something new but attending \*more\* school really just isn't in the cards for me at the moment besides potentially some night classes at my local community college. Even then I'm not sure what I'd pivot too and I don't want to do the blind rush into something like I did last time since that's what got me into this mess. Many of my favorite things that I believe I would enjoy as a career don't pay nearly enough to live comfortably with the economy (US) being what it is right now and things don't appear to be changing positively.I guess my question then is just, where do I even go from here? I feel like there are both 100 directions and absolutely none. I'm sitting in a dead end hole that I dug in the middle of an open field with no clear way out.",31,0.93,12,https://www.reddit.com/r/cscareerquestions/comments/1qpx9cu/completely_stumped_on_next_steps_need_some_career/,2026-01-29 03:24:21,2026-02-02 02:24:02
1qt9e1w,Advice for new grads relying too much on AI?,bagofseadust,cscareerquestions,"I am a new grad just starting a job and feel like I am relying too much on AI (mainly GitHub copilot, haven’t used Claude code yet). I rely on it to generate code, debug and basically everything I need to do on the job. I built an intern project that worked and everything with around 1000 lines of code but I still felt like I wouldn’t have been able to write 15% of that myself. Feeling major imposter syndrome at the same time. I want to better my skills and learn more so I am not just a liability to my team in the future Any advice from more experienced engineers or insights? Thank you",31,0.81,34,https://www.reddit.com/r/cscareerquestions/comments/1qt9e1w/advice_for_new_grads_relying_too_much_on_ai/,2026-02-01 20:14:26,2026-02-02 02:24:02
1qpafpw,Companies that have banned AI due to internal security policies - how are they faring?,RareMeasurement2,cscareerquestions,There seems to be two camps of AI on how it's used in companies:1) they wholly embrace it and let every department use it2) they completely ban it due to fear of data leaks or job lossesI'm curious to know how companies in the second camp are faring by banning AI?,31,0.85,39,https://www.reddit.com/r/cscareerquestions/comments/1qpafpw/companies_that_have_banned_ai_due_to_internal/,2026-01-28 12:48:05,2026-02-02 02:24:02
1qsd5ff,Leaving Corporate- Genuine Question,Basic_Simple9464,cscareerquestions,"Hello, So I work for a tech company & hate it. I hate the hustle culture, the do whatever it takes to get the job done even if that’s selling your soul to the devil. I want out. This may be a stupid question, but when people say they left corporate because it’s so toxic & ruins their mental health, where do they go? Where can you go that’s not corporate? What is considered corporate & what is not? I ask because I don’t even know where to begin to look at jobs to apply to in order to get out of corporate.",27,0.94,11,https://www.reddit.com/r/cscareerquestions/comments/1qsd5ff/leaving_corporate_genuine_question/,2026-01-31 20:22:33,2026-02-02 02:24:02
1qrd83p,Trying to get a new job and starting to panic,BraisWebDev,cscareerquestions,"I have been laid off in December, this was my last month with a contract as I had one month garden leave, during this month I have been applying to maybe 30 offers.I am currently a senior React + Typescript developer with 6+ YOE, and all the offers I applied for used the same stack and technologies I used at my current company, which is a well known product in Germany (although I work remotely from Spain)I remade my CV taking ATS into account but I am still getting the same automated rejection mail from every company, I think I just landed like 3 interviews.Is there anything else I can do to improve my chances other than keep applying through linkedin?In the meantime I am learning React Native and refreshing algorithms and some things that I forgot during the last years of not using them. But I am starting to panic, I have money to live a bit more than a year but… idk",26,0.91,22,https://www.reddit.com/r/cscareerquestions/comments/1qrd83p/trying_to_get_a_new_job_and_starting_to_panic/,2026-01-30 18:13:34,2026-02-02 02:24:02
1qnvfnb,Am I the only one who has stopped enjoying building things?,suniracle,cscareerquestions,"I have almost two years of experience as a software developer. I work for a great company, earn a good salary for my experience and age, and my career seems to be on the right track. However, I’m a little anxious about the future. I’ve always wanted to have my own project, but I’ve lost the motivation to work extra hours on it. It feels like everyone is building something, the field is saturated, and I’m just wasting my time on things that won’t succeed. I am the only one feeling like this?",24,0.86,6,https://www.reddit.com/r/cscareerquestions/comments/1qnvfnb/am_i_the_only_one_who_has_stopped_enjoying/,2026-01-26 22:35:51,2026-02-02 02:24:02
1qp6qt0,"6 years of mediocre experience, Need guidance",randomstuff009,cscareerquestions,"So as the title says I have worked in 2 jobs totaling about 6 years of experience but the issue is both are non standard jobs. The first which I worked 5 years in during the COVID-19 times was a very small company with a team of about 4 developers.Over here while I did a lot of development work nothing was up to standard and felt like it was someone's personal project.So while I did get experience it was with the very basics of the technology, no CI/CD no unit/integration testing and didn't get to work with the deployment side of things as much.While the second job was more up to standard they are moving away from java development to a closed source platform and I do not want to be stuck in a niche.So what I need to know is how do I get out of this rut? I want to try and get into a senior role is there any hope of this?What can I do to get myself to a level where I can get a job to match the amount of years I have spent?I am feeling very lost and would like some guidance.",23,0.93,13,https://www.reddit.com/r/cscareerquestions/comments/1qp6qt0/6_years_of_mediocre_experience_need_guidance/,2026-01-28 09:26:35,2026-02-02 02:24:02
