id,title,author,subreddit,content,score,upvote_ratio,num_comments,url,created_utc,extracted_at
1u2us9d,showed leadership our architecture diagram. forgot to take the last box out.,oscarm_paris,dataengineering,am i getting fired ?,1549,0.97,85,https://i.redd.it/jpcf5979nm6h1.png,2026-06-11 10:02:50,2026-06-13 03:53:42
1u0belf,"when someone asks you what programming language they should learn, don't simply answer the one you prefer",Thinker_Assignment,dataengineering,No content,707,0.98,54,https://i.redd.it/yrprsnvyv26h1.png,2026-06-08 15:35:51,2026-06-13 03:53:42
1u01pp0,This is how i look when i request the approval of a Pull Request,HMZ_PBI,dataengineering,sonetimes it takes weeks of bureaucracy,348,0.94,26,https://i.redd.it/5c8812eap06h1.jpeg,2026-06-08 08:16:09,2026-06-13 03:53:42
1u20xy5,I feel like I don't know anything. And I am nothing without Claude,Temporary_Act3174,dataengineering,"6M claude code user here.Things started great. I was astonished how I can just finish things off quickly with this beast. Overtime, I started using it as the first thing I do - be it addressing issues, planning development, writing code etc. I thought this is the way - if claude can do it for me, why bother?I observed this feeling first when claude went down for a while. I was flabbergasted. I went blank - couldn't figure out things. I think we are at a cross road here - If I dont use claude, I will get behind or layoffed. If I continue, I am not sure what I learn How do you guys maintain this balance ?",210,0.9,88,https://www.reddit.com/r/dataengineering/comments/1u20xy5/i_feel_like_i_dont_know_anything_and_i_am_nothing/,2026-06-10 12:35:12,2026-06-13 03:53:42
1u3byio,Any senior data engineers here who pivoted to ML/AI and regret it?,Beneficial_Aioli_797,dataengineering,"I'm a senior data engineer at a Big 4 firm in Spain, and I'm looking for advice on whether to pivot my career.For some context, I enjoy the engineering part, but I've realized there's less and less of it. I got into DE because I liked building systems, but increasingly it feels like moving data between the same handful of tools. It's also a role with very little visibility. I've lost count of how many times I've heard stakeholders say that delivering tables isn't an actual deliverable.The solutions are all the same, and 80% of projects use the same 20% of technologies.In contrast, ML and AI seem to pay very well. The roles and tasks look more exciting, and the problems appear more diverse.A huge factor might be that I'm pretty bad at DSA, and I can't seem to imagine finding a much better DE job without grinding LeetCode. On the other hand, I'm still pretty fresh when it comes to ML, statistics, and AI engineering concepts.For those who made the jump from DE to ML/AI, was it actually more interesting day-to-day, or was it just a different flavor of hype?",110,0.98,28,https://www.reddit.com/r/dataengineering/comments/1u3byio/any_senior_data_engineers_here_who_pivoted_to/,2026-06-11 21:24:39,2026-06-13 03:53:42
1u3ek13,I felt like making people die inside...just because,zangler,dataengineering,"* “Here is the report I use.”* “This number looks right or wrong.”* “We send this to the carrier.”* “Finance adjusts this after close.”* “That column means something different for older records.”* “Ask Lisa, she knows why that happens.”* “We exclude those sometimes, but not always.”* “The spreadsheet has the real version.”",93,0.95,20,https://www.reddit.com/r/dataengineering/comments/1u3ek13/i_felt_like_making_people_die_insidejust_because/,2026-06-11 23:11:52,2026-06-13 03:53:42
1u3vqq1,Is the industry actually swinging back to Postgres?,ForeignExercise4414,dataengineering,"Since the hyperscalars have become a thing and everyone started migrating to the cloud a decade ago the ethos has been “get data out of the RDBMS silo and onto could object storage”. Now the leading Lakehouse platform (DBRX) implemented a managed Postgres engine. Are we just putting all our data and pipelines back into a single giant centralized platform? There used to be a clear distinction between OLAP and OLTP which I felt was useful.The underlying innovations seem cool. Stateless compute nodes streaming WAL data straight to a distributed storage tier, completely disabling full page writes and slashing WAL by 90%. The first thing- is this lock-in going to be acceptable? Tying in your transactional layer directly to analytical governance (unity catalog) feels…permanent. Granted I don’t know how Databricks plans to integrate UC governance to Postgres tables, but I’m sure they will.Also- isn’t this going to lead to a lot of access pattern misuse? Postgres still has that 8TB limit. Just a matter of time till an analyst or rouge agent tried to run a massive unindexed analytical scan.Curious to hear if anyone is LakeBase or Neon in prod yet and their experience. Is it actually a velocity win or should these layers really remain separate?",52,0.83,39,https://www.reddit.com/r/dataengineering/comments/1u3vqq1/is_the_industry_actually_swinging_back_to_postgres/,2026-06-12 13:46:18,2026-06-13 03:53:42
1tyhrv0,What meetings do you deem very important to have monthly and quarterly?,ketopraktanjungduren,dataengineering,"I'm planning to build a new culture within my data team that's align with data maturity level of the company we're working at. To do that, I thought it would be helpful to have reoccurring meeting each month and quarter. Here are some topics I can think of:1. Metrics & benchmarking review (monthly or quarterly with each department), to discuss the metrics and measurements we have build and whether changes are needed or not2. Architecture review (quarterly with the management), especially to scale the technology up while pushing the cost lower3. Lessons and takeaways (monthly with internal data team), mostly about personal programming journey each member of the team has For context, most of our data pipelines are still in the development environment. Our analytics system is designed to be functional enough just to fulfill what the analyst and users needs. My team is focused on building its architecture and set up a proper dev - test - prod workflow.",32,0.86,13,https://www.reddit.com/r/dataengineering/comments/1tyhrv0/what_meetings_do_you_deem_very_important_to_have/,2026-06-06 13:48:59,2026-06-13 03:53:42
1u3phha,How to level up as a data engineer ?,dumb_user_404,dataengineering,"Let me setup a little context.I am a student in college right now. I have a pretty fundamental knowledge about Data engieering and its concepts, but I am struggling to grow as a data engineer. Below I will be listing what I know, and at last my question.What I know :\- Building ETL pipelines. \- Idempotency \- Dimensional Data Modelling \- Little bit of medallion architechture development \- airflow for orchestration Now my dilemaI am unable to level up as a data engineer, the path ahead feels confusing and abstract. I cant spend much on cloud technologies so buying big cloud platform subscriptions for now feels useless. Learing distributed architechture like spark feels confusing because no amount of data i work on is that big to require that.Honestly i just want to find some real life experience with some work but unable to find in the current market. can you guide me with the path ahead. I am also open to trying out new things like backend dev or something else if that helps in some way",34,0.85,38,https://www.reddit.com/r/dataengineering/comments/1u3phha/how_to_level_up_as_a_data_engineer/,2026-06-12 08:31:28,2026-06-13 03:53:42
1u25htx,How would you introduce data engineering to high school graduates in 20 minutes?,ThrowRAbm42,dataengineering,"I’ve been invited to give a short presentation to students who have just finished school, and I’d like to introduce them to data engineering in a way that’s engaging and inspiring.I’m also considering including a short Q&A or some kind of interactive activity or mini-project.For those who have spoken to younger audiences or work in tech outreach, what has worked well for you? Are there any analogies, demonstrations, games, or hands-on exercises that made technical topics more accessible and memorable? I’d appreciate any ideas or suggestions.",34,0.93,36,https://www.reddit.com/r/dataengineering/comments/1u25htx/how_would_you_introduce_data_engineering_to_high/,2026-06-10 15:29:55,2026-06-13 03:53:42
1tyfrkj,dbt: is my flow correct? Please suggest,installing_software,dataengineering,"Hi All, as our integrations are getting over, we will be implementing dbt. So wanted to validate my basic implementation. I have raw table let's say customer then what should be my approach/flow if I am building scd2? Below is what i am doing - Raw > stg model(materialze as view to clean,transform data)> snapshot(materialze as table tb\_customer\_snapshot with dbt meta columns) > dim\_customer(materialize as table dim\_customer with surrogate key and effective dates from dbt meta columns). Please suggest are you following the same or is there any other better approach. Appreciate your help.",35,0.95,20,https://www.reddit.com/r/dataengineering/comments/1tyfrkj/dbt_is_my_flow_correct_please_suggest/,2026-06-06 12:18:00,2026-06-13 03:53:42
1u08apk,Any reason to use the Minus operator in a Merge/Upsert command?,opabm,dataengineering,"I need to replicate some load logic for several data pipelines and scripts, and the only other developer who was on my team and wrote these scripts has retired. He had years of experience, slightly more as a software engineer than a traditional BI/data background. Only wanted to share that since it might be relevant.In these Merge/Upsert commands, the logic is essentially the following: MERGE INTO final.dim_table as tgt using ( SELECT * FROM staging.dim_table MINUS SELECT * FROM final.dim_table WHERE source_system = 'ERP' ) as src ON tgt.id = src.id AND tgt.source_system = src.source_system when matched then update set tgt.name = src.name tgt.description = src.description when not matched then insert ( name, description ) values ( name, description ) ;I honestly can't think of any reason to use a `MINUS` here. The filter on the final table (`WHERE source_system = 'ERP') does make me pause, but I don't think it makes a difference. There are other records in `final.dim_table` from other source_systems but the filter and join clause prevents the wrong product record from another source system from being updated, right? Posting this here since I have nobody to bounce this off of and would appreciate a sanity check on this.",31,0.98,18,https://www.reddit.com/r/dataengineering/comments/1u08apk/any_reason_to_use_the_minus_operator_in_a/,2026-06-08 13:42:23,2026-06-13 03:53:42
1tyxo10,Designing a demand planning system. Microsoft Power Platform vs Streamlit?,Alternative_Maize_90,dataengineering,"I’m working on designing a demand planning / min-max replenishment system for my company and would appreciate input from people who’ve built or maintained similar systems in production.Current problem We have \~70K item/location combinations that need to have: \- Monthly min/max calculations \- Demand forecasting (currently considering Holt Winters/smoothing models) \-Planner overrides at the month level \-Parameter-driven logic (forecast horizon, safety stock days, etc.) \-Output exported as a flat file (TXT) that is loaded into an ERP system \-not a real-time system, it runs in monthly cycles: Load historical + inventory data from ERP Generate forecasts + min/max values \- Allow planner overrides \- Export updated file back into ERPRequirements \- Batch processing (75k rows is normal scale, not interactive browsing) \- Override capability that should trigger recalculation for impacted items \- Audibility (who changed what and when) \- Maintainability long term (this will become a core business process)What I’’m trying to decide is if I should go with MS or py for my build. 1. Microsoft stack SQL Server for data + logic Power Apps for override UI Power BI for reporting Power Automate / Fabric for workflows + refresh2. Python + Streamlit style system Custom app with full control over forecasting logic and be able to implement models, custom graphs, ML, etc.Is Power Platform actually viable for a system like this, or does it suck? I haven’t used it only power automate along time ago and it was unreliable but I’ve heard it’s gotten better.Would you avoid Streamlit for anything production facing in a corp environment?",28,0.91,41,https://www.reddit.com/r/dataengineering/comments/1tyxo10/designing_a_demand_planning_system_microsoft/,2026-06-07 00:40:54,2026-06-13 03:53:42
1u0d11s,How to research and find real industry/data problems to solve?,Old_Mind8618,dataengineering,"Hi, i've got an upcoming project and i want to do a data engineering project.Our professor advised us to start researching problems to solve. I do not want to replicate generic top 10 data engineering projects. I'm currently looking for clues in opensource projects and data journals.I'd appreciate sources/links on where to start and what to look for if anyone has done this sort of thing before.",26,0.91,17,https://www.reddit.com/r/dataengineering/comments/1u0d11s/how_to_research_and_find_real_industrydata/,2026-06-08 16:33:18,2026-06-13 03:53:42
1u2zwr6,docker + airflow question,random-soul-feeder,dataengineering,"hey, guys. I need some help with a personal project, concerning docker and airflow. It's a study project, and I've never used docker and airflow. I already know the concepts, DAG, containers, images, docker file, etc. My question is, I need my project to run wether my PC is on or not, I have all my files set up, but how does it work the process of having it running with my PC off? I've made some research and it seems that I need to upload my containers into a VPS, how does it work?please keep in mind that it's a small project, and I dont want to spend to much money with a cloud service at the beggining. can anyone help me? thanks",25,0.9,14,https://www.reddit.com/r/dataengineering/comments/1u2zwr6/docker_airflow_question/,2026-06-11 14:00:50,2026-06-13 03:53:42
1u3wmr1,Clean data using pandas before loading data or using SQL after loading data into warehouse?,Old_Mind8618,dataengineering,"I have a very simple pipeline:SOURCE(S3 json files) -> load using pandas script -> push data to warehouse -> Staging(deduplication) -> production.My question is:Should cleaning of data be done when loading data using the pandas script or should it be done in the staging step after data is loaded?if i do cleaning in the pandas step i would:* rename columns to appropriate names* remove any bad values like bad dates and coerce them to become nulls* cast all columns to correct data types* at the end push data to predefined raw table schema with the expected data typesif i do cleaning in the staging step then in the pandas step i would only:* only predefine the raw table schema with loose types like text to accept unexpected values* push data to raw table* then do all the cleaning using SQLi want do do cleaning in SQL but honestly it seems like a hassle compared to pandas. Just an example:`elif conf_col_type == 'datetime64[ns]':` `df[col] = pd.to_datetime(df[col] , errors='coerce' , dayfirst=True).dt.date`",23,0.96,43,https://www.reddit.com/r/dataengineering/comments/1u3wmr1/clean_data_using_pandas_before_loading_data_or/,2026-06-12 14:19:56,2026-06-13 03:53:42
1u237ii,Nervous about first DE job,WillDill2,dataengineering,"Title pretty much says it all. I graduated a few weeks ago with a degree in geography and a minor in data science and landed a relatively high paying data quality engineer role shortly after. I know some of you are probably wondering how I landed this job with that education, but my degree was pretty technical and I had an internship through my last year of school that I spent primarily working with a senior data engineer. The job was originally posted as a mid level position but I guess they really liked me in the interviews and ended up offering me the job.Anyways, I’ll be primarily responsible for data QA/QC using Oracle PL/SQL. I feel pretty comfortable with SQL but haven’t used a ton of PL/SQL, but I do have a lot of experience with other procedural languages. During my internship I used GCP and BigQuery a ton, which I feel is a lot more modern and user friendly than Oracle. I start in a little less than a week and was curious what advice you all may have for me. I guess I’m just kinda nervous that they will be expecting a lot from me given how much they’re paying me, and I am not sure what the culture within the dev team is like. I feel like some dev teams are kinda intimidating and competitive.",23,0.93,13,https://www.reddit.com/r/dataengineering/comments/1u237ii/nervous_about_first_de_job/,2026-06-10 14:06:44,2026-06-13 03:53:42
1u35g6s,"Building Production Semantic Search: A Practical Guide to Embeddings, ANN, and Vector DBs",Veduis,dataengineering,No content,18,0.95,1,https://veduis.com/blog/vector-search-fundamentals/,2026-06-11 17:24:24,2026-06-13 03:53:42
1u2p784,Work annoyances (?),device2025,dataengineering,"Hi everyone, so I have been a data engineer for about 2+ years, working in a mid-sized organization. My team supports a lot of the data pipelines, and I maintain, build, and improve data pipelines, plus sometimes get pulled into analytical workstreams as well.I am not in a tech company, and I feel like a lot of the non-technical individuals (i.e., business development managers, salespeople, and senior management) treat data engineers and ""technical people"" without any respect at all. The worst experience I had was when I spoke with a director, who claims she has a ""background in engineering"" but then proceeded to misunderstand everything, and then ultimately provided the worst possible technical guidance.Some of the middle managers also have this holier-than-thou attitude and even told my colleague that most of the data engineering work ""can be automated by AI"".Anyone has a similar experience? I would be grateful if anyone could provide some career advice on how to navigate non-technical corporate hierarchies, or whether I should just pack up and leave for a tech company.",12,0.88,10,https://www.reddit.com/r/dataengineering/comments/1u2p784/work_annoyances/,2026-06-11 04:42:39,2026-06-13 03:53:42
1u0nbrn,Databricks: Feels strongest for transformations.,Due-Advantage297,dataengineering,"I’ve been building a medallion architecture pipeline in Databricks.For this project, I built Marathos Atlas event using : \- Medallion architecture / Bronze , Silver and Gold layers. \- Pyspark and Lakeflow pipelines \- Unity Catalog \- Streaming ingestion , which makes the streaming tables for Bronze and silver \- Data cleaning and transformation \- Dimensional modeling \-Gold views for analytics \- Databricks Dashboard for insights (KPI’s) \- Genie space for stakeholders or users to query the data What would you do differently in this project?",9,0.67,18,https://www.reddit.com/r/dataengineering/comments/1u0nbrn/databricks_feels_strongest_for_transformations/,2026-06-08 22:44:15,2026-06-13 03:53:42
1u42vlb,Reduce Dagster Cloud credits by collapsing your dbt project,YoungVundabar,dataengineering,"Hello Dagster crew! The Dagster Cloud pricing change last month also took our team by surprise. The biggest, quickest thing we could do to cut down the cost was to collapse our DBT project into a single asset.This lowered the credit use by 60%. The tradeoff is that we now have a is coarser observability. I finally got to sit down and write an blog post about it. I hope ot helps someone!",7,0.9,0,https://www.narev.ai/blog/lower-dagster-bill,2026-06-12 18:04:37,2026-06-13 03:53:42
1u3hu8f,Columnstore payloads over the network.,SmallAd3697,dataengineering,"Columnstore data at rest (and in memory) is pretty popular nowadays. Even for conventional relational databases.&#x200B;However delivering columnstore data over the network to a remote client from a SQL engine is much less common. I keep waiting for Microsoft to enhance their TDS wire protocol to send data with columnstore compression but it hasn't happened yet.&#x200B;It almost seems like a ""no brainer"" to offer this technology, especially in a cloud environment when working with large datasets. I don't understand why it isn't a priority. Even in their modern DW stack (Fabric LH and DW) they are not innovating in this way yet. They send data to clients with row-based serialization. &#x200B;What is the deal? Is Microsoft's technology stack so old and rigid that they can't change it? Obviously there are workarounds. But they aren't perfect. (Instead of using SQL endpoints, we might also connect directly to the underlying blobs via ADLS gen2. However that isn't always advisable since it won't play well with in-flight transactions.)",6,0.81,11,https://www.reddit.com/r/dataengineering/comments/1u3hu8f/columnstore_payloads_over_the_network/,2026-06-12 01:42:26,2026-06-13 03:53:42
1u2itjk,"IceStream: Asynchronous, Diskless, Efficient Converter for Iceberg Equality Deletes to Deletion Vectors",jordepic,dataengineering,"Hi all! Just wanted to provide an update here after iterating on feedback from this community.The Iceberg table ingestion problem from streaming engines has gone unsolved for a few years now, and I hope that this takes it a big step forwards! Streaming engines tend to publish equality delete files for primary key tables, which are highly read-unoptimized. IceStream uses Apache Paimon tables to store secondary indexes of iceberg tables, allowing efficient index joins between equality deletes and Paimon tables.Feel free to check it out! I'd love your thoughts on either the idea or the architecture! I've now benchmarked this and can provably demonstrate the speedup in removing equality deletes from large iceberg tables.",6,0.81,1,https://github.com/jordepic/icestream,2026-06-10 23:43:53,2026-06-13 03:53:42
1u0f9np,AI Workflows - Ralph Loops/Ticket based Agentic Workflows,KrixMercades,dataengineering,"Ok now that I've got your attention with clickbaity headline, this is really a question to better understand what others are doing in the space right now. For context - I've got a four person data engineering team on what is probably the most boring tech stack on the planet right now. Fivetran + AWS feeding straight into Snowflake, DBT Cloud for Transformation and Orchestration, Sigma for BI.For AI, we're on Anthropic right now. So in addition to our tech stack, we have an MCP Stack that works something like this:1. Source System has Direct MCP2. We build it - Then it's Rest API on AWS Lambda, MCP on AWS Lambda, .Skill file/zip to govern the MCP Effectively we are still at human triggered, human reviewed workflows with AI, but the platform that we are working out of has a lot of connectivity. And I'm happy to get into weeds about how we handle for context/biz rules etc. But not really relevant to the question.Few weeks back, I'm at a party, and some of my friend's friends are in the SWE space at other firms and talking about what they are doing in the space which is getting into this Jira triggered workflow where AI Agents iterate using the ""Ralph Loop"" to begin work, and each agent has a specific Role. (Research -> Spec -> Execution -> QA) which fair enough. Has anyone gone through and done this in the data space, where the focus is still on a data warehouse, and if so how did you go from the jump of human directed to the ""Agentic"" workflow?",7,0.63,8,https://www.reddit.com/r/dataengineering/comments/1u0f9np/ai_workflows_ralph_loopsticket_based_agentic/,2026-06-08 17:51:47,2026-06-13 03:53:42
1u02u6t,"QueryFlux: Multi-engine SQL query router in Rust—with routing, queuing, and sqlglot dialect translation",codingdecently,dataengineering,No content,6,0.69,1,https://github.com/lakeops-org/queryflux,2026-06-08 09:23:12,2026-06-13 03:53:42
1u2708r,Building knowledge layer with ontos databricks vs neo4j,na_kanchit_sashwatam,dataengineering,"Hi All, Advantages of ontos databricks with respect to building knowledge layer vs using neo4j for the same. Any suggestions for implementing ontos databricks and how can be achieved,since it's yet to be released as prod version in dbr . Would like to hear your suggestions",6,0.8,5,https://www.reddit.com/r/dataengineering/comments/1u2708r/building_knowledge_layer_with_ontos_databricks_vs/,2026-06-10 16:23:05,2026-06-13 03:53:42
