id,title,author,subreddit,content,score,upvote_ratio,num_comments,url,created_utc,extracted_at
1pypu6b,What jobs do people do after software engineering?,lol_fi,cscareerquestions,"I've been in this career for 6 years but I've been feeling like I'm falling behind my peers and people younger than me. I genuinely do not feel good at this anymore and fear for being able to keep up as AI is coming. I work in an aerospace/defense space and AI is coming a lot slower. I don't feel like I've learned as much as I should, and I recently had a baby and don't feel like I have hours to put in to learn and study outside of work. I feel regretful that others in my field and others are growing in their career and I'm stagnating and feel trapped. I'm 32 so I still have 35 years of career to go, even though it feels hard to start a new path when others have been growing in their path. My sister is getting ready to become a PRN and I feel so jealous! Although the nursing path would probably never have been open to me - she's been working night shifts in the ICU and I couldn't deal with the trauma and night schedule. For those who have left CS or are planning to leave, what did you do or what do you plan on doing?",148,0.92,107,https://www.reddit.com/r/cscareerquestions/comments/1pypu6b/what_jobs_do_people_do_after_software_engineering/,2025-12-29 15:55:45,2025-12-31 01:49:05
1pulos2,Where in the world would you move to improve your chances of getting jobs in tech?,Emergency_Price2864,cscareerquestions,where and why?,153,0.88,111,https://www.reddit.com/r/cscareerquestions/comments/1pulos2/where_in_the_world_would_you_move_to_improve_your/,2025-12-24 11:54:10,2025-12-31 01:49:05
1pzn5wp,Algorithm complexity analysis during remote technical screens,SeveralAd6597,cscareerquestions,I have a hard time explaining Big O analysis during remote coding sessions even though I understand it When I'm alone I can work through problems and know the complexity but on video calls where I'm sharing my screen and they're asking me to walk through it I mess up the explanation and this happens consistently btw like enough that it's becoming a problem If anyone has found a way to get better at verbalizing this stuff I would love some tips,124,0.98,11,https://www.reddit.com/r/cscareerquestions/comments/1pzn5wp/algorithm_complexity_analysis_during_remote/,2025-12-30 16:53:26,2025-12-31 01:49:05
1pxsf6v,Who is planning to change jobs next year?,Shoeaddictx,cscareerquestions,"I have a total of 3.5 years of experience in a full-stack direction (Next.js, React.js, Node.js (Express.js), Postgres, TypeScript), and I’m quite underpaid, so that’s my plan for next year, looking for a new job. I’ve been at my current place for 2 years.What about you?",109,0.94,54,https://www.reddit.com/r/cscareerquestions/comments/1pxsf6v/who_is_planning_to_change_jobs_next_year/,2025-12-28 14:19:17,2025-12-31 01:49:05
1pw6nbl,Should I quit my 100k job because of the toxic work culture?,fsdklas,cscareerquestions,"I’ve been working at a Fortune 500 automotive company for 4 years now but the culture has gone to shit. They brought in new execs and started stack ranking everyone. The bottom 10% is getting laid off every year now and no one is helping each other, everyone is out for themselves. I’ve thought about quitting but looking at the job market it seems very difficult right now. My old work friend quit and it’s been 6 months and he hasn’t found a job yet. Honestly I’ve just been waiting about getting laid off now. The only thing that is keeping me there is the lunch friends I made with others not on my team but the rest of the company has gone to shit. I keep thinking I’ll get fired tomorrow. I had an old work friend who got laid off and they just shut off his work laptop. They didn’t even tell him anything. I’ve just been checking my Workphone in case I got fired or not. Should I just quit or should I wait until I get laid off while applying to new companies? I haven’t gotten any new interviews lately so it’ll be difficult",112,0.89,84,https://www.reddit.com/r/cscareerquestions/comments/1pw6nbl/should_i_quit_my_100k_job_because_of_the_toxic/,2025-12-26 15:18:29,2025-12-31 01:49:05
1puwtmr,"21M, CS + Data Science major unable to find full-time job, even in the NYC metro area. Am I doomed?",MarathonMarathon,cscareerquestions,"So I'm soon to become one of those ""unemployed CS majors"" everyone keeps talking about once I graduate. I've been struggling to find meaningful employment, and don't have a job lined up. The way things are currently heading, after graduation I'm likely just heading back to my mom's house and maybe working some shitty retail job with 0 upward mobility. This is a future some people (including some friends) from my high school have achieved without attending college, and if that's my future, it means my mom will have wasted 4 years on an expensive degree that ended up being worthless.I'm well aware that it only gets harder and harder to find a full-time job the longer you wait after graduating. Which is why I'm frightened of being jobless or underemployed once that happens, and then having an awkward gap in my resume to have to explain, which only gets more and more awkward the longer I wait.The roles I've been applying to include SWE, data analysis, data engineer, and data science. While my undergraduate internship grinds have been very hit-or-miss, I have some ""roundabout"" experience (multiple unpaid internships + paid research) on my resume, some of it ongoing (and my performance there has been satisfactory), which I've been told is enough to land me interviews, which I have. It's just that I've been struggling to pass these interviews. I've known people who've managed to hand-wave themselves in through interviews just by talking a bit, but I've somehow failed even one of those when given one (though that was partially my fault since my reference waved me through without even giving me the JD).My clear metric for ""success"" is having enough money to *be able to* move away from home and afford a non-shitty apartment if I wanted to (and in the event I don't, it'll be because the job is in my metro area, aka NYC). If I don't achieve this, I'll have failed. I wouldn't say I'm asking for much, and I feel like this is a quite reasonably low bar to clear, and if I don't clear it, I'm a failure.Now that it's Christmas already and I still don't have any kind of post-college offer in hand, things are not looking up. I've barely applied to any positions between Thanksgiving and Christmas and have secured 0 new interviews therein. I barely even grind Leetcode anymore, since it just makes me disappointed whenever I fail questions that are supposedly ""Easy"" or ""Medium"". If you gave me a Leetcode-style interview or OA right now, I'd probably fail it. I've yet to actually receive such an *interview* (OAs I have, with mixed performance), but I'm well aware that many companies do ask them. A lot of what I've failed so far is behavioral, though I've passed a few.I've received mixed messaging on whether to consider grad school. My parents aren't going to pay for it and I'll have to take out expensive loans if I do go for it. And I know cheap online programs like OMSCS exist, but I don't know if they're right or if it'll be too challenging, and I'm not even sure if it's something I'm seriously invested in either. The whole field just seems like a sinking ship with AI and all, and people seem to be right about there being no need to hire any more juniors.I just want to know what to do, because things seem absolutely grim, and people who've been through 2008 keep calling me entitled and telling me that the job market now isn't nearly as bad as 2008. Keep doing what I'm doing and hope something lands? But if nothing lands, what then? Certmaxx and pivot to IT? Push boxes in some Amazon warehouse alongside people without college degrees, rendering the degree worthless?",104,0.81,132,https://www.reddit.com/r/cscareerquestions/comments/1puwtmr/21m_cs_data_science_major_unable_to_find_fulltime/,2025-12-24 20:40:28,2025-12-31 01:49:05
1pymg1m,What was your GPA and how much has it affected your Career assuming you Got a Bachelor’s Degree in Computer Science?,An_Engineer_Near_You,cscareerquestions,Just curious how much a degree even matters.,90,0.88,152,https://www.reddit.com/r/cscareerquestions/comments/1pymg1m/what_was_your_gpa_and_how_much_has_it_affected/,2025-12-29 13:35:30,2025-12-31 01:49:05
1pwn4n2,Am I just wasting my my free time by avoiding AI when building projects?,CantStantTheWeather,cscareerquestions,"So I'm a junior SWE with 1 year of experience and I started working on a side project just for the sake of getting better at the language and tools I use. I don't like using AI because I feel like I do nothing myself and my goal is to learn. It seems like most people building projects are using AI tho, and it makes me wonder if I'm just wasting my time by not using it. I do ask questions to Claude but just basic syntax questions that I could just google but I never ask it to actually write code for me and copy paste it. I like to think there's still value in learning to code without AI but at this point, it looks like future engineers might not even need to understand coding technologies deeply because AI will keep improving and they'll basically just be AI prompters.What do you guys think?",81,0.87,75,https://www.reddit.com/r/cscareerquestions/comments/1pwn4n2/am_i_just_wasting_my_my_free_time_by_avoiding_ai/,2025-12-27 03:11:06,2025-12-31 01:49:05
1pvf6oe,Are traditional engineering degrees safer than CS nowadays?,userh1bcr1lwg3,cscareerquestions,"I’m a first-year CS student, and honestly, the job market has been stressing me out. Between tech layoffs, market saturation, and the rapid rise of AI, it’s hard not to feel anxious about the future of this field.Luckily, I’m still a freshman, so if shifting to another degree would truly offer better job security and a more stable income, I wouldn’t hesitate to consider it.Don’t get me wrong: I genuinely love tech. I can see myself studying and working in this field long-term because of how vast and interesting it is. But we also can’t deny reality: the industry feels oversaturated, entry-level roles are extremely competitive, and the barrier to entry is relatively low. Anyone who self-studies can technically enter the field (even if they don’t have the same depth as someone who studied CS formally), and that definitely affects competition.So my question is this:If you were in college right now, still studying CS and not yet graduated, would you consider shifting to a traditional engineering degree instead?I’m talking about fields like:Electrical EngineeringElectronics EngineeringMechanical EngineeringCivil EngineeringDo these degrees actually offer better long-term job security compared to CS today? Or is the grass just greener on the other side?PS: I know some people will say, “If you’re doubting CS, then it’s not for you,” or that those who truly grind will succeed—or that this is just a way to reduce competition. That’s not my intent. I’m just trying to be realistic and pragmatic. I still see myself pursuing CS, but I want honest perspectives before it’s too late to pivot.Would really appreciate your thoughts.",79,0.9,82,https://www.reddit.com/r/cscareerquestions/comments/1pvf6oe/are_traditional_engineering_degrees_safer_than_cs/,2025-12-25 15:05:08,2025-12-31 01:49:05
1px4ppj,How do you move from small company to big tech?,Friendly_Rock_2276,cscareerquestions,"I am lucky to have gotten an internship at a small company doing .net mobile dev, and I have graduated and taken the return offer. How do I move on from here? I feel like my work here as a mobile dev going bug to bug and feature to feature isn’t really that meaningful, how do you get into big tech after graduating?",83,0.94,112,https://www.reddit.com/r/cscareerquestions/comments/1px4ppj/how_do_you_move_from_small_company_to_big_tech/,2025-12-27 18:23:56,2025-12-31 01:49:05
1pz24ow,I want to quit my job because of anxiety,anabeluga19,cscareerquestions,"I am working as a software developer in an international medium/big sized company (800 employees). I started off as a QA intern an got offer in software dev. I hate it so much, but mostly I hate it because of the daily standups we have. My manager likes to ask detailed questions about what everyone did and I am honestly probably getting dumber every day because I am getting worse at coding as the day goes. I think my anxiety is killing me. The ""urgency"" that I need to get something done otherwise I will embarrass myself in the standup (he opens each ticket and asks specific questions).I sometimes ping people on slack, they don't reply. I try coding, and just end up vibe coding. I feel like I have grown a hatred towards this profession the last few months. Every day just feels dreadful for me. The job is remote, so I have also found myself trying to fix bugs, or finding shit to just do at night or on weekends so I can show something..I don't even know how they accepted me in the first place, even less how I got the return offer. I am not a good ""coder"" or ""problem solver"". I feel like this job has made me lose all my confidence that I had ngl.",78,0.85,69,https://www.reddit.com/r/cscareerquestions/comments/1pz24ow/i_want_to_quit_my_job_because_of_anxiety/,2025-12-29 23:44:51,2025-12-31 01:49:05
1pxsf6m,Is software career over for me?,One-Specialist2785,cscareerquestions,I’ll just make this quick and to the point. I graduated from a low tier CS school in Canada in summer 2024. I have no experience and since then I’ve gotten maybe two software dev interviews which I didn’t make it past round one. I just accepted a job that’s low level IT that pays 20/hr because it’s literally the best thing I could get and I can’t sit around working retail anymore. I’m pretty depressed about how little money I’m going to be making at my age especially after completing a 4 year degree. Are my dreams of one day being involved with software pretty much over? I was even trying to get into QA and application support but got complete silence from all my applications so now I’m stuck doing grunt IT work. Anyone else is a similar position? I feel like I’ve probably ruined all my chances at a good paying job and decent to high income.,77,0.86,50,https://www.reddit.com/r/cscareerquestions/comments/1pxsf6m/is_software_career_over_for_me/,2025-12-28 14:19:17,2025-12-31 01:49:05
1pwjjow,Does quick job hopping look bad?,Administrative_Bar46,cscareerquestions,"Hey everyone,I am in a tricky situation. I graduated from college about two and a half years ago and started my career at a Big 4 company, where I stayed for two years. I then joined Amazon, but my role was impacted by a layoff after eight months tenure. I was fortunate to find another job fairly quickly. The new role offers about $20K less in compensation, but it provides strong opportunities for career growth.how long should I plan to stay at this company before considering my next move?",73,0.88,53,https://www.reddit.com/r/cscareerquestions/comments/1pwjjow/does_quick_job_hopping_look_bad/,2025-12-27 00:22:46,2025-12-31 01:49:05
1pxd3bg,I'm about to become senior but I can't write a project from scratch. Is this normal behaviour?,scoopydidit,cscareerquestions,"I've been working within the same company for 5 years. I am very good at my job in the sense that I can get stuff done very quickly and I'm an SME for our internal infrastructure tools.However, whenever I try to code any project from scratch (hobby stuff after work hours), my brain turns to mush. All skills go out the window.But then the next day I'll be back mucking around in a large codebase tweaking functions or refactoring and I'll find the answers, regardless of difficulty.I don't know if this is the norm. I feel a bit of imposter syndrome because of this.",70,0.85,75,https://www.reddit.com/r/cscareerquestions/comments/1pxd3bg/im_about_to_become_senior_but_i_cant_write_a/,2025-12-28 00:24:31,2025-12-31 01:49:05
1pz9x0l,Not sure where to go next,Guy-Lambo,cscareerquestions,"I was laid off 6 months ago. I've worked as a software eng in the bay area for about 13 years. I'm 38 now so I'm not young anymore but I still have to work since I can't retire.I've always considered myself as average intelligence for a software engineer with a very strong work ethic. This often got me noticed and promoted at the companies I've worked for. Technically, there are usually a few engineers on the team that are better than me.Interviews were never easy back then for me but I always felt like the jobs were given to me since my experience was great. I would typically talk about my projects and then do some whiteboarding problem where it felt like I was working alongside the interviewer. I think I've had probably 8 interviews in my entire life and got a no offer on 3 of them until recently.Ever since my layoffs, I've failed probably 5 interviews in the first or second round. The furthest I got was 5 rounds(they wanted a few more rounds and I could tell they were not super enthusiastic about me). The interviews seem a lot more toxic recently with interviewers asking me questions like ""what value can you bring if AI can do those things?"" With all these things, I stopped looking for a tech job completely and found a part-time retail job.I'm fortunate enough to have a small savings and the part-time retail job is slowing down my burn. I'm trying to break away from tech right now and find any career worth getting into where I can afford a family in the future ($20/hr in retail is very hard to make work for a single person). I have a year or two to figure something out.I spend some of my free time at the library just reading to get ideas on where I can go but I feel so lost. Here are some options I'm thinking about:**1. Grind leetcode, study AI/design, work on interview skills and keep interviewing until I find a tech job.***Pros:* *- Clear objectives* *- Good pay* *- Job is interesting for the most part**Cons:* *- Layoffs still on the table* *- Extremely difficult to get an offer (I dont even know what to study since questions are so random)* *- I really do not want to grind leetcode anymore***2. Change careers***Pros:* *- Fresh start and something that aligns better with my values* *- Maybe better work-life balance than eng (tradeoff with lower pay is fine)**Cons:* *- Have to do some soul-searching to find next career* *- Probably difficult to switch careers* *- Most jobs are probably slower and less mentally stimulating***3. Start a business***Pros:* *- Be your own boss (kinda not really)* *- No leetcode**Cons:* *- Hard grind that requires all your focus and dedication* *- I prefer more stability*With those 3 options, I'm leaning towards changing careers. The starting a business is something I think about a lot but it's not something I can just pull out of nowhere. The thought of going back into tech gives me anxiety through the roof. Unfortunately, I dont know what careers I can change into. The general field people around reddit have been proposing are the HVAC/therapist/nursing variety.I'm feeling lost right now and just wanted to air some thoughts out. Thanks for reading. Would love any thoughts or stories/experiences on how people are navigating this.",61,0.92,32,https://www.reddit.com/r/cscareerquestions/comments/1pz9x0l/not_sure_where_to_go_next/,2025-12-30 05:42:24,2025-12-31 01:49:05
1pzcxn8,Selling vested RSUs after leaving FAANGs,sesquipedalianinfj,cscareerquestions,"Hi everyone,I formerly worked at one of the FAANGs whose stock appreciated significantly during the time I was there. I never sold any stock whilst I was employed there, so I have a significant chunk of RSUs sitting in my investment account.Reading about my former company in the news now, I don't feel particularly confident about holding on for too much longer, but equally, I've spent enough time in tech to know that anything can happen in the market (although the AI wave does have me ever-so-slightly concerned). What have former FAANG employees who didn't sell during their employment done after? I'd appreciate any insights. I'm leaning towards selling 90% and holding 10%, but if there are better strategies I can consider, open to hearing from folks about that, too. P.S. Fully aware choosing to buy/sell is purely based on my own financial needs + goals, but this post is more focused on general advice and if former FAANG folks are holding or selling their RSUs",55,0.83,63,https://www.reddit.com/r/cscareerquestions/comments/1pzcxn8/selling_vested_rsus_after_leaving_faangs/,2025-12-30 08:36:03,2025-12-31 01:49:05
1pvwuzd,Back to optimization?,No_Leopard_9321,cscareerquestions,"I really enjoy lower level computing, abstractions just continuously make me want to dig-deeper.Everyone tells me besides more niche systems level software or networking stuff, that there isn’t a large market for low-level efficient code.Now that we’re seeing memory shortages and hitting physical constraints on computing, do you think there will be a resurgence in the need and demand for highly efficient and optimized code? Is it worth my time to focus on that more specialized skill-set vs just learning how to program at the higher levels?",39,0.88,36,https://www.reddit.com/r/cscareerquestions/comments/1pvwuzd/back_to_optimization/,2025-12-26 05:46:10,2025-12-31 01:49:05
1pupqmx,Toxic work culture or not ?,breqa,cscareerquestions,"This is my first time working on a team where the majority of members, including the leadership, are Indian. I’ve noticed a tendency to rely more on verbal guidance rather than written technical documentation. There is also a strong focus on visibility, and long meetings—sometimes four hours or more—to address urgent issues are quite common.Additionally, there is little to no documentation for some of the most critical implementations. When something important or urgent needs to be fixed, we often have to rely on someone else to jump in and provide guidanceAt this point, I honestly find myself wondering whether this is normal in some teams or if I’m just being overly sensitive about it.For additional context, I’m writing this while working today, December 24th.Edit: F*ck this company. I’m not going to accept 5–7 hour calls just to fix stupid bugs that one person could solve if proper documentation existed.I’m not going to waste my energy convincing leadership to use fucking documentation or Confluence.This is a horrible hustle culture, where people just want to look like “essential” team members.There isn’t a single decent architecture diagram for this f*cking project.Edit:Actively looking for another job now.",38,0.85,29,https://www.reddit.com/r/cscareerquestions/comments/1pupqmx/toxic_work_culture_or_not/,2025-12-24 15:20:13,2025-12-31 01:49:05
1px4ert,Is there anyone here who found a job through the 'Hacker News Ask HN: Who is hiring?' page?,Shoeaddictx,cscareerquestions,"Every month a post packed with job listings is published under the name Ask HN: Who is hiring? (current month, 2025), full of listings, email addresses, etc.Like this: https://news.ycombinator.com/item?id=46108941Is there anyone here who found a job through this? Is it worth it?",34,0.87,18,https://www.reddit.com/r/cscareerquestions/comments/1px4ert/is_there_anyone_here_who_found_a_job_through_the/,2025-12-27 18:11:32,2025-12-31 01:49:05
1pysiwu,"New grads that worked/work at a startup, do you regret it?",keeperpaige,cscareerquestions,"I’m so scared I might not like it, get burnt out, etc.",31,0.93,49,https://www.reddit.com/r/cscareerquestions/comments/1pysiwu/new_grads_that_workedwork_at_a_startup_do_you/,2025-12-29 17:36:02,2025-12-31 01:49:05
1pw4vew,How do people qualify for senior+ technical roles when most projects don't give you the opportunity to grow,MoneySounds,cscareerquestions,"A common theme is that companies want to hire senior and they're always head hunting for people who can solve problems but at the same time from my POV as a junior developer most tasks seem to be implementing business logic, fixing bugs and changing different configs.I don't really see an opportunity for tasks that can help you grow and learn and if they do exist there is a timeline in which they need to be implemented. There is no pair-programming so you can't exchange ideas or receive guidance on how to solve or implement them.So how do people do it?",28,0.82,19,https://www.reddit.com/r/cscareerquestions/comments/1pw4vew/how_do_people_qualify_for_senior_technical_roles/,2025-12-26 13:56:31,2025-12-31 01:49:05
1puwk3k,Where do people seriously find software engineering jobs?,mylogicoveryourlogic,cscareerquestions,"When I search up ""software engineer"" on linkedin, for New York City metro, I get jobs like:""Software Engineer"" by ""Career Search Partners"" (obvious Indian resume harvest scam) There seriously seems to be no ""real"" jobs out there. like 80% of them fall into the above mentioned category, or they require like 10 years of experience as a senior. Lol",25,0.65,44,https://www.reddit.com/r/cscareerquestions/comments/1puwk3k/where_do_people_seriously_find_software/,2025-12-24 20:27:33,2025-12-31 01:49:05
