id,title,author,subreddit,content,score,upvote_ratio,num_comments,url,created_utc,extracted_at
1u2us9d,showed leadership our architecture diagram. forgot to take the last box out.,oscarm_paris,dataengineering,am i getting fired ?,1698,0.97,93,https://i.redd.it/jpcf5979nm6h1.png,2026-06-11 10:02:50,2026-06-18 04:05:27
1u3byio,Any senior data engineers here who pivoted to ML/AI and regret it?,Beneficial_Aioli_797,dataengineering,"I'm a senior data engineer at a Big 4 firm in Spain, and I'm looking for advice on whether to pivot my career.For some context, I enjoy the engineering part, but I've realized there's less and less of it. I got into DE because I liked building systems, but increasingly it feels like moving data between the same handful of tools. It's also a role with very little visibility. I've lost count of how many times I've heard stakeholders say that delivering tables isn't an actual deliverable.The solutions are all the same, and 80% of projects use the same 20% of technologies.In contrast, ML and AI seem to pay very well. The roles and tasks look more exciting, and the problems appear more diverse.A huge factor might be that I'm pretty bad at DSA, and I can't seem to imagine finding a much better DE job without grinding LeetCode. On the other hand, I'm still pretty fresh when it comes to ML, statistics, and AI engineering concepts.For those who made the jump from DE to ML/AI, was it actually more interesting day-to-day, or was it just a different flavor of hype?",144,0.99,38,https://www.reddit.com/r/dataengineering/comments/1u3byio/any_senior_data_engineers_here_who_pivoted_to/,2026-06-11 21:24:39,2026-06-18 04:05:27
1u3ek13,I felt like making people die inside...just because,zangler,dataengineering,"* “Here is the report I use.”* “This number looks right or wrong.”* “We send this to the carrier.”* “Finance adjusts this after close.”* “That column means something different for older records.”* “Ask Lisa, she knows why that happens.”* “We exclude those sometimes, but not always.”* “The spreadsheet has the real version.”",128,0.95,23,https://www.reddit.com/r/dataengineering/comments/1u3ek13/i_felt_like_making_people_die_insidejust_because/,2026-06-11 23:11:52,2026-06-18 04:05:27
1u3vqq1,Is the industry actually swinging back to Postgres?,ForeignExercise4414,dataengineering,"Since the hyperscalars have become a thing and everyone started migrating to the cloud a decade ago the ethos has been “get data out of the RDBMS silo and onto could object storage”. Now the leading Lakehouse platform (DBRX) implemented a managed Postgres engine. Are we just putting all our data and pipelines back into a single giant centralized platform? There used to be a clear distinction between OLAP and OLTP which I felt was useful.The underlying innovations in LakeBase seem cool. Stateless compute nodes streaming WAL data straight to a distributed storage tier, completely disabling full page writes and slashing WAL by 90%.The first thing- is this lock-in going to be acceptable? Tying in your transactional layer directly to analytical governance (unity catalog) feels…permanent. Granted I don’t know how Databricks plans to integrate UC governance to Postgres tables, but I’m sure they will.Also- isn’t this going to lead to a lot of access pattern misuse? Postgres still has that 8TB limit. Just a matter of time till an analyst or rouge agent tried to run a massive unindexed analytical scan.Curious to hear if anyone is LakeBase or Neon in prod yet and their experience. Is it actually a velocity win or should these layers really remain separate?",107,0.89,78,https://www.reddit.com/r/dataengineering/comments/1u3vqq1/is_the_industry_actually_swinging_back_to_postgres/,2026-06-12 13:46:18,2026-06-18 04:05:27
1u6kjdy,Moving away from databricks to OLTP,aks-786,dataengineering,"The data is not huge. Not hitting even 500 GB. Make sense not to use databricks (this much horsepower not required)But team still tried databricks for a year. I have tried to keep bill around $1000 usd per month (our budget)People like ai/bi dashboard internally but now we want web apps dashboard for the customers with real time data.If we try to implement same in databricks, the cost will sky rocket. Let me know if there are any alternatives, suggestions, feedback or if need more info i can edit the post, thanks. I am writing this post because databricks sales team and marketing team told my manager subtlety that the team sucks and dont know databricks. Not sure if I am letting my team down. I blame budget constraints",97,0.95,70,https://www.reddit.com/r/dataengineering/comments/1u6kjdy/moving_away_from_databricks_to_oltp/,2026-06-15 15:53:53,2026-06-18 04:05:27
1u3phha,How to level up as a data engineer ?,dumb_user_404,dataengineering,"Let me setup a little context.I am a student in college right now. I have a pretty fundamental knowledge about Data engieering and its concepts, but I am struggling to grow as a data engineer. Below I will be listing what I know, and at last my question.What I know :\- Building ETL pipelines. \- Idempotency \- Dimensional Data Modelling \- Little bit of medallion architechture development \- airflow for orchestration Now my dilemaI am unable to level up as a data engineer, the path ahead feels confusing and abstract. I cant spend much on cloud technologies so buying big cloud platform subscriptions for now feels useless. Learing distributed architechture like spark feels confusing because no amount of data i work on is that big to require that.Honestly i just want to find some real life experience with some work but unable to find in the current market. can you guide me with the path ahead. I am also open to trying out new things like backend dev or something else if that helps in some way",83,0.93,52,https://www.reddit.com/r/dataengineering/comments/1u3phha/how_to_level_up_as_a_data_engineer/,2026-06-12 08:31:28,2026-06-18 04:05:27
1u7myvl,LTAP as combination of OLTP and OLAP: Any thoughts on the new Databricks announcement on their Postgres (Lakebase) database which saves data in a single copy suitable for both OLTP and OLAP Workflows?,ExmachinaCoffee,dataengineering,More info here: it seems that no data duplication and CDC pipeline is needed anymore. The same data wold be used for both Trasactional and analytical workflows.&#x200B;[https://www.databricks.com/company/newsroom/press-releases/databricks-launches-ltap-first-lake-transactionalanalytical](https://www.databricks.com/company/newsroom/press-releases/databricks-launches-ltap-first-lake-transactionalanalytical),83,0.97,42,https://www.reddit.com/r/dataengineering/comments/1u7myvl/ltap_as_combination_of_oltp_and_olap_any_thoughts/,2026-06-16 19:08:35,2026-06-18 04:05:27
1u70qmg,"Lot of fancy terms, but nothing really has changed",Complete-Regret-4300,dataengineering,"So I started working as a Microsoft Business intelligence developer back in 2007 and I absolutely loved how simple things were. You had source systems like ERP/core banking, they delivered files to FTP sites. We had ETL tool like SSIS that picked up those files loaded into staging area, did transformation and then loaded into datawarehouse. Then we had SSAS cubes are the semantic layer and then business users either used Excel to connect to the cubes or we had SSRS static reports connecting to the cubes or the data warehouse tables/view directly.I lived under a rock for the last 18 years or so and completely skipped the big data, cloud, ai bandwagons.Recently I changed my job and initially I was really worried with the advent of data engineering, pipelines, data lake, delta lake, lakehouse and all the new terms.But I realized all these are fancy terms and we arent really doing anything different, lol.So, the place where we work, it is supposed to be a cutting edge technology place. They are using ERP systems like SAP, Oracle Fusion as source. Those sources push files into S3 bucket in AWS which is kind of replacement for the ftp/file landing zone. Then we have snowflake for the datawarehouse. Again a fancy tool, that is now more expensive than what we did in on prem SQL Server. Instead of SSIS, we have Mattilion in the cloud and for semantic layer we have SSAS still and the plan is to migrate this to Tabular/Fabric very soon. The reporting layer is Pyramid analytics.So, basically nothing much has changed. I refuse to learn python or databricks or any other programming language. I am happy with my SQL, MDX skills and I am okay to learn DAX. I am glad we still have implementations like these rather than all those fancy big data, no sql and stuff. I understand there is data explosion after advent of social media, we need unstructured data. However, not every business process out there is using explosive amounts of data. Maybe some businesses who have direct individual customers, low revenue per customer, but millions of them, yeah you have data explosion. But if there are businesses with few customers but millions of dollars of revenue per customer, there is no data explosion, think about investment banks, private banks etc They have simple core banking systems which have structured data sources and a datawarehouse with dimensional modelling is good enough for these businesses. I am curious, if there are still people like me in 2026.Cheers :grinning_face_with_smiling_eyes:",78,0.91,70,https://www.reddit.com/r/dataengineering/comments/1u70qmg/lot_of_fancy_terms_but_nothing_really_has_changed/,2026-06-16 02:16:49,2026-06-18 04:05:27
1u6fwuu,Trying to solve the Airflow schedule pain,AlvaroLeandro,dataengineering,"As a Staff Data Engineer, I always have to answer questions like this:Will my new DAG scheduled at **\*/45 2-6 \* \* 1-5** collide with that heavy Spark job running every 40 minutes?As you can imagine, this becomes increasingly difficult as the production environment grows and the number of scheduled DAGs increases.For this reason, I've created [Airflow Calendar](https://medium.com/data-engineer-things/stop-staring-at-cron-expressions-airflow-just-got-a-google-calendar-upgrade-f519c709e3c1), an open-source plugin inspired by the Google Calendar experience.Recently, following the community feedback, I released a new version with some useful features like background color change.I hope this tool can be as useful to you guys as it has been to me in my daily life! [https://github.com/AlvaroCavalcante/airflow-calendar-plugin](https://github.com/AlvaroCavalcante/airflow-calendar-plugin)",78,0.92,23,https://i.redd.it/sotd24oh0g7h1.gif,2026-06-15 12:59:33,2026-06-18 04:05:27
1u3wmr1,Clean data using pandas before loading data or using SQL after loading data into warehouse?,Old_Mind8618,dataengineering,"I have a very simple pipeline:SOURCE(S3 json files) -> load using pandas script -> push data to warehouse -> Staging(deduplication) -> production.My question is:Should cleaning of data be done when loading data using the pandas script or should it be done in the staging step after data is loaded?if i do cleaning in the pandas step i would:* rename columns to appropriate names* remove any bad values like bad dates and coerce them to become nulls* cast all columns to correct data types* at the end push data to predefined raw table schema with the expected data typesif i do cleaning in the staging step then in the pandas step i would only:* only predefine the raw table schema with loose types like text to accept unexpected values* push data to raw table* then do all the cleaning using SQLi want do do cleaning in SQL but honestly it seems like a hassle compared to pandas. Just an example:`elif conf_col_type == 'datetime64[ns]':` `df[col] = pd.to_datetime(df[col] , errors='coerce' , dayfirst=True).dt.date`",52,0.93,53,https://www.reddit.com/r/dataengineering/comments/1u3wmr1/clean_data_using_pandas_before_loading_data_or/,2026-06-12 14:19:56,2026-06-18 04:05:27
1u6dksf,Open-Sourcing dbt state-aware Orchestration,engineer_of-sorts,dataengineering,"Hi there - Hugo from Orchestra here. Got some fun open-source news:Excited to share Sao Paolo by Orchestra. We worked on this for dbt, and it's State-Aware Orchestration on dbt core. Available under Apache 2.0[https://github.com/orchestra-hq/sao-paolo](https://github.com/orchestra-hq/sao-paolo)Few reasons we like this approach::check_mark_button: Easier Scheduling: Orchestra SAO (State Aware Orchestration) means you don’t need to manually tag models, you just need to say when the models should be updated and Orchestra SAO handles the dependencies.:check_mark_button:Save cost: Orchestra SAO detects when there is new data and only updates models and their downstream deps if there is new data, saving money and reducing time.:check_mark_button:Works out of the box: no need to upgrade dbt versions to take advantage of Orchestra SAOBeing part of the dbt community was one of the things that originally brought me to data engineering back when I was working at JUUL, so it feels pretty awesome to finally contribute something back!For those of you wondering how this compares to Fusion - we launched SAO in our proprietary solution a couple months back when the dbt Fusion license was still Elastic 2.0 I think and state APIs not public. The two projects are not currently identical, there are a couple of differences such as a nice optimisation around build\_after configurations propagating up the entire DAG in Orchestra SAO for example. I imagine over time these projects will converge.There is no requirements to use this in Orchestra. It works with your dbt repo, just requires you to configure where state is stored.Any questions just shoot !",49,0.95,11,https://www.reddit.com/r/dataengineering/comments/1u6dksf/opensourcing_dbt_stateaware_orchestration/,2026-06-15 11:13:24,2026-06-18 04:05:27
1u79041,Nerves getting the best of me,the_nabzter,dataengineering,"Ive recently been laid off where I had transitioned from data analytics to engineering. I’ve been doing the role for two years and in those two, I’ve unfortunately received no mentorship whatsoever.Adding to that, I had to migrate the same project into 4 different platforms (Synapse -> Fabric -> Databricks -> OnPrem). The decision to move back to OnPrem was a cost cutting directive. Unfortunately I was not able to investigate databricks further and see what could be done to reduce costs (our integration specialist had set us up to use only serverless to run notebooks). I had asked to have further privileges, those were ignored. My time at the company has been quite frustrating so i’m treating my current position as a blessing.Ultimately, I am at that stage where I am looking for an opportunity and I am struggling with nerves. Especially during technical rounds in interviews. My answers come across as vague and not deep enough. Questions such as “What dim types have you worked with?” tend to trip me up. I’ve only experienced SCD.What should I do in order to get over this hurdle? Should I be looking at specific sites? Work with a mentor? All suggestions are welcomed.",44,0.89,20,https://www.reddit.com/r/dataengineering/comments/1u79041/nerves_getting_the_best_of_me/,2026-06-16 09:50:24,2026-06-18 04:05:27
1u70uh7,Is data engineering with c# a thing?,octacon100,dataengineering,"So I’ve been following this subreddit for years now, it seems like the standard way to do data engineering was python, some orchestrator (prefect, airflow, dagster, etc) and a data lake and data warehouse. The place I’m working is mostly a c# shop and I thought that showing how much easier it was in python with prefect would be a good thing. New management has come along and seems to be more comfortable with c#, nservicebus and redis, but I’ve heard the places that they used to work at rung up a $10M a month bill on data bricks so I’m trying to figure out how viable something like this is. Just curious to see how much data engineering out there is done in c# as the only frame of reference I have is here. Thanks in advance.",41,0.83,55,https://www.reddit.com/r/dataengineering/comments/1u70uh7/is_data_engineering_with_c_a_thing/,2026-06-16 02:21:39,2026-06-18 04:05:27
1u85fh4,What kind of ETL pipeline would be helpful when the incoming file is an excel and the structure keeps changing and every piece of info is important and needs to be loaded into the Db?,Street-Albatross4908,dataengineering,"I am currently working on a Project which requires me to design the eel pipeline to be scalable and automated and work without human intervention, but the structure of the incoming doc is an excel sheet pretty unstructed and messy and the thing to worry about is the data (attributes) keep changing .",39,0.94,23,https://www.reddit.com/r/dataengineering/comments/1u85fh4/what_kind_of_etl_pipeline_would_be_helpful_when/,2026-06-17 09:32:43,2026-06-18 04:05:27
1u8ebc4,Databricks conference,proximaljarl17,dataengineering,"I have been attending the databricks conference, but nothing has stood out to me as being very exciting.&#x200B;Have folks found anything interesting or something you may actually be excited for in the DE space?",38,0.88,36,https://www.reddit.com/r/dataengineering/comments/1u8ebc4/databricks_conference/,2026-06-17 16:02:17,2026-06-18 04:05:27
1u6sole,I just had an data engineering question and answer session for a role that I didnt do well on. What is your advice for preparing for data engineering related questions for a job?,Historical_Donut6758,dataengineering,I know how to code ( sql and python) but I didnt do a good job of conveying what I know to the question askers. tech code question and answer session are unrealistic to me because they want you to know syntax from memory and to me thats not realistic since most devs i know look up what they dont know,32,0.86,26,https://www.reddit.com/r/dataengineering/comments/1u6sole/i_just_had_an_data_engineering_question_and/,2026-06-15 20:40:24,2026-06-18 04:05:27
1u6covm,Will fully autonomous self healing pipelines ever be a thing?,CasteliaLyon,dataengineering,"I'm just thinking back to all those times debugging pipeline production failures that could be due to so many different reasons . Schema drift, missing data or some other micro service fails and returns a 400 .Is it going to be possible in the near future to have agents debugging failures, pushing updates to logics to fix the pipelines .Will we ever trust them enough to give them those kinds of permissions.",29,0.79,35,https://www.reddit.com/r/dataengineering/comments/1u6covm/will_fully_autonomous_self_healing_pipelines_ever/,2026-06-15 10:27:13,2026-06-18 04:05:27
1u5hl5o,Question :exclamation_question_mark:,Annual_Fox2278,dataengineering,"I'm new to data engineering. I joined my company last year after graduation as a Software Engineer. I had never worked in data engineering before, but the company needed someone who was good at Python and SQL. Since I was strong in both, I became a core member of the team.&#x200B;The original structure of our pipeline was a Spark-based ETL process, but it was very slow and took hours to complete. We have now moved to a dbt-based ELT pipeline.&#x200B;We were using provisioned Redshift, which performed well for incremental models. However, we recently shifted to Redshift Serverless. It provides significantly better performance overall compared to provisioned Redshift, but the catch is that incremental models perform worse, while full refreshes and models materialized as tables perform extremely well.&#x200B;For every incremental model, a full refresh is actually faster. Theoretically, incremental models should be faster, but in practice we're seeing the opposite.&#x200B;Even with all models materialized as tables, our complete run now takes about 45 minutes, compared to 1 hour 30 minutes on provisioned Redshift. The original Spark-based ETL pipeline took around 6 hours.&#x200B;I believe incremental models should allow us to achieve even better performance. Can anyone help me understand what might be causing this behavior?&#x200B;&#x200B;Redshift serverless is costing as more compare to provisional.&#x200B;",26,0.83,5,https://www.reddit.com/r/dataengineering/comments/1u5hl5o/question/,2026-06-14 10:27:32,2026-06-18 04:05:27
1u2zwr6,docker + airflow question,random-soul-feeder,dataengineering,"hey, guys. I need some help with a personal project, concerning docker and airflow. It's a study project, and I've never used docker and airflow. I already know the concepts, DAG, containers, images, docker file, etc. My question is, I need my project to run wether my PC is on or not, I have all my files set up, but how does it work the process of having it running with my PC off? I've made some research and it seems that I need to upload my containers into a VPS, how does it work?please keep in mind that it's a small project, and I dont want to spend to much money with a cloud service at the beggining. can anyone help me? thanks",29,0.91,17,https://www.reddit.com/r/dataengineering/comments/1u2zwr6/docker_airflow_question/,2026-06-11 14:00:50,2026-06-18 04:05:27
1u42vlb,Reduce Dagster Cloud credits by collapsing your dbt project,YoungVundabar,dataengineering,"Hello Dagster crew! The Dagster Cloud pricing change last month also took our team by surprise. The biggest, quickest thing we could do to cut down the cost was to collapse our DBT project into a single asset.This lowered the credit use by 60%. The tradeoff is that we now have a is coarser observability. I finally got to sit down and write an blog post about it. I hope ot helps someone!",25,0.92,13,https://www.narev.ai/blog/lower-dagster-bill,2026-06-12 18:04:37,2026-06-18 04:05:27
1u5sr64,GitLab CI/CD to run ETL jobs?,55vj55,dataengineering,"Our team runs a number of ETL automations using Python. Basically the vast majority of automation are running some query and export the results as an Excel spreadsheets. But we also have a few that are running more complicated queries to load to a dashboard, passing data to an api or some Control/Access testing and some other odd jobs. Most of these take less than a minute to do but a few of them are a bit longer with some taking over an hour due to complicated queries. Currently all our jobs run on windows task scheduler but we are trying to modernize and requested a server to do this. Our dev ops team got back and suggested we use a gitlab runner to do this. We have a self hosted GitLab instance and some runners on a different server. So the plan would be we would schedule these jobs on gitlab scheduler and run them on a runner. Any thoughts on if this is a viable solution. I am more along the lines of getting a separated server to run these jobs and use a separate scheduling tool to do this such as airflow or prefect.",26,0.93,18,https://www.reddit.com/r/dataengineering/comments/1u5sr64/gitlab_cicd_to_run_etl_jobs/,2026-06-14 18:29:17,2026-06-18 04:05:27
1u35g6s,"Building Production Semantic Search: A Practical Guide to Embeddings, ANN, and Vector DBs",Veduis,dataengineering,No content,24,0.93,2,https://veduis.com/blog/vector-search-fundamentals/,2026-06-11 17:24:24,2026-06-18 04:05:27
1u6iwol,Education to go from data analyst to data engineer,batmandabee,dataengineering,"I am currently a senior Data Operations Analyst in the healthcare industry. I've been working at my current position for 4 years but have built the skills i need for it over the past 15 years.&#x200B;I work primarily with SQL, excel, oracle and Azure. I work closely with dev teams, product teams and implementation. I am also a primary knowledge source for EDI transactions. I have learned enough python to complete relatively simple coding on my own and to read code to write up work items for devs. &#x200B;I do not have a college degree, though I did start college before deciding I didn't want to spend all the money when 50% of my classes were gen ed and not related to any field I was pursuing. Ive taken classes and gotten certifications over the years when it benefitted my career goals and it has served me well since I enjoy my work and make enough money to live very comfortably.&#x200B;I was recently contacted by a recruiter for Data Engineering Academy and I am skeptical of their program even before talking cost. They've also promised interviews and a large pay boost, more than is typically noted given my experience. It has got me thinking about working towards a transition to Data Engineering. In looking at other options most seem to be masters degrees, but without a bachelor's degree I don't think that is an option. &#x200B;Does anyone have any advice? Is Data Engineer academy a good option for me? At this point I don't see a benefit in going back for a degree.",21,0.97,12,https://www.reddit.com/r/dataengineering/comments/1u6iwol/education_to_go_from_data_analyst_to_data_engineer/,2026-06-15 14:54:48,2026-06-18 04:05:27
1u4cxwx,Management roles,cyamnihc,dataengineering,"What does a DE/BI manager job look like in your organization? Since data is primarily an internal facing function I see most of what my manager does is find projects for the team by speaking to internal teams, and select the most valuable ones from it for us to work on. I would say apart from the usual management duties, this is the key role. As I am at a juncture on which path to take in terms of management v/s IC, I want to understand more on what does else the DE management role in you/your company does to get a better understanding of what the management role does? I am making an assumption that DE /BI is an internal function so would also love to hear from folks who are external facing and by that I don’t mean consulting companies but product companies whose product is a reporting tool etc",16,1.0,8,https://www.reddit.com/r/dataengineering/comments/1u4cxwx/management_roles/,2026-06-13 00:54:04,2026-06-18 04:05:27
