id,title,author,subreddit,content,score,upvote_ratio,num_comments,url,created_utc,extracted_at
1ppuky6,My “small data” pipeline checklist that saved me from building a fake-big-data mess,Jhaspelia,dataengineering,"I work with datasets that are not huge (GBs to low TBs), but the pipeline still needs to be reliable. I used to overbuild: Kafka, Spark, 12 moving parts, and then spend my life debugging glue. Now I follow a boring checklist to decide what to use and what to skip.If you’re building a pipeline and you’re not sure if you need all the distributed toys, here’s the decision framework I wish I had earlier.1. Start with the SLA, not the techAsk:* How fresh does the data need to be (minutes, hours, daily)?* What’s the cost of being late/wrong?* Who is the consumer (dashboards, ML training, finance reporting)?If it’s daily reporting, you probably don’t need streaming anything.2. Prefer one “source of truth” storage layerPick one place where curated data lives and is readable by everything:* warehouse/lakehouse/object storage, whatever you have Then make everything downstream read from that, not from each other.3. Batch first, streaming only when it pays rentStreaming has a permanent complexity tax:* ordering, retries, idempotency, late events, backfills. If your business doesn’t care about real-time, don’t buy that tax.4. Idempotency is the difference between reliable and hauntedEvery job should be safe to rerun.* partitioned outputs* overwrite-by-partition or merge strategy* deterministic keys If you can’t rerun without fear, you don’t have a pipeline, you have a ritual.5. Backfills are the real workloadDesign the pipeline so backfilling a week/month is normal:* parameterized date ranges* clear versioning of transforms* separate “raw” vs “modeled” layers6. Observability: do the minimum that prevents silent failureAt least:* row counts or volume checks* freshness checks* schema drift alerts* job duration tracking You don’t need perfect observability, you need “it broke and I noticed.”7. Don’t treat orchestration as optionalEven for small pipelines, a scheduler/orchestrator avoids “cron spaghetti.” Airflow/Dagster/Prefect/etc. is fine, but the point is:* retries* dependencies* visibility* parameterized runs8. Optimize lastMost pipelines are slow because of bad joins, bad file layout, or moving too much data, not because you didn’t use Spark. Fix the basics first:* partitioning* columnar formats* pushing filters down* avoiding accidental cartesian joinsMy rule of thumbIf you can meet your SLA with:* a scheduler* Python/SQL transforms* object storage/warehouse and a couple checksthen adding a distributed stack is usually just extra failure modes.Curious what other people use as their “don’t overbuild” guardrails. What’s your personal line where you say “ok, now we actually need streaming/Spark/Kafka”?",485,0.98,31,https://www.reddit.com/r/dataengineering/comments/1ppuky6/my_small_data_pipeline_checklist_that_saved_me/,2025-12-18 16:06:50,2025-12-25 01:47:59
1ppksi4,Report: Microsoft Scales Back AI Goals Because Almost Nobody is Using Copilot,City-Popular455,dataengineering,Saw this one come up in my LinkedIn feed a few times. As a Microsoft shop where we see Microsoft constantly pushing Copilot I admit I was a bit surprised to see this…,430,0.97,84,https://i.redd.it/go2g4s0bzw7g1.jpeg,2025-12-18 07:23:01,2025-12-25 01:47:59
1pqqnmp,Realization that I may be a mid-level engineer at best,I_Blame_DevOps,dataengineering,"Hey r/dataengineering, Feeling a bit demoralized today and wondering if anyone else has come to a similar realization and how they dealt with it. Approximately 6 months ago I left a Sr. DE job on a team of 5 to join a startup as their sole data engineer. The last job I was at for 4.5 years and helped them create reliable pipelines for \~15 sources and build out a full QC process that all DEs followed, created code standards + CI/CD that linted our code and also handled most of the infrastructure for our pipelines. During this time I was promoted multiple times and always had positive feedback. Cut to my current job where I have been told that I am not providing enough detail in my updates and that I am not specific enough about what went wrong when fixing bugs or encountering technical challenges. And - the real crux of the issue - I failed to deliver on a project after 6 months and they have of course wanted to discuss why the project failed. For context the project was to create a real time analytics pipeline that would update client reporting tables. I spent a lot of time on the infrastructure to capture the changes and started running into major challenges when trying to reliably consume the data and backfill data.We talked through all of the challenges that I encountered and they said that the main theme of the project they picked up on was that I wasn't really ""engineering"" in that they felt I was just picking an approach and then discovering the challenges later. Circling back to why I feel like maybe I'm just a mid-level engineer, in every other role I've been in I've always had someone more senior than me that understood the role. I'm wondering if I'm not actually senior material and can't actually do this role solo. Anyways, thanks for reading my ramble and let me know if you've found yourself in a similar position.",316,0.97,61,https://www.reddit.com/r/dataengineering/comments/1pqqnmp/realization_that_i_may_be_a_midlevel_engineer_at/,2025-12-19 17:15:29,2025-12-25 01:47:59
1pty9p3,Most data engineers would be unemployed if pipelines stopped breaking,Different_Pain5781,dataengineering,Be honest. How much of your value comes from building vs fixing. Once things stabilize teams suddenly question why they need so many people. A scary amount of our job is being the human retry button and knowing where the bodies are buried. If everything actually worked what would you be doing all day?,245,0.84,101,https://www.reddit.com/r/dataengineering/comments/1pty9p3/most_data_engineers_would_be_unemployed_if/,2025-12-23 16:30:08,2025-12-25 01:47:59
1ptkqbu,Why is UnitedHealth Group (USA) hiring hundreds of local engineers in India instead of local engineers in USA?,GigglySaurusRex,dataengineering,"Going through below, I don't understand what skill USA engineers are missing:https://www.unitedhealthgroup.com/careers/in/technology-opportunities-india.html",124,0.82,98,https://www.reddit.com/r/dataengineering/comments/1ptkqbu/why_is_unitedhealth_group_usa_hiring_hundreds_of/,2025-12-23 04:30:26,2025-12-25 01:47:59
1ps0pti,"""Going forward, our company vision is to utilize AI at all levels of production""",circumburner,dataengineering,"Wow, thanks. This is the exact same vision that every executive I have interacted with in the last 6 months has provided. However unlike generic corporate statements, my work is subject to audit and demonstrable proof of correctness, none of which AI provides. It's really more suitable for making nebulous paragraphs of text without evidence or accountability. Maybe we can promote a LLM as our new thought leader and generate savings of several hundreds of thousands of dollars?",110,0.95,32,https://www.reddit.com/r/dataengineering/comments/1ps0pti/going_forward_our_company_vision_is_to_utilize_ai/,2025-12-21 07:24:55,2025-12-25 01:47:59
1pqxp2n,How are you exposing “safe edit” access to business users without giving them the keys to the warehouse?,nagel393,dataengineering,"Curious how other teams are handling this, because I have seen a few versions of the same problem now.Pattern looks like this:* Warehouse or DB holds the “real” data* Business / ops / support teams need to fix records, update statuses, maybe override a few fields* Nobody wants to give them direct access in Snowflake/BigQuery/Postgres or let them loose in dbt modelsI have seen a bunch of approaches over the years:* old-school: read-only views + “send us a ticket to change anything”* Excel round-trips that someone on the data team turns into SQL* custom internal web apps that a dev built once and now everyone is scared to touch* more recently: low-code / internal tool builders like Retool, Appsmith, UI Bakery, Superblocks, etc, sitting in front of the warehouse or APIsRight now I am leaning toward the “small internal app in front of the data” approach. We are experimenting with a builder instead of rolling everything from scratch, partly to avoid becoming a full-time CRUD developer.UI Bakery is one of the tools we are trying at the moment because it can sit on-prem, talk to our DB and some OpenAPI-described services, and still give non-technical users a UI with roles/permissions. Too early to call it perfect, but it feels less scary than handing out SQL editors.Curious what the rest of you are doing:* Do you let business users touch warehouse data at all, or is everything ticket-driven?* If you built a portal / upload tool / internal UI, did you go custom code or something like Retool / Appsmith / UI Bakery / similar?* Any “we thought this would be fine, then someone updated 50k rows by mistake” stories you are willing to share?Trying to find a balance between safety, governance and not spending my whole week building yet another admin panel.",80,0.95,22,https://www.reddit.com/r/dataengineering/comments/1pqxp2n/how_are_you_exposing_safe_edit_access_to_business/,2025-12-19 22:02:58,2025-12-25 01:47:59
1prs6gr,"Seeing posts about using Google sheets and excel as database a lot in LinkedIn, this bothers me so much",Old_Tourist_3774,dataengineering,"Seems it is such a can of worms and borderline creating ""solutions"" for things that are not problems.One time I suggested using a regular database like SQlite and the dude used my comment later to post saying how I was basically a retard to suggest to some old sir to use and understand a database.#Here is one exemple:>I’m developing an MVP for a small client who needed agility and, above all, zero initial infrastructure cost. The solution?I turned a Google Sheets spreadsheet into the backend.The scenario:Stack: Node.js consuming the Google Sheets API.Goal: Validate an idea quickly, with minimal bureaucracy.Client advantage: They can manage the data themselves using an interface they already know (the spreadsheet!), and the website updates in real time. Cost: $0.My “software engineer” side screams: “This won’t scale! What about the API rate limits? Where’s relational integrity?!”",75,0.92,38,https://www.reddit.com/r/dataengineering/comments/1prs6gr/seeing_posts_about_using_google_sheets_and_excel/,2025-12-20 23:45:49,2025-12-25 01:47:59
1pq4tkx,Making 100k with 5 years experience with Snowflake and Databricks,Lanky-Fig8945,dataengineering,"It was my first job, and I cant take it anymore. If i get let go could I find another DE job making about the same MCOL. How is the job market. I feel like I am very underpaid but salary beats no salary or should i shoot for 135k",63,0.76,57,https://www.reddit.com/r/dataengineering/comments/1pq4tkx/making_100k_with_5_years_experience_with/,2025-12-18 22:51:59,2025-12-25 01:47:59
1pr16h8,Spark 4.1 is released :D,holdenk,dataengineering,The full list of changes is pretty long: [https://issues.apache.org/jira/secure/ReleaseNote.jspa?projectId=12315420&version=12355581](https://issues.apache.org/jira/secure/ReleaseNote.jspa?projectId=12315420&version=12355581) :D The one warning out of the release discussion people should be aware of is that the (default off) MERGE feature (with Iceberg) remains experimental and enabling it may cause data loss (so... don't enable it).,54,0.97,18,https://spark.apache.org/news/spark-4-1-0-released.html,2025-12-20 00:49:13,2025-12-25 01:47:59
1prpfsf,"Best practice: treating spreadsheets as an ingestion source (schema drift, idempotency, diffs)",Green-Branch-3656,dataengineering,"I’m seeing spreadsheets used as operational data sources in many businesses (pricing lists, reconciliation files, manual corrections). I’m trying to understand best practices, not promote anything.When ingesting spreadsheets into Postgres, what approaches work best for:* schema drift (columns renamed, new columns appear)* idempotency (same file uploaded twice)* diffs (what changed vs the prior version)* validation (types/constraints without blocking the whole batch)* merging multiple spreadsheets into a consistent modelIf you’ve built this internally: what would you do differently today?(If you want context: I’m prototyping a small ingestion + validation + diff pipeline, but I won’t share links here.)",44,0.91,29,https://www.reddit.com/r/dataengineering/comments/1prpfsf/best_practice_treating_spreadsheets_as_an/,2025-12-20 21:38:14,2025-12-25 01:47:59
1pqdjh9,Left DE Before Even Getting a Job,HarvesterOfReveries,dataengineering,"Just sharing my story here, not a successful one. I was trying to switch from legacy backend dev at a government organization to a DE role. Did relevant projects, learned a lot, but no luck. I was comfortable working with python, docker, a few frameworks like Airflow, Spark, Dagster, DBT etc. and of course git and Java + a few tools that nobody uses in DE from the job that I was doing.Did about 100 applications, spending a fair bit of time tweaking applications to match every job that I applied to. Did not apply for stuff that I wasn't interested in. Got pretty much nothing.I did however also applied to a few software dev roles too. Ended up landing one and got incredibly lowballed but I was so tired of my previous job, I had to take it like an idiot.Well, started the new job and the work was pretty fun. But colour me surprised, the thing that pushed me out from the previous job wasn't the culture or the work just being boring, it was the cycle. I'm only 26 and honestly, I can't imagine working 9-5 until I turn 50 or 60. I'm drafting up some ideas, learning and researching what's required to create products on my own. Once I'm confident enough in an idea and the progress, I'll probably quit. Or get fired because I'm distracted. Staying for a few for months because of financial constraints.Anybody else have similar experiences? I find it so weird that I was so interested in DE just a year ago, still confident that I can perform well in it, but completely lost interest to put in the effort because in the end I know I'll just get paid peanuts for the actual amount of work I'll do (pay in my country is garbage). The only thing that might change this would be life changing compensation, but obviously that requires much more prep that I don't know if I have the time for (or the ability for that matter). Even that wouldn't be a sustainable way out of this dumb rotten week cycle we humans invented for ourselves. Work like a mchine for 5 days and be tired for the rest of the day after work? Recover from that shit for 2 days and then get back to it again? Fuck. That.Thanks for listening to my rant, please share your own thoughts, because obviously there's lots of people who enjoy what they do and have much more ""work endurance"" than me. Also curious to see if there's more people who feel the same way as me too.",44,0.79,30,https://www.reddit.com/r/dataengineering/comments/1pqdjh9/left_de_before_even_getting_a_job/,2025-12-19 05:56:18,2025-12-25 01:47:59
1psvmt2,"Career pivot into data: I’m a ""Data Team of One"" in a company and I’m struggling to orient my role. Any advice?",Either-Exercise3600,dataengineering,"First of all: Hi everyone and thanks for taking the time to read my post.I completely changed careers and now I’m trying to understand where to “aim” long term.My background: I’m a humanities major who took a hard pivot. After a couple of years of self-teaching (programming, SQL, data fundamentals) and some freelancing, I landed a role about a year ago in a large company (hundreds of millions in revenue).When I joined, there was zero data culture. No team, no processes, just a lot of manual work and fragmented info. My official title is ""Data Manager"", but since I’m building the function from scratch, I’ve been doing a bit of everything:* Automation & ETL: Writing Python scripts and using Power Automate to kill manual tasks.* Infrastructure: Designing and building business-oriented databases from the ground up.* BI/Visualization: Creating the first actual dashboards.* Optimization: Cleaning up the ""Excel Wild West"" and setting common data policies.My question: Imposter syndrome aside, I’m struggling to map this experience to the actual market. I love the ""ideation"" and architecture part—designing the pipelines, thinking through the data flows, and making things work automatically. But I sometimes worry I’m doing a lot of useful things, but not building a clean and recognizable profile.\- What term would you use to describe this type of role? I'm not sure if I'm closer to data engineering or analytics...\- Is it wise to be a generalist in the long run? Is there a point at which choosing a lane (engineering, product, analytics, etc.) makes more sense than leaning into this builder profile?\- What would you discover next if you were in my shoes? I want to switch from band-aid solutions to more reliable, scalable procedures. At this point, what would you learn first: DBT, cloud architecture, orchestration tools like Airflow, or something else?My current stack is Python, SQL, Power BI, Power Automate, and some legacy VBA.I genuinely love this job—it's a world away from my previous life in humanities—but I want to make sure I’m steering the ship in the right direction. And again, thanks for waste your time reading me.",44,0.91,17,https://www.reddit.com/r/dataengineering/comments/1psvmt2/career_pivot_into_data_im_a_data_team_of_one_in_a/,2025-12-22 09:43:38,2025-12-25 01:47:59
1pqom0w,What do you think fivetran gonna do?,Fair-Bookkeeper-1833,dataengineering,Now that they have both SQLMesh and DBT.I think probably they'll go with SQLMesh as standard and will slowly move DBT customer base to SQLMesh.what do you guys think?,40,0.83,90,https://www.reddit.com/r/dataengineering/comments/1pqom0w/what_do_you_think_fivetran_gonna_do/,2025-12-19 15:56:04,2025-12-25 01:47:59
1pq9aei,Good books/resources for database design & data modeling,zipArk,dataengineering,"Hey folks,I’m looking for recommendations on **database design / data modeling books or resources** that focus on **building databases from scratch**.My goal is to develop a **clear process** for designing schemas, avoid common mistakes early, and model data in a way that’s **fast and efficient**. I strongly feel that even with solid application-layer logic, a poorly designed database can easily become a bottleneck.Looking for something that covers:* Practical data modeling approach* Schema design best practices* Common pitfalls & how to avoid them* Real-world examplesBooks, blogs, courses — anything that helped you in real projects would be great.Thanks!",41,0.94,16,https://www.reddit.com/r/dataengineering/comments/1pq9aei/good_booksresources_for_database_design_data/,2025-12-19 02:17:40,2025-12-25 01:47:59
1ptyqc3,Career Progression for a Data Engineer,SlowTask3681,dataengineering,"Hi, I am a mid-level Data Engineer with 12 years of total experience. I am considering what should be my future steps should be for my career progression. Most of the times, I see people of my age or same number of years of experience at a managerial level, while I am still an individual contributor. So, I keep guessing what I would need to do to move ahead. Also another point is my current role doesn't excite me anymore. I also do not want to keep coding whole of my life. I want to do more strategic and managerial role and I feel I am more keen towards a role which has business impact as well as connection to my technical experience so far.I am thinking of couple of things -1. May be I can do an MBA which opens wide variety of domain and opportunities for me and may be I can do more of a consulting role ?2. Or may be learn more new technologies and skills to add in my CV and move to a lead data engineer role . But again this still means I will have to do a coding. Don't think this will give me exposure to business side of things. Could you please suggest what should I consider as my next steps so that I can achieve a career transition effectively?",32,0.84,18,https://www.reddit.com/r/dataengineering/comments/1ptyqc3/career_progression_for_a_data_engineer/,2025-12-23 16:48:43,2025-12-25 01:47:59
1pr9fxu,Snowflake Openflow a bittersweet experience soo far,Defiant_Month_497,dataengineering,"Just wanted to share my experience with Snowflake Openflow. The client i work for relies heavily on CDC replication for their data ingestion to snowflake. We mainly bring in data from SQL server and oracle database to our snowflake data lake.Our client is using many different ETL tools mainly Firvetran's HVR, IICS and AWS DMS and in some cases snowpipe when they want to ingest data from s3 to snowflake. When snowflake announced openflow which supports CDC replication we were excited. Out of the box it was supporting SQL Server CDC replication and Oracle connector was soon to be released. We were very excited as our client wanted to move away from IICS and HVR due to licensing costs. We immediately started working on a POC when the openflow was available in private preview.POC Area: - CDC based replication from SQL Server to snowflake. Its fairly very easy to setup the connectors and start using it. We were able to configure the connectors and start ingesting the data within couple of hours and mind you none of us had used apache nifi before. Pros: - 1. easy to setup and use.2. Replication latency is pretty low. Plus it can be configured as well to fit your use case. Cons: - 1. Cannot configure target snowflake schema : - biggest downside we have found out yet. We were using the default workflow for SQL server CDC and there is no option to ingest the data into desired snowflake schema. By default Openflow is creating a schema in snowflake database with the source SQL Server schema name. We were pulling the data from SQL server schema ""DBO"" and Openflow was creating the same schema inside our snowflake database.We updated almost all the processors inside the workflow to use the custom schema name, for most part it worked. we were able to create tables and journal tables etc inside our custom schema in snowflake. But there is one processor which merges journal tables to permanent table which was not supporting to use custom schema name. Somehow it was still using "".DBO"". DB name is configurable in this processor but not the schema name. We connected with the snowflake internal team regarding the same and the guy said they working on it after receiving complaints from lots of other clients. Later he suggested us to not configure/updated the workflow which comes with database connectors. If we do update it, it's gonna be considered as a custom workflow and it will be locked out of future updates.So, customizing the pipeline is out of the picture.2. Environment variables and JVM variables: - there is no one stop UI to manage all these variables inside the workflow. You need to navigate to each processor to manage these variables. 3. Error logs: - not a fan of how openflow manages error logs, its very janky to navigate and use. these were the stuff we found out in the last couple of weeks. We have stopped our POC midway due to con 1. And we and the client are totally dissappointed with how openflow is working as of now.",32,0.97,7,https://www.reddit.com/r/dataengineering/comments/1pr9fxu/snowflake_openflow_a_bittersweet_experience_soo/,2025-12-20 08:20:56,2025-12-25 01:47:59
1pqhfbw,"In SQL coding rounds, how to optimise between readibility and efficiency when working with CTEs?",Consistent-Zebra3227,dataengineering,"Any hard problem can be solved with enough CTEs. But the best solutions that an expert can give would always involve 1-2 CTEs less ( questions like islands and gaps, sessionization etc.)So what's the general rule of thumb or rationale?Efficiency as in lesser CTEs make you seem smarter in these rounds and the code looks cleaner as it is lesser lines of code",30,0.76,42,https://www.reddit.com/r/dataengineering/comments/1pqhfbw/in_sql_coding_rounds_how_to_optimise_between/,2025-12-19 10:01:43,2025-12-25 01:47:59
1pufkm8,"Data Quality on Spark — A Practical Series (Great Expectations, Soda, DQX, Deequ, Pandera)",ivan_kurchenko,dataengineering,I'm planning to work on Data Quality improvement project at work so decided to start with current tools evaluation. So decided to write a blog series along the way.1. [**Part 1 — Great Expectations**](https://levelup.gitconnected.com/data-quality-on-spark-part-1-greatexpectations-fd4ffa126ca0)2. [**Part 2 — Soda**](https://levelup.gitconnected.com/data-quality-on-spark-part-2-soda-97d5d32e2d8b)3. [**Part 3 — DQX**](https://levelup.gitconnected.com/data-quality-on-spark-part-3-dqx-f0335b8ff07d)4. [**Part 4 — Deequ**](https://levelup.gitconnected.com/data-quality-on-spark-part-4-deequ-d82e8c2344ae)5. [**Part 5 — Pandera**](https://levelup.gitconnected.com/data-quality-on-spark-part-5-pandera-05cd494d5b01),29,0.96,6,https://www.reddit.com/r/dataengineering/comments/1pufkm8/data_quality_on_spark_a_practical_series_great/,2025-12-24 05:31:36,2025-12-25 01:47:59
1pu6fj8,How much DevOps do you use in your day-to-day DE work?,BeautifulLife360,dataengineering,What's your DE stack? What devops tools do you use? Open-source or proprietary? How do they help?,31,0.95,12,https://www.reddit.com/r/dataengineering/comments/1pu6fj8/how_much_devops_do_you_use_in_your_daytoday_de/,2025-12-23 22:01:52,2025-12-25 01:47:59
