id,title,author,subreddit,content,score,upvote_ratio,num_comments,url,created_utc,extracted_at
1q034du,Senior Data Engineer Experience (2025),ElegantShip5659,dataengineering,"I recently went through several loops for Senior Data Engineer roles in 2025 and wanted to share what the process actually looked like. Job descriptions often don’t reflect reality, so hopefully this helps others.I applied to 100+ companies, had many recruiter / phone screens, and advanced to full loops at the companies listed below.# Background* Experience: 10 years (4 years consulting + 6 years full time in a product company)* Stack: Python, SQL, Spark, Airflow, dbt, cloud data platforms (AWS primarily)* Applied to mid large tech companies (not FAANG-only)# Companies Where I Attended Full Loops* Meta* DoorDash* Microsoft* Netflix* Apple* NVIDIA* Upstart* Asana* Salesforce* Rivian* Thumbtack* Block* Amazon* Databricks# Offers Received : SF Bay Area* **DoorDash** \-  Offer not tied to a specific team (**ACCEPTED**)* **Apple** \- Apple Media Products team* **Microsoft** \- Copilot team* **Rivian** \- Core Data Engineering team* **Salesforce** \- Agentic Analytics team* **Databricks** \- GTM Strategy & Ops team# Preparation & Resources1. **SQL & Python** * Practiced complex joins, window functions, and edge cases * Handling messy inputs primarily json or csv inputs. * Data Structures manipulation * Resources: stratascratch & leetcode2. **Data Modeling** * Practiced designing and reasoning about fact/dimension tables, star/snowflake schemas. * Used AI to research each company’s business metrics and typical data models, so I could tie Data Model solutions to real-world business problems. * Focused on explaining trade-offs clearly and thinking about analytics context. * Resources: AI tools for company-specific learning3. **Data System Design** * Practiced designing pipelines for batch vs streaming workloads. * Studied trade-offs between Spark, Flink, warehouses, and lakehouse architectures. * Paid close attention to observability, data quality, SLAs, and cost efficiency. * Resources: *Designing Data-Intensive Applications* by Martin Kleppmann, *Streaming Systems* by Tyler Akidau, YouTube tutorials and deep dives for each data topic.4. **Behavioral** * Practiced telling stories of ownership, mentorship, and technical judgment. * Prepared examples of handling stakeholder disagreements and influencing teams without authority. * Wrote down multiple stories from past experiences to reuse across questions. * Practiced delivering them clearly and concisely, focusing on impact and reasoning. * Resources: STAR method for structured answers, mocks with partner(who is a DE too), journaling past projects and decisions for story collection, reflecting on lessons learned and challenges.**Note:** Competition was extremely tough, so I had to move quickly and prepare heavily. My goal in sharing this is to help others who are preparing for senior data engineering roles.",769,0.99,104,https://www.reddit.com/r/dataengineering/comments/1q034du/senior_data_engineer_experience_2025/,2025-12-31 03:55:05,2026-01-07 01:49:58
1q1iezn,Can we do actual data engineering?,marketlurker,dataengineering,"Is there any way to get this subreddit back to actual data engineering? The vast majority of posts here are how do I use tool or compare to . If you are worried about how a given tool works, you aren't doing data engineering. Engineering is so much more and tools are near the bottom of the list of things you need to worry about. The one thing this subreddit does tell me is that the Databricks marketing has earned their yearend bonus. The number of people using the name medallion architecture and the associated colors is off the hook. These design patterns have been used and well documented for over 30 years. Giving them a new name and a Databricks coat of paint doesn't change that. It does however cause confusion because there are people out there that think this is new.",188,0.84,68,https://www.reddit.com/r/dataengineering/comments/1q1iezn/can_we_do_actual_data_engineering/,2026-01-01 23:22:22,2026-01-07 01:49:58
1q48kzj,Small Group of Data Engineering Learners,lil_faucet,dataengineering,"**Hey everyone!**I realized I could really use more DE coworkers / people to nerd out with. I’d love to start a casual weekly call where we can talk data engineering, swap stories, and learn from each other.Over time, if there’s interest, this could turn into things like a textbook or whitepaper club, light presentations, or deeper dives into topics people care about. Totally flexible.**What you’d get out of it:*** Hearing how other people think about DE problems* Learning stuff that doesn’t always come up in day-to-day work* Getting exposure to different career paths and ways of working* Practical ideas you can actually use**Some topics I’m especially interested in:*** Performance and scaling* Systems thinking* Data platforms and infrastructure* FinOps / cost awareness* Reliability, observability, and ops* Architecture tradeoffs (build vs buy, etc.)* How data stacks evolve as companies growThis is mainly for early-to-mid career folks, but anyone curious is welcome. If this sounds interesting, reach out and we’ll see what happens.",158,0.96,101,https://www.reddit.com/r/dataengineering/comments/1q48kzj/small_group_of_data_engineering_learners/,2026-01-05 01:52:37,2026-01-07 01:49:58
1q1174f,"The Data warehouse blues by Inmon, do you think he's right about Databricks & Snowflake?",Tall_Working_2146,dataengineering,"Bill Inmon posted on substack saying that Data-warehousing got lost in the modern data technology.In a way that companies are now mistakenly confusing storage for centralization and ingestion for integration. Although I agree with the spirit of his text, he does take a swing at Databrick&Snowflake, as a student I didn't have the chance to experiment with these plateforms yet so I want to know what experts here think.Link to the post : [https://www.linkedin.com/pulse/data-warehouse-blues-bill-inmon-sokkc/](https://www.linkedin.com/pulse/data-warehouse-blues-bill-inmon-sokkc/)",113,0.98,151,https://www.reddit.com/r/dataengineering/comments/1q1174f/the_data_warehouse_blues_by_inmon_do_you_think/,2026-01-01 10:26:23,2026-01-07 01:49:58
1q4zzac,What actually differentiates candidates who pass data engineering interviews vs those who get rejected?,Murky-Equivalent-719,dataengineering,"Hey everyone, I’m currently looking for a data engineering role and I’ve always been curious about what really separates people who make it into Google (or similar big tech) from those who don’t. Not talking about fancy schools or prestige, just real, practical differences. From your experience, what do strong candidates consistently do better, and what are the most common gaps you see? I’d really appreciate any honest, experience-based insights. Thanks!",91,0.94,39,https://www.reddit.com/r/dataengineering/comments/1q4zzac/what_actually_differentiates_candidates_who_pass/,2026-01-05 22:16:45,2026-01-07 01:49:58
1q37mpm,Again - Take home assignment,Limp-Complaint5817,dataengineering,"I am a senior engineer, and although this has been discussed before, I experienced it again recently. I was asked to prepare a presentation for a panel with only two days’ notice. I spent the weekend preparing the slides, attended the final meeting, and presented to six people. The presentation went very well. However, a month later, I was informed by the recruiter that the hiring process had been paused. After that experience, I decided not to accept take-home assignments again.Unfortunately, I made the same mistake again recently. After a phone screening with fairly basic questions, I was given a take-home assignment. It was described as a prototype, expected to take only a few hours, with up to a week to complete. They also said it didn’t need to be fully finished, as long as I explained what I would do with more time.I was genuinely interested in the company, so I spent two full days working on it and submitted what I had. The feedback came back saying it wasn’t at the level they expected and that more work was needed, so they decided not to move forward. From the comments, it was clearly not a “few hours” task, it was closer to a full week of work and would require paid cloud resources. What is your opinion?",81,0.94,34,https://www.reddit.com/r/dataengineering/comments/1q37mpm/again_take_home_assignment/,2026-01-03 22:05:26,2026-01-07 01:49:58
1q04miu,Fellow DEs — what's your go-to database client these days?,SainyTK,dataengineering,"Been using DBeaver for years. It gets the job done, but the UI feels dated and it can get sluggish with larger schemas. Tried DataGrip (too heavy for quick tasks), TablePlus (solid but limited free tier), Beekeeper Studio (nice but missing some features I need).What's everyone else using? Specifically interested in:* Fast schema exploration* Good autocomplete that actually understands context* Multi-database support (Postgres, MySQL, occasionally BigQuery)",58,0.87,64,https://www.reddit.com/r/dataengineering/comments/1q04miu/fellow_des_whats_your_goto_database_client_these/,2025-12-31 05:10:47,2026-01-07 01:49:58
1q13vjk,Best certificates nowadays for Data Engineers?,Irachar,dataengineering,"What are the best certificates to earn this 2026 as a FREELANCE DE? I assume from AWS and Azure for sure.\*Azure has the DP-700 (Fabric Data Engineer) as a new standard? What about the rest? Databricks, dbt, snowflake, something in LLM maybe?",54,0.89,23,https://www.reddit.com/r/dataengineering/comments/1q13vjk/best_certificates_nowadays_for_data_engineers/,2026-01-01 13:10:46,2026-01-07 01:49:58
1q05yz4,Snowflake or Databricks in terms of DE career,DryYesterday8000,dataengineering,"I am currently a Senior DE with 5+ years of experience working in Snowflake/Python/Airflow. In terms of career growth and prospects, does it make sense to continue building expertise in Snowflake with all the new AI features they are releasing or invest time to learn databricks?Current employer is primarily a Snowflake shop. Although can get an opportunity to work on some one off projects in Databricks.Looking to get some inputs on what will be a good choice for career in the long run.",49,0.95,36,https://www.reddit.com/r/dataengineering/comments/1q05yz4/snowflake_or_databricks_in_terms_of_de_career/,2025-12-31 06:23:05,2026-01-07 01:49:58
1q22shj,What does an ideal data modeling practice look like? Especially with an ML focus.,Capable_Mastodon_867,dataengineering,"I was reading through Kimballs warehouse toolkit, and it gives this beautiful picture of a central collection of conformed dimensional models that represent the company as a whole. I love it, but it also feels so central that I can't imagine a modern ML practice surviving with it.I'm a data scientist, and when I think about a question like ""how could I incorporate the weather into my forecast?"" my gut is to schedule daily api requests and dump those as tables in some warehouse, followed by pushing a change to a dbt project to model the weather measurements with the rest of my features. The idea of needing to connect with a central team of architects to make sure we 'conform along the dimensional warehouse bus' just so I can study the weather feels ridiculous. Dataset curation and feature engineering would likely just die. On the flip side, once the platform needs to display both the dataset and the inferences to the client as a finished product, then of course the model would have to get conformed with the other data and be secure in production.On the other end of the extreme from Kimballs central design, I've seen mentions of companies opening up dbt models for all analysts to push using the staged datasets as sources. This looks like an equally big nightmare, with a hundred under-skilled math people pushing thousands of expensive models, many of which would achieve relatively the same thing with minor differences and numerous unchecked data quality problems, different interpretations of data, confusion on different representations from the different datasets, I can't imagine this being a good idea.In the middle, I've heard people mention the Mesh design of having different groups manages their warehouses. So analytics could set up its own warehouse for building ML features and a maybe a central team helps coordinate the different teams data models to be coherent. One difficulty that comes to mind is if a healthy fact table in one teams warehouse is desired for modeling and analysis by another team, spinning up a job to extract and load a healthy model from one warehouse to another is silly, and it also makes one groups operation quietly dependent on the other groups maintenance of that table.There seems to be a tug-of-war on the spectrum between agility and coherent governance. I truly don't know what the ideal state should look like for a company. To some extent, it could even be company specific. If you're too small to have a central data platform team, then could you even conceive of Kimballs design? I would really love to hear thoughts and experiences.",44,0.9,25,https://www.reddit.com/r/dataengineering/comments/1q22shj/what_does_an_ideal_data_modeling_practice_look/,2026-01-02 16:17:12,2026-01-07 01:49:58
1q1tqt0,Why don't people read documentation,LargeSale8354,dataengineering,"I used to work for a documentation company as a developer and CMS specialist. Although the people doing the information architecture, content generation and editing were specialist roles, I learned a great deal from them. I have always documented the systems I have worked on using the techniques I've learned. I've had colleagues come to me saying they knew I ""would have documented how it works"". From this I know we had a findability issue.On various Redit threads there are people who are adamant that documentation is a waste of time and that people don't read it.What are the reasons people don't read the documentation and are the reasons solvable? I mention findability, which suggests a decent search engine is needed.I've done a lot of work on auto-documenting databases and code. There's a lot of capability there but not so much use of the capability. I don't mind people asking me how things work but I'm one person. There's only so much I can do without impacting my other work.On one hand I see people bemoaning the lack of documentation but on the other hand being adamant that it's not something they should do",43,0.85,46,https://www.reddit.com/r/dataengineering/comments/1q1tqt0/why_dont_people_read_documentation/,2026-01-02 08:54:23,2026-01-07 01:49:58
1q3fp3h,Looking for Udemy / YouTube course recommendations for AWS Data Engineer certification,Sreekar_yadav,dataengineering,"Hi everyone,I’m planning to prepare for the AWS Data Engineer certification and looking for Udemy / YouTube course recommendations.Background:AWS CCP certified (2 years ago)Basic AWS + data conceptsLooking for hands-on, practical, exam-relevant resources (Glue, Athena, Redshift, S3, etc.).If you’ve used a course that worked well (or should be avoided), please share.Thanks!",37,0.9,4,https://www.reddit.com/r/dataengineering/comments/1q3fp3h/looking_for_udemy_youtube_course_recommendations/,2026-01-04 03:57:04,2026-01-07 01:49:58
1q12ev1,Advent of code challenges solved in pure SQL,Creative-Skin9554,dataengineering,No content,36,0.93,0,https://clickhouse.com/blog/clickhouse-advent-of-code-2025,2026-01-01 11:44:37,2026-01-07 01:49:58
1q4135w,Slapping a vendor's brand on hosted duckdb,SmallAd3697,dataengineering,"Many of the big data vendors will reuse open source components like python, spark, airflow, postgres, and deltalake. They rebrand it, and host it in their SaaS, and call it ""managed"" and/or ""easy"". They also charge customers 50% more than if the same software were to be hosted on kubernetes or IaaS.I keep thinking that one of these vendors (perhaps databricks first) would develop a managed version of duckdb. It would almost be a no-brainer, since the software is massively useful but is still not widely adopted.Why hasn't this happened yet? Are there licensing restrictions that I'm overlooking? Or would this sort of thing cannibalize the profits made from existing components in each of these closed ecosystems?",35,0.86,54,https://www.reddit.com/r/dataengineering/comments/1q4135w/slapping_a_vendors_brand_on_hosted_duckdb/,2026-01-04 20:44:44,2026-01-07 01:49:58
1q1ddky,Non technical boss is confusing me,Huxley_The_Third,dataengineering,"I’m the only developer at my company. I work on a variety of things, but my primary role is building an internal platform that’s being used by our clients. One of the platform’s main functionalities is ingesting analytics data from multiple external sources (basic data like clicks, conversions, warnings data grouped by day), though analytics is not its sole purpose and there are a bunch of other features. At some point , my boss decides he wants to “centralize the company data” and hires some agency out of the blue. They drafted up an outline of their plan, which involved setting up a separate database with a medallion architecture. They then requested that I show them how the APIs we’re pulling data from work, and a week later, they request that I help them pull the analytics from the existing db. they never acknowledged any of the solutions i provided for either of those things nor did they explain the Point of those 2 conflicting ideas. So I ask my boss about and he says that the plan is to “replace the entire existing database with the one they’re working on“. And the next time I hop on a call with them, what we discussed instead was just mirroring the analytics and any relevant data to the bronze layer. so I begin helping them set this up, and when they asked for a progress update and I show them what I’ve worked on, they tell me that no, we’re not mirroring the analytics, we need to replace the entire db, including non analytical data. at this point. at this point, I tell them we need to take a step back and discuss this all together (me, then, and my boss). we’ve yet to meet again, (we are a remote company for context) , but I have literally no idea what to say to him, because it very much seems like whatever he’s trying to achieve, and whatever proposals they pitched him don’t align at all (he has no technical knowledge , and they don’t seem to fully understand what the platform does, and there were obviously several meetings I was left out of)",34,0.87,24,https://www.reddit.com/r/dataengineering/comments/1q1ddky/non_technical_boss_is_confusing_me/,2026-01-01 19:56:47,2026-01-07 01:49:58
1q2ytbh,Anyone else tired of exporting CSVs just to get basic metrics?,Flat-Shop,dataengineering,"Right now I’m pulling data from a few tools, exporting CSVs, and manually stitching them together just to answer basic questions like revenue trends or channel performance. It works, but it’s slow, error-prone, and feels like busywork more than insight.Not looking for anything fancy or real time, just something that pulls data into one place and updates automatically so I’m not stuck being a data entry robot.What others are using here? build something yourself? Switch to a BI/dashboard tool? Or just accept spreadsheets forever?",30,0.81,15,https://www.reddit.com/r/dataengineering/comments/1q2ytbh/anyone_else_tired_of_exporting_csvs_just_to_get/,2026-01-03 16:25:50,2026-01-07 01:49:58
1q0zn12,Switching to Databricks,AdQueasy6234,dataengineering,"I really want to thank this community first before putting my question. This community has played a vital role in increasing my knowledge.I have been working with Cloudera on prem with a big US banking company. Recently the management has planned to move to cloud and Databricks came to the table.Now being a complete onprem person who has no idea about Databricks (even at the beginner level) I want to understand how folks here switched to Databricks and what are the things that I must learn when we talk about Databricks which can help me in the long run. Our basic use case include bringing data from rdbms sources, APIs etc. batch processing, job scheduling and reporting.Currently we use sqoop, spark3, impala hive Cognos and tableau to meet our needs. For scheduling we use AutoSys.We are planning to have Databricks with GCP.Thanks again for every brilliant minds here.",30,0.92,19,https://www.reddit.com/r/dataengineering/comments/1q0zn12/switching_to_databricks/,2026-01-01 08:41:02,2026-01-07 01:49:58
1q3b44p,1.5 YOE Data Engineer — used many tools but lacking depth. How to go deeper?,Nice_Sherbert3326,dataengineering,"I’ve been working as a Data Engineer for \~1.5 years. Stack I’ve used at work:* Spark / PySpark (Databricks)* Azure data services & Microsoft Fabric* SQL, Python* Certs: Databricks DE Associate, Fabric DE AssociateI’m trying to switch jobs but struggling to get interviews. Along with CV, I think the issue is also depth, not exposure. I have exposure to other tools through my job, but to go in-depth, most online resources (YouTube, Coursera, etc.) I found are very high-level. I’ve already gone through many of them and they don’t get into real design or internals.I want to go deeper into:* Spark (internals & performance)* Airflow* Snowflake* dbt* Kafka* AWS (beyond just S3)Paid DE platforms are often $7k–$10k, which isn’t realistic for me.Question: For people working as mid/senior DEs — what resources (books, repos, blogs, projects) actually helped you understand these tools at a *production* level? How did you move from “used it” to “can design with it”?TL;DR: \~1.5 YOE DE, used many tools but lacking depth. Intro resources are too shallow — looking for in-depth learning guidance.",24,0.89,12,https://www.reddit.com/r/dataengineering/comments/1q3b44p/15_yoe_data_engineer_used_many_tools_but_lacking/,2026-01-04 00:30:22,2026-01-07 01:49:58
1q2u5l7,"Carquet, pure C library for reading and writing .parquet files",Vitruves,dataengineering,"Hi everyone,I was working on a pure C project and I wanted to add lightweight C library for parquet file reading and writing support. Turns out Apache Arrow implementation uses wrappers for C++ and is quite heavy. So I created a minimal-dependency pure C library on my own (assisted with Claude Code).The library is quite comprehensive and the performance are actually really good notably thanks to SIMD implementation. Build was tested on linux (amd), macOS (arm) and windows.I though that maybe some of my fellow data engineering redditors might be interested in the library although it is quite niche project.So if anyone is interested check the Gituhub repo : [https://github.com/Vitruves/carquet](https://github.com/Vitruves/carquet)I look forwarding your feedback for features suggestions, integration questions and code critics :slightly_smiling_face:Have a nice day!",22,0.96,1,https://www.reddit.com/r/dataengineering/comments/1q2u5l7/carquet_pure_c_library_for_reading_and_writing/,2026-01-03 13:05:14,2026-01-07 01:49:58
1q1r9zp,How can a self-taught data engineer make a step into the big community of data?,Professional-Sun179,dataengineering,"I’m not sure if this the right place to ask these stupid questions but I don’t know where and I apologize. I am literally a beginner in this field and I live in a place where the morden data architecture is not available everywhere and not popular unfortunately. My country is highly developing and I work in a sensitive governmental system where we still use very old transactional databases lol. 2 years ago I was interested of the data science field, and I randomly learned SQL or at least learned what it is, and the journey of data or at least what’s happening in the data pipelines from ingestion, streaming, integration and processing. Right now I have finished the IBM data engineering course for Python, and it was good and I like it and I took the certificate but this is not enough. I obviously learned that I must implement what I learned and will learn into projects but I kinda feel that I can start on my own. I feel like don’t need to continue with the course, but at the same time I am very lonely and overwhelmed. I have tried to look for people who are like me everywhere , and on my country’s subreddit but no use. Because no one knows English evenWhat do you suggest? Is it possible to create an organization on my own? Should i continue with IBM course? And how can I find my people? Sorry for the many questions but I need human answers :face_with_tears_of_joy:. thank you so much for reading",23,0.88,7,https://www.reddit.com/r/dataengineering/comments/1q1r9zp/how_can_a_selftaught_data_engineer_make_a_step/,2026-01-02 06:24:20,2026-01-07 01:49:58
